登記案號,類別,案由,主任,登記號數,收件日期,登記日期,公告日期,登記簿,任期判定,屆期判定,法人代表,法人名稱,設立登記日期,主事務所,目的,捐助方法,許可機關日期,存立時期,財產總額,結案原因,結案日期,歸檔日期,發證日期,清算人,變更原因,註銷日期,撤銷日期,撤(註)銷機關文號,撤(註)銷原因
098法登他000001,1,2,呂仲陸,15,0980113,0980113,0980117,2冊2頁,2,5,高瑞鵬,財團法人澎湖縣慈善服務基金會,0760205,澎湖縣馬公市治平路28之1號,協助政府推行社會福利政策，辦理急難救助慈善服務事業。,澎湖縣民眾服務社、東南水泥股份有限公司、長榮集團並接受團體及個人之捐助。,澎湖縣政府75年10月6日澎府民社字第40626號函。,無限期,25000000.00,1,0980115,0990713,0980119,,,,,,
098法登他000002,1,2,呂仲陸,34,0980117,0980119,0980221,2冊21頁,2,2,陳美菊,財團法人澎湖妙雲文教基金會,0881203,澎湖縣馬公市水源路二之一號十二樓,本會以舉辦各種成人教育及各階層讀書會為主，嚮導人心正思，以期自我成長，糾正社會暴戾之氣。,由張素貞女士捐助。,澎湖縣政府八十八年十一月十八日八八澎府教社字第六五八三八號函。,永久。,2000000.00,1,0980119,0990713,0980121,,,,,,
098法登他000003,1,2,呂仲陸,43,0980304,0980305,0980306,2冊30頁,1,3,董事長,財團法人辛氏宗祠,0910306,澎湖縣湖西鄉湖西村一０號,秉承歷代祖先忠孝傳家、敦睦宗親、廣佈家聲、興辦公益慈善及社會教化事業。,捐助。,澎湖縣政府九十一年二月二十五日府民禮字第09100089730號。,永久。,1006680.00,1,0980304,0990713,0980309,,,,,,
098法登他000005,2,2,呂仲陸,46,0980521,0980521,0980525,2冊33頁,1,3,陳雙全,社團法人澎湖縣照顧服務協會,0921211,澎湖縣馬公市介壽路七之一號,本會為依法設立，非以營利為目的之社會福利團體，以落實政府社會福利政策，促進照顧服務品質，增進民眾福利為宗旨。,會費收入、捐助收入、計畫執行收入。,澎湖縣政府92年11月27日府社行字第0920069340號函。,永久,4730075.00,1,0980521,0990713,,,,,,,
098法登他000006,1,2,呂仲陸,29,0980603,0980603,0980606,2冊16頁,1,4,張端美,財團法人林進丁先生文教基金會,0861002,澎湖縣馬公市西文里惠民新村二十之一號,以關懷澎湖鄉土文代為出發點，秉人文主義精神及社區意識觀念，牽動家庭社會，教育文化，生態環境的關係，發展全方位的改造工作為宗旨。,基金由喬昶營造有限公司負責人張端美捐贈,澎湖縣政府中華民國八十六年九月卅日八六澎府教社字第六０五七一號,永久,2000000.00,1,0980603,0990713,0980608,,,,,,
098法登他000008,1,2,呂仲陸,44,0980821,0980821,0980825,2冊31頁,2,19,林柏榕,財團法人臺灣兒童暨家庭扶助基金會澎湖分事務所,0910417,台北市信義區忠孝東路五段四八二號四樓,以辦理兒童、青少年、身心障礙者及家庭福利為宗旨。,由美國維吉尼亞州基督教兒童福利會捐助。,臺灣省政府社會處43年12月10日以台省社字第００六號函同意設立。澎湖縣政府72年11月9日澎府民社字第39692號函。,永久。,3179027320.00,1,0980821,0990713,0980826,,,,,,
098法登社000001,2,1,呂仲陸,56,0981125,0981125,0981127,2冊43頁,,,黃光對,社團法人澎湖縣西嶼鄉黃氏宗親會,0981125,澎湖縣西嶼鄉池西村166號,連絡宗親感情，增進會員宗親情誼，祭祀祖先。,會員會費及捐款,"澎湖縣政府   98年11月1日府社行字第0980060858號函。",永久,0.00,1,0981126,,0981211,,,,,,
098法登財000001,1,1,呂仲陸,55,0980925,0981012,0981013,2冊42頁,,,辛遊宮,財團法人辛氏祭祀公業管理委員會,0981012,澎湖縣湖西鄉湖西村10號,秉承歷代祖先，遺留之祖產管理與運用，興辦公益慈善及社會教化事業。,辛氏祖先參佰餘年前，自金門來到澎湖湖西置產之土地。,澎湖縣政府中華民國九十八年九月十七日府民禮字第0980500459號函。,永久,13389620.00,1,0981012,,0981027,,,,,,
098法登財000002,1,1,呂仲陸,57,0981215,0981216,0981217,2冊44頁,,,林亨華,財團法人國立馬公高級中學教育事務基金會,0981216,澎湖縣馬公市中華路369號,本會以運用社會資源，結合民間力量，舉辦教育事務為宗旨，依有關法令辦理下列業務：（一）學生獎助金之設置。（二）學生及教職員員工（含退休人員）之急難救助與照顧。（三）充實圖書、行政、教學相關設施及設備。（四）校友、家長及捐款人士之聯繫服務。（五）捐款人指定之項目。（六）其他有關教育、公益及學術性活動之舉辦與補助。,本會以本校文教基金籌備會新台幣二百萬元為創立基金。俟後運作經費來源如下：（一）基金孳息。（二）民間捐款。（三）其他收入。,"澎湖縣政府   中華民國98年12月2日府教社字第0980805069號函。",永久。,2000000.00,1,0981216,,0981217,,,,,,
