登記案號,類別,案由,主任,登記號數,收件日期,登記日期,公告日期,登記簿,任期判定,屆期判定,法人代表,法人名稱,設立登記日期,主事務所,目的,捐助方法,許可機關日期,存立時期,財產總額,結案原因,結案日期,歸檔日期,發證日期,清算人,變更原因,註銷日期,撤銷日期,撤(註)銷機關文號,撤(註)銷原因
064法登000154,1,1,鄭忠仁,154,0640307,0640307,0640310,8冊62頁,,0,董事長,財團法人台灣省新竹市彭氏祖祠管理委員會,0640307,新竹市南寮里東大路三級四六七巷一號,"本會以奉祀開基始祖商賢大夫以錢鏗公暨歷代烈祖烈宗之神位,闡揚祖德、敦親睦族、追思祖德扶植後裔並宏揚復興中華文化為宗旨",捐助,六十四年一月八日新竹縣政府,無限期,398119.00,1,0640307,0921224,,,,,,,
064法登000155,1,1,鄭忠仁,155,0640320,0640320,0640323,8冊63頁,,0,董事長,財團法人台灣基督長老教會新竹教會,0640320,新竹市勝利路二四七號,本財團法人為圖謀基督教健全之發展，而幫助台灣基督長老教會新竹教會之傳道事工，及依宗教信仰辦理附屬社會教育文化公益慈善福利事業，並致力管理本教會所屬資產。,由本財團法人台灣基督長老會新竹教會信徒捐贈,六十四年三月十二日新竹縣政府,無限期,3102287.00,1,0640320,0921224,,,,,,,
064法登000156,1,1,鄭忠仁,156,0640606,0640606,0640609,8冊64頁,2,2,董事長,財團法人台灣省苗栗縣中華基督教苗栗浸信會,0640606,苗栗縣苗栗市郵電街八號,為施行耶穌基督所託付之大使命以傳揚福音，遵行聖經教訓實踐新約中教會精神服務社會，辦理教育慈善等事業為目的,,六十四年五月二十八日苗栗縣政府,永久,1207550.00,1,0640606,0921224,,,,,,,
064法登000157,1,1,鄭忠仁,157,0640812,0640812,0640815,8冊65頁,,0,董事長,財團法人天德堂,0640812,新竹縣新豐鄉松柏林,本堂宗旨在宏揚佛法興辦公益慈善事業免費施診病患服務大眾不以營利為目的,募捐,六十四年七月九日新竹縣政府,永久存立,58000.00,1,0640812,0921224,,,,,,,
064法登000158,1,1,鄭忠仁,158,0640913,0640913,0640916,8冊66頁,,0,董事長,財團法人台灣省新竹市宏宗聖堂道學院,0640913,新竹縣新竹市長安街九十九號,以闡揚中華固有道德文化及提倡社會公益事業為設立目的,捐助,六十四年九月二日新竹縣政府,永久,629600.00,1,0640913,0921224,,,,,,,
