登記案號,類別,案由,主任,登記號數,收件日期,登記日期,公告日期,登記簿,任期判定,屆期判定,法人代表,法人名稱,設立登記日期,主事務所,目的,捐助方法,許可機關日期,存立時期,財產總額,結案原因,結案日期,歸檔日期,發證日期,清算人,變更原因,註銷日期,撤銷日期,撤(註)銷機關文號,撤(註)銷原因
074法登000008,1,1,"盧  廣",134,0740228,0740228,0740303,11冊3頁,,0,董事長,財團法人台灣省台南縣學甲鎮鎮安宮,0740228,台南縣學甲鎮頭港里五五號,"本法人以正人心、勉人遷善、祈求國泰民安，舉辦各種公益慈善事業        ，推行文化復興運動及社會教化工作。",捐助,七十三年十一月二十一日台南縣政府，府民禮字第一四０二五六號,無限期,6000000.00,1,0740228,0740321,0740321,,,,,,
074法登000013,1,1,"盧  廣",135,0740408,0740408,0740411,11冊4頁,,0,董事長,財團法人台南市私立行原社會福利慈善事業基金會,0740408,台南市東區富強路二三三巷一三二號,"為服務老人福利、兒童福利、殘障福利、低收入照顧、貧困病患之醫        療、老弱無依之收容救助",捐助,七十四年三月一日台南市政府，南市社福字第０五四０二號,無限期,2905898.00,1,0740408,0740620,0740620,,,,,,
074法登000021,1,2,"盧  廣",4,0740612,0740612,0740615,1冊4頁,2,2,董事長,財團法人陳介臣獎學基金會,0441125,台南市永福路一０八號,為扶助台南市籍清寒學生進修專科以上學校,由陳介臣捐獻,四十四年一月三十日台南市政府,未定,130000.00,1,0820528,,,,,,,,
074法登000028,1,2,"盧  廣",58,0740725,0740725,0740728,3冊3頁,2,2,馬甦德,財團法人台灣省台南市大同教地方靈體會,0570312,台南市大學路十八巷二十六號,宣揚大同教教義及處理大同教教務並舉辦慈善公益事業,由伊朗籍蘇洛曼捐贈,五十七年二月十二日台南市政府，南市民字第０五三四三號,無限期,300000.00,1,0740725,0740813,0740813,,"第1屆董事任期屆滿，改選第2屆董事。
代表法人之董事：馬甦德。
新任董事印鑑。",,,,
074法登000030,1,2,"盧  廣",70,0740828,0740828,0740831,4冊5頁,2,2,董事長,財團法人台南縣白河鎮火山碧雲寺,0591117,台南縣白河鎮仙草里火山路一號,"為使不同名義管理之火山碧雲寺動產不動產統一歸納法人名義管理及        維持保存財產為目的。",由火山碧雲寺原有財產捐助外，視業務擴展情形隨時募捐。,五十九年十月二十七日台南縣政府，南府民字第八六０一六號,無限期,65175103.00,1,0740828,0740918,0740918,,,,,,
074法登000035,1,1,"盧  廣",136,0741024,0741024,0741028,11冊5頁,,0,董事長,財團法人台灣省基督長老教會新樓醫院,0741024,台南市東門路五七號,"本院以紀念馬雅各醫生創立台灣第一所醫院新樓醫院之精神及以基督        教博愛精神，推行社會公益，舉辦慈善醫療事業，服務社會，非營利        事業為宗旨。",由財團法人台灣基督長老教會提供土地建物設備費由國內外會友捐獻,七十四年十月十七日行政院衛生署，衛署醫字第五四八八七三號,無限期,318254598.00,1,0741024,0741105,0741105,,,,,,
074法登000037,1,1,"盧  廣",137,0741109,0741109,0741113,11冊6頁,,0,董事長,財團法人蕭水波先生優秀清寒獎助金基金會,0741109,台南縣白河鎮新厝仔永安里七十一之一一六號,"本會以配合政府推行社會福利政策，辦理台南縣白河鎮優秀學生及家        境清寒學生獎助學金等事業為宗旨",本會由蕭水波先生及水波種畜場創辦，並接受團體或個人捐助,七十四年十月二十九日台南縣政府，府教學字第一三０三七０號,無限期,1000000.00,1,0741109,0741122,0741122,,,,,,
074法登000039,1,2,"盧 廣",6,0741107,0741128,0741127,1冊6頁,2,9,許安德利,財團法人台灣基督長老教會,0450922,台南市東區東門路五七號,本會為圖謀基督教健全之發展，致力於台灣之教會所組織，台灣基督長老教會所有或管理執行禮拜、國內外宣教、教育、醫療、社會福利、慈善及其他事業所需之土地、建築物備品以及供應所需之資產為目的。,捐助。,台灣省政府民國四十五年八月七日四五府民一字第八八一六五號,無限期,93943922.00,1,1010628,,,,"第8屆董事任期屆滿，改選第9屆董事。
代表法人之董事：許安德利。
新任董事印鑑。",,,,
074法登000043,1,2,"盧  廣",53,0741218,0741218,0741222,2冊23頁,2,2,董事長,財團法人台灣省台南市天主教仁愛修女會,0551227,台南市金華路一段五三０巷十九號,"為供應本會所需的一切傳教設備及經費以維持本會現在及將來所經辦        之宗教慈善教育及社會福利各項事業",捐助,五十五年十一月二十九日台南市政府，南市民字第四六四０四號,無限期,50000.00,1,0741218,0741231,0741231,,,,,,
