登記案號,類別,案由,主任,登記號數,收件日期,登記日期,公告日期,登記簿,任期判定,屆期判定,法人代表,法人名稱,設立登記日期,主事務所,目的,捐助方法,許可機關日期,存立時期,財產總額,結案原因,結案日期,歸檔日期,發證日期,代理人,代理人住址,郵遞區號,第二個代理人,第二個代理人住址,郵遞區號,送達代收人姓名,送達代收人住址,郵遞區號,清算人,變更原因,註銷日期,撤銷日期,撤(註)銷機關文號,撤(註)銷原因
069法登000010,1,2,謝怜聰,76,0690424,0690424,0690425,5冊43頁,2,5,陳蘭松,財團法人北部台灣基督長老教會新竹中會,0541007,新竹市光鎮里高峰路一一０號,為圖謀基督教健全之發展，而幫助台灣基督長老教會新竹中會之傳道事工，並致力管理本會所屬資產,信徒捐助,五十四年十月四日　　台灣省政府民政局,永　　　九,2000000.00,1,0690424,0921224,,,,,,,,,,,,,,,,
069法登000168,1,1,鄭忠仁,168,0690213,0690213,0690213,8冊76頁,,0,董事長,財團法人苗栗縣私立弘法院附設仁愛之家,0690213,苗栗縣獅潭鄉竹木村北庒三十七號,"本仁愛之家,以濟助收容貧困無依老人,舉辦有關社會福利事業,宣揚我佛教慈善精神為宗旨。",本財產來源、種類、數額悉自本財團創辦人(弘法院)董事贊助或地方,六十八年十二月二十六日苗栗縣政府,永久,7750000.00,1,0690213,0921224,,,,,,,,,,,,,,,,
069法登000169,1,1,鄭忠仁,169,0690312,0690312,0690315,8冊77頁,,0,董事長,財團法人台灣省苗栗縣三灣鄉五穀廟,0690312,苗栗縣三灣鄉三灣村中山路四十六號,供奉諸神像以宏揚教義敦睦信徒增進友誼興辦社會公益事業樹立互助合作團結精拔擢人才為宗旨。,捐助,六十九年二月二十九日苗栗縣政府,永久存立,2873040.00,1,0690312,0921224,,,,,,,,,,,,,,,,
069法登000170,1,1,鄭忠仁,170,0690421,0690421,0690424,8冊78頁,,0,董事長,財團法人新竹區中小企業銀行股份有限公司職,0690421,新竹市復興路三十五號,辦理職工福利事宜,創立時就資本總額內提撥壹仟萬元正,六十八年十二月十二日新竹縣政府,永久,10000000.00,1,0690421,0921224,,,,,,,,,,,,,,,,
069法登000171,1,1,鄭忠仁,171,0821229,0821229,0821231,8冊79頁,1,0,董事長,財團法人苗栗縣後備軍人奬學基金會,0821229,苗栗縣苗栗鎮府前路五十六號,鼓勵優秀後備軍人及子女求學向上、培育國家英才貢獻社會,苗栗縣後備軍人捐助,六十九年五月十二日苗栗縣政府,無限期,2905660.00,1,0821231,0921224,,,,,,,,,,,,,,,,
