登記案號,類別,案由,主任,登記號數,收件日期,登記日期,公告日期,登記簿,任期判定,屆期判定,法人代表,法人名稱,設立登記日期,主事務所,目的,捐助方法,許可機關日期,存立時期,財產總額,結案原因,結案日期,歸檔日期,發證日期,清算人,變更原因,註銷日期,撤銷日期,撤(註)銷機關文號,撤(註)銷原因
107法登他000265,1,2,陳美月,360,1070705,1070706,1070711,18冊19頁,2,8,周荃,財團法人賢德惜福文教基金會,0861227,新北市汐止區康寧街141巷28號12樓,以新北市文化教育政策研究發展暨服務為宗旨。,設立基金共新台幣貳佰萬元整，由台灣邁新企業有限公司及國航航空器工業有限公司共同捐助，俟完成法人登記後，得繼續接受捐助,台北縣政府⒒八六北府教三字第442361號,永久,2000000.00,1,1070706,1070808,1070718,,法人圖記暨董事印鑑。,,,,
107法登他000266,1,2,陳美月,390005,1070705,1070706,1070711,1冊5頁,1,20,林明成,財團法人台灣省私立台北仁濟院,0390126,新北市淡水區中正東路2段153號,以從事並發展社會救濟、社會福利、公益慈善等事業為宗旨。,捐助,台灣省政府社會處39.1.4.為子支北市民社字第103號,永久,7920063704.00,1,1070706,1070821,1070718,,法人圖記變更。,,,,
107法登他000267,1,2,陳美月,1131,1070705,1070706,1070711,57冊5頁,1,7,楊天嘯,財團法人國軍暨家屬扶助基金會,0870410,台北市內湖區行愛路77巷67號3樓,為能激勵國軍官兵士氣，以期安定軍心，以能顧及眷心，以達撫生慰死之目的。,設立基金新台幣貳仟萬元由軍人之友社、社會各界人士暨婦女聯合會等捐助；嗣後得繼續接受捐贈。,"國防部中華民國87年1月20日  (87)祥福字第00608號函",永久,495602183.00,1,1070706,1070821,1070718,,法人圖記暨繼任董事雷倩印鑑。,,,,
107法登他000268,1,2,陳美月,283,1070705,1070706,1070711,14冊25頁,2,8,林孝信,財團法人中興保全文教基金會,0850702,台北市鄭州路139號4樓,以「造福社區造福家」為宗旨。,設立基金新台幣壹仟萬元整，由中興保全股份有限公司捐助；俟依法完成法人登記後，得繼續接受捐贈,教育部、中華民國85年6月5日台(85)社(四)字第85509307號,永久,142000000.00,1,1070706,1070821,1070718,,法人圖記暨董事印鑑。,,,,
107法登他000269,1,2,陳美月,1216,1070705,1070706,1070711,61冊10頁,1,13,曹國賢,財團法人曹仲植基金會,0661229,台北市內湖區堤頂大道2段413號3樓,以公益及辦理社會福利慈善事業為目的。,由臺灣慎昌股份有限公司捐助新臺幣貳佰萬元整，嗣後為擴大事業發展，得接受個人及法人捐贈。,內政部中華民國66年12月19日台內社字第767677號函,永久,15400000.00,1,1070706,1070806,1070718,,"章程變更：
1.原章程第1條、第3條、第12條、第17條、第18條條文內容變更，章程第3條、第12條、第17條、第18條條次變更，並刪除第16條條文，為變更後章程第1條、第2條、第3條第2項、第18條至第20條，業經主管機關衛生福利部中華民國107年4月19日衛授家字第1070006540號函同意。
2.原章程第2條、第4條至第8條、第10條、第11條、第13條至第15條條文內容變更，章程第2條、第4條至第7條、第10條、第14條、第15條條次變更，並增訂第10條、第14條、第15條條文，為變更後章程第3條第1項、第4條第2項、第5條至第8條、第10條至第17條，業經本院民事庭107年度法字第13號民事裁定確定。",,,,
107法登他000270,2,2,陳美月,1875,1070709,1070716,1070717,94冊9頁,2,3,賴克明,社團法人臺北市第二地政士公會,1010730,台北市南港區忠孝東路7段557號2樓,以協調同業關係，增進共同利益，促進社會經濟建設暨維護不動產交易安全，保障人民財產權益，健全地政士制度、提昇地政士專業服務品質、協助政府推行政令為宗旨。,入會費、常年會費、委託收益、基金及其孳息、會員捐款、事業費及其他收入,臺北市政府社會局中華民國101年5月31日北市社團字第10137654700號函,永久,100999.00,1,1070716,1070809,1070724,,法人圖記暨理、監事印鑑。,,,,
107法登他000271,1,2,陳美月,1718,1070710,1070712,1070713,86冊12頁,1,1,王雪洸,財團法人張馨予社會福利慈善事業基金會,1051110,台北市士林區中山北路7段124巷8號,以辦理社會福利慈善事業為目的。,設立基金共新台幣三仟萬元整，由張馨予、張維中、張家鈁、王雪洸、王文潮、王陳安靜、王雪清、曾皓筠、王雪敏、王泉龍、赤慶、王碧鑾等捐助，嗣後得由捐助人或其他個人、團體繼續捐贈補充之,衛生福利部中華民國105年11月4日部授家字第1050023376號函,永久,34445971.00,1,1070712,1070806,1070723,,,,,,
107法登他000272,2,2,陳美月,367,1070710,1070712,1070713,18冊33頁,2,11,陳亮吟,社團法人台北市教保人員協會,0870403,台北市大同區民權西路146號13樓之2,結合從事嬰幼兒教保相關工作人員，基於互助合作之精神，發揮團體力量，以提昇教保人員的專業素養，保障兒童、家長與教保/托育人員/保母三方面的權益福祉，整合社會資源，推廣兒童福利與親職教育，並以改善托育服務及教保品質為宗旨。,入會費、常年會費、會員捐款、委託收益、基金及其孳息、其他收入,台北市政府社會局⒓⒓北市社一字第8626580400號,永久,79600.00,1,1070712,1070821,1070723,,"章程第22條條文內容變更，業經主管機關臺北市政府社會局中華民國107年7月5日北市社團字第1076018313號函核備。
法人圖記暨理、監事印鑑。",,,,
107法登他000273,1,2,陳美月,310,1070710,1070712,1070713,15冊39頁,1,13,張成國,財團法人中國醫藥研究發展基金會,0630120,台北市北投區裕民一路40巷27號2樓,旨在籌募基金，俾便延攬優秀之中西醫藥人才，使用最新之科學方法與設備，從事中國醫藥研究與發展，尤以痼疾、癌症為研究重點，以宏揚中國固有文化，提供人類維護健康之最大服務。,捐助。,行政院衛生署62.12.18衛署醫字第33583號函,永久,10000000.00,1,1070712,1070806,1070719,,法人圖記暨繼任董事陳敬德印鑑。,,,,
107法登他000274,1,2,陳美月,172,1070710,1070712,1070713,9冊3頁,2,9,李壽東,財團法人消化醫學研究發展基金會,0821013,台北市北投區石牌路2段201號,以舉辦或資助消化系醫學研究之發展，培養消化系醫學研究人才及提昇消化醫學水準。,由台北榮民總醫院院長羅光瑞發起，創設基金新台幣壹仟萬元整，由聯合報系董事長王惕吾捐助，嗣後得繼續接受各界熱心醫學研究之團體或個人自由捐贈,行政院衛生署82.9.13衛署醫字第8260756號函,永久,13000000.00,1,1070712,1070808,1070719,,法人圖記暨董事印鑑。,,,,
107法登他000275,1,2,陳美月,1876,1070711,1070716,1070717,94冊10頁,1,5,曾張月,財團法人台北市葡眾科技人文發展基金會,0930604,台北市內湖區金莊路18號10樓,以「結合各界資源，促進科技與人文發展，提升民眾生活品質」為宗旨。,設立基金共新臺幣伍佰萬元整，由葡眾企業股份有限公司捐助；嗣後捐助人或其他個人、團體得隨時補充之,臺北市政府建設局中華民國93年5月20日北市建一字第09331824700號函,永久,5000000.00,1,1070716,1070809,1070724,,因主事務所變更，修訂章程第5條條文內容，業經主管機關臺北市政府產業發展局中華民國107年6月14日北市產業工字第1076005882號函同意變更。,,,,
107法登他000276,2,2,陳美月,1877,1070713,1070718,1070719,94冊11頁,2,3,柯天路,社團法人台灣社會發展推動協會,1010111,台北市內湖區行善路459號6樓,以辦理身心障礙及弱勢族群相關服務之研究、經營與輔導為宗旨。,入會費、常年會費、事業費、會員捐款、委託收益、基金及其孳息、其他收入,內政部中華民國100年12月1日台內社字第1000225638號函,永久,10000.00,1,1070718,1070809,1070726,,"因法人名稱變更，章程第1條變更，另修訂第5條、第6條條文，第10條、第20條錯字修正及第36條修訂歷程變更，業經主管機關內政部中華民國107年5月3日台內團字第1070022619號函備查。
法人圖記暨理、監事印鑑。",,,,
107法登他000277,1,2,陳美月,1878,1070712,1070718,1070719,94冊12頁,1,1,吳榮義,財團法人台灣水資源與農業研究院教育基金會,1050818,新北市淡水區中正東路2段27-8號19樓,研究國內外水資源與農業領域整合議題，以嘉惠新北市市民及機關學校為主要宗旨。,設立基金共新臺幣伍佰萬元整，由虞國興先生捐助；俟依法完成法人登記後，得繼續接受補(捐)助,新北市政府教育局中華民國105年8月10日新北教社字第1051339410號函,永久,5000000.00,1,1070718,1070809,1070726,,因主事務所變更，章程第4條條文及第15條修訂歷程變更，業經主管機關新北市政府教育局中華民國107年6月8日新北教社字第1070963586號函許可變更。,,,,
107法登他000278,2,2,陳美月,607,1070713,1070713,1070716,30冊58頁,2,5,張富源,社團法人中華視障安養福利協會,0910408,台北市大同區伊寧街37號1樓,本會為了關懷身心障礙老人，無論在促進就業、就醫、就養、樂活、教育等生活上，希望均能獲得適切的關注，本會更致力推動身心障礙老人的安養問題，以達到老吾老以及人之老的安樂社會。,入會費、常年會費、事業費、會員捐款、委託收益、基金及其孳息、其他收入,內政部中華民國91年1月4日台內社字第09100675140號函,永久,219576.00,1,1070713,1070806,1070723,,法人圖記暨理、監事印鑑。,,,,
107法登他000279,1,2,陳美月,680828,1070713,1070718,1070719,4冊1頁,2,13,林政平,財團法人林振興先生慈善濟助事業基金會,0681219,台北市士林區德行東路129巷10之1號1樓,以協助貧困家庭，解決急難完成公益為宗旨。,由林振興先生家族繼續捐贈，並接受社會團體及個人捐贈,臺北市政府社會局中華民國68年10月26日北市社三字第35486號函,永久,1000000.00,1,1070718,1070806,1070726,,"原章程第2條、第6條、第7條、第11條、第23條條文內容變更，業經主管機關臺北市府社會局中華民國107年6月20日北市社團字第1076009399號函核備。
法人圖記暨董、監事印鑑。",,,,
107法登他000280,1,2,陳美月,481,1070713,1070719,1070723,24冊31頁,2,15,謝健興,財團法人中華藥學研究基金會,0630316,新北市淡水區中正東路2段27-2號21樓,以致力於藥學相關事業研究發展為宗旨。,由劉孔樂先生捐助，嗣後並得繼續接受國內外之個人或團體之捐助,"63年2月18日行政院衛生署  衛署藥字第35496號許可成立",永久,10058053.00,1,1070719,1070806,1070730,,法人圖記暨董事印鑑。,,,,
107法登他000281,1,2,陳美月,1447,1070713,1070718,1070719,73冊1頁,1,6,李貴敏,財團法人時雨文教基金會,0881203,新北市汐止區新台五路1段81號10樓,以培養「國際觀、推廣國際教育文化及拓展國際交流」為宗旨。,設立基金共新台幣貳佰萬元整，由李貴敏捐助；俟依法完成法人登記後，得繼續接受捐助,新北市政府中華民國88年11月4日88北府教3字第402793號函,永久,15299445.00,1,1070718,1070806,1070726,,原章程第4條、第15條條文內容變更，業經主管機關新北市政府教育局中華民國107年6月26日新北教社字第1071079560號函許可變更。,,,,
107法登他000282,2,2,陳美月,1648,1070717,1070718,1070719,83冊2頁,1,1,黃國倫,社團法人台灣心欣關懷協會,1041215,台北市南港區經貿二路188號18樓,以發揚基督愛人如己精神，結合社會大眾及組織團體的專業與資源，推廣公益，從事慈善救助服務及活動，扶助貧弱家庭及團體。期以智者之心，行關懷之道，得歡欣之恩，創造和樂良善之社會風氣。,入會費、常年會費、事業費、會員捐款、委託收益、基金及其孳息、其他收入,內政部中華民國104年11月13日台內團字第1040078836號函,永久,100000.00,1,1070718,1070806,1070726,,法人圖記暨繼任理事孫仲亮印鑑。,,,,
107法登他000283,1,2,陳美月,1515,1070717,1070719,1070723,76冊9頁,1,2,吳泰忠,財團法人中華文化姓氏文教發展基金會,1030604,台北市內湖區文德路273號1樓,以中華文化姓氏文化、教育，立姓氏祖先牌位慎終追遠及由忠-忠於國家民族，孝-孝順父母、尊師重道，仁-身體健康調理，慈-覺悟的慈悲智慧之做人處事根本文化教育，提昇靈性智慧為宗旨。,設立基金共新臺幣壹仟萬元整，由捐助人吳泰忠先生及元隆建設股份有限公司捐助；俟依法完成法人登記後，得繼續接受捐助,臺北市政府文化局中華民國103年5月27日北市文化文創字第10331328600號函,永久,73215814.00,1,1070719,1070808,1070730,,原章程第2條業務項目增加及第18條修訂歷程變更，業經主管機關臺北市政府文化局中華民國107年7月9日北市文化文創字第1076003008號函同意變更。,,,,
107法登他000284,1,2,陳美月,1586,1070717,1070719,1070723,79冊20頁,2,2,鄭榮城,財團法人臺北市王禪老祖慈善基金會,1040305,台北市士林區承德路4段152號11樓之1,以關懷社會及貧困救助為宗旨，將王禪老祖慈善心散播人間，執行業務區域以臺北市為原則。,設立基金總額為新臺幣壹仟萬元整，由捐助人鄭榮城、呂清水、許昭雄、陳世民無償捐助之；嗣後得由捐助人或其他個人、團體隨時補充之,臺北市政府社會局中華民國104年1月7日北市社團字第10349835300號函,永久,10000000.00,1,1070719,1070806,1070730,,法人圖記暨董事印鑑。,,,,
107法登他000285,1,2,陳美月,550278,1070717,1070726,1070730,2冊27頁,1,17,賴榮信,財團法人聖約翰科技大學,0551121,新北市淡水區淡金路4段499號,根據國家教育政策暨現行法令之規定，為達到辦理科技大學，並謀求其健全發展之目的，設立財團法人聖約翰科技大學。,建校基金新臺幣伍佰萬元，由創辦人王長齡先生暨全體董事籌措捐助；校地係由上海聖約翰大學同學會暨上海聖瑪利亞女校校友會捐助。嗣後並得繼續接受國內外之個人、法人或團體之捐贈。,教育部55.7.28.台(55)高字第12322號函,永久,3350188654.00,1,1070726,1070821,1070803,,繼任董事曾鴻鍊印鑑。,,,,
107法登他000286,1,2,陳美月,1116,1070717,1070719,1070723,56冊10頁,1,5,王聰麟,財團法人全國認證基金會,0920917,新北市淡水區中正東路2段27號23樓,以提供經濟與社會發展需求之公正、客觀、獨立及符合國際規範之第三者認證服務為宗旨。,創立基金共新台幣三千五百八十萬元整，由經濟部標準檢驗局等18家機關（構）共同捐助，嗣後得繼續接受捐贈。,經濟部中華民國92年9月15日經商字第09202184100號函,永久,129815189.00,1,1070719,1070806,1070730,,常務監事江靜瑜印鑑。,,,,
107法登他000287,2,2,陳美月,621,1070717,1070724,1070726,31冊40頁,2,8,周俊文,社團法人台灣國際創價學會,0790510,台北市士林區至善路2段250號,以研究、實踐日蓮大聖人佛法積極入世、自行化他的精神為根本、啟迪人心向善；並以世界市民的理念為根基，致力於國際間文化、教育與和平的各項活動，以創造生命最高價值，促進人類的友好與和平為宗旨。,入會費、常年會費、事業費、會員捐款、委託收益、基金及其孳息、其他收入,內政部中華民國79年3月19日台(79)內社字第775301號函,永久,1255608683.00,1,1070724,1070808,1070802,,"章程變更：
1.原章程第10條、第16條、第18條、第19條、第20條、第23條、第28條、第31條、第32條、第36條條文內容變更，業經主管機關內政部中華民國107年6月15日台內團字第1070041603號函備查。
2.原章程第14條、第33條、第40條條文內容變更，業經主管機關內政部中華民國107年7月4日台內團字第1070048939號函備查。
法人圖記暨理、監事印鑑。",,,,
107法登他000288,2,2,陳美月,1795,1070717,1070720,1070723,90冊9頁,2,5,李進興,社團法人臺灣野鳥保育協會,1060926,台北市北投區關渡路62號10樓,以『保育臺灣國內野生鳥類及其棲息地環境』、『提升臺灣保育形象』、『參與國內外鳥類相關組織活動』為目的。,入會費、常年會費、永久會員終生會費、事業費、會員捐款、委託收益、基金及其孳息、其他收入,內政部中華民國99年1月18日台內社字第0990011262號函,永久,500.00,1,1070720,1070806,1070730,,法人圖記暨理、監事印鑑。,,,,
107法登他000289,2,2,陳美月,1327,1070717,1070725,1070726,67冊1頁,2,3,李月玲,社團法人中華民國基督教中興浸信會,1010104,新北市汐止區康寧街541巷12弄22號2樓,以宣揚基督福音真理，辦理慈善公益，充實信會員心靈精神生活，促進社會善良風氣為宗旨。,事業費、會員捐款、委託收益、基金及其孳息、其他收入,內政部中華民國100年6月20日台內社字第1000122216號函,永久,2392686.00,1,1070725,1070808,1070802,,法人圖記暨理、監事印鑑。,,,,
107法登他000290,1,2,陳美月,509,1070719,1070720,1070723,25冊55頁,2,7,陳啟明,財團法人乳癌學術研究基金會,0890911,台北市北投區立德路125號,乳癌學術研究及協助衛生單位從事乳癌相關臨床之工作,設立基金共新台幣壹仟壹佰零捌萬元整，楊明德先生等13人發起並捐助；嗣後並得繼續接受國內外個人或團體捐助及其他符合規定之收入捐助捐助,行政院衛生署中華民國89年4月21日衛署醫字第89017846號,永久,17373475.00,1,1070720,1070821,1070730,,法人圖記暨董、監事印鑑。,,,,
107法登他000291,1,2,陳美月,490117,1070719,1070831,1070904,1冊55頁,1,14,邱文彬,崇義學校財團法人,0491111,新北市汐止區大同路3段68號,創辦私立崇義高級中學並謀其發展。,設立基金新台幣壹佰肆拾肆萬柒仟捌佰肆拾元，由道安法師等捐助；嗣後並得繼續接受國內外之個人、法人或團體之捐贈,民國49年9月1日台灣省政府教育廳四九教二字第2977號,永久,85718563.00,1,1070831,1080301,1070911,,,,,,
107法登他000292,1,2,陳美月,980,1070720,1070723,1070726,49冊14頁,1,9,羅瑩雪,財團法人中華民國兒童福利聯盟文教基金會,0801224,台北市大同區長安西路43號6樓,以倡導兒童福利觀念，推展兒童教育，保障兒童權利，促進兒童健全發展，增進兒童福利為宗旨。,由財團法人心臟病兒童、吳麥文教、國泰建設文化教育等基金會、王志雄、王世雄、林謝罕見等捐助，俟完成法人登記後，得繼續接受捐贈,"教育部80年12月17日  台（80）社字第68396號函",永久,940000000.00,1,1070723,1070806,1070802,,原章程第2條業務項目增訂及第23條修訂歷程變更，業經主管機關教育部中華民國107年7月9日臺教社(三)字第1070103044號函許可變更。,,,,
107法登他000293,1,2,陳美月,670776,1070720,1070724,1070726,3冊81頁,2,11,周志達,財團法人新北市淡水無極天元宮,0670825,新北市淡水區北新路3段36號,為發揚固有文化復興運動、宣揚數千年來宗教傳統真義、惇化民心向善、利國利民為宗旨。,捐助,台北縣政府66.12.28北縣民(一)字第63號,永久,5679055.00,1,1070724,1070808,1070802,,法人圖記暨董、監事印鑑。,,,,
107法登他000294,1,2,陳美月,331,1070720,1070724,1070726,17冊1頁,1,7,鄭欽明,財團法人雅文兒童聽語文教基金會,0860307,台北市內湖區洲子街60號4樓,以推廣聽覺口語法之專業教育，協助聽障兒童全人發展，及其他有關聽障教育事項為宗旨。,設立基金共新臺幣壹仟萬元整，由鄭欽明及倪安寧共同捐助；俟完成法人登記後，得繼續接受捐贈,教育部85.12.26.台(85)社(四)字第85525678號函,永久,118868800.00,1,1070724,1070809,1070802,,,,,,
107法登他000295,1,2,陳美月,222,1070720,1070724,1070726,11冊23頁,2,12,李清富,財團法人台北縣汐止鎮崇德國民小學教育發展基金會,0840128,新北市汐止區茄苳路158號,以協助學校改善環境、推展校務及發展教育為宗旨。,設立基金新台幣貳佰萬元整，由捐助人代表崇德國小教育後援會捐助，俟依法完成法人登記後得繼續接受捐助,台北縣政府84.1.16八四北府教三字第18062號函,永久,2200000.00,1,1070724,1070808,1070802,,法人圖記暨董事印鑑。,,,,
107法登他000297,1,2,陳美月,540245,1070723,1070726,1070730,2冊13頁,2,18,簡安硌,財團法人真理大學,0540909,新北市淡水區真理街32號,為達成教學及學術研究，自由探討真理，培養人格，服務社會，促進國際間學術交流，榮神益人之目的，設立財團法人真理大學。,設立基金新台幣陸佰貳拾萬元，由北部臺灣基督長老教會大會，熱心信徒及社會各界人士捐助，嗣後並得繼續接受國內外之個人、法人或團體之捐贈,教育部54.8.26台(54)高字第13242號函,永久,4948133627.00,1,1070726,1070808,1070803,,法人圖記暨董事印鑑。,,,,
107法登他000298,1,2,陳美月,1122,1070723,1070727,1070730,56冊16頁,1,5,"林  釗",財團法人台灣創價學會基金會,0890721,台北市士林區至善路2段250號,本於宗教之精神，以傳揚日蓮大聖人佛法教義為宗旨。,設立基金共新台幣參仟萬元整，由台灣國際創價學會捐助,內政部中華民國89年7月16日台(89)內民字第890603號函,永久,231506111.00,1,1070727,1070808,1070803,,"第5屆董事林廷鋒、張勝利、盧怡孝、洪玉柱等4人辭職，依章程董事人數7人仍符合規定，不予補選。
法人圖記暨董事印鑑。",,,,
107法登他000299,2,2,陳美月,1113,1070723,1070727,1070730,56冊7頁,2,8,吳國雄,社團法人中華無菌製劑協會,0860926,台北市承德路1段35號3樓,以結合製藥業與相關工業、政府及學術界之從業人員及認同本會宗旨之社會人士，共同提升醫藥物品質及製造技術，貢獻於社會為宗旨。,入會費、常年會費、事業費、會員捐款、委託收益、基金及其孳息、其他收入,內政部中華民國86年8月7日台(86)內社字第8687596號函,永久,851977.00,1,1070727,1070821,1070803,,新任理事盧藴澤、蔡國漳印鑑。,,,,
107法登他000300,2,2,陳美月,1776,1070723,1070727,1070730,89冊10頁,2,23,林廷峰,社團法人國際獅子會台灣總會台北市第三支會,0960813,台北市內湖區成功路5段460號14樓之1,"一、發揚人類博愛互助精神。
二、增進國際間友好關係。
三、尊重自由啟發智慧。
四、提倡社會福利。
五、維護國家安全。",會員繳納之會費、會員及社會各界之樂捐款、基金之孳息,臺北市政府社會局中華民國85年6月14日北市社一字第33082號函,永久,1707095.00,1,1070727,1070821,1070803,,"原章程第7條第5款、第13條第1款條文內容變更，業經主管機關臺北市政府社會局中華民國107年7月17日北市社團字第1076023253號函備查。
法人圖記暨理、監事印鑑。",,,,
107法登他000301,1,2,陳美月,939,1070723,1070727,1070730,47冊13頁,2,6,洪文棟,財團法人台北市洪萬傳慈善基金會,0860109,台北市重慶北路2段76號,以舉辦或捐助慈善公益事業為目的。,設立基金新台幣壹仟萬元整，由洪文棟先生捐助；嗣後得由捐助人、或其他個人、公司、團體隨時補充之。,"臺北市政府社會局中華民國85年12月16日  北市社二字第72294號函",永久,20937310.00,1,1070727,1070831,1070803,,"原章程第7條、第9條、第11條、第13~16條、第20條、第21條、第25條條文內容變更，業經本院民事庭107年度法字第14號民事裁定確定。
法人圖記暨董事印鑑。",,,,
107法登他000302,1,2,陳美月,898,1070724,1070727,1070730,45冊12頁,2,5,陳介源,財團法人正覺教育基金會,0950911,台北市大同區承德路3段267號10樓,為推廣及促進佛學、哲學之文教活動及學術交流，以提昇學術研究風氣及品質，並淨化社會安穩人心之目的為宗旨。,設立基金由蕭絜仁先生及台北市佛教正覺同修會共同捐助；俟完成登記後，得繼續接受捐贈。,"教育部中華民國95年9月4日  台社(四)字第0950126636號函",永久,170524158.00,1,1070727,1070831,1070803,,"原章程第10條條文內容變更，業經主管機關教育部中華民國107年7月19日臺教社(三)字第1070107299號函許可變更。
法人圖記暨董事印鑑。",,,,
107法登他000303,1,2,陳美月,1620,1070725,1070727,1070730,81冊14頁,2,3,王惠鈞,財團法人生化科技教育基金會,1001226,新北市汐止區原興路60巷4號12樓,以建立學界與產業界之溝通橋樑，培育生技醫藥跨領域人才，提升臺灣生化科技在國際上的能見度為宗旨。,設立基金新台幣伍佰萬元整，由中國醫藥大學附設醫院、李祖德、合裕管理顧問、上騰生技顧問、明生生物科技股份有限公司等共同捐助；俟依法完成法人登記後，得繼續接受捐贈,新北市政府教育局中華民國100年12月23日北教社字第1001840736號函,永久,5000000.00,1,1070727,1070808,1070803,,法人圖記暨董事印鑑。,,,,
