登記案號,類別,案由,主任,登記號數,收件日期,登記日期,公告日期,登記簿,任期判定,屆期判定,法人代表,法人名稱,設立登記日期,主事務所,目的,捐助方法,許可機關日期,存立時期,財產總額,結案原因,結案日期,歸檔日期,發證日期,清算人,變更原因,註銷日期,撤銷日期,撤(註)銷機關文號,撤(註)銷原因
107法登他000427,2,2,陳美月,1617,1071019,1071030,1071101,81冊11頁,2,2,紀清林,社團法人臺北市南港媽祖慈善會,1040722,台北市南港區舊莊街2段2巷9號,以急難救助為宗旨。,入會費、常年會費、會員捐款、委託收益、基金及其孳息、其他收入,臺北市政府社會局中華民國104年6月11日北市社團字第10438937700號函,永久,176200.00,1,1071030,1080525,1071108,,理、監事印鑑。,,,,
107法登他000428,1,2,陳美月,1898,1071022,1071025,1071029,95冊12頁,1,2,"廖  群",財團法人慧治農業基金會,1030506,台北市大同區寧夏路11號6樓之12,以推展有機農業及休閒農業，辦理有機農業推廣教育、農村綠美化、培養有機農業人才為宗旨。,財產共新臺幣參仟萬元整，由慧治投資有限公司捐助，其中設立基金為新臺幣貳仟萬元整，餘新臺幣壹仟萬元為業務之「營運基金」；俟依法完成法人登記後，得繼續接受捐贈,行政院農業委員會中華民國103年3月5日農糧字第1031033642號函,永久,30000000.00,1,1071025,1080708,1071105,,,,,,
107法登他000429,1,2,陳美月,18,1071024,1071026,1071029,1冊35頁,2,11,"鄒   麟",財團法人基督教浸禮聖經會南港恩慈堂,0751020,台北市南港區東新街67號6樓之2,為傳佈基督教聖經之非營利宗教教會，應促進教友間之聯合，使基督之純潔與正義，傳諸人群及後裔，並辦理附屬公益慈善、教育、社會福利、傳媒等事業，不涉及政治性質，尊重本國憲法及民法之規定。,由財團法人台灣基督教浸禮聖經會捐助。,台北市南港區公所75.8.6(75)北市南民字第10775號,永久,500032280.00,1,1071026,1080301,1071105,,"原章程第6條條文內變更，業經主管機關臺北市政府民政局中華民國107年10月8日北市民宗字第1076004840號函同意備查。
四、法人圖記暨董事印鑑。",,,,
107法登他000430,2,2,陳美月,1139,1071024,1071026,1071029,57冊13頁,2,4,林綠紅,社團法人台灣受試者保護協會,0981225,台北市北投區石牌路2段325巷5號2樓,以推廣人體研究之受試者保護觀念，增進受試者保護精神，保障受試者權益，與促進社會公益為目的。,入會費、常年會費、捐款、委託收益、基金及其孳息、補助費收入、其他收入,內政部中華民國98年7月3日台內社字第0980124433號函,永久,170457.00,1,1071026,1080301,1071105,,新任理、監事印鑑。,,,,
107法登他000431,1,2,陳美月,630586,1071024,1071114,1071115,3冊21頁,2,15,黃敏正,財團法人台北市私立方濟高級中學,0630626,台北市內湖區成功路3段61號,為創辦私立方濟高級中學暨附設國民中學部並謀其發展為目的。,設立財產總額新臺幣肆佰玖拾壹萬捌仟伍佰柒拾貳元捌角整，由財團法人天主教方濟各會捐助，為何礪行神父主導對外募集所得。嗣後並得繼續接受國內外之個人、法人或團體之捐贈。,台北縣政府54.7.8北府教一字第64525號令,永久,512133921.00,1,1071114,1080301,1071123,,法人圖記暨董事、監察人印鑑。,,,,
107法登他000432,1,2,陳美月,620493,1071024,1071029,1071031,2冊95頁,1,14,黃瑞霞,財團法人臺北市私立文德女子高級中學,0620131,台北市內湖區成功路3段70號,以創辦私立文德女子高級中學並謀其發展為目的。,設立基金新台幣柒佰伍拾伍萬零肆佰陸拾伍元整，由天主教耶穌聖嬰方濟修女會捐贈，嗣後並得繼續接受國內外之個人、法人或團體之捐贈,台北市政府教育局60.7.5北市教輝二字第20767號函,永久,255576819.00,1,1071029,1080301,1071107,,繼任董事黃斯勝印鑑。,,,,
107法登他000433,1,2,陳美月,1770,1071024,1071026,1071029,89冊4頁,1,7,蕭宗煌,財團法人文化臺灣基金會,0870225,台北市大同區華陰街91號14樓之1,以落實台灣文化建設、促進多元文化發展、充實文化內涵為宗旨，以文化精緻化、現代化、國際化為目標。,設立基金目標訂為新台幣壹拾億元整，其中新台幣貳億肆仟萬元業由臺灣省政府文化處捐贈，除續由政府捐贈外並接受民間捐助,臺灣省政府教育廳中華民國87年2月25日87教五字第03355號函（主管機關改隸文化部）,永久,250905251.00,1,1071026,1080301,1071105,,法人圖記暨繼任董事長蕭宗煌、董事林淑真印鑑。,,,,
107法登他000434,1,2,陳美月,94,1071025,1071026,1071029,5冊7頁,2,8,李寶玉,財團法人台北市佛教慈觀社會福利基金會,0800121,台北市德行東路109巷104號6樓,以辦理台北市區社會貧苦救濟、急難救助等為目的,設立基金新台幣壹仟萬元整，由捐助人周綉鶯、周調和、林熟、高雅花、徐月娥、謝雪娥、李寶玉無償捐助之，嗣後得由捐助人或其他個人、團體隨時補充之,台北市政府社會局79.11.22(79)北市社二字第41105號函,永久,27335500.00,1,1071026,1080301,1071105,,"原章程第6條、第7條條文內容變更，業經本院民事庭107年度法字第39號民事裁定確定。
五、法人圖記暨董事印鑑。",,,,
107法登他000435,1,2,陳美月,1334,1071025,1071026,1071029,67冊8頁,2,3,石曜堂,財團法人演譯基金會,1010119,台北市內湖區行善路58號3樓之3,建立華人大型人體生物資料庫，提供生物醫學及生技產業研究發展，以研究生命科學研究為目的。,設立基金新台幣一千萬元整，由美兆生活事業股份有限公司捐助；嗣後並得繼續接受國內外之個人或團體之捐助,行政院衛生署中華民國101年1月12日衛署醫字第1010204516號函,永久,10000000.00,1,1071026,1080301,1071105,,"原章程第9條條文內容變更，業經本院民事庭107年度法字第43號民事裁定確定。
四、法人圖記暨董事印鑑。",,,,
107法登他000436,1,2,陳美月,1121,1071029,1071030,1071101,56冊15頁,1,3,阿瑪亞‧賽斐格（AMAYA‧SAYFI）,財團法人原住民族文化事業基金會,0980916,台北市南港區重陽路120號5樓,以傳承原住民族文化、經營原住民族傳播媒體事業為宗旨。,創立基金新臺幣二千萬元，由行政院原住民族委員會編列預算捐助，嗣後繼續接受捐贈。,行政院原住民族委員會中華民國98年9月8日原民教字第0980041725號函,永久,723518826.00,1,1071030,1080301,1071108,,"監察人駱慧菁印鑑變更。

四、董事長阿瑪亞‧賽斐格（AMAYA‧SAYFIK）暨監察人駱慧菁印鑑。",,,,
107法登他000437,2,2,陳美月,1606,1071029,1071030,1071101,80冊20頁,2,2,胡幼鳳,社團法人數位新媒體3D協會,1040519,台北市內湖區民權東路6段324號3樓,以著重在新媒體之科技與藝術的推動，結合影、音、圖、文等領域為宗旨。,入會費、常年會費、事業費、會員捐款、委託收益、其他收入,內政部中華民國103年11月3日台內團字第1030312887號函,永久,4510133.00,1,1071030,1080301,1071108,,法人圖記暨理、監事印鑑。,,,,
107法登他000438,1,2,陳美月,316,1071029,1071030,1071101,16冊11頁,1,8,袁陳美,財團法人台北市袁紹斌文教基金會,0860520,台北市大同區承德路3段246號13樓,以推展文化、教育為宗旨。,設立基金共新台幣五百萬元整，由袁紹斌捐助；俟完成法人登記後，得繼續接受捐助,台北市教育局86.4.24北市教四字第8621952000號,永久,20000000.00,1,1071030,1080301,1071108,,法人圖記暨繼任董事許政仁印鑑。,,,,
107法登他000440,1,2,陳美月,1434,1071030,1071031,1071101,72冊8頁,2,5,陳茂強,財團法人軒宇文化藝術基金會,0951220,台北市內湖區陽光街321巷56號4樓之6,以提升文化生活品質、健全藝術發展環境，營造優質生活並促進國際文化藝術交流為宗旨,設立基金共新臺幣伍佰萬元整，由陳茂強創始董事捐助；俟依法完成財團法人登記後，得繼續接受捐贈,臺北市政府文化局中華民國95年12月18日北市文化四字第09532037900號函,永久,5000000.00,1,1071031,1080301,1071108,,新任董事廖皎含印鑑。,,,,
107法登他000441,1,2,陳美月,793,1071030,1071031,1071101,40冊7頁,2,5,陳麒文,財團法人力鋼社會福利慈善基金會,0940215,台北市士林區社中街76號,辦理社會福利慈善事業為目的,由力鋼工業股份有限公司捐贈，嗣後得繼續接受捐助,臺北市政府社會局中華民國94年1月11日北市社二字第09342027200號函,永久,30000000.00,1,1071031,1080301,1071108,,法人圖記暨董事印鑑。,,,,
107法登他000442,1,2,陳美月,93,1071101,1071105,1071107,5冊5頁,1,9,曹力中,財團法人台北市基督教士林錫安堂,0800110,台北市士林區福國路94號2樓,本基督仁愛精神，在台北市內傳揚基督教教義，辦理社會公益慈善教育事業。,設立基金新台幣參佰參拾參萬參仟伍佰玖拾伍元整，依法完成法人登記後，得繼續接受國內外個人或團體之奉獻及捐贈,台北市政府民政局79年12月22日(79)北市民三字第18251號函,永久,105389112.00,1,1071105,1080301,1071114,,,,,,
107法登他000443,1,2,陳美月,455,1071101,1071105,1071107,23冊13頁,2,7,董素卿,財團法人新北市立秀峰高中教育基金會,0890111,新北市汐止區忠孝東路201號,以獎助品學兼優或清寒學生，及協助本校改善教育環境，發展校務為目的。,設立基金新台幣參佰肆拾萬元整，由地方熱心人士、教職員工、學生家長捐助，俟依法完成法人登記後，得繼續接受捐助,台北縣政府　中華民國88年12月30日　88北府教三字第489569號函,永久,3400000.00,1,1071105,1080525,1071115,,新任董事印鑑。,,,,
107法登他000444,1,2,陳美月,172,1071101,1071105,1071107,9冊3頁,1,9,李壽東,財團法人消化醫學研究發展基金會,0821013,台北市北投區石牌路2段201號,以舉辦或資助消化系醫學研究之發展，培養消化系醫學研究人才及提昇消化醫學水準。,由台北榮民總醫院院長羅光瑞發起，創設基金新台幣壹仟萬元整，由聯合報系董事長王惕吾捐助，嗣後得繼續接受各界熱心醫學研究之團體或個人自由捐贈,行政院衛生署82.9.13衛署醫字第8260756號函,永久,13000000.00,1,1071105,1080301,1071115,,"原章程第6條條文內容變更，業經本院民事庭107年度法字
第25號民事裁定確定。",,,,
107法登他000445,1,2,陳美月,3,1071101,1071105,1071107,1冊5頁,2,10,張德明,財團法人中華醫學研究獎助基金會,0731106,台北市北投區石牌路2段201號,以促進我國醫學研究發展為宗旨。,設立基金共新台幣607萬元正，由鄒濟勳等44人捐助，嗣後並得陸續接受社會熱心醫學研究人士自由捐贈,行政院衛生署73.10.17衛署醫字第5016811號,永久,11200000.00,1,1071105,1080708,1071115,,"原章程第3條、第15條條文內容變更，業經本院民事庭107年度法字第24號民事裁定確定。
四、法人圖記暨董事印鑑。",,,,
107法登他000446,1,2,陳美月,634,1071102,1071106,1071107,32冊19頁,2,3,朱國榮,財團法人新北市國寶社會福利慈善事業基金會,0911024,新北市三芝區店子里龜子山9之2號,本會以辦理社會福利慈善事業為目的。,福座往生禮儀服務股份有限公司捐助,台北縣政府中華民國91年10月2日北府社助字第0910533862號函,永久,10000000.00,1,1071106,1080301,1071115,,"原章程第1條、第2條、第23條條文內容變更，業經主管機關新北市政府中華民國107年10月18日新北府社助字第1071978665號函許可變更。
六、法人圖記暨董事印鑑。",,,,
107法登他000447,2,2,陳美月,1380,1071102,1071107,1071108,69冊17頁,2,3,趙良慧,社團法人中華華美媒體傳播協會,1010720,台北市士林區外雙溪翠山街34號,提升廿一世紀華人軟實力對全球各民族之影響力，以文化心靈產業為核心價值；使用傳播精神文明為對話媒介，推動全球華語媒體間之交流合作與資源整合；以促進新媒體發展、數位匯流傳播媒介之研究與應用為成立目標。以期符合廿一華人世紀，從台灣出發全面提升法政、社會、經濟、文化、藝術，對世界文明的積極正向之影響力。,入會費、常年會費、事業費、會員捐款、委託收益、基金及其孳息、其他收入,內政部中華民國101年4月25日台內社字第1010172328號函,永久,1000.00,1,1071107,1080301,1071116,,法人圖記暨理、監事印鑑。,,,,
107法登他000449,1,2,陳美月,518,1071106,1071107,1071108,26冊11頁,2,7,蕭　靜,財團法人新約教會石牌教會,0891017,台北市北投區石牌路1段166巷11號5樓,傳揚耶穌基督全備福音，引導聖徒及社會大眾遵守使徒教訓，樹立榮神益人之典範，以造福社會大眾。,捐助,台北市民政局89年10月2日北市民三字第8922963900號函,永久,4500000.00,1,1071107,1080301,1071116,,法人圖記暨董事印鑑。,,,,
107法登他000450,1,2,陳美月,721001,1071106,1071107,1071108,4冊51頁,2,12,黃秋妹,財團法人台北市私立佛教菩提慈善基金會,0720519,台北市南京西路18巷4弄2號,以辦理慈善事業為目的。,設立基金新台幣貳佰萬元整，由賴碧惠、陳金梅、黃秋妹、劉瑞昌等無償捐助之；嗣後得由捐助人隨時補充之,台北市政府社會局72.5.16(72)北市社四字第17482號,永久,2000000.00,1,1071107,1080301,1071116,,法人圖記暨董事印鑑。,,,,
107法登他000451,1,2,陳美月,785,1071106,1071107,1071108,39冊55頁,1,5,釋證嚴,財團法人慈濟傳播人文志業基金會,0931231,台北市北投區立德路2號,以健全大眾傳播媒體文化之發展，闡揚世間真、善、美，促進人心淨化、社會祥和為宗旨。,創立基金為新台幣伍仟萬元整及座落於台北市立德路2號及2-1號建物及其土地，由財團法人中華民國佛教慈濟慈善事業基金會捐助,行政院新聞局93年12月28日新廣一字第0930606201號函,永久,5255356598.00,1,1071107,1080301,1071116,,,,,,
107法登他000452,2,2,陳美月,1584,1071107,1071114,1071115,79冊18頁,2,2,梁貴米,社團法人台灣動物保護協會,1040304,台北市北投區立功街165巷5號6樓,以秉持愛護動物的理念，配合政府推動各項動物福利之服務與宣導，流浪動物急難救助及關懷動物的生存權，落實社區校園宣導，終極計畫是讓貓狗與人和平共處為宗旨。,入會費、常年會費、事業費、會員捐款、委託收益、基金及其孳息、其他收入,內政部中華民國103年11月24日台內團字第1030313057號函,永久,1000.00,1,1071114,1080301,1071123,,"章程第1條、第2條、第5條及第30條條文變更，業經主管機關內政部中華民國107年10月11日台內團字第1070067611號函備查。
七、法人圖記暨理、監事印鑑。",,,,
107法登他000453,1,2,陳美月,466,1071108,1071114,1071115,23冊46頁,2,9,賴明亮,財團法人佛教蓮花基金會,0830910,台北市大同區承德路3段230號4樓,以推廣全人照顧及生命教育為宗旨，協助末期病人及家屬獲得適當之醫療及身心靈照顧。,由國內外之個人或團體捐助,行政院衛生署　83年8月30日　衛署醫字第83048577號函,永久,56000000.00,1,1071114,1080301,1071123,,"原章程第14條條文變更，業經本院民事庭107年度法字第37號民事裁定確定。
法人圖記暨董事印鑑。",,,,
107法登他000454,2,2,陳美月,1096,1071109,1071116,1071119,55冊10頁,2,6,郭國任,社團法人台北市不動產估價師公會,0930308,台北市大同區長安西路82號6樓,以不動產估價學術與實務之闡揚，不動產估價技術之改進、協助及促進國家社會、經濟建設為目的，協調會員間關係，增進、保障及維護會員共同利益與信譽，共謀不動產估價師事業之發展為宗旨。,入會費、年會費、捐款、委託收益、基金及其孳息、其他收入,臺北市政府社會局中華民國92年1月24日北市社一字第09230505600號函,永久,923491.00,1,1071116,1080301,1071126,,"原章程第38條條文變更，業經主管機關臺北市政府社會局中華民國107年2月1日北市社團字第10731943900號函備查。
法人圖記暨理、監事印鑑。",,,,
107法登他000455,1,2,陳美月,980,1071109,1071116,1071119,49冊14頁,2,10,羅瑩雪,財團法人中華民國兒童福利聯盟文教基金會,0801224,台北市大同區長安西路43號6樓,以倡導兒童福利觀念，推展兒童教育，保障兒童權利，促進兒童健全發展，增進兒童福利為宗旨。,由財團法人心臟病兒童、吳麥文教、國泰建設文化教育等基金會、王志雄、王世雄、林謝罕見等捐助，俟完成法人登記後，得繼續接受捐贈,"教育部80年12月17日  台（80）社字第68396號函",永久,1060000000.00,1,1071116,1080301,1071126,,法人圖記暨董事、監察人印鑑,,,,
107法登他000456,1,2,陳美月,630567,1071109,1071116,1071119,3冊17頁,1,14,熊名昭,財團法人新北市私立聖心國民小學,0630323,新北市八里區龍米路1段261號,為發揚天主教聖心會教育理念之目的，設立財團法人新北市私立聖心國民小學。,設立基金新臺幣參拾萬元由聖心國民小學董事會捐贈，聖心會所捐贈貳拾參萬伍仟零伍拾伍元已全部動用為建校經費。嗣後並得繼續接受國內外之個人、法人或團體之捐贈,台灣省台北縣政府55.9.5北府教二字第82409號令,永久,163074224.00,1,1071116,1080301,1071126,,"一、選聘第13屆監察人：
監察人	郭維夏	新北市新莊區中正路510號。
二、法人圖記暨監察人郭維夏印鑑。",,,,
107法登他000457,1,2,陳美月,721010,1071112,1071116,1071119,4冊57頁,2,9,陳政忠,財團法人台北市陳安文教基金會,0720713,台北市士林區延平北路6段116巷46號1樓,1.協助貧寒家庭子女就學，繼續完成其學業。2.一般清寒家庭之救助。3.文教社會風氣之宣導。,由陳安先生遺囑，自其遺產撥出新台幣參拾萬元作為原始基金，嗣後仍可由其家族繼續捐贈，並接受社會團體及個人之捐贈,台北市政府教育局72年6月27日,永久,1000000.00,1,1071116,1080301,1071126,,董、監事印鑑。,,,,
107法登他000458,2,2,陳美月,1112,1071112,1071116,1071119,56冊6頁,2,4,陳金來,社團法人台北共樂軒民藝文化協會,0980814,台北市大同區歸綏街160巷6號,以發揚傳統文化，傳承民俗技藝、提倡正當活動，促進社區團結為宗旨。,入會費、常年會費、會員捐款、委託收益、基金及其孳息、其他收入,臺北市政府社會局中華民國98年5月1日北市社團字第09835460700號函,永久,10000.00,1,1071116,1080301,1071126,,法人圖記暨理、監事印鑑。,,,,
107法登他000459,1,2,陳美月,670788,1071112,1071116,1071119,3冊83頁,1,12,郭銘玉,財團法人台灣基督長老教會三角埔教會,0671127,台北市士林區延平北路6段261巷3號,一、為謀基督教義健全之發展。二、協助三角埔教會之傳道事工。三、推行社會公益事業與社區服務工作。四、致力管理本會所屬資產。,捐助,台北市士林區公所67.11.4.士興民字第28474號函,永久,6165300.00,1,1071116,1080301,1071126,,原章程第7條、第9條、第10條條文變更，業經本院民事庭107年度法字第12號民事裁定確定。,,,,
107法登他000460,1,2,陳美月,1116,1071113,1071119,1071120,56冊10頁,1,5,王聰麟,財團法人全國認證基金會,0920917,新北市淡水區中正東路2段27號23樓,以提供經濟與社會發展需求之公正、客觀、獨立及符合國際規範之第三者認證服務為宗旨。,創立基金共新台幣三千五百八十萬元整，由經濟部標準檢驗局等18家機關（構）共同捐助，嗣後得繼續接受捐贈。,經濟部中華民國92年9月15日經商字第09202184100號函,永久,129815189.00,1,1071119,1080301,1071127,,董事周登春印鑑。,,,,
107法登他000461,1,2,陳美月,248,1071113,1071119,1071120,12冊35頁,2,8,楊理建,財團法人新北市汐止區長安國民小學教育發展基金會,0840821,新北市汐止區長興街1段80號,以協助學校改善環境，推展校務及發展教育為宗旨。,設立基金新台幣貳佰參拾萬陸仟伍佰元整，由黃聰明等人捐助；嗣後得繼續接受捐助。,台北縣政府84.8.9八四北府教三字第290113號函,永久,2350000.00,1,1071119,1080301,1071127,,法人圖記暨董事印鑑。,,,,
107法登他000462,1,2,陳美月,874,1071114,1071119,1071120,44冊8頁,1,8,鍾張培士,財團法人中華民國婦聯聽障文教基金會,0850314,台北市北投區振興街45號,以推展並捐助聽障文教工作為宗旨。,設立基金新台幣貳仟萬元整，由中華民國婦女聯合會捐助；俟完成登記後，得繼續接受捐助,教育部　85年2月26日台（85）社（四）字第85004594號函,永久,981600000.00,1,1071119,1080301,1071127,,法人圖記暨繼任董事汪芝蓁印鑑。,,,,
107法登他000463,2,2,陳美月,1877,1071115,1071120,1071121,94冊11頁,1,3,柯天路,社團法人台灣社會發展推動協會,1010111,台北市內湖區行善路459號6樓,以辦理身心障礙及弱勢族群相關服務之研究、經營與輔導為宗旨。,入會費、常年會費、事業費、會員捐款、委託收益、基金及其孳息、其他收入,內政部中華民國100年12月1日台內社字第1000225638號函,永久,10000.00,1,1071120,1080301,1071129,,繼任常務理事張靜玉印鑑。,,,,
107法登他000465,1,2,陳美月,1123,1071115,1071119,1071120,56冊17頁,2,6,楊克齊,財團法人中華出版基金會,0871001,台北市內湖區內湖路1段91巷40號,發揚中華文化及創意植根，以流通出版資訊，培育出版人才，開創出版商機，推動兩岸及國內、外之出版交流，暨促進出版事業、學術研究等為策略之永續發展。,創會基金新台幣伍佰伍拾萬元，由洪秀柱、武奎昱、曾繁潛、李沛儒、莊芳榮等人捐助，嗣後繼續接受捐贈。,行政院新聞局中華民國87年8月29日(87)建版四字第13955號函,永久,5500000.00,1,1071119,1080301,1071127,,法人圖記暨董、監事印鑑。,,,,
107法登他000466,2,2,陳美月,921,1071115,1071130,1071203,46冊15頁,2,13,張清溪,社團法人台北彰商校友會,0850511,台北市大同區西寧北路70之1號6樓,以敦睦校友感情、發揚互助與愛校精神，協助母校之發展與協助政府共謀國家社會之經濟發展，促進國民外交為宗旨。,入會費、常年會費、永久會費及贊助會費、榮譽會費及榮譽贊助會費、事業費、會員捐款、委託收益、基金及其孳息、其他收入,"台北市政府社會局中華民國83年8月19日  北市社一字第1203號函",永久,1000000.00,1,1071130,1080301,1071210,,"因法人名稱變更，修正章程第1條條文，業經主管機關臺北市政府社會局中華民國107年10月24日北市社團字第1076074935號函核備。
五、法人圖記暨理、監事印鑑。",,,,
107法登他000468,1,2,陳美月,490112,1071119,1071119,1071120,1冊49頁,2,11,胡國勇,財團法人台北市私立王氏宗廟圖書館,0490830,台北市北投區一德街75號,以提供本館館舍及全部戶外空間做為民眾閱覽、運動、休憩場所及配合辦理藝術、文化、音樂創作等有益於社會風氣提昇之公益活動為宗旨。,設立基金新台幣柒拾萬元整，由捐助人無償捐助之，俟依法完成法人登記後，得繼續接受捐贈,台北市政府教育局47.8.18,永久,546858868.00,1,1071119,1080301,1071127,,法人圖記暨董事印鑑。,,,,
107法登他000469,2,2,陳美月,800,1071120,1071126,1071127,40冊14頁,2,8,蕭葆羲,社團法人中華民國風工程學會,0940317,新北市淡水區英專路151號,以整合國內風工程相關研究學者與團體，推動風工程學術研究與應用推廣工作，提供工程界所需風工程相關服務諮詢並促進與國際風工程學術團體交流為宗旨。,入會費、常年會費、補助及贊助費、會員捐款、委託收入、其他收入,"內政部  中華民國92年12月1日台內社字第0920042897號函",永久,78924.00,1,1071126,1080301,1071204,,新任理、監事印鑑。,,,,
107法登他000470,2,2,陳美月,944,1071121,1071123,1071128,47冊18頁,2,7,顧玉玲,社團法人新北市成人學習推廣協會,0891201,新北市汐止區福德一路5號16樓,為促進成人學習之有效整合，推動社區民眾之學習風氣，提供各種學習管道與資訊，以落實終身學習的精神。,常年會費、入會費、事業費、會員捐款、委託收益、其他收入,臺北縣政府89年11月24日89北府社團字第448620號函,永久,59900.00,1,1071123,1080301,1071205,,法人圖記暨理、監事印鑑。,,,,
