登記案號,類別,案由,主任,登記號數,收件日期,登記日期,公告日期,登記簿,任期判定,屆期判定,法人代表,法人名稱,設立登記日期,主事務所,目的,捐助方法,許可機關日期,存立時期,財產總額,結案原因,結案日期,歸檔日期,發證日期,清算人,變更原因,註銷日期,撤銷日期,撤(註)銷機關文號,撤(註)銷原因
107法登他000135,1,2,陳美月,714,1070327,1070329,1070330,36冊19頁,1,10,黃欽成,財團法人台北市博愛福利基金會,0760909,台北市士林區天母西路3號4樓之1,以辦理身心障礙及低收入戶同胞之福利工作，輔助身心障礙及低收入戶同胞發揮潛能自力更生為目的。,設立基金新台幣壹百萬元整，由捐助人無償捐助；嗣後得繼續接受捐贈,台北市政府社會局76年8月17日北市社四字第38297號函核備,永久,4228053.00,1,1070329,1070507,1070403,,法人圖記暨繼任董事郭維武印鑑。,,,,
107法登他000136,1,2,陳美月,122,1070327,1070329,1070330,6冊23頁,2,14,張德光,財團法人台北市基督教改革宗長老會東光教會,0810121,台北市內湖區康樂街136巷18弄27號2樓,"本  基督耶穌之精神，在臺北市內傳揚基督教義，辦理社會公益慈善教育事業。","本教會所屬財產為受捐助之不動產，原始捐助金額新台幣62萬2,885元。",台北市政府民政局80年11月14日北市民三字第21766號函,永久,5019700.00,1,1070329,1070806,1070403,,法人圖記暨董事印鑑。,,,,
107法登他000137,1,2,陳美月,920,1070329,1070329,1070330,46冊14頁,2,4,王秀珍,財團法人陳建志毅宇未來教育基金會,0960115,台北市內湖區瑞光路358巷30弄1號11樓,以善盡企業社會責任，推廣具創意性之優質實驗教育與多元教育選擇、促進台灣教育與世界連結，並推動教育公益活動以回饋社會為宗旨。,由和毅（股）公司、毅人投資（股）公司、陳建志、陳毅、王黃素珠、王鄰貴等人共同捐助，嗣後得繼續接受捐贈,內政部中華民國95年12月29日內授中社字第0950702140號函核備,永久,30000000.00,1,1070329,1070808,1070403,,法人圖記暨董事印鑑。,,,,
107法登他000138,1,2,陳美月,423,1070329,1070331,1070402,21冊23頁,2,4,王祖欽,財團法人台北市中和堂,0880707,台北市北投區奇岩路151號,以信奉佛教並弘揚佛教經典暨興辦各種公益慈善社會教化事業為宗旨。,捐助,"台北市政府民政局 中華民國88年6月24日 北市民三字第8821771200號函",永久,667152269.00,1,1070331,1070806,1070409,,法人圖記暨董事印鑑。,,,,
107法登他000139,2,2,陳美月,1251,1070330,1070419,1070420,63冊5頁,2,3,黃芬宜,社團法人台灣愛喜樂關懷協會,1000415,台北市北投區明德路161號1樓,發揮基督愛人的精神，及「施比受更為有福」的理念，參與及服務社會；並鼓勵大家珍惜生命，常常喜樂，凡事謝恩，活出正面積極的人生觀。,入會費、常年會費、事業費、捐款、委託收益、基金及其孳息、其他收入,內政部中華民國99年2月24日台內社字第0990038064號函,永久,42237.00,1,1070419,1070806,1070427,,法人圖記暨理、監事印鑑。,,,,
107法登他000140,2,2,陳美月,1441,1070402,1070417,1070418,72冊15頁,2,2,羅鴻基,社團法人臺灣身心障礙暨弱勢者權益推動協會,1020619,台北市北投區立農街2段155號,以保障身心障礙暨弱勢者權益及福祉，維護會員權益為宗旨。,會員之常年會費、事業費、會員捐款、委託收益、基金及其孳息、政府補助、其他收入,內政部中華民國101年10月17日台內社字第1010331012號函,永久,20700.00,1,1070417,1070806,1070425,,"原章程第17條條文內容變更，另刪除第36條，業經主管機關內政部中華民國106年7月18日台內團字第1060039307號函備查。
法人圖記暨理、監事印鑑。",,,,
107法登他000141,1,2,陳美月,411,1070402,1070403,1070409,21冊1頁,2,5,"左  坤",財團法人耶穌基督血水聖靈全備福音佈道團,0880308,聖靈重建教會石牌教會台北市北投區東華街1段364號5樓,本著耶穌基督博愛之精神：一、在全國傳揚耶穌基督血、水、聖靈全備福音。在全國各地建立聖靈重建教會，開展海內外福音事業。二、辨理社會公益慈善事業，淨化人心，搶救人的靈魂。,捐助,內政部88年2月11日台(八八)內民字第8888524號,永久,16679367.00,1,1070403,1070806,1070416,,法人圖記暨董事印鑑。,,,,
107法登他000142,1,2,陳美月,1365,1070402,1070403,1070409,68冊19頁,2,3,蔡衍明,財團法人蔡衍明愛心基金會,1010531,台北市大同區西寧北路72號,以辦理社會福利慈善事業為目的。,設立基金新台幣參仟萬元整，由蔡衍明等捐助；嗣後得由捐助人或其他個人、團體繼續捐贈補充之,內政部中華民國101年5月7日內授中社字第1015932253號函,永久,30000000.00,1,1070403,1070808,1070416,,法人圖記暨董事印鑑。,,,,
107法登他000143,2,2,陳美月,1756,1070402,1070403,1070409,88冊10頁,2,3,康如萍,社團法人中華柔德音佛學會,1000527,台北市士林區中山北路7段186號7樓,為弘揚顯密圓融之佛陀教法，並以具德阿帝夏大尊者所著之〔菩提道之燈論〕及宗喀巴大師所著之〔菩提道次第廣論〕為基礎來推廣佛法，化育僧俗之人才；以期淨化人心，豐富生命內涵，建立圓融人生，並以能廣大利益眾生、救度眾生之大乘佛教為目的。,入會費、常年會費、事業費、會員捐款、委託收益、基金及其孳息、其他收入,內政部中華民國100年2月10日台內社字第1000015140號函,永久,16000.00,1,1070403,1070806,1070416,,理、監事印鑑。,,,,
107法登他000144,1,2,陳美月,787,1070402,1070403,1070409,40冊1頁,2,4,吳尚飛,財團法人台北市樺霖文化藝術基金會,0940107,台北市內湖區舊宗路1段159號9樓,以推動社會文化藝術精神建設及推廣文化藝術創作及活動為宗旨。,設立基金新臺幣1千萬元整由張榮華、林崑海、張秀等人捐助，俟完成登記後，得繼續接受捐贈。,臺北市政府文化局93年12月24日北市文化四字第09331905900號函,永久,41807020.00,1,1070403,1070806,1070416,,法人圖記暨董事印鑑。,,,,
107法登他000145,2,2,陳美月,1051,1070402,1070409,1070411,53冊5頁,1,7,林育鵬,社團法人中華民國原始佛法三摩地學會,0970908,台北市北投區石牌路1段39巷80弄15號,研習原始佛法，發展禪定觀慧，止息人生憂惱，清涼淨化心靈。,入會費、常年會費、事業費、會員捐款、委託收益、基金及孳息、其他收入,內政部中華民國88年2月25日台內社字第8896249號函,永久,15680175.00,1,1070409,1070806,1070418,,繼任監事林靜芳印鑑。,,,,
107法登他000146,1,2,陳美月,620508,1070402,1070409,1070411,3冊1頁,1,12,曹安娜,恕德學校財團法人,0620512,台北市內湖區內湖路1段353號,為謀其發展為目的，設立恕德學校財團法人。,設立基金總額新台幣參仟參佰壹拾柒萬玖仟柒佰伍拾肆元陸角整，由創辦人兼校長趙筱梅博士捐贈；嗣後並得繼續接受國內外之個人、法人或團體之捐贈,54年7月5日台灣省政府教育廳教三字第2796號,永久,821439603.00,1,1070409,1070806,1070418,,法人圖記暨繼任董事長曹安娜、董事汪精輝印鑑。,,,,
107法登他000147,1,2,陳美月,168,1070402,1070409,1070411,8冊35頁,2,13,李權哲,財團法人基督教耕耘會,0660826,台北市士林區中山北路5段678號1樓,以遵守聖經教訓、傳揚耶穌基督福音、從事教會復興，興辦或捐助社會福利、教化、慈善、公益等事業為宗旨。,捐助,台北市政府士林區公所66.6.1士興民字第15719號函,永久,490938184.00,1,1070409,1070806,1070418,,法人圖記暨董事印鑑。,,,,
107法登他000148,1,2,陳美月,899,1070410,1070411,1070412,45冊13頁,2,7,李道明,財團法人台北市私立李雪吟社會福利慈善事業基金會,0890421,台北市士林區中正路450之1號3樓,以辦理社會福利慈善事業為目的。,基金總額新台幣參仟捌佰貳拾柒萬柒仟玖佰捌拾貳元整，由捐助人無償捐助之；嗣後得由捐助人或其他個人、團體隨時補充之,臺北市政府社會局中華民國89年3月27日北市社四字第8921734900號函,永久,58277982.00,1,1070411,1070806,1070423,,"修正捐助章程第7條，業經主管機關臺北市政府社會局中華民國107年3月30日北市社團字第10735273400號函核備。
法人圖記暨董事印鑑。",,,,
107法登他000149,2,2,陳美月,1205,1070410,1070411,1070413,60冊19頁,2,3,林于仕,社團法人中華基督教網路發展協會,0990914,新北市淡水區中正東路2段83號19樓之6,以透過網際網路連結與分享華人基督徒的資源、關懷、禱告、交誼、行動、愛與信仰為宗旨。,入會費、常年會費、事業費、會員捐款、委託收益、基金及其孳息、其他收入,內政部中華民國98年8月12日台內社字第0980149090號函,永久,10000.00,1,1070411,1070806,1070420,,法人圖記暨理、監事印鑑。,,,,
107法登他000151,1,2,陳美月,323,1070410,1070412,1070416,16冊25頁,2,5,陳忠成,財團法人新約教會台北教會,0860624,台北市南港區南港路1段289號5樓,係遵照聖經，傳揚耶穌基督血、水、聖靈全備真道，教導人行善除惡、救世救人、伸張正義、主持公道，帶進耶穌基督宇宙和平國，得享人類永世的和平並從事佈道工作等公益慈善事宜。,捐助,台北市政府民政局86.5.1北市民三字第8621182900號,永久,27235936.00,1,1070412,1070806,1070423,,法人圖記暨董事印鑑。,,,,
107法登他000152,1,2,陳美月,1705,1070411,1070412,1070416,85冊19頁,2,8,孫寶年,財團法人蔣見美教授文教基金會,0851016,台北市內湖區堤頂大道1段223號6樓,以紀念蔣見美教授，倡導科技及文化交流，獎勵及培訓優秀之科技與文化人才為宗旨。,設立基金共新臺幣六百萬元整，由中華民國食品科技學會捐助；俟依法完成法人登記後，得繼續接受捐助,臺北市政府教育局中華民國85年8月24日北市教四字第85245429號函,永久,6500000.00,1,1070412,1070808,1070423,,法人圖記暨董事印鑑。,,,,
107法登他000153,2,2,陳美月,1201,1070412,1070531,1070604,60冊15頁,2,3,劉鈞衡,社團法人台灣法旨覺修慈善協會,0990820,新北市八里區中華路2段536-8號3樓,"慈悲濟世救人。
振興倫理道德。
淨化善性人心。
謀求眾生福址。",入會費、常年會費、事業費、會員捐款、委託收益、基金及其孳息、其他收入,內政部中華民國98年12月23日台內社字第0980236640號函,永久,500100.00,1,1070531,1070821,1070608,,法人圖記暨理、監事印鑑。,,,,
107法登他000154,2,2,陳美月,1062,1070412,1070412,1070416,53冊16頁,1,11,鍾道詮,社團法人中華民國愛滋感染者權益促進會,0890629,台北市大同區承德路1段48號2樓,以促進社會平等、爭取及維護愛滋感染者應有的權利及福利、提高愛滋感染者的社會地位、遏止愛滋病毒蔓延為宗旨。,入會費、常年會費、委辦費、會員捐款、委託收益、基金及孳息、其他收入,內政部中華民國86年12月15日台(86)內社字第8690006號函,永久,497980.00,1,1070412,1070821,1070423,,法人圖記暨繼任理事長鍾道詮、常務理事高智龍、理事鄭孝忱印鑑,,,,
107法登他000155,1,2,陳美月,500151,1070412,1070413,1070416,1冊73頁,1,15,孫寶年,財團法人新北市美國基督教効力會,0501120,新北市淡水區自強路51號,在研究及學習基督教聖經教義、傳揚基督教、訓練服事上帝之工作人員等，以達成基督之最高使命；特別係在促進基督教會之開拓及革新，及導入基督教化於中華文化中。,捐助,台北縣政府50.9.18北縣民一字第7號,永久,1118090122.84,1,1070413,1070806,1070423,,法人圖記暨董事印鑑。,,,,
107法登他000156,2,2,陳美月,532,1070413,1070417,1070418,27冊4頁,1,5,高宏雄,社團法人台北市視障生活品質福利促進會,0891127,台北市大同區華陰街39號,以關心視障人之生活，無論在德、智、體、群、美五育上均能獲得適切的關注，藉以提升其生活品質，以達到和諧安樂的生活。,入會費、常年會費、事業費、會員捐款、委託收益、基金及其孳息、其他收入,台北市政府社會局中華民國89年9月8日北市社一字第8926307600號函,永久,138274.00,1,1070417,1070806,1070425,,理、監事印鑑。,,,,
107法登他000157,2,2,陳美月,1464,1070413,1070417,1070418,73冊18頁,2,2,陳宜鋒,社團法人台北市愛生關懷協會,1020923,台北市內湖區內湖路1段314號12樓,以愛惜尊重生命，關懷人倫互動聯誼為宗旨。,入會費、常年會費、會員捐款、委託收益、基金及其孳息、其他收入,臺北市政府社會局中華民國102年3月20日北市社團字第10233901500號函,永久,30000.00,1,1070417,1070806,1070425,,法人圖記暨理、監事印鑑。,,,,
107法登他000158,1,2,陳美月,974,1070413,1070417,1070418,49冊8頁,1,4,林伯實,財團法人臺北市學學文化創意基金會,0960911,臺北市內湖區堤頂大道2段207號10樓,以推動台灣文化創意產業發展為宗旨。,由林伯實先生捐助，俟完成登記後，得繼續接受各界捐贈。,臺北市政府文化局中華民國96年8月17日北市文化一字第09631781900號函,永久,5000000.00,1,1070417,1070523,1070425,,"章程變更：
1.章程第2條業務項目及第11條修訂歷程變更，業經主管機關臺北市政府文化局中華民國106年12月27日北市文化文創字第10632163000號函同意。
2.章程第8條、第9條條文內容變更，業經本院民事庭107年度法字第4號民事裁定確定。",,,,
107法登他000160,2,2,陳美月,336,1070416,1070417,1070418,17冊11頁,1,11,陸大元,社團法人台北市佛教正覺同修會,0860917,台北市大同區承德路3段277號9樓,以結合佛教三寶弟子，無相念佛共修，淨化身心，秉持釋迦牟尼佛正法眼，普攝眾生，建立良善之組織與制度，以自利利他之菩薩道，積極廣行福慧資糧，落實正覺的教義，弘揚佛法廣利有緣眾生，使正法久住，法輪常轉，以期到達圓滿的人間淨土為宗旨。,入會費、常年會費、會員捐款、委託收益、基金及其孳息、其他收入,台北市政府社會局⒎⒉北市社一字第8623605400號,永久,37412790.00,1,1070417,1070806,1070425,,原章程第16條、第18條條文內容變更，業經主管機關臺北市政府社會局中華民國107年3月27日北市社團字第10734910100號備查。,,,,
107法登他000161,2,2,陳美月,1737,1070417,1070417,1070418,87冊11頁,1,1,蘇惠娟,社團法人中華生命無懼關懷協會,1060214,台北市士林區中社路2段7號4樓,促進重症罹患兒少獲得全人之照護、並關懷其相關環境與社會正義間之互動實務，以此建構社會對生命之積極正向之體認與關懷行為之實踐。,入會費、常年會費、事業費、會員捐款、委託收益、基金及其孳息、其他收入,內政部中華民國105年10月27日台內團字第1050072884號函,永久,17767.00,1,1070417,1070806,1070425,,"原章程第30條條文內容變更，業經主管機關內政部中華民國107年4月11日台內團字第1070026892號函備查。
新任理、監事印鑑。",,,,
107法登他000162,1,2,陳美月,442,1070417,1070418,1070419,22冊34頁,1,9,林百里,財團法人廣達文教基金會,0881026,台北市士林區後港街116號9樓,以「知識分享‧文化均富」為宗旨。,設立基金共新台幣參仟萬元整，由廣達電腦股份有限公司捐助壹仟萬元及林百里先生捐助貳仟萬元；俟完成法人登記後，得繼續接受捐贈,"教育部 中華民國88年10月14日 台( 88) 社( 四) 字第88125437號　",永久,30000000.00,1,1070418,1070806,1070426,,法人圖記暨董事長林百里、繼任董事曹筱玥印鑑。,,,,
107法登他000163,1,2,陳美月,938,1070418,1070419,1070420,47冊12頁,2,6,王國肇,財團法人台北市毅夫教育基金會,0910522,台北市內湖區瑞光路358巷30弄1號11樓,以弘揚固有倫理教育，導正社會人心及舉辦教育性、正當休閒育樂等活動為宗旨。,設立基金新台幣伍佰萬元整，由秦曼平捐助，依法完成登記後，得繼續接受捐贈,臺北市政府教育局中華民國91年5月20日北市教六字第09133553000號函,永久,5000000.00,1,1070419,1070507,1070427,,法人圖記暨董事印鑑。,,,,
107法登他000164,1,2,陳美月,490124,1070418,1070419,1070420,1冊59頁,1,11,李菊花,財團法人台北市私立華興育幼院,0491210,台北市士林區仰德大道1段101號,除收容因公殉職軍警遺孤外，並參照國家有關法令收容社會貧苦無依兒童，使成為健全國民為宗旨。,捐助,台北市政府社會局45.4,永久,1609409416.00,1,1070419,1070806,1070427,,"董事趙徐林秀住所變更：
繼任董事長李菊花及新任董事吳俊明、劉果、林華韋印鑑。",,,,
107法登他000165,2,2,陳美月,1664,1070418,1070420,1070423,83冊18頁,1,1,楊宗仁,社團法人台灣遊戲與生活文化介入發展協會,1050223,台北市北投區石牌路1段71巷9弄19號2樓之1,以推廣遊戲與生活文化介入，促進兒童教育及健康發展為宗旨。,入會費、常年會費、事業費、會員捐款、委託收益、基金及其孳息、其他收入,內政部中華民國104年6月29日台內團字第1040032404號函,永久,20235.00,1,1070420,1070808,1070430,,"原章程第1條、第2條、第5條條文內容變更，業經主管機關內政部中華民國107年3月27日台內團字第1070011537號函備查。
法人圖記。",,,,
107法登他000166,1,2,陳美月,900,1070418,1070420,1070423,45冊14頁,2,6,張壯謀,財團法人綠色消費者基金會,0820330,台北市士林區中山北路6段758號1樓,為發揚綠色思想，推廣消費者環境保護知識與意識，鼓勵廠商生產環保產品，研究綠色消費與綠色行銷，提倡節約能源與保育，提高能源使用效率，共創永續發展之社會。,林俊義、方儉、胡因子、陳玉峰、楊憲宏捐助,"行政院環境保護署中華民國82年3月5日  （82）環署綜字第06915號函",永久,6662475.00,1,1070420,1070821,1070430,,"因會址變更修正組織章程第4條及第25條修訂歷程，業經主管機關行政院環境保護署中華民國107年3月29日環署綜字第1070024944號函核備。
法人圖記暨董事長印鑑及董事、監察人簽名式。",,,,
107法登他000168,1,2,陳美月,500145,1070423,1070425,1070427,1冊71頁,2,12,蔡錫安,財團法人台灣基督教恩惠福音會,0500820,台北市內湖區內湖路1段608號,以傳揚基督福音引人歸主並舉辦慈善救濟公益事業為宗旨。,捐助,台北縣政府50.7.24.北縣民一字第6號,永久,174344590.00,1,1070425,1070808,1070504,,法人圖記暨董事印鑑。,,,,
107法登他000169,1,2,陳美月,660728,1070423,1070425,1070427,3冊67頁,2,15,張鏡湖,財團法人臺北市私立華岡藝術學校,0661024,台北市士林區建業路73巷8號,依私立學校法規定設立臺北市私立華岡藝術學校。,設立基金由財團法人私立中國文化大學捐助，嗣後並得繼續接受國內外之個人、法人或團體之捐贈,"台北市政府教育局 中華民國66年3月4日 北市教一字第06396號函",永久,561692442.00,1,1070425,1070821,1070504,,新任董事樊慰慈、鄭德淵印鑑。,,,,
107法登他000170,1,2,陳美月,1107,1070424,1070426,1070427,56冊1頁,1,10,黃夢童,財團法人創價文教基金會,0770317,台北市士林區至善路2段250號,以促進社會和諧，提高精神生活品質，辦理社會公益之文教工作為宗旨。,設立基金新台幣壹佰萬元整，由江順盛、吳大和、莊昭森、蘇素玲共同捐助，嗣後得繼續接受捐助。,教育部中華民國77年3月3日台(77)社字第08514號函,永久,187889145.00,1,1070426,1070808,1070504,,,,,,
107法登他000171,1,2,陳美月,1260,1070424,1070426,1070427,63冊14頁,1,2,王榮信,台神學校財團法人,1000519,台北市士林區仰德大道2段2巷20號,為傳揚基督福音、培養基督教傳教人才，推動宗教學術研究之目的。,設立基金新臺幣伍仟萬元，由財團法人台灣神學院捐助，嗣後並得繼續接受國內外之個人、法人或團體之捐贈,教育部中華民國99年9月6日台高(四)字第0990137447號函,永久,188562937.00,1,1070426,1070806,1070504,,繼任董事羅龍斌、蔡幸昇、趙謨立、康為恭、陳美玲、方玲玲印鑑。,,,,
107法登他000172,1,2,陳美月,235,1070425,1070426,1070427,12冊9頁,2,8,蘇龍華,財團法人台北市華夏婦女文教基金會,0820217,台北市士林區至誠路1段62巷28號,以關愛社會、重視文化、熱心教育、照顧婦女、發揚傳統文化、推展社會教育為宗旨。,由中華婦女反共聯合會台北市分會捐助,台北市政府教育局82.1.11北市教四字第68192號函,永久,6000000.00,1,1070426,1070507,1070504,,法人圖記暨董事印鑑。,,,,
107法登他000173,1,2,陳美月,723,1070427,1070501,1070502,36冊49頁,1,7,胡世賢,財團法人天下為公社會福利慈善事業基金會,0861111,新北市汐止區大同路3段425號,以舉辦或捐助（贈）社會福利慈善事業為目的。,設立基金新台幣參仟萬元整，由胡世賢等25人共同捐助；嗣後得由捐助人或其他個人、團體繼續捐贈補充之,內政部86年9月8日　台（86）內社字第8685198號函,永久,30000000.00,1,1070501,1070808,1070509,,原章程第2條、第3條條文內容及章程修訂歷程變更，業經主管機關衛生福利部中華民國107年4月23日衛授家字第1070006339號函同意備查。,,,,
107法登他000174,1,2,陳美月,545,1070427,1070501,1070502,27冊43頁,1,6,費克強,財團法人天主教白永恩神父社會福利基金會,0900302,台北市士林區德行東路202號4樓,以辦理社會福利慈善事業為目的。,由財團法人天主教遣使會捐助成立，捐助金額為新台幣參仟萬元整；嗣後得由捐助人或其他個人、團體繼續捐贈補充之,"內政部  中華民國90年2月8日台內中社字第9070257號函",永久,1002712237.00,1,1070501,1070808,1070509,,法人圖記暨董事印鑑。,,,,
107法登他000175,1,2,陳美月,1577,1070501,1070502,1070503,79冊11頁,1,6,曹安娜,康寧學校財團法人,0890218,台北市內湖區康寧路3段75巷137號,為響應私人捐資興學，培養國家高級學術人才之目的，設立康寧學校財團法人。,設立時之財產總額為新台幣貳億元整，由王榮昌、林政則、王純德等人捐助設立（詳如捐助人名冊及捐助財產清冊）；嗣後並得繼續接受國內外之個人、法人或團體之捐贈,教育部中華民國88年9月29日台八八高三字第88117128號函,永久,4870861867.00,1,1070502,1070808,1070510,,法人圖記暨繼任董事長曹安娜印鑑。,,,,
107法登他000177,1,2,陳美月,45,1070503,1070503,1070507,2冊31頁,2,11,陳昱達,財團法人台北市關天師天心慈善基金會,0770428,台北市北投區清江路102號1樓,本財團以辦理社會上貧苦須濟助之同胞之慰問及救濟事項等為目的。,設立基金新台幣貳佰萬元整，由捐助人無償捐助之；嗣後得由捐助人隨時補充之,"台北市政府社會局  77年3月17日北市社二字第8440號",永久,2040000.00,1,1070503,1070808,1070514,,法人圖記暨董事印鑑。,,,,
107法登他000180,1,2,陳美月,501,1070504,1070504,1070508,25冊31頁,2,9,周碧瑟,財團法人人權教育基金會,0830302,台北市北投區立農街2段155號,以推展人權教育，培養本國國民健全人格為宗旨。,設立基金共新台幣貳佰萬元整，由全體董事捐助；俟依法完成法人登記後，得繼續接受捐贈,台北縣政府83年2月21日（83）北府教三字第057905號函,永久,20000000.00,1,1070504,1070808,1070515,,法人圖記暨董事印鑑。,,,,
107法登他000181,1,2,陳美月,1122,1070508,1070509,1070510,56冊16頁,1,5,"林  釗",財團法人台灣創價學會基金會,0890721,台北市士林區至善路2段250號,本於宗教之精神，以傳揚日蓮大聖人佛法教義為宗旨。,設立基金共新台幣參仟萬元整，由台灣國際創價學會捐助,內政部中華民國89年7月16日台(89)內民字第890603號函,永久,231506111.00,1,1070509,1070821,1070517,,"章程第1條條文內容變更，業經主管機關內政部中華民國107年1月24日台內民字第1070006185號函備查。
法人圖記。",,,,
107法登他000182,1,2,陳美月,649,1070508,1070508,1070509,33冊4頁,2,7,陳慧穎,財團法人台灣民間教育基金會,0920123,新北市八里區中山路3段112號,本會以提高國民生活品質，宏揚台灣固有文化，推動社會教育，創造和諧社會為宗旨。,設立基金共新臺幣伍佰萬元整，由陳朝傳捐助；俟依法完成法人登記後，得繼續接受捐助,台北縣政府中華民國92年1月10日北府教社字第0920006924號,永久,10642857.00,1,1070508,1070808,1070517,,法人圖記暨董事印鑑。,,,,
