登記案號,類別,案由,主任,登記號數,收件日期,登記日期,公告日期,登記簿,任期判定,屆期判定,法人代表,法人名稱,設立登記日期,主事務所,目的,捐助方法,許可機關日期,存立時期,財產總額,結案原因,結案日期,歸檔日期,發證日期,清算人,變更原因,註銷日期,撤銷日期,撤(註)銷機關文號,撤(註)銷原因
112法登他000001,1,2,張惠芳,1910,1120103,1120103,1120104,58冊38頁,2,2,鄒志鴻,財團法人新北市偉旭教育基金會,1090622,新北市三峽區中華路42號,以協助急難家庭學童、獎助家境清寒、品學兼優學生為要，並襄助學校改善教育環境，鼓勵學生積極向學並提昇教育品質為宗旨,由林坤波先生捐助。,新北市政府教育局中華民國109年6月10日新北教社字第1091030582號函,永久,5000000.00,1,1120103,,,,"董事印鑑。
修正捐助章程第7、15條條文。",,,,
112法登他000002,1,2,張惠芳,213,1120104,1120104,1120105,8冊19頁,1,14,丘寧世,財團法人新北市私立竹林國民小學,0620615,新北市中和區華新街143巷12號,為創辦新北市私立竹林國民小學並謀其發展。,由創辦人丘棣華及中外熱心教育人士等捐助,台北縣政府六十二年五月二十九日北府教二字第五二八六七號函,永久,59163686.00,1,1120104,,,,,,,,
112法登他000003,2,2,張惠芳,887,1120104,1120104,1120105,30冊26頁,2,5,陳清志,社團法人中華仁道關懷協會,0991008,新北市板橋區民生路2段247號7樓,以博愛、救濟、互助、教育、推己及人的仁民愛物之法統精神，用愛與關懷來照亮社會、用心力與行動增添光熱，奉獻己力、發揚傳統固有的美德。,入會費、常年會費、事業費、會員捐款、委託收益、基金及其孳息、其他收入。,內政部中華民國99年7月25日台內社字第0990154344號,永久,200000.00,1,1120104,,,,"理監事印鑑。
修正章程第14、18、21、37、38條條文。",,,,
112法登他000004,1,2,張惠芳,664,1120104,1120104,1120105,23冊12頁,2,6,蘇興李,財團法人新北市私立秀旺社會福利慈善事業基金會,0950912,新北市三峽區添福里添福10之12號,以舉辦社會福利慈善事業為宗旨。,由蘇王菜女士捐助,臺北縣政府95年9月1日北府社助字第0950588301號函,永久,10000000.00,1,1120104,,,,"董事印鑑。
修正捐助章程第1、2、4~24條條文，並新增第25~27條條文。",,,,
112法登他000005,1,2,張惠芳,1506,1120104,1120104,1120105,50冊1頁,2,3,蔡永輝,財團法人新北市私立宗聖社會福利慈善事業基金會,1060202,新北市板橋區文化路1段266號22樓之1,以辦理社會福利慈善事業為目的。,由釋迦聖如、蔡永輝、王碧嬌等3人捐助,新北市政府中華民國106年1月20日新北府社助字第1060093577號函,永久,17499497.00,1,1120104,,,,董事、監察人印鑑。,,,,
112法登他000006,2,2,張惠芳,1702,1120105,1120105,1120106,54冊46頁,2,3,林錦蓮,社團法人台灣永續發展教育協會,1071122,新北市土城區延吉街78巷1弄6號,以推動終生教育為宗旨。,入會費、常年會費、事業費、會員捐款、委託收益、基金及其孳息、其他收入,內政部中華民國107年10月8日台內團字第1070068352號函,永久,104015.00,1,1120106,,,,"理監事印鑑。
修正章程第15、17、19、30條條文。",,,,
112法登他000007,2,2,張惠芳,872,1120105,1120105,1120107,30冊11頁,2,4,蔡宗成,社團法人台灣關懷弱勢協會,0990730,新北市土城區中央路2段61巷11號24樓,關懷弱勢、服務弱勢族群。鼓勵弱勢朋友參與，提升弱勢朋友生活觀與價值觀。提供弱勢溫馨、自主和有尊嚴的生活環境。尊重與關心弱勢，肯定生命的意義。喚起社會大眾對弱勢朋友的認識與關懷。提升兩岸弱勢慈善、社會福利發展交流。,入會費、常年會費、事業費、會員捐款、委託收益、基金及其孳息、其他收入。,內政部中華民國99年7月6日台內社字第0990126308號函,永久,10000.00,1,1120105,,,,"理監事印鑑。
會址遷移至新北市土城區中央路2段61巷11號24樓。",,,,
112法登他000008,1,2,張惠芳,716,1120106,1120106,1120107,25冊4頁,2,6,周錫瑋,財團法人中華永續城市發展教育基金會,0961109,新北市土城區承天路18號,以推展公益教育事務及學術交流為宗旨,由麗源建設股份有限公司、麗寶建設股份有限公司及雙和工程有限公司共同捐助。,臺北縣政府96年11月2日北教社字第0960720346號函,永久,5000000.00,1,1120106,,,,"董事印鑑。
修正捐助章程第2、6、15條條文。",,,,
112法登他000009,1,2,張惠芳,2110,1120106,1120106,1120107,62冊38頁,1,1,沈朝標,財團法人王少柏慈善基金會,1101208,新北市土城區大安路2號5樓,以社會福利慈善事業為目的。,由王少柏捐助,衛生福利部中華民國110年11月23日衛授家字第1105002641號函,永久,202556473.00,1,1120106,,,,新任董事印鑑。,,,,
112法登他000010,1,2,張惠芳,180,1120107,1120107,1120109,7冊13頁,1,18,連勝彥,清傳學校財團法人,0550504,新北市三重區五谷王北街141巷1號,以遵照國家教育政策暨現行法令之規定，辦理私立清傳高級商業職業學校，並謀其健全發展為目的。,由連清傳先生捐助,台灣省政府五十五年四月八日教三字第二七五六二號,永久,95674747.00,1,1120107,,,,,,,,
112法登他000011,1,2,張惠芳,200,1120109,1120109,1120110,7冊53頁,1,10,卓敏枝,財團法人台大商學會計文教基金會,0840626,新北市永和區中和路343號15樓之1,以提昇商學會計學術研究及教育水準為宗旨,由卓敏枝等人捐助,台北縣政府八十四年五月二十七日北府教三字第一八四一一０號函,永久,30000000.00,1,1120109,,,,,,,,
112法登他000012,1,2,張惠芳,186,1120109,1120109,1120110,7冊25頁,2,19,鄭蕭秀華,東海中學學校財團法人,0590820,新北市三重區忠孝路3段93巷12號,為遵照國家教育政策暨現行教育法令之規定，辦理高級中學，並謀其健全發展。,由查綏之等人捐助,台灣省政府教育廳五十九年六月二十六日教二字第四六六五０號,永久,918793557.00,1,1120109,,,,董事、監察人印鑑。,,,,
112法登他000013,1,2,張惠芳,414,1120109,1120109,1120110,15冊1頁,1,13,李忠成,財團法人崇德文化教育基金會,0750207,新北市中和區圓通路367巷33弄34之6號,以發揚中華固有倫理道德文化，倡導終身學習暨弘揚一貫道道義，進而獎助各界研究一貫道道統傳承與學術思想，促進世界大同為宗旨。,由韓雨霖、陳鴻珍等人捐助。,"教育部七十四年十月二日台(七四 )高字第四二七八０號函",永久,1087834920.00,1,1120109,,,,,,,,
112法登他000014,1,2,張惠芳,102,1120109,1120109,1120110,4冊37頁,2,11,連勝彥,財團法人清傳商職文教基金會,0820413,新北市三重區五谷王北街141巷1號,以協助清傳商職學校改善環境，發展校務，獎勵教師研究進修，促進學生敦品勵學為宗旨。,由連清傳等人捐助,台北縣政府八十二年四月八日北府教三字第一一七二八五號函,永久,9000000.00,1,1120109,,,,董事印鑑。,,,,
112法登他000015,2,2,張惠芳,2188,1120110,1120110,1120111,63冊45頁,2,13,鄭文燦,社團法人中華民國足球協會,0980427,新北市新莊區中央路730號2樓,以發展足球運動，辦理全國性及國際性之足球比賽，藉以提高技術水準，增進健康為宗旨。,會員年費、行銷、罰款、符合中華民國足球協會目標精神的其他捐款與收入。,內政部中華民國62年6月23日台內社字第529047號函,永久,8763783.00,1,1120110,,,,理監事印鑑。,,,,
112法登他000016,1,2,張惠芳,1097,1120110,1120110,1120111,37冊26頁,1,4,徐魁標,財團法人新北市基督教林口靈糧堂,1011211,新北市林口區文化一路一段93號4樓之1、2,以傳揚基督教教義，增進社會福祉、推動教育、文化、公益、慈善等事業為宗旨。,由財團法人台北市中國基督教靈糧世界佈道會台北靈糧堂捐助。,新北市政府中華民國101年12月4日北府民宗字第1012966773號函,永久,14100039.00,1,1120110,,,,變更董事馮啓文印鑑及第4屆董事名冊。,,,,
112法登他000017,1,2,張惠芳,417,1120110,1120110,1120111,15冊7頁,1,8,鄭傑夫,財團法人葫蘆教育基金會,0890620,新北市中和區水源路132巷7號5樓之1,以致力於藝文、文教幼兒活動的推廣，公共政策的研究規劃及居民社區意識的建立，以營造平安新故鄉為宗旨。,由陳茂正捐助,台北縣政府八十九年六月一日八九北府教社字第一九九九一八號函,永久,10000000.00,1,1120110,,,,,,,,
112法登他000018,1,2,張惠芳,332,1120111,1120111,1120112,12冊17頁,2,9,黃林玲玲,財團法人新莊國小教育基金會,0871105,新北市新莊區中正路86號,以推行文教活動，協助發展校務為宗旨。,由徐金壽等人捐助,台北縣政府八十七年十月十三日北府教三字第三二三三六五號函,永久,7177550.00,1,1120111,,,,董事印鑑。,,,,
112法登他000019,2,2,張惠芳,1497,1120111,1120111,1120112,49冊22頁,2,3,魏碧貞,社團法人台灣新巨輪服務協會,1051222,新北市土城區承天路43巷10號,輔導身心障礙和新住民的就業、創業、技藝與職業訓練為主要目的,入會費、常年會費、事業費、會員捐款、委託收益、基金及其孳息、其他收入,內政部中華民國105年11月23日台內團字第1050076594號函,永久,860106.00,1,1120112,,,,"理監事印鑑。
法人圖記變更。",,,,
112法登他000020,2,2,張惠芳,1303,1120116,1120116,1120117,43冊28頁,2,3,盛連金,社團法人台灣愛心三六五藝文關懷協會,1040126,新北市板橋區中正路25巷17號5樓,本會為依法設立、非以營利為目的之社會團體，以即時行善為理念、文化藝術為媒介、促進社會和諧為願景，致力推動各項藝文及公益活動為宗旨。,入會費、常年會費、永久會費、事業費、會員捐款、委託收益、基金及其孳息、其他收入,內政部中華民國103年12月5日台內團字第1030317137號函,永久,526882.00,1,1120116,,,,"理監事印鑑。
修正章程第15、17條條文。",,,,
112法登他000021,1,2,張惠芳,280,1120116,1120116,1120117,10冊33頁,1,17,林瀚東,財團法人林柏壽文教基金會,0611110,新北市板橋區府中路169號9樓,以辦理與教育文化有關之公益性業務為主要目的，並得設置獎助學金。,由林柏壽捐助,台北縣政府六十一年十月三十日北府教二字第一三九七三四號,永久,33129505.00,1,1120116,,,,,,,,
112法登他000022,2,2,張惠芳,1754,1120116,1120116,1120117,55冊48頁,1,1,林武雄,社團法人新北市菜寮舍人公信眾會,1080513,新北市三重區大同南路143巷3號,本會以秉持舍人公忠義才德之精神及感念保佑社稷之恩澤，宏揚善思推行正念以濟世助人。,入會費、常年會費、事業費、會員捐款、委託收益、基金及其孳息、其他收入,新北市政府中華民國108年4月10日新北府社團字第1080538512號函,永久,630000.00,1,1120116,,,,"修正章程標題及第1條條文。
法人圖記變更。",,,,
112法登他000023,1,2,張惠芳,46,1120117,1120117,1120118,2冊43頁,1,14,丘寧世,財團法人新北市私立竹林國民小學附設幼兒園,0790313,新北市中和區華新街143巷12號,為創辦新北市私立竹林國民小學附設幼兒園，並謀其發展之目的。,由創辦人捐助,台北縣政府七十九年二月二十六日北府教二字第六一四二五號函,永久,5686462.00,1,1120117,,,,,,,,
112法登他000024,1,2,張惠芳,111,1120117,1120117,1120118,4冊55頁,1,16,許耀基,財團法人黎明技術學院,0580818,新北市泰山區泰林路3段22號,為培植工業專門人才，響應政府獎勵私人興學，並為供應黎明技術學院所需之一切設備及經費。,由許添地等人捐助,教育部五十八年六月十二日58專字第一一三九二號函,永久,1676820909.00,1,1120117,,,,新任董事、監察人印鑑。,,,,
112法登他000025,1,2,張惠芳,410,1120117,1120117,1120118,14冊53頁,2,8,楊玉良,財團法人錦和高中文教基金會,0890415,新北市中和區錦和路163號,以獎助品學兼優或家境清寒學生、協助本校改善教育環境及發展校務為目的。,由邱垂益等人捐助,臺北縣政府八十九年三月二十日八九北府教社字第０九八三六０號函,永久,2000000.00,1,1120117,,,,"董事印鑑。
修正捐助暨組織章程第1、2、4~17條條文。",,,,
112法登他000026,1,2,張惠芳,1237,1120118,1120118,1120119,42冊2頁,1,4,陳國勇,財團法人基誠全人發展中心,0910916,新北市板橋區實踐路30號十一樓,本於耶穌基督之精神，以傳遞基督的生命為宗旨。,由周棉花、宋燕燕等二人共同捐助,內政部中華民國91年8月27日台內民字第0910006167號函,永久,47041515.00,1,1120118,,,,"新任董事印鑑。
董事陳肯住所變更為臺中市西區向上路1段56號5樓之1。",,,,
112法登他000027,2,2,張惠芳,908,1120118,1120118,1120119,31冊17頁,2,4,黃雅麗,社團法人中華敦珠顯密法林學會,0991207,新北市樹林區後站街3巷2號11樓,以推廣顯密佛學為基礎，以敦珠傳承教法匡正人心，促進社會公益為宗旨。,入會費、常年會費、事業費、會員捐款、委託收益、基金及其孳息、其他收入。,內政部中華民國99年9月19日台內社字第0990220215號,永久,15005000.00,1,1120118,,,,理監事印鑑。,,,,
112法登他000028,1,2,張惠芳,1190,1120118,1120118,1120119,40冊29頁,1,3,蔡賢嶔,財團法人儒鴻教育基金會,1021118,新北市新莊區中央路738號,以回饋社會、培育人才、鼓勵創新、促進產學合作、提升社會文化涵養、關懷弱勢族群及社會公益為宗旨。,由儒鴻企業股份有限公司、洪鎮海先生、蔡賢嶔先生等11人共同捐助。,教育部中華民國102年11月11日臺教社（三）字第1020167507號函,永久,31000000.00,1,1120118,,,,修正捐助章程第2、4、15條條文。,,,,
112法登他000029,1,2,張惠芳,339,1120118,1120118,1120119,12冊31頁,1,11,劉謙馴,財團法人新北市召會新莊會所,0610225,新北市新莊區民樂街75號,以成立聚會所，傳揚基督，引人歸主，並舉辦慈善育英公益事業為宗旨。,由信徒捐助,台北縣政府六十一年二月十二日北府民一字第二二二五一號,永久,112381191.00,1,1120118,,,,,,,,
112法登他000030,1,2,張惠芳,1323,1120118,1120118,1120119,44冊8頁,1,16,林宜真,財團法人山葉音樂振興基金會,0640917,新北市板橋區遠東路3號二樓,以推廣全民音樂提高國民音樂水準為宗旨。,由台北市私立山葉音樂短期補習班及台灣山葉樂器製造股份有限公司共同捐助。,教育部中華民國64年9月13日（六四）社字第23815號函,永久,1000000.00,1,1120118,,,,新任董事印鑑。,,,,
112法登他000031,1,2,張惠芳,2238,1120130,1120130,1120201,64冊45頁,1,1,李貞慧,財團法人台灣學傳慈善基金會,1110615,新北市新莊區新樹路797號8樓,本會以舉辦或捐贈社會福利慈善事業為目的。,由李學傳捐助。,衛生福利部111年6月7日衛授家字第1110002921號,永久,30000000.00,1,1120130,,,,變更捐助章程第3條條文。,,,,
112法登他000032,2,2,張惠芳,19,1120130,1120130,1120201,1冊37頁,2,11,黃志彰,社團法人新北市警察之友會,0820617,新北市板橋區府中路32號1樓,以結合本市熱心促進警民合作，協同防範犯罪，擴大安全宣導，強化治安功能為宗旨。,入會費、常年會費、有關機關補助、事業費、會員贊助、委託收益、基金及其孶息、其他收入。,八十一年十二月二日台北縣政府北府社一字第四一０七三三號函。,永久。,14415891.00,1,1120131,,,,"理監事印鑑。
修正章程第7、23、25條條文。",,,,
112法登社000001,2,1,張惠芳,2232,1120104,1120104,1120106,64冊39頁,,,林鈺詔,社團法人新北市菩提心願慈善會,1120104,新北市板橋區松柏街33巷16號,本會以結合民間團體，關懷弱勢，濟貧扶弱，參與社會公益、慈善活動，宣揚佛陀教義，端正社會風氣、啟迪民心，利益十方眾生為宗旨。,入會費、常年會費、會員捐款、委託收益、基金及其孳息、其他收入。,新北市政府中華民國111年9月20日新北府社團字第1111740425號函,永久,101234.00,1,1120104,,,,,,,,
112法登社000002,2,1,張惠芳,2233,1120111,1120111,1120113,64冊40頁,,,楊隆榮,社團法人中華新住民關懷協會,1120111,新北市五股區五工一路123號2樓,以助新住民快速瞭解台灣民俗風情並融入社會，營造新住民歸屬感落地生根，並協助及輔導就業，以協助政府及結合民間資源，共同創造新住民友善生活環境，用以促進國家安全、社會安定、家庭幸福美滿乃本會之創立宗旨。,入會費、常年會費、事業費、會員捐款、委託收益、基金及其孳息、其他收入,內政部中華民國111年12月2日台內團字第1110055103號函,永久,5000.00,1,1120111,,,,,,,,
112法登社000003,2,1,張惠芳,2234,1120111,1120111,1120113,64冊41頁,,,洪金龍,社團法人五股代天府協進會,1120111,新北市五股區成泰路1段235號之12地下1層之3,本會以遵照道廟禮制，安祀配神，以弘揚道教教義、樹立民間正信、宣導主神聖蹟、革除不良習俗，激發人心向善、促進社會和諧、復興民族文化、保存民族精神；運作五股代天府事務並興辦公益慈善及文化教育建設等事務為宗旨。,入會費、常年會費、事業費、會員捐款、委託收益、基金及其孳息、其他收入,新北市政府中華民國109年5月5日新北府社團字第109082581號函,永久,6078910.00,1,1120111,,,,,,,,
112法登社000004,2,1,張惠芳,2235,1120112,1120112,1120116,64冊42頁,,,游美玉,社團法人快樂希望種子關懷協會,1120112,新北市土城區金城路3段176號B1,以本著基督耶穌的愛和精神，關懷幫助現今日益嚴重的家庭，能有個健康快樂的家；並關懷幫助日加增多的弱勢家庭，及有需要有問題的孩子(兒童和青少年)，和老人的需要，使他們能感受到愛，有希望，作個快樂的人為宗旨。,入會費、常年會費、事業費、會員捐款、委託收益、基金及其孳息、其他收入,內政部中華民國105年9月5日台內團字第1050050310號函,永久,5450.00,1,1120112,,,,,,,,
112法登社000005,2,1,張惠芳,2236,1120130,1120130,1120201,64冊43頁,,,莊閔傑,社團法人台灣海洋能發展協會,1120130,新北市中和區民享街4號G棟2樓,以結合國內外產官學研各界資源力量，共同推動台灣海洋能產業發展、從事海洋能推廣教育、政策研究、人才培育，促進海洋能產業的蓬勃發展為創立宗旨。,入會費、常年會費、事業費、會員捐款、委託收益、基金及其孳息、其他收入,內政部中華民國111年10月17日台內團字第1110047623號函,永久,1000.00,1,1120130,,,,,,,,
112法登社000006,2,1,張惠芳,2237,1120130,1120130,1120201,64冊44頁,,,楊傳蓮,社團法人亞洲創新教育發展協會,1120130,新北市林口區忠孝路95號,以致力於推展各國實驗教育與本土教育的融合與創新為宗旨。,入會費、常年會費、事業費、會員捐款、委託收益、基金及其孳息、其他收入,內政部中華民國111年11月16日台內團字第1110053211號函,永久,5000.00,1,1120130,,,,,,,,
112法登社000007,2,1,張惠芳,2239,1120130,1120130,1120201,64冊46頁,,,吳燦城,社團法人中華美學手藝發展協會,1120130,新北市五股區民義路1段60號4樓,以發展全方位美學、藝術、文創及各項手作、手藝技術，透過各類活動、課程推廣，傳承與創新，並培養人才，協物就業或創業，落實身心靈美學生活，增進國人手藝專長研習為宗旨。,入會費、常年會費、事業費、會員捐款、委託收益、基金及其孳息、其他收入,內政部中華民國111年10月6日台內團字第1110048513號函,永久,1000.00,1,1120130,,,,,,,,
