登記案號,類別,案由,主任,登記號數,收件日期,登記日期,公告日期,登記簿,任期判定,屆期判定,法人代表,法人名稱,設立登記日期,主事務所,目的,捐助方法,許可機關日期,存立時期,財產總額,結案原因,結案日期,歸檔日期,發證日期,代理人,代理人住址,郵遞區號,第二個代理人,第二個代理人住址,郵遞區號,送達代收人姓名,送達代收人住址,郵遞區號,清算人,變更原因,註銷日期,撤銷日期,撤(註)銷機關文號,撤(註)銷原因
062法登000001,1,2,唐志明,7,0620330,0620330,0620403,-1冊7頁,2,2,董事長,財團法人屏東縣私立美和中學,0520715,屏東縣內埔鄉美和村學人路三二三號,"以創辦私立美和初級中學,並謀其發展為目的.",由徐傍興捐助,六十二年二月一日台灣省教育廳(六十二年),永久,6276859.00,1,0620331,0620430,0620430,,,,,,,,,,,,,,,
062法登000003,1,2,周鴻禹,19,0620323,0620323,0620326,1冊3頁,2,2,尤丁財,財團法人屏東市教會聚會所,0560929,屏東市北平路三十六號,以傳基督引人歸主為目的,由眾聖徒所奉獻,台灣省屏東縣政府，中華民國五十六年九月十三日,永久,160050.00,1,0620323,0931014,,,,,,,,,,,,,,,,
062法登000004,1,1,洪有川,35,0620522,0620522,0620522,1冊19頁,,0,李德銓,財團法人私立日新高級工商職業學校,0620522,屏東縣潮州鎮太平路二二四號,協助政府發展職業教育培養工商企業人才,由董事會捐助,五十八年十月十七日,永久,13807171.00,1,0881214,0931014,,,,,,,,,,,,,,,,
062法登000005,1,2,,9,0620609,0620609,0620612,1冊10頁,1,0,董事長,財團法人屏東縣私立屏信中學,0530218,屏東市瑞光里民生東路十二號,協助政府發展職業教育,由屏東市信用合作社捐助,五十一年一月二十九日台灣省政府教育廳，教二字第一三七０九號,無限期,2000000.00,1,0620609,0620618,,,,,,,,,,,,,,,,
062法登000008,1,2,周鴻禹,22,0620628,0620628,0620630,1冊6頁,2,2,鍾炳堂,財團法人台灣省屏東縣私立志成高級商工職業學校,0580501,屏東縣潮州鎮彭城里彭城路三一五號,創立私立志成商業職業學校並謀其發展,由吳騰耀捐贈,中華民國五十六年六月一日,永久,9428224.00,1,0620628,0931014,,,,,,,,,,,,,,,,
062法登000013,1,2,周鴻禹,17,0631128,0631128,0631201,1冊1頁,2,3,董事長,財團法人私立永達工業專科學校,0560725,屏東縣麟洛鄉麟蹄村五鄰中山路三一六號,為供應私立永達工業專科學校所需之一切設備及經費。,由創辦人車轟等捐助,中華民國五十六年六月十日，教育部，台(五六)高字第九八四一號,永久,5000000.00,1,0631128,0931014,,,,,,,,,,,,,,,,
