登記案號,類別,案由,主任,登記號數,收件日期,登記日期,公告日期,登記簿,任期判定,屆期判定,法人代表,法人名稱,設立登記日期,主事務所,目的,捐助方法,許可機關日期,存立時期,財產總額,結案原因,結案日期,歸檔日期,發證日期,清算人,變更原因,註銷日期,撤銷日期,撤(註)銷機關文號,撤(註)銷原因
114法登他000002,2,2,范碩真,236,1140106,1140106,1140106,5冊106頁,2,2,理事長蔡國章,社團法人苗栗縣廣興文化協會,1100526,苗栗縣竹南鎮大厝里10鄰獅山5-3號,現今社會的需求了解與關懷、照顧與服務的精神，應該植根於社會的基層，和需求服務最殷切的地方，向不同階層的人士，提供各種服務，不拘族群、不問性別，亦無分信仰，即可消除人與人之間的隔閡，改變自私自利和不公不義的架構，開闢溝通的管道，顯示人類大愛之精神，進而建構一個真正符合人性，充滿同情、寬恕、和諧與友愛精神的社會為宗旨,入會費、常年會費、會員捐款、其他收入、基金及其孳息、委託收益,苗栗縣政府110年1月13日府社行字第1100008523號函,永久,2605545.00,1,1140106,,1140106,,第1屆理事長、常務理事、理事、常務監事、監事任期屆滿，改選第2屆事長、常務理事、理事、常務監事、監事,,,,
114法登他000004,1,2,范碩真,51,1140204,1140206,1140206,3冊31頁,2,9,董事長徐享崑,財團法人永續城鄉發展文教基金會,0881119,苗栗縣公館鄉石墻村15鄰石墻8號,結合國內外熱心人仕，共同協力推動各項永續城鄉文教發展工作，以達到城鄉文化教育、社會經濟之永續發展為目的。,"1.由徐福增捐助新臺幣2,000,000元整，作為本基金會設立基金。2.接受外國人仕或企業之捐助。3.政府機關之捐（輔）助或委辦。4.協助政府或民間從事業務相關工作之酬勞。",苗栗縣政府民國88年11月2日88府教社字第8800094189號,永久,2027000.00,1,1140206,,1140206,,第8屆董事長、董事任期屆滿，改選產生第9屆董事長、董事。,,,,
114法登他000005,2,2,范碩真,88,1140205,1140205,1140205,2冊75頁,2,6,理事長陳翠英,社團法人中華民國恩福會,0940215,苗栗縣頭屋鄉中華街91號,非以營利事業為目的之社會團體，以推動社會公益、關懷生命，反毒教育與生命教育為宗旨。,一、入會費。二、常年會費。三、事業費。四、會員捐款。五、委託收益。六、基金及其孳息。七、其他收入。,內政部中華民國93年12月17日台內社字第0930044946號函,永久,40000.00,1,1140205,,1140205,,主事務所變更為苗栗縣頭屋鄉中華街91號,,,,
114法登他000006,2,2,范碩真,201,1140205,1140205,1140205,5冊1頁,2,3,理事長陳翠英,社團法人中華民國更心園關懷協會,1071214,苗栗縣頭屋鄉中華街91號,本會以推動社會公益關懷生命，反毒教育、生命教育和培訓謀生技能，重返社會為宗旨。,入會費、常年會費、事業費、會員捐款、委託收益、基金及其孳息、其他收入,內政部中華民國104年12月30日台內團字第1040087784號函,永久,72008.00,1,1140205,,1140205,,,,,,
114法登他000007,1,2,范碩真,16,1140205,1140206,1140206,1冊88頁,1,13,董事長劉慶輝,財團法人臺灣省苗栗縣私立育民高級工業家事職業學校,0870224,苗栗縣苗栗市水源里8鄰37號,配合國家政策培育青年回饋社會建設國家之目的。,本法人設立時原始捐助之財產總額為新臺幣4055219元，由魏綸洲、魏周梅、陳健治、簡木炎、李茂盛、柯順清、涂麗生、鄒道善、吳金城、林錦銘、林耀宗魏義明、江義雄、周錦文、周增祥等捐助設立。,台灣省政府教育廳59年2月18日教三字第18137號函,永久,151865844.00,1,1140206,,1140206,,"財產總額變更為151,865,844元",,,,
114法登社000001,2,1,范碩真,288,1140103,1140103,1140103,6冊112頁,,,理事長黃仕斌,社團法人大中華行動餐飲創新交流協會,1140103,苗栗縣後龍鎮福寧里1鄰頭湖19-2號,以促進和支持行動餐車產業的健康發展，透過協作、資源共享和行業倡導，營造一個積極向上的營商環境。行動餐車不僅是美食的提供者，更是社區連結的橋樑。未來推動兩岸行動餐飲創新發展交流，共創雙贏、促進行動餐車產業發展、維護行業利益和權益、提供專業支持與資源、促進行業合作與交流、倡導社會責任與可持續發展為宗旨,入會費、常年會費、事業費、會員捐款、委託收益、基金及其孳息、其他收入。,內政部中華民國113年11月15日台內團字第1130044162號函,永久,0.00,1,1140103,,,,,,,,
