登記案號,類別,案由,主任,登記號數,收件日期,登記日期,公告日期,登記簿,任期判定,屆期判定,法人代表,法人名稱,設立登記日期,主事務所,目的,捐助方法,許可機關日期,存立時期,財產總額,結案原因,結案日期,歸檔日期,發證日期,清算人,變更原因,註銷日期,撤銷日期,撤(註)銷機關文號,撤(註)銷原因
114法登他000001,1,2,曾瓊安,700922,1140102,1140102,1140106,4冊23頁,1,12,張循鋰,財團法人秦啓榮烈士紀念基金會,0701012,台北市士林區雨農路二十二號,以紀念山東殉國烈士秦啓榮將軍，並舉辦各項文教公益活動為目的。,捐助,台北市政府教育局70.8.18北市教四字第三一一六一號函,永久,1543411.50,1,1140102,,1140114,,法人捐助章程條文變更並經主管機關臺北市政府教育局113年9月27日北市教終字第1133016759號函核准變更及本院113年度法字第46號民事確定裁定准予變更，變更內容詳如章程修正條文對照表。,,,,
114法登他000002,2,2,曾瓊安,1717,1140102,1140102,1140106,86冊11頁,2,3,施養仁,社團法人台灣盲人協會,1051107,台北市大同區庫倫街23號2樓,以弘揚人道主義思想，發展盲人事業。代表盲人共同利益，反映盲人特殊需求，為盲人服務，維護盲人合法權益，促進盲人平等、充分參與社會生活為宗旨。,入會費、常年會費、事業費、會員捐款、委託收益、基金及其孳息、其他收入,內政部中華民國105年10月6日台內團字第1050061275號函,永久,0.00,1,1140102,,1140114,,全體理、監事印鑑式。,,,,
114法登他000003,1,2,曾瓊安,2349,1140102,1140102,1140106,117冊19頁,1,4,蔡慧玲,財團法人台灣尤努斯基金會,1040518,台北市南港區忠孝東路6段21號11樓之6,本會以辦理社會福利慈善事業為目的，推動並落實諾貝爾和平獎得主尤努斯教授建立社會型企業之扶貧理念為宗旨。,由蔡慧玲等捐助成立,衛生福利部中華民國104年5月8日部授家字第1040500369號函,永久,48000000.00,1,1140102,,1140114,,,,,,
114法登他000004,1,2,曾瓊安,1552,1140102,1140102,1140106,78冊6頁,2,4,焦佑麒,財團法人彩晶文教基金會,1031024,台北市內湖區行善路168巷17號6樓,以提升教育品質及培力能力為宗旨。,設立基金共新台幣伍佰萬元整，由瀚宇彩晶股份有限公司捐助。俟本基金會依法完成財團法人登記後，得繼續接受捐贈。,臺北市政府文化局中華民國103年10月17日北市文化文創字第10331808400號函,永久,30000000.00,1,1140102,,1140114,,"全體董事印鑑式。
法人捐助章程條文變更並經主管機關臺北市政府文化局113年8月1日北市文化文創字第1133017957號函同意變更及本院113年度法字第19號民事確定裁定准予變更，變更內容詳如章程修正條文對照表。
主管機關改隸為教育部。",,,,
114法登他000005,1,2,曾瓊安,1660,1140102,1140102,1140106,83冊14頁,2,4,簡又新,財團法人中鼎教育基金會,1050216,台北市北投區福善路16號2樓,以提昇永續發展教育、培育永續及創新人才、獎勵永續及前瞻研究、推廣企業社會責任教育、推動大學永續發展為宗旨。,設立基金共新臺幣三千萬元整，由中鼎工程股份有限公司捐助；俟依法完成法人登記後，得繼續接受捐贈,教育部中華民國105年1月27日臺教社（三）字第1040172971號函,永久,30000000.00,1,1140103,,1140114,,全體董事印鑑式。,,,,
114法登他000006,1,2,曾瓊安,639,1140102,1140102,1140106,32冊34頁,2,8,范瑞穎,財團法人福臨文化藝術基金會,0911121,台北市內湖區洲子街75號4樓之1,本基金會以保存文化藝術資產、推廣文化暨藝術教育、提昇文化生活品質人文素養、培養人才及鼓勵藝術欣賞、促進世界文化藝術交流為宗旨。,設立基金共新台幣壹仟萬元整，由范瑞穎先生捐助；俟完成法人登記後，得繼續接受捐贈,台北市政府文化局中華民國91年11月11日北市文化四字第09131514800號函,永久,10000000.00,1,1140103,,1140114,,全體董事印鑑式。,,,,
114法登他000007,1,2,曾瓊安,2597,1140102,1140102,1140106,130冊7頁,1,9,江天愛,財團法人臺北市新圓融教育基金會,0870731,台北市大同區重慶北路2段30號,本會以弘揚我國禪學思想及教化人心，寓意以家庭團圓，社會融合，各族團結，世界和平，圓滿通達為宗旨。,由陳怡魁、王桂萍、陳美惠、陳美華、陳文祥、陳楊月子、余若陶、余兆一、吳宏安等人捐助。,臺北市政府教育局68年1月18日　北市教四字第190號函,永久,1000000.00,1,1140103,,1140114,,"法人捐助章程第1條、第2條、第3條、第4條、第5條及第15條條文變更並經主管機關臺北市政府教育局113年9月26日北市教終字第1133018316號函核准變更及臺灣臺北地方法院113年度法字第166號民事確定裁定准予變更，變更內容詳如章程修正對照表。
新法人圖記。",,,,
114法登他000010,1,2,曾瓊安,1820,1140105,1140114,1140115,91冊14頁,2,3,杜奕瑾,財團法人台灣人工智慧發展基金會,1070105,台北市大同區承德路1段70號6樓,以推動台灣人工智慧產業，加速台灣人工智慧科學技術研究發展，與推廣台灣人工智慧應用為目的。,設立基金共新臺幣參仟萬元整，由美商人工智慧發展有限公司台灣分公司捐助；俟依法完成法人登記後，經董事會決議後得接受各界之捐贈,科技部中華民國106年12月28日科部綜字第1061012360號函,永久,30000000.00,1,1140114,,1140123,,"全體董事印鑑式。
法人捐助章程條文變更並經主管機關國家科學及技術委員會113年10月17日科會綜字第1130065871號函同意變更及臺灣臺北地方法院113年度法字第172號民事確定裁定准予變更，變更內容詳如章程修正條文對照表。",,,,
114法登他000011,1,2,曾瓊安,750,1140103,1140106,1140108,38冊7頁,2,13,鄒永中,財團法人鄒氏文教基金會,0780811,台北市士林區基河路22號3樓,以獎掖社會在學青年，敦品勵學，奮發向上，期達培育人才，蔚為國用為宗旨。,"設立基金計 新台幣貳佰萬元整，由國內本姓宗親熱心人士分別捐助，俟依法完成法人登記後，得繼續接受捐贈","教育部78年6月1日  台北（78）高字第25688號函",永久,7000000.00,1,1140106,,1140116,,全體董事印鑑式。,,,,
114法登他000012,1,2,曾瓊安,176,1140106,1140106,1140108,9冊11頁,2,10,周宜宏,財團法人王文浩放射線醫學基金會,0821125,臺北市內湖區南京東路6段348號4樓,以協助推廣放射線醫學之研究發展，培養放射線相關之醫學人才及提高放射線醫學水準為目的。,由湳開股份有限公司王文浩先生遺孀劉菊貞女士捐助新台幣壹仟萬元為設立基金。嗣後並得繼續接受國內外自然人、法人、機構或團體之捐贈。,行政院衛生署82.10.20衛署醫字第8267703號函,永久,66669864.00,1,1140107,,1140116,,全體董事印鑑式。,,,,
114法登他000013,2,2,曾瓊安,1356,1140106,1140106,1140108,68冊10頁,2,3,鄭卉妡,社團法人中華心蓮心公益協會,1010425,台北市內湖區瑞光路122巷71弄1號,結合愛護公益社會人士，以倡導並促進社會善良風俗，幫助及照顧弱勢族群，發揚人溺己溺之精神，並促使全國各縣市弱勢族群喪葬、貧病、急難、孤兒鰥寡等獲得救助，以促進社會之和諧，造福社會為宗旨。,入會費、常年會費、事業費、會員捐款、委託收益、基金及其孳息、其他收入,內政部100年9月13日台內社字第1000181309號函,永久,6400.00,1,1140107,,1140116,,全體理、監事印鑑式。,,,,
114法登他000014,1,2,曾瓊安,1652,1140106,1140106,1140108,83冊6頁,1,3,翁元臻,財團法人佛教如來宗如來實證基金會,1041225,台北市內湖區民權東路6段180巷6號12樓,"一﹑弘揚佛教如來宗宗師  妙禪師父教化之明心見性，見性成佛，利益十方眾生。
二﹑依教奉行，實踐  妙禪師父悲智願行，實證  妙禪師父法偈所開示「末法眾生苦，妙禪住世渡，佛子滿天下，聖花佛果實。」為千秋萬世如來正法奠基。",設立基金新台幣參仟萬元整，由社團法人佛教如來宗如來實證協會捐助；嗣後得繼續接受個人或有關單位之捐贈（獻）,內政部中華民國104年12月14日台內民字第1041105712號函,永久,30000000.00,1,1140107,,1140116,,繼任董事印鑑式。,,,,
114法登他000015,1,2,曾瓊安,330,1140106,1140106,1140108,16冊39頁,1,9,廖武治,財團法人保生文教基金會,0860731,台北市大同區哈密街61號,以推動文化藝術教育為宗旨。,設立基金新台幣參仟萬元整，由財團法人台北保安宮捐助。俟完成登記後，得繼續接受捐贈。,教育部86.7.7.台(86)社(四)字第86077794號函,永久,95000000.00,1,1140107,,1140116,,繼任董事印鑑式。,,,,
114法登他000016,1,2,曾瓊安,1612,1140106,1140106,1140108,81冊6頁,1,15,尹慶中,財團法人台灣非破壞檢測協會,0690229,新北市淡水區中正東路2段27之3號24樓,以協助政府推動經濟建設，加速工業升級，及協助公民營企業機構建立非破壞檢測制度，促進非破壞檢測技術之發展為宗旨。,設立基金共新台幣貳佰貳拾萬元整，由中國造船股份有限公司等11個單位捐助，嗣後得接受各方之捐助,經濟部中華民國68年7月9日經（六八）工字第第20735號函,永久,7182112.00,1,1140107,,1140116,,繼任董事印鑑暨簽名式。,,,,
114法登他000017,1,2,曾瓊安,906,1140106,1140106,1140108,45冊20頁,2,7,吳秀光,財團法人昇恒昌基金會,0951025,台北市內湖區新湖二路289號,以確保觀光事業永續發展、提昇國際旅客服務品質、發展免稅商店國際接軌、促進國際交流合作、舉辦社會公益活動為宗旨。,由昇恒昌股份有限公司捐助，俟完成登記後，得繼續接受捐贈,"交通部  中華民國95年10月19日交路字第0950010035號函",永久,650000000.00,1,1140107,,1140116,,全體董事印鑑式。,,,,
114法登他000018,1,2,曾瓊安,152,1140106,1140106,1140108,8冊3頁,1,10,方嘉男,財團法人東吳經濟系校友基金會,0820219,新北市汐止區國興街30巷26號5樓,以服務系友，回饋母校為宗旨。,設立基金共新台幣伍佰伍拾萬元整，由陳鴻智等人捐助；俟依法完成法人登記後，得繼續接受捐助,台北縣政府82年1月29日八二北府教三字第28159號函,永久,5500000.00,1,1140107,,1140116,,繼任董事印鑑式。,,,,
114法登他000019,1,2,曾瓊安,520199,1140107,1140107,1140108,1冊91頁,1,18,"尹 冀",財團法人台北市私立體惠育幼院,0521021,台北市北投區中和街399之8號,以「基督之愛」收容教養，輔導社會失依兒童少年生活及升學為目的。,財產孳息、業務收入、地方捐助、政府補助、其他收益,台北市政府社會局52年1月1日,永久,434528.00,1,1140107,,1140116,,"繼任董事印鑑式。
法人捐助章程條文變更並經主管機關臺北市政府社會局113年4月11日北市社兒少字第1133049772號函收訖備查及本院113年度法字第47號民事確定裁定准予變更，變更內容詳如章程修訂條文對照表。
新法人圖記。",,,,
114法登他000020,1,2,曾瓊安,2057,1140107,1140108,1140110,103冊11頁,1,2,陳名聖,財團法人李美蓉癌症醫學研究基金會,1090319,台北市士林區天母西路41巷2之1號1樓,以獎勵癌症醫學研究發展、培養研究人才及提升醫療水準為目的,"由王秋雄先生一人捐助新臺幣30,000,000元為設立基金。嗣後並得繼續接受國內外自然人、法人、機構或團體之捐贈。",衛生福利部中華民國109年3月12日衛部醫字第1091661129號函,永久,440100000.00,1,1140108,,1140120,,,,,,
114法登他000021,2,2,曾瓊安,2093,1140107,1140108,1140110,105冊7頁,2,2,康力,社團法人台灣YWAM福音協會,1090609,新北市淡水區英專路2巷4號5樓,以廣傳福音、拓荒宣教、門徒培訓、慈惠服務等訓練，並與國際連結，全人培育本國及國際基督徒投入宣教福音事工，完成宣教大使命與榮神益人為宗旨。,入會費、常年會費、事業費、會員捐款、委託收益、基金及其孳息、其他收入,內政部中華民國109年4月6日台內團字第1090018965號函,永久,14100.00,1,1140108,,1140120,,全體理、監事印鑑式。,,,,
114法登他000022,2,2,曾瓊安,2091,1140108,1140108,1140110,105冊5頁,2,5,汪金水,社團法人新北市佛理慈善功德會,1090603,新北市淡水區北新路33號4樓,以慈悲濟世，救人自救，不分男女老幼，教化人心，以營造溫馨社會為宗旨。,入會費、常年會費、會員捐款、委託收益、基金及其孳息、其他收入,臺北縣政府中華民國97年11月26日北府社團字第0970883974號,永久,412750.00,1,1140108,,1140120,,全體理、監事印鑑式。,,,,
114法登他000023,1,2,曾瓊安,690849,1140108,1140108,1140110,4冊9頁,1,12,廖武治,財團法人台北保安宮,0690328,台北市大同區哈密街61號,以闡揚宗教教義提倡敬奉神明，並管理本法人財產及辦理社會公益事業為宗旨。,設立財產總額新台幣壹億壹仟零壹拾肆萬貳仟零貳拾肆元均由捐助人台北保安宮管理委員會捐助及信眾樂捐，嗣後得繼續接受樂捐,台北市政府民政局69.2.28北市民三字第1466號,永久,997442161.00,1,1140108,,1140120,,繼任董事印鑑式。,,,,
114法登他000024,1,2,曾瓊安,1577,1140108,1140108,1140110,79冊11頁,1,8,吳慶堂,康寧學校財團法人,0890218,台北市內湖區康寧路3段75巷137號,為響應私人捐資興學，培養國家高級學術人才之目的，設立康寧學校財團法人。,設立時之財產總額為新台幣貳億元整，由王榮昌、林政則、王純德等人捐助設立（詳如捐助人名冊及捐助財產清冊）；嗣後並得繼續接受國內外之個人、法人或團體之捐贈,教育部中華民國88年9月29日台八八高三字第88117128號函,永久,4308188184.00,1,1140109,,1140120,,,,,,
114法登他000025,1,2,曾瓊安,540245,1140109,1140109,1140110,2冊13頁,1,19,林博彥,財團法人真理大學,0540909,新北市淡水區真理街32號,為達成教學及學術研究，自由探討真理，培養人格，服務社會，促進國際間學術交流，榮神益人之目的，設立財團法人真理大學。,設立基金新台幣陸佰貳拾萬元，由北部臺灣基督長老教會大會，熱心信徒及社會各界人士捐助，嗣後並得繼續接受國內外之個人、法人或團體之捐贈,教育部54.8.26台(54)高字第13242號函,永久,4121520945.00,1,1140109,,1140120,,繼任董事印鑑式。,,,,
114法登他000027,1,2,曾瓊安,530217,1140110,1140110,1140113,1冊97頁,1,15,林忠榮,財團法人全國林姓宗廟,0530601,台北市大同區重慶北路1段73號10樓,以闡揚祖德敦睦宗誼增進宗親福利，樹立團結互助精神為目的。,捐助,台北市政府民政局53.3.14(53)北市民行字第12258號,永久,88531119.89,1,1140110,,1140121,,,,,,
114法登他000028,1,2,曾瓊安,570326,1140109,1140109,1140113,2冊45頁,1,17,林哲弘,中華學校財團法人,0570709,台北市南港區研究院路3段245號,響應政府獎勵私人興學及培育高級科技與管理人才為目的。,設立基金新台幣伍佰萬元整，由中華技術學院創辦人周光中先生捐贈；嗣後並得繼續接受國內外之個人、法人或團體之捐贈,教育部57.7.22台57專字第17859號函,永久,3403992288.00,1,1140110,,1140121,,,,,,
114法登他000029,1,2,曾瓊安,530221,1140109,1140109,1140113,2冊1頁,1,17,陳秋德,惇敍學校財團法人,0530810,台北市北投區泉源路221號,響應政府鼓勵私人興學，配合當地需要，以培養青年俾成為國家社會有用之才為目的。,"由黃次倫先生捐助土地二筆房舍五棟(其價值為新台幣3,951,311.1元正)設立，嗣後並得繼續接受國內外之個人、法人或團體之捐助",台北市政府教育局78.5.19北市教一字第23635號函,永久,172746464.00,1,1140110,,1140121,,,,,,
114法登他000030,2,2,曾瓊安,1949,1140113,1140113,1140115,98冊3頁,2,3,高于棻,社團法人南島魯瑪社,1080419,新北市淡水區山子邊3之5號12樓,以協助原住民在傳統領域土地上自主發展、打造家園為宗旨。,入社費、常年社費、事業費、社員捐款、委託收益、基金及其孳息、其他收入,內政部中華民國108年3月26日台內團字第1080016587號函,永久,24500.00,1,1140113,,1140123,,"新任理事長、常務理事、監事印鑑式。
法人章程條文變更並經主管機關內政部113年12月31日台內團字第1130287260號函予以備查。",,,,
114法登他000031,1,2,曾瓊安,2585,1140113,1140113,1140115,129冊15頁,2,8,杜書伍,財團法人聯強文化藝術基金會,0911218,台北市南港區市民大道8段205號26樓,本會以推廣文化理念，辦理文化活動，創造文化教育與產業之連結為宗旨。,由聯強國際股份有限公司捐助,臺北市政府文化局中華民國91年12月17日北市文化四字第09131724800號函,永久,5000000.00,1,1140113,,1140123,,董事印鑑、簽名。,,,,
114法登他000032,1,2,曾瓊安,391,1140113,1140113,1140115,20冊1頁,1,8,洪鴻榮,法鼓學校財團法人,0871021,台北市北投區公舘路186號,為遵照國家教育政策暨現行教育法令之規定，辦理法鼓學校財團法人，並謀其健全發展。,捐助,教育部87年6月5日台(87)高(三)字第87058532號,永久,7573086794.00,1,1140113,,1140123,,,,,,
114法登他000033,1,2,曾瓊安,540247,1140110,1140110,1140115,2冊15頁,1,18,陳韻如,財團法人德明財經科技大學,0540910,台北市內湖區環山路1段56號,為配合國家政策、服務社會並配合產業發展需求，實踐故陸軍一級上將陳濟棠先生之遺志，在台灣省創辦私立德明商業專科學校(於民國89年4月改制為德明技術學院、96年6月改名為德明財經科技大學)，設立財團法人德明財經科技大學，以培育青年並謀其發展為目的。,捐助設立後得繼續接受國內外之個人、法人或團體之捐贈,教育部54.8.30台(54)高字第1359號函,永久,2721573870.00,1,1140113,,1140123,,繼任董事印鑑式。,,,,
114法登他000034,1,2,曾瓊安,510179,1140113,1140113,1140115,1冊81頁,1,28,王紹堉,財團法人東吳大學,0511110,台北市士林區臨溪路70號,辦理東吳大學並謀其發展為目的。,設立基金總額為新台幣壹仟肆佰柒拾陸萬玖仟肆佰陸拾貳元伍角伍分，由董事會籌募及美國基督教衛理公會贊助,教育部44.11.11台(44)高字第15209號函,永久,7208576285.00,1,1140113,,1140123,,原監察人劉吉人任期屆滿；經董事會決議由劉吉人續任監察人並經教育部113年12月11日臺教高（三）字第113012939號函核定。,,,,
114法登他000035,2,2,曾瓊安,775,1140114,1140114,1140115,39冊25頁,1,5,孟繁毅,社團法人台北市基督教榮耀堂全人關懷協會,0931014,台北市南港區忠孝東路6段465號B2,以結合神職人員及基督徒傳揚基督真理，並以實踐信望愛之精神積極投入全人關懷、身心靈教化及社區服務工作，以造福人群為宗旨。,入會費、常年會費、會員捐款、委託收益、基金及其孳息、其他收入,臺北市政府社會局93年9月7日北市社一字第09337880000號函,永久,17587026.00,1,1140114,,1140123,,,,,,
114法登他000036,1,2,曾瓊安,1898,1140114,1140114,1140115,95冊12頁,2,4,廖　群,財團法人慧治基金會,1030506,台北市大同區寧夏路11號6樓之12,以推展有機農業及休閒農業，辦理有機農業推廣教育、農村綠美化、培養有機農業人才，關懷弱勢族群，從事兒童及青少年福利服務、婦女福利服務、老人福利服務、身心障礙者福利服務、家庭支持、社會救助、社會工作服務等慈善社會福利事項為宗旨。,本會財產共新臺幣參仟萬元整，由慧治投資有限公司捐助，俟依法完成法人登記後，得繼續接受捐贈,行政院農業委員會中華民國103年3月5日農糧字第1031033642號函,永久,30000000.00,1,1140114,,1140123,,全體董事印鑑式。,,,,
114法登他000037,1,2,曾瓊安,2600,1140114,1140114,1140115,130冊10頁,1,1,韓蕙燕,財團法人佛教雲貞慈懿基金會,1130726,臺北市大同區承德路1段40號9樓,以辦理佛教各項會務及致力佛法之研究、弘揚、傳播與實踐，期使眾生皆能轉惡為善、轉迷為悟、轉凡成聖為目的、宗旨。辦理傳布佛教教義、研究與翻譯教義經典文獻、培育護持弘法人員、出版佛教刊物、多媒體弘法、舉辦佛教文化展覽、跨國弘法學術交流、設置傳教場所事業；並興辦與佛教有關之教育、弘法、文化、文物研究、佛教儀典、護生、淨化生態與人心、弱勢救助、身心保健等之公益事業。,由莊秀華、韓國靖、珍的國際有限公司、台灣雍寶有限公司共同捐助,內政部中華民國113年6月7日台內宗字第1130025840號函,永久,30000000.00,1,1140114,,1140123,,法人捐助章程第5條及第27條條文變更並經主管機關內政部113年12月10日台內宗字第1130050812號函予以備查。,,,,
114法登他000038,1,2,曾瓊安,1121,1140114,1140114,1140115,56冊15頁,1,5,瑪拉歐斯,財團法人原住民族文化事業基金會,0980916,臺北市南港區重陽路120號5樓,以傳承原住民族文化、經營原住民族傳播媒體事業為宗旨。,創立基金新臺幣二千萬元，由行政院原住民族委員會編列預算捐助，嗣後繼續接受捐贈。,行政院原住民族委員會中華民國98年9月8日原民教字第0980041725號函,永久,1785268389.00,1,1140114,,1140123,,"第5屆董事戴美鳳Ｋｕｍｕ　Ｗａｔａｎ印鑑變更。
第5屆監察人周王雋印鑑變更及姓名變更為：王雋 Ｖｉｌｉａｎ　Ｉｓｐａｌｉｄａｖ。",,,,
114法登他000039,2,2,曾瓊安,2478,1140114,1140114,1140115,124冊8頁,2,7,游碧珠,社團法人中華綠度母佛學會,0940919,台北市北投區立功街165巷5號7樓,本會以闡揚佛陀教義，倡導悲智雙運，福慧雙修，圓融大小乘及顯密佛法，淨化社會人心為宗旨。,會員會費等,內政部中華民國94年7月11日台內社字第0940065698號函,永久,12031900.00,1,1140114,,1140123,,全體理、監事印鑑式。,,,,
114法登社000001,2,1,曾瓊安,2596,1140102,1140102,1140106,130冊6頁,,,呂隶彥,社團法人臺北市善終慈善功德會,1140102,台北市士林區環河北路3段201號1樓,以慈善活動、急難濟助、宗教揚善、善終濟助、殮葬濟助、推展社會公益等為宗旨。,入會費、常年會費、會員捐款、委託收益、基金及其孳息、其他收入,臺北市政府社會局中華民國112年7月20日北市社團字第1123103278號函,永久,2000.00,1,1140102,,1140114,,,,,,
114法登社000002,2,1,曾瓊安,2598,1140107,1140107,1140110,130冊8頁,,,黃家德,社團法人臺北市立麗山高級中學退休及離職同仁聯誼協會,1140107,台北市內湖區內湖路2段103巷113號11樓,以關懷會員、增進會員情誼，凝聚感恩與回饋的精神為宗旨。,入會費、常年會費、會員捐款、入會費及捐款孳息、其他收入,臺北市政府社會局中華民國113年11月5日北市社團字第1133174148號函,永久,0.00,1,1140108,,1140120,,,,,,
