登記案號,類別,案由,主任,登記號數,收件日期,登記日期,公告日期,登記簿,任期判定,屆期判定,法人代表,法人名稱,設立登記日期,主事務所,目的,捐助方法,許可機關日期,存立時期,財產總額,結案原因,結案日期,歸檔日期,發證日期,清算人,變更原因,註銷日期,撤銷日期,撤(註)銷機關文號,撤(註)銷原因
061登000093,1,2,王維靜,102,0611017,0611017,0611017,7冊29頁,1,2,楊根旺,財團法人楊姓四知堂,0490430,台北市雙園區東園街176巷45弄31號,本堂以闡揚祖德敦睦宗誼，增進宗族福利，樹立團結互助精神並舉辦公益慈善事業為宗旨。,由宗親捐助,臺灣省政府中華民國49年4月2日(49)(4)(2)府民一字第23971號通知,永久,6770800.00,1,0611017,0611226,,,,,,,
061登000094,1,2,王維靜,190,0611018,0611018,0611018,13冊25頁,1,3,陳耿福,財團法人臺北市私立景文高級中學董事會,0520812,台北市木柵區保儀路1段127號,本會以創辦私立景文高級中學并謀其發展為目的。,由發起人武佩英、王超群、蘇桐鳳、葉永成等共同捐助,臺北市政府教育局中華民國59年9月22日北市教輝二字第17110號函,永久,1346100.00,1,0611018,0611226,,,修改章程及更換法人圖記。,,,,
061登000095,1,1,王維靜,478,0611019,0611019,0611019,27冊11頁,,,張水銀,財團法人台北市臺灣省城隍廟,0611019,台北市城中區武昌街1段14號,本財團奉祀城隍爺為主，並供奉其他諸神像，宏揚道教信仰，興辦社會公益慈善救濟事業為宗旨。,由信徒共同捐助,臺北市政府教育局中華民國61年10月13日北市民一字第15885號函,永久,1500000.00,1,0611019,0611226,,,,,,,
061登000096,1,1,王維靜,479,0611021,0611023,0611023,27冊13頁,,,各董事,財團法人世界龍岡親義總會中華民國分會,0611023,台北市林森北路138巷4號3樓,本會以促進劉關張趙四姓團結互助，共謀社會福利為目的。,向有關方面捐募,內政部中華民國61年5月3日台內社字第469532號函,永久,150000.00,1,0611023,0611226,,,,,,,
061登000097,1,2,王維靜,323,0611023,0611023,0611023,21冊53頁,1,,各董事,財團法人中華民國陳誠先生獎學基金董事會,0570513,台北市涼州街28號,中華民國各界為紀念　陳誠先生對國家之貢獻及其獎掖青年之德意，特創立陳誠先生獎學基金以獎助清寒優秀青年深造，完成學業，俾能致力建國大業為宗旨。,由全國各界捐獻,教育部中華民國57年4月29日台(57)高字第11199號代電,永久,24200000.00,1,0611023,0611226,,,"繼任董事張豐緒印鑑。
　",,,,
061登000099,1,1,王維靜,480,0611030,0611030,0611030,27冊15頁,,,張福壽,財團法人台北市靈源寺,0611030,台北市松山區虎林街26巷5號,"本財團以奉祀濟公禪師為主神，並供奉諸神像，宏揚佛法及教義，興辦社會救濟慈善事業為宗旨。
（捐助方法：由詹萬、楊守利、周祖昭、黃陳好、林尾、詹水源、詹地發、詹安雄、張葉罔市、林義盛、蔡錦祥、蔡村田、高陳招治、賴角水、張福壽、陳文慶、陳張月嬌、林陳玉蘭、王永欉、楊善標、林金寶、周陳來有等信徒共同捐助）",由詹萬等22位信徒共同捐助,臺北市政府民政局中華民國61年10月26日北市民一字第16518號函,永久,252207.00,1,0611030,0611226,,,,,,,
061登000100,1,1,王維靜,481,0611102,0611102,0611102,27冊17頁,,,胡維藩,財團法人詩文橋藝中心,0611102,台北市錦州街18號,為響應復興固有文化，陶冶高尚情藻，啟發智能，培植詩才，提倡橋藝各種正當娛樂，務期樹德立人，本乎仁、依於禮、興於詩、成於樂、遊於藝。,由胡維藩、林斯燊、楊惟海、王紹光、董華福、黃清和、李和標、王辰良、蔣永春等共同捐助,臺北市政府教育局中華民國61年10月27日北市教輝四字第002號許可證書,永久,100000.00,1,0611102,0611226,,,,,,,
061登000101,1,1,王維靜,482,0611106,0611107,0611107,27冊19頁,,,各董事,財團法人中華針灸科學研究基金會,0611107,台北市通化街207號之1,本基金會以聘請、委託或協助國內外衣學及科學團體或中西醫師及科學家，以科學方法對針灸之原理及方法，作有系統之研究，公諸於世，擴大醫學效用，促進人類健康，發揚中華文化為宗旨。,由原始捐助人葉公超等共同捐助,行政院衛生署中華民國61年9月18日衛署醫字第09166號函,永久,100000.00,1,0611107,0611226,,,,,,,
061登000102,1,2,王維靜,62,0611107,0611108,0611108,5冊9頁,1,,各董事,財團法人台灣手工業推廣中心,0470320,台北市徐州路1號（中山南路5號之1）,改良及增加手工業品之生產。發展手工業品之國外市場。促進手工業原料之充分利用。提供生產者以技術協助及訓練。,由行政院美援運用委員會、行政院經濟安定委員會工業委員會、台灣省建設廳、台灣省政府等共同捐助,經濟部中華民國47年3月20日台(47)工字第04124號通知,永久,3843600.00,1,0611108,0611226,,,繼任董事林洋港、林錫鈞印鑑。,,,,
061登000106,1,2,王維靜,375,0611115,0611117,0611117,23冊43頁,2,2,樊祥孫,財團法人中華顧問工程司,0590128,台北市忠孝東路4段280號7樓,本工程司以發揮我國專門人才之技術知識，促進交通建設，改進工程技術，協助國內外之經濟發展為目的。,由國際經濟合作發展委員會、交通部、郵政總局、電信總局、民用航空局、台灣鐵路管理局、台灣省公路局、基隆港務局、高雄港務局、台灣省公共工程局、台北市工務局、中國工程師學會等共同捐助,交通部中華民國58年12月17日交人字第5812-0642號通知,永久,850000.00,1,0611117,0611226,,,修改捐助章程第5條、第7條、第8條條文。,,,,
061登000107,1,1,王維靜,485,0611115,0611117,0611117,27冊25頁,,,各董事,財團法人台北市私立協和高級工商職業學校董事會,0611117,台北市松山路249巷123號,本會以創辦私立協和高級工商職業學校並謀其發展為目的。,由創辦人張瑟音、董事陳宏毅、陳詠沂等共同捐助,臺北市政府教育局中華民國60年7月23日教輝二字第14545號簡復表,永久,15121988.00,1,0611117,0611226,,,,,,,
061登000108,1,2,徐豐乾,338,0611121,0611121,0611121,22冊23頁,1,,尹子寬,財團法人萬國道德總會,0571024,台北市南京東路4段211巷83弄168號,本會以改建社會締造大同促世界進化謀人群幸福，實行利民生，啟民智，敦民德之計劃為宗旨。,會員及社會人士捐助,內政部中華民國57年8月20日台內社字第28494號通知,永久,4406000.00,1,0611121,0611206,,,修改捐助章程第3條條文。,,,,
061登000110,1,2,徐豐乾,259,0611123,0611124,0611124,18冊17頁,2,3,各董事,財團法人私立中國市政專科學校董事會,0550312,台北市景美區興隆路3段56號,本會以創辦私立中國市政專科學校，並謀其發展以配合都市建設為目的。,本財團法人之基金新台幣貳佰柒拾萬元由創辦人上官業佑先生捐贈,教育部中華民國54年10月1日(54)高字第15373號令,永久,75036775.00,1,0611124,0611226,,,"新任董事劉瓊、劉大柏、劉清源印鑑。
修改捐助章程第2條條文。",,,,
061登000112,1,2,王維靜,220,0611201,0611202,0611202,15冊29頁,2,,成文秀,財團法人台灣基督教福音貴格會　,0530716,台北市南港區興南路28號,本會以在台灣省各地設立教會、宣傳福音真理、舉辦宗教教育、以及慈善公益等事業為宗旨。,捐助,台北縣政府五三年五月二十五日　北府三民字第四二００八號通知,永久,700000.00,1,0611202,0611226,,,"更換法人印信及董事印鑑。
修改章程第1條至第13條、增加第14條至第20條條文。",,,,
061登000113,1,1,王維靜,488,0611202,0611204,0611204,27冊31頁,,,張曉古,財團法人基督教浸禮聖經會台北會幕堂,0611204,台北市中山北路1段105巷19號,本教會宗旨，以信靠基督耶穌為救主，遵守聖經教訓，以崇拜、祈禱並宣揚基督福音勸人悔改、行善造福社會為目的。,由教友之自由奉獻及國內外熱心人士或團體之捐贈,臺北市政府民政局中華民國61年11月29日北市民一字第18211號函,永久,3960000.00,1,0611204,0611226,,,,,,,
061登000115,1,2,王維靜,52,0611205,0611206,0611206,4冊19頁,2,,辜嚴倬雲,財團法人台北基督教女青年會,0460902,台北市青島西路7號　,本會以基督教女青年會世界協會之基本信條：「我信全能之父上帝和他的獨生子救主耶穌基督與聖靈」為基本信仰。並本基督之精神，促進婦女德、智、體、群四育之發展，使獲有高尚之人格，團契之精神，以達成服務社會，造福人群為宗旨。,由林李美貞、本會會員暨熱心人士等共同捐助,臺灣省臺北市政府中華民國46年7月6日(46)北市社組字第43085號通知,永久,633000.00,1,0611206,0611226,,,"事務所：台北市青島西路7號。
修改組織及捐助章程及更換法人印鑑。
目的：本會以基督教女青年會世界協會之基本信條「我信全能之父上帝和他的獨生子救主耶穌基督與聖靈」為基本信仰。並本基督之精神，促進婦女德、智、體、羣四育之發展，使獲有高尚之人格、團契之精神，以達成服務社會造福人羣為宗旨。",,,,
061登000116,1,2,王維靜,379,0611215,0611216,0611216,23冊51頁,1,2,顧文魁,財團法人中興工程顧問社,0590404,台北市南京東路4段280號（大陸大樓）10樓,本社承辦電力、水利、都市建設及一般土木工程等計劃之研究、規劃、勘測、設計、檢驗及施工監督管理等事項，以配合國家經濟發展及對外技術輸出。,由經濟部、水資會、榮民工程管理處、曾文水庫建設委員會、台灣省水利局、台灣省公共工程局、台北市工務局、中國工程師學會及台糖、台電、中油、中華工程、台機、台船股份有限公司等共同捐助,經濟部中華民國59年3月4日經(59)人字第08568號令,永久,1200000.00,1,0611216,0611216,,,,,,,
061登000117,1,1,徐豐乾,489,0611230,0611230,0611230,27冊33頁,,,各董事,財團法人台北市私立台灣電視訓練短期職業補習班董事會,0611230,台北市八德路3段10號,本補習班，以訓練有關電視事業經營所需各項事業人才為宗旨。,捐助收入,臺北市政府教育局中華民國61年12月27日(61)北市教四字第032號許可證書,永久,1869396.40,1,0611230,0611230,,,,,,,
