登記案號,類別,案由,主任,登記號數,收件日期,登記日期,公告日期,登記簿,任期判定,屆期判定,法人代表,法人名稱,設立登記日期,主事務所,目的,捐助方法,許可機關日期,存立時期,財產總額,結案原因,結案日期,歸檔日期,發證日期,清算人,變更原因,註銷日期,撤銷日期,撤(註)銷機關文號,撤(註)銷原因
096法登他000106,2,2,林文鼎,554,0960615,0960615,0960620,19冊43頁,2,14,洪文裕,社團法人臺北縣登山會,0920612,台北縣板橋市南雅南路1段117號5樓,基於仁者樂山之古訓，倡導登山運動，鍛鍊國民體魄，培養進取冒險之精神，並以陶冶性情、健全身體，進而攀登世界名山，致力於國民外交為宗旨。,入會費、常年會費、捐款收入、補助收入、其他收入。,臺北縣政府九十一年七月十二日北府社團字第０九一０四三七九七二號函,永久,2790321.00,1,0960615,0960801,0960622,,理監事印鑑。,,,,
096法登他000107,1,2,林文鼎,81,0960615,0960615,0960620,3冊55頁,2,3,李文森,財團法人台灣省台北縣基督教台灣明志神的教會,0811007,台北縣泰山鄉明志路3段42巷32號,本博愛之精神傳揚教義，辦理社會公益慈善教育事業為宗旨。,由李麗澤捐助,台北縣政府八十一年六月十九日北府民二字第二０一五八七號函,永久,3146823.00,1,0960615,0960801,0960622,,董事印鑑。,,,,
096法登他000109,1,2,林文鼎,581,0960620,0960620,0960621,20冊37頁,2,6,江新光,財團法人中國易學研究文教基金會,0780830,台北縣板橋市雙十路2段47巷59號4樓,以研究中國易經學術，並謀其發展應用，定期辦理講習會及促進學識之交流為目的。,由潘養和等八人捐助,教育部七十八年七月二十一日台七八高字第三五六三三號函,永久,1000000.00,1,0960620,0960801,0960627,,董事印鑑。,,,,
096法登他000110,1,2,林文鼎,516,0960621,0960621,0960622,18冊27頁,2,3,林文益,財團法人國立三重高級中學教育基金會,0910705,台北縣三重市三信路1號,以協助國立三重高級中學校務發展，提升教育品質為宗旨。,由林義重、王守良、張輝政等人捐助,臺北縣政府九十一年七月一日北府教社字第０九一０四０四五九九號函,永久,5803561.00,1,0960621,0960801,0960628,,董事印鑑。,,,,
096法登他000111,2,2,林文鼎,197,0960621,0960621,0960622,7冊47頁,2,7,林金塗,社團法人台北縣脊髓損傷者協會,0840609,台北縣中和市中正路637巷6號1樓,以結合群力，協助脊髓損傷者自立自強，重新適應社會生活為宗旨。,會員入會費、基金及其孳息、會員捐款、補助費、其他收入。,台北縣政府八十四年三月三十日北府社一字第七七三七九號函,永久,69000.00,1,0960621,0960801,0960628,,理監事印鑑。,,,,
096法登他000112,1,2,林文鼎,74,0960621,0960621,0960622,3冊41頁,2,6,李慶旺,財團法人天恒文教基金會,0810806,台北縣三重市重陽路3段132號4樓,以加強文化建設，宏揚道德文化，辦理社會福利慈善事業，共創富而好禮，老者安之，少者懷之的大同社會為宗旨。,由黃惠彬等捐助,台北縣政府八十一年六月二十六日北府教三字第二一０九三六號函,永久,29731785.00,1,0960621,0960801,0960628,,"董事印鑑。
修正捐助章程第6條、第7條、第8條、第16條。",,,,
096法登他000113,1,2,林文鼎,562,0960622,0960622,0960623,19冊59頁,2,3,林清文,財團法人台灣商品數碼防偽技術發展教育基金會,0921120,台北縣中和市建六路82號,以提昇資訊科技、知識經濟價值，培育科技、印刷技術人才及提昇社會生活品質為宗旨。,由林清文、高榮茂、葉建仁捐助。,臺北縣政府九十二年十一月十四日北府教社字第０九二０六七三八００號函,永久,5000000.00,1,0960622,0960801,0960629,,"董事印鑑。
修正捐助章程第7條、第9條、第11條、第16條。",,,,
096法登他000114,2,2,林文鼎,330,0960625,0960625,0960626,12冊13頁,1,11,吳仲凱,社團法人臺北縣肢體傷殘自強協會,0871027,臺北縣永和市林森路67號5樓,以團結臺北縣優秀肢體傷殘同胞，配合社會各界惠殘人士，發揮博愛精神，以促進本縣肢體傷殘同胞自立自強、自助助人，化消極退縮為積極進取，以貫徹身心障礙保護法精神為宗旨。,會員入會費、常年會費及其他收入。,臺北縣政府八十七年七月八日八七北府社一字第二０六四五九號函,永久,148876.00,1,0960625,0960801,0960702,,,,,,
096法登他000115,1,2,林文鼎,7,0960626,0960626,0960627,1冊13頁,1,5,顧其芸,財團法人台灣省台北縣台北基督徒中和禮拜堂,0720506,台北縣中和市南山路298巷3弄4號,傳揚耶穌基督救世福音，造就信徒靈性，推動社會福利公益事業。,由信徒捐助,台北縣政府七十二年三月十八日北府民二字第五四００八號函,永久,100676454.00,1,0960626,0960801,0960703,,,,,,
096法登他000116,2,2,林文鼎,631,0960626,0960626,0960627,22冊9頁,2,2,蔡麗華,社團法人臺北縣社區大廈促進協會,0941129,台北縣蘆洲市民族路263巷19號6樓,以提供協助推行台北縣社區大樓公共事務服務管理及推展舉凡社福、關懷弱勢、治安、教育、文化、環保、聯誼活動等工作，藉以落實社區工作，提昇生活品質為宗旨。,入會費、個人常年會費、團體會員會費、理監事捐款、基金及其孳息、其他收入。,臺北縣政府94年11月16日北府社團字第0940794613號函,永久,354411.00,1,0960626,0960801,0960703,,"修正章程第30條。
理監事印鑑。",,,,
096法登他000117,1,2,林文鼎,500,0960627,0960627,0960628,17冊55頁,2,2,趙志郎,財團法人台灣省台北縣天理教飾大台北教會,0910319,台北縣三重市三和路3段151巷56號4樓,本於父母精神，傳揚天理教教義及辦理社會公益慈善事業。,由張欽昇捐助,臺北縣政府九十一年三月十一日北府民宗字第０九一００六二七００號函,永久,1419950.00,1,0960627,0960801,0960704,,董事印鑑。,,,,
096法登他000118,1,2,林文鼎,31,0960702,0960702,0960703,2冊13頁,2,6,"梁  堂",財團法人台灣省台北縣中國基督教靈糧世界佈道會板橋靈糧堂,0761203,台北縣板橋市中山路2段416巷3弄3之2號,"本耶穌基督愛人之精神，在台北縣傳揚基督教教義，辦理社會公益慈        善事業。",由會友捐助,台北縣政府七十六年十一月二十六日北府民二字第三六三七二九號函,永久,527500.00,1,0960702,0960903,0960706,,董事印鑑。,,,,
096法登他000119,2,2,林文鼎,498,0960702,0960702,0960703,17冊51頁,2,9,陳昌郎,社團法人中華印刷科技學會,0801009,台北縣三重市光復路1段61巷27號11樓之2,以研究印刷科技，提升印刷工業水準為宗旨。,會員會費及捐助,內政部八十年三月十八日台八０內社字第九０七八七九號函,永久,864105.50,1,0960702,0960903,0960706,,理監事印鑑。,,,,
096法登他000120,2,2,林文鼎,248,0960704,0960704,0960705,9冊29頁,2,21,李瑞庚,社團法人國際獅子會臺灣總會臺北縣三多獅子會,0850517,台北縣樹林市保安街2段180號4樓,以尊重自由啟發智慧，發揚人類博愛互助精神，促進國家安全，增進國際間友好的關係，提倡社會福利為宗旨。,會員入會費、常年會費及其他捐助。,台北縣政府八十五年二月五日北府社一字第四四０二二號函,永久,1052232.00,1,0960704,0960903,0960711,,理監事印鑑。,,,,
096法登他000121,2,2,林文鼎,400,0960709,0960709,0960710,14冊33頁,2,22,陳國盛,社團法人國際扶輪社中華民國總社臺灣省臺北縣林口扶輪社,0890223,臺北縣林口鄉文化二路1段362號,以鼓勵並培養以服務之精神為可貴事業之基礎為宗旨。,會員入會費、常年會費及其他收入。,臺北縣政府八十九年一月二十九日北府社團字第０四０二五七號函,永久,4129834.00,1,0960709,0960903,0960716,,理事印鑑。,,,,
096法登他000122,2,2,林文鼎,618,0960710,0960710,0960711,21冊51頁,2,2,李錦雲,社團法人臺北縣生命小鬥士愛心協會,0940801,台北縣三重市永福街179巷6號,以只要有愛，就有希望，關懷兒童，救助弱勢，熱愛生命，尊重生命為宗旨。,入會費、常年會費、事業費、會員捐款、委託收益、基金及其孳息、其他收入。,臺北縣政府94年7月19日北府社團字第0940516317號函,永久,126000.00,1,0960710,0960903,0960717,,理監事印鑑。,,,,
096法登他000123,1,2,林文鼎,529,0960710,0960710,0960711,18冊53頁,2,5,邱加瑜,財團法人天主教主顧修女會,0460108,台北縣泰山鄉新生路4號,一、為供應主顧修女會所需之一切設備及經費，並使年邁或生病的修女得到贍養。二、培育教會人員在宗教、科學、文學等各方面的訓練，以服務社會。三、協助各地教會舉行天主教儀式及宣揚天主教教義。四、協助天主教在世界各地已辦或擬辦之社會慈善事業、教育事業或教會團體、團員或某一地居民之社會福利事業。,由溫萃珍捐助,台中市政府四十五年十二月二十九日〈主管機關改隸臺北縣政府〉,永久,96893700.00,1,0960710,0960903,0960717,,董事印鑑。,,,,
096法登他000124,2,2,林文鼎,474,0960712,0960712,0960713,17冊3頁,2,5,李省楠,社團法人中國同善社,0900921,台北縣中和市圓通路84號2樓,以勸善規過為正宗，以正心修身為要旨，以靜坐養道為工夫。,社員入社費、常年社費及其他收入。,內政部九十年八月二十九日台九十內社字第九０二六八八二號函,永久,6669907.00,1,0960712,0960903,0960719,,理監事印鑑。,,,,
096法登他000125,1,2,林文鼎,90,0960712,0960712,0960713,4冊13頁,1,5,黃忠臣,財團法人恩主公醫院,0820114,台北縣三峽鎮復興路三九九號,秉持促進社會祥和公益及發揮慈善濟世之理念為大眾謀福利，並從事精研醫術，宏揚醫德，以增進人群健康幸福。,由財團法人台北市行天宮捐助,行政院衛生署八十一年十二月十七日衛署醫字第八一八五三０一號函,永久,3209396787.00,1,0960712,0960903,0960719,,,,,,
096法登他000126,1,2,林文鼎,667,0960713,0960713,0960716,23冊15頁,1,1,李信誼,財團法人台北縣私立李氏瓦丹林秀金連社會福利慈善事業基金會,0950922,台北縣三峽鎮大同路88巷3之1號,以舉辦社會福利慈善事業為宗旨。,由李金連捐助,臺北縣政府95年9月20日北府社助字第0950628996號函,永久,21106579.00,1,0960713,0960903,0960720,,新任董事印鑑登記。,,,,
096法登他000127,1,2,林文鼎,628,0960713,0960713,0960716,22冊6頁,1,2,鄭鴻傑,財團法人力瑋文教基金會,0880729,台北縣五股鄉五工路105號7樓,以宣揚人性光明面為宗旨,由力瑋實業股份有限公司、鄭鴻傑先生、陳清泉先生、何春盛先生共同捐助。,教育部88年7月19日台88社4字第88084999號函,永久,10000000.00,1,0960713,0960903,0960720,,,,,,
096法登他000128,1,3,林文鼎,321,0960717,0960717,0960718,11冊55頁,1,0,翁淑容會計師,財團法人私立頂福陵園管理基金會,0870709,台北縣林口鄉頂福村八十九之一號,以委託辦理公墓之管理維護及響應政府政策，提倡公墓公園化，宣導火葬簡葬，改善民俗為宗旨。,由徐仲祥捐助,台北縣政府八十七年三月二十日北府社一字第０五六九四五號函,永久,5000000.00,1,0960717,0960903,,翁淑容會計師,"一、解散原因：
法人設立目的，因殯葬管理條例公佈施行，由頂福事業股份有限公司取代，且董事任期屆滿，未能依捐助章程改選董事續行目的事業，主管機關臺北縣政府基於情事變更，法人目的不能達成，依民法第65條規定，於中華民國95年11月1日以北府民殯字第0950714324號函命令解散。
二、清算人姓名及住所：
翁淑容會計師  台北市羅斯福路3段28號8樓",,,,
096法登他000129,1,2,林文鼎,169,0960719,0960719,0960720,6冊51頁,2,4,何萬良,財團法人台灣省台北縣天主教本篤會,0570418,台北縣泰山鄉明志路3段96巷1號,以協助中國當地主教服務人群，宣揚天主教教義，並供應聖本篤會所需之一切設備及經費為目的。,由天主教本篤會總會捐助,台北縣政府五十七年三月十八日,永久,227436000.00,1,0960719,0960903,0960726,,董事印鑑。,,,,
096法登他000130,1,2,林文鼎,291,0960723,0960723,0960725,10冊55頁,2,4,蔡敦雄,財團法人永育文教基金會,0860712,台北縣永和市仁愛路8號2樓,以推動教育、文化公益事業及社區服務為宗旨。,由蔡敦雄先生捐助,台北縣政府八十六年七月九日八六北府教三字第二五四０六七號函,永久,2000000.00,1,0960723,0960903,0960731,,董事印鑑。,,,,
096法登他000131,1,2,林文鼎,449,0960723,0960723,0960725,16冊11頁,2,3,楊兩傳,財團法人政陽文教基金會,0900314,台北縣中和市建二路153號2樓,以提昇全民教育，實現終生學習理念為宗旨。,由楊兩傳等人捐助,臺北縣政府九十年二月二十六日北府教社字第０六九三０九號函,永久,2000000.00,1,0960723,0960903,0960731,,董事印鑑。,,,,
096法登他000132,1,2,林文鼎,204,0960724,0960724,0960725,8冊1頁,2,10,林瀚東,財團法人台灣省台北縣大觀書社,0521221,台北縣板橋市西門街5號,以辦理社會福利慈善事業，社會文化事業及附設大觀幼稚園，並維護文昌廟之完整與祭典為宗旨。,由林本源家捐助,台北縣政府五十二年十一月十六日,永久,45325832.00,1,0960724,0960903,0960731,,董事印鑑。,,,,
096法登他000133,1,2,林文鼎,223,0960725,0960725,0960726,8冊39頁,1,6,李佩忠,財團法人台北縣後備軍人獎學基金會,0690126,台北縣土城市仁愛路23號,"以運用後備軍人本身財力，籌措基金，以獎助後備軍人( 含子女 )努力向學為宗旨。",由台北縣全體後備軍人輔導幹部暨後備軍人及社會人士捐助,台北縣政府六十八年十二月二十七日68北府教一字第二七０一三八號函,永久,19854168.50,1,0960725,0961101,0960801,,新任董事印鑑登記。,,,,
096法登他000134,1,2,林文鼎,464,0960726,0960726,0960727,16冊41頁,2,5,江朝騰,財團法人台灣省台北縣承天禪寺,0680814,台北縣土城市承天路96號,以宣揚佛陀教義，淨化社會人心，護國利生為目的。,由李廣欽、線家蕃及信徒捐助。,臺北縣政府六十八年五月二十二日六八北府民一字第一００五七四號函,永久,4049675.00,1,0960726,0960903,0960802,,法人圖記及董事印鑑。,,,,
096法登他000135,1,2,林文鼎,209,0960730,0960730,0960731,8冊11頁,2,15,王希聖,財團法人臺灣省臺北縣私立光華高級商業職業進修學校,0640313,台北縣板橋市南雅南路2段1號,為遵照國家教育政策暨現行教育法令之規定，辦理高級商業職業進修學校，並謀其健全發展。,由孟棣樺、王希聖、王蔭藩捐助。,台灣省政府教育廳六十三年六月十二日教五字第三九九六四號許可書〈主管機關改隸教育部〉,永久,37242498.00,1,0960730,0960903,0960806,,董事印鑑。,,,,
096法登他000136,1,2,林文鼎,392,0960730,0960730,0960731,14冊17頁,2,3,高志誠,財團法人義美藝術教育基金會,0890114,台北縣三重市重新路5段609巷2號地下1樓,以倡導優質生活，推廣落實藝術教育為宗旨。,由義美食品股份有限公司及歐瑞淑捐助,台北縣政府八十九年一月十一日北府教三字第四八九八七一號函,永久,26500000.00,1,0960730,0960903,0960806,,董事印鑑。,,,,
096法登他000137,1,2,林文鼎,91,0960801,0960801,0960802,4冊15頁,2,3,黃華銘,財團法人台灣省台北縣基督教五福禮拜堂,0820114,台北縣板橋市雙十路2段130巷2弄12號,使信徒獲得靈性長進，廣傳耶穌基督救世福音，並推動社會福利及公益事業為宗旨。,由林伯雄捐助,台北縣政府八十二年一月四日北府民二字第四五０一六一號函,永久,3488880.00,1,0960801,0961001,0960808,,董事印鑑。,,,,
096法登他000138,1,2,林文鼎,578,0960801,0960801,0960802,20冊31頁,2,2,何樹滋,財團法人華藏耕心教育基金會,0930329,台北縣三重市萬全街15號1樓,一、建立孝親尊師、知恩報恩的精神中心思想。二、養成學為人師、行為世範的聖哲賢達威儀。三、推展福慧雙修、多元文化的幸福美滿教育。四、落實人文倫理、和睦平等的社區深耕關懷。,由陳佳源等人捐助,臺北縣政府九十三年三月二十三日北府教社字第０九三０一四三六二九號函,永久,5000000.00,1,0960801,0961001,0960808,,"修訂捐助章程第7條。
董事印鑑。",,,,
096法登他000139,1,2,林文鼎,586,0960802,0960802,0960803,20冊47頁,2,2,譚量吉,財團法人雲林同鄉文教基金會,0930610,雲林縣麥寮鄉麥珍村中山路218號,以激勵雲林同鄉子弟之敦品勵學，頒發績優清寒獎助學金、急難救助，協同照應雲林同鄉，倡導傳習讀經教化等多面向才藝智能，補助學術創作研究著述，發行鄉親求才、就業、創業資訊，以提升母縣學術、科技、教育、社會、經濟、環境生態等多元文教蓬勃發展為宗旨。,由全國各地雲林同鄉、社會賢達、工商企業團體及各界熱心文教人士捐助。,臺北縣政府九十二年七月二十九日北府教社字第０九二０四七三五五八號函,永久,11000000.00,1,0960802,0961001,0960809,,董監事印鑑。,,,,
096法登他000140,1,2,林文鼎,325,0960802,0960802,0960803,12冊3頁,1,3,釋道海,財團法人佛教僧伽醫護基金會,0870821,台北縣樹林市大安路五三四號六樓,以照顧及促進全國僧伽健康，配合政府實施全民健康保險，而協助全國僧伽辦理保險事務，協助僧伽醫護安養、臨終關懷，使其無後顧之虞，以從事人心教化工作，淑世導俗、改善社會風氣為宗旨。,由財團法人台灣省私立佛教懷仁社會福利慈善事業基金會等捐助,行政院衛生署八十七年八月十八日衛署醫字第八七０四四九七０號函,永久,55556613.00,1,0960802,0961101,0960809,,修訂捐助章程第2條及第21條。,,,,
096法登他000141,1,2,林文鼎,178,0960802,0960802,0960803,7冊9頁,1,13,邱弘文,財團法人台北縣私立邱和成慈善基金會,0690526,台北縣鶯歌鎮中正二路67號,以紀念邱公和成生前樂善好施，救濟貧困疾難，或低收入者學童獎助學金為目的。,由邱弘文先生等人捐助,台北縣政府六十九年五月二十二日北府社三字第一０五七四七號函,永久,167000000.00,1,0960802,0961001,0960809,,董事許清順印鑑登記。,,,,
096法登他000142,1,2,林文鼎,103,0960802,0960803,0960806,4冊39頁,2,8,楊耕宗,財團法人台北縣更寮國民小學文教基金會,0820413,台北縣五股鄉四維路2號,以獎助台北縣更寮國民小學品學兼優或家境清寒學生，及代表學校參加鄉級以上之正式比賽成績優異之師生為目的。,由林士元等捐助,台北縣政府八十二年三月二十日北府教三字第九七二七三號函,永久,2130000.00,1,0960803,0961001,0960810,,董事印鑑。,,,,
096法登他000143,1,2,林文鼎,345,0960803,0960803,0960806,12冊43頁,1,3,"薛  琦",財團法人電訊暨智慧運輸科技發展基金會,0880318,台北縣板橋市四川路2段58號,以發展通信、資訊、智慧型運輸科技等有關技術為目的。,由遠傳電信股份有限公司捐助,交通部八十八年二月二十四日交郵八十八字第０一四六六三號函,永久,56838341.00,1,0960803,0961001,0960810,,"修正捐助章程名稱及第1條、第3條、第4條、第23條。
變更法人圖記及新任董事印鑑登記。",,,,
096法登他000144,2,2,林文鼎,361,0960806,0960806,0960807,13冊15頁,2,9,洪文裕,社團法人國際獅子會臺灣總會臺北縣樹林獅子會,0880720,台北縣樹林市大安路538號7樓,以發揮人類博愛互助精神，增進國際間友好關係，尊重自由啟發智慧，提倡社會福利，促進國家安全為宗旨。,入會費、常年會費、事業費、會員捐款、委託收益、基金及孳息、其他收入。,台北縣政府八十八年五月二十九日北府社一字第二００二七０號函,永久,1323952.00,1,0960806,0961001,0960809,,理監事印鑑。,,,,
096法登他000145,1,2,林文鼎,399,0960806,0960806,0960807,14冊31頁,2,4,施信民,財團法人守望文教基金會,0861203,台北縣三重市仁愛街588號2樓,以推展台北縣社區居民重視及關心公共事務，培養主動參與社區建設與社區發展意識，共同為提昇社區整體生活與人文品質之社會教育為宗旨。,由曹愛蘭捐助,台北縣政府八十六年十一月二十五日北府教三字第四四五四五九號函,永久,2000000.00,1,0960806,0961001,0960813,,董事印鑑。,,,,
096法登他000146,1,2,林文鼎,238,0960807,0960807,0960808,9冊9頁,2,14,孫柔遠,財團法人台灣省台北縣私立徐匯高級中學,0540909,台北縣蘆洲市中山一路1號,為遵照國家教育政策暨現行教育法令之規定，辦理台灣省台北縣私立徐匯高級中學，並謀其健全發展。,由財團法人天主教耶穌會捐助,台灣省政府教育廳五十二年八月七日教二字第０三０四六號令,永久,257302375.00,1,0960807,0961001,0960814,,董事印鑑。,,,,
096法登他000147,1,2,林文鼎,624,0960807,0960807,0960808,22冊2頁,1,1,湯堯東,財團法人理財教育基金會,0941003,台北縣板橋市文化路2段182巷3弄54號14樓,以推廣理財教育，提昇教育水準，改善教育資源為宗旨。,由湯堯東捐助,臺北縣政府94年9月26日北府教社字第0940671079號函,永久,5000000.00,1,0960807,0961001,0960814,,新任董事印鑑登記。,,,,
096法登他000148,1,2,林文鼎,414,0960813,0960813,0960814,15冊1頁,2,8,陳鴻珍,財團法人崇德文化教育基金會,0750207,台北縣中和市圓通路367巷33弄34之6號,以發揚中華倫理文化及獎助在校學生敦品勵學為宗旨。,由韓雨霖、陳鴻珍等人捐助。,"教育部七十四年十月二日台(七四 )高字第四二七八０號函",永久,1500000.00,1,0960813,0961001,0960820,,董監事印鑑。,,,,
096法登他000149,1,2,林文鼎,208,0960814,0960814,0960815,8冊9頁,2,2,李啟銘,財團法人台灣省台北縣板橋市基督教會錫安堂,0840727,台北縣板橋市信義路1巷26弄32號4樓,以傳揚福音，並興辦社會公益與慈善事業為目的。,由李明星等人捐助,台北縣政府八十四年七月十八日八四北府民二字第二五九四三二號函,永久,2789656.00,1,0960814,0961001,0960821,,董事印鑑。,,,,
096法登他000150,1,2,林文鼎,274,0960815,0960815,0960816,10冊21頁,1,7,王陳𤆬,財團法人臺灣省臺北縣泰山基督教會美門堂,0661130,台北縣泰山鄉明志路1段354號,以信奉基督耶穌為救世主，遵守聖經教訓，宣揚基督福音，勸人悔罪歸主，行善助人，造福社會為宗旨。,由會友捐助,台北縣政府六十六年五月二日北府民一字第八二一九號,永久,33042418.00,1,0960815,0961001,0960822,,,,,,
096法登他000151,1,2,林文鼎,87,0960815,0960815,0960816,4冊7頁,2,13,孟繼洛,財團法人華夏技術學院,0541116,台北縣中和市工專路111號,為遵照國家教育政策暨現行教育法令之規定辦理技術學院，並謀其健全發展。,由創辦人及董事捐助,教育部五十五年一月十九日55高字第０八一九號令,永久,1744386162.00,1,0960815,0961001,0960822,,董事印鑑。,,,,
096法登他000152,1,2,林文鼎,679,0960816,0960816,0960817,23冊27頁,1,1,"劉  戀",財團法人劉戀文化基金會,0960112,台北縣新莊市復興路3段19號3樓,以台北縣藝文發展為宗旨,"由劉  戀、陳柄武捐助",臺北縣政府96年1月2日北府文行字第0950011483號函,永久,5000000.00,1,0960816,0961001,0960823,,董事卿敏良印鑑登記。,,,,
096法登他000153,2,2,林文鼎,167,0960816,0960816,0960817,6冊47頁,2,8,楊敏娟,社團法人台北縣自閉症服務協進會,0830909,台北縣三重市溪尾街109號3樓,以結合台北縣關心自閉症人士，爭取自閉症者合法權益，促進自閉症福利為宗旨。,會員入會費、常年會費及其他收入。,台北縣政府八十三年九月五日北府社一字第三０五五二四號函,永久,2662320.00,1,0960816,0961001,0960823,,理監事印鑑。,,,,
096法登他000154,1,2,林文鼎,41,0960817,0960817,0960820,2冊33頁,2,5,許炳崑,財團法人思源醫療基金會,0780902,台北縣新莊市思源路127號,1.以協助急救、急難病患就醫，研究加強急診醫療功能，照顧弱勢國民及社區健康促進為宗旨。2.協助政府推動各項醫療、福利等政策，以維護國民健康。,由劉炳偉等捐助,行政院衛生暑七十八年五月十日衛暑醫字第八０一六七０號函,永久,11398656.00,1,0960817,0961001,0960824,,"修正捐助及組織章程第2、5、6、8條。                              
董監事印鑑。",,,,
096法登他000155,1,2,林文鼎,308,0960817,0960817,0960820,11冊29頁,2,4,周成乾,財團法人愛陽文教基金會,0870204,台北縣板橋市長安街25巷7之1號1樓,以獎勵成績優異學生為宗旨,由周成乾捐助,台北縣政府八十六年十二月三十一日北府教三字第四九五八九四號函,永久,11400000.00,1,0960817,0961001,0960824,,董事印鑑。,,,,
