登記案號,類別,案由,主任,登記號數,收件日期,登記日期,公告日期,登記簿,任期判定,屆期判定,法人代表,法人名稱,設立登記日期,主事務所,目的,捐助方法,許可機關日期,存立時期,財產總額,結案原因,結案日期,歸檔日期,發證日期,清算人,變更原因,註銷日期,撤銷日期,撤(註)銷機關文號,撤(註)銷原因
096法登他000055,1,2,林文鼎,560,0960409,0960409,0960410,19冊55頁,2,2,粟明德,財團法人台北縣私立輝容社會福利慈善事業基金會,0921106,台北縣三重市重新路4段97號25樓之1,以舉辦社會福利慈善事業為目的。,由粟明德、輝容投資股份有限公司及粟清雲捐助。,臺北縣政府九十二年十月二十九日北府社助字第０九二０六三五九七六號函,永久,30000000.00,1,0960409,0960601,0960416,,董事印鑑。,,,,
096法登他000057,2,2,林文鼎,643,0960413,0960413,0960414,22冊21頁,2,3,郭富修,社團法人臺北縣身心障礙游泳協會,0950323,台北縣板橋市大觀路3段91號,以推廣身心障礙者之游泳活動，以復健強身為目的，結合社會資源推動會福利政策，促進會繁榮，發展全民運動為宗旨。,會員入會費、常年會費、會員捐款、委託收益、基金及其孳息、其他收入。,臺北縣政府95年3月17日北府社團字第0950153015號函,永久,106181.00,1,0960413,0960601,0960420,,理監事印鑑。,,,,
096法登他000058,1,2,林文鼎,625,0960413,0960413,0960414,22冊3頁,1,2,林清標,財團法人台北縣私立融獻社會福利慈善事業基金會,0941007,台北縣林口鄉文化一路1段93號7樓之2,以舉辦社會福利慈善事業為宗旨,由林進忠等26人捐助,臺縣政府94年10月3日北府社助字第0940662319號函,永久,10000000.00,1,0960413,0960601,0960420,,修正捐助章程第6條、第7條、第21條、第23條。,,,,
096法登他000059,1,2,林文鼎,116,0960416,0960416,0960417,5冊5頁,2,14,楊定一,財團法人明志科技大學,0550601,台北縣泰山鄉貴子村工專路84號,創辦明志科技大學，並謀其發展。,台灣塑膠股份有限公司捐助,教育部五十三年七月六日台53高字第八八五二號令,永久,13225112025.90,1,0960416,0960601,0960423,,董事印鑑。,,,,
096法登他000060,1,2,林文鼎,296,0960417,0960417,0960418,11冊5頁,2,5,"沈  正",財團法人台灣省台北縣中華基督教內地會,0800308,台北縣中和市秀朗路3段175巷16號4樓之6,本基督之精神傳揚福音，造就門徒，建立教會，鼓勵並差派宣教士，服務社會辦理教會慈善等事業為宗旨。,由傅德修先生捐助,台北縣政府八十年二月十一日北府民二字第四七三九０號函,永久,6438666.00,1,0960417,0960601,0960424,,董事印鑑。,,,,
096法登他000061,1,2,林文鼎,6,0960419,0960419,0960420,1冊11頁,1,1,董何美卿,財團法人明倫社會福利慈善事業基金會,0711201,台北縣板橋市南雅南路2段21號,以辦理社會福利慈善事業為目的,由社會熱心人士捐助,台北縣政府七十一年七月二十三日北府社三字第一四七七四三號〈主管機關變更為內政部〉,永久,145224844.00,1,0960419,0960601,0960426,,,,,,
096法登他000062,1,2,林文鼎,139,0960423,0960423,0960424,5冊51頁,1,13,孫繼泉,財團法人台灣省台北縣私立南山高級中學,0491204,台北縣中和市廣福路41號,為遵照國家教育政策暨現行教育法令之規定，辦理高級中學，並謀其健全發展。,由林熊祥等人捐助,台北縣政府四十六年九月五日北府教德一字第四一六四號〈主管機關改隸教育部〉,永久,842031544.00,1,0960423,0960601,0960430,,董事張金洲印鑑登記。,,,,
096法登他000063,1,2,林文鼎,444,0960424,0960424,0960425,16冊1頁,2,4,丁豫中,財團法人臺北縣立樹林高級中學校務發展文教基金會,0900130,台北縣樹林市中華路8號,以發展校務文教為宗旨。,由學生家長及熱心人士捐助,臺北縣政府九十年一月八日北府教社字第０一一八八六號函,永久,4000000.00,1,0960424,0960601,0960501,,董事印鑑。,,,,
096法登他000064,1,2,林文鼎,198,0960425,0960425,0960426,7冊49頁,2,5,顏惠忠,財團法人學淵文教基金會,0840612,台北縣板橋市文化路1段219之7號,以獎助優秀清寒學生就學為宗旨,由台北汽車客運股份有限公司捐助,台北縣政府八十四年六月一日北府教三字第一九一二六九號函,永久,10000000.00,1,0960425,0960601,0960502,,董事印鑑。,,,,
096法登他000065,1,2,林文鼎,660,0960425,0960425,0960426,23冊8頁,1,6,許欽琳,財團法人許加紀念基金會,0800702,台北縣永和市保福路1段35巷2號,以舉辦或捐助社會福利慈善事業為目的,"由許  加等捐助",內政部80年5月28日台80內社字第930664號函,永久,32000000.00,1,0960425,0960601,0960502,,修正捐助章程第3條、第5條、第14條、第17條。,,,,
096法登他000066,2,2,林文鼎,453,0960427,0960427,0960430,16冊19頁,2,6,蘇麗卿,社團法人中華民國唐氏症關愛者協會,0810722,台北縣永和市中山路1段341號地下1樓,以結合唐氏症者家長、監護人及關心唐氏症者人士團體及學者專家，共同促進教養經驗之溝通或護理保健之諮詢，早期療育之推展及就業、就養等服務之促進，進而爭取唐氏症者合法權益與福利，以期協助國家減輕負擔、解決社會問題為宗旨。,會員會費及捐助,內政部八十一年一月二十二日台八一內社字第八一０一四八七號函,永久,166000.00,1,0960427,0960601,0960504,,"修訂章程第28條、第30條。
理監事印鑑。",,,,
096法登他000067,2,2,林文鼎,502,0960430,0960430,0960501,17冊59頁,2,5,王昆德,社團法人中華民國一貫道總會,0770523,台北縣中和市建八路2號11樓,以團結全國一貫道信徒，整理教規，闡揚教義，弘揚中華文化，促進社會和諧及世界大同為宗旨。,會員常年會費及會員捐款,內政部七十七年四月一日台七七內社字第五八三六七六號函,永久,15343000.00,1,0960430,0960601,0960507,,"修正組織章程第1、3、23、25條，增訂第37條。
理事印鑑。",,,,
096法登他000068,1,2,林文鼎,366,0960430,0960430,0960501,13冊25頁,2,3,吳茂雄,財團法人大漢溪文教基金會,0880906,台北縣樹林市大安路538號,以提升台北縣縣民生活品質為宗旨。,由吳茂雄等十一人捐助,台北縣政府八十八年八月三十日北府教三字第三三０六六七號函,永久,2000000.00,1,0960430,0960601,0960507,,"董事印鑑。
修訂捐助章程第6條。",,,,
096法登他000069,1,2,林文鼎,365,0960430,0960430,0960501,13冊23頁,2,5,吳東賢,財團法人台灣省台北縣竹塹吳氏宗祠,0880819,台北縣林口鄉文化一路190巷7弄1號9樓之3,本中華民族慎終追遠之精神，以闡揚傳統孝道美德，促進社會祥和及國家安寧，並推動社會福利慈善公益事業。,由吳東興等捐助,台北縣政府八十八年七月二十七日北府民二字第二七九三二一號函,永久,17554089.00,1,0960430,0960601,0960507,,董事監察人印鑑。,,,,
096法登他000070,1,2,林文鼎,200,0960502,0960502,0960503,7冊53頁,2,5,卓敏枝,財團法人台大商學會計文教基金會,0840626,台北縣永和市中和路343號15樓之1,以提昇商學會計學術研究及教育水準為宗旨,由卓敏枝等人捐助,台北縣政府八十四年五月二十七日北府教三字第一八四一一０號函,永久,3000000.00,1,0960502,0960702,0960509,,董事印鑑。,,,,
096法登他000071,1,2,林文鼎,561,0960502,0960502,0960503,19冊57頁,2,2,吳寶田,財團法人麗寶文化藝術基金會,0921119,台北縣五股鄉成泰路1段189巷16號2樓,以推廣各項文化藝術社區教育公益工作為宗旨。,由麗寶建設股份有限公司捐助,臺北縣政府九十二年十月二十二日北府文行字第０九二０００八五五六號函,永久,5000000.00,1,0960502,0960702,0960509,,董事印鑑。,,,,
096法登他000072,1,2,林文鼎,594,0960504,0960504,0960507,21冊3頁,2,2,陳威仁,財團法人台北縣取得私有既成道路基金會,0931026,台北縣板橋市中山路1段161號13樓,以協助臺北縣政府取得轄區內私有既成道路及其他公共設施保留地，以健全都市及交通發展為目的。,由臺北縣政府捐助,臺北縣政府九十三年十月二十六日北府工新字第０九三０六八二七五三號函,永久,10000000.00,1,0960504,0960702,0960509,,董事監察人印鑑。,,,,
096法登他000073,1,2,林文鼎,322,0960509,0960509,0960510,11冊57頁,2,5,曾黃麗明,財團法人台北縣私立瀚邦國際社會福利慈善事業基金會,0870715,台北縣新莊市長青街17號3樓之2,以舉辦社會福利慈善事業為宗旨。,由曾黃麗明、曾梁源、曾瀚霆捐助。,台北縣政府八十七年七月六日北府教三字第二０四三一七號函,永久,10000000.00,1,0960509,0960702,0960516,,董事印鑑。,,,,
096法登他000074,1,2,林文鼎,410,0960509,0960509,0960510,14冊53頁,2,3,楊玉良,財團法人錦和高中文教基金會,0890415,台北縣中和市錦和路163號,以獎助品學兼優或家境清寒學生，及協助本校改善教育環境發展校務為目的。,由邱垂益等人捐助,臺北縣政府八十九年三月二十日八九北府教社字第０九八三六０號函,永久,2000000.00,1,0960509,0960702,0960516,,"修正捐助及組織章程名稱、第1條、第4條。
法人圖記及董事印鑑。",,,,
096法登他000075,1,2,林文鼎,224,0960510,0960510,0960511,8冊41頁,1,11,顧懷祐,財團法人台灣省台北縣私立醒吾高級中學,0551231,台北縣林口鄉力行路2號,為供應私立醒吾高級中學所需之一切設備及經費,由顧懷祖先生捐助,台灣省政府教育廳五十二年七月二十七日教二字第０六六三一號函,永久,149288983.00,1,0960510,0960702,0960517,,,,,,
096法登他000076,2,2,林文鼎,693,0960510,0960510,0960511,24冊11頁,2,2,徐明輝,社團法人中華國際供佛齋僧功德會,0931214,台北縣中和市中山路2段255號11樓之2,以舉辦國內外供佛齋僧活動，藉以推展國際佛教文化交流，弘揚大乘佛教，接引大眾，淨化人心，促進社會祥和，達成世界和平為宗旨。,入會費、常年會費、事業費、會員捐款、委託收益、基金及其孳息、其他收入。,內政部93年1月2日台內社字第0930071614號函,永久,300000.00,1,0960510,0960702,0960517,,"修訂章程第13條、第17條、第20條、第30條。
理監事印鑑。",,,,
096法登他000077,1,2,林文鼎,274,0960511,0960511,0960514,10冊21頁,2,7,王陳𤆬,財團法人臺灣省臺北縣泰山基督教會美門堂,0661130,台北縣泰山鄉明志路一段三五四號,以信奉基督耶穌為救世主，遵守聖經教訓，宣揚基督福音，勸人悔罪歸主，行善助人，造福社會為宗旨。,由會友捐助,台北縣政府六十六年五月二日北府民一字第八二一九號,永久,44940000.00,1,0960511,0960702,0960518,,董事印鑑。,,,,
096法登他000078,1,2,林文鼎,304,0960511,0960511,0960514,11冊21頁,2,4,林皙陽,財團法人李江却台語文教基金會,0860129,台北縣三重市重陽路1段43巷20號3樓Ａ室,以恢復台灣各族群語言的生命為宗旨,由林皙陽、李秀卿捐助。,台北縣政府八十六年一月七日北府教三字第七六九三號函,永久,2000000.00,1,0960511,0960702,0960518,,董事印鑑。,,,,
096法登他000079,2,2,林文鼎,613,0960511,0960511,0960514,21冊41頁,2,4,劉國順,社團法人台灣寶島行善義工團,0901006,台北縣中和市中正路855巷16號1樓,一、急難救助。二、災區重建。三、維護環境。四、幫助人類。,入會費、常年會費、事業費、會員捐款、委託收益、基金及其孳息、其他收入。,內政部90年7月17日台90內社字第9002862號函,永久,400000.00,1,0960511,0960702,0960518,,理監事印鑑。,,,,
096法登他000080,2,2,林文鼎,546,0960514,0960514,0960515,19冊27頁,2,4,林秋英,社團法人臺北縣視障協會,0920401,台北縣樹林市長壽街70巷14弄7號,以輔導及服務視障者，爭取視障者合法權益、福利，促進視障者獨力人格及尊嚴的建立為宗旨。,會員入會費、常年會費及其他收入。,臺北縣政府九十一年三月二十二日北府社團字第０九一０一三六二八八號函,永久,258618.00,1,0960514,0960702,0960521,,理監事印鑑。,,,,
096法登他000081,1,2,林文鼎,569,0960514,0960514,0960515,20冊13頁,2,4,周杰之,財團法人台灣省台北縣基督教永和國語禮拜堂,0640529,台北縣永和市勵行街66巷2號,以管理運用永和國語禮拜堂所有一切財產，使信徒獲得靈性長進，及傳揚耶穌基督救世福音，並推動社會福利及公益事業為宗旨。,由信徒捐獻,臺北縣政府六十四年四月十四日北縣民一字第五十號許可證書,永久,755745.00,1,0960514,0960702,0960521,,董事印鑑。,,,,
096法登他000082,2,2,林文鼎,555,0960514,0960514,0960515,19冊45頁,2,2,張春梅,社團法人中華勵本志身心障礙者技藝創業協會,0920626,台北縣新莊市建安街17巷16號1樓,以團結中華民國之身心障礙者，配合政府推展身心障礙福利政令，結合社會的資源協助身心障礙者，鼓勵身心障礙者自立自強，爭取身心障礙者參與社會的權利，開拓身心障礙者的創業契機為宗旨。,會員入會費、常年會費及其他收入。,內政部九十二年六月二十六日台內社字第０九二００二四七八一號函,永久,130000.00,1,0960514,0960702,0960521,,理監事印鑑。,,,,
096法登他000083,2,2,林文鼎,214,0960515,0960515,0960516,8冊21頁,1,4,卜炳琴,社團法人台北縣身心障礙者福利促進協會,0840920,台北縣板橋市文化路2段451號3樓,以成為造福身體及心理障礙者的媒介為宗旨。,會員入會費、常年會費及其他收入。,台北縣政府八十四年八月二十五日八四北府社一字第三一一八三八號函,永久,307000.00,1,0960515,0960801,0960522,,,,,,
096法登他000084,1,2,林文鼎,452,0960516,0960516,0960517,16冊17頁,2,3,林靜華,財團法人慈祐教育基金會,0900323,台北縣中和市中山路2段269號10樓,以促進兒童身心健全發展，輔導青少年課餘正規生活教育，拓展中年人才藝、美容、健康、體育、語言進修、電腦、理財等知識領域，培養老年人正當休閒娛樂，宣導現代經濟生活觀念，獎勵優秀教育工作者及學子為宗旨。,由林朝財、黃燦玉捐助。,臺北縣政府九十年三月十三日北府教社字第０八七八八三號函,永久,12200000.00,1,0960516,0960702,0960523,,董事印鑑。,,,,
096法登他000085,2,2,林文鼎,479,0960516,0960516,0960517,17冊13頁,2,4,翁偉國,社團法人臺北縣弱勢彩券協會,0901024,台北縣土城市福祥街69號2樓,維護會員之共同利益及保障其合法權益，協助會員爭取工作機會與合理待遇，保障會員基本生活。配合政府結合社會資源推動社會福利政策，促進社會繁榮，共創台灣社會福利國之願景。,會員入會費、常年會費及其他收入。,臺北縣政府九十年八月十七日北府社團字第三０六四八七號函,永久,64577.00,1,0960516,0960702,0960523,,理監事印鑑。,,,,
096法登他000086,1,2,林文鼎,694,0960518,0960518,0960521,24冊12頁,1,3,洪春安,財團法人防焰安全中心基金會,0870605,台北縣土城市中央路3段76巷42號1樓,以從事防焰性能之研究及認定，防焰加工技術之改進，並接受政府委託辦理相關防焰認證及防焰專業人員之講習訓練事宜，以促進火災預防，抑制火災發生或擴大，確保國人生命財產，維護公共安全為宗旨。,由洪春安、林權訓、許凱南、黃旭陽、楊欣家等捐助,內政部87年5月11日台87內消字第8774290號函,永久,10000000.00,1,0960518,0960702,0960525,,,,,,
096法登他000087,1,2,林文鼎,327,0960522,0960522,0960523,12冊7頁,2,4,劉炳輝,財團法人台灣省私立板信社會福利慈善事業基金會,0870829,台北縣板橋市成都街18號2樓,以辦理社會福利慈善事業為宗旨。,由板信商業銀行捐助,台灣省政府社會處八十七年八月十四日八七社一字第四五九八九號函,永久,25750000.00,1,0960522,0960702,0960529,,董事印鑑。,,,,
096法登他000088,1,2,林文鼎,199,0960523,0960523,0960524,7冊51頁,1,8,周法平,財團法人中華啟能基金會,0720105,台北縣三重市重新路四段一八四巷二十五弄十九號,以舉辦或捐助社會福利慈善事業為目的。,由范立明等人捐助,內政部七十一年十月二十九日(71)台內社字第一二一二０二號函,永久,378080005.00,1,0960523,0960702,0960530,,,,,,
096法登他000089,1,2,林文鼎,279,0960523,0960523,0960524,10冊31頁,1,4,李添財,財團法人金車原住民文教公益基金會,0860408,台北縣泰山鄉工專路84號,以獎助原住民清寒學子、培養人才及舉辦原住民有關之公益活動等為宗旨。,由李添財、楊兆麟捐助。,台北縣政府八十六年三月八日北府教三字第０八一七三三號函,永久,10246000.00,1,0960523,0960702,0960530,,,,,,
096法登他000090,1,2,林文鼎,219,0960523,0960523,0960524,8冊31頁,1,11,謝武弘,財團法人功學社關係企業社會福利基金會,0651209,台北縣蘆洲市中山二路162號12樓,以舉辦及獎助社會福利事業為宗旨,由功學社教育用品股份有限公司等捐助,內政部六十五年十二月九日台內社字第七一五四三三號函,永久,74246352.00,1,0960523,0960702,0960530,,,,,,
096法登他000091,1,2,林文鼎,239,0960523,0960523,0960524,9冊11頁,1,17,楊萬運,財團法人台灣省台北縣私立金陵女子高級中學,0490609,台北縣三重市重新路5段656號,為遵照國家教育政策暨現行教育法令之規定，辦理高級中學暨附設國民中學部，並謀其健全發展。,由社會熱心教育人士捐助,台北縣政府四十六年二月十四日北府德教一字第０六七四號〈主管機關改隸教育部〉,永久,1063823305.00,1,0960523,0960702,0960530,,修正董事會組織章程第12條、第13條。,,,,
096法登他000092,2,2,林文鼎,648,0960524,0960524,0960525,22冊26頁,1,1,葉建鋒,社團法人臺北縣身心障礙者弘德協會,0950504,台北縣板橋市和平路62號1樓,以團結各類型身心障礙者及社會上具有熱誠之愛心人士，使其傷健一家，共同發揮弘德助人精神，以促進身心障礙者身心平衡發展，自立自強，互助互勵，進而達到服務人群，回饋社會為宗旨。,入會費、常年會費、事業費、會員捐款、委託收益、基金及其孳息、其他收入。,臺北縣政府95年3月3日北府社團字第0950103431號函,永久,1000.00,1,0960524,0960702,0960531,,新任理事吳秋成印鑑登記。,,,,
096法登他000093,2,2,林文鼎,445,0960525,0960525,0960528,16冊3頁,2,4,王炳勝,社團法人臺北縣國際生命線協會,0900207,台北縣板橋市四川路2段245巷89號,以發揚博愛精神，運用專業能力辦理生命線社會服務工作為宗旨。,會員入會費、常年會費及其他收入。,"臺北縣政府九十年二月一日北府社團字第０三七八００ 號函",永久,2169839.50,1,0960525,0960702,0960601,,理監事印鑑。,,,,
096法登他000094,1,2,林文鼎,196,0960525,0960525,0960528,7冊45頁,1,13,黃麗芳,財團法人醒吾技術學院,0540920,台北縣林口鄉力行路2號,為供應醒吾技術學院所需之一切設備及經費,由顧懷祖捐助,教育部五十四年十月二十一日台54高字第一六三七五號,永久,1396609288.00,1,0960525,0960702,0960601,,董事長黃麗芳印鑑登記。,,,,
096法登他000095,1,2,林文鼎,101,0960529,0960529,0960530,4冊35頁,1,5,陳哲三,財團法人印刷工業技術研究中心,0820413,台北縣三重市光復路1段61巷27號11樓之3,以配合政府印刷工業之發展政策，從事印刷工業之機材生產技術，品質工程管理，印刷品外銷之研究發展，印刷工業技術移轉，人才培育及印刷前後技術整合與發展，藉以促進印刷工業技術升級為宗旨。,由經濟部工業局及台灣區印刷工業同業公會捐助,經濟部八十二年三月二日經82商字第二０四九九九號函,永久,40800000.00,1,0960529,0960702,0960605,,董事林美雪印鑑登記。,,,,
096法登他000096,1,2,林文鼎,145,0960601,0960601,0960604,6冊3頁,1,5,林延男,財團法人國立泰山高級中學文教基金會,0830324,台北縣泰山鄉辭修路7號,以協助學校改善環境，發展校務，獎勵教師研究進修，促進學生敦品勵學為宗旨。,由熱心教育人士捐助,台北縣政府八十三年三月十七日北府教三字第０八九０三三號函,永久,7000000.00,1,0960601,0960801,0960608,,,,,,
096法登他000097,1,2,林文鼎,505,0960604,0960604,0960605,18冊5頁,1,4,葉綢妹,財團法人台灣省台北縣天主教亞西西方濟各修女會,0620628,台北縣土城市福祥街39號5樓,一、經辦或籌辦之社會、教育、宗教、公益、福利等事業所需用之一切設備及經費。二、培植本會新進會之修女，訓練初學生及年高病患修女妥善獲得贍養之所需。,由天主教台北總主教公署捐助,臺北縣政府六十二年六月十九日,永久,180778482.00,1,0960604,0960801,0960611,,修正捐助及組織章程第2條、第18條。,,,,
096法登他000098,1,2,林文鼎,698,0960606,0960606,0960607,24冊16頁,2,7,黃俊雄,財團法人黃土英文教基金會,0780620,台北縣三重市光復路1段121號,以提昇教育水準為宗旨。,由黃土英、黃博治、黃俊雄等捐助,教育部78年6月1日台78高字第25673號函,永久,21303680.00,1,0960606,0960801,0960613,,董事印鑑。,,,,
096法登他000099,1,2,林文鼎,36,0960607,0960607,0960608,2冊23頁,2,8,洪吉春,財團法人臺北縣文化基金會,0771103,台北縣板橋市莊敬路62號,以規劃、協調、推動台北縣社會教育及文化活動，提昇縣民文化水準為目的。,由台北縣政府等捐助,台北縣政府七十七年九月十三日北府教三字第二八三一五四號函,永久,131200000.00,1,0960607,0960801,0960614,,"董監事印鑑。                                                    
修正捐助章程第2、3、6、17、19、23條，增訂第6條，刪除第18條。",,,,
096法登他000100,1,2,林文鼎,525,0960608,0960608,0960611,18冊45頁,2,2,陳林阿滿,財團法人陳萬富教育基金會,0910905,台北縣蘆洲市中正路43號,以普及全民教育及推廣文化教育為宗旨。,由陳萬富捐助,教育部九十一年八月二十八日台九一社四字第九一一二八０二一號函,永久,30000000.00,1,0960608,0960801,0960615,,董事印鑑。,,,,
096法登他000101,1,2,林文鼎,123,0960608,0960608,0960611,5冊19頁,1,12,黃耀堂,財團法人紡織產業綜合研究所,0490201,台北縣土城市承天路六號,以配合政府政策，進行紡織產業之綜合研究，提高紡織產業水準，促進經濟繁榮與提升國家整體競爭力為目的。,由工業技術研究院化學工業研究所及台灣區棉紡工業同業公會捐助,經濟部四十八年十二月三日經台(48)二字第一七七三二號函,永久,196854049.00,1,0960608,0960801,0960615,,董事杜紫軍印鑑登記。,,,,
096法登他000102,1,2,林文鼎,143,0960611,0960611,0960612,5冊59頁,2,6,尤進興,財團法人樹春文教基金會,0830126,台北縣三峽鎮大仁路2號7樓,以協助推廣教育活動，提倡社會優良風氣為宗旨。,由尤進興等六人捐助,台北縣政府八十二年十二月二十七日北府教三字第四七五０八六號,永久,6000000.00,1,0960611,0960801,0960621,,"修正捐助章程第4條、第6條、第15條。
董事印鑑。",,,,
096法登他000103,1,2,林文鼎,439,0960613,0960613,0960314,15冊51頁,2,3,李志賢,財團法人清雲教育基金會,0891213,台北縣泰山鄉明志路3段423號6樓,以培育優秀人才，提倡書香社會為宗旨。,由李志賢、李王玉娟捐助。,臺北縣政府八十九年十一月二十九日北府教社字第四五七四三六號函,永久,2000000.00,1,0960613,0960801,0960621,,"修正捐助章程第5條、第6條、第7條。
董事印鑑。",,,,
096法登他000104,1,2,林文鼎,667,0960613,0960613,0960614,23冊15頁,1,1,李信誼,財團法人台北縣私立李氏瓦丹林秀金連社會福利慈善事業基金會,0950922,台北縣三峽鎮大同路88巷3之1號,以舉辦社會福利慈善事業為宗旨。,由李金連捐助,臺北縣政府95年9月20日北府社助字第0950628996號函,永久,10000000.00,1,0960613,0960801,0960621,,修正捐助章程第7條。,,,,
096法登他000105,2,2,林文鼎,447,0960614,0960614,0960615,16冊7頁,2,8,林永裕,社團法人臺灣省土木技師公會,0900223,台北縣板橋市三民路2段37號12樓Ａ3,以加強會員聯繫，保障會員權益，提高土木工程技術水準，發揚服務精神及協助政府推展國家建設為宗旨。,會員入會費、常年會費、福利金、事業費及其他收入。,臺灣省政府九十年二月十四日九０府社行字第二九八一號函〈主管機關改隸內政部〉,永久,72217947.00,1,0960614,0960801,0960621,,理監事印鑑。,,,,
