登記案號,類別,案由,主任,登記號數,收件日期,登記日期,公告日期,登記簿,任期判定,屆期判定,法人代表,法人名稱,設立登記日期,主事務所,目的,捐助方法,許可機關日期,存立時期,財產總額,結案原因,結案日期,歸檔日期,發證日期,代理人,代理人住址,郵遞區號,第二個代理人,第二個代理人住址,郵遞區號,送達代收人姓名,送達代收人住址,郵遞區號,清算人,變更原因,註銷日期,撤銷日期,撤(註)銷機關文號,撤(註)銷原因
073法000009,1,2,王復生,3,0731113,0731126,0731129,1冊3頁,,0,曾水沂,財團法人慈惠石壁部堂,0620220,花蓮市國福里十一鄰一一九號,傳佈無極瑤池金母道教教義及社會救濟事會。,信徒捐助。,六十二年一月三十日花蓮縣政府,永久,700000.00,1,0850502,0850502,0850502,,,,,,,,,,,,,,,
073法登000001,1,2,王復生,14,0730117,0730121,0730122,1冊14頁,,0,黃金鳳,財團法人台灣省花蓮縣私立國光高級商工職業學校,0560214,花蓮市中正路四十六號,創設花蓮縣私立國光商工職業學校，培育工商專業人才。,基本財產由各董事捐助,台灣省政府教育廳民國五十五年十一月二十八日,永久,15679329.00,1,0850515,0730126,0730126,,,,,,,,,,,,,,,
073法登000002,1,1,王復生,40,0730217,0730220,0730222,1冊40頁,,0,陳水土,財團法人呂阿章先生獎學金管理委員會,0730220,花蓮市光復街三十六號,獎勵花蓮縣民優秀清寒子弟就讀國內公私立大學院校，以培養縣境人才。,由呂阿章先生遺族捐贈新台幣630000萬元，花蓮市第二信用合作社配合捐贈新台幣370000萬元。,花蓮縣政府民國七十三年一月十七日,永久,1000000.00,1,0850601,0730226,0730226,,,,,,,,,,,,,,,
073法登000003,1,2,王復生,10,0730514,0730614,0730618,1冊10頁,,6,許木碇,財團法人台灣省花蓮縣私立四維高級中學,0511115,花蓮市國慶里德興三十八號,為創辦四維中學並謀其發展為目的。,,台灣省政府民國五十一年八月七日教二字第42523號,,69512930.00,1,0850511,0730620,0730620,,,,,,,,,,,,,,,
073法登000004,1,2,王復生,7,0730523,0730529,0730530,1冊7頁,,0,何淑雅,財團法人台灣省花蓮縣基督教女教士差會,0471119,花蓮市民權八街一號,傳播基督福音救養貧苦盲女及義務醫療牙疾為目的。,本會之美國總會撥給,四十七年十月二十三日花蓮縣政府府萍民一字第五五四六六號,永久,6155693.00,1,0850518,0730530,0730530,,,,,,,,,,,,,,,
073法登000006,1,2,王復生,35,0730801,0730804,0730808,1冊35頁,,0,許文發,財團法人花蓮太魯閣祥德寺,0720428,花蓮縣秀林鄉富世村天祥十六號,弘揚佛教教義，導化人心，匡正社會風氣及促進太魯閣風景區之發展為目的。,信徒及熱心公益事業之社團、財團以及社會人士捐助。,花蓮縣政府七十一年十月二十一日府民禮字第七一八九二號,永久,500000.00,1,0850531,0730812,0730812,,,,,,,,,,,,,,,
073法登000010,1,1,程佩珍,44,0730921,0730927,0730930,1冊44頁,,0,江天順,財團法人臺灣省花蓮縣臺灣基督長老教會美港教會,0730927,花蓮市中美二街六十一號,"秉耶穌基督之精神在花蓮縣傳揚基督教義，辦理社會公益慈善教育事        業。",由董事會籌措及會員捐献。,七十三年九月十五日花蓮縣政府,永久,4780000.00,1,0850601,0731002,0731002,,,,,,,,,,,,,,,
073法登000015,1,2,王復生,8,0731204,0731207,0731208,1冊8頁,,0,單國璽,財團法人花蓮縣花蓮市私立若瑟國民小學,0620607,花蓮市永興路二一號,發展東部教育，培植優良國民。,由天主教聖吳甦樂羅馬聯合修女會捐助。,台灣省政府教育廳四十九年十一月七日教四字第五六七三七號函,永久,6733050.00,1,0850614,0731212,0731212,,,,,,,,,,,,,,,
