105法登他000101,1,2,陳錦鑾,427,1050318,1050318,1050321,8冊157頁,1,7,董事長,天主教聖功醫療財團法人,0850418,高雄市苓雅區建國一路352號,為宏揚耶穌基督博愛世人之精神，推行醫療公益事業，辦理醫療機構以服務社會之目的。,由財團法人天主教聖母無原罪方濟傳教修女會捐贈。,行政院衛生署85年1月16日衛署醫字第85000023號,永久,566876354.00,1,1050318,,,馮郁婷,,,,,,,,,,程變更：原章程第6條於105年2月15日經法人第7屆第7次董事會議修正通過，報經主管機關備查。,,,,,https://aomp109.judicial.gov.tw/judbp/whd6k/q/N6-NxFLQ8-kknXuPh9MgukyrX72AVhw5Mj4_itEe7_XPMoxloZmJOvc9Yr8=
105法登他000102,2,2,陳錦鑾,1213,1050318,1050321,1050322,23冊10頁,1,3,理事長,社團法人高雄市記帳及報稅代理人公會,0990824,高雄市新興區忠孝一路460號3樓之1,以保障會員權益，增進會員知識，舉辦會員在職專業教育進修，爭取會員執業尊嚴及社會地位，謀求會員福利，為社會工商業服務為宗旨。,會費及捐助,高雄市政府社會局94年7月15日高市社局一字第0940023576號函,永久,100000.00,1,1050321,,,黃淑梅,,,,,,,,,,一、法人名稱變更為社團法人高雄市記帳及報稅代理人公會。二、法人圖記變更。三、章程變更：原章程第1條於105年2月15日經法人第3屆第2次臨時會員大會修正通過，報經主管機關備查。四、理監事變更：第3屆理監事任期中陳阿金辭任常務理事等職務，由陳靖惠遞補常務理事等職務。五、新任理事印鑑登記。,,,,,https://aomp109.judicial.gov.tw/judbp/whd6k/q/Wm4ksDOe3lQbj0JGr6nMHqsPqfPfYqxKLeShceXYwxpqX4MPOgvJjtnt9Ca-
105法登他000103,2,2,陳錦鑾,826,1050321,1050321,1050322,13冊353頁,2,7,理事長,社團法人高雄市小草關懷協會,0930401,高雄市小港區宏仁街39號11樓,服務遭受身心壓力的朋友，協助其解脫心身症狀的束縛，推廣各種解壓的方法與知識，幫助患者自我調適，增強抗壓免疫能力，以達到安頓身心，自助助人的目標。,會費及捐助等,高雄市政府93年3月11日高市府社一字第0930014049號函,永久,187682.00,1,1050321,,,胥蘭芳,,,,,,,,804,,一、法人圖記變更。二、原章程第1、3、5條於法人104年7月24日第6屆第2次會員大會修正通過，報經主管機關備查。三、理監事變更：第5屆理監事任期屆滿，改選第6屆理監事。四、理監事印鑑登記。,,,,,https://aomp109.judicial.gov.tw/judbp/whd6k/q/12y2TRi00aYIm3mIZUvn_Afjyg4fIOyA1cp3iqkRXxRaYC8-W9CtvVwjDHA=
105法登他000104,1,2,陳錦鑾,513,1050321,1050321,1050322,10冊95頁,1,6,董事長,財團法人高雄市私立義大國際高級中學,0870424,高雄市大樹區學城路一段6號,為規劃完善的十二年一貫學制，並推廣優質國際教育嘉惠學子。,由林義守等捐助,高雄縣政府、民國86年9月17日（96年8月22日改隸於教育部）,永久,577676534.00,1,1050321,1050505,1050406,歐丹鳳,,,,,,,,,,"財產總額變更：原財產總額為新台幣573,958,741.0元整，變更為新台幣577,676,534.0元整。",,,,106年5月9日雄院和登513字第1061011313號移轉橋院管轄,https://aomp109.judicial.gov.tw/judbp/whd6k/q/t6tGqn1svBLqjW8_uAVDS5JJRQa16ZIwK3GmCfYQb-IVuBuGHJQJxYuQPVk=
105法登他000105,1,2,陳錦鑾,242,1050322,1050322,1050322,5冊46頁,1,,董事長,財團法人高雄美國學校,0791128,高雄市左營區翠華路889號,為增進外僑在南台灣之投資，提供外僑子弟正規教育，本法人以提供高品質之獨立教育設備為宗旨。,由熱心教育人士捐助,台灣省政府教育廳、民國79年11月13日79教四字第89281號函，88年1月1日改隸高雄市政府,永久,1750947.00,1,1050322,1050505,1050331,許憶華,高雄市前金區中正四路211號22樓之4,801,,,,,,,,一、主事務所變更為高雄市左營區翠華路889號。二、原章程第3條於法人104年4月7日董事會議修正通過，報經主管機關備查。三、董事變更：董事哈國瑞、張瑪龍任期屆滿，指派哈國瑞、高玉樹擔任董事，董事張基昌、鄭津津、陳碧宜任期中辭任董事職務改指定林建中、王英斌、柯俊吉續任。四、董事印鑑登記。,,,,106年3月2日雄院和登242字第1061005425號函移轉橋頭地院管轄,https://aomp109.judicial.gov.tw/judbp/whd6k/q/kdSV3bsNo5UAvVCucb1x0Gv6Sr2lNWkSMirBND7uOeL7_H1zsFTxgwU8HAw=
105法登他000106,1,2,陳錦鑾,1390,1050322,1050322,1050322,27冊29頁,1,2,董事長,財團法人郁品堂中醫基金會,1010925,高雄市苓雅區明德街151號2樓,本會基於「取之於社會，用之於社會」的精神，以中醫養生理論為指導，中醫自主健康管理為方法，達到「未病先防」與「已病防變」的目標為宗旨。,會費及捐助等,行政院衛生署101年9月17日衛署醫字第1010213544號函,永久,10000000.00,1,1050322,,,許妙璟,基隆市安樂區基金一路135巷21弄11號,,,,,,,,,一、主事務所變更為高雄市苓雅區明德街151號2樓。二、章程變更：原章程第4、6條經法人104年12月8日第2屆第2次董事會修正通過，經本院105年法字第6號民事裁定准予變更裁定確定，並報經主管機關備查。,,,,,https://aomp109.judicial.gov.tw/judbp/whd6k/q/1PA1qQ7QoPjX3YluhBuJIN7kjjgm4gW7s7LG5IkeH3iAY7Q5MK4_DoDSrFAI
105法登他000107,1,2,陳錦鑾,251,1050323,1050323,1050324,5冊55頁,2,4,董事長,財團法人中華基督教岡山浸信會,0800904,高雄市岡山區介壽西路54號,傳揚福音領人歸主，遵行聖經教訓，發揚基督救世精神，並視需要辦理教育，托兒及慈善事業等，以服務社會。,捐助,高雄縣政府八十年七月三日八十府民禮字第九二九六八號,永久,4528000.00,1,1050323,1050505,1050406,戴家諒,高雄市岡山區介壽西路54號,820,,,,,,,,一、董事、監察人變更：第3屆董事、監察人任期屆滿，改選第4屆董事、監察人。二、董事、監察人印鑑登記。,,,,105年10月27日雄院和登251字第1051037109號函移送橋頭地方法院管轄,https://aomp109.judicial.gov.tw/judbp/whd6k/q/p4Lypd9vFqDbd0dBV0MgWcoHHdamq82DTrrGuAPp5ypJhVacO9-Wxf-xGYk=
105法登他000108,1,2,陳錦鑾,592,1050323,1050323,1050324,11冊213頁,1,6,董事長,財團法人高雄市私立洪賴金珠社會福利慈善事業基金會,0880723,高雄市新興區中正三路55號11樓之1,以舉辦社會福利慈善事業為宗旨。,捐助,高雄縣政府、民國88年7月15日八八府社福字第130109號函,永久,108350890.00,1,1050323,,,董昭欒,,,,,,,,,,一、董事變更：第6屆董事曾連彩任期中逝世，選聘黃鑠喬繼任董事職務。二、新任董事印鑑登記。,,,,,https://aomp109.judicial.gov.tw/judbp/whd6k/q/6uyNlWUPjevjA9ZzTVJbYFGs3wSuvTZ9RrMLORMTC6j37hD-OiSywk_K4Dg=
105法登他000109,1,2,陳錦鑾,1274,1050323,1050323,1050324,24冊31頁,1,2,董事長,財團法人善慧恩社會慈善基金會,1000303,高雄市左營區大順一路93號9樓之1,本會以辦理社會慈善事業為目的。,由黃弘仁捐助,內政部100年2月14日內授中社字第1000002095號函,永久,30000000.00,1,1050323,,,莊雅朱,,,,,,,,,,一、董事變更：第2屆董事任期中黃弘仁辭任董事及董事長職務，改選彭春貴繼任董事長職務，另選聘徐秀榮繼任董事職務。二、新董事長、董事印鑑登記。,,,,,https://aomp109.judicial.gov.tw/judbp/whd6k/q/BVnk7VBlxALnRDFR2JcX36hFyJzB7vMTnZvprKrI9Bw70RC0DgbLaJgwZ8ZI
105法登他000110,2,2,陳錦鑾,1447,1050323,1050324,1050325,29冊6頁,2,2,理事長,社團法人高雄市旗津中洲基督全人關懷協會,1020528,高雄市旗津區敦和街2巷56弄9號,以聖經教導傳道基督耶穌大愛精神，實踐社會關懷，彼此相愛不分國界為宗旨。,會費及捐助,高雄市政府社會局102年4月25日高市社人團字第10233342700號函,永久,59000.00,1,1050324,,1050406,洪守志,,,,,,,,,,一、主事務變更為高雄市旗津區敦和街2巷56弄9號。二、理監事變更：第一屆理監事任期屆滿，改選第2屆理監事。三、理監事印鑑登記。,,,,,https://aomp109.judicial.gov.tw/judbp/whd6k/q/DIL7DquK2ooK-1ey4S4a6DTNUMIqMmEcr7CzYyDsuLSz2AFkbgpNP1Eqbr6i
105法登他000111,1,2,陳錦鑾,174,1050324,1050324,1050325,4冊68頁,1,9,董事長,財團法人義守大學,0770121,高雄市大樹區學城路1段1號,為遵照國家教育政策暨現行法令之規定，辦理高等工業科技教育，為國儲才、並謀其健全發展。,由國統投資開發有限公司捐助,教育部、民國75年5月26日台(75)22328號函。,永久,9212660567.00,1,1050324,1050505,1050330,宋星明,,,,,,,,,,"財產總額變更：原財產總額新台幣9,120,905,295.0元整，變更為新台幣9,212,660,567.0元整。",,,106年6月14日雄院和登174字第1061014438號函移轉橋頭地方法院管轄,,https://aomp109.judicial.gov.tw/judbp/whd6k/q/6V1jwjfrrp6zyIGPA5SkWWrglVgc3nShn6yyAh7vOnx-7ifC_a__p_FrK3A=
105法登他000112,1,2,陳錦鑾,1532,1050324,1050325,1050328,31冊11頁,1,,董事長,財團法人高雄市晉禾社會福利慈善事業基金會,1030626,高雄市田寮區新興路168號,以辦理社會福利慈善事業為目的。,由蔡永裕、蔡永泉、陳錫惠、蔡菘涵、蔡雄田、蔡榮泰等6人捐助,高雄市政府社會局103年6月16日高市社人團字第10335199300號函,永久,403245000.00,1,1050325,1050505,1050406,羅寶豊,高雄市岡山區新樂街107號,820,,,,,,,,"財產總額變更：原財產總額新台幣360,000,000.0元整，變更為新台幣403,245,000.0元整。",,,,106年3月17日雄院和登1532字第1061006822號移轉台灣橋頭地方法院,https://aomp109.judicial.gov.tw/judbp/whd6k/q/pcLGada-z3Rsn3IqOpj1EQyMF7LP_6kvmtZUg1XoNooTs_4OZ7feq2c_njEk
105法登他000113,1,2,陳錦鑾,534,1050325,1050325,1050328,10冊179頁,1,5,李靖國,財團法人李瑞標紀念教育基金會,0870729,高雄市苓雅區四維二路118號11樓,本會以獎勵新聞教育推廣文化活動為宗旨。,由李瑞標家屬捐助,高雄市政府教育局、民國87年7月23日,永久,24573660.00,1,1050325,,1050407,江秀絨,,,,,,,,,,"財產總額變更：原財產總額新台幣24,671,160.0元整，變更為新台幣24,573,660.0元整。",,,,,https://aomp109.judicial.gov.tw/judbp/whd6k/q/9nFWMs95GECPoaylJaB6iTqWnRufScGxB2kXMSp7ZxqaErNyWSkJCbvuBaU=
105法登他000114,1,2,陳錦鑾,385,1050325,1050325,1050328,7冊191頁,1,8,董事長,財團法人福康文教基金會,0831215,高雄市五福三路21號10樓,為落實中國文化傳承，追求卓越品質及關懷社會脈動為宗旨。,由陳敏賢等捐助,高雄市政府教育局、民國83年12月13日,永久,43000000.00,1,1050325,,,賴月春,,,,,,,,,,一、董事姓名變更：第8屆董事陳乃菁更名為陳絲縈。二、董事更名印鑑登記。,,,,,https://aomp109.judicial.gov.tw/judbp/whd6k/q/f4XfglTSU7nlsrMrkmz1H7JOJQaB_0JKnmdMhHArdBpV4AvwuyiUYW2a_TE=
105法登他000115,1,2,陳錦鑾,87,1050325,1050325,1050328,3冊31頁,1,12,董事長,財團法人東南文化基金會,0601215,高雄市前金區五福三路21號,一、獎勵家境清寒、優秀青少年完成學業。二、獎勵體育運動提高心身健康。三、有關文化、教育事業等創辦事項。四、育樂活動中心建設事項。五、其他慈善救濟事項。六、辦理研究生貸學金，以培養特殊人才。七、獎勵及培訓資訊管理等相關專業人才，興建高雄世界貿易中心。八、委託或承辦世界中心協會知各項經貿調查與資訊服務。,捐助,臺灣省政府教育廳、民國60年12月3日,永久,379793240.00,1,1050325,,,賴月春,高雄市前金區五福三路21號,801,,,,,,,,一、董事姓名變更：第12屆董事長陳乃菁更名為陳絲縈。二、董事長更名印鑑登記。,,,,,https://aomp109.judicial.gov.tw/judbp/whd6k/q/T8RGWvB8trIlIJHKhSCKnN3btzlDgW9DtAcoeqsbh7kXjoDc8BfCzEG-Ww==
105法登他000116,2,2,陳錦鑾,1285,1050328,1050328,1050329,25冊2頁,2,8,理事長,社團法人高雄市勞資和諧促進協會,1000505,高雄市橋頭區里林東路39之5號,本會以促進勞資和諧增進知識技能並協助政府推行政令之實施為宗旨。,會費及捐助,高雄縣政府82年9月13日82府社行字第155432號函,永久,5000.00,1,1050328,,,凌進源,,,,,,,,,,一、理監事變更：第7屆理監事任期屆滿，改選第8屆理監事。二、理監事印鑑登記。,,,,,https://aomp109.judicial.gov.tw/judbp/whd6k/q/MYJGbrtpbSRs9ZIPp8rzuvf8JMvWdvJXUUdGfwLIEEAvimAvWoUzQMer1lPb
105法登他000117,2,2,陳錦鑾,503,1050328,1050328,1050329,10冊57頁,2,6,理事長,社團法人高雄市妙法慈音學會,0870126,高雄市林園區林園里忠孝西路74號,本會以從事慈善工作為主，並以淨化社會風氣，提升人們精神生活內涵，增進社會安定力量為宗旨。,會員會費及捐助,`高雄縣政府、民國85年4月1日,永久,500000.00,1,1050328,,,張玉恩,,,,,,,,,,一、理監事變更：第5屆理監事任期屆滿，改選第6屆理監事。二、理監事印鑑登記。,,,,,https://aomp109.judicial.gov.tw/judbp/whd6k/q/I2vRjomD2nU-KWjiDtZ1cwvFPOr5rZ7j8vGqTySbUMhOSI_YMNswQZU4Xno=
105法登他000118,2,2,陳錦鑾,1219,1050328,1050328,1050329,23冊16頁,2,5,理事長,社團法人高雄市小原流插花協會,0990907,高雄市前金區自強二路102巷11號2樓,以研究日本小原流插花為宗旨。,會費及捐助,高雄市政府社會局97年10月24日高市社局一字第0970043213號函,永久,5000.00,1,1050328,,,羅慧美,高雄市新興區南台路129號5樓之1,800,,,,,,,,一、理監事變更：第4屆理監事任期屆滿，改選第5屆理監事。二、理監事印鑑登記,,,,,https://aomp109.judicial.gov.tw/judbp/whd6k/q/N5SSf7-dwGHmtwHNjFjW6YvjnUO-JOihhM9nr9M1qcrPvt4vH-JhPTDe5PKb
105法登他000119,2,2,陳錦鑾,968,1050328,1050513,1050514,15冊197頁,2,4,理事長,社團法人高雄市憨兒就業輔導協會,0951014,高雄市美濃區和興路13之1號,本會以為身心障礙者謀求福利，及發揚客家傳統精神，並結合社區環境輔導其技職教育、就業安置、回歸社區生活，以實現於經濟、社會及生活上的所有潛能為宗旨,會員會費及捐助,高雄縣政府社會局民國94年10月20日府社行字第0940226780號函,永久,50000.00,1,1050513,,,,,,,,,,,,,一、理監事變更：第3屆理監事任期屆滿，改選第4屆理監事。二、理監事印鑑事記。,,,,,https://aomp109.judicial.gov.tw/judbp/whd6k/q/VsSPTfLYzY_Fexss9fRlFPbbhEyIqBIow6FSIm06fZshMZWM-W-We34BGsA=
105法登他000120,1,2,陳錦鑾,996,1050328,1050328,1050329,16冊162頁,2,4,董事長,財團法人高雄市靜觀慈善事業基金會,0960504,高雄市左營區大順一路93號8樓之4,以辦理社會福利慈善事業為目的,由陳淑愛等6人捐助,高雄市政府社會局民國96年4月23日高市社局二字第0960015127號函,永久,20000000.00,1,1050328,,,許素芬,,,,,,,,,,一、董事變更：第3屆董事任期屆滿，改選第4屆董事。二、新任董事歐月琴、洪玉芳印鑑登記，連任董事鐘素幸印鑑變更登記。,,,,,https://aomp109.judicial.gov.tw/judbp/whd6k/q/KB7znQsh9UNCZEzu7uj5G2SsfGnFaM-91ouMer4nG0m2JJ82dyMGWgypskE=
105法登他000121,2,2,陳錦鑾,474,1050329,1050329,1050330,9冊141頁,2,10,理事長,社團法人高雄市心橋勵友協會,0860813,高雄市岡山區公園西路14號,以聯絡殘障人士彼此間之友誼，培養生活之技能，達到自立自強推動殘障傷害預防工作，促進殘障福利為宗旨。,會員會費及捐助,高雄縣政府、民國86年7月11日,永久,2500000.00,1,1050329,1050505,1050407,鍾麗娟,,,,,,,,,,一、理監事變更：第9理監事任期屆滿，改選第10屆理監事。二、理監事印鑑登記。,,,,106年2月2日雄院和登474字第1061002754號函移轉橋頭地方法院管轄,https://aomp109.judicial.gov.tw/judbp/whd6k/q/THCZ7OJYWoerfpWNgbdHxshDUta7_7z-xpZnQC8KgfHMoPVaS5RdegVM-ug=
105法登他000122,1,2,陳錦鑾,683,1050329,1050329,1050330,12冊181頁,2,6,董事長,財團法人東海教育基金會,0891221,高雄市鹽埕區建國四路303號,以關懷社會教育為宗旨,由林瓊璋捐助,高雄市政府教育局、民國89年12月6日高市教四字第8900021503號函,永久,10000000.00,1,1050329,,,饒瑞鵬,,,,,,,,,,一、董事變更：第5屆董事任期屆滿，改選第6屆董事。二、董事印鑑登記。,,,,,https://aomp109.judicial.gov.tw/judbp/whd6k/q/cyH1AlIUUyEgwo9Tu8CldgzMB3Mu3EgpLgAt-siS8y9yfG7b8qymZKDYOhg=
105法登他000123,1,2,陳錦鑾,59,1050329,1050329,1050330,3冊3頁,1,15,董事長,新光學校財團法人,0560923,高雄市大寮區鳳屏一路217號,為遵照國家教育政策暨現行教育法令之規定設立新光學校財團法人,蔡基成等十一人等捐助,台灣省政府教育廳中華民國56年6月5日,永久,190540775.00,1,1050329,,,程振威,,,,,,,,,,章程變更：原捐助章程第7、24條、織組章程第16條於法人104年8月2日第15屆董事會修正通過，其中捐助章程第7、24條經本院104年度法字第40號民事裁定確定准予變更，均報經主管機關備查。,,,,,https://aomp109.judicial.gov.tw/judbp/whd6k/q/3StVJMRNt1E20DKMo8X7ykk7RTJM2C_d3cG1oVtQX-_kho04AGbZuBb8xA==
105法登他000124,2,2,陳錦鑾,1585,1050329,1050331,1050330,32冊24頁,2,11,理事長,社團法人高雄市黃氏宗親會,1040303,高雄市苓雅區苓雅一路290號,以闡揚祖德，敦睦宗誼，增進宗族福利，促互助團結，並發揚中華民族之傳統精神為宗旨。,會費及捐助等,高雄市政府69年4月20日,永久,174280.00,1,1050331,,,潘姿穎,,,,,,,,,,一、章程變更：法人章程第1條於104年度4月6日第10屆第1次臨時會員大會修正通過，第20、21條於法人104年12月13日第11屆第1次會員大會修正通過，以上修正均報經主管機關備查。二、法人圖記變更。三、理監事變更：第10屆理監事任期屆滿，改選第11屆理監事。四、理監事印鑑登記。,,,,,https://aomp109.judicial.gov.tw/judbp/whd6k/q/vlvGd9sLUbnmnnE72YGbRgSqOIdzhjnt8UXUmQ4mVYD4nsYdA4X3tHbqHh02
105法登他000125,2,2,陳錦鑾,1537,1050329,1050329,1050330,31冊16頁,1,,理事長,社團法人高雄市傳愛協會,1030711,高雄市新興區民生一路19號,見苦‧惜福‧再造福‧傳愛最幸福。,會費及捐助,高雄市政府社會局103年7月1日高市社人團字第10335569100號函,永久,60458.00,1,1050329,,1050407,馮雅琪,,,,,,,,,,主事務所變更為高雄市新興區民生一路19號。,,,,,https://aomp109.judicial.gov.tw/judbp/whd6k/q/REmaV6nmzzgdkfihsncUvP1B2R7IUe7t_ZJzw1M42lev51BMX_DBveThUHY8
105法登他000126,1,2,陳錦鑾,749,1050330,1050330,1050331,13冊45頁,1,5,董事長,財團法人藏應宏道基金會,0910717,高雄市三民區九如二路532號7樓,輔導青(少)年宏揚古聖先賢之哲理與道德教育，淨化青少年之心靈，以培養其服務社會人群之精神。,由郭國賢、郭曜豪等二人捐助,"行政院青年輔導委員會、民國91年5月2日青參字第091300091 號函同意設立",永久,5000000.00,1,1050330,,,王秋碧,,,,,,,,,,一、董事變更：第5屆董事任期中鄭卜五、洪能通辭任董事，選聘何永成、許群英繼任董事職務。二、新任董事印鑑登記。,,,,,https://aomp109.judicial.gov.tw/judbp/whd6k/q/kBAiQA4xIaW_rXL5PO2vvFo5lnWlUKm5ktl_RlHQ06pxDpWQqBGPETlrsxs=
105法登他000127,2,2,陳錦鑾,1141,1050330,1050330,1050331,21冊25頁,2,5,理事長,社團法人高雄市天祥宇宙聖道會,0981008,高雄市鳳山區誠群街3巷1號,以倡導倫理道德、促進人心向善、化戾徵祥、社會和諧、世界大同為宗旨。,會員會費及捐助等,高雄市政府社會局93年2月2日高市府社一字第93015號函,永久,160000.00,1,1050331,,,鄭景禖,高雄市鳳山區誠群街3巷1號,830,,,,,,,,一、理監事變更：第4屆理監事任期屆滿，改選第5屆理監事。二、理監事印鑑登記。,,,,,https://aomp109.judicial.gov.tw/judbp/whd6k/q/64okbE1kjeQOsZGzd7jCqy74-7YcbAxHcwBCkhAAmCBXV3_E2rT-SD-GDP4c
105法登他000128,1,2,陳錦鑾,565,1050331,1050331,1050401,11冊105頁,2,6,董事長,財團法人宏洋文教基金會,0880125,高雄市新興區七賢二路68號1樓,舉辦教育文化有關之公益性業務為宗旨。,捐助,高雄市政府教育局中華民國88年1月21日,永久,19538240.00,1,1050331,,,吳佳玲,,,,,,,,,,"一、章程變更：原章程第1條於法人104年12月12日第5屆第2次董事會議修正通過，報經主管機關備查。二、財產總額變更：原財產總額新臺幣17,800,000.0元整，變更為新臺幣19,538,240.0元整。三、董事變更：第5屆董事任期屆滿，改選第6屆董事。四、董事印鑑登記。",,,,,https://aomp109.judicial.gov.tw/judbp/whd6k/q/CwO0RD5MwZJNJDyfUJ-tl3iu04Urh9K8qblGzpI6JDE2SF9aJPOG6eTXi24=
105法登他000129,2,2,陳錦鑾,548,1050401,1050406,1050407,11冊37頁,1,11,理事長,社團法人高雄市盲人福利協進會,0871013,高雄市苓雅區光華一路12號2樓之1,本會以團結盲胞及結合社會愛心力量，激發盲人發揮「殘而不廢」之潛能自立自強，積極參與社會建設與視障團體之活動，進而加強社教宣廣與促進國民外交，使能提昇文化水準及盲人社會地位，改善生活品質，爭取合法權益與福利為宗旨。,會員會費及捐助,"高雄市政府社會局  民國73年8月22日",永久,3689173.00,1,1050406,,,王志強,,,,,,,,,,一、章程變更：原章程第1、25條於法人105年3月17日第11屆第3次會員大會修正通過，報經主管機關備查。二、法人圖記變更登記。,,,,,https://aomp109.judicial.gov.tw/judbp/whd6k/q/eAQTlXZCFoiXAKB9h6MylbDfRha5dWQINzlT9nS84je7xtJjxEF1aSQQkXY=
105法登他000130,1,2,陳錦鑾,170,1050401,1050406,1050407,4冊64頁,1,9,董事長,財團法人和春技術學院,0760430,高雄市大寮區琉球里至學路288號,遵照國家教育政策暨現行教育法令之規定，辦理技術學院，並謀其健全發展。,由羅傳進等捐助,教育部、中華民國76年4月14日,永久,3042841368.00,1,1050406,,,羅雅慧,,,,,,,,,,"財產總額變更：原財產總額新台幣3,205,749,754.0元整，變更為新台幣3,042,841,368.0元整。",,,,,https://aomp109.judicial.gov.tw/judbp/whd6k/q/bXplH5iUwM2JodhIJsAe_xUBhRUGXL-nvaYXj-47E6p0pHkK33i1QCD2EZE=
105法登他000131,2,2,陳錦鑾,492,1050401,1050406,1050407,10冊13頁,2,13,理事長,社團法人高雄市聲暉協會,0861204,高雄市左營區崇德路8巷1號4樓,為鼓勵聽力異常及合併聽力之多重障礙者能求生與上進，擴展有關聽障同胞之社會教育宣導、諮詢、技能訓練之輔導工作，以建立聽覺障礙者之安樂與社會安定為宗旨。,會員會費及捐助,高雄市政府社會局民國86年11月26日,永久,1353700.00,1,1050406,1050505,1050412,翁詠琪,,,,,,,,,,"一、理監事變更：第12屆理監事任期屆滿，改選第13屆理監事。二、理監事印鑑登記。
(107年5月4日雄院和登492字第1071008967號函移轉橋頭地方法院管轄)",,,107年5月4日雄院和登492字第1071008967號函移轉橋頭地方法院管轄,,https://aomp109.judicial.gov.tw/judbp/whd6k/q/HJoLmeH9PpgT5W5HaN7zs96W5esRtkMj-w2HnVCAx42D-T9a9BsAM9a981I=
105法登他000132,2,2,陳錦鑾,899,1050407,1050407,1050408,14冊245頁,2,6,理事長,社團法人高雄市基督教光美教會協進會,0940629,高雄市鼓山區美術南二路18號,依據聖經直理、以落實基督的愛，及宣揚基督福音為使命。發揮教會服務社會的僕人和牧羊人精神。致力於社區居民身心靈的全人關懷，提升社區居民家庭婚姻品質，建立和樂的家庭關係。期透過團契、詩歌、聖經真理等服事，提升彼此關愛的親密公民關係。本於耶穌對全人關顧之精神，服務社會，擴展基督博愛之精神，向其他城市、國家傳揚福音。,會員會費及捐助,高雄市政府社會局民國九四年四月四日高市社局一字第０九四０００九九三六號函,永久,650000.00,1,1050407,,,曹水香,,,,,,,,,,一、章程變更：原章程第6條於法人105年3月6日第6屆第2次會員大會修正通過，報經主管機關備查。二、理監事變更：第5屆理監事任期屆滿，改選第6屆理監事。三、理監事印鑑登記。,,,,,https://aomp109.judicial.gov.tw/judbp/whd6k/q/SRb687NZ2BlWu9yVGjhN0cfw-RDPFziDQpcTLJXOaxTIdLRU8a9VK5ypt_w=
105法登他000133,2,2,陳錦鑾,953,1050408,1050408,1050411,15冊107頁,2,5,理事長,社團法人高雄市聰動成長協會,0950612,高雄市三民區應安街251號,本會以協助神經退化性疾病之病友與家屬，提供全方位之支持，以提昇其生活品質為宗旨。,會員會費及捐助,"高雄市政府社會局   民國95年04月04日  高市社局一字第0950011177號函",永久,760000.00,1,1050408,,1050414,,,,,,,,,,,一、理監事變更：第4屆理監事任期屆滿，改選第5屆理監事。二、理監事印鑑登記。,,,,,https://aomp109.judicial.gov.tw/judbp/whd6k/q/KYMkSsObdpFanlVM3bK63pmxwa_KWnQEJOWhmB_IW1vAtIG3lOlsU0rWqh8=
105法登他000134,2,2,陳錦鑾,1503,1050411,1050411,1050412,30冊22頁,1,1,理事長,社團法人高雄市旗聖功德會,1030219,高雄市旗山區華川路26巷2號,以救急濟貧、慈善關懷、促進社會和諧、推展教化世道人心為宗旨。,會費及捐助等,高雄市政府社會局103年1月24日高市社人團字第10330599300號函,永久,6000.00,1,1050411,,,陳怡菱,,,,,,,,,,一、第一屆理監事任期中謝炳昆辭任理事長職務，改選黃仁郁繼任理事長。二、新任理事長印鑑登記。,,,,,https://aomp109.judicial.gov.tw/judbp/whd6k/q/d7kKBkxO1pgeTV18YQ7wrQH8l5CJ7PDLl2eTWGcEC9JbgMQBl9DJQ9O1tBMZ
