105法登他000333,1,2,陳錦鑾,1538,1051018,1051018,1051019,31冊17頁,2,2,董事長,財團法人金培醫學基金會,1030714,高雄市新興區中正三路106號,以協助推廣國人醫學研究及保健防治工作，並計畫推動相關醫學教育與衛生教育活動，冀能全面提升國人身心健康及生活品質為目的或宗旨。,由江博暉等人捐助,衛生福利部103年6月19日衛部醫字第1031663922號函,永久,10000000.00,1,1051018,,,謝欣芸,高雄市鳥松區大埤路123號(2樓泌尿科震波碎石室),833,,,,,,,,一、第1屆理監事任期屆滿，改選第2屆理監事。二、理監事印鑑登記。,,,,,https://aomp109.judicial.gov.tw/judbp/whd6k/q/tcqq1_qY2NdaOpWuayWb7WTJmqjHdzUpBSQWKKiISbXpY7rDEkV9CckUIEB5
105法登他000334,1,2,陳錦鑾,1736,1051019,1051019,1051020,36冊15頁,1,10,董事長,財團法人基督教台灣褔音會,0450202,高雄市鼓山區鼓山二路85號,以在臺灣省各地建立教會，闡揚基督聖道，共訓練傳授基督教義人才為宗旨。,設立基金新台幣四十九萬五千元整，由設立人孔彼得牧師為本會自美國所募捐；嗣後得由董及信徒捐獻之。,台灣省政府民政廳42年11月2日民甲字第1387號,永久,89937693.00,1,1051019,,,萬玉玲,高雄市鼓山區鼓山一路161巷50弄25號4樓之1,804,,,,,,,,"一、主事務所變更為：高雄市鼓山區鼓山二路85號。
二、財產總額變更：原財產總額為新台幣81,195,693元整，變更為新台幣89,937,693元整。
三、章程變更：原章程第3條於105年8月16日經董事會會議通過，報經主管機關備查，修正要旨：本會法人事務所設立於高雄市鼓山區鼓山二路85號。",,,,,https://aomp109.judicial.gov.tw/judbp/whd6k/q/yqdG3Unv3K_sMfFgjySL9u3yT50wgjsxfxQ-rbQwozv5ARa30AIe-ibvXpHV
105法登他000335,1,2,陳錦鑾,319,1051019,1051019,1051020,6冊133頁,2,8,董事長,財團法人高雄榮耀基督教會,0820806,高雄市三民區建國二路42號4樓,"本主耶穌基督全備福音,傳揚基督教教義及辦理社會公益慈善事業。",捐助,"高雄市政府民政局 82年7月19日高市民政三字第9574號",永久,35059368.00,1,1051019,,,陳武洲,高雄市三民區鼎中路711巷18弄16號,807,,,,,,,,"一、董事變更：第7屆董事任期屆滿，改選第8屆董事。
二、董事印鑑登記。",,,,,https://aomp109.judicial.gov.tw/judbp/whd6k/q/bd20RNZimrnGq3IgW_RXEMbwv0aGoH_Zyo9SaJS2ewVYSQfmC5vECY_uUvg=
105法登他000336,1,2,陳錦鑾,761,1051019,1051019,1051020,13冊93頁,2,5,董事長,財團法人開證上人紀念慈善基金會,0911007,高雄市新興區八德一路211號,以從事慈善、教育、文化等事業為目的,宏法寺、陳來春、張黃甘等捐助,高雄市政府社會局、民國九十一年九月二十日高市社局字第０九一００二四九八八號函,永久,10000000.00,1,1051019,,,李惠玲,高雄市新興區八德一路211號,800,,,,,,,,一、董事、監察人變更：第4屆董事、監察人任期屆滿，改選第5屆董事、監察人。二、新任董事、監察人印鑑登記。,,,,,https://aomp109.judicial.gov.tw/judbp/whd6k/q/O44s-_F4r2mYz3DZRb5RR9NJOuVnz3fgfJ0Cu5J9eFon0qtJfY1n6F6Mv_A=
105法登他000337,1,2,陳錦鑾,1030,1051020,1051020,1051021,17冊159頁,2,4,董事長,財團法人高雄市私立典寶社會福利慈善事業基金會,0961204,高雄市三民區民族一路553號14樓,本會以舉辦社會福利慈善事業為目的。,由吳錫松等三人共同捐助,高雄縣政府民國96年11月28日府社長字第0960273420號函,永久,10000000.00,1,1051020,,,鄧文港,高雄市三民區民族一路553號14樓,807,,,,,,,,一、章程變更：原章程第4條於105年09月25日，經法人第4屆第1次董事會議修正通過，修正要旨為：本會事務所設於高雄市三民區民族一路553號14樓，報經主管機關備查。二、主事務所變更為：高雄市三民區民族一路553號14樓。三、第3屆董事任期屆滿，改選第4屆董事。三、董事印鑑登記。,,,,,https://aomp109.judicial.gov.tw/judbp/whd6k/q/iujA8MPPcnQR2aqKxeQr6BFCZ_9aGDRb0zCLsXb3WiyFZ55liqf9FsGSple1
105法登他000338,2,2,陳錦鑾,1227,1051021,1051021,1051024,23冊24頁,2,3,理事長,社團法人台灣營造工程協會,0991012,高雄市苓雅區光華一路148之29號3樓,本會以扮演政府與營建工程業間的橋樑，建言政府擬定最佳營建工程法令，創造同業會員之最大利益、提供綜合輔導、培訓專業人才，強化同業經營體質提昇競爭力，協助參加各種專業性討論與會議，拓展同業之技術交流，追求雙贏合諧的合作關係，發展長遠健全的營造工愛環境為宗旨。,會費及捐助,內政部99年3月5日台內社字第0990031470號函,永久,1500000.00,1,1051021,,,吳振纓,高雄市苓雅區光華一路148之29號3樓,802,,,,,,,,"一、主事務所變更為：高雄市苓雅區光華一路148之29號3樓
二、章程變更：原章程第30條於105年3月12日經法人第2屆第4次會員大會會議修正通過，報經主管機關備查。三、理監事變更：第3屆理監事任期屆滿，改選第4屆理監事。四、理監事印鑑登記。",,,,,https://aomp109.judicial.gov.tw/judbp/whd6k/q/4k_XfSmk4WEphhO8WDbsEEfo986vhHm_92wTX1YTeFg3jacgeFiVfTHPqhu2
105法登他000339,1,2,陳錦鑾,1224,1051021,1051021,1051024,23冊21頁,2,3,董事長,財團法人高雄市KT社會福利慈善事業基金會,0991001,高雄市前鎮區管仲路350號2樓1,本會以辦理社會福利慈善事業為目的。,由呂明珠、郭松林、翁福來、翁王雪花、林中一、黃美紅、邱美欣等捐助成立,高雄市政府社會局99年9月13日高市社局二字第09900436821號函,永久,16800000.00,1,1051021,,,汪佳倫,高雄市前金區八德二路165巷44號,801,,,,,,,,一、主事務所變為：高雄市前鎮區管仲南路350號2樓1。二、章程變更：原章程第1、2、9條於105年8月15日經法人第2屆第8次董事會會議通過，報經主管機關備查。三、第2屆董事任期屆滿，改選第3屆董事。四、董事印鑑登記。,,,,,https://aomp109.judicial.gov.tw/judbp/whd6k/q/DMPCjZcvtKE58_lLWRim6rUhml--SkOx59Rude4unsQF571pOfnrl5_4EsNR
105法登他000340,1,2,陳錦鑾,961,1051024,1051024,1051025,15冊155頁,1,10,董事長,財團法人「張老師」基金會,0761022,台北市中山區松江路219號,以配合政府政策辦理身心輔導、心理諮商、心理治療與心理衛生教育推廣等有關工作，以加強接受本會服務的當事人生活適應能力，激發其潛能，創造幸福美滿人生，進而促進社會國家之安和樂利為宗旨,由中國青年反共救國團、金寶電子工業、台灣石化合成、統一企業股份有限公司等捐助,"教育部76年10月9日 台76高字4786號函",永久,53593858.00,1,1051024,,,徐婉瑜,高雄市苓雅區中山二路412號3樓,802,,,,,,,,一、章程變更：原章程第12、17條於105年5月18日經法人第10屆第5次董會會議修正通過，報經主管機關備查，並經臺灣臺北地方法院105年度法字第138號裁定准予變更確定。,,,,,https://aomp109.judicial.gov.tw/judbp/whd6k/q/eBKyb0-UyRuSPyLkPI_GUs0F1Lif1NsPczS3EzU5JmRT4e5nLGUfv5SpYlk=
105法登他000341,1,2,陳錦鑾,98,1051024,1051212,1051213,3冊42頁,2,12,董事長,財團法人高雄市私立高鳳高級工業家事職業學校,0620330,高雄市小港區松崗路119號,以創辦私立高雄市私立高鳳高級工業家事職業學校、並謀其發展為目的。,捐助,台灣省政府教育廳、民國60年8月3日,永久,234673376.00,1,1051212,,,許銣芳,高雄市小港區松崗路119號,812,,,,,,,,"一、財產總額變更登記：原財產總額為新台幣233,816,549元整，變更為新台幣234,673,376元整。二、董事及監察人變更：第11屆董事及監察人任期屆滿，改選第12屆董事及監察人。三、董事及監察人印鑑登記。",,,,,https://aomp109.judicial.gov.tw/judbp/whd6k/q/kykUUJs4Y5V_so-FBdc_YI6SX60C7zLCNnb2-NQK-JmtxLdx5aaWmHFFqA==
105法登他000342,1,2,陳錦鑾,725,1051027,1051027,1051028,12冊349頁,2,6,董事長,財團法人中華文字理哲學教育基金會,0901128,高雄市鳳山區誠群街5號,以中華文字哲學研究、推動教育文化、深耕社區總體營造為宗旨。,由蕭鉉晁等捐助,高雄市政府教育局、民國90年11月16日高市教四字第35676號函,永久,5000000.00,1,1051027,,,孔榛景,高雄市鳳山區成群街5號,830,,,,,,,,一、主事務所變更為：高雄市鳳山區誠群街5號。二、章程變更：原章程第4條於105年9月2日經法人第五屆第8次董監事聯席會會議修正通過，報經主管機關備查，修正要旨：本會會址設於高雄市鳳山區誠群街5號。三、董監事變更：第5屆董監事任期屆滿，改選第6屆董監事。四、董監事印鑑登記。,,,,,https://aomp109.judicial.gov.tw/judbp/whd6k/q/wqG1Q8Um72zyu_96-h7Gu-swD7VtOl4t5vBBxcKIsFT3Awu-H_KQP0kAV40=
105法登他000343,1,2,陳錦鑾,856,1051028,1051028,1051031,14冊73頁,2,5,董事長,財團法人聚和文化藝術基金會,0931216,高雄市大寮區華東路28號,本會以發展創新知識文化及促進人文科技國際化為宗旨,由聚和國際股份有限公司捐助,高雄市政府文化局民國93年12月2日高市文一字第0930007975號函,永久,5000000.00,1,1051028,,1051110,陳明儀,高雄市三民區河北一路328號,807,,,,,,,,"一、董事變更：第4屆董事任期屆滿，改選第5屆董事。
二、董事印鑑登記。",,,,,https://aomp109.judicial.gov.tw/judbp/whd6k/q/2no4v-iA8UbFF8Yi105KGnCw0jQST7gpdD_1PcMZFnBYfcWZVBGzVDiJNaE=
105法登他000344,1,2,陳錦鑾,2,1051028,1051028,1051031,1冊3頁,2,20,董事長,財團法人基督教中華循理會,0430903,高雄市前金區自強一路36號11樓,本法人設立目的為在台灣全省、台北市、高雄市各地設立教會(禮拜堂)傳揚基督聖道，並設聖光神學院訓練基督教義之傳道人才、並謀其健全發展、增進社會福祉推動各項公益慈善事業、關懷弱勢族群包括國內外貧苦兒童、家庭、單親、提供生活及獎助學金等之協助，並本著基督博愛救世精神，進行國內外人道救援、重大急難之救助，於國內外宣揚福音補助宣教經費及協助設立教會之經費等。,由國內外循理會信徒樂捐及因教會發展臨時籌謀,臺灣省政府民政廳、民國41年4月11日,永久,532733623.00,1,1051028,,1051109,李婉娜,高雄市前金區榮安街125號,801,,,,,,,,"一、財產總額變更登記：原財產總額為新台幣469,280,810元整，變更為新台幣532,733,623元整。二、董事變更：第19屆董事任期屆滿，改選第20屆董事。三、董事印鑑登記。",,,,,https://aomp109.judicial.gov.tw/judbp/whd6k/q/Fpt684uEbJibQJWV0fREL315VIJTaVhddTOczSrq98T9PaOsrOiNsRy2
105法登他000345,2,2,陳錦鑾,844,1051028,1051028,1051031,14冊25頁,2,12,理事長,社團法人高雄市愛心手足慈善會,0931108,高雄市苓雅區五福三路149之1號703室,以愛心為信念，結合民間善心人士之力量，為遭遇急難困境之同胞盡力及社會公益之服務為宗旨。,會員會費及捐助等,高雄市政府社會局民國83年1月12日高市社一字第83002號立案證書,永久,568638.00,1,1051028,,,鍾蕙宇,高雄市苓雅區五褔三路149之1號7樓703室,802,,,,,,,,一、理監事變更：第11屆理監事任期屆滿，改選第12屆理監事。二、理監事印鑑登記。,,,,,https://aomp109.judicial.gov.tw/judbp/whd6k/q/QUWWaQprZDwR67WcLtbGZiToebYSx_CKeeYBA3YCEK4FteOYBh9xlzEjeVs=
105法登他000346,1,2,陳錦鑾,301,1051101,1051101,1051102,6冊61頁,1,11,董事長,財團法人國立鳳山高級中學文教基金會,0820503,高雄市鳳山區光復路二段130號,以協助國立鳳山高級中學改善環境，發展校務，獎勵教師（研究及教學服務績優等）促進學生敦品勵學為目的。,捐助,高雄縣政府、82年4月27日82府教社字第68115號,永久,4235000.00,1,1051101,,,剛淑萍,高雄市鳳山區光復路二段130號,830,,,,,,,,"一、財產總額變更：原財產總額為新台幣2,025,000，變更為新台幣4,235,000元整",,,,,https://aomp109.judicial.gov.tw/judbp/whd6k/q/muNd7nF95mzgeeYJMvcDEfKUuEEffxiAOKiFHuiRxoWOwXTqtavndl0nmcw=
105法登他000347,1,2,陳錦鑾,197,1051101,1051101,1051102,5冊1頁,2,7,董事長,財團法人吳麥文教基金會,0780225,高雄市苓雅區新光路38號34樓之1,辦理文化教育事業、慈善事業、獎助清寒學子、社會公益、急難救助以服務社會、回饋社會為宗旨。,捐助,高雄市政府教育局中華民國七十八年一月二十日,永久,10000000.00,1,1051101,,,張天雄,高雄市小港區宏平路369號,,,,,,,,,一、章程變更：原章程第7條於105年4月6日經法人第6屆董事會第6次會議修正通過，報經主管機關備查，並經本院105年度法字第19號民事裁定准予變更確定，修正要旨：原董事名額七人至二十一人修正為董事名額五人至二十一人為限。二、董事變更：第６屆董事任期屆滿，改選第7屆董事。三、董事印鑑登記。,,,,,https://aomp109.judicial.gov.tw/judbp/whd6k/q/ZKfi2n7OvPzEP54Wirqpq018XA1LF3Xqw8CtnKDEY44fhM2DtniFQfHTWJQ=
105法登他000348,2,2,陳錦鑾,653,1051102,1051102,1051104,12冊61頁,2,5,理事長,社團法人台灣愛之希望協會,0890616,高雄市鼓山區龍文街25號2樓,一、關懷愛滋感染者，提供持續性的服務與支持，解決因愛滋病蔓延所帶來社會及醫療上的問題。二、推廣愛滋防治活動與教育，提高民眾對愛滋病的認識、瞭解與關切。,會費及捐助等,內政部、民國88年10月21日台（八八）內社字第8885644號函,永久,100000.00,1,1051103,,,李俊億,高雄市鼓山區龍文街31號5樓,804,,,,,,,,一、理監事變更：第4屆理監事任期屆滿，改選第5屆理監事。二、理監事印鑑登記。,,,,,https://aomp109.judicial.gov.tw/judbp/whd6k/q/Z3UfwEpX5Q9oZoKUFUp2r1qJu1qALoiTnH5KqOUlW1ECO85Q2YJ70Rq63yc=
105法登他000349,1,2,陳錦鑾,469,1051102,1051102,1051103,9冊121頁,2,7,董事長,和春醫療財團法人,0860719,高雄市鼓山區臨海二路58之2號,以從事醫療事業辦理醫療機構及經由醫療服務與醫學研究，促進全民健康為目的。,捐助,行政院衛生署中華民國86年7月11日,永久,37600000.00,1,1051102,,,羅傳進,高雄市鼓山區臨海二路58號之2,804,,,,,,,,一、董事變更：第6屆董事任期屆滿，改選第7屆董事。二、董事印鑑登記。,,,,,https://aomp109.judicial.gov.tw/judbp/whd6k/q/JNKcfRkKWUAGVI3U5uVsXHwuHqItN7I5SvHurxwFIjma31_f2Fx8wzuY8M8=
105法登他000350,1,2,陳錦鑾,901,1051102,1051102,1051103,14冊253頁,1,4,董事長,財團法人多元社會教育基金會,0940708,高雄市新興區河南路336號,推動族群合諧，提倡族群共生共榮，建立多元社會價值觀。,林建泉等捐助,高雄縣府94年7月1日府教社字第0940138279號函,永久,173151245.00,1,1051102,,,吳依平,高雄市新興區河南路336號,800,,,,,,,,"一、財產總額變更：原財產總額為新台幣171,455,869元整，變更為新台幣173,151,245元整。",,,,,https://aomp109.judicial.gov.tw/judbp/whd6k/q/bwsa_qsFGNB5Rr0rVff_dbAE3SXdek-ZNnF3iGjwhtB4jWuttLhgo2f8X-Y=
105法登他000351,1,2,陳錦鑾,1077,1051103,1051103,1051104,19冊47頁,1,3,董事長,財團法人喆園社會福利慈善基金會,0970923,高雄市新興區六合一路87號5樓,本會以辦理社會福利慈善事業為目的。,由許正吉、許競仁等捐助,高雄市政府社會局97年8月25日高市社局二字第0970033754號函,永久,10000000.00,1,1051103,,,江秀絨,高雄市苓雅區中正二路74號9樓,,,,,,,,,一、主事務所變更為：高雄市新興區六合一路87號5樓。二、章程變更：原章程第2條於105年9月23日經法人第3屆第2次董事會會議修正通過，報經主管機關備查，修正要旨為：本會址事務所設於高雄市新興區六合一路87號5樓。,,,,,https://aomp109.judicial.gov.tw/judbp/whd6k/q/cwSGv5CgK8HtRSAS9Lzd3ZJdJ0c5cj3q0gazeqwBEtZTROZZivqail49djgc
105法登他000353,1,2,陳錦鑾,59,1051115,1051115,1051116,3冊3頁,1,15,董事長,新光學校財團法人,0560923,高雄市大寮區鳳屏一路217號,為遵照國家教育政策暨現行教育法令之規定設立新光學校財團法人,蔡基成等十一人等捐助,台灣省政府教育廳中華民國56年6月5日,永久,200511519.00,1,1051115,,,程振威,高雄市大寮區鳳屏一路217號,831,,,,,,,,"財產總額變更：原財產總額為新台幣190,540,755元整，變更為新台幣200,511,519元整。",,,,,https://aomp109.judicial.gov.tw/judbp/whd6k/q/IQshcdhRP95bTwfqEV6eqCXE2PQ47VDz7WOBWdiRgPX3fH1hjDSqHW89Mg==
105法登他000354,2,2,陳錦鑾,602,1051117,1051117,1051118,11冊253頁,2,11,理事長,社團法人高雄市唇顎裂顱顏協會,0880903,高雄市苓雅區行信路6號,以服務唇顎裂及顱顏患者及家屬，協助患者正常人格發展及良好社會適應為宗旨。,"會費及捐助。                                                　　",高雄市政府社會局、民國82年8月18日(82高市社局一字第82076）,永久,459353.00,1,1051117,,,孫幸秀,高雄市新興區民族二路97號11樓之3,800,,,,,,,,一、理監事變更：第10屆理監事任期屆滿，改選第11屆理監事。二、新任理監事印鑑登記。,,,,,https://aomp109.judicial.gov.tw/judbp/whd6k/q/Q65scc_815sqmsKhZvdDoOi6rTksGukHC61Gv-aNGQxjPOMQTSJqW1aEgPg=
105法登他000355,1,2,陳錦鑾,359,1051117,1051117,1051118,7冊89頁,1,7,董事長,財團法人高雄市林園國民小學教育發展基金會,0830520,高雄市林園區林園里忠孝西路20號,本會以提昇學校教育品質為宗旨。,捐助,高雄縣政府83年5月13日83府教社字第78254號,永久,2000000.00,1,1051117,,,董原利,高雄市林園區忠孝西路20號,832,,,,,,,,一、董事變更：任期中原任董事長陳詠禎及董事李積璋辭任，選聘張坤宏擔任董事長，吳啟豪遞補董事。二、新任董事印鑑登記。,,,,,https://aomp109.judicial.gov.tw/judbp/whd6k/q/oNolWtxwkRePI8DyqS_KFU46XIWVI0f4pBBFLBjJsxvGoplwGZdWrQ6eXs0=
105法登他000356,1,2,陳錦鑾,83,1051118,1051118,1051121,3冊27頁,2,3,董事長,財團法人高雄市潮汕同鄉會,0600729,高雄市鼓山區捷興二街17號,為掌管會所不動產及舉辦公益事業，共謀社會褔利。,捐助,中華民國五十九年十二月十七日,永久,750000.00,1,1051118,,,張國益,高雄市鼓山區捷興二街17號,804,,,,,,,,一、董監事變更：第２屆董事任期屆滿，改選第３屆董監事。二、董監事印鑑登記。,,,,,https://aomp109.judicial.gov.tw/judbp/whd6k/q/jxrnfgljJGUwwzn_sbXtfDpUXT2B1Jv1RsXi4eFbURfFM5GjV0uECOP8lg==
105法登他000357,2,2,陳錦鑾,1295,1051118,1051118,1051121,25冊12頁,2,2,理事長,社團法人高雄市照顧服務推廣協會,1000624,高雄市三民區遼寧二街13號,本會以建構照顧服務者與被照顧服務者及其家屬間最好的服務平台為宗旨。,會費及捐助,高雄市政府社會局99年12月3日高市社局一字第0990056348號函,永久,5000.00,1,1051118,,,,,,,,,,,,,一、理監事變更登記：第2屆理監事任期屆滿，改選第3屆理監事。二、理監事印鑑登記。,,,,,https://aomp109.judicial.gov.tw/judbp/whd6k/q/5Yv-6T2Dt-51cZk2s6CZZyVyBdCbPsznXl28dCBHZeriUvk3Vk1M11N3DOmR
105法登他000358,1,2,陳錦鑾,681,1051123,1051123,1051124,12冊173頁,2,7,董事長,財團法人蔡瑞熊健康關懷文教基金會,0891215,高雄市三民區十全一路100號,"以獎勵醫學研究，推展保健教育，關懷醫療弱勢族群，促進全民健康為宗旨。                                                                      .",由張峯紫等人捐助,高雄市政府教育局、89年12月14日高市教四字第8900021887號函,永久,10000000.00,1,1051123,,,吳美慧,高雄市三民區十全一路100號,807,,,,,,,,一、董事變更：第6屆董事任期屆滿，改選第7屆董事。二、董事印鑑登記。,,,,,https://aomp109.judicial.gov.tw/judbp/whd6k/q/oXXLgnTDe1gcENKlpRm5EL5d3Lr8qRnKLEpjsq0pQL70fOn3HYUySgywsrI=
105法登他000360,2,2,陳錦鑾,1735,1051124,1051130,1051201,36冊14頁,1,1,理事長,社團法人臺灣優質手工具發展協會,1051018,高雄市前鎮區新生路248之40號2樓,以互信、互助及互惠之合作原則，共同擴展臺灣手工具產業國際市場，進而帶動國內就業市場、增加手工具產業產值與附加價值，進而帶動國內經濟發展為宗旨。,會費及捐款等,內政部105年7月1日台內團字第1050048091號函,永久,301000.00,1,1051130,,1051213,范嘉真,高雄市前鎮區新生路248之40號2樓,806,,,,,,,,理事游祥鎮之住址變更為：台中市大里區慈德路300巷22號。,,,,,https://aomp109.judicial.gov.tw/judbp/whd6k/q/ksaR_sx9uCttcbQKw38wUgvXOGgecWfC4oQvCCqifkYCSJsGRqqnalVUo1zW
105法登他000361,2,2,陳錦鑾,548,1051125,1051125,1051128,11冊37頁,1,11,理事長,社團法人高雄市盲人福利協進會,0871013,高雄市苓雅區光華一路12號2樓之1,本會以團結盲胞及結合社會愛心力量，激發盲人發揮「殘而不廢」之潛能自立自強，積極參與社會建設與視障團體之活動，進而加強社教宣廣與促進國民外交，使能提昇文化水準及盲人社會地位，改善生活品質，爭取合法權益與福利為宗旨。,會員會費及捐助,"高雄市政府社會局  民國73年8月22日",永久,3689173.00,1,1051125,,1051201,戴宜姍,高雄市苓雅區光華一路12號2樓之1,802,,,,,,,,一、監事變更：任期中監事朱勝喜辭任，由陳俊廷繼任。二、新任監事印鑑登記。,,,,,https://aomp109.judicial.gov.tw/judbp/whd6k/q/0CyHjXtuP_0_IAZZxBOHCGTqZQHlpqLA7BHNPgknL9Cc6ZMzPMLrLT9NIZg=
105法登他000362,2,2,陳錦鑾,1480,1051129,1051129,1051130,29冊39頁,2,3,理事長,社團法人高雄市國立台北科技大學校友會,1021016,高雄市三民區大順二路147號4樓之3,以連絡感情、研究學術、互相合作、貢獻國家為宗旨。,會費及捐助,高雄市政府社會局54年4月11日,永久,3000000.00,1,1051130,,,林界源,高雄市小港區桂華街235號,812,,,,,,,,一、理監事變更：第2屆理監事任期屆滿，改選第3屆理監事。二、理監事印鑑登記。,,,,,https://aomp109.judicial.gov.tw/judbp/whd6k/q/r2dX5sxN63Ut_G8JdYySKziNILFbWNtVOSRe63vmUq5UOXaj7cHFkaCXvn--
105法登他000363,1,2,陳錦鑾,259,1051130,1051130,1051201,5冊63頁,2,6,董事長,財團法人南方文教基金會,0801214,高雄市三民區繼光街10號,以提昇全民生活環境品質為宗旨。,捐助,高雄市政府教育局、民國80年12月9日高市教育四字第41417號,永久,10000000.00,1,1051130,,,廖秀麗,高雄市三民區繼光街10號,807,,,,,,,,一、主事務所變更為：高雄市三民區繼光街10號。二、章程變更：原章程第4條於105年10月29日經法人第5屆第6次董事會會議修正通過，報經主管機關備查。三、董事變更：第5屆董事任期屆滿，改選第6屆董事。四、董事印鑑登記。,,,,,https://aomp109.judicial.gov.tw/judbp/whd6k/q/bi2FQerlTbq7R7T2nAPRjdOwK184Hq1Wcm4-ROXDVrp8zUJwSZXWbaoaZs8=
105法登他000364,2,2,陳錦鑾,1395,1051130,1051130,1051201,27冊34頁,1,14,理事長,社團法人高雄市建築師公會,1011106,高雄市三民區博愛一路366號23樓,以促進會員聯繫，保障會員應有權益，提高職業水準，發揚服務精神及協助推行國家建設為宗旨。,會費及捐助等,高雄市政府社會局68年7月27日社局一字第68823號函,永久,30574329.00,1,1051130,,,歐育伶,高雄市三民區博愛一路366號23樓,807,,,,,,,,章程變更：原章程第31條及第32條於105年3月25日經法人第14屆第2次會員大會修正通過，報經主管機關備查。,,,,,https://aomp109.judicial.gov.tw/judbp/whd6k/q/oAJA1Iv-WUKg4CE_4M_5A3dkK27-cOdjXvaEBBBQCa3KtD0IVvApc3IG3Ne8
105法登他000365,1,2,陳錦鑾,840,1051207,1051207,1051208,14冊9頁,2,5,董事長,財團法人覺恩慈善事業基金會,0930907,高雄市鼓山區昌盛路336號2樓,舉辦或捐助社會福利慈善事業,由林妙珍等十人捐助,高雄市政府社會局民國93年8月31日高市社局二字第0930024724號函,永久,10000000.00,1,1051207,,1051214,郭怡青,高雄市鼓山區昌盛路336號2樓,804,,,,,,,,一、董事變更：第4屆董事任期屆滿，改選第5屆董事。二、董事印鑑登記。,,,,,https://aomp109.judicial.gov.tw/judbp/whd6k/q/-9ntWKTW5_DpBbVkhO7OV53pk8VbfEH4rHJC99euCftb-FIDt2P3qxU7P_U=
105法登他000366,1,2,陳錦鑾,1016,1051207,1051207,1051208,17冊75頁,2,4,董事長,財團法人建準慈善基金會,0961030,高雄市前鎮區新衙路296巷30號,本會以辦理社會慈善事業為目的,由洪銀樹、洪陳富英、洪慶昇、洪聖泰、洪嘉駿、洪嘉偉等六人共同捐助,高雄市政府社會局民國96年10月26日高市社局二字第0960041974號函,永久,57584000.00,1,1051207,,,黃玲玟,高雄市前鎮區新衙路296巷30號,806,,,,,,,,"一、財產總額變更：原財產總額新台幣45,484,000.0元整，變更為新台幣57,584,000.0元整。二、董事變更登記：第3屆董事任期屆滿，改選第4屆董事。三、董事印鑑登記。",,,,,https://aomp109.judicial.gov.tw/judbp/whd6k/q/VvNjsiyUZj6o3Q25G4EP4yZOSooCPRdl9rRzogtECHRC6kEgRi66XAidjSoS
