105法登他000202,1,2,陳錦鑾,265,1050601,1050601,1050602,5冊69頁,2,5,董事長,財團法人基督教改革宗長老會高雄信愛教會,0810226,高雄市苓雅區林森二路87號12樓,宣揚基督救世之福音，根據聖經闡釋基督教義及辦理社會公益慈善事業,捐助,高雄市政府民政局81年2月12日81高市民政三字第844號,永久,19018991.00,1,1050601,,,羅翠花,,,,,,,,,,一、董事變更：第4屆董事任期屆滿，改選第5屆董事。二、董事印鑑登記。,,,,,https://aomp109.judicial.gov.tw/judbp/whd6k/q/zZ_mQDBWiTo93KtxSN_JqQ1CY_BUQXriIObSOS7e-hOYmnIWX_gTMnanP64=
105法登他000203,1,2,陳錦鑾,141,1050602,1050602,1050603,4冊35頁,2,12,董事長,財團法人高雄市私立樂仁啟智中心,0710621,高雄市小港區高坪76街2號,辦理心智障礙者之早期療育與教養服務、以減輕其家庭負擔，並結合資源，推廣身心障礙福利服務。,由高正幸等四人捐助,高雄市政府社會局、民國71年4月3日,永久,22004525.00,1,1050602,,,林秋如,,,,,,,,,,一、董事變更：第11屆董事任期屆滿，改選第12屆董事。二、董事印鑑登記。,,,,,https://aomp109.judicial.gov.tw/judbp/whd6k/q/Hnmgg7D8JMTmIu_QXDB52C2wHdWQGoeNUkJMokx4hh0bxZ8Km1AZ_gFa2fw=
105法登他000204,2,2,陳錦鑾,585,1050603,1050603,1050604,11冊185頁,2,9,理事長,社團法人高雄市家庭照顧者關懷協會,0880617,高雄市三民區十全一路68巷34號,本會以結合本市家庭照顧者及關懷家庭照顧者之社會人士及團體，積極爭取家庭照顧者權益，提升社會大眾對家庭照顧者的認識、關懷與提供服務為宗旨。,會員入會費、常年會費、事業會、捐款、委託收益、基金及慈息、其他。,高雄市政府社會局88年4月29日,永久,50000.00,1,1050603,,,莫清芬,,,,,,,,,,一、法人主事務所變更為高雄市三民區十全一路68巷34號。二、理監事變更：第8屆理監事任期屆滿，改選第9屆理監事。三、理監事印鑑登記。,,,,,https://aomp109.judicial.gov.tw/judbp/whd6k/q/7N3z20YphZcwk_DRsT4eXwHIeC9JojtjRRe1lqVutzcdc0pc-nbm0eTyLZU=
105法登他000205,1,2,陳錦鑾,103,1050603,1050603,1050604,3冊47頁,2,17,董事長,財團法人育英醫護管理專科學校,0620721,高雄市三民區大昌二路420巷15號,本法人之辦學理念為培育具有博愛精神、盡忠職守、服務及照顧人群之專業人才,捐助,高雄市政府教育局、民國52年9月27日,永久,488332916.00,1,1050603,,,嚴曉雲,,,,,,,,,,一、董事變更：第16屆董事任期屆滿，改選第17屆董事。二、董事印鑑登記。,,,,,https://aomp109.judicial.gov.tw/judbp/whd6k/q/kiwV8YHaVr0i6hT1oUIG5_u_8dStbNfoUgulg8kjdzyiaj34RohPpOqE0ZE=
105法登他000206,2,2,陳錦鑾,1053,1050603,1050603,1050604,18冊103頁,2,9,理事長,社團法人高雄市惠急慈善會,0970512,高雄市三民區覺民路288巷36號8樓之3,"本會以結合民間善心人士及團體機構之力量,配合政府社會福利政策之推行,共同開創社會慈善事業為宗旨",會員會費及捐助等,高雄市政府社會局88年6月6日高市社一字第88071號,永久,1106251.00,1,1050603,1050707,1050615,陳雅媚,,,,,,,,,,一、理監事變更：第8屆理監事任期屆滿，改選第9屆理監事。二、理監事印鑑登記。,,,,105年9月23日雄院和登字第1051033878號函移送橋頭地方法院管轄,https://aomp109.judicial.gov.tw/judbp/whd6k/q/SLuU6y5L0kppAZc5zNSqtYtqHiIKI1CYH1-lAx_3ght0KKvcP8jbXcIoynoK
105法登他000207,1,2,陳錦鑾,405,1050606,1050606,1050607,8冊69頁,1,7,董事長,財團法人喜憨兒社會福利基金會,0840710,高雄市苓雅區中正一路306號11樓之2,以辦理社會福利為目的。,由高雄市智障者福利促進會等捐助,高雄市政府教育局、民國84年6月29日高市教四字第19169號（90年5月28日隸屬內政部〉,永久,198451198.00,1,1050606,,,林綉如,,,,,,,,,,章程變更：原章程第3條，於105年4月29日法人第7屆第9次董事會議修正通過，報經主管機關備查。,,,,,https://aomp109.judicial.gov.tw/judbp/whd6k/q/CjvLqKQpKvA0AJxuZvHau1XBiLSZo-zkEaUksRStEB0YS-tbbXkGApJ7rJk=
105法登他000208,1,2,陳錦鑾,1665,1050606,1050606,1050607,34冊24頁,2,6,董事長,財團法人天主教白永恩神父社會福利基金會,1050115,台北市士林區德行東路202號4樓,以辦理社會福利慈善事業為目的,由財團法人天主教遣使會捐助成立。,內政部中華民國90年2月8日台（90）內中社字第9070257號函,永久,1002712237.00,1,1050606,,1050622,曾琬渝,,,,,,,,,,一、董事變更：第5屆董事任期屆滿，改選第6屆董事。二、董事印鑑登記。,,,,,https://aomp109.judicial.gov.tw/judbp/whd6k/q/b6OnJck0NQWiINzy4-XUglyqkcbSOxWgIn-MpM-tvqVNMstEjwzupUanPd6z
105法登他000209,1,2,陳錦鑾,104,1050606,1050606,1050607,4冊1頁,1,14,董事長,財團法人高美醫護管理專科學校,0620905,高雄市美濃區成功路309號,協助政府發展教育，培育實用醫療、護理、衛健及管理等專業人才，並謀本校校務發展為目的。,捐助,台灣省政府教育廳、民國57年8月30日（主管機關自88年7月1日起改隸教育部）,永久,444724869.00,1,1050606,1050707,1050620,邱國勇,,,,,,,,,,"財產總額變更：原財產總額新臺幣512,434,120.0元整，變更為新臺幣444,724,869.0元整。",,,,105年12月16日雄院和登104字第1051415970號函移送橋頭地方法院管轄,https://aomp109.judicial.gov.tw/judbp/whd6k/q/thwfSLHABU53I8dAamjV2H702L75CCXzLmm_VY-cHKtNK5Qf5_snAPLCiEc=
105法登他000210,1,2,陳錦鑾,462,1050606,1050606,1050607,9冊93頁,2,6,董事長,財團法人向台教育基金會,0860627,高雄市前鎮區中山二路91號18樓之3,獎勵經濟教育之學術研究，關懷弱勢團體之教育問題，推廣文化教育之公益活動為宗旨。,朱安雄等捐助,高雄市政府教育局中華民國86年6月23日,永久,16710000.00,1,1050606,,,藍心妍,高雄市前鎮區長江街95號,,,,,,,,,一、章程變更：原章程第2條於105年3月2日，經法人第6屆第1次董事會議通過修正，報經主管機關備查。二、董事變更：第5屆董事任期屆滿，改選第6屆董事。三、董事印鑑登記。,,,,,https://aomp109.judicial.gov.tw/judbp/whd6k/q/jnliCULM9-r-kLkYrg7QobYwC7hlt4cTDkZD3kcG-VmJ6l-YePhC-pwsSSE=
105法登他000211,1,2,陳錦鑾,557,1050606,1050606,1050607,11冊73頁,2,6,董事長,財團法人郭隆龍先生文教基金會,0871219,高雄市三民區同盟二路21號,辦理托兒教育、幼稚教育及醫療教育為宗旨。,郭隆龍先生等捐助,高雄市政府教育局中華民國87年12月16日,永久,5000000.00,1,1050606,,,林儷真,,,,,,,,,,一、董事變更：第5屆董事任期屆滿，選聘第6屆董事。二、董事印鑑登記。,,,,,https://aomp109.judicial.gov.tw/judbp/whd6k/q/4jFApxD0zfcArbMQK1qxIqYTqwBpJhlwL8akofDGVaIg0BTfB-qLlZOlsxY=
105法登他000212,2,2,陳錦鑾,1551,1050607,1050607,1050608,31冊30頁,2,6,理事長,社團法人高雄市心家長協會,1030929,高雄市仁武區鳳仁路369巷41號,以提昇家長參與教育決策之能力、推動高雄市各級學校家長會效能化、提昇整體教育品質、提供家庭支持系統服務、建構家庭教育終身學習體系、倡導弱勢家庭終身習權益為宗旨。,會費及捐助,高雄市政府社會局95年5月24日高市社一字第95094號,永久,148325.00,1,1050607,1050718,1050628,林淑美,高雄市鳳山區中正路169之2號,830,,,,,,,,一、理監事變更：第5屆理監事任期屆滿，改選第6屆理監事。二、理監事印鑑登記。,,,107年10月23日雄院和登1551字第1071019817號函移轉橋頭地方法院管轄,,https://aomp109.judicial.gov.tw/judbp/whd6k/q/awVNaNFmjVb73ckTRMWhN8W_1LeSigDQw6LWXDn6dyykqdbiMrVjVdsGYAoH
105法登他000213,1,2,陳錦鑾,684,1050607,1050608,1050613,12冊185頁,2,7,董事長,財團法人高雄市私立聖和社會福利慈善事業基金會,0900129,高雄市路竹區鴨寮里保民路99巷36號,以舉辦社會福利慈善事業為宗旨,由蘇劉碧草女士捐助,高雄縣政府、民國90年1月9日90府社長字第3688號函,永久,96291775.00,1,1050608,1050707,1050627,周雅婷,,,,,,,,,,一、董事變更：第6屆董事任期屆滿，改選第7屆董事。二、董事印鑑登記。,,,107年3月22日雄院和登684字第1071006132號函移轉橋頭地方法院管轄,,https://aomp109.judicial.gov.tw/judbp/whd6k/q/_AI4HdASiJ8o8hErf_AC0TgNNwAzMAm23WIoS8OMEnETPxk1qXYRZIrkPfE=
105法登他000214,2,2,陳錦鑾,1569,1050608,1050608,1050613,32冊8頁,2,4,理事長,社團法人高雄市甲仙愛鄉協會,1031225,高雄市甲仙區大田里新榮巷14號,以協助區內社團發展，並結合區內社團力量，配合行政機關資源，共同促進地方整體發展為宗旨。,會費及捐助等,高雄縣政府95年3月23日府社行字第0950068987號函（現主管機關為高雄市政府）,永久,407297.00,1,1050608,,,曾麗雲,,,,,,,,,,一、原章程第34條於105年2月19日，法人第4屆第1次會員大會修正通過，報經主管機關備查。二、法人圖記變更。三、理監事變更：第3屆理監事任期屆滿，改選第4屆理監事。四、理監事印鑑登記。,,,,,https://aomp109.judicial.gov.tw/judbp/whd6k/q/nWR8xb_d8tzg0o6vUqw3I2iVNvB8SsuBJThkrmpe266d1_CCynJWhnPLDUhy
105法登他000215,1,2,陳錦鑾,345,1050607,1050608,1050613,7冊33頁,2,8,董事長,財團法人高雄市立兆湘國民小學教育發展基金會,0830223,高雄市岡山區介壽路60號,以協助高雄市立兆湘國民小學改善環境、發展校務、獎勵教師研究進修、促進學生敦品勵學為目的。,捐助及高雄縣政府補助,高雄縣政府、民國83年2月7日83府教社字第20080號,永久,2000000.00,1,1050608,1050707,1050628,莊豐懋,,,,,,,,,,一、董事變更：第7屆董事任期屆滿，改選第8屆董事。二、董事印鑑登記。,,,,106年4月25日雄院和登345字第1061010041號移轉橋院管轄,https://aomp109.judicial.gov.tw/judbp/whd6k/q/7UASceSO1sz9ZLdoO6ZRNkdY-0_4Ar3rdFuSn1ombXB3eWOe_sytUzmxBS8=
105法登他000216,1,2,陳錦鑾,377,1050607,1050608,1050613,7冊161頁,2,5,簡錦松,財團法人古典詩學文教基金會,0830905,高雄市前金區中華四路282號2樓,推廣古典詩學、提昇台灣文化。,捐助,教育部中華民國八十三年八月四日台八三社字０四三０一０號,永久,10000000.00,1,1050608,,,賴美享,,,,,,,,,,一、董事變更：第4屆董事任期屆滿，改選第5屆董事。二、董事印鑑登記。,,,,,https://aomp109.judicial.gov.tw/judbp/whd6k/q/ARWtGp5GzTL7HXE3zKnMqLjXz8kDlpPxm_l6nQAOXWZ5yLckCMGiuZcBVL0=
105法登他000217,1,2,陳錦鑾,333,1050608,1050608,1050613,6冊189頁,2,10,董事長,財團法人長谷文教基金會,0821222,高雄市三民區民族一路80號25樓之2,本基金會以提昇經營管理、建築科技研究、推動中國傳統文化、現代生活美學、人文教育及社會服務等活動為宗旨。,由長谷建設及長家營建捐助,教育部、82年12月20日台82社070726號函,永久,10000000.00,1,1050608,,,陳彩媚,,,,,,,,,,董事變更：第9屆董事任期屆滿，改選第10屆董事。,,,,,https://aomp109.judicial.gov.tw/judbp/whd6k/q/4l5r7KzUE-FvkCPbiBu-fbL8CFCbM5Ozn5t8acESJfh3aL38inH2v5IpSXc=
105法登他000218,2,2,陳錦鑾,661,1050608,1050608,1050613,12冊93頁,2,5,理事長,社團法人高雄市育仁社區關愛協會,0890830,高雄市岡山區岡山路436號,以仁愛胸懷，關愛兒童、青少年、中年、婦女及老人為對象，辦理終身學習，心靈建設及有益心身文康聯誼活動並提供服務為宗旨,會費及捐助,高雄縣政府、民國89年6月22日89府社行字第101198號函,永久,114789.00,1,1050608,,,黃韻純,,,,,,,,,,一、理監事變更：第4屆理監事任期屆滿，改選第5屆理監事。二、理監事印鑑登記。,,,,,https://aomp109.judicial.gov.tw/judbp/whd6k/q/Z8Dmgm9tLEgMfrKmirCj4Z6Xuj9KbMCagNpEhabtI9g4rtpFfNtrSXsZHPk=
105法登他000219,1,2,陳錦鑾,1136,1050613,1050613,1050613,20冊197頁,2,3,董事長,財團法人天真基金會,0980918,高雄市湖內區海埔里信義路180號,本於仁愛之精神，以宣揚道教教義暨興辦社會公益慈善事業為宗旨。,由榮田精機股份有限公司等共同捐助,高雄縣政府98年9月7日府民宗字第0980233462號函,永久,15000000.00,1,1050613,,,,,,,,,,,,,一、第2屆董事任期屆滿，改選第3屆董事。二、董事印鑑登記。,,,,,https://aomp109.judicial.gov.tw/judbp/whd6k/q/UfBcQZ5fcgeElO0RV7jYF6WtJwhKybs1azt_6Yb9jXi6UyC4KNZFMZhHtp_s
105法登他000220,1,2,陳錦鑾,1552,1050613,1050613,1050614,31冊31頁,2,4,理事長,社團法人台灣五方佛慈善會,0970725,高雄市湖內區海埔里忠孝街170號,尊重生命、人道關懷，發揚人溺己溺、人飢己飢的精神，以佛心為吾心、以悟心為佛心。,會員入會費、捐款及其他募款,內政部中華民國100年3月21日台內社字第1000057279號函,永久,131841.00,1,1050613,1050707,1050627,呂建發,,,,,,,,,,一、理監事變更：第3屆理監事任期屆滿，改選第4屆理監事。二、理監事印鑑登記。,,,107年8月15日雄院和登1552字第1071015644號函移轉橋頭地方法院管轄,,https://aomp109.judicial.gov.tw/judbp/whd6k/q/cLRgV0k2UxhGc5FwpOvItguqyJpgumDQ9CGSEndDS0VQiNL5uM9PF62GTEP-
105法登他000221,1,2,陳錦鑾,39,1050614,1050514,1050515,2冊13頁,2,9,董事長,財團法人高雄市文武聖殿,0520905,高雄市鹽珵區富野路170號,協助政府推行政令、團結信徒宣揚教義發展宗教信仰事業、並舉辦慈善事業福利社會為宗旨。,捐助,高雄市政府民政局、民國52年7月18日,永久,245350000.00,1,1050614,,,朱威亮,,,,,,,,,,一、董監事變更：第8屆董監事任期屆滿，改選第9屆董監事。二、董事監印鑑登記。,,,,,https://aomp109.judicial.gov.tw/judbp/whd6k/q/7ioNCT8_hgns9Du2VC6KjG73aODuYnZOtZLRdsgju4WEZjk_JYinKlTncw==
105法登他000222,1,2,陳錦鑾,198,1050614,1050614,1050615,5冊2頁,1,9,董事長,財團法人高苑科技大學,0780311,高雄市路竹區中山路1821號,遵照國家教育政策暨現行教育法令之規定辦理科技大學並謀其健全發展。,捐助,教育部、民國78年03月06日台82技058129號,永久,3942502063.00,1,1050614,1050707,1050623,陳麒文,,,,,,,,,,章程變更：原章程第11條於105年4月16日，法人第9屆第23次董事會議修正通過，報經主管機關備查。,,,,106年5月2日雄院和登198字第1061010651號移轉橋院管轄,https://aomp109.judicial.gov.tw/judbp/whd6k/q/rot_GCiwlkZrPexp8M5GayATZ3rv4H1mn60PZHQQR-X1ENyPwPhTlNR8tqs=
105法登他000223,2,2,陳錦鑾,493,1050614,1050614,1050615,10冊17頁,2,16,理事長,社團法人高雄市春陽協會,0861208,高雄市苓雅區中正二路22號8樓之1,以為顏面傷殘及燒傷同胞謀求法定保護地位並協助其重返社會以貢獻體能智慧為宗旨。,會費、捐助,高雄市政府社會局中華民國86年11月28日,永久,2279228.00,1,1050614,,,葉翡霞,,,,,,,,,,"一、理監事變更：第15屆理監事任期屆滿，改選第16屆理監事。 二、理監事印鑑登記。",,,,,https://aomp109.judicial.gov.tw/judbp/whd6k/q/-MWujP58ywJGd79xGScMpppOUfAMWF41ijXhy7VC3T2vY8SIB0l9cACtffk=
105法登他000224,2,2,陳錦鑾,1257,1050614,1050615,1050616,24冊14頁,2,12,理事長,社團法人高雄市美濃愛鄉協進會,0991224,高雄市美濃區福安里福安街12號,本會以促進地方發展提昇美濃地區教育、社會、生態及文化生活品質為宗旨。,會費及捐助,高雄縣政府83年6月7日83府社行字第91391號函,永久,132687.00,1,1050615,1050804,1050704,陳立蕙,,,,,,,,,,一、理監事變更：第11屆理監事任期屆滿，改選第12屆理監事。二、理監事印鑑登記。,,,107年6月06日雄院和登1257字第1071011223號函移轉橋頭地方法院管轄,,https://aomp109.judicial.gov.tw/judbp/whd6k/q/irQ_qvof-qykd3vM5ImippCW_NxrN8AU9jgUXIfSUb7YJsBbS_9uqD5kwcc3
105法登他000225,1,2,陳錦鑾,12,1050615,1050712,1050713,1冊13頁,2,4,董事長,財團法人高雄縣鳳山市教會聚會所,0470503,高雄縣鳳山市曹公路36巷1號,宣揚基督教教義，興辦公益事業，促進社會福利。,信徒自由樂捐,高雄縣政府中華民國47年3月27日,永久,600000.00,1,1050712,1050901,1050722,黃永榮,高雄市前金區新盛二街60號,801,,,,,,,,"第3屆董、監事屆滿,改選第4屆董、監事。",,,,,https://aomp109.judicial.gov.tw/judbp/whd6k/q/uR6H4D5JTQONUqreu-fIDevOHltOJrvcwP7t6Ylcsxxf_Ish6Itxs_jiEw==
105法登他000226,1,2,陳錦鑾,20,1050614,1050615,1050616,1冊27頁,2,14,董事長,財團法人台灣基督教救恩會,0500616,高雄市鼓山區鼓山一路161巷20號,以闡揚基督聖教為任務，為宣傳教義，倡導救助社會為目的。,捐助,臺灣省政府、中華民國50年5月29日,永久,17363098.00,1,1050615,,,,,,,,,,,,,一、董事變更：第13屆董事任期屆滿，改選第14屆董事。二、董事印鑑登記。,,,,,https://aomp109.judicial.gov.tw/judbp/whd6k/q/wKrbBtDn5nuvqwjJKISW4mS8lBx17X3JOq5Vo5iH4Pjx70A7HF4DS25EOg==
105法登他000227,1,2,陳錦鑾,635,1050615,1050615,1050616,11冊385頁,1,3,董事長,財團法人長秀更年期關懷文教基金會,0890203,高雄市鼓山區美術東二路177號7樓,以鼓勵優秀更年期醫學人員，研究發展更年期及停經後醫學，增進國際研討交流，提昇我國更年期及停經後醫學水準為宗旨。,捐助,高雄縣政府、民國八十八年十二月二十七日(八八)府教社字第二三一五０八號函,永久,4000000.00,1,1050615,,,洪梅箐,,,,,,,,,,一、章程變更：原章程第4條於105年2月21日經法人第3屆第2次董事會議修正通過，報經主管機關備查。二、主事務所變更為高雄市鼓山區美術東二路177號7樓。,,,,,https://aomp109.judicial.gov.tw/judbp/whd6k/q/yQIqY950PuoA8fCVmWVIQOOpWexp0Yw3jDuvilkwz0CeTiqnEjND9JoyS8s=
105法登他000228,1,2,陳錦鑾,184,1050616,1050616,1050617,4冊78頁,1,10,董事長,財團法人佛光山文教基金會,0770613,高雄市大樹區興田路153號,獎助專業人才及優秀青年進修留學、造福社會提昇文化水準、弘揚佛法淨化人人心為宗旨。,星雲大師等捐助,教育部、民國77年3月26日,永久,28685200.00,1,1050616,1050718,1050627,林立貴,,,,,,,,,,章程變更：原章程第5、18條於105年5月19日經法人第10屆第4次董事會議修正通過，報經主管機關備查。,,,107年5月9日雄院和登184字第1071009441號函移轉橋頭地方法院管轄,,https://aomp109.judicial.gov.tw/judbp/whd6k/q/zn_-BmjeT4A04s-PeVAFZRT8CM0xeUvo2jX-9li3rfT5Nme5eN17kDBntbA=
105法登他000229,1,2,陳錦鑾,1036,1050617,1050617,1050619,18冊1頁,2,5,董事長,財團法人高雄法邁內觀中心,0961224,高雄市六龜區荖濃里頂濃路100巷1之1號,本法人本於釋迦牟尼佛智慧與慈悲之精神，以傳揚釋迦牟尼佛教義為宗旨。,由高雄縣法印精舍捐助,高雄縣政府民國96年12月18日府民宗字第0960280543號函,永久,20549895.00,1,1050617,1050707,1050621,林奕全,,,,,,,,,,"變更登記事項:原捐助章程第七條經董事會議於105年3月27日第5屆第2次通過變更 ,報經主管機關高雄市政府民政局以105年5月23日高市民政宗字第10531056100號准予備查。並經本院105法字第14號裁定確定准予補充變更。",,,107年3月1日雄院和登1056字第107004526號函移轉橋頭地方法院管轄,,https://aomp109.judicial.gov.tw/judbp/whd6k/q/umJhZqpsWbk3ItRoNRmijWT54uuIh9w3c2n8JiV0hWrhNqxZdnEmUqiAmbLN
105法登他000230,1,2,陳錦鑾,93,1050617,1050617,1050619,3冊37頁,1,12,董事長,華德學校財團法人,0611201,高雄市茄萣區濱海路四段66號,辦學理念為以「品德為本、知能為重、人文為要」，創辦華德學校財團法人高雄市華德高級工業家事職業學校，並謀求其發展為目的。,捐助,台灣省政府教育廳、中華民國61年11月2日（民國88年7月1日隸屬教育部）,永久,222704168.00,1,1050617,1050707,1050627,許瓊元,,,,,,,,,,"原董事吳明德先生辭卸董事 ,補選吳黛妮女士為董事.",,,,106年3月14日雄院和登93第1061006571號函移台灣橋頭地方法院,https://aomp109.judicial.gov.tw/judbp/whd6k/q/ZPZ_D206LKe4QjTuNB9JPECys0sd0abcLWdhAJGSGlJaGHk5Tj7bCYK_pg==
105法登他000231,1,2,陳錦鑾,384,1050620,1050620,1050621,7冊187頁,2,8,董事長,財團法人國立高雄師範大學教育學術基金會,0831128,高雄市苓雅區和平一路116號,本會以協助校務發展、提昇學術水準、改善教學環境為宗旨。,捐助,教育部、中華民國83年11月15日台83社字第06131號,永久,16387529.00,1,1050620,,,周君珍,,,,,,,,,,一、董事變更：第7屆董事任期屆滿，改選第8屆董事。二、董事印鑑登記。,,,,,https://aomp109.judicial.gov.tw/judbp/whd6k/q/upYMjGS8nqX4MRQV5Bp1Gf1mmXo-4TcyE85-4339XW1un1Xzt-g3uq6mVBM=
105法登他000232,2,2,陳錦鑾,1185,1050621,1050621,1050622,22冊85頁,2,2,理事長,社團法人臺灣大中華家庭關懷協會,0990519,高雄市左營區南屏路250號之1,發揮家庭關懷促進家庭互助並力行慈善公益活動。,會費及捐助,內政部99年5月5日台內社字第0990090160號函,永久,50000.00,1,1050621,1050718,1050627,李辰璟,,,,,,,,,,一、理監事變更：第2屆理監事任期屆滿，改選第3屆理監事。二、理監事印鑑登記。,,,107年6月06日雄院和登1185字第1071011222號函移轉台中地方法院管轄,,https://aomp109.judicial.gov.tw/judbp/whd6k/q/dERSFvSbK6WN9lz80bN1ofUCuZAEKzCANwabjWh_GwE7mLR03HVSDR-paASr
105法登他000233,1,2,陳錦鑾,1264,1050622,1050622,1050623,24冊21頁,2,3,董事長,財團法人台灣基督長老教會高雄宣教中心,1000117,高雄市三民區山東街142號4樓,本法人之宗旨本於耶穌基督仁愛救人之精神，宣揚基督教義、辦理社會公益慈善及文教事業為目的。,由財團法人台灣基督長老教會捐助,高雄市政府民政局99年11月22日高市民政三字第0990014977號函,永久,24190025.00,1,1050622,,,方玉齡,,,,,,,,,,一、董事變更：第2屆董事任期屆滿，改選第3屆董事。二、董事印鑑登記。,,,,,https://aomp109.judicial.gov.tw/judbp/whd6k/q/lxRvyGgqQY8E6GM50VzCVwfe1eXctx_tc70RWr5yE7r1SI7C2BvJOMREBKnD
105法登他000234,1,2,陳錦鑾,435,1050623,1050704,1050706,8冊189頁,2,6,董事長,財團法人高雄市私立永安老人養護中心,0850618,高雄市大寮區過溪里濃中街12號,舉辦老人福利慈善事業。,捐助,高雄縣政府八十五年五月二十一日八五府社福字第九五一八五號,永久,49679710.00,1,1050704,,1050720,袁海涵,高雄市大寮區濃公路192號,831,,,,,,,,"一、財產總額變更:財產總額異動為4,967萬9,710元整。
二、章程修正：105年4月16日第六屆第二次董事會議記錄修正章程第10條。",,,,,https://aomp109.judicial.gov.tw/judbp/whd6k/q/giOBxUcQSW9_YsFJtvQieUdwlyG_xVurgexxzXwoisIEL2phhK8Ku9F-IeU=
105法登他000235,2,2,陳錦鑾,1108,1050623,1050627,1050628,20冊31頁,2,5,理事長,社團法人中華卓越國際公益協會,0980305,高雄市三民區民族一路80號50樓,集合企業資源與優勢，以教育、技能、獎助輔助需支援之個人與團體，共創社會有益文化,會員會費與捐助等,內政部中華民國97年4月9日台內社字第0970059253號函,永久,20000.00,1,1050627,,,吳政德,,,,,,,,,,一、理監事變更：第4屆理監事任期屆滿，改選第5屆理監事。二、理監事印鑑登記。,,,,,https://aomp109.judicial.gov.tw/judbp/whd6k/q/1z4AvPMxMf90vWZSjxVoh1xpR9guGhH7jX03xaI74xoFdYUd9Y_fM_IApeHs
105法登他000236,1,2,陳錦鑾,779,1050624,1050627,1050628,13冊165頁,1,5,董事長,財團法人內惟埤文化藝術基金會,0920226,高雄市鼓山區美術館路89號,本會以致力於運用社會資源，推動藝文活動，提昇文化品質與促進社區感情，並以增進家庭、教育、社會生活環境為宗旨,由呂惠美捐助,高雄市政府文化局、民國九十二年一月二十八日高市文一字第０九二００００四０七號函,永久,5000000.00,1,1050627,,,呂淑媛,,,,,,,,,,章程變更：原章程第1、7條於104年12月25日法人第5屆第3次董事會修正通過，其中第7條經本院105年度法字第11號裁定確定准予變更，均報經主管機關備查。,,,,,https://aomp109.judicial.gov.tw/judbp/whd6k/q/uZnfWid7Eins1y04640cOKVjh4bWGxeUFMc8ahWlTAF0n-eE-o6jb91_Hqg=
105法登他000237,1,2,陳錦鑾,286,1050624,1050627,1050628,6冊1頁,1,8,董事長,財團法人國立鳳山高級商工職業學校文教基金會,0820105,高雄市鳳山區文衡路51號,"以協助國立鳳山高級商工職業學校改善環境、發展校務、奬勵教師（研究及  教學服務績優等）促進學生敦品勵學為目的。",捐助,高雄縣政府、81年12月29日81府教社字第201059號,永久,5850000.00,1,1050627,,,伍世雄,高雄市鳳山區中山東路136巷34號,830,,,,,,,,章程變更：原章程第6、7、10條於法人105年4月1日第8屆第6次董事會議修正通過，並經本院105年度法字第25號裁定確定准予變更，報經主管機關備查。,,,,,https://aomp109.judicial.gov.tw/judbp/whd6k/q/8_EAJYiS4pENw7mF9O-z5g87OZ9SjUcnu529R3Tg2ntKgR9wTY6-HsSFDEE=
