登記案號,類別,案由,主任,登記號數,收件日期,登記日期,公告日期,登記簿,任期判定,屆期判定,法人代表,法人名稱,設立登記日期,主事務所,目的,捐助方法,許可機關日期,存立時期,財產總額,結案原因,結案日期,歸檔日期,發證日期,清算人,變更原因,註銷日期,撤銷日期,撤(註)銷機關文號,撤(註)銷原因
105法登他000001,1,2,李秋瓊,597,1050104,1050104,1050104,16冊30頁,2,8,劉招明,財團法人廖英鳴文教基金會,0830627,臺中市西屯區文華路１００號,以協助學術發展進而提昇國內人文及科技水準為宗旨。,由黃秋雄捐助,"教育部       中華民國８３年６月１１日","永  久",10000000.00,1,1050104,,1050105,,,,,,
105法登他000002,2,2,李秋瓊,1361,1050104,1050104,1050104,29冊60頁,2,10,黃同家,社團法人中華民國禪理研究會,0781214,臺中市豐原區北陽路515號,以一、用科學禪理，端正社會風氣，匡扶風俗人心。二、復興固有文化，弘揚濟世大道。三、強身淨心，以期堯天舜日文風，中華古禮文化之再興為宗旨。,會員會費等,內政部　　　中華民國七十八年十一月九日,永　久,498782.00,1,1050104,,1050105,,,,,,
105法登他000003,2,2,李秋瓊,2184,1050105,1050105,1050105,43冊44頁,2,2,劉啟仲,社團法人中華大家功德會,1020501,臺中市北屯區松竹路二段308號,以結合社會資源、推廣社會福利與道德教育服務及各項社會公益為宗旨。,會員會費等,內政部中華民國102年3月26日台內社字第1020137016號函,永久,3836335.00,1,1050105,,1050106,,章程修訂：原章程第28條條文內容修訂。,,,,
105法登他000004,1,2,李秋瓊,1947,1050106,1050106,1050106,39冊47頁,1,2,林隆洲,財團法人大毅幸福教育基金會,1000518,臺中市北屯區崇德路三段1號,本會以推動幸福家庭、樂活環保、兒童教育、人文藝術、健康律動、社會關懷為宗旨。,由大毅建設股份有限公司等共同捐助。,臺中市政府教育局中華民國100年5月16日中市教社字第1000026821號函,永久,26733318.00,1,1050106,,1050107,,章程變更：原捐助章程第5條條文內容修訂。,,,,
105法登他000005,1,2,李秋瓊,159,1050106,1050106,1050106,6冊13頁,1,15,郭榮昌,財團法人中臺科技大學,0550701,臺中市北屯區廍子里廍子路666號,為遵照國家教育政策暨現行教育法令之規定，辦理科技大學，且以朝向醫學大學為目標，並謀其健全發展之目的，設立財團法人中臺科技大學。,由本會董事會捐助,"教育部       中華民國５５年８月１０日","永   久",3317849589.00,1,1050106,,1050107,,,,,,
105法登他000006,1,2,李秋瓊,518,1050106,1050106,1050106,15冊1頁,1,6,黃芝溪,財團法人台中市後備軍人(子女)獎學金文教基金會,0811214,臺中市西屯區青海路二段１１１號,以獎助優秀後備軍人(子女)努力向學，培養書香氣息，促進社會和諧。,由臺中市各區後備軍人輔導中心、社會人士、社團組織、公司行號等捐助,"臺中市政府　       中華民國８１年１２月５日","永 久",17667028.00,1,1050106,,1050107,,,,,,
105法登他000007,2,2,李秋瓊,802,1050106,1050106,1050106,20冊40頁,2,6,鄭明裕,社團法人中華東海建築文化協會,0870820,臺中市南屯區大進街669之3號7樓,以提昇建築文化品質，促進各界間之交流並推廣建築教育為宗旨。,會員會費等,內政部　　中華民國８７年５月５日,永　久,650000.00,1,1050106,,1050107,,,,,,
105法登他000008,1,2,李秋瓊,568,1050106,1050106,1050106,16冊1頁,1,12,倪洪珊,財團法人臺中市私立信望愛智能發展中心,0821217,臺中市豐原區水源路7巷239號,本中心以專業及永續關懷之精神，配合政府推行身心障礙及發展遲緩者社會福利業務，有效推廣相關對象之教育、訓練、照護、復健、居住及早期療育等服務，提升其融合正常化環境之能力，並結合社會關懷提供家庭支持為宗旨。,由各董事及團體捐助,"臺中縣政府          中華民國８２年１２月９日","永  久",32000000.00,1,1050106,,1050108,,章程變更：原捐助章程第8、17條條文內容修訂，第18條刪除，第19條起條次遞昇；經本院民事庭104年度法字第47號裁定准予變更。,,,,
105法登他000009,1,2,李秋瓊,163,1050107,1050107,1050107,7冊3頁,1,15,王乃弘,財團法人弘光科技大學,0560622,臺中市沙鹿區晉江里臺灣大道六段1018號,為培育專業人才，設立財團法人弘光科技大學。,由王毓麟捐助,"教育部      中華民國５６年６月２０日","永 久",3754075731.00,1,1050107,,1050108,,,,,,
105法登他000010,1,2,李秋瓊,1161,1050107,1050107,1050107,26冊39頁,2,7,林正介,財團法人老五老基金會,0860922,臺中市北屯區松山街79號,一、發揚人類自助互助之美德。二、結合民間與政府相關資源。三、從事有關因應高齡化社會之學術研究與實務推展。四、對政府部門相關政策與實務推展。五、營造安和樂利之高齡化社會。,由發起人、民間企業、機構、團體及社會人士共同捐助,"南投縣政府             中華民國八十六年九月十七日","永   久",38500000.00,1,1050107,,1050108,,,,,,
105法登他000011,1,2,李秋瓊,1185,1050107,1050107,1050107,27冊3頁,1,4,石建東,財團法人私立明道普霖斯頓國民小學,0921203,臺中市北屯區河北路三段１６號,(一)：為遵照國家教育政策暨現行教育法令之規定，辦理國民小學。(二)：為補充國民生活知識，提高教育程度，培養優秀人才，輔導升學及促進社會進步，辦理補習班並謀其健全發展。,由石建東、黃啟誠等人捐助,"臺中市政府       中華民國９２年８月１２日","永   久",494340068.00,1,1050107,,1050108,,,,,,
105法登他000012,1,2,李秋瓊,107,1050107,1050107,1050107,4冊21頁,2,22,趙明洋,財團法人真耶穌教會臺灣總會,0470426,臺中市北屯區松竹路二段１８０號,傳揚耶穌基督福音，舉辦公益慈善事業，促進社會福利。,由林榮杰等人捐助,"臺灣省政府民政廳          中華民國４７年３月２４日","永   久",4028232109.00,1,1050107,1050219,1050108,,,,,,
105法登他000013,1,2,李秋瓊,1791,1050107,1050107,1050107,37冊11頁,2,3,卓永財,財團法人上銀科技教育基金會,0990118,臺中市南屯區文山里精科路7號,藉由各項教育與奬助活動，以促進我國工業水準之提升為宗旨。,由上銀科技(股)公司等共同捐助,臺中市政府中華民國９９年１月４日府教社字第0980346211號函,"永 久",123535260.00,1,1050107,,1050108,,,,,,
105法登他000014,1,2,李秋瓊,2524,1050108,1050108,1050108,49冊22頁,1,,賴加勳,財團法人產業安全技術中心,1040916,臺中市南屯區工業區22路6號,增進工作場所勞工操作器具設備安全或衛生，研發或應用相關產業技術以提升整體工作安全與功能為目的。,由賴加勳、徐凱玲共同捐助,勞動部中華民國104年9月9日勞職授字第1040202977號函,永久,10200000.00,1,1050108,,1050111,,法人圖記變更。,,,,
105法登他000015,1,2,李秋瓊,167,1050111,1050111,1050111,7冊11頁,1,33,曾紀鴻,財團法人東海大學,0560912,臺中市西屯區臺灣大道四段1727號,為遵照國家教育發展政策暨現行教育法令規定辦理大學，並謀其健全發展之目的，設立財團法人東海大學。,由美國在亞洲基督教高等教育聯合董事會捐贈,"教育部           中華民國44年9月27日","永  久",8263055723.00,1,1050111,,1050112,,,,,,
105法登他000016,1,2,李秋瓊,306,1050111,1050111,1050111,10冊35頁,1,9,郭秀銘,財團法人台中市私立蓮友慈益基金會,0700410,臺中市東區東信里東英五街88號,以弘揚中華文化提倡國民道德，輔助社會福利，辦理慈善公益為宗旨。,由李炳南等人捐助,"臺中市政府               中華民國７０年２月１８日","永  久",5680735.00,1,1050111,,1050112,,章程變更：原捐助章程第2條條文內容修訂。,,,,
105法登他000017,1,2,李秋瓊,1584,1050111,1050111,1050111,33冊44頁,2,5,黃翠錦,財團法人水藍文教基金會,0870511,臺中市大里區德芳路二段116號,弘揚社會倫理，提倡社會公益活動，並培育國內文教科技人才，致力加速文教科技發展為宗旨。,由黃翠錦等人捐助,"教育部            中華民國８７年４月１７日","永    久",10000000.00,1,1050111,,1050112,,,,,,
105法登他000018,1,2,李秋瓊,545,1050112,1050112,1050112,15冊28頁,1,8,張趙忠誠,財團法人臺灣省私立天一圓德社會福利慈善事業基金會,0820901,臺中市大里區東興里益民路二段347號,闡揚中華固有道德文化，辦理社會公益事業為宗旨。,由何添火等捐助,"臺灣省政府社會處      中華民國８２年８月２３日","永  久",13000000.00,1,1050112,,1050113,,章程變更：原捐助章程第5、6、24條條文修訂，經本院民事庭104年度法字第72號裁定准予變更。,,,,
105法登他000019,2,2,李秋瓊,1270,1050112,1050112,1050112,28冊28頁,2,13,鍾李美雲,社團法人台灣省慈心協會,0930811,臺中市北區崇德路一段１５６號１１樓之３,秉持「政治、宗教中立」與「取之於社會、用之於社會」之精神，擷取專家學者建言，建立公開之人事、財務及專業、人性化制度，以推展社會服務、醫療建設、社會文化、急難救助等事業為宗旨。,會員會費等,臺灣省政府　　　中華民國８０年１月２９日,"永  久",1000000.00,1,1050112,,1050113,,,,,,
105法登他000020,1,2,李秋瓊,152,1050112,1050112,1050112,6冊6頁,1,15,廖繼誠,財團法人臺中市私立大明高級中學,0540518,臺中市大里區新仁路三段210號,為辦理臺中市私立大明高級中學並謀其永續發展之目的，設立財團法人臺中市私立大明高級中學。,由盧中天捐助,"臺灣省政府教育廳          中華民國53年6月19日","永   久",787238902.00,1,1050112,,1050113,,,,,,
105法登他000021,1,2,李秋瓊,149,1050112,1050112,1050112,6冊3頁,1,13,簡豐杰,財團法人臺中市新福宮,0531124,臺中市東區新庄里和平街228巷1號,奉祀三府王爺為主神，以宏揚教義，導正宗教信仰改善民俗，興辦公益慈善事業，推行文化建設，促進社會福祉為目的。,由原臺中市新福宮等捐助,"臺中市政府        中華民國５３年１０月８日","永 久",9310000.00,1,1050112,,1050113,,章程變更：原捐助章程第1、5條條文內容修訂，其中第5條經本院民事庭104年度法字第68號裁定准予變更。法人圖記變更。,,,,
105法登他000022,2,2,李秋瓊,2044,1050112,1050112,1050112,41冊24頁,2,2,許文忠,社團法人臺中市恩光社區關懷協會,1010330,臺中市南區城隍里國光路225號,以耶穌基督的愛關懷弱勢族群、促進族群融合、提倡正當休閒活動、使家庭和樂、社會和諧、生活有盼望、人生有亮光為宗旨。,會員會費等,臺中市政府社會局中華民國101年1月4日中市社團字第1000097815號函,永久,500.00,1,1050112,,1050113,,,,,,
105法登他000023,1,2,李秋瓊,94,1050112,1050112,1050112,4冊8頁,1,16,黃慶隆,財團法人臺灣聖教會,0450817,臺中市北區錦新街30號12樓,以建立基督教會、會堂管理、傳講基督教義、興旺教會及辦理慈善福祉、社會教化為宗旨。,臺南聖教會等捐助,"臺灣省政府          中華民國４５年８月１日","永  久",938510788.00,1,1050112,,1050113,,,,,,
105法登他000024,1,2,李秋瓊,1127,1050114,1050114,1050114,26冊5頁,1,5,郭秀銘,財團法人台中市私立慈光社會福利慈善事業基金會,0920321,臺中市東區東信里東英路３０３號,秉持佛家慈悲濟眾之心懷及儒家幼人之幼之精神，以創辦附設慈馨兒少之家、慈馨少年家園、慈光社區心理諮商所暨扶助貧孤兒童及不幸青少年等社會福利慈善事業為宗旨。,由郭秀銘女士捐助,"臺中市政府            中華民國９２年３月１７日","永 久",157910208.00,1,1050114,,1050118,,章程變更：原捐助章程第3、5、19、21、22、23、24內容修訂；其中第3、5、19、22、23條，經本院民事庭105年度法字第2號民事裁定准予變更。,,,,
105法登他000025,1,2,李秋瓊,231,1050115,1050115,1050115,9冊8頁,1,13,郭永生,財團法人私立郭腓利門紀念基金會,0630501,臺中市北屯區松竹路二段180號,資助兒童青少年老人福利機構及宗教團體舉辦之福利措施與其學生中心奬助金等。,郭頂順等人捐助,"臺灣省政府社會處               中華民國63年3月15日","永  久",41456383.00,1,1050115,,1050118,,,,,,
105法登他000026,2,2,李秋瓊,2579,1050115,1050115,1050115,50冊17頁,1,,"簡  淑",社團法人台灣遺傳諮詢學會,1040708,臺中市西屯區上安里至善路62號4樓,為增進遺傳諮詢專業、協助政府推行保健、衛生、醫療法令與社會服務、維護會員權益、增進共同利益為宗旨。,入會費、常年會費、事業費、會員捐款、委託收益、基金及其孳息、其他收入。,內政部中華民國97年9月4日台內社字第0970144197號函,永久,312373.00,1,1050115,,1050118,,,,,,
105法登他000027,2,2,李秋瓊,1914,1050115,1050115,1050115,39冊14頁,1,3,王湘瀚,社團法人中華民國三學佛學院,1000216,臺中市北區中清路一段79號9樓Ａ,本會設立之基本目標在於對佛教哲學文化之研究與宣揚。期望讓世人深入了解佛教的教理與修持方式，進而得以淨化身心，人人解脫自在。,會員會費等,"內政部    中華民國１００年１月５日台內社字第0990248531號函","永 久",209874.00,1,1050115,,1050118,,章程變更：原章程第2、6條條文內容修訂。,,,,
105法登他000028,1,2,李秋瓊,2177,1050118,1050118,1050118,43冊37頁,1,18,韓仁偉,財團法人台灣基督教協同會,0470210,臺中市外埔區大馬路123號,為傳揚及推進救主耶穌之福音、服務教會及推廣社會慈善事業；並為在美國新澤西州登記之基督教協同會在台灣地區及台灣以外地區推進其宗教工作。,由美國新澤西州基督教協同會捐助,台灣省政府46年11月28日府民一字第113722號函,永久,483915437.00,1,1050118,,1050119,,,,,,
105法登他000029,1,2,李秋瓊,135,1050119,1050119,1050119,5冊19頁,1,18,蕭清杰,財團法人臺中市萬和宮,0510106,臺中市南屯區萬和路一段５１號,宣揚媽祖聖德，力求改善民俗，興辦慈善公益事業，促進社會福利。,由原南屯區萬和宮捐助,"臺中市政府               中華民國５０年９月２２日","永  久",223411.00,1,1050119,,1050120,,章程變更：原捐助章程第1－4、8、10、15、28條條文內容修訂；其中第4、8、10、15、28條經本院民事庭104年度法字第66號裁定准予變更。法人圖記變更。,,,,
105法登他000030,1,2,李秋瓊,1396,1050119,1050119,1050119,30冊35頁,1,4,林重國,財團法人東震社會福利慈善事業基金會,0941111,臺中市文心路一段４２９號,以辦理社會福利慈善事業為目的。,由東震股份有限公司等共同捐助,"內政部             中華民國９４年１０月２６日","永   久",30000000.00,1,1050119,,1050120,,,,,,
105法登他000031,1,2,李秋瓊,698,1050119,1050119,1050119,18冊32頁,1,6,黃世妍,財團法人一貫道崇正基金會,0851004,臺中市太平區東平路766號,本基金會為發揚中華文化、宣揚中華道統及一貫道傳道真義與宗旨，倡導倫理道德。增進社會福祉，利國利民為宗旨。,由黃世妍捐助,"內政部          中華民國８５年９月１０日","永   久",182109121.00,1,1050119,,1050120,,,,,,
105法登他000032,1,2,李秋瓊,1911,1050120,1050120,1050120,39冊11頁,1,2,釋印可,財團法人嚴淨菩提教育基金會,1000208,臺中市北屯區瀋陽路三段134號,本會以品德倫理之提升端正社會奢靡之惡風，以佛陀慈悲之本懷教育大眾人心之向善為宗旨。,由釋印可捐助,"臺中市政府教育局  中華民國100年2月1日中市教社字第1000003280號函",永久,8324324.00,1,1050120,,1050121,,章程變更：原捐助章程第4、15條條文內容修訂。,,,,
105法登他000033,1,2,李秋瓊,479,1050120,1050120,1050120,14冊11頁,2,9,張天任,"財團法人張  明、王國秀文教基金會",0810116,臺中市太平區中山路一段215巷35附1號,"為遵循國家文教政策暨現行法令之規定，辦理張  明、王國秀文教基金會並謀其發展。","由張  明、王國秀伉儷捐助","教育部            中華民國８０年１２月２０日","永  久",147922507.97,1,1050120,,1050121,,,,,,
105法登他000034,2,2,李秋瓊,2378,1050120,1050120,1050120,46冊56頁,1,,李美賞,社團法人臺中市天使守護關懷協會,1030828,臺中市新社區復盛里興社街二段17之6號,致力於人文關懷、社區服務，關懷老人及弱勢族群，結合家屬及各專業力量倡導老年失智症的認識、預防、照護並組織失智症家屬支持團體，提昇失智症者、家屬及照顧者的生活品質，促進家庭與社會之祥和及協助政府推動老人相關福利政策為宗旨。,會員會費等,臺中市政府社會局中華民國103年6月30日中市社團字第1030063265號函,永久,5200.00,1,1050120,,1050122,,,,,,
105法登他000035,2,2,李秋瓊,2461,1050121,1050121,1050121,48冊19頁,2,20,劉仁煌,社團法人台中市和風慈善會,1040408,臺中市東區天乙街50號,秉持「人飢己飢，人溺己溺」及「助人為快樂之本」之宗旨，集腋成裘及時援助社會上孤苦、急難者，讓溫馨、祥和散播到社會各個角落。,會員會費等,臺中市政府社會局中華民國86年3月16日第2-05-183號,永久,15293216.00,1,1050121,,1050122,,,,,,
105法登他000036,1,2,李秋瓊,2147,1050121,1050121,1050121,43冊7頁,2,2,張燕雪,財團法人劉曜瑋青年國際志工基金會,1020103,臺中市沙鹿區中清路1之10號2樓,以推廣關懷國際社會之理念、鼓勵青年投入國際志工的行列為宗旨。,由劉明創等人共同捐助,行政院青年輔導委員會中華民國101年12月17日青參字第1010010089號函,永久,5200000.00,1,1050121,,1050122,,,,,,
105法登他000037,1,2,李秋瓊,137,1050121,1050121,1050121,5冊21頁,1,15,郭劉昭惠,財團法人臺中市私立新民高級中學,0510227,臺中市北區健行路１１１號,為創辦私立新民高級中學並謀其發展為目的，設立財團法人臺中市私立新民高級中學。,由張煥珪等捐助,"臺灣省政府教育廳             中華民國４９年６月１７日",永　久,2885452382.00,1,1050121,,1050122,,,,,,
105法登他000038,1,2,李秋瓊,119,1050121,1050121,1050121,5冊3頁,1,14,王俊傑,財團法人臺中市私立明道高級中學,0500301,臺中市烏日區仁德里中山路一段497號,為作育英才，實現私人興學理想之目的，設立財團法人臺中市私立明道高級中學。,由王福來捐助新台幣捌佰萬元暨汪廣平捐助新台幣捌佰捌拾萬元,"臺灣省政府教育廳   　  中華民國４９年７月２７日","永  久",1720010838.00,1,1050121,,1050122,,,,,,
105法登他000039,1,2,李秋瓊,736,1050121,1050121,1050121,19冊22頁,1,7,黃安全,財團法人台中市西區中正國民小學學校文化教育基金會,0860503,臺中市西區英才路４２３號,以提昇中正國小教育品質、推動教育發展為宗旨。,由中正國小家長會捐助,"臺中市政府    　  中華民國８６年４月１６日","永   久",4000000.00,1,1050121,,1050122,,,,,,
105法登他000040,1,2,李秋瓊,1420,1050121,1050121,1050121,30冊60頁,1,4,黃全福,財團法人加馬刀腦神經醫學教育基金會,0950509,臺中市南屯區大墩二街３之６號１６樓,以教育大眾對腦神經疾病的認識、治療與預防保健為宗旨。,由黃全福、李德明二人共同捐助,"臺中市政府           中華民國９５年５月３日","永   久",21231604.00,1,1050121,,1050122,,,,,,
105法登他000041,1,2,李秋瓊,258,1050122,1050122,1050122,9冊35頁,2,11,江麗慧,財團法人臺中市四張犂三官堂,0650303,臺中市北屯區昌平路二段６８號,虔誠崇奉三官大帝神聖、醒悟修身、樂善好施、宏揚教義，導民為善，並興辦慈善事業。,由游朝陽等捐助,"臺中市政府          中華民國６５年１月２２日","永   久",551300.00,1,1050122,,1050125,,章程變更：原捐助章程第8、12、13、15、20、22、24、25、26條條文內容修訂，經本院民事庭104年度法字第73號裁定准予變更。,,,,
105法登他000042,2,2,李秋瓊,1733,1050122,1050122,1050122,36冊13頁,2,3,徐銘健,社團法人中華民國恩雨關懷協會,0980612,臺中市太平區育德路247號2樓,以「助人為快樂之本」廣結社會善心人士幫助社會邊緣人及弱勢者，讓社會更加祥和,會員會費等,"內政部       中華民國98年3月27日台內社字第0980055879號函","永  久",50000.00,1,1050122,,1050125,,,,,,
105法登他000043,1,2,李秋瓊,148,1050122,1050122,1050122,6冊2頁,1,17,劉瑞瓊,財團法人臺灣省臺中市私立曉明女子高級中學,0530705,臺中市北區賴明里中清路一段606號,為遵照國家教育政策暨教育法令之規定，辦理高級中學(含國中)教育，並謀其健全發展，設立財團法人臺灣省臺中市私立曉明女子高級中學。,由羅馬教廷等初期捐助成立,"臺灣省政府教育廳    　中華民國５２年７月１１日","永   久",680186081.00,1,1050122,,1050125,,,,,,
105法登他000044,1,2,李秋瓊,136,1050122,1050122,1050122,5冊20頁,1,17,林亦沂,宜寧學校財團法人,0510108,臺中市南區復興路二段４５號,為遵照國家教育政策暨現行教育法令之規定，辦理高級中學，並謀其健全發展。設立宜寧學校財團法人。,由蔣緯國等捐助,"臺灣省政府教育廳               中華民國４０年１１月７日","永  久",271552977.00,1,1050122,,1050125,陳信紅(學校),,,,,
105法登他000045,1,2,李秋瓊,951,1050122,1050122,1050122,23冊9頁,1,5,蔡長海,財團法人亞洲大學,0891101,臺中市霧峰區南柳里柳豐路５００號,為促進高等教育發展之目的，設立財團法人亞洲大學。,由蔡長海、林增連等人捐助,"教育部            中華民國８９年１０月２３日","永  久",5183063436.00,1,1050122,,1050125,,,,,,
105法登他000046,2,2,李秋瓊,2072,1050122,1050122,1050122,41冊52頁,2,2,莊素貞,社團法人中華視覺障礙教育學會,1010614,臺中市西區民生路140號（台中教育大學特教系轉求真樓1003室）,為研究及促進我國視覺障礙教育之發展。,會員會費等,內政部中華民國88年7月8日台（88）內社字第8881457號函,永久,5666.00,1,1050122,,,,主事務所遷移至臺北市北投區立農里吉利街259巷42號5樓,,,,
105法登他000047,2,2,李秋瓊,2297,1050125,1050125,1050125,45冊37頁,2,4,何幸枝,社團法人台中市東區東英社區發展協會,1030121,臺中市東區東英里東英十五街155號,以促進社區發展，增進居民福利，建設安和融洽、團結互助之現代社會為宗旨。,會員會費等,臺中市政府中華民國94年10月13日府社行字第0940189608號,永久,326420.00,1,1050125,,1050126,,章程變更：原章程第16條條文內容修訂。,,,,
105法登他000048,1,2,李秋瓊,280,1050127,1050127,1050127,10冊9頁,1,9,蘇耀文,財團法人靜宜大學,0671012,臺中市沙鹿區臺灣大道七段200號,為發揮天主教教育理念之目的，設立財團法人靜宜大學。,天主教美國主顧修女會捐助,"教育部         中華民國４６年４月１日","永   久",5215257466.00,1,1050127,,1050128,,章程變更：原捐助章程第2、4條條文內容修訂。,,,,
105法登他000049,2,2,李秋瓊,2165,1050127,1050127,1050127,43冊25頁,1,8,王明乾,社團法人臺中市大里長青槌球協會,1020311,臺中市大里區東湖里長春路39巷9弄3號,以增進中老年人身心健康，愉悅心情及訓練體能為宗旨。,會費收入,臺中市政府社會局100年5月15日,永久,235355.00,1,1050127,,1050128,,,,,,
105法登他000050,2,2,李秋瓊,2190,1050127,1050127,1050127,43冊50頁,2,2,江竹翔,社團法人中華國際創新育成志工協會,1020522,臺中市西屯區科園路21號,建構跨產業、跨國性之創新育成志工服務學習環境，形成國際創新育成志工服務平台，培育國際人才，以協助產、官、學研界在創新育成領域達到世界一流水準，促進全球經濟體系發展。,會員會費等,內政部中華民國102年2月19日台內社字第1010389134號函,永久,22500.00,1,1050127,,1050128,,,,,,
105法登他000051,1,2,李秋瓊,236,1050127,1050127,1050127,9冊13頁,1,10,張淑娥,財團法人臺中市私立慈明高級中學,0630603,臺中市太平區光隆里11鄰光德路388號,為遵照國家教育政策暨現行教育法令之規定，辦理高中及附設職業類科、國中部、托兒所，並謀其健全發展之目的，設立財團法人臺中市私立慈明高級中學。,由陳林明捐助,"臺灣省政府教育廳             中華民國６１年７月２６日","永 久",1408477678.00,1,1050127,,1050128,,,,,,
