登記案號,類別,案由,主任,登記號數,收件日期,登記日期,公告日期,登記簿,任期判定,屆期判定,法人代表,法人名稱,設立登記日期,主事務所,目的,捐助方法,許可機關日期,存立時期,財產總額,結案原因,結案日期,歸檔日期,發證日期,清算人,變更原因,註銷日期,撤銷日期,撤(註)銷機關文號,撤(註)銷原因
105法登他000307,1,2,李秋瓊,804,1050705,1050705,1050705,20冊42頁,2,7,王恩泉,財團法人英才文教基金會,0870826,臺中市西屯區府會園道179號4樓,舉辦教育文化公益性事業為宗旨。,由王恩泉先生捐助,"教育部                中華民國８７年８月１２日","永   久",30000000.00,1,1050705,,1050706,,。,,,,
105法登他000308,1,2,李秋瓊,840,1050705,1050705,1050705,21冊18頁,2,6,羅文貴,財團法人臺中市私立華盛頓國民小學,0880403,臺中市潭子區潭興路一段165巷300號,為遵照國家教育政策暨現行教育法令之規定辦理國民小學，並謀其健全發展之目的，設立財團法人臺中市私立華盛頓國民小學。,由李園會及龍澤營造有限公司共同捐助,"臺中縣政府            中華民國８７年７月８日","永   久",384098972.00,1,1050705,,1050706,,,,,,
105法登他000309,2,2,李秋瓊,1027,1050705,1050705,1050705,24冊25頁,1,29,吳梓生,社團法人臺中律師公會,0910118,臺中市西區自由路一段９１號,關於平民法律扶助之實施、法令修改或司法事務之建議、法律教育之提倡、法學研究及刊物出版、會員品德之砥礪與風紀之整飭、會員共同利益之維護增進、會員素養提昇、行政及司法機關委辦或諮詢、人民權益及自由保障、本會章程所規定之其他事項等。,會員會費等,"臺中市政府           中華民國８７年５月２５日","永  久",1374749.00,1,1050705,,1050706,,,,,,
105法登他000310,2,2,李秋瓊,1670,1050706,1050706,1050706,35冊10頁,1,,謝淑惠,社團法人台中市生活美學協會,0971003,臺中市西屯區西屯路三段181號,以倡導終身學習並結合各社區民眾，推展文化、教育及創意美學之普及，並協助政府相關政策宣導，落實推廣社會發展文化美學為宗旨。,會員會費等,臺中市政府中華民國９７年８月７日府社行字第0970184796號,永久,87000.00,1,1050706,,1050707,,,,,,
105法登他000311,1,2,李秋瓊,303,1050706,1050706,1050706,10冊32頁,1,7,曾冉勤,財團法人台灣省台中市中華基督教貿易九村浸信會,0700224,臺中市北屯區新平里經貿路258號,以傳揚基督教義、領人歸主、牧養和充實信徒心靈生活，社區服務並國內外救助，分享上帝的愛為宗旨。,由會友捐助,"臺中市政府   　　　 中華民國６８年６月７日","永  久",8303400.00,1,1050706,,1050707,,章程變更：原捐助章程修訂（詳如對照表），經本院民事庭105年法字第14號裁定准予變更。,,,,
105法登他000312,1,2,李秋瓊,524,1050706,1050706,1050706,15冊7頁,2,9,賴慧珊,財團法人台中市慈善寺文教基金會,0820226,臺中市北屯區天津路四段１９８號,以發揚中華倫理文化及興辦教育公益業務為宗旨。,"由周  稚等捐助","臺中市政府          中華民國８２年２月３日","永  久",10130000.00,1,1050706,,1050707,,,,,,
105法登他000313,2,2,李秋瓊,1265,1050706,1050706,1050706,28冊23頁,2,13,黃孔明,社團法人臺中市太極拳協會,0930726,臺中市南區仁和路214巷24弄3號,以推行太極拳等武術活動為主，並配合全民體育運動，以增進國民身心健康及宏揚中華固有武德武藝為宗旨。,會員會費等,"臺中市政府                中華民國八十三年十二月九日","永    久",780827.00,1,1050706,,1050707,,,,,,
105法登他000314,2,2,李秋瓊,2366,1050707,1050707,1050707,46冊44頁,2,2,姚繼儒,社團法人臺中市雲濟慈善會,1030716,臺中市北區太原路二段214號1樓,以宣揚五倫八德、慈悲喜捨之精神，濟弱扶傾行善助人，促進社會和諧為宗旨。,會員會費等,臺中市政府社會局中華民國103年6月19日中市社團字第1030060550號函,永久,184015.00,1,1050707,,1050708,,,,,,
105法登他000315,1,2,李秋瓊,1123,1050707,1050707,1050707,26冊1頁,2,15,陳智仁,財團法人天主教瑪利諾會,0920310,臺中市西區公館路６８號,協助中國當地主教傳教暨舉辦社會福利事業。,捐助,"臺北市政府民政局       中華民國５８年１１月６日","永   久",379003774.00,1,1050707,,1050708,,,,,,
105法登他000316,1,2,李秋瓊,1411,1050707,1050707,1050707,30冊51頁,2,3,金康德,財團法人台灣省台中縣基督教聖光教會,0950410,臺中市潭子區勝利十三街35號,本法人宗旨在施行耶穌基督所託付之大使命，以傳揚福音，差派宣教士，領人歸主遵行聖經教訓，實踐新約中教會精神，服務社會、辦理教育、公益慈善等事業。,由莊麗雪、劉涵引二人共同捐助,"臺中縣政府            中華民國95年3月15日","永  久",2640276.00,1,1050707,,1050708,,,,,,
105法登他000317,2,2,李秋瓊,699,1050707,1050707,1050707,18冊33頁,2,21,黃仁杰,社團法人台中市省都扶輪社,0851012,臺中市西區大隆路20號5樓之1,以服務精神為可貴事業之基礎，尤其著重於鼓勵與培養：一、藉增廣交遊為擴展服務之機會，二、倡導高尚之道德標準。三、以服務精神應用於個人生活、務及社會方面之活動。四、透過世界性的友誼，增加國際間之瞭解、友善與和平。,會員會費等,"臺中市政府　　 中華民國８５年３月５日",永　久,400500.00,1,1050707,,1050708,,,,,,
105法登他000318,1,2,李秋瓊,922,1050707,1050707,1050707,22冊40頁,2,4,陳傑儒,福安醫療財團法人,0890408,臺中市西屯區安林段140、141、142、159、160、161、162等地號,為從事醫療事業辦理醫療機構及從事以健康促進為主的醫療事業之目的，設立福安醫療財團法人。,由陳傑儒等人捐助,"行政院衛生署  　　中華民國８９年２月１日","永   久",106000000.00,1,1050707,,1050712,,,,,,
105法登他000319,2,2,李秋瓊,1151,1050711,1050711,1050711,26冊29頁,2,19,曾澎英,社團法人國際蘭馨交流協會中華民國總會,0920616,臺中市西屯區臺灣大道二段715號8樓之2,一、聯合全世界職業婦女聯盟，提昇婦女在法律、政治、經濟及職業上之地位。二、與政府間及其他組織合作，以促進並奬勵世界各國設立蘭馨會，進而督導。三、將蘭馨會之奉獻與價值，推廣至每一會員以及社會。四、發揚蘭馨服務精神、團結各界婦女領袖，共同謀求國際間之了解與友誼，以促進世界和平。,會員會費等,"內政部       中華民國九十一年五月十五日","永   久",1001763.00,1,1050711,,1050712,,,,,,
105法登他000320,2,2,李秋瓊,2114,1050711,1050711,1050711,42冊34頁,1,2,王聖惠,社團法人中華公民人權協會,1010921,臺中市北屯區景賢路165號16樓,為發揚聯合國『世界人權宣言』之精神，關懷及落實民眾基本人權：促進與支持各項研究，以發掘精神與心理治療之影響：出版心理健康方面之人權與相關議題之資訊，並結合社會各界人士與團體共同合作關懷此議題。,會員會費等,內政部中華民國101年6月4日台內社字第1010194800號函,永久,88000.00,1,1050711,,1050712,,主事務所遷移至臺中市北屯區景賢路165號16樓,,,,
105法登他000321,2,2,李秋瓊,1804,1050711,1050711,1050711,37冊24頁,2,3,蔡秀綢,社團法人中華民國優質家庭教育發展促進會,0990308,臺中市大雅區學府路25號,以促進家庭教育優質化為宗旨。,會員會費等,內政部中華民國９７年６月１５日台內社字第0970101927號函,"永  久",5000.00,1,1050711,,1050712,,章程變更：原章程第五條條文內容修訂。,,,,
105法登他000322,1,2,李秋瓊,283,1050711,1050711,1050711,10冊12頁,2,11,林秋雄,財團法人玉敕封神台谷關大道院,0671104,臺中市和平區博愛里東關路一段４５０號,宏揚宗教教義、興辦社會福利公益慈善事業。,信徒捐助,"臺中縣政府            中華民國６７年９月１２日","永  久",45320000.00,1,1050711,,1050713,,,,,,
105法登他000323,2,2,李秋瓊,2637,1050712,1050712,1050712,51冊15頁,2,12,吳俊忠,社團法人中華民國醫事檢驗師公會全國聯合會,1030724,臺中市西區忠明南路303號6樓之1,以聯合全國醫事檢驗師，發展醫事業務及技能，協助推行社會服務，維護會員權益，增進會員權益，增進共同利益為宗旨。,入會費、常年會費、事業費、會員捐助費、政府補助、其他收入、基金及孳息,內政部中華民國103年6月23日台內團字第1030194266號函,永久,4000000.00,1,1050712,,1050713,,,,,,
105法登他000324,1,2,李秋瓊,763,1050712,1050712,1050712,20冊1頁,2,5,謝映雪,財團法人天主教聖心基金會,0861120,臺中市光復路１３６號４樓,以傳揚天主教義，發揮愛心，宏揚中華文化，推動社會教育，辦理社會慈善救濟為宗旨。,由財團法人天主教耶穌聖心修女會捐助。,"臺灣省政府民政廳                中華民國８６年１１月１１日","永  久",20000000.00,1,1050712,,1050713,,,,,,
105法登他000325,2,2,李秋瓊,754,1050712,1050712,1050712,19冊40頁,2,20,潘尚文,社團法人台中市松竹扶輪社,0861006,臺中市西區五權路２之３號８樓８０９室,為鼓勵並培養以服務理想、增廣相識、擴展服務社會。,社員捐款(入社費、年費、及自由樂捐),"臺中市政府   　中華民國８６年５月１４日","永  久",500000.00,1,1050712,,1050713,,,,,,
105法登他000326,2,2,李秋瓊,1409,1050712,1050712,1050712,30冊48頁,2,11,蘇維祺,社團法人台中市中科扶輪社,0950330,臺中市西區金山路18之3號1樓,以鼓勵並培養以服務之理想為可貴事業之基礎為宗旨。,會員會費等,"臺中市政府              中華民國95年3月20日","永   久",1000000.00,1,1050712,,1050713,,,,,,
105法登他000327,2,2,李秋瓊,1221,1050712,1050712,1050712,27冊39頁,2,24,張博森,社團法人台中市西屯扶輪社,0930318,臺中市西屯區臺灣大道二段666號Ｂ1,以鼓勵並培養以服務之理想為可貴事業之基礎為宗旨。,會員會費等,"臺中市政府           中華民國９１年８月８日","永   久",500000.00,1,1050712,,1050713,,,,,,
105法登他000328,1,2,李秋瓊,1191,1050712,1050712,1050712,27冊9頁,1,4,陳裕濱,財團法人裕珍馨文化基金會,0921218,臺中市大甲區光明路67之1號,以推動臺中縣地方文化，營造良好地方文化藝術環境，培養藝文人口為宗旨,由裕珍馨食品股份有限公司等捐助,臺中縣政府文化局　　　中華民國９２年１２月１１日,永　久,6000000.00,1,1050712,,1050714,,,,,,
105法登他000329,1,2,李秋瓊,962,1050714,1050714,1050714,23冊20頁,2,2,陳豐玲,財團法人大度山社會福利慈善事業基金會,0900119,臺中市大雅區東大路二段811號,以舉辦社會福利慈善事業為宗旨。,由高山企業股份有限公司捐助,"臺中縣政府      中華民國九十年一月八日","永  久",10000000.00,1,1050714,,1050715,,章程變更：原捐助章程第4、6條條文內容修訂，其中第6條經本院民事庭105年度法字第31號裁定准予變更。,,,,
105法登他000330,2,2,李秋瓊,1731,1050714,1050714,1050714,36冊11頁,2,20,林桂熙,社團法人台中市東友扶輪社,0980610,臺中市西區五權路２之３號８樓８０６室,以鼓勵並培養以服務之理想為可貴事業之基礎為宗旨。,會員會費等,臺中市政府　　中華民國９８年４月１６日,"永  久",450142.00,1,1050714,,1050715,,,,,,
105法登他000331,2,2,李秋瓊,808,1050714,1050714,1050714,20冊46頁,2,19,呂肇傑,社團法人台中市東海扶輪社,0870905,臺中市西區五權路２之３號８樓８０１室,為鼓勵並培養以服務理想、增廣相識、擴展服務社會。,社員入會費等,"臺中市政府          中華民國８７年３月１１日","永   久",500000.00,1,1050714,,1050718,,,,,,
105法登他000332,2,2,李秋瓊,1197,1050715,1050715,1050715,27冊15頁,2,19,賴朝宏,社團法人台中市中州扶輪社,0921229,臺中市中區公園路３０之１號,以鼓勵並培養以服務之理想為可貴事業之基礎為宗旨。,社員會費等,臺中市政府　　　中華民國８７年４月３日,"永 久",452440.00,1,1050715,,1050718,,,,,,
105法登他000333,2,2,李秋瓊,2195,1050715,1050715,1050715,43冊54頁,2,8,吳宇生,社團法人台中市惠來扶輪社,1020529,臺中市西區民生路197號12樓之5,鼓勵與培養以服務社會之理想為宗旨。,會員會費等,臺中市政府社會局中華民國99年1月22日府社行字第0990017493號,永久,3168503.00,1,1050715,,1050718,,,,,,
105法登他000334,2,2,李秋瓊,1254,1050715,1050715,1050715,28冊11頁,2,7,邱茂林,社團法人臺中市靈聖慈善會,0930707,臺中市北區原子街１２號,以「助人為快樂之本」發揮個人愛心，結合團體力量以援助社會上需要幫助的人為宗旨。,會員會費等,臺中市政府　　　　中華民國９３年６月２８日,"永 久",136743.00,1,1050715,,1050718,,,,,,
105法登他000335,2,2,李秋瓊,1537,1050715,1050715,1050715,32冊57頁,2,10,何淑鈴,社團法人台中市文心扶輪社,0960611,臺中市西區自治街１５５號９樓之４,鼓勵並培養以服務為理想可貴事業之基礎為宗旨。,會員會費等,"臺中市政府        中華民國９６年５月１８日","永   久",1000.00,1,1050715,,1050719,,,,,,
105法登他000336,2,2,李秋瓊,2452,1050718,1050718,1050718,48冊10頁,1,2,蔡文貴,社團法人臺中市群英扶輪社,1040320,臺中市西區臺灣大道二段181號11樓之22,以辦理社會服務及慈善活動為宗旨。,會員會費等,臺中市社會局中華民國104年3月4日中市社團字第1040023323號函,永久,1000.00,1,1050718,,1050719,,,,,,
105法登他000337,2,2,李秋瓊,648,1050718,1050718,1050718,17冊32頁,2,62,古亭河,社團法人台中市台中扶輪社,0840925,臺中市民權路１０２號８０４室,"鼓勵並養成以服務精神為可貴事業之基礎，尤其著重於鼓勵與培養:藉增交遊 擴展服務之機會。倡導高尚之道德標準。社員以服務精神應用於各方面之活動。透過各業人士而聯結一致之世界性友誼，以增進國際間之了解友善與和平。",會員會費等。,臺中市政府　　　　中華民國８４年８月１５日,永　　久,668674.00,1,1050718,,1050719,,,,,,
105法登他000338,2,2,李秋瓊,1181,1050719,1050719,1050719,26冊59頁,2,45,洪士超,社團法人臺中市西北扶輪社,0921126,臺中市西區金山路18之3號1樓,以鼓勵並培養以服務之理想為可貴事業之基礎為宗旨。,會員會費等,"臺中市政府       中華民國90年8月1日","永   久",2696983.00,1,1050719,,1050720,,,,,,
105法登他000339,1,2,李秋瓊,1019,1050720,1050720,1050720,24冊17頁,2,5,詹雅莉,財團法人基督教精誠教會,0901217,臺中市西區忠明南路３０３號８樓之５,本法人係由信奉基督為救世主，願本聖經教導建立地方教會之基督徒所組成。並以管理運用所有一切財產，使會眾之靈命增長，並積極傳揚福音為宗旨。　,由黃宗儀、陳復鈞、朱世珍、王愛玲、陳淑利等共同捐助,"臺中市政府              中華民國９０年１２月１３日","永  久",926548.00,1,1050720,,1050721,,,,,,
105法登他000340,1,2,李秋瓊,245,1050720,1050720,1050720,9冊22頁,2,8,"李  沂",財團法人基督教臺中國語禮拜堂,0631121,臺中市北區太平路７１號,本於耶穌博愛之精神，以傳揚基督教義，辦理社會各項公益活動、促進社會祥和為宗旨。,由加拿大神召會及本堂會友等捐獻,"臺中市政府           中華民國６３年１０月１８日","永  久",32935034.00,1,1050720,,1050721,,,,,,
105法登他000341,2,2,李秋瓊,2642,1050721,1050721,1050721,51冊20頁,2,5,蔡浲銘,社團法人中華民國通天門氣功養生協會,0970808,臺中市霧峰區中正路1231號,秉持真心、信心、恆心三大心之理念，推廣氣功科學，激發人體潛能，鍛鍊身心靈健康，促進全民運動為宗旨。,入會費、常年會費、事業費、會員捐款、委託收益、基金及其孳息、其他收入,內政部中華民國95年12月8日台內社字第0950190397號函,永久,220879.00,1,1050721,,1050722,,,,,,
105法登他000342,2,2,李秋瓊,1183,1050721,1050721,1050721,27冊1頁,2,40,何文隆,社團法人台中市西南扶輪社,0921128,臺中市西區金山路18之3號1樓,以鼓勵並培養以服務之理想為可貴事業之基礎為宗旨。,社員會費等,"臺中市政府       中華民國九十年七月三日",永　　久,1734896.00,1,1050721,,1050725,,,,,,
105法登他000343,2,2,李秋瓊,1178,1050721,1050721,1050721,26冊56頁,2,24,陳家全,社團法人台中市南屯扶輪社,0921113,臺中市西區金山路18之3號一樓,以鼓勵並培養以服務之理想為可貴事業之基礎為宗旨。,社員會費等,"臺中市政府       中華民國82年12月31日","永   久",2862897.00,1,1050721,,1050725,,,,,,
105法登他000344,2,2,李秋瓊,1302,1050722,1050722,1050722,29冊1頁,2,34,曾建成,社團法人台中市東區扶輪社,0931130,臺中市西區五權路２之３號８樓８０４室,以鼓勵並培養以服務之理想為可貴事業之基礎為宗旨。,會員會費等,臺中市政府　　中華民國９３年１月２８日,"永 久",800000.00,1,1050722,,1050725,,,,,,
105法登他000345,1,2,李秋瓊,2361,1050722,1050722,1050722,46冊39頁,1,2,吳燦禪,財團法人基督教慕溪基金會,1010618,臺中市西屯區福和里福安二街3巷27號2樓,本法人本於基督教之精神，以傳揚本教教義，增進社會福祉，推動公益慈善事業為宗旨。,由林瀚明捐助,內政部中華民國101年6月13日台內民字第1010201142號函,永久,160000000.00,1,1050722,,,,章程變更：原章程第5條條文內容修訂。,,,,
105法登他000346,2,2,李秋瓊,1190,1050722,1050722,1050722,27冊8頁,2,6,陳中岳,社團法人台中市肢體傷殘關懷協會,0921212,臺中市北屯區軍功路一段373號,以促進、推展肢體傷殘者之各項福利及維護其基本人權為的目的．,會員會費等,臺中市政府　　中華民國９２年１１月２６日,"永 久",20000.00,1,1050722,,1050726,,章程變更：原章程第21條條文內容修訂。,,,,
105法登他000347,1,2,李秋瓊,1195,1050722,1050722,1050722,27冊13頁,2,5,陳國英,財團法人台灣省台中市善修宮,0921223,臺中市北區大誠街１３１巷２號,以奉祀關聖帝君為主神，以弘揚教義、導正人心，淨化社會及舉辦公益慈善事業與文化建設，以增進社會福祉為精神，並以傳揚道教教義為宗旨。,由臺中善修宮捐助,臺中市政府　　　　中華民國９２年１２月１１日,永　久,4226451.00,1,1050722,,1050726,,,,,,
105法登他000348,2,2,李秋瓊,1163,1050725,1050725,1050725,26冊41頁,1,13,林村基,社團法人中華民國汽車工程學會,0780913,臺中市豐原區豐原大道四段305號5樓,以加強汽車科技之交流與服務，及促進國內汽車界之整合，提升汽車學術技術水準為宗旨。,會員會費等,"內政部               中華民國７８年６月２２日","永   久",180000.00,1,1050725,,1050727,,,,,,
105法登他000349,2,2,李秋瓊,788,1050725,1050725,1050725,20冊26頁,2,28,陳錫忠,社團法人臺中市中興扶輪社,0870518,臺中市北區忠太西路59號3樓之1,以鼓勵並培養以服務之理想為可貴事業之基礎為宗旨。,會員會費等,"臺中市政府  中華民國八十七年二月二十六日","永   久",397595.00,1,1050725,,1050727,,,,,,
105法登他000350,1,2,李秋瓊,221,1050726,1050726,1050726,8冊14頁,2,15,蔡寶倫,財團法人臺中市私立嶺東高級中學,0620621,臺中市南屯區嶺東路２號,為遵照國家教育政策暨現行教育法令之規定，辦理財團法人臺中市私立嶺東高級中學，並謀其健全發展之目的，設立財團法人臺中市私立嶺東高級中學。,"由蔡亞萍先生、黎  明女士捐贈","臺灣省政府教育廳       中華民國６０年７月１日","永  久",767744147.00,1,1050726,,1050727,,,,,,
105法登他000351,2,2,李秋瓊,2174,1050727,1050727,1050727,43冊34頁,2,2,翁喆裕,社團法人台灣基地協會,1020403,臺中市西屯區河南路二段470號5樓之1,致力於多元性/別、性傾向、健康及平權工作，營造同志健康暨在地文化，健全個體全人發展、社群間互助合作之性別友善社會。,會員會費等,內政部中華民國102年3月13日台內社字第1020110944號函,永久,1000.00,1,1050727,,1050728,,章程變更：原章程第2、5條條文內容修訂。,,,,
105法登他000352,1,2,李秋瓊,629,1050727,1050727,1050727,17冊12頁,2,8,王乃弘,財團法人弘道老人福利基金會,0840324,臺中市西區民權路２３４號３樓,本會以辦理社會福利慈善事業為目的。,由王乃偉等人共同捐助,"臺中市政府          中華民國８４年３月１３日","永   久",41863711.00,1,1050727,,1050728,,,,,,
105法登他000353,1,2,李秋瓊,478,1050727,1050727,1050727,14冊10頁,2,5,江黃靜花,財團法人台灣省私立江陳樹文教基金會,0810110,臺中市民生路９巷２４號,弘揚中華文化，提倡國民道德，改善社會風氣，積極推行社會文教事業。,由江黃靜花捐助,"臺灣省政府教育廳          中華民國８０年１１月２５日","永   久",5000000.00,1,1050727,,1050728,,,,,,
105法登他000354,1,2,李秋瓊,1778,1050727,1050727,1050727,36冊58頁,2,3,廖豊民,財團法人台中市棒球教育基金會,0981120,臺中市北屯區崇德路三段835號,以推廣棒球運動教育及培訓為宗旨。,由臺中市政府等共同捐助。,臺中市政府中華民國９８年１１月９日府教社字第0980289918號函,"永  久",5000000.00,1,1050727,,1050728,,章程變更：原捐助章程第4、18條條文內容修訂。,,,,
105法登他000355,1,2,李秋瓊,1858,1050728,1050728,1050728,38冊18頁,2,3,朱傳裕,財團法人台中市朱錦惠祭祀公業,0990820,臺中市石岡區豐勢路寺前巷５６之１號,本法人本於仁愛之精神，以宣揚先祖教義及德行，發揮宗親互助互愛之精神，及興辦社會公益慈善事業為宗旨。,由朱傳裕等人共同捐助,臺中縣政府中華民國９９年７月２６日府民宗字第0990228991號函,"永 久",5100000.00,1,1050728,,1050729,,,,,,
105法登他000356,1,2,李秋瓊,851,1050729,1050729,1050729,21冊29頁,2,3,廖福澤,財團法人大都會教育基金會,0880622,臺中市南屯區大聖街338號1樓,本會以推展國內文化、教育等與社區總體營造相關之業務為宗旨,由上采房屋仲介實業股份有限公司捐助,"臺中市政府  中華民國八十八年六月八日","永    久",2000000.00,1,1050729,,1050801,,,,,,
105法登他000357,1,2,李秋瓊,1496,1050729,1050729,1050729,32冊16頁,2,4,王建銘,財團法人新高經貿發展基金會,0951227,臺中市清水區西寧路32之2號,以協助進出口商拓展市場及促進經貿發展為宗旨。,由臺中縣進出口商業同業公會捐助,"經濟部               中華民國９５年１２月１８日","永  久",36102642.00,1,1050729,,1050801,,,,,,
105法登他000358,1,2,李秋瓊,322,1050729,1050729,1050729,11冊1頁,2,9,周惠貞,財團法人台中市私立台中中學紀念基金會,0720318,臺中市中區自由路二段１２號９樓,一、資助或獎勵高中(職)以上學校清寒優秀學生就學。二、舉辦慈善公益事業促進社會福利。三、辦理有關社會福利事業。四、辦理其他有關事業。,臺中市立中學同學會捐助,臺中市政府　中華民國７２年２月１１日　,永　久,10650240.00,1,1050729,,,,,,,,
105法登他000359,1,2,李秋瓊,333,1050801,1050801,1050801,11冊12頁,1,7,蔡錦隆,財團法人台中縣文化基金會,0740207,臺中市豐原區東仁街138號,一、協助政府推動文化復興運動及國際性文化活動。二、推動本縣文化活動。三、其他文化活動有關事項。,捐助,"臺中縣政府　　　 中華民國７２年１０月２０日","永 久",14140280.00,1,1050801,,1050802,,,,,,
105法登他000360,1,2,李秋瓊,779,1050801,1050801,1050801,20冊17頁,2,5,陳明造,財團法人民生科技文教基金會,0870408,臺中市國光路２５０號農環大樓１０樓Ａ２室,促進食衣住行之民生發展；協助教學研究及推展與文化教育有關活動；提供民生相關資訊服務與協助；改善民生為宗旨。,自由捐助,"臺中市政府  　　 中華民國８７年３月２６日","永    久",2000000.00,1,1050801,,1050802,,,,,,
105法登他000361,1,2,李秋瓊,1287,1050801,1050801,1050801,28冊46頁,2,20,賴曉芬,財團法人主婦聯盟環境保護基金會,0780327,臺北市中正區汀州路三段１６０巷４號５樓之１,結合女性力量，關懷社會，以提昇生活品質，確保生存環境可持續性。,由世祺股份有限公司等２２人共同捐助,行政院環境保護署　　　中華民國７８年３月３日,"永  久",1000000.00,1,1050801,,1050803,,章程變更：原捐助章程第1條至第16條、第18條條文修訂，經臺灣臺北地方法院104年度法字第196號民事裁定准予變更。,,,,
