登記案號,類別,案由,主任,登記號數,收件日期,登記日期,公告日期,登記簿,任期判定,屆期判定,法人代表,法人名稱,設立登記日期,主事務所,目的,捐助方法,許可機關日期,存立時期,財產總額,結案原因,結案日期,歸檔日期,發證日期,清算人,變更原因,註銷日期,撤銷日期,撤(註)銷機關文號,撤(註)銷原因
105法登他000516,2,2,李秋瓊,2556,1051128,1051128,1051128,49冊54頁,1,,顧哲銘,社團法人台灣人智學健康照護平台整合協會,1041126,臺中市大里區塗城路542巷7弄2號1樓,以人智學的精神建構人智學各類健康照護專業人士彼此交流互動的整合性平台，竭力推廣人類身、心、靈的健康照護。,會員會費等,內政部中華民國104年7月15日台內團字第1040052024號函,永久,420438.00,1,1051128,,1051129,,章程變更：原章程第30條條文內容修訂。,,,,
105法登他000517,1,2,李秋瓊,1876,1051129,1051129,1051129,38冊36頁,2,3,張筠薇,財團法人張萬露文化藝術基金會,0991013,臺中市南屯區五權西路三段１２３號,本會以提高國民生活品質、提升文化藝術水準為宗旨。,由張筠薇等六人共同捐助,臺中市政府文化局中華民國９９年１０月４日中市文藝字第0990011555號函,"永 久",21225572.00,1,1051129,,1051130,,,,,,
105法登他000518,1,2,李秋瓊,1548,1051130,1051130,1051130,33冊8頁,2,4,劉進源,財團法人基督教福音宣揚會,0960802,臺中市北屯區昌平路二段１８之１８號,係本著耶穌基督之精神，以傳揚福音、服務社會、建立教會、辦理文化教育及相關公益慈善等事業為宗旨。,由財團法人國際差傳協會捐助,"臺中市政府             中華民國９６年７月２４日","永   久",10617840.00,1,1051130,,1051201,,,,,,
105法登他000519,1,2,李秋瓊,932,1051205,1051205,1051205,22冊50頁,2,6,林英琪,財團法人臺中市德光文教基金會,0890602,臺中市北屯區太和六街89號,以推展文化及教育，淨化心靈，重整社會秩序為宗旨。,由蕭鴻川、林英琪、陳榮泉等人捐助,"臺中縣政府      中華民國89年5月15日","永  久",5000000.00,1,1051205,,1051206,,,,,,
105法登他000520,1,2,李秋瓊,1275,1051205,1051205,1051205,28冊33頁,2,5,李芳裕,財團法人永信李天德醫藥基金會,0930823,臺中市大甲區中山路一段１１９１號,以促進生技醫藥相關學門之教育與研究發展為宗旨。,由李天德等十人共同捐助,"行政院衛生署              中華民國９３年８月５日","永   久",416802423.00,1,1051205,,1051207,,,,,,
105法登他000521,1,2,李秋瓊,986,1051206,1051206,1051206,23冊44頁,2,8,周溪煌,財團法人台中二中文教基金會,0900605,臺中市北區英士路１０９號,以辦理臺中二中文化教育活動為宗旨。　,由施勝得等人捐助,"臺灣省政府　        中華民國９０年５月１１日　","永  久",5253000.00,1,1051206,,1051207,,,,,,
105法登他000522,1,2,李秋瓊,434,1051207,1051207,1051207,13冊15頁,2,9,卓京紅,財團法人中華基督教臺中建德浸信會,0790512,臺中市東區建德街二００號,本基督之精神，傳揚基督耶穌教義及辦理社會公益慈善事業。,由南美浸信會臺灣事務所捐助,"臺中市政府      中華民國七十六年十月三十日",永　久,1633834.00,1,1051207,,1051208,,法人圖記變更登記。,,,,
105法登他000523,1,2,李秋瓊,542,1051207,1051207,1051207,15冊25頁,2,13,陸光智,財團法人東青文教基金會,0820726,臺中市東區泉源里樂業路134號,以發揚中華文化、推行倫理道德、實施倫理教育公益事業為宗旨。,由臺中市東區後備軍人輔導中心捐助,"臺中市政府　  中華民國８２年７月２３日","永 久",4200000.00,1,1051207,,1051208,,,,,,
105法登他000524,1,2,李秋瓊,1232,1051208,1051208,1051208,27冊50頁,2,10,謝文昌,財團法人基督教惠明盲人福利會,0570120,臺中市大雅區雅潭路四段336號,以舉辦盲人福利及救濟事業為目的。,由德國惠明總會補助、地方捐助與贈送,"內政部           中華民國５５年１１月３日","永   久",480261530.00,1,1051208,,1051209,,,,,,
105法登他000525,1,2,李秋瓊,510,1051208,1051208,1051208,14冊42頁,1,9,"廖  仁",仁愛醫療財團法人,0810918,臺中市大里區東榮路483號,為從事醫療事業辦理醫療機構及本於『取諸於社會，用諸於社會』之精神，從事醫療事業，促進社會公益福利為宗旨。,由廖泉生等捐助,"行政院衛生署             中華民國８１年９月１８日","永  久",2719086174.00,1,1051208,,1051209,,,,,,
105法登他000526,1,2,李秋瓊,267,1051208,1051208,1051208,9冊44頁,1,10,林宏昭,財團法人臺中市玉闕朝仁宮,0650930,臺中市烏日區新興路318號,宣揚元帥忠貞，聖母懿德，倡行遵聖孝道，闡揚聖德，興辦社會公益，慈善救濟，推行倫理道德，復興中華文化教育等服務人群為宗旨。,由信徒捐助,臺中縣政府　　中華民國６５年９月１５日,"永  久",161670572.00,1,1051208,,1051209,,,,,,
105法登他000527,1,2,李秋瓊,213,1051208,1051208,1051208,8冊6頁,2,14,張裕昌,財團法人中華基督教臺中浸信會,0610414,臺中市西區自由路一段９９號,本耶穌基督精神在台灣及海外地區內傳揚聖經教訓，服務社會，辦理教育、慈善及慈惠捐助等事業。,由美南浸信會捐助,"臺灣省政府民政廳           中華民國６１年４月１４日","永  久",76546022.00,1,1051208,,1051209,,,,,,
105法登他000528,2,2,李秋瓊,1682,1051208,1051208,1051208,35冊22頁,2,4,徐淑麗,社團法人臺灣圓愛全人關懷協會,0971106,臺中市北區民權路３５９巷７號,本會宗旨以聯絡各界資源，不分年齡，對社會主動以全人關懷模式，助人活出豐盛生命，使個人成長、家庭有愛、社區活絡、社會和諧。,會員會費等,內政部中華民國９７年９月５日台內社字第0970135723號函,永久,1000.00,1,1051208,,1051212,,章程變更：原章程第17條條文內容修訂。,,,,
105法登他000529,1,2,李秋瓊,383,1051209,1051209,1051209,12冊14頁,1,10,廖本煥,財團法人廖學鏞先生文教基金會,0761127,臺中市南屯區大墩四街４３３號,以推動各項文教活動，促進學術研究及獎勵各級學校學生敦品勵學為宗旨。,由廖本煥等捐助,"臺灣省政府教育廳           中華民國７６年１０月２２日","永   久",5000000.00,1,1051209,,1051212,,章程變更：原捐助章程第8、10條條文內容修訂；經本院民事庭105年度法字第59號裁定准予變更。,,,,
105法登他000530,2,2,李秋瓊,2250,1051209,1051209,1051209,44冊49頁,1,,解其橋,社團法人臺中市喜樂福關懷協會,1020930,臺中市南區福中街23號,以神愛世人的精神關懷社區，增進個人幸福、建立愛的家庭、營造活力的社區、促成健康的社會為宗旨。,會員會費等,臺中市政府社會局中華民國102年9月4日中市社團字第1020074490號函,永久,1000.00,1,1051209,,1051212,,,,,,
105法登他000531,1,2,李秋瓊,136,1051209,1051209,1051209,5冊20頁,1,17,林亦沂,宜寧學校財團法人,0510108,臺中市西屯區東大路一段555號,為遵照國家教育政策暨現行教育法令之規定，辦理高級中學，並謀其健全發展。設立宜寧學校財團法人。,由蔣緯國等捐助,"臺灣省政府教育廳               中華民國４０年１１月７日","永  久",271552977.00,1,1051209,,1051213,陳信紅(學校),章程變更：原捐助章程第2、4條條文內容修訂。,,,,
105法登他000532,1,2,李秋瓊,358,1051212,1051212,1051212,11冊37頁,2,9,王胡紹茶,財團法人台中市私立無極證道院社會福利慈善事業基金會,0751212,臺中市北屯區民政里橫坑巷４６之２號,以舉辦社會福利慈善事業為宗旨。,由王翼漢捐助,"臺中市政府  　    中華民國７５年１１月２１日","永  久",5000000.00,1,1051212,,1051214,,,,,,
105法登他000533,1,2,李秋瓊,156,1051212,1051212,1051212,6冊10頁,1,16,林倉民,修平學校財團法人,0550511,"臺中市大里區工業路 １１號",為遵照國家教育政策暨現行法令之規定，辦理修平學校財團法人修平科技大學並謀其健全發展，設立修平學校財團法人。,由林湯盤等捐助,"教育部          中華民國５５年２月２２日","永  久",2599394045.00,1,1051212,,1051213,,,,,,
105法登他000534,1,2,李秋瓊,1482,1051212,1051212,1051212,32冊2頁,1,4,吳子鈞,財團法人台中市私立宏恩社會福利慈善基金會,0951206,臺中市南區南平路33號5樓,以辦理社會福利為目的。,由林豐麗女士捐助,"臺中市政府           中華民國９５年１２月１日","永   久",41658277.00,1,1051212,,1051213,,,,,,
105法登他000535,2,2,李秋瓊,2572,1051212,1051212,1051212,50冊10頁,1,1,許家畯,社團法人臺中市綠生活創意行動協會,1041225,臺中市東區三賢街166號,1、建立低碳綠能生活創意的友善環境。2、促進低碳綠能產業加值服務的國家發展政策。,會員會費等,臺中市政府社會局中華民國104年9月4日中市社團字第1040091955號函,永久,2000.00,1,1051212,,1051213,,,,,,
105法登他000536,2,2,李秋瓊,732,1051213,1051213,1051213,19冊18頁,2,21,曾煥政,社團法人臺中市雅心慈善會,0860416,臺中市大雅區民生路一段1號3樓,以熱心犧牲、奉獻服務之精神，協助社會服務及急難救助工作之推展，從服務活動中培養高尚情操，並在活動之餘提供各會員自我成長。,社員會費及其他捐款,"臺中縣政府　　 中華民國83年3月23日","永  久",6000000.00,1,1051213,,1051214,,,,,,
105法登他000537,1,2,李秋瓊,2287,1051213,1051213,1051213,45冊27頁,2,2,魏嘉銘,財團法人臺中市私立嘉磐慈善基金會,1021220,臺中市南屯區五權西路二段236號13樓之1,以辦理社會福利慈善事業為目的。,由魏嘉銘捐助,臺中市政府社會局中華民國102年12月16日中市社助字第1020106815號函,永久,10000000.00,1,1051213,,1051214,,,,,,
105法登他000538,2,2,李秋瓊,1475,1051213,1051213,1051213,31冊55頁,2,5,傅茂椿,社團法人台中市相德慈善會,0951113,臺中市南區福平里光輝街2號,以協助政府推行敬老尊賢、互助合作及濟貧紓因，改善低收入戶生活，發揚倫理道德為宗旨。,會員會費等,"臺中市政府            中華民國９５年９月１９日","永   久",1000.00,1,1051213,,1051214,,,,,,
105法登他000539,1,2,李秋瓊,778,1051214,1051214,1051214,20冊16頁,2,7,李茂萍,財團法人華盛頓文教基金會,0870326,臺中市北區崇德路一段６３１號５樓之３,承續三采建設實業股份有限公司廖福澤先生熱愛藝術、關懷社區及幼稚教育之熱忱，以推展藝術生活化、生活藝術化活動及優質幼稚教育為宗旨。,由三采建設實業股份有限公司及其關係企業等共同捐助,"教育部      中華民國８７年３月１９日","永  久",10000000.00,1,1051214,,1051215,,,,,,
105法登他000540,1,2,李秋瓊,137,1051215,1051215,1051215,5冊21頁,2,15,郭劉昭惠,財團法人臺中市私立新民高級中學,0510227,臺中市北區健行路１１１號,為創辦私立新民高級中學並謀其發展為目的，設立財團法人臺中市私立新民高級中學。,由張煥珪等捐助,"臺灣省政府教育廳             中華民國４９年６月１７日",永　久,2975576704.00,1,1051215,,1051216,,,,,,
105法登他000541,1,2,李秋瓊,218,1051215,1051215,1051215,8冊11頁,1,13,黃振元,財團法人臺中市私立立人高級中學,0620522,臺中市大里區中興路二段380號,為辦理臺中市私立立人高級中學，並謀其發展為目的，設立財團法人臺中市私立立人高級中學。,由王固盤等十五人捐助,"臺灣省政府教育廳　 　  中華民國62年3月23日","永  久",1420289185.00,1,1051215,,1051216,,,,,,
105法登他000542,2,2,李秋瓊,2127,1051215,1051215,1051216,42冊47頁,2,2,林文燦,社團法人中華訓練品質學會,1011106,臺中市東區復興路四段231之1號7樓,以從事訓練管理之學術研究與實務活動為宗旨。,會費收入,內政部中華民國101年9月19日台內社字第010309461號函,永久,1000.00,1,1051215,,1051219,,,,,,
105法登他000543,1,2,李秋瓊,468,1051216,1051216,1051216,13冊49頁,1,8,謝文昌,財團法人臺中市私立惠明盲校,0801030,臺中市大雅區雅潭路四段336號,為遵照國家教育政策暨現行教育法令之規定，辦理特殊教育學校謀其健全發展之目的，設立財團法人臺中市私立惠明盲校。,由財團法人基督教惠明盲人福利會捐助,"臺灣省政府教育廳                  中華民國６１年６月２１日",永　久,1005291633.00,1,1051216,,1051219,,,,,,
105法登他000544,2,2,李秋瓊,718,1051219,1051219,1051219,19冊4頁,2,18,黃麒麟,社團法人台中市身障福利協進會,0860201,臺中市南屯區東興路一段４５０號,推動身障者政策、爭取身障者之福利、辦理攸關身障者社會福利服務活動、使其機會平等地參與社會，展望同心協力、生命關懷、啟發價值、豐富人生為宗旨。,會員會費、常年會費等,"臺中市政府　  　中華民國７４年７月８日","永  久",1507768.00,1,1051219,,1051220,,,,,,
105法登他000545,2,2,李秋瓊,2202,1051219,1051219,1051219,44冊1頁,1,,江冠明,社團法人中華少數民族宣教中心差傳會,1020625,臺中市北區進化路575號11樓之2,為基督贏得各少數民族與帶領各民族作主門徒並差派少數民族為跨族與跨國的宣教士，且將福音傳於萬族萬邦。,會員會費等,內政部中華民國102年5月22日台內社字第1020199544號函,永久,60000.00,1,1051219,,1051220,,,,,,
105法登他000546,1,2,李秋瓊,122,1051220,1051220,1051220,5冊6頁,1,13,周明仁,財團法人中山醫學大學,0500405,臺中市南區樹德里建國北路一段１１０號,為遵照國家教育政策暨現行教育法令規定辦理大學，並謀其健全發展之目的，設立財團法人中山醫學大學。,由周汝川等捐助,"教育部  　中華民國５１年５月２８日　(51)高字第7251號","永  久",12623563110.00,1,1051220,,1051221,,,,,,
105法登他000547,2,2,李秋瓊,1171,1051221,1051221,1051221,26冊49頁,2,8,卓碧惠,社團法人台中市人智哲學發展學會,0921009,臺中市北屯區軍榮街197巷16號,以研究、發展人智哲學及其於實際層面之應用為宗旨。,會員會費等,"臺中市政府       中華民國９０年１月２日","永   久",650000.00,1,1051221,,1051222,,章程變更：原章程第5條條文內容修訂。,,,,
105法登他000548,1,2,李秋瓊,219,1051222,1051222,1051222,8冊12頁,1,12,蘇信忍,財團法人臺中市私立育仁國民小學,0620601,臺中市北區雙十路二段５０號,為謀求臺中市私立育仁國民小學的發展，並充實其設備為目的。,由比利時天主教聖母聖心會捐助,"臺中市政府　　  中華民國６２年５月３１日",永久,390107021.00,1,1051222,,1051223,,,,,,
105法登他000549,1,2,李秋瓊,390,1051222,1051222,1051222,12冊21頁,2,9,謝德賓,財團法人中華基督教台灣萬國兒童佈道團,0770323,臺中市大肚區遊園路一段87巷2弄48號,宣揚基督教福音並舉辦慈善教育公益等事業以增進社會福利為目的。,由唐代英捐助,"臺中縣政府               中華民國７７年２月１０日","永   久",902436.00,1,1051222,,1051226,,章程修訂：原捐助章程第4條條文內容修訂。　,,,,
105法登他000550,1,2,李秋瓊,120,1051223,1051223,1051223,5冊4頁,1,17,黃一雄,光華學校財團法人,0500301,臺中市太平區東平路18號,為授與青年以生產知識與技能，以養成從事職業能力，從而繁榮社會安定國民經濟並謀其發展為目的，設立光華學校財團法人。,"由黃  冕、黃陳惠鈺捐助","臺灣省政府教育廳          中華民國44年12月5日","永  久",2180296595.00,1,1051223,,1051226,,,,,,
105法登他000551,1,2,李秋瓊,1185,1051223,1051223,1051223,27冊3頁,1,4,石建東,財團法人私立明道普霖斯頓國民小學,0921203,臺中市北屯區河北路三段１６號,(一)：為遵照國家教育政策暨現行教育法令之規定，辦理國民小學。(二)：為補充國民生活知識，提高教育程度，培養優秀人才，輔導升學及促進社會進步，辦理補習班並謀其健全發展。,由石建東、黃啟誠等人捐助,"臺中市政府       中華民國９２年８月１２日","永   久",498430770.00,1,1051223,,1051226,,,,,,
105法登他000552,2,2,李秋瓊,2699,1051226,1051226,1051226,52冊17頁,2,24,蔡少正,社團法人中國生理學會,0860606,臺中市南區南和路175之2號13樓之2,以聯絡國內外人士，共同發揚生理科學之研究及應用為宗旨。,入會費、常年會費、永久會員終生會費、補助費、自由捐款、基金及其孳息、其他收入,內政部中華民國48年10月3日台（48）內社字第17676號,永久,450000.00,1,1051226,,1051227,,章程變更：原章程第16、17條條文內容修訂。,,,,
105法登他000553,1,2,李秋瓊,221,1051226,1051226,1051226,8冊14頁,1,15,蔡寶倫,財團法人臺中市私立嶺東高級中學,0620621,臺中市南屯區嶺東路２號,為遵照國家教育政策暨現行教育法令之規定，辦理財團法人臺中市私立嶺東高級中學，並謀其健全發展之目的，設立財團法人臺中市私立嶺東高級中學。,"由蔡亞萍先生、黎  明女士捐贈","臺灣省政府教育廳       中華民國６０年７月１日","永  久",773841948.00,1,1051226,,1051227,,,,,,
105法登他000554,1,2,李秋瓊,1381,1051226,1051226,1051226,30冊20頁,2,4,王士杰,麗喆學校財團法人,0940912,臺中市西屯區國安二路２４２巷１９９號,為遵照國家教育政策暨現行教育法令之規定辦理國民中小學，並謀其健全發展，設立麗喆學校財團法人。,由李園會及張明正共同捐助,"臺中市政府         中華民國９４年７月６日","永  久",35000000.00,1,1051226,,1051227,,,,,,
105法登他000555,1,2,李秋瓊,1701,1051228,1051228,1051228,35冊41頁,2,17,陳天鳴,財團法人基督教中國佈道會,0531030,臺中市北區中清路一段447號18樓之1,一、傳佈基督福音，引人歸主，建立教會。二、舉辦各樣教會更新之研討訓練聚會，訓練教會同工。三、從事國內外社會服（福）救助事工（其餘內容詳如新章程所載）。四、設立神學院、聖經學校或事奉訓練學校，造就傳道聖工人才。五、從事國內之佈道植堂及海外異文化宣教事工。六、開創藝術、媒體、網路、劇團等事工，在社會中塑造基督文化。七、連結、關懷、協助、支持其他基督教團體，並與其他海內外基督肢體在事工上合作。八、設立或捐助成立其他有關基督信仰之事工或事業（其餘內容詳如新章程所載）。九、設立出版機構，發行本會各項事工之出版品暨代理相關產品。,捐助,臺灣省政府中華民國５３年１０月１３日,永久,4339133656.00,1,1051228,,1051229,,,,,,
105法登他000556,2,2,李秋瓊,2149,1051230,1051230,1051230,43冊9頁,2,3,褚宸綺,社團法人臺中市嬰幼兒福利聯合會,1020107,臺中市太平區新高里立行街31號,以保障嬰、幼兒福利與教育暨嬰、幼兒事業教育發展為宗旨。,會員會費等,臺中市政府社會局101年11月21日中市社團字第1010093105號函,永久,104371.00,1,1051230,,1060103,,,,,,
105法登社000001,2,1,李秋瓊,2574,1050108,1050108,1050108,50冊12頁,,,林瑋倫,社團法人台灣未來影像發展協會,1050108,臺中市大雅區大雅里大雅路28號,以透過本協會推廣台灣影像創作能量、創作者權益以及資源分享為宗旨。,入會費、常年會費、事業費、正式會員捐款、委託收益、基金及孳息、其他收入,內政部中華民國104年10月30日台內團字第1040078786號函,永久,0.00,1,1050128,,1050111,,,,,,
105法登社000002,2,1,李秋瓊,2575,1050112,1050112,1050112,50冊13頁,,,盧冠良,社團法人手愛心視障生活關懷協會,1050112,臺中市西區土庫里美村路一段576巷17號,透過本會發動社會力量，幫助視障朋友尋找就業合作機會，積極落實「就業安置，生活安定」等兩項目標及宗旨。,會員會費等,內政部中華民國104年12月8日台內團字第1040087426號函,永久,2000.00,1,1050112,,1050113,,,,,,
105法登社000003,2,1,李秋瓊,2576,1050112,1050112,1050112,50冊14頁,,,蔡政勳,社團法人育新青少兒關懷協會,1050112,臺中市西區臺灣大道二段501號18樓之1,以「關懷並協助青少兒健全成長」為宗旨，致力推動「青少兒福利」服務。,會員會費等,內政部中華民國104年12月28日台內團字第1041406392號函,永久,0.00,1,1050112,,1050113,,,,,,
105法登社000004,2,1,李秋瓊,2577,1050113,1050113,1050113,50冊15頁,,,呂坤樹,社團法人臺中市基督教新社磐石協會,1050113,臺中市新社區永源里井新街37號,以實踐耶穌基督信仰與基督教社會服務工作為宗旨。,會員會費等,臺中市政府社會局中華民國104年10月16日中市社團字第1040101109號函,永久,200.00,1,1050113,,1050114,,,,,,
105法登社000005,2,1,李秋瓊,2578,1050114,1050114,1050114,50冊16頁,,,陳秀鳳,社團法人臺中市伊甸園聯合生命事奉敬拜禱告殿全人關懷協會,1050114,臺中市太平區大興里大興六街32號,以聯結全國眾教會、學校、其他社工單位之資源，推廣兒童及青少年（含低收入戶）課業輔導、婚前輔導、單親家庭、弱勢族群（含全國原住民），生命品格與心理重建等相關輔導、教育、訓練、活動，落實全人關懷教育理念為宗旨。,會員會費等,臺中市政府社會局中華民國104年12月10日中市社團字第1040124440號函,永久,1000.00,1,1050114,,1050115,,,,,,
105法登社000006,2,1,李秋瓊,2580,1050115,1050115,1050115,50冊18頁,,,劉宜中,社團法人台灣逆轉聯盟協會,1050115,臺中市西區美村路一段771巷17號1樓,以連結臺灣各地優秀組織，幫助弱勢兒童、青少年走向卓越人生為宗旨。,會員會費等,內政部中華民國104年12月29日台內團字第1040088111號函,永久,15623.00,1,1050115,,1050118,,,,,,
105法登社000007,2,1,李秋瓊,2581,1050121,1050121,1050121,50冊19頁,,,楊瑞仁,社團法人中華民國人為教育發展學會,1050121,臺中市西區五權五街151號8樓之3,致力於教育本質與人的教育理論之學術研究與推展，裨益我國教育任務之變異與創化，進而促進教育文化之革新與演化。,會員會費等,內政部中華民國104年12月23日台內團字第1040086873號函,永久,0.00,1,1050121,,1050122,,,,,,
105法登社000008,2,1,李秋瓊,2582,1050122,1050122,1050122,50冊20頁,,,許燦崑,社團法人台灣大家庭關懷協會,1050122,臺中市北屯區民政里橫坑巷聖地4弄4號,為喚起社會大眾，關懷社會急需救助的家庭，給予關心、給予急難救助和鼓勵，使其渡過難關；透過舉辦愛心活動，從事公益工作，達到關懷人群及社區，發揚人類之博愛精神為宗旨。,會員會費等,內政部中華民國104年11月4日台內團字第1040078314號函,永久,1000.00,1,1050122,,1050126,,,,,,
105法登社000009,2,1,李秋瓊,2583,1050125,1050125,1050125,50冊21頁,,,洪麗華,社團法人臺中市鑫關懷協會,1050125,臺中市沙鹿區鹿寮里光榮街36號,以關懷老人、青年、兒童，推廣社區參與機會和社會資本，以達成自助、互助和助人的社會理想為宗旨。,會員會費等,臺中市社會局中華民國104年12月23日中市社團字第1040130918號函,永久,2800.00,1,1050125,,1050126,,,,,,
105法登社000010,2,1,李秋瓊,2584,1050127,1050127,1050127,50冊22頁,,,林苡倢,社團法人台灣藝術手工皂協會,1050127,臺中市太平區新福路52巷6號10號,以推廣台灣在地芳香調理藝術手工皂之職業訓練應用技能與教育，培育並提升專業人才之產業競爭力，建立在地產業與勞工職能之發展，推動就業服務為宗旨。,會員會費等,內政部中華民國104年10月26日台內團字第1040067750號函,永久,3000.00,1,1050127,,1050128,,,,,,
105法登社000011,2,1,李秋瓊,2585,1050128,1050128,1050128,50冊23頁,,,吳晉杰,社團法人臺中市樂活運動舞蹈協會,1050128,臺中市中區中華里中華路一段171之9之7號,以建立健康的生活型態，達到身心靈的健康目標為宗旨。,會員會費等,臺中市政府社會局中華民國104年12月10日中市社團字第1040123901號函,永久,0.00,1,1050128,,1050129,,,,,,
105法登社000012,2,1,李秋瓊,2586,1050128,1050128,1050128,50冊24頁,,,林燦堂,社團法人臺中市救世功德會,1050128,臺中市東區東英里十甲東路820巷24號1樓,基於安家、興邦、廣施功德，致臻社會祥和。以發揚救世濟貧期求社會和諧之精神；並推廣正當團體社交活動，期達會員能充實自我、戮力服務社會為宗旨。,會員會費、捐贈等,臺中市政府社會局中華民國105年1月11日中市社團字第1050001337號函,永久,1000.00,1,1050128,,1050129,,,,,,
