登記案號,類別,案由,主任,登記號數,收件日期,登記日期,公告日期,登記簿,任期判定,屆期判定,法人代表,法人名稱,設立登記日期,主事務所,目的,捐助方法,許可機關日期,存立時期,財產總額,結案原因,結案日期,歸檔日期,發證日期,代理人,代理人住址,郵遞區號,第二個代理人,第二個代理人住址,郵遞區號,送達代收人姓名,送達代收人住址,郵遞區號,清算人,變更原因,註銷日期,撤銷日期,撤(註)銷機關文號,撤(註)銷原因,網站連結
077法登000002,1,1,莊金昌,47,0770325,0770406,0770406,2冊67頁,,0,丘俊明,財團法人邱烋公祭祀公業,0770406,彰化縣永靖鄉瑚璉村中山路二段二三０號,以永遠奉祀邱氏歷代祖宗神位暨敦宗睦族發揚中華民族立國精神及興辦社會公益或慈善教育事業為目的。,依捐助章程第十一條辦理,"彰化縣政府、９、彰 府民文字等一三八一八四號函",永久,1550000.00,1,0770406,0921209,,,,,,,,,,,,,,,,,https://aomp109.judicial.gov.tw/judbp/whd6k/q/ucihzmeXWUoraXUZE3qM1uKiwpVBoDfAr87Hi46fYVZ3ShPwnGsyfA==
077法登000003,1,2,王增瑜,14,0770517,0770602,0770602,1冊27頁,2,4,莊國龍,財團法人台灣省彰化縣私立達德高級商工職業學校,0620709,彰化縣田中鎮碧峰里一鄰中南路二段二七七號,發展教育，培養工商業專門人才，以配合國家經濟建設。,財團法人台灣省彰化縣私立達德高級商工職業學校董事會捐助。,中華民國六十二年六月十九日台灣省政府教育廳六十二、六、十九教三40822號,無限期,106668635.00,1,0841221,0921209,,,,,,,,,,,,,,,,,https://aomp109.judicial.gov.tw/judbp/whd6k/q/haCT_2rt5HQcw6PBSaKRFNKjSfGQ6QdIh6TOcPnYoOhsZ4WyryzjOw==
077法登000004,1,2,莊金昌,16,0770601,0770609,0770609,2冊3頁,2,2,辜振甫,財團法人彰化縣私立鹿港民俗文物舘,0630917,彰化縣鹿港鎮泰興里中山路一五二號,創辦鹿港民俗文物舘以夕揚固有文化。,由隆昌企業股份有限公司捐助土地及房屋，鹿港民俗文物舘董事會辜偉甫以及社會熱心社教人士分別捐,中華民國六十三年四月九日台灣省政府教育廳許可,無限期,23170406.00,1,0770601,0921209,,,,,,,,,,,,,,,,,https://aomp109.judicial.gov.tw/judbp/whd6k/q/1U3slgOSBJkg3E0hzT2uu0gtusfnzfh3RBxquq3EvBl0ublOLC5Lbw==
077法登000005,1,1,莊金昌,48,0770620,0770705,0770705,2冊69頁,,0,吳聰其,財團法人全興文教基金會,0770705,彰化縣彰化市寶山路二六六巷二號,興辦教育，弘揚文化。,由全興工業股份有限公司暨其關係人等捐助,彰化縣政府七十七年六月八日七七彰府教社字第一一二四七三號,永久,1200000.00,1,0770705,0921209,,,,,,,,,,,,,,,,,https://aomp109.judicial.gov.tw/judbp/whd6k/q/iVgcg4tNLgB-qvk7Qc8SPI7vXO-QBREqpTP7o9Lxy_7s1wHJvNzULQ==
077法登000008,1,2,莊金昌,21,0770901,0771014,0771014,2冊13頁,2,3,蘇振輝,財團法人台灣省彰化縣私立精誠中學,0670624,彰化縣彰化市平和里中華西路二五０巷四十二號,"以創辦私立精誠中學為發展地方教育,以培植青年蔚為國用。",捐贈,台灣省教育廳民國肆拾伍年拾月玖日許可,永久設立,4626254.00,1,0771014,0921209,,蘇振輝,彰化市中華西路八０號,,,,,,,,,,,,,,https://aomp109.judicial.gov.tw/judbp/whd6k/q/QPrl_aWP7ThdyVXiki4sLbHqqyCTapOzMXo54LEWyvZev3bK9FG4_Q==
077法登000009,1,2,莊金昌,37,0770901,0771007,0771007,2冊49頁,2,2,王黃蕋,財團法人王萬進文教基金會,0740926,彰化縣彰化市長壽街二一一號,以提供奬金奬勵優良在學學生及傑出之學術研究者，並辦理社會公益福利事業為宗旨。,由董事王朝慶捐助,彰化縣政府中華民國七十四年六月一日,永久設立,27750000.00,1,0921209,0921209,,,,,,,,,,,,,,,,,https://aomp109.judicial.gov.tw/judbp/whd6k/q/_Y5F1rRB70Wxjuy_BwVJECbSMpnpHEIq_mRNWZ_df5WIMVG5kASTew==
077法登000010,1,2,莊金昌,2,0770902,0771017,0771017,1冊4頁,2,2,牛踐初,財團法人私立中州工業專科學校,0581128,彰化縣員林鎮山腳路三段二巷六號,創立學校教育青年培養人才。,創辦人可景俊捐助新台幣伍佰萬元正、土地五一五一一甲。,五十八年十一月二十四日教育部五十八專字第二四二七五號函,永久設立,124205302.00,1,0771017,0921209,,,,,,,,,,,,,,,,,https://aomp109.judicial.gov.tw/judbp/whd6k/q/L36I_fkCmVTKIQlLRxPMLI5j_ZHHWR58rXh4usV7fmIDHvfsKLLm
