登記案號,類別,案由,主任,登記號數,收件日期,登記日期,公告日期,登記簿,任期判定,屆期判定,法人代表,法人名稱,設立登記日期,主事務所,目的,捐助方法,許可機關日期,存立時期,財產總額,結案原因,結案日期,歸檔日期,發證日期,代理人,代理人住址,郵遞區號,第二個代理人,第二個代理人住址,郵遞區號,送達代收人姓名,送達代收人住址,郵遞區號,清算人,變更原因,註銷日期,撤銷日期,撤(註)銷機關文號,撤(註)銷原因
071法登000004,1,1,謝怜聰,315,0510914,0510914,0510915,10冊44頁,,0,和加迪,財團法人天主教聖道明瑪利諾修女會,0510914,台中市貴和街四十二號,"以維持本會修女現在及將來所經辦之教育、醫務、宗教、慈善、社會福利各事業, 嘉惠民眾,協助當地主教,並使年老有疾病之修女獲得贍養。",由聖道明瑪利諾女修會總會及本會修女捐助。,"台灣省政府民政廳 五十一年八月二十七日","永  久",5171190.00,1,0921218,,,,,,,,,,,,,,,,,
071法登000012,1,1,謝怜聰,314,0710205,0710205,0710205,10冊43頁,,0,董事長,財團法人台灣省台中縣基督教導航會,0710205,台中縣龍井鄉國際街一五四巷一號,"本基督之精神,傳授基督教義,辦理社會公益,慈善教育事業",由李亮欽、陳潭捐助,七十年十二月三十日台中縣政府,永久,146621.00,1,0921218,,,,,,,,,,,,,,,,,
071法登000015,1,2,謝怜聰,274,0710414,0710414,0710414,10冊3頁,1,1,郭文圳,財團法人臺灣省臺中市神農大帝神明會,0671206,台中市北屯區北屯路二０九號,以宏揚神農大帝嘉惠農民造福地方之遺德，並配合政府推行復興中華文化道德運動，改善民俗及興辦地方慈善或公益事業為目的。,信徒捐助,"臺中市政府                中華民國六十六年十一月二十八日","永   久",4148545.50,1,0930528,,,,,,,,,,,,,,,,,
071法登000019,1,1,謝怜聰,316,0710506,0710506,0710507,10冊45頁,,0,陳亭卿,財團法人心愛紀念基金會,0710506,台中縣龍井鄉沙田路四段二四七號,捐助雄行優良家境清寒學生或孤兒之教育資金並舉辦各種文藝獎金,由陳亭卿、陳洪月桂共同捐助,"台中縣政府   六十九年一月二十九日","永   久",2000000.00,1,0710506,,,,,,,,,,,,,,,,,
071法登000036,1,1,謝怜聰,318,0710930,0710930,0711001,10冊47頁,,0,黃崇西,財團法人旭台教育獎學基金會,0710930,臺縣后里鄉甲后路七一八號,響應政府社會福利加強社會教育福利，培養優秀學子向學精神，以造福人群。,由旭台橡膠股份有限公司捐助,"臺中縣政府  中華民國七十年十二月十八日","永   久",1000000.00,1,0710930,,,,,,,,,,,,,,,,,
071法登000041,1,1,李添興,319,0711018,0711018,0711018,10冊48頁,,0,臧烈傳,財團法人臺中市後備軍人奬學基金會,0711018,臺中市北屯路六號,奬勵本市優秀而貧困之後備軍人及其子女努力向學為國培育英才。,臺中市後備軍人幹部捐助,"臺中市政府  中華民國七十一年七月三十一日",永久,115000.00,1,0711018,,,,,,,,,,,,,,,,,
071法登財000111,1,1,謝怜聰,320,0711028,0791029,0791029,10冊49頁,,0,傅忠雄,財團法人臺中市私立博愛基金會,0791029,臺中市民權路九十七號,協助政府推行社會福利政策，辦理急難、貧困濟助資助家境清寒、優秀學生等事業為宗旨。,接受團體及個人捐助,"臺中市政府     中華民國七十一年九月三日",永久,8000000.00,1,0791029,,,,,,,,,,,,,,,,,
