登記案號,類別,案由,主任,登記號數,收件日期,登記日期,公告日期,登記簿,任期判定,屆期判定,法人代表,法人名稱,設立登記日期,主事務所,目的,捐助方法,許可機關日期,存立時期,財產總額,結案原因,結案日期,歸檔日期,發證日期,代理人,代理人住址,郵遞區號,第二個代理人,第二個代理人住址,郵遞區號,送達代收人姓名,送達代收人住址,郵遞區號,清算人,變更原因,註銷日期,撤銷日期,撤(註)銷機關文號,撤(註)銷原因,網站連結
080法登000001,1,2,王復生,77,0800208,0800223,0800226,2冊77頁,,0,魏火曜,財團法人中華民國捐血事業基金會花蓮捐血中心,0790606,花蓮市節約街十三號,本會以建立無償供血制度，辦理捐供血業務，提高醫療用血品質，保障病患權益，增進國民健康為目的。,由中華民國捐血運動協會捐助設立,行政院衛生署衛署醫字第八六一一九二號民國七十九年三月五日,永久,573229780.00,1,0850604,0800228,0800228,,,,,,,,,,,,,,,,https://aomp109.judicial.gov.tw/judbp/whd6k/q/L3nsqC2CV_voQ6V3Rb6NL3XDNHp_zM_6x5ccC5xY9rM0AGUMR7shyg==
080法登000003,1,2,王復生,4,0800517,0800531,0800602,1冊4頁,,0,蔡斯馨,財團法人北部台灣基督長老教會東部中會,0551201,花蓮市節約街三０號,為圖謀基督教健全之發展，而幫助北部台灣基督長老教會東部中會之傳道事工及社會福利公益慈善教育事業。,由台灣基督長老教會北部大會所捐助指定為東部中會之資產。,台灣省政府民政廳民國五十五年十月二十六日,永久,2000000.00,1,0850502,0800602,0800602,,,,,,,,,,,,,,,,https://aomp109.judicial.gov.tw/judbp/whd6k/q/Ihl4jaotw7Ue8q0VGqqvu7ETdXjefwOLDOyjWaeeXXoSeUERT7ps
080法登000004,1,1,王復生,88,0800604,0800620,0800622,2冊88頁,,0,王德蔭,財團法人基督教花蓮福音中心,0800620,花蓮市中興路二七六號,於花蓮地區傳佈耶穌基督的福音，使同胞認識真神上帝，並享受神的救贖和神的愛，期能因個人生命改變，而影響家庭、社會、國家之幸福。,本會經費由信徒自由捐獻，並接受會外信徒之愛心捐獻。,花蓮縣政府(80)民禮字第五０一七八號民國八十年五月二十五日,永久,15000000.00,1,0850607,0800626,0800626,,,,,,,,,,,,,,,,https://aomp109.judicial.gov.tw/judbp/whd6k/q/730dErF5VywFsQ8znvywCdzo7zq21L7EiX0Q55a7C-lG8Mp-i3ak7w==
080法登000005,1,1,許仕楓,89,0800625,0800715,0800725,2冊89頁,,0,范明賢,財團法人中華基督教浸信會花蓮博愛堂,0800715,花蓮市博愛街二二五號,傳揚基督福音並辦理社會公益慈善及教育事業。,信徒奉献及有關單位之捐助。,花蓮縣政府八十年五月二十五日，八十府民禮字第五０一七七號函,永久,5103920.00,1,0800725,0800725,0800725,,,,,,,,,,,,,,,,https://aomp109.judicial.gov.tw/judbp/whd6k/q/EW9_Zp_Z0K0-y-NqQnaZ_lYulaVF1lL40K54rwhj4mofq4pQmEq2TA==
080法登000006,1,1,許仕楓,90,0800723,0800725,0800810,2冊90頁,2,2,林文輝,財團法人花蓮縣私立慈惠愛心基金會,0800725,花蓮市美工路三十五號,以發揮仁愛精神，辦理社會公益事業為宗旨,林文輝等捐助,八十年七月十七日花蓮縣政府八十府民社字第七００一五號,永久,3000000.00,1,0850523,0850523,0850523,,,,,,,,,,,,,,,,https://aomp109.judicial.gov.tw/judbp/whd6k/q/x6ZC_DFBna7sd_oJMJhDsJe0UVlxIW1ZS4RD_YRu53eTqvciCe4eRA==
080法登000007,1,1,王復生,91,0800816,0801002,0801006,2冊91頁,,0,陳泰鴻,財團法人基督教花蓮鍚安堂,0801002,花蓮市中美九街一一七巷一弄九號,傳揚耶穌基督救世救人福音。,銀行定期存款,花蓮縣政府民國八十年八月八日,永久,70000.00,1,0850605,0801010,0801010,,,,,,,,,,,,,,,,https://aomp109.judicial.gov.tw/judbp/whd6k/q/BHMIwvSVDbPMB7VVLn9WAKdfQNGUFYhpi97JJAaogDq7v_X1uijb8A==
080法登000008,1,2,王復生,6,0801201,0801211,0801212,1冊6頁,,0,江龍山,財團法人台灣基督長老教會玉山神學院,0540709,花蓮縣壽豐鄉池南村池南路一段二十八號,本院以傳揚基督教教義，並以基督教神學培養原住民傳教人材發展台灣基督長老教會，並辨理教會公益事業為目的。,由基督長老教會信徒所捐獻。,花蓮縣政府民國五十四年四月,,9272354.00,1,0850510,0801215,0801215,,,,,,,,,,,,,,,,https://aomp109.judicial.gov.tw/judbp/whd6k/q/H6WBGuUfRuHYBj7d8fH6jzbGEs-sAJxfYmiJTbLSnByT-Z6XJGJp
