登記案號,類別,案由,主任,登記號數,收件日期,登記日期,公告日期,登記簿,任期判定,屆期判定,法人代表,法人名稱,設立登記日期,主事務所,目的,捐助方法,許可機關日期,存立時期,財產總額,結案原因,結案日期,歸檔日期,發證日期,代理人,代理人住址,郵遞區號,第二個代理人,第二個代理人住址,郵遞區號,送達代收人姓名,送達代收人住址,郵遞區號,清算人,變更原因,註銷日期,撤銷日期,撤(註)銷機關文號,撤(註)銷原因,網站連結
050法登000048,1,1,鄭忠仁,48,0500110,0500110,0500113,4冊31頁,,0,董事長,財團法人臺灣省新竹市私立光復高級中學,0500110,新竹市光復路二段一五三號,"創辦臺灣省新竹市私立光復高級中學,並謀其發展為目的。",由李仲英捐助及其他有志者捐獻。,五十年一月十五日臺灣省政府教育廳,無限期,139421013.00,1,0870220,0921224,,,,,,,,,,,,,,,,,https://aomp109.judicial.gov.tw/judbp/whd6k/q/Nt0cIIPgwOoDJ84_8J4Fo1Ymfv7HxkVjCNHrVQY9kfdGc0KioZqjSw==
050法登000049,1,1,鄭忠仁,49,0500510,0500510,0500513,4冊33頁,,0,董事長,財團法人中國煤礦開發股份有限公司職工福利,0500510,新竹市建中路八號,謀求職工公共利益以期達到改善生活為目的,,四十九年七月十八日新竹縣政府,無期限,28780.00,1,0870220,0921224,,,,,,,,,,,,,,,,,https://aomp109.judicial.gov.tw/judbp/whd6k/q/WqmgMtKNjIoysFzH2RfQrvoEWEAUZoeZhHXdbyKmzw5MdG7BjzDvVg==
050法登000053,1,1,鄭忠仁,53,0500826,0500826,0500829,4冊45頁,,0,董事長,財團法人臺灣省新竹市私立曙光國民小學,0500826,新竹市北大路七十號,"辦理私立曙光國民小學,並謀其發展。",由天主教聖神修女傳教會捐助,五十年八月二十五日臺灣省教育廳,無限期,108556185.00,1,0500826,0921224,,,,,,,,,,,,,,,,,https://aomp109.judicial.gov.tw/judbp/whd6k/q/lHkbCHlJ_T6mftvYuVKrw-2w0a6wVccTo38ansXGaqCdc8bxeEb3ng==
050法登000054,1,1,鄭忠仁,54,0500826,0500826,0500829,4冊47頁,,0,董事長,財團法人台灣省新竹縣私立上智國民小學,0500826,新竹縣竹東鎮東寧路九三一號,配合政府教育政謀其健全發展為國培育有用人才,捐助,五十年八月二十五日新竹縣政府,無限期,53424605.00,1,0870220,0921224,,,,,,,,,,,,,,,,,https://aomp109.judicial.gov.tw/judbp/whd6k/q/O9Aa7WG1wJXmE5ThKFxfASSxcTWROSZmB6cIx4rEyMEV-BXvXXxnDw==
050法登000055,1,1,鄭忠仁,55,0501226,0501226,0501227,4冊49頁,2,2,董事長,財團法人台灣省天主教會新竹教區,0501226,設:新竹市北大路一六六巷十六號,為供應本教區所需之一切傳教設備及經費以維持本教區現在及將來所辦之宗教慈善教育社會福利各項事業,,五十年十二月十一日新竹縣政府,無限期,372759.00,1,0870220,0921224,,,,,,,,,,,,,,,,,https://aomp109.judicial.gov.tw/judbp/whd6k/q/fRuAuezPlA_36kHHjiVstAZKzZKB3Gu9N1mKuVDEYYOgNZKalZtADQ==
