登記案號,類別,案由,主任,登記號數,收件日期,登記日期,公告日期,登記簿,任期判定,屆期判定,法人代表,法人名稱,設立登記日期,主事務所,目的,捐助方法,許可機關日期,存立時期,財產總額,結案原因,結案日期,歸檔日期,發證日期,代理人,代理人住址,郵遞區號,第二個代理人,第二個代理人住址,郵遞區號,送達代收人姓名,送達代收人住址,郵遞區號,清算人,變更原因,註銷日期,撤銷日期,撤(註)銷機關文號,撤(註)銷原因
052法登000060,1,1,鄭忠仁,60,0520131,0520131,0520203,5冊1頁,,0,董事長,財團法人天主教穌肋傷女修會,0520131,新竹縣橫山鄉新興村九讚頭一九二之三號,"為供應本修會所需之一切設備及經費,以推行本會之傳教及其他公益慈善事業",由總會及其他團體或私人捐助,五十二年一月十一日新竹縣政府,無限期,198115.00,1,0520131,0921224,,,,,,,,,,,,,,,,
052法登000061,1,1,鄭忠仁,61,0510106,0510106,0520309,5冊3頁,,0,董事長,財團法人台灣省新竹縣私立內思高級工業職業,0510106,新竹縣新埔鎮四座里二四九號,"創辦內思工校,並謀其發展",由財團法人天主教耶穌會等捐助,四十七年九月十三日台灣省教育廳,無期限,103958147.00,1,0510106,0921224,,,,,,,,,,,,,,,,
052法登000062,1,1,鄭忠仁,62,0821018,0821018,0821021,5冊5頁,2,2,董事長,財團法人台灣基督長老教會聖經書院,0821018,新竹市光鎮里高峰路五十六號,以傳揚基督福音並以聖經神學及基督教教育培養教會工作人員發展台灣基督長老教會辦理教會公益事業為目的,總會交付金，會友獻金,五十二年七月四日新竹縣政府,無期限,1665543630.00,1,0821105,0921224,,,,,,,,,,,,,,,,
052法登000063,1,1,鄭忠仁,63,0520727,0520727,0520730,5冊9頁,,0,董事長,財團法人苗栗縣私立中興高級商工職業學校,0520727,設：苗栗縣竹南鎮大營路二一一號,以創辦苗栗縣私立中興高級商工職業學校並謀其發展為目的,創辦人捐贈,五十一年八月十一日台灣省政府教育廳,無限期,579585.00,1,0520727,0921224,,,,,,,,,,,,,,,,
052法登000065,1,1,陳駿璧,65,0521128,0521128,0521201,5冊15頁,1,0,董事長,財團法人臺灣基督教神召會,0521128,苗栗縣竹南鎮正南里十四鄰和平街五十八號,本財團設立的目的是為協助本財團所屬各地方教會在政府法律之下遵照新舊約聖經宣傳耶穌基督救贖之福音並興辦教育及一切有關文字佈道廣播及社會慈善事業,信徒捐助,五十二年八月二十六日新灣省政府民政廳,無限期,3069543.00,1,0521128,0921224,,,,,,,,,,,,,,,,
