登記案號,類別,案由,主任,登記號數,收件日期,登記日期,公告日期,登記簿,任期判定,屆期判定,法人代表,法人名稱,設立登記日期,主事務所,目的,捐助方法,許可機關日期,存立時期,財產總額,結案原因,結案日期,歸檔日期,發證日期,清算人,變更原因,註銷日期,撤銷日期,撤(註)銷機關文號,撤(註)銷原因
078法登000001,1,1,陳賢慧,26,0780421,0780426,0780426,2冊26頁,,0,傅約翰,財團法人私立台東基督教阿尼色弗兒童之家,0780426,台東縣卑南鄉賓朗路二六０號,"以顯揚神的大能及神的慈愛，傳揚耶穌基督的信息，培養忠心基督徒，殘而  不缺的精神服務社會，協助貧寒家庭之子女及孤兒有一溫暖的家庭為宗旨。",由美國阿尼色弗總會捐助。,台東縣政府。中華民國七十五年十二月二十日。,無限期,14290000.00,1,0780426,,,,,,,,
078法登000003,1,1,陳賢慧,27,0780822,0780822,0780826,1冊27頁,,0,羅朝明,財團法人臺灣省臺東社會教育館社會教育基金會,0780822,臺東市大同路二五四號,"本會以配合省立臺東社會教育館辦理各項社會教育工作,結合民間資源,實施全民教育及終身教育為宗旨。","由臺灣省政府教育廳捐助外,亦接受民間捐助。","臺灣省政府教育廳。  中華民國七十八年六月二日。",無限期。,5000000.00,1,0930105,,,,,,,,
078法登000004,1,2,陳賢慧,24,0780824,0780829,0780831,2冊24頁,,0,謝英皆,財團法人台灣基督長老教會馬偕紀念社會事業基金會,0761214,台北市中山北路二段九十二號。分事務所:台東市長沙街303巷一號,"以耶穌基督救世之精神,推行醫療服務創辦社會事業,並培養醫務人員與醫學之研究,以非營利為宗旨。",由台灣基督長老教會北部大會所捐助指定為本會之財產。,許可機關:台北市政府。許可日期:中華民國五十六年六月廿八日。,永久。,307302185.00,1,0930105,,,,,,,,
078法登000005,1,2,蔡勝雄,25,0770523,0770523,0770523,2冊11頁,,0,林張禎子,財團法人台東縣私立華福社會服務基金會,0770523,台東市仁二街一六０號,為台東縣需要之民眾服務。,社會捐助。,台東縣政府七十七年五月十三日（七七）府民社字第三五三五六號,永久無限制。,5000000.00,1,0930105,,,,,,,,
078法登000006,1,1,黃秋鴻,,0780904,0780904,0780908,2冊28頁,,,李鍾桂,財團法人中國青年服務事業文教基金會,,台北市松江路219號,以服務青年，推展各項文教活動為宗旨。,捐助。,教育部77年3月23日台（77）高11893號函,永久,27303790.00,1,1110314,,,,,,,,
078法登財000007,1,1,陳賢慧,29,0781108,0781110,0781115,2冊29頁,,0,林張翠柳,財團法人台東縣私立高明佛堂林坤池基金會,,台東市強國里仁愛街六十二號,本會以推動急難救助及各項社會服務及推展各項文教活動為宗旨。,捐助。,"台東縣政府 。七十八年九月八日。",永久設立,10000000.00,1,0930105,,,,,,,,
