登記案號,類別,案由,主任,登記號數,收件日期,登記日期,公告日期,登記簿,任期判定,屆期判定,法人代表,法人名稱,設立登記日期,主事務所,目的,捐助方法,許可機關日期,存立時期,財產總額,結案原因,結案日期,歸檔日期,發證日期,代理人,代理人住址,郵遞區號,第二個代理人,第二個代理人住址,郵遞區號,送達代收人姓名,送達代收人住址,郵遞區號,清算人,變更原因,註銷日期,撤銷日期,撤(註)銷機關文號,撤(註)銷原因
095法登他000001,2,2,呂仲陸,23,0950418,0950420,0950421,2冊10頁,2,3,理事長,社團法人澎湖縣智障者家長協會,0821204,澎湖縣馬公市忠孝路1號1樓,以結合澎湖縣關心智障者人士，爭取智障者合法權益，促進智障者福利為宗旨。,發動民間熱心人士捐助及政府補助。,澎湖縣政府82年10月6日,永久性,648701.00,1,0950420,0980316,,李大同,澎湖縣馬公市光華里12鄰24號,880,,,,,,,,,,,,
095法登他000002,1,2,呂仲陸,39,0950418,0950419,0950420,2冊26頁,1,0,董事長,財團法人澎湖縣馬公市中興國民小學校務發展基金會,0900718,澎湖縣馬公市光復路一八六號。,以協助中興國小推動校務發展健全校務為宗旨。,補助及捐助。,澎湖縣政府九十年七月六日九十澎府教社字第三四六四七號函。,永久,2000000.00,1,0950419,0980316,,許義次,澎湖縣湖西鄉龍門村一五○號之三,,,,,,,,,,,,,
095法登他000003,2,2,呂仲陸,46,0950418,0950424,0950425,2冊33頁,1,0,理事長,社團法人澎湖縣照顧服務協會,0921211,澎湖縣馬公市介壽路七之一號,本會為依法設立，非以營利為目的之社會福利團體，以落實政府社會福利政策，促進照顧服務品質，增進民眾福利為宗旨。,會費收入、捐助收入、計畫執行收入。,澎湖縣政府92年11月27日府社行字第0920069340號函。,永久,1411379.00,1,0950420,0980316,,王明輝,彰化縣花壇鄉4鄰福德街41號,880,,,,,,,,,,,,
095法登他000005,1,2,呂仲陸,15,0950721,0950726,0950728,2冊2頁,2,3,高瑞鵬,財團法人澎湖縣慈善服務基金會,0760205,澎湖縣馬公市治平路28之1號,協助政府推行社會福利政策，辦理急難救助慈善服務事業。,澎湖縣民眾服務社、東南水泥股份有限公司、長榮集團並接受團體及個人之捐助。,澎湖縣政府七十五年十月六日澎府民社字第四０六二六號函。,無限期,25000000.00,1,0950724,0980316,,高瑞鵬,台北市松山區南京東路5段59巷29弄1號3樓,105,,,,,,,,,,,,
095法登他000006,1,2,呂仲陸,10,0950726,0950726,0950728,1冊19頁,1,,董事長,財團法人澎湖縣馬公市嵵裡里林燕力行獎學基金會,0710716,澎湖縣馬公市嵵裡里社區活動中心圖書室,獎助本里（嵵裡里）努力向學之優秀學生。,策動地方人士捐獻籌集。,澎湖縣政府71年6月9日澎府教國字第15848號函。,常年,1678000.00,1,0950728,0980316,,陳雙全,澎湖縣馬公市水源路2之1號8樓1室,880,,,,,,,,,,,,
095法登他000007,1,2,呂仲陸,7,0950726,0950727,0950728,1冊11頁,1,3,林吉男,財團法人天主教澎湖教區,0660423,澎湖縣馬公市光復路48號,辦理宗教、慈善、教育、社會福利等事業。,自由捐助。,"澎湖縣政府 66年2月9日（66）澎府民行字第02979號函。",無限期,13804462.00,1,0950728,0980316,,林吉男,台南市東區中西里1鄰長榮路2段15號,701,,,,,,,,聲請法人財產總額變更為新台幣壹仟參佰捌拾萬肆仟肆佰陸拾貳元整,,,,
095法登他000009,1,2,呂仲陸,44,0950925,0950926,0950926,2冊31頁,1,0,董事長,財團法人臺灣兒童暨家庭扶助基金會澎湖分事務所,0910417,台北市信義區忠孝東路五段四八二號四樓,以辦理兒童、青少年、身心障礙者及家庭福利為宗旨。,由美國維吉尼亞州基督教兒童福利會捐助。,臺灣省政府社會處43年12月10日以台省社字第００六號函同意設立。澎湖縣政府72年11月9日澎府民社字第39692號函。,永久。,2360545771.00,1,0950926,0980316,0951003,林柏榕,台中市南屯區三和里12鄰大芳街77號,408,,,,,,,,,,,,
