登記案號,類別,案由,主任,登記號數,收件日期,登記日期,公告日期,登記簿,任期判定,屆期判定,法人代表,法人名稱,設立登記日期,主事務所,目的,捐助方法,許可機關日期,存立時期,財產總額,結案原因,結案日期,歸檔日期,發證日期,清算人,變更原因,註銷日期,撤銷日期,撤(註)銷機關文號,撤(註)銷原因
111法登他000061,1,2,葛羽洪,328,1110512,1110512,1110512,4冊28頁,2,6,董事長陳淑愛,財團法人高雄市靜觀慈善事業基金會,0960504,高雄市左營區大順一路93號8樓之4,以辦理社會福利慈善事業為目的,由陳淑愛等六人捐助,高雄市政府社會局民國96年4月23日,永久,20000000.00,1,1110512,,,,"陳淑愛、洪玉芳、許素芬連任第六屆董事。
第六屆董事印鑑登記。",,,,
111法登他000062,1,2,葛羽洪,50,1110512,1110512,1110512,1冊50頁,2,8,董事長溫和琴,財團法人高雄市私立愛心老人養護中心,0880617,高雄市美濃區中圳里泰安路249巷2之2號,本中心目的事業市辦理老人養護業務，以提供生活自理能力缺損需他人照顧之老人或需鼻胃管、導尿管護理服務需求之老人住宿、照顧、諮詢等服務，增進老人健康及確保老人生活照顧為目的。,內政部獎助及古煥輝、溫和琴等捐助,高雄縣政府88年5月28日88府社福字第101448號函,永久,43528798.00,1,1110512,,,,"溫和琴、古永明、張順發、林品君、傅可涵及宋瓊珠等人連任第八屆董事。
第八屆董事印鑑登記",,,,
111法登他000063,2,2,葛羽洪,216,1110513,1110513,1110513,3冊16頁,2,3,理事長沈桂綾,社團法人高雄市菩薩慈善功德會,1070503,高雄市橋頭區白樹路120號,本會以協助弱勢者，於受傷、生病、失業或其他急難事由，提供短期救急、長期救貧，最終協助其獨立自主為本會成立之宗旨,會費及捐款等,高雄市政府社會局中華民國107年2月9日高市社人團字第10731167000號函,永久,39750.00,1,1110513,,,,"第二屆任期屆滿，改選為第三屆理監事。
沈桂綾、朱炳憲、蔡秀娥、郭貞汝、王秋梅、邱瑞美、李羽玲、釋蓮燈師父及朱玫雪等人連任第三屆理監事。
第三屆理監事印鑑登記。
章程變更:原章程第一條於中華民國107年06月16日經法人第一屆第一次臨時會員大會決議修正，並經高雄市政府社會局中華民國107年07月17日高市社人團字第10735591300號函核備。
法人名稱變更：法人原名稱為高雄市菩薩慈善功德會，變更為社團法人高雄市菩薩慈善功德會。
法人圖記變更登記。",,,,
111法登他000064,1,2,葛羽洪,17,1110513,1110519,1110519,1冊17頁,2,5,董事長趙鎔資,財團法人正德文教傳播基金會,1000217,高雄市鳥松區本館路44之8號,本於健全大眾傳播媒體文化之發展，闡揚世間真、善、美，促進人之淨化、社會祥和為宗旨,由陳刻勤等捐助,國家通訊傳播委員會100年1月24日通傳營字第09900616580號函,永久,50000000.00,1,1110519,,,,"趙鎔資、邱長英、吳淑貞、賴秀貞等四人連任第五屆董事
第五屆董事印鑑登記",,,,
111法登他000065,2,2,葛羽洪,332,1110516,1110516,1110516,4冊32頁,2,6,理事長黎新豪,社團法人高雄市仁武慈暉志願協會,1030415,高雄市仁武區文武里仁林路8號,廣結志工以拓展社會福利工作，培植志願服務人員，維護社區環境清潔、提升鄉民居住品質意識、社區弱勢族群關懷、協助婦女居家生活。,一、入會費。二、常年會費。三、事業費。四、會員捐款。五、委託收益。六、基金及其孳息。七、其他收入。,高雄縣政府95年12月6日府社行字第0950280035號函,永久,50000.00,1,1110516,,,,"黎新豪、陳劉素枝連任第五屆理事；張月趙、江美慧轉任第五屆監事。
第五屆理監事印鑑登記
章程變更:原章程第24條於中華民國111年04月20日經法人第六屆第一次會員大會決議修正，經高雄市政府社會局高市社人團字第11133712100號函核備。",,,,
111法登他000066,1,2,葛羽洪,367,1110516,1110516,1110516,4冊67頁,2,10,董事長林再錦,財團法人一貫道天皇基金會,0810821,"主事務所：臺中市石岡區九房里建德街八號      分事務所：高雄市六龜區新寮里三民路81之6號",本會為發揚中華文化，宣揚數千年來中華道統及一貫道傳道真義與宗旨，倡導倫理道德，增進社會福祉，匡正社會風俗及慈善事業，利國利民為宗旨,由施慶星等捐助,"內政部  中華民國81年5月29日",永久,482215459.00,1,1110517,,,,"第九屆董事全員連任第十屆董事
第十屆董事印鑑登記",,,,
111法登他000067,2,2,葛羽洪,304,1110518,1110518,1110518,4冊4頁,2,3,理事長徐林素卿,社團法人高雄市小鄉社造志業聯盟,1031119,高雄市旗山區南洲里石岩巷3號,以在地社造人才培育，蹲點陪伴及組織培力，社造經驗集結串聯，深耕地方創造土地價值為宗旨,會費及捐助,高雄市政府社會局103年9月10日高市社人團字第10337627000號函,永久,37000.00,1,1110518,,,,"第二屆理監事任期屆滿，改選為第三屆理監事。
李婉玲、呂月如、孫佩馨、蘇美玉、林春福、張惠珍、蔡梁玉英、潘麗華等人連任第三屆理事；鄭燕珠及陳擧琇連任第三屆監事；徐林素卿由監事轉任第三屆理事。
第三屆理監事印鑑登記。
法人主事務所變更:法人之主事務所由高雄市六龜區寶來里中正路128之12號變更至「高雄市旗山區南洲里石岩巷3號」。",,,,
111法登他000068,2,2,葛羽洪,278,1110520,1110520,1110520,3冊78頁,2,9,理事長林宗賢,社團法人高雄市心家長協會,1030929,高雄市仁武區鳳仁路369巷41號,以提升家長參與教育決策之能力、推動高雄市各級學校家長會效能化、提升整體教育品質、提供家庭支持系統、建構家庭教育終身學習系統、倡導弱勢家庭終身學習權益為宗旨。,會費及捐助,高雄市政府社會局95年5月24日高市社一字第95094號,永久,148325.00,1,1110520,,,,"第八屆任期屆滿，改選為第九屆理監事。
林宗賢、王霈諄、柯香君、粱淑芬、丁春蘭、毛美遐、彭薏芬、許柔美、張金雀、李展超、蔡親廣連任第9屆理事；林淑美、吳宸濬連任第9屆監事。
第九屆理監事印鑑登記",,,,
111法登他000069,1,2,葛羽洪,103,1110523,1110523,1110523,2冊3頁,2,10,董事長謝文宜,財團法人實踐家政教育文化基金會,0770203,高雄市內門區內南里大學路200號,以家政教育文化為目的，依有關法令規定辦理下列業務：一、辦理家政教育、技藝、體育、藝術文教活動。二、辦理老人教養、青少年輔導、婦幼教育活動。三、舉辦家政協談、家庭生活教育、休憩、育樂、研討、演講文教活動。四、受理政府或社會團體委辦職技、秘書、康輔、文教人員訓練。五、協助政府辦理學校、家庭、社會教育並解決食、衣、住、行、育、樂問題。六、出版家政文教刊物、設立圖書館。七、其他符合本會設立目的之相關公益性文教事務。,捐助,高雄縣政府中華民國77年1月21日七七府教社字第6730號函,永久,11000000.00,1,1110523,,,,"財產總額變更:原財產總額為新台幣2,000,000元整，變更為新台幣11,000,000元整。
法人捐助章程變更:原捐助章程於中華民國110年08月24日第10屆第2次董事會議決議通過；及經高雄市政府教育局中華民國111年02月17日高市教社字第11131187700號函核備；並經本院111年法字第8號民事確定裁定准予變更。(變更內容詳如章程對造表)",,,,
111法登他000070,2,2,葛羽洪,245,1110525,1110525,1110525,3冊45頁,2,2,理事長何勝雄,社團法人高雄市鳥松區仁美福德祠把水福德祠萬應公廟文化發展協會,1070808,高雄市鳥松區仁美路27巷5號,本會以宣揚福德正神護國衛民精神、凝聚鄉里團結為宗旨,入會費、常年會費、金紙香油捐獻、祭祀慶典收入、企業暨個人捐獻贊助,高雄市政府社會局107年1月11日高市社人團字第10730016800號函,永久,36225892.00,1,1110525,,,,"何勝雄、吳恒亮、黃世鄰、莊慶龍、王清見、何進義等人連任第二屆理事；王和憲連任第二屆監事；第一屆理事林正明改任第二屆監事。
第二屆理監事印鑑登記。
章程變更：原章程第16條於中華民國111年01月09日經法人第二屆第一次會員大會決議修正，並經高雄市政府社會局中華民國111年03月03日高市社人團字第11132035900號函准予核備。",,,,
111法登他000071,1,2,葛羽洪,75,1110525,1110525,1110525,1冊75頁,2,9,董事長陳銘華,財團法人濟興長青基金會,0861209,高雄市燕巢區橫山路72號,以興辦社會福利為目的。,高雄市濟興慈善會捐助,高雄市政府社會局86年11月28日高市社局二字第29884號函,永久,106430914.00,1,1110525,,,,"第八屆董事、監察人全部連任第九屆董事、監察人；並依章程新增蘇百增及林坤榮為第二屆董事。
第九屆董事及監察人印鑑登記",,,,
111法登他000072,2,2,葛羽洪,308,1110530,1110530,1110530,4冊8頁,2,2,理事長李陳恩,社團法人高雄市鳥松福德祠會,1080318,高雄市鳥松區松埔北巷11-63號,以發揚福德爺（伯公祖）犧牲奉獻遵行古禮，造福里民為宗旨。,會費及其他收入等,高雄市政府社會局中華民國108年1月31日高市社人團字第10831243200號函,永久,1000.00,1,1110530,,,,"李陳恩、黃福安、蘇春美等人連任第二屆理事；第一屆監事董秀麗改任第二屆理事。
第二屆理監事印鑑登記。
法人章程變更:原章程第一、三十條於中華民國108年03年23日經法人第一屆第一次臨時會員大會決議修正，並經高雄市政府社會局中華民國111年03月31日高市社人團字第11132695500號函核備。
法人名稱變更:法人名稱變更為「社團法人高雄市鳥松福德祠會」。
法人圖記變更登記
法人章程變更:原章程第二十一、三十一及三十四條於中華民國110年12月18日經法人第一屆第三次會員大會決議修正；並經高雄市政府社會局中華民國111年04月11日高市社人團字第11132830100號函核備。",,,,
111法登他000073,2,2,葛羽洪,218,1110531,1110531,1110531,3冊18頁,2,8,理事長何國良,社團法人高雄市心儀慈善會,0850527,高雄市田寮區崗安路41號,本會以發揮愛心、善心、濟世利人及慈悲心懷，救急助人為宗旨。,會員會費及捐助,高雄縣政府83年8月18日（83）府社行字第133846號函,永久,327400.00,1,1110531,,,,"第七屆監事何國良、林武達改任第八屆理事；許天色、林昆成、許志揚、黃月錦及劉益利等連任第八屆理事；第七屆理事陳水山及李晏珊改任第八屆監事；吳國彰連任第八屆監事。
第八屆理監事印鑑登記",,,,
111法登他000074,1,2,葛羽洪,251,1110531,1110531,1110531,3冊51頁,2,4,董事長王育忠,財團法人玄元大道院社會福利慈善基金會,1000914,高雄市左營區左營大路696號,本會以辦理社會福利慈善事業為目的。,由林漢松及林慧卿捐助成立,高雄市政府社會局100年7月28日高市社局人團字第1000063140號函,永久,10000000.00,1,1110531,,,,"王育忠、李桂香、陳乃麟、許進陽、蘇錦忠、余炤岑等人連任第四屆董事。
第四屆董事印鑑登記。",,,,
111法登他000075,2,2,葛羽洪,224,1110602,1110602,1110602,3冊24頁,2,3,理事長洪新傑,社團法人新高市勞資權益協會,1031023,高雄市路竹區延平路680巷7號,以維護勞資權利與義務並推廣勞工教育、促進勞資關係和諧及協助勞工就業及失業勞工安置，作為勞資與政府間溝通之橋樑，真實反應基層實況，並協助勞、資、政推行政令事項。,會費及捐助,高雄市政府社會局中華民國103年4月18日高市社人團字第10333301300號函,永久,16000.00,1,1110602,,,,"第二屆理監事任期屆滿；改選第三屆理監事。
林進源、劉兆揮、曾國熙、鄭寶柱、李鴻璋、張吳玉燕、王小芬、鄧惠文及張雅琪等人連任第三屆理監事；李紹文、顏飛龍、郭清文及許文典等人連任第三屆監事；第二屆理事黃宏明改任第三屆監事。
第三屆理監事印鑑登記。
法人主事務所變更:法人為主事務所為高雄市路竹區文化路33號；變更至高雄市路竹區文北里延平路680巷7號。",,,,
111法登他000076,2,2,葛羽洪,353,1110602,1110602,1110602,4冊53頁,2,2,理事長陳國棟,社團法人中華製程安全學會,1080805,高雄市左營區重義路59號4樓,"配合政府政策及施政方針，提升安全管理績效，研究安全衛生學術與教育訓練，協助事業單位提供防災安全管理、技術及建議事項，藉以減少災害損失，保障民眾生命及財產之安全， 並以培訓製程安全管理與技術人才為宗旨",入會費及常年會費等,內政部108年5月17日台內團字第1080030592號函,永久,200.00,1,1110602,,,,"朱鳴達、蕭玉玫、徐錦源、徐英傑等人連任第二屆理事；謝賢書及周富榮等人連任第二屆監事。
第二屆理監事印鑑登記。",,,,
111法登他000077,1,2,葛羽洪,521,1110606,1110606,1110606,6冊22頁,2,7,董事長林勝直,財團法人林春桂文教基金會,0840923,高雄市橋頭區橋頭里林厝巷6號,以捐助清寒優秀子弟獎助學金，推廣教育、藝術文化、體育活動為宗旨,捐助,高雄縣政府教育局八十四年八月二十一日八四府教社字第一六三六五四號函,永久,26978902.00,1,1110606,1110803,,,"林勝直、林太平、沈欽銘、林文苑、蔣順市、林中庸、張百祥、林松能、林黃美秀及李清枝等人連任第七屆董事。
第七屆理監事印鑑登記
章程變更:法人捐助章程第1至14條於中華民國110年05月02日經法人第七屆第八次董事會議決議修正；報經高雄市政府教育局中華民國111年01月04日高市教社字第11130059100號函准予備查；捐助章程修正後第五條至第十二條之條文經本院111法字第9號確定裁定准予補充變更。",,,,
111法登他000078,1,2,葛羽洪,336,1110608,1110609,1110609,4冊36頁,2,11,董事長陳威廷,財團法人農友社會福利基金會,0810110,高雄市大樹區竹寮路114之6號,辦理農業研究發展和救助貧困農民,本會創立基金為新台幣貳仟萬元。前項基金得由捐助創立人或其他個人、團體繼續捐贈補充之。,行政院農業委員會民國80年12月20日農糧字第0161117A號函,永久,27120000.00,1,1110609,,,,"陳龍木、邱阿昌、高振源、陳威廷、馬光遠、吳芳銘、戴順發等7人連任第十一屆董事；林裕堡連任第十一屆監察人。
第十一屆董事、監察人印鑑登記。
財產總額變更:法人原財產總額為新台幣20,000,000元整；變更為新台幣:27,120,000元整。",,,,
111法登他000079,1,2,葛羽洪,358,1110609,1110609,1110609,4冊58頁,2,4,董事長張國津,財團法人岡山高中文教基金會,0830330,高雄市岡山區公園路52號,本會以協助岡山高中，改善教學環境，發展校務，獎勵教師進修，促進學生敦品勵學為目的。,捐助,高雄縣政府民國83年3月21日八三府教社字第42583號函,永久,10000000.00,1,1110609,,,,"張國津、戴文凱、劉憲同、何宋錦、盧義光等人連任第四屆董事。
第四屆董事印鑑登記。
目的變更:本會以協助岡山高中，改善教學環境，發展校務，獎勵教師進修，促進學生敦品勵學為目的。",,,,
111法登他000080,2,2,葛羽洪,221,1110609,1110609,1110609,3冊21頁,2,5,理事長張豐藤,社團法人台灣環境教育協會,1010911,高雄市楠梓區加昌路216號,以推動環境教育追求台灣環境永續發展為宗旨。,會費及捐助等,內政部中華民國98年1月21日台內社字第0980018107號函,永久,618000.00,1,1110609,,,,"張豐藤、洪美華、林耀東、馮嘉祺、莊佩璇及王毓正等人連任第五屆理事；方煥銘及吳明孝等人連任第五屆監事。
第五屆理、監事印鑑登記",,,,
111法登他000081,2,2,葛羽洪,439,1110613,1110614,1110614,5冊39頁,2,6,理事長鄭又腆,社團法人中華兩岸勞資法務顧問協會,1091105,高雄市左營區大順一路91號10樓之5,本會為依法設立、非以營利為目的之社會團體，以促進兩岸企業勞工法令權益維護與降低企業職業災害風險，增進企業與勞工對於勞動法令知識的增進。透過協會的諮詢及宣導，讓兩岸的企業及勞工均要遵守勞動法令，並了解企業經營的重要性，避免違法經營企業造成企業經營上的風險，發展和諧穩定的新型勞資關係，創造勞資雙贏。策進勞工與企業創造有利之兩岸企業經營發展環境為宗旨,會費收入及其他收入等,內政部105年2月24日台內團字第1050007327號函,永久,318662.00,1,1110614,,,,"第五屆理事鄭又晪、洪仙姬、陳致修等人連任第六屆理事；第五屆監事王辰祥連任第六屆監事；第五屆監事林建芳改任第六屆理事。
第六屆理監事印鑑登記。
法人章程變更：原章程第15條及第30條第2項於中華民國111年01月06日經法人第6屆第1次會員大會決議修正；報經內政部中華民國111年03月01日台內團字第1110007161號函准予核備。",,,,
111法登他000082,2,2,葛羽洪,420,1110613,1110614,1110614,5冊20頁,2,2,理事長田安克,社團法人台灣愛與希望國際關懷協會,1080930,高雄市左營區翠華路611號,以關懷弱勢者、國際難民及維護兒少權益為宗旨,會費及捐款等,內政部中華民國106年03月28日台內團字第1060410049號函,永久,122965.00,1,1110614,,,,"章程變更:原章程第二條及第五條於中華民國111年04月17日法人第二屆第一次臨時會員大會決議修正；並經內政部中華民國111年05月10日台內團字第1110022034號函准予核備。
法人目的變更為以關懷弱勢者、國際難民及維護兒少權益為宗旨。",,,,
111法登他000083,1,2,葛羽洪,129,1110614,1110614,1110614,2冊29頁,1,3,董事長周林錦燕,財團法人高雄市私立希恩之家,1031107,高雄市大社區學府路210巷16號,以上帝的愛關懷並照顧危機懷孕婦女以及危機處遇的孩童。,由雙語社區教會、武昌教會、國內外基督徒個人與教會、團體等捐助成立，總金額新臺幣一千萬元整。前項基金得由捐助人或其他個人、團體繼續捐贈補充之。,高雄市政府社會局中華民國103年10月28日高市社婦保字第10338947500號函,永久,66750899.00,1,1110614,,,,,,,,
111法登他000084,2,2,葛羽洪,522,1110614,1110614,1110614,6冊23頁,2,13,理事長黃烱輝,社團法人高雄市黃氏宗親會,1040303,高雄市燕巢區深水路77號,本會以闡揚祖德，敦睦宗誼，增進宗族福利，促互助團結，並發揚中華民族之傳統精神為宗旨。,會費及捐助等,高雄市政府社會局中華民國103年12月24日高市社人團字第10340567300號函,永久,174280.00,1,1110614,,,,"第十二屆監事黃介誠、黃三郎、黃鐘田、黃松山等人改任第十三屆理事；黃仲良、黃啓川、黃瑞榮、黃維中、黃淑芬、黃慶富、黃新發、黃榮權、黃金柱、黃明治、黃靖銘、黃紹庭、黃雄鵬等人連任第十三屆理事；第十二屆理事黃清淵、黃正忠、黃德成、黃建家、黃忠信等人改任第十三屆監事；黃棟樑連任第十三屆監事。
第十三屆理、監事印鑑登記。
主事務所變更:法人主事務所由「高雄市苓雅區苓雅一路290號」變更至「高雄市燕巢區深水路77號」。",,,,
111法登他000085,2,2,葛羽洪,194,1110616,1110616,1110616,2冊94頁,2,8,理事長吳文正,社團法人高雄市湖內老人健康促進會,0870709,高雄市湖內區東方路260號,本會以發揚互助精神提昇老人愛護古蹟之意願，維護寧靖公園環境美綠化及會員身心健康，共謀老人福利促進觀光事業發展為宗旨,會員費及捐助,台灣省高雄縣政府民國83年9月27日八三府社行字第158572號函,永久,500000.00,1,1110616,,,,"吳文正、熊新民、陳克修、王吳麗粉、王尹貞等人連任第八屆理事；第七屆監事蘇錦桃改任第八屆理事；余舒慶、鄭郭里連任第八屆監事；第七屆理事陳恆成改任第八屆監事。
第八屆理監事印鑑登記。",,,,
111法登他000086,2,2,葛羽洪,523,1110617,1110617,1110617,6冊24頁,2,9,理事長劉文宏,社團法人中華民國水中運動協會,1020710,高雄市梓官區信義路68巷10號,提倡水中競技、協助政府推展水中運動、確保水上活動安全；協助各團隊推廣相關水中運動，以實現海洋國家為宗旨。,會費及捐助,內政部中華民國80年01月06日台內社字第896333號函,永久,822313.00,1,1110617,1110803,,,"劉文宏、林榮男、鍾永貴、莊憲源、翁明祥、尤若弘、張助道、歐鴻祥連任第九屆理事；吳三嘉、于錦鳳、何武明連任第九屆監事；第八屆理事劉育修改任第九屆監事。
第九屆理、監事印鑑登記。
章程變更:法人原章程第2至41條於中華民國106年11月26日經法人第七屆第四次臨時會員大會決議修正；並經內政部中華民國106年12月19日台內團字第1060448705號函核備。
章程變更:法人原章程第6至44條於中華民國110年12月05日經法人第八屆第四次(應為第八屆第一次)臨時會員大會決議修正；並經內政部中華民國111年04月14日台內團字第1110001118號函核備。",,,,
111法登他000087,2,2,葛羽洪,227,1110622,1110622,1110622,3冊27頁,2,15,理事長鍾秀梅,社團法人高雄市美濃愛鄉協進會,0991224,高雄市美濃區福安里福安街12號,本會以促進地方發展提昇美濃地區教育、社會、生態及文化品質為宗旨。,會費及捐助,高雄縣政府中華民國83年6月7日83府社行字第91391號函,永久,132687.00,1,1110622,,,,"温文相、邱瑞梅、黃森蘭、黃鴻松、劉昭能、陳柏豪、曾振寧等連任第十五屆理事；第十四屆監事邱俊英改任第十五屆理事；鍾鐵鈞、張高傑等人連任第十五屆監事；第十四屆理事宋長青改任第十五屆監事。
第十五屆理監事印鑑登記。",,,,
111法登他000088,1,2,葛羽洪,24,1110622,1110622,1110622,1冊24頁,2,8,董事長林再錦,財團法人高雄市私立寶光建德社會福利慈善事業基金會,0820811,"高雄市六龜區新寮里三民路81號 (分事務所：台南市永康區中山南路510巷1之13號)",以舉辦社會福利慈善事業為宗旨,捐助,82年7月21日高雄縣政府（八二）府社福字第一二二六三三號函,永久,273752146.00,1,1110622,,,,"財產總額變更:原財產總額為新台幣:106,926,320元整；變更為新台幣:273,752,146元整。",,,,
111法登他000089,2,2,葛羽洪,12,1110623,1110624,1110624,1冊12頁,2,12,理事長陳紹崇,社團法人高雄市惠急慈善會,0970512,高雄市路竹區自由街132巷13號5樓,本會以結合民間善心人士及團體機構之力量，配合政府社會福利政策之推行，共同開創社會慈善事業為宗旨。,一、入會費。二、常年會費。三、事業費。四、會員捐款。五、委託收益。六、基金及利息。七、其他收入。,高雄市政府社會局中華民國88年6月6日高市社一字第88071號函。,永久,1106251.00,1,1110624,,,,"陳紹崇、郭亮伶、林原誼、徐翠華等人連任第十二屆理事；第十一屆理事許靜淑改任第十二屆監事。
第十二屆理、監事印鑑登記。",,,,
111法登他000090,1,2,葛羽洪,88,1110624,1110624,1110624,1冊88頁,2,3,董事長蔡淑芳,財團法人高雄市關愛社會福利慈善事業基金會,1060331,高雄市左營區海勝里15鄰翠華路601巷81號,本會以辦理社會福利為目的,由社團法人高雄市肢體障礙協會捐助,高雄市政府社會局106年3月29日高市社人團字第10632754100號函,永久,10001000.00,1,1110624,,,,"蔡淑芳、張木藤、鄭玉慧、金銅、陳泰延等人連任第三屆董事；第二屆監察人李瑛惠改任第三屆董事。
第三屆董事印鑑登記。",,,,
111法登他000091,1,2,葛羽洪,37,1110624,1110624,1110624,1冊37頁,2,8,董事長張孟光,財團法人首席消防安全設備維護基金會,0820727,高雄市左營區至真路11號,協助國內發展各種消防安全設備之技術，推廣消防學術交流，暨強化大樓建築物消防設施，提供消防安全之維護及管理知識、技術與服務以減少災害損失，保障民眾生命財產權益，促進社會公共安全。,捐助,高雄市政府警察局、民國82年7月6日82高市警消字第53304號函（84年8月30日主管機關變更為內政部）,永久,10000000.00,1,1110624,,,,"章程變更:法人捐助章程第11條於110年11月13日經法人第8屆第7次董監事會會議決議修正，並經內政部中華民國110年12月7日內授消字第1100826412號函准予備查；並由本院111年度法字第2號確定裁定准予補充變更。
章程變更:法人捐助章程第22條於110年04月10日經法人第8屆第5次董監事會會議決議修正，並經內政部中華民國110年5月14日內授消字第1100823698號函准予備查；並由本院111年度法字第2號確定裁定准予補充變更。",,,,
