登記案號,類別,案由,主任,登記號數,收件日期,登記日期,公告日期,登記簿,任期判定,屆期判定,法人代表,法人名稱,設立登記日期,主事務所,目的,捐助方法,許可機關日期,存立時期,財產總額,結案原因,結案日期,歸檔日期,發證日期,清算人,變更原因,註銷日期,撤銷日期,撤(註)銷機關文號,撤(註)銷原因
111法登他000001,2,2,陳宏城,507,1110103,1110103,1110103,14冊15頁,2,5,簡純青,社團法人台灣遺傳諮詢學會,0970802,花蓮縣吉安鄉慶豐十一街229之19號,為增進遺傳諮詢專業、協助政府推行保健、衛生、醫療法令與社會服務、維護會員權益、增進共同利益為宗旨。,入會費、常年會費、事業費、會員捐款、委託收益、基金及其孳息、其他收入,內政部中華民國97年9月4日台內社字第097014419號函,永久,1005136.00,1,1110103,1110208,,,"一、第4屆理、監事任期屆滿，改選產生第5屆理、監事
二、主事務所變更為花蓮縣吉安鄉慶豐十一街229之19號",,,,
111法登他000002,1,2,陳宏城,164,1110103,1110103,1110103,4冊164頁,2,2,蔡林檔,財團法人普明文教基金會,0880531,花蓮縣秀林鄉佳民村佳民121號,從事心靈改革，推展各項文教事業為宗旨從事心靈改革，推展各項文教事業為宗旨，並依有關法令規定辦理左列業務：一、設立獎助學，輔導原住民子分。二、辦理佛學教育研修，造就僧伽人才，進而從事心靈改革工作。三、辦理其它各項文教事業，促進社會安定祥和,由林金梅(釋慧寶)捐助,花蓮縣政府88年5月4日、88府教社字第43609號,永久,2100000.00,1,1110103,,,,"第1屆董事任期屆滿，改選產生第2屆董事(依該社團  法人章程規定，應設董事七名，惟經花蓮縣政府同意選任五名臨時董事，代行董事會之職權)",,,,
111法登他000003,2,2,陳宏城,479,1110105,1110105,1110105,13冊15頁,1,1,黃文欽,社團法人慧治教育協會,1090508,花蓮市建成街126號,本會為依法設立，非以營利為目的之社會團體，以秉持適性揚才理念，成為引領探索天賦及發揮生命價值的教育平台為宗旨。,入會費、常年會費、事業費、會員捐款、委託收益、基金及其孳息、其他收入。,內政部中華民國109年4月8日台內團字第1090019108號函。,永久,238000.00,1,1110105,,,,"一、原理事長卓依蒨辭任，補選為黃文欽、原理事楊修俊辭任，補選為李弘毅、原常務監事曾馨瑩辭任，補選為高耀光、原監事任翔辭任，補選為黃思遠
二、原主事務所為花蓮市介仁街96號，變更為花蓮市建成街126號",,,,
111法登他000004,2,2,陳宏城,446,1110106,1110106,1110106,12冊14頁,1,2,范平亞,社團法人花蓮縣私立富興居家長照協會,1061110,花蓮縣新城鄉復興路255號2樓,非以營利為目的，以結合民間力量及社會資源為配合政府社會福利之推行，共同開創慈善事業及社會服務為宗旨,個人會費、團體會費、事業費、會員捐款、委託收益、基金及其孳、其他收入,花蓮縣政府105年03月29日府社行字第1050057830號,永久存立,12000.00,1,1110106,1110208,,,第二屆貢慶安理事、李詩涵常務理事、邱婉涵理事辭任，依侯順序由蕭裕玲理事、賴夏玲理事、鄧瑞華理事遞補，並法補選潘雪涵為常務理事,,,,
111法登他000005,1,2,陳宏城,116,1110106,1110106,1110106,3冊116頁,1,7,鄒永宏,財團法人國立花蓮女子高級中學教育基金會,0830325,花蓮市菁華街2號,"本會以充分運用社會資源推廣文化教育事業為宗旨依有關法令規定辦理下列業務。
一、改善教學環境。
二、充實教學社備。
三、獎助教學研究。
四、獎助清寒優秀學生。
五、其他有關學校教育發展事項。",本會設立基金以新台幣貳佰壹拾萬元整，由鄒永宏先生等捐助，俟本會依法完成財團法人登記後，得繼續接受捐助。,花蓮縣政府83年3月21日八十三府社字第27165號函,永久,2100000.00,1,1110106,,,,第7屆董事林俊彰、張淑美、馮慕民、王正宇、監察人陳玉娟辭任，繼任董事黃婷瑩、陳玉娟、王宜誠、許小薇、監察人謝文靜變更登記。,,,,
111法登他000006,1,2,陳宏城,27,1110110,1110110,1110103,1冊27頁,1,14,釋性開,財團法人佛教私立禪光育幼院,0690325,花蓮縣新城鄉新城村中正路98巷16、18、20、22號,以慈悲喜捨的佛教精神濟世助人。,由各董事捐助及熱心公益慈善人士捐府獻,花蓮縣政府六九年三月十二日，六九府民社字第一六五二一號函,永久,80655882.00,1,1110207,,,,第14屆董事長釋法蓮辭任、繼任董事長為釋性開，董事釋性開、監察人釋性空辭任、繼任董事釋性空、監察人廖琼美變更登記,,,,
111法登他000007,2,2,陳宏城,253,1110111,1110111,1110111,6冊253頁,2,57,何心佑,社團法人花蓮縣花蓮國際青年商會,0940715,花蓮市中和街92號,為發展青年之才智，並結合有志青年人之力量，以促進人類生活、社會經濟及精神文化之進展。一、啟發並促使每一國民承擔其應盡之責任。二、透過會務活動，以發展並提高青少年之領導潛能。三、藉參與計劃及執行會務活動，以訓練個人繁榮社會。四、促進經濟發展。五、促進全人類之瞭解、親善與互助合作,會員入會費及常年會費、國內外公私立團體及個人之捐贈、基金之孳息、其他收入,花蓮縣政府中華民國五十四年九月十九日府社行字第09300556760號函（補發）,永久,2200000.00,1,1110111,,,,第56屆理、監事任期屆滿，改選產生第57屆理、監事,,,,
111法登他000008,1,2,陳宏城,13,1110118,1110118,1110118,1冊13頁,1,6,黃兆明,財團法人天主教會花蓮教區,0441024,花蓮市民立里中美路一六八號,供應本教區為舉行天主教儀式宣揚天主教教義並已辦或擬辦之教育、慈善、社會公益等事業或教會團體、團員或居民之福利事業所需用之一切設備及經費。,信友捐助,台灣省政府民政廳民國四十四年八月八日,永久,2426900815.00,1,1110118,,,,第6屆原董事葛德辭任，繼任董事宋津翰,,,,
111法登他000009,1,2,陳宏城,298,1110119,1110119,1110119,7冊19頁,1,2,雷岳勳,財團法人花蓮耶和華見證人,0971225,花蓮市國聯四路65號5樓,於台灣花蓮縣地區傳授聖經真理，經由免費分發聖經、聖經書刊及其他媒體形式之聖經出版物，並提供免費聖經演講及聖經課程、探訪家庭、於公眾場所提供免費聖經資訊，以及其他任何合法方法達成上述目的。,由財團法人台灣耶和華見證人及國內外信徒所捐助。,花蓮縣政府中華民國97年12月9日府民宗字第097191563號函,永久,12993244.00,1,1110119,,,,一、原社團名稱為財團法人花蓮縣守望台聖經書社，變更為財團法人花蓮耶和華見證人。二、原主事務所為花蓮縣光復鄉中正路一段295巷1號，變更為花蓮市國聯四路65號5樓。三、章程變更,,,,
111法登他000010,1,2,陳宏城,101,1110120,1110120,1110120,3冊101頁,2,8,吳吉雄,財團法人人幼教育基金會,0811222,花蓮市延平街141號,以發揚中華固有文化，提倡人倫道德發揚人性光輝，維護兒童身心健康，增進兒童倫理觀念。,由吳梁月娥等九人共同捐助,花蓮縣政府八十一年十一月十八日府教社字第一一七二九三號,永久,2000000.00,1,1110120,,,,一、第7屆董事任期屆滿，改選產生第8屆董事。二、變更章程,,,,
111法登他000011,1,3,陳宏城,380,1110124,1110124,1110124,10冊14頁,,,傅淑文,財團法人佛祖菩薩眾神社會福利基金會,1021212,花蓮縣吉安鄉慶豐村中山路3段788號,辦理社會福利慈善事業。,由捐助人或其他個人，團體繼續捐贈補充之。,衛生福利部民國102年12月6日部授家字第1020851610號,永久存立,30000000.00,1,1110124,,,,財團法人德發慈善事業基金會、財團法人關聖恩公慈善事業基金會、財團法人佛祖菩薩眾神社會福利基金會等3家基金會，合併為新設法人財團法人佛祖關聖德發慈善事業基金會,,,,
111法登他000012,1,3,陳宏城,289,1110124,1110124,1110124,7冊10頁,2,5,傅淑文,財團法人關聖恩公慈善事業基金會,0870630,花蓮縣吉安鄉中山路三段788號,本會以辦理慈善事業為目的,由傅劉滿蘭、傅淑文、傅顯貴、傅鐙弁捐助,內政部87‧6‧26,永久,30000000.00,1,1110124,,,,財團法人德發慈善事業基金會、財團法人關聖恩公慈善事業基金會、財團法人佛祖菩薩眾神社會福利基金會等3家基金會，合併為新設法人財團法人佛祖關聖德發慈善事業基金會,,,,
111法登他000013,1,3,陳宏城,362,1110124,1110124,1110124,9冊26頁,2,3,傅淑文,財團法人德發慈善事業基金會,0840529,花蓮縣吉安鄉慶豐村中山路3段788號,本基金會以從事培育人才獎助服務性社團、個人、及幫助照顧弱勢族群，以及設計規劃各類有助於國民身心健康之活動為目的。,由傅劉滿蘭女士捐助。,內政部,中華民國84年5月18日,30000000.00,1,1110124,,,,財團法人德發慈善事業基金會、財團法人關聖恩公慈善事業基金會、財團法人佛祖菩薩眾神社會福利基金會等3家基金會，合併為新設法人財團法人佛祖關聖德發慈善事業基金會,,,,
111法登他000014,2,2,陳宏城,428,1110207,1110207,1110207,11冊29頁,2,8,蔡天順,社團法人花蓮縣噶瑪噶舉佛學會,1050829,花蓮市國盛一街180之58號7樓,本會為依法設立、非以營利為目的之社會團體，以宏揚佛法及宣揚西藏噶瑪噶舉傳承之教義為主，以達淨化人心建立祥和社會為宗旨。,會員捐款、會費或其他捐款。,花蓮縣政府84年3月1日府社行字第22358號函核准立案。花蓮縣政府105年8月22日府社行字第1050154989號函核准設立登記法人。,永久存立,14000.00,1,1110207,,,,第8屆理、監事任期屆滿，改選產生第9屆理、監事,,,,
111法登他000015,1,2,陳宏城,456,1110208,1110208,1110208,12冊24頁,1,1,劉一峰,財團法人花蓮縣劉一峰神父天涯若比鄰文化藝術基金會,1070606,花蓮縣玉里鎮協興街62號,弘揚劉一峰神父博愛與奉獻之精神，促進社會祥和、環境永續為宗旨，辦理文化、藝術、教育及環境永續等活動為宗旨。,劉一峰捐助,花蓮縣政府107年6月1日府文藝字第1070105002號函同意設立,永久存立,2000000.00,1,1110208,,,,章程變更,,,,
111法登他000016,1,2,陳宏城,185,1110210,1110210,1110210,4冊185頁,1,7,楊隆翔,財團法人東海岸文教基金會,0890502,花蓮縣吉安鄉南埔八街10巷9號,本會以推動花蓮縣文化、教育、藝術及公共政策之發展為宗旨,由楊守全等二十七人共同捐助,花蓮縣政府中華民國八十九年三月十三日八九府教社字第Ｏ二二一七五號函,永久,2000000.00,1,1110210,,,,捐助章程變更,,,,
111法登他000017,2,2,陳宏城,451,1110210,1110210,1110210,12冊19頁,1,1,陳文遠,"社團法人中華皮革工藝師協會                                                                                      (原名稱為社團法人中華皮革工藝師認證學會)",1070326,花蓮市中興路43巷3號2樓之6,本會以加強凝聚全國之專業學術、技能與力量，促進經濟發展、增益於人類社會，提升國內皮革工藝師專業水準為宗旨。,入會費、常年會費、事業費、會員捐款、委託收益、基金及其孳息、其他收入。,內政部中華民國107年1月10日台內團字第1060089194號。,永久,21700.00,1,1110210,,,,原名稱為社團法人中華皮革工藝師認證學會，變更為社團法人中華皮革工藝師協會,,,,
111法登他000018,1,2,陳宏城,137,1110210,1110210,1110210,3冊137頁,2,9,陳永興,財團法人門諾社會福利慈善事業基金會,0860614,花蓮市民權路4號,本會以宏揚基督耶穌救人博愛精神，舉辦或捐贈社會福利慈善事業為目的。辦理下列各項目的事業：一、兒童及少年福利事項。二、老人福利事項。三、身心障礙者福利事項。四、婦女福利事項。五、原住民福利事項。六、社會救助事項。七、健康照護事項。八、長期照顧服務事項。九、志願服務之辦理及推廣事項。十、主管機關委託辦理事項。十一、其他有關社會福利慈善事業事項。,由財團法人臺灣基督教門諾會醫院捐助,內政部台(86)內社字第8679831號中華民國八十六年五月二十六日,永久,300373972.00,1,1110210,1110401,,,一、第8屆董、監事任期屆滿，改選產生第9屆董、監事。二、章程變更。,,,,
111法登他000019,1,2,陳宏城,49,1110211,1110211,1110211,2冊49頁,2,11,釋證嚴,佛教慈濟醫療財團法人,0740206,花蓮市中央路三段707號,"為秉持佛陀慈悲喜捨之精神，服膺 證 嚴上人「為佛教、為眾生」之志節，傳承靜思法脈，弘揚慈濟宗門，感於「貧因病起、病由貧生」，為解蒼生之病苦，起慈悲濟世之宏願，實踐「人本醫療、尊重生命」之宗旨，從事醫療事業辦理醫療機構及提供醫療服務、醫學研究及教育，並提高地區醫療水準，培養優秀醫事人才及照顧低收入及弱勢民眾，以達醫人、醫病、醫心暨服務社會之目的。",由財團法人中華民國佛教慈濟慈善事業基金會捐助。並由其他個人、團體捐助。,行政院衛生署七十三年十二月二十七日衛署醫字第五０一八四三號函,永久,25082687805.00,1,1110211,,,,變更章程。,,,,
111法登他000020,2,2,陳宏城,385,1110211,1110211,1110211,10冊18頁,2,3,林惠美,社團法人中華美學技藝創新設計發展促進會,1030310,花蓮縣吉安鄉東里一街156號2樓,為推動發展時尚美學與整體造型設計永續發展人才訓練，未來將整合同業間教育訓練資源，透過協會提昇美學暨整體造型的專業素養，為專業從業人員與消費大眾提供全方位的優質服務為宗旨。,入會費、年年會費、事業費、委託收益、基金及其孳息及其他收入。,內政部中華民國102年12月5日台內團字第1020362819號函准予立案。,永久,23800.00,1,1110211,,,,一、第2屆理、監事任期屆滿，改選產生第3屆董、監事，二、原主事務所為花蓮縣吉安鄉中央路三段606號3樓，變更為花蓮縣吉安鄉東里一街156號2樓,,,,
111法登他000021,1,2,陳宏城,27,1110215,1110215,1110215,1冊27頁,1,14,釋性開,財團法人佛教私立禪光育幼院,0690325,花蓮縣新城鄉新城村中正路98巷16、18、20、22號,以慈悲喜捨的佛教精神濟世助人。,由各董事捐助及熱心公益慈善人士捐府獻,花蓮縣政府六九年三月十二日，六九府民社字第一六五二一號函,永久,80655882.00,1,1110215,,,,變更章程,,,,
111法登他000022,1,2,陳宏城,24,1110218,1110218,1110218,1冊24頁,1,12,釋證嚴,財團法人中華民國佛教慈濟慈善事業基金會,0690130,花蓮縣新城鄉康樂村精舍街88巷1號,"本會以佛教之「無緣大慈，同體大悲」精神，舉辦社會福利、公益、醫療保健、教育及人文等志業為旨，各種活動及濟助的對象，,不分宗教派別，不分地域、國度。",由靜思精舍（附設佛教慈濟功德會）捐助，並由社會熱心人士樂捐納入本會。,台灣省政府社會處,永久,82395719800.00,1,1110218,1110302,,,"原財產總額為 82,195,158,453元，變更為 82,395,719,800元",,,,
111法登他000023,2,2,陳宏城,512,1110221,1110415,1110415,14冊19頁,1,4,蘇子鎧,社團法人中華民國一貫道浩然育德道務發展協會,,花蓮縣瑞穗鄉奇美村134號,敬天地，禮神明，愛國忠事，敦品崇禮，孝父母，重師尊，信朋友，和相鄰，改惡向善，講明五倫八德，闡發五教聖人之奧旨，恪遵四維綱常之古禮，洗心滌慮，借假修真，恢復本性之自然，啟發良知良能之至善，已立立人，己逹逹人，挽世界為清平，化人心為良善，冀世界為大同。,個人入會費、常年會費、團體入會費、事業費、會員捐款、委託收益、基金及其孳息、其他收入。,內政部中華民國99年1月29日台內社字第0990012532號函,永久,0.00,1,1110415,,,,原主事務所桃園市桃園區愛一街68號5樓，變更後主事務所為花蓮縣瑞穗鄉奇美村134號,,,,
111法登他000024,1,2,陳宏城,455,1110302,1110302,1110302,12冊23頁,2,2,林忠順,"財團法人花蓮縣百丈山力行禪寺-Foundation of Viriyachan Monastery",1070515,"花蓮縣壽豐鄉水璉村南坑81之6號-No. 81-6, NanKeng, Shuilian Village, Shoufeng Township, Hualien County 974, Taiwan(R.O.C)",本法人致力於佛法之研究、宏揚、傳播與實踐，推展興辦佛教之教育、文化、公益事業。於八宗兼弘中，特重中國禪宗修持法門，以明心見性為修行之終極目標，以淨化人心、福利社會為弘化之宗旨。,現金基金新台幣2000000元由陳武平捐助。不動產及其他產權由力行禪寺、張乃文、江薰正、江永祺、龔世賢等捐助。並得繼續接受個人或有關單位之捐贈（獻）。,花蓮縣政府民國107年5月9日府民宗字第1070085498號許可設立。,永久,14966915.00,1,1110302,,,,第1董、監事任期屆滿，改選產生第2董、監事,,,,
111法登他000025,1,2,陳宏城,209,1110308,1110308,1110308,5冊209頁,2,23,趙犁民,財團法人台灣兒童暨家庭扶助基金會,0910117,台北市忠孝東路五段482號四樓,以實踐博愛助人精神，辦理國內外兒童、少年及家庭、社會服務為宗旨,由美國維吉尼亞州基督教兒童福利會捐助,台灣省政府社會處民國四十三年十二月十日台省社字第006號函；八十四年一月十二日改隸內政部兒童局。,永久,969355329.00,1,1110308,,,,,,,,
111法登他000026,2,2,陳宏城,276,1110314,1110314,1110314,6冊276頁,2,6,楊寶珍,社團法人花蓮縣牛犁社區交流協會,0960423,花蓮縣壽豐鄉豐山村中興街37號,本會為依法設立，非以營利為目的之社團，以發展文化產業、社會福利服務、生態保育與環境教育為宗旨。,一、入會費：新台幣貳佰元於會員入會時繳納。常年會費：新台幣參佰元。,花蓮縣政府91年1月11日府社行字第09100042660號函同意設立。,永久,1474148.00,1,1110314,,,,"一、第5屆理、監事任期屆滿，改選產生第6屆理、監事。二、原財產總為新臺幣1,213,321元整，變更為新臺幣1,474,148元整。",,,,
111法登他000027,2,2,陳宏城,248,1110314,1110314,1110314,6冊248頁,2,6,楊傑,社團法人花蓮縣老人暨家庭關懷協會,0940309,花蓮市中華路486號,以推展老人保護工作並從事老人福利法規定之福利業務及推動提升家庭功能之相關服務為宗旨。,會員入會費、常年會費、捐款；事業費，委託收益，基金及其孳息，其他收入。,花蓮縣政府、中華民國九十四年一月二十四日府社行字第09400129250號,永久,33000.00,1,1110314,,,,,,,,
111法登他000028,1,2,陳宏城,10,1110314,1110314,1110314,1冊10頁,2,16,黃淑怡,四維學校財團法人,0511115,花蓮市國慶里中山路一段200號,為創辦四維學校財團法人花蓮縣四維高級中學並謀永續發展之目的。,董事會暨其他個人、團體等捐助,台灣省政府教育廳民國五十一年八月七日教二字第42523號函核准設立,永久,448169653.00,1,1110314,,,,"一、第15屆董、監事任期屆滿，改選產生第16屆董、監事。二、原財產總額為新臺幣440,093,399元整，變更為新臺幣448,169,653元整",,,,
111法登他000029,2,2,陳宏城,337,1110314,1110314,1110314,9冊337頁,2,7,傅右杞,社團法人花蓮縣八蚌智慧林佛學會,0991105,花蓮縣花蓮市民國路159號2樓,以弘揚共的佛法與不共的藏傳佛教噶瑪噶舉八蚌智慧林傳承、安定人心、利益眾生、以促進社區總體營造為宗旨。,入會費、常年會費、事業費、會員捐款、委託收益、基金及孽息,花蓮縣政府、中華民國98年12月30日府社行字第0980223111號,永久,100000.00,1,1110314,,,,一、第6屆理、監事任期屆滿，改選產生第7屆理、監事，二、章程變更,,,,
111法登他000030,1,2,陳宏城,462,1110315,1110315,1110315,12冊30頁,2,2,張安平,財團法人花蓮縣和平文化藝術基金會,1071221,花蓮縣秀林鄉和平村和工二路七號,"本會以培育文創產業為宗旨，依有關法令規定辦理下列業務：
一、原住民各部族文化創意事業。
二、原住民弱勢家庭或原住民輔導文化藝術創作事項。
三、回饋花蓮當地原住民文化藝術相關事項。
四、其他符合本會設立宗旨之相關公益性文化藝術活動。
二、原住民弱勢家庭或原住民輔導文化藝術創作事項。
三、回饋花蓮當地原住民文化藝術相關事項。
四、其他符合本會設立宗旨之相關公益性文化藝術活動。",由臺灣水泥股份有限公司捐助。俟本會依法完成財團法人登記後，得繼續接受捐贈。,花蓮縣政府中華民國107年12月6日府文藝字第1070240549號函許可設立。,永久,5000000.00,1,1110315,,,,第1屆董、監事任期屆滿，改選產生第2屆董、監事,,,,
111法登他000031,1,2,陳宏城,345,1110316,1110316,1110316,9冊9頁,2,4,李安榮,財團法人花蓮縣天步文化藝術基金會,1000629,花蓮縣玉里鎮城南7街9號,研究自然，宏揚人文精神為宗旨借文化藝術與科學之力量，達到普及教育，培養人才，協助地方及國家建設。,個人捐助。由彭廣愷捐助。財團法人登記後得繼續接受捐贈。,花蓮縣政府民國100年6月17日府文藝字第10000105191號函許可。,永久,2000000.00,1,1110316,,,,第3屆董事任期屆滿，改選產生第4屆董事,,,,
111法登他000032,1,2,陳宏城,350,1110316,1110316,1110316,9冊14頁,2,12,楊瑞永,財團法人陽光社會福利基金會,1000930,台北市中山區南京東路3段91號3樓,以辦理灼燙傷及顏面損傷者之社會福利為目的。,由李娟、孫妙雪、陳俊良等捐助。,台北市政府教育局71年9月23日北市教四字第44964號函；花蓮縣政府100年6月16日府社助字第1000102955號函。,永久,213529032.00,1,1110316,,,,"一、第11屆董、監事任期屆滿，改選產生第12屆董、監事。二、原財產總額為新台幣187,276,000元整，變更為台幣213,529,032元整",,,,
111法登他000033,2,2,陳宏城,252,1110317,1110317,1110317,6冊252頁,2,5,吳明崇,社團法人花蓮縣花蓮市民生社區發展協會,0940617,花蓮市復興街50-4號,以推行社區基礎建設、規劃環境保護、發揚守望相助精神、增進居民福利、醫療保健、建立安和融洽之現代化社會為宗旨。,會員入會費、會員常年會費、捐贈贊助款、基金及其孳息、其他收入。,花蓮縣政府九十四年三月十七日府社行字第09400349600號、花蓮市公所九十四年三月二一日花市社字第0940006150號,永久,50000.00,1,1110317,,,,,,,,
111法登他000034,2,2,陳宏城,95,1110321,1110321,1110321,2冊95頁,2,9,陳重成,社團法人花蓮縣光復鄉老人會,0810529,花蓮縣光復鄉大同村三鄰自強路80巷29號,為加強服務老人，改善老人生活環境、從事老人問題之理論研究，策劃老人之福利等。,會員入會費、會員常年會費、補助款、捐款收入、利息收入、其他收入、基金收入,花蓮縣政府民國八十一年四月十一日(81)府民社字第32629號函,永久,285900.00,1,1110321,,,,第8屆理、監事任期屆滿，改選產生第9屆理、監事,,,,
111法登他000035,1,2,陳宏城,188,1110323,1110323,1110323,4冊188頁,2,5,賴孔明,財團法人台灣基督長老教會花蓮清水教會,0890930,花蓮縣吉安鄉福興村福興一街四十六號,本法人本於耶蘇基督之精神，以傳揚基督福音、領人歸主及辦理社會福利、公益慈善事業為宗旨，且依據相關法令辦理下列目的事業：一、社會慈善服務工作。二、宗教文化傳承。三、公益事業。,本法人之財產由林光武、曾有富、邱明煌等三人共同捐助,花蓮縣政府中華民國八十九年七月十九日八九府民宗字第０七五一七八號函,永久,21500000.00,1,1110323,,,,,,,,
111法登他000036,1,2,陳宏城,3,1110324,1110324,1110324,1冊3頁,2,15,楊松根,財團法人慈惠石壁部堂,0620220,花蓮市國福里11鄰石壁街280巷32號,弘揚無極瑤池金母大聖西王大天尊道教教義匡正社會風氣暨辦理社會公益及社會救濟事業，度眾善信行善功德。,信徒及熱心公益之社團、財團以及社會人士之捐助。,花蓮縣政府民國七十三年四月二十日,永久,5400000.00,1,1110324,,,,第14屆董、監事任期屆滿，改選產生第15屆董、監事,,,,
111法登他000037,2,2,陳宏城,291,1110329,1110329,1110329,7冊12頁,1,4,廖婉玉,社團法人花蓮縣多加全人關懷協會,0970717,花蓮縣萬榮鄉明利村34-12號,本會為依法設立、非以營利為目的之社會體，以服務部落弱勢家庭、老人、婦女、兒童、青少年、身心障礙為主旨，並促進部落健康與發展，提升部落就業機會為宗旨。,入會費、常年會費、事業費、會員捐款、委託收益、基金及其孳息、其他收入,97年5月8日府社行字第0970067307號,永久,100.00,1,1110329,,,,第4屆理事長何愛花辭任、繼任理事長為廖婉玉，監事劉惠琳辭任、繼任監事劉添順變更登記,,,,
