登記案號,類別,案由,主任,登記號數,收件日期,登記日期,公告日期,登記簿,任期判定,屆期判定,法人代表,法人名稱,設立登記日期,主事務所,目的,捐助方法,許可機關日期,存立時期,財產總額,結案原因,結案日期,歸檔日期,發證日期,清算人,變更原因,註銷日期,撤銷日期,撤(註)銷機關文號,撤(註)銷原因
111法登他000001,2,2,陳宏城,507,1110103,1110103,1110103,14冊15頁,2,5,簡純青,社團法人台灣遺傳諮詢學會,0970802,花蓮縣吉安鄉慶豐十一街229之19號,為增進遺傳諮詢專業、協助政府推行保健、衛生、醫療法令與社會服務、維護會員權益、增進共同利益為宗旨。,入會費、常年會費、事業費、會員捐款、委託收益、基金及其孳息、其他收入,內政部中華民國97年9月4日台內社字第097014419號函,永久,1005136.00,1,1110103,,,,"一、第4屆理、監事任期屆滿，改選產生第5屆理、監事
二、主事務所變更為花蓮縣吉安鄉慶豐十一街229之19號",,,,
111法登他000002,1,2,陳宏城,164,1110103,1110103,1110103,4冊164頁,2,2,蔡林檔,財團法人普明文教基金會,0880531,花蓮縣秀林鄉佳民村佳民121號,從事心靈改革，推展各項文教事業為宗旨從事心靈改革，推展各項文教事業為宗旨，並依有關法令規定辦理左列業務：一、設立獎助學，輔導原住民子分。二、辦理佛學教育研修，造就僧伽人才，進而從事心靈改革工作。三、辦理其它各項文教事業，促進社會安定祥和,由林金梅(釋慧寶)捐助,花蓮縣政府88年5月4日、88府教社字第43609號,永久,2100000.00,1,1110103,,,,"第1屆董事任期屆滿，改選產生第2屆董事(依該社團  法人章程規定，應設董事七名，惟經花蓮縣政府同意選任五名臨時董事，代行董事會之職權)",,,,
111法登他000003,2,2,陳宏城,479,1110105,1110105,1110105,13冊15頁,1,1,黃文欽,社團法人慧治教育協會,1090508,花蓮市建成街126號,本會為依法設立，非以營利為目的之社會團體，以秉持適性揚才理念，成為引領探索天賦及發揮生命價值的教育平台為宗旨。,入會費、常年會費、事業費、會員捐款、委託收益、基金及其孳息、其他收入。,內政部中華民國109年4月8日台內團字第1090019108號函。,永久,238000.00,1,1110105,,,,"一、原理事長卓依蒨辭任，補選為黃文欽、原理事楊修俊辭任，補選為李弘毅、原常務監事曾馨瑩辭任，補選為高耀光、原監事任翔辭任，補選為黃思遠
二、原主事務所為花蓮市介仁街96號，變更為花蓮市建成街126號",,,,
