登記案號,類別,案由,主任,登記號數,收件日期,登記日期,公告日期,登記簿,任期判定,屆期判定,法人代表,法人名稱,設立登記日期,主事務所,目的,捐助方法,許可機關日期,存立時期,財產總額,結案原因,結案日期,歸檔日期,發證日期,清算人,變更原因,註銷日期,撤銷日期,撤(註)銷機關文號,撤(註)銷原因
111法登他000001,1,2,楊雅淇,164,1110103,1110118,1110120,4冊29頁,1,7,張優理,財團法人私立佛光大學,0880614,宜蘭縣礁溪鄉林尾路160號,遵照國家教育政策暨現行教育法令之規定，辦理佛光大學，並謀其健全發展。,由星雲等人捐助,教育部中華民國85年8月6日(85)高(3)字第85514687號函,永久,5033504987.00,1,1110118,,,,"財產總額變更為「新臺幣5,033,504,987元整」。
董事陳迺臣地址變更
章程第15條變更",,,,
111法登他000002,1,2,楊雅淇,362,1110105,1110120,1110122,9冊23頁,2,3,陳文隆,財團法人鑑湖堂文化基金會,1010529,宜蘭縣宜蘭市進士路36之10號,推展社區發展相關文化工作，增進民眾福祉。,捐助人捐助,宜蘭縣政府中華民國101年5月18日府文行字第1010003310號,永久,2300000.00,1,1110120,,,,"第3屆董事、監察人任期屆滿，改選產生第4屆。
代表法人之董事：陳文隆。
第4屆董事、監察人之印鑑。",,,,
111法登他000003,1,2,曾少均,225,1110117,1110124,1110127,6冊3頁,2,6,耿蓉,財團法人阿寶教育基金會,0930203,宜蘭縣宜蘭市自強路86號,積極爭取身心障礙者人權，維護身心障礙者權益，全面提升身心障礙者各項服務品質，合理分配使用政府資源，落實保障身心障礙者相關法規及加強社會教育。,由王華沛等十一人共同捐助,宜蘭縣政府中華民國92年12月15日府教終字第0920152740號函,永久,2000000.00,1,1110125,,1110207,,"第6屆董事任期屆滿改選產生第7屆。
第7屆董事印鑑。
章程第11條變更。",,,,
111法登他000004,1,2,曾少均,115,1110126,1110216,1110218,3冊23頁,1,8,林哲立,財團法人宜蘭縣私立慧燈高級中學,0851129,宜蘭縣員山鄉枕山路117之60號,為興學興國目的,由林忠勝等捐贈土地及現金,宜蘭縣政府中華民國85年2月12日府教國字第15268號函,永久,1329338946.00,1,1110216,,,,"財產總額原為「新台幣1,334,572,864元」變更為「新臺幣1,329,338,946元」。",,,,
111法登他000005,1,2,曾少均,126,1110210,1110217,1110222,3冊33頁,2,5,林阿丹,財團法人宜蘭縣五結鄉孝威村國姓廟,0860628,宜蘭縣五結鄉孝威村孝威南路49之1號,本教化之精神，傳揚道教教義及辦理公益慈善事業。,由信徒捐助或有關單位之捐助。,宜蘭縣政府91年6月3日府民禮字第0910060916號函。,永久,1977900.00,1,1110218,,,,"第5屆董事、監察人任期屆滿，改選產生第6屆。姓名及住所如下：
第6屆董事、監察人之印鑑，其中監察人林金生印鑑變更。",,,,
111法登他000006,2,2,曾少均,475,1110210,1110218,1110223,11冊37頁,2,1,陳渝文,社團法人中華佛教法蓮寺慈善協會,1070417,宜蘭縣三星鄉中山路3段179號,本會為依法設立，非以營利為目的之大日如來佛精神，以人飢己飢，人溺己溺，孤苦無依老幼殘障者行善施惠，臨終關懷，不分宗教、種族之精神，藉著宣傳刊物讓少年對法令認知及自我保護觀念，拒絕毒品誘惑。中低收入戶兒童、少年課後寒暑假輔導課業，增進文教氣息及教養，提昇社會道德為宗旨。,入會費、常年會費、事業費、會員捐款、委託收益、基金及其孳息、其他收入。,內政部中華民國107年2月12日台內團字第1070003998號函,永久,20989.00,1,1110221,,,,"第1屆理、監事任期屆滿改選
第2屆理、監事印鑑章",,,,
111法登他000007,1,2,曾少均,288,1110222,1110307,1110308,7冊49頁,2,5,吳丞景,財團法人宜蘭縣私立宏仁老人長期照顧中心(養護型),0970923,宜蘭縣宜蘭市舊城北路177號,提供老人社區服務、機構養護及推展身心障礙者福利。,由發起創辦人及社會善心人士機構共同捐助,宜蘭縣政府97年9月8日府社救字第0970116603號函,永久,25000000.00,1,1110307,,,,"第5屆董事任期屆滿改選。
第6屆董事印鑑。
章程第7條、15條變更。",,,,
111法登他000008,1,2,曾少均,406,1110224,1110304,1110308,10冊17頁,2,5,郭銓慶,財團法人宜蘭縣私立力麗社會福利慈善事業基金會,0941013,宜蘭縣五結鄉中正路3段21號1樓,本會以辦理社會福利慈善事業為目的。辦理下列各項目的事業：一、關於兒童福利、青少年福利、婦女福利等事項。二、關於身心障礙福利、急難救助事項。三、關於提供長期照顧服務、安養及其他老人服務與福利事項。四、關於志願服務及其他社會公益事項。五、接受主管機關指導辦理事項。六、其他有關社會福利慈善事業事項。,捐助,桃園縣政府中華民國94年10月5日府社助字第0940264280號函,永久,10000000.00,1,1110307,,1110315,,三、第6屆董事印鑑,,,,
111法登他000010,2,2,楊雅淇,497,1110225,1110307,1110308,12冊9頁,2,1,官燿金,社團法人宜蘭縣生態農業發展協會,1080410,宜蘭縣壯圍鄉新南村霧罕路3號,本會為依法設立，非以營利為目的之社會團體，宗旨為生態農業之建立及推廣，共創人與自然生態共榮之永續農田及農村。,入會費、常年會費、事業費、會員捐款、委託收益、基金及其孳息、其他收入,宜蘭縣政府中華民國108年1月30日府社區合字第1080009201號,永久,0.00,1,1110307,,,,"第1屆理監事任期屆滿改選
第2屆理監事印鑑，其中理事張家昀印鑑變更",,,,
111法登他000012,1,2,曾少均,202,1110304,1110314,1110317,5冊22頁,1,6,林姿妙,財團法人蘭陽農業發展基金會,0910314,宜蘭縣宜蘭市縣政北路1號,本會以促進蘭陽地區農、林、漁、牧、糧食、農村發展及其他有關農業事務並增進農民福祉為宗旨，不以營利為目的，惟提供服務時得酌收服務費用。,本會由宜蘭縣政府以及宜蘭縣各級農、漁會等捐助成立，捐助金額為新台幣壹仟壹佰伍拾萬元整。前項基金得由捐助人，或其他國內外之個人、法人或機關團體繼續捐助之。,行政院農業委員會中華民國91年3月4日農輔字第0910050194號函,永久,11500000.00,1,1110315,,,,章程第1、10、13、19條變更。,,,,
111法登他000014,1,2,曾少均,74,1110309,1110317,1110321,2冊12頁,1,14,呂若瑟,財團法人聖母醫護管理專科學校,0621128,宜蘭縣三星鄉三星路2段265巷100號,興辦教育事業,依捐獻方式,臺灣省政府教育廳民國62年7月23日教三字第08155號函,永久,1057105206.00,1,1110317,,,,"財產總額原為「1,058,117,863」元整變更為「1,057,105,206」元整。
董事吳韻樂地址變更",,,,
111法登他000015,1,2,曾少均,432,1110309,1110322,1110325,10冊43頁,2,2,李清煌,財團法人羅東城隍廟,1041225,宜蘭縣羅東鎮中正路128號,"本法人本於弘揚奉祀主神  城隍老爺明辨是非、賞善罰惡精神，激發人心向善、促進社會和諧、推動急難救助，辦理公益事業為宗旨。",由羅東城隍廟原所有資產變更申請設立財團法人羅東城隍廟。,宜蘭縣政府中華民國104年12月21日府民禮字第1040213548號函,永久,154600043.00,1,1110322,,1110401,,"第2屆董、監事任期屆滿。
第3屆董、監事印鑑，其中陳燦榕、陳祥文、蔡明珠、楊進益等人印鑑變更。
財產總額原登記「新臺幣149,600,403元整」，變更為「新臺幣154,600,043元整」。",,,,
111法登他000016,1,2,曾少均,203,1110310,1110318,1110324,5冊29頁,2,22,趙犁民,財團法人台灣兒童暨家庭扶助基金會,0910516,台北市信義區忠孝東路5段482號4樓,以實踐博愛助人精神，辦理國內外兒童、少年及家庭、社會服務為宗旨,由美國維吉尼亞州基督教兒童福利會捐助,台灣省政府社會處中華民國43年12月10日台省社字第006號函；84年1月12日改隸內政部,永久,969355329.00,1,1110321,,,,"財產總額變更為「新臺幣969,355,329元整」。
第22屆董事任期屆滿，改選第23屆董事。
代表法人之董事：趙犁民。
第23屆董事印鑑。
捐助章程分別經主管機關以中華民國109年2月12日衛授家字第1090002137號函、109年8月31日衛授家字第1090018415號函、110年2月19日衛授家字第1100000553號函、110年4月12日衛授家字第1100010583號函准予變更登記。",,,,
111法登他000017,1,2,曾少均,489,1110316,1110324,1110328,12冊1頁,2,1,金碧偉,財團法人林秋瓊文化藝術基金會,1071123,宜蘭縣壯圍鄉廍後路74號,本會以營造有利於文化藝術工作之展演環境及獎助文化藝術事業、提升藝文水準為目的。,本會設立基金共新臺幣貳佰萬元整，由金碧偉女士捐助。俟完成財團法人登記後，得繼續接受個人，公私立機關團體及公司行號捐贈。,宜蘭縣政府中華民國107年10月29日府文行字第1070008069號函,永久,2000000.00,1,1110324,,,,"第1屆董事任期屆滿改選。
第2屆董事印鑑。",,,,
111法登他000018,1,2,楊雅淇,259,1110316,1110323,1110325,7冊20頁,2,5,李瑞騰,財團法人黃大魚文化藝術基金會,0950727,宜蘭縣羅東鎮林森路187之2號,藝術紮根、文化推廣,本會設立基金由黃建興等10人共同捐助。本會辦理各項業務所需經費，以支用基金孳息及法人成立後所得捐贈為原則。,宜蘭縣政府中華民國95年5月29日府文行字第0950002641號函,永久,2000000.00,1,1110323,,,,"5屆董事、監察人任期屆滿。
第6屆董事、監察人印鑑。",,,,
111法登他000019,1,2,曾少均,224,1110318,1110325,1110328,6冊4頁,2,6,郭煌宗,財團法人微龍教育基金會,0930115,宜蘭縣宜蘭市崇聖街167號6樓,本會以促進兒童身心發展，加強雙親親職功能，健全家庭動力，凝聚社區活力和關懷弱勢教育為宗旨。,由郭煌宗先生捐助。,宜蘭縣政府教育局92年12月30日府教終字第0920160011號,永久,2000000.00,1,1110325,,,,"第6屆董事任期屆滿，改選產生第7屆
第7屆董事印鑑",,,,
111法登他000020,1,2,曾少均,80,1110321,1110325,1110401,2冊18頁,1,10,吳榮華,財團法人羅東高中教育基金會,0821228,宜蘭縣羅東鎮公正路324號,協助羅東高中改善環境、發展校務、獎勵教師研究進修，促進學生敦品勵學為目的,由校友、家長、熱心教育人士捐助,宜蘭縣政府中華民國81年7月20日八一府教社字第71526號函,永久,4300000.00,1,1110328,,,,"第10屆董事盧銘欽辭任，新任董事簡銘杉
董事簡銘杉印鑑章",,,,
111法登他000022,1,2,曾少均,103,1110324,1110401,1110408,3冊12頁,1,17,林志賢,財團法人宜蘭縣羅東鎮文宗社,0841130,宜蘭縣羅東鎮北成路一段26號,為紀念萬世師表大成至聖先師孔子暨制字倉頡、周濂溪、張橫渠、程明道、程伊川、朱考亭等諸先賢興辦教育及慈善救濟事業，促進社會福利。,社員樂捐,宜蘭縣政府中華民國84年11月16日84府民禮字第130720號函,永久,362893.00,1,1110406,,,,"第17屆監察人廖鍾耀辭世由許進義遞補為監察人
監察人許進義印鑑。
監察人黃其田印鑑變更",,,,
111法登他000023,1,2,曾少均,158,1110325,1110401,1110408,4冊23頁,2,4,張慧珠,財團法人宜蘭縣私立蘭馨婦幼中心,0871216,宜蘭縣羅東鎮光明街166號,本中心目的事業為婦幼福利服務,本中心由黃淑鈴發起創設暨彭林英等捐助成立,宜蘭縣政府中華民國91年4月18日府社福字第0910044192號函,永久,3000000.00,1,1110406,,,,"第4屆董事任期屆滿，改選產生第5屆董事。
第5屆董事印鑑",,,,
111法登社000001,2,1,曾少均,577,1110216,1110225,1110301,13冊39頁,,,林志鴻,社團法人宜蘭縣燈照關懷協會,,宜蘭縣宜蘭市慈安路12巷12號,本會為依法設立，非以營利為目的之社會團體，以促進縣內長者健康福祉與照護品質，增進長照從業人員權益與保障，辦理相關專業知能研習，建構長者友善生活與照護環境，辦理長期照顧服務相關機構，以健全長期照顧體系發展為主要發展宗旨,入會費、常年會費、事業費、會員捐款、委託收益、基金及其孳息、其他收入,宜蘭縣政府中華民國111年1月27日府社區合字第1110014617號函,永久,0.00,1,1110225,,,,,,,,
111法登社000002,2,1,曾少均,579,1110314,1110325,1110401,13冊41頁,,,楊振安,社團法人台灣福德慈善功德會,,宜蘭縣頭城鎮文雅路57巷15號1樓,本會為依法設立，非以營利為目的之公益性社會團體，以發揚福德愛民之理念與素養，推展施棺行善積德之信念，保境安民之理想。結合地方善心人士厚植教育。積極關懷弱勢，推動社會服務，促進社會祥和穩定發展為宗旨。,入會費、常年會費、事業費、會員捐款、委託收益、基金及其孳息、其他收入,內政部中華民國111年1月24日台內團字第1100067739號函,永久,4500.00,1,1110328,,,,,,,,
111法登財000001,1,1,曾少均,578,1110221,1110311,1110317,13冊40頁,,,李垣靜,財團法人宜蘭縣帥德教育基金會,,宜蘭縣宜蘭市嵐峰路3段462巷2號1樓,本會以辦理教育公益服務活動為主軸，秉持慈悲喜捨之精神、宏揚中華固有傳統文化，提倡儒家思想，積極推動品格教育、社區讀經、孝道推廣等，各項文教活動，共同攜手打造儒風傳家、書香有禮、溫馨祥和的社會生活為宗旨，依有關法令規定辦理下列業務：一、推行品格及讀經教育：以儒家思想為本，推動社區親子讀經教育。二、頒發獎助學金：舉辦成年禮並頒發各項節孝勵志獎助學金。三、提倡孝道倫理：舉辦孝親感恩活動。四、開設心靈課程：淨化人心，以改變社會風氣。五、舉辦各種教育研習會，傳播中華固有文化。六、其他符合本會設立宗旨之相關公益性教育事務。,本會設立基金共新臺幣貳百零參萬貳仟貳佰元整，由董事長李垣靜捐助新台幣壹佰參拾萬元整、張世欣捐助新台幣陸拾萬元整、林芳怡捐助新台幣伍萬元整、駱崧根捐助新台幣貳萬元整、陳湘彥捐助新台幣壹萬元整、陳湘高捐助新台幣壹萬元整、陳美璉捐助新台幣壹萬元整、陳俐陵捐助新台幣壹萬元整、周立川捐助新台幣伍仟元整、許喆富捐助新台幣伍仟元整、陳韋勳捐助新台幣伍仟元整、許雯捐助新台幣參仟元整、魏一成捐助新台幣貳仟元整、邱志忠捐助新台幣壹仟元整、陳琝錥捐助新台幣壹仟元整、林雅慧捐助新台幣貳佰元整。俟本會完成財團法人登記後得繼續接受捐贈。,宜蘭縣政府中華民國111年1月12日府教多字第1100210729號,永久,2032200.00,1,1110314,,,,,,,,
