登記案號,類別,案由,主任,登記號數,收件日期,登記日期,公告日期,登記簿,任期判定,屆期判定,法人代表,法人名稱,設立登記日期,主事務所,目的,捐助方法,許可機關日期,存立時期,財產總額,結案原因,結案日期,歸檔日期,發證日期,清算人,變更原因,註銷日期,撤銷日期,撤(註)銷機關文號,撤(註)銷原因
111法登他000002,1,2,張惠芳,25,1110103,1110103,1110104,2冊1頁,2,12,林翠屏,財團法人中和堂文教基金會,0751121,新北市永和區仁愛路60號6樓,以崇敬先師林森倪公宜炎暨奉化王公澂瑩，生前對發揚五倫八德，提倡修齊治平養性教育，以及教學不厭不倦之精神與行誼為創立宗旨。,由林秉梅、王調勳、王民毅等人捐助。,教育部七十五年十月二十七日台75高字第四八二五０號函,永久,18438850.00,1,1110103,,,,董事印鑑。,,,,
111法登他000003,1,2,張惠芳,1448,1110103,1110103,1110104,48冊3頁,2,13,"嚴  明",財團法人大鵬文教基金會,0830205,新北市林口區文化二路1段577號5樓之2,以弘揚空軍精神，舉辦空軍及公益性教育事務，設置獎、助學金獎掖優秀子弟及培植因公殉職子女完成大專院校學業為宗旨。,由中華婦女反共聯合會空軍總司令部分會捐助,教育部八十二年十二月二十二日台（八二）社字第Ｏ七一三一九號函,永久,106513652.00,1,1110103,,,,董事印鑑。,,,,
111法登他000004,1,2,張惠芳,65,1110104,1110104,1110105,3冊23頁,2,16,翁桂卿,財團法人新北市基督教永和教會,0801205,新北市永和區環河西路1段1號2樓,本基督耶穌拯救世人之精神，傳揚耶穌基督並祂釘十字架之真理，於新北市內辦理相關之社會公益事業。,由喬桂伶捐助,台北縣政府八十年十一月十四日北府民二字第三五二九三四號函,永久,8591648.00,1,1110104,,,,董事印鑑。,,,,
111法登他000005,1,2,張惠芳,196,1110104,1110104,1110105,7冊45頁,1,15,黃麗芳,醒吾學校財團法人,0540920,新北市林口區粉寮路1段101號,為供應醒吾學校財團法人醒吾科技大學所需之一切設備及經費,由顧懷祖捐助,教育部五十四年十月二十一日台54高字第一六三七五號,永久,2660759723.00,1,1110104,,,,新任董事印鑑。,,,,
111法登他000006,2,2,張惠芳,1813,1110104,1110104,1110105,57冊7頁,2,10,吳建勳,社團法人中華慈光愛心會,0850518,新北市三重區仁愛街112巷12號4樓,以推廣愛心服務，有效整合愛心服務資源，推動相關之社會福利之工作為宗旨,入會費、常年會費、事業費、會員捐款、委託收益、基金及其孳息、其他收入,內政部中華民國85年4月12日台(85)內社字第8510255號函,永久,98300.00,1,1110104,,,,"理監事印鑑。
修正章程第15條條文。",,,,
111法登他000007,1,2,張惠芳,1903,1110105,1110105,1110106,58冊31頁,2,5,劉技進,財團法人新北市華藏誠明教育基金會,1090610,新北市三重區後竹圍街175巷32弄5號2樓,以提高國民生活品質、弘揚文化、振興學術、推展孝道、發揮人溺己溺、人飢己飢、老吾老以及人之老精神、發展社教及舉辦教育性，正當性休閒娛樂活動為目的,由李秀鳳捐助,臺北市政府教育局中華民國94年1月4日北市教社字第09334088600號函,永久,5000000.00,1,1110105,,,,"董事印鑑變更。
修正捐助章程第5、15條條文。",,,,
111法登他000008,2,2,張惠芳,720,1110105,1110105,1110106,25冊8頁,2,8,陳金玲,社團法人新北市家庭照顧者關懷協會,0961206,新北市永和區秀朗路1段210號5樓之1,以結合新北市地區關懷家庭照顧者之社會人士及團體，積極爭取照顧者及被照顧者人權，促進照顧者及被照顧者權益為宗旨。,入會費、常年會費、事業費、捐款、委託收益、基金及其孳息、其他收入。,新北市政府中華民國89年5月13日北府社團換字第1000249071號,永久,561255.00,1,1110105,,,,理監事印鑑。,,,,
111法登他000009,2,2,張惠芳,1892,1110105,1110105,1110106,58冊20頁,1,1,陳鎔,社團法人台灣設計菁英協會,1090513,新北市中和區中和路366號4樓,提供會員完整教育訓練平台、加強業界多方資源整合，與國際間學術交流，帶領設計同業走向多元發展，爭取更多商機，展望未來立足台灣放眼國際市場。,入會費、常年會費、廠商入會費及常年會費、事業費、會員捐款、委託收益、基金及其孳息、其他收入,內政部中華民國109年4月21日台內團字第1090017285號函,永久,660986.00,1,1110105,,,,新任理監事印鑑。,,,,
111法登財000001,1,1,張惠芳,2123,1110103,1110103,1110105,62冊51頁,,,許銘春,財團法人職業災害預防及重建中心,1110103,新北市新莊區中平路439號南棟11樓,本中心以推展國家規劃之職業災害預防與重建政策，協助辦理職業災害預防及職業災害勞工重建相關業務，使每一個工作者安全健康工作，保護職業災害勞工權益，確保安全健康勞動力為宗旨。,由勞動部捐助。,勞動部中華民國110年12月29日勞職授字第1100206632號函。,永久,30000000.00,1,1110103,,,,,,,,
