登記案號,類別,案由,主任,登記號數,收件日期,登記日期,公告日期,登記簿,任期判定,屆期判定,法人代表,法人名稱,設立登記日期,主事務所,目的,捐助方法,許可機關日期,存立時期,財產總額,結案原因,結案日期,歸檔日期,發證日期,代理人,代理人住址,郵遞區號,第二個代理人,第二個代理人住址,郵遞區號,送達代收人姓名,送達代收人住址,郵遞區號,清算人,變更原因,註銷日期,撤銷日期,撤(註)銷機關文號,撤(註)銷原因
072法登000004,1,1,林文鼎,7,0720505,0720506,0720506,1冊13頁,,0,"吳  勇",財團法人台灣省台北縣台北基督徒中和禮拜堂,0720506,台北縣中和市南山路二九八巷三弄四號,傳揚耶穌基督救世福音，造就信徒靈性，推動社會福利公益事業。,由信徒捐助,台北縣政府七十二年三月十八日北府民二字第五四００八號函,永久,4183317.00,1,0720506,,,,,,,,,,,,,,,,,
072法登000006,1,2,林文鼎,282,0720718,0720718,0720718,10冊37頁,2,2,徐公義,財團法人台灣省台北縣三重市教會聚會所,0680626,台北縣三重市大同北路三十六號,以管理運用所屬一切財產，促進信徒健全信仰，宣傳基督福音，造福公益社會為宗旨。,由信徒捐助,台北縣政府六十八年四月二十七日北府民一字第九三三五七號,永久,1380628.00,1,0720718,,,,,,,,,,,,,"分事務所：台北縣三重市車路頭街九十五巷三弄十二號                
修正捐助暨組織章程第一條、第二條、第三條、第五條、第八條、第九條
  、第十條、第十三條至第十八條。",,,,
072法登000007,1,2,林文鼎,193,0720728,0720728,0720728,7冊39頁,2,3,李有信,財團法人台灣省台北縣泰山巖,0570828,台北縣泰山鄉應化街二十六號,以宣揚顯應祖師聖德，代天宣化弘揚佛道，敦睦信徒親善，促進互助精神，興辦慈善公益事業為宗旨。,由社會人士捐助,台北縣政府五十七年五月十九日北縣民一字第二十八號,永久,2024000.00,1,0720728,,,,,,,,,,,,,"修正捐助章程第五、八、九、十二、十五、十八、二十七條。          
董事印鑑。",,,,
072法登000008,1,1,林文鼎,8,0720803,0720803,0720803,1冊15頁,,0,李林泉,財團法人台灣省台北縣樹林鎮海明寺,0720803,台北縣樹林鎮海明巷一號,以宣揚佛法，促進人心向善，興辦社會慈善事業為宗旨。,由周土城、悟明法師、如道法師共同捐助。,台北縣政府七十一年九月十七日北府民二字第二二三六三四號函,永久,13826000.00,1,0720803,,,,,,,,,,,,,,,,,
072法登000009,1,2,林文鼎,298,0720809,0720809,0720809,11冊9頁,2,2,張鳳章,財團法人台灣省台北縣基督教永和基督徒聚會,0680413,台北縣永和市民治街五十九巷六號,以促進信徒健全信仰，宣揚福音，並舉辦公益慈善及教育事業為宗旨。,信徒捐助,台北縣政府六十八年二月二十三日北府民一字第二二五八九號函,永久,206584.60,1,0820809,,,,,,,,,,,,,"修正組織暨捐助章程第一、二、三、五、九、十條，刪除第四、六、八、
  十二條。                                                      
董事印鑑。",,,,
072法登000916,2,1,林文鼎,515,0720606,0720606,0720606,18冊25頁,,0,童致誠,社團法人世界童氏宗親總會,0720606,台北市忠孝西路一段二一五號六樓之二,以提倡倫理，團結族人，互助合作，勉勵上進，造福宗親，貢獻社會為宗旨。,入會費、常年會費、自由樂捐等。,內政部七十一年十一月十六日七一台內社字第一二一五四五號函,永久,1129000.00,1,0720606,,,,,,,,,,,,,,,,,
