登記案號,類別,案由,主任,登記號數,收件日期,登記日期,公告日期,登記簿,任期判定,屆期判定,法人代表,法人名稱,設立登記日期,主事務所,目的,捐助方法,許可機關日期,存立時期,財產總額,結案原因,結案日期,歸檔日期,發證日期,清算人,變更原因,註銷日期,撤銷日期,撤(註)銷機關文號,撤(註)銷原因
113法登他000001,1,2,周聰慶,15,1130104,1130117,1130118,1冊5頁,1,6,黃浩然,財團法人天主教靈醫會,0451211,宜蘭縣羅東鎮中正南路160號,本法人設立宗旨在發揚耶穌博愛精神，辦理結合天主教信仰與醫療保健、教育文化及社會福利之公益慈善業務。依據相關法令辦理下列目的事業:一、興辦長期照顧服務、老人及身心障礙福利等社會福利事業及宗教慈善各事業。二、以宗教、文學、科學全方位培養天主教靈醫會全球會士。三、設立獎助學金，推動國際性宗教學習與服務專業人才培養與進修。四、支援國內外天主教教會所屬之醫療及非醫療之社會福利機構，達成醫療傳道與社會公益之雙重目標。五、從事濟貧、教育、醫療或應付急難等國際人道救援、重建與生活扶助工作，提升台灣國際形象。六、達成有助於本會宗旨之其他事宜。,由天主教靈醫會羅馬總會捐助。,宜蘭縣政府中華民國45年9月12日宜府民行字第5012號函,永久,1709062020.00,1,1130117,,,,"財產總額變更為新臺幣1,709,062,020元整。",,,,
113法登他000002,1,2,周聰慶,164,1130104,1130129,1130201,4冊29頁,2,7,張優理,財團法人私立佛光大學,0880614,宜蘭縣礁溪鄉林尾路160號,響應私人捐資興學，培養國家高級人才。,由星雲等人捐助。,教育部中華民國85年8月6日(85)高(3)字第85514687號函,永久,5082093099.00,1,1130129,,,,"財產總額變更為「新臺幣5,082,093,099元整」。",,,,
113法登他000003,1,2,周聰慶,454,1130109,1130125,1130131,11冊16頁,2,2,蔡世寅,財團法人正常國家文化基金會,1060124,宜蘭縣宜蘭市和睦路23之3號,本會以落實台灣認同、深化民主價值、推動正名制憲、促進公平正義、維護永續經濟為宗旨，推動文化藝術教育。,由林佳龍捐助新臺幣二百萬元整。,宜蘭縣政府中華民國105年12月29日府授文行字第1050008979號函,永久,2000000.00,1,1130125,,,,"第2屆董事、第1屆監事任期屆滿，改選產生第3屆董事、第2屆監事。
第3屆董事、第2屆監事印鑑。
捐助章程第4條、第7條、第9條第1項、第3項、第12條、第14條、第17條經本院民事庭112年度法字第10號民事裁定准予變更。",,,,
113法登他000006,1,2,周聰慶,5,1130115,1130121,1130124,1冊22頁,2,16,林姿妙,財團法人蘭陽文教基金會,0780629,宜蘭縣宜蘭市復興路2段101號,本會以推展宜蘭縣文教活動，發揮社會教育功能，提昇縣民生活品質為宗旨。,台灣省政府與宜蘭縣政府補助。,宜蘭縣政府中華民國78年6月29日府教社字第56054號函,永久,5000000.00,1,1130121,,,,捐助及組織章程第3條、第8條經本院民事庭112年度法字第13號民事裁定准予變更。,,,,
113法登他000009,1,2,周聰慶,308,1130123,1130124,1130130,8冊19頁,2,4,曾文韻,財團法人中國基督教靈糧世界佈道會蘭陽靈糧堂,0980930,宜蘭縣羅東鎮中正北路117號,本聖經之精神建立教會，以傳揚基督教義及辦理社會公益慈善事業。,設立財產由游本義捐助。,宜蘭縣政府中華民國98年9月10日府民禮字第0980129974號函,永久,116761563.00,1,1130124,,,,"第4屆董事任期屆滿，改選產生第5屆。
第5屆董事印鑑。",,,,
