登記案號,類別,案由,主任,登記號數,收件日期,登記日期,公告日期,登記簿,任期判定,屆期判定,法人代表,法人名稱,設立登記日期,主事務所,目的,捐助方法,許可機關日期,存立時期,財產總額,結案原因,結案日期,歸檔日期,發證日期,清算人,變更原因,註銷日期,撤銷日期,撤(註)銷機關文號,撤(註)銷原因
113法登他000255,1,2,趙美玲,425,1130816,1130816,1130816,8冊149頁,2,15,董事長,財團法人伊甸社會福利基金會,0850318,台北市文山區萬美街一段55號3樓。,以發揮基督耶穌愛人並服務人群的心，舉辦褔利服務及長期照顧服務為目的。,由劉俠等人繼續捐助,台北市政府社會局、民國72年3月19日北市社四字第9699號,永久,775039856.00,1,1130816,,,,一、董事、監察人變更：第14屆董事、監察人任期屆滿，改選第15屆董事、監察人。二、董事、監察人印鑑登記。,,,,
113法登他000257,1,2,趙美玲,241,1130821,1130822,1130822,5冊45頁,2,11,董事長,財團法人再好社會福利事業基金會,0791128,高雄市苓雅區四維二路118號11樓,本會以推廣社會福利為宗旨。,由李瑞標等捐助,高雄市政府、民國79年9月3日79高市社二字第13804號,永久,47229875.00,1,1130821,,,,一、董事變更：第10屆董事任期屆滿，改選第11屆董事。二、董事印鑑登記。,,,,
113法登他000258,1,2,趙美玲,66,1130822,1130823,1130823,3冊10頁,2,12,董事長,財團法人高雄市廣濟宮,0580425,高雄市前鎮區中山二路217號,為協助政府推行政令，宣揚教義及舉辦慈善公益事業福利社會並謀健全發展。,捐助,高雄市政府、中華民國58年4月25日,永久,144280700.00,1,1130823,,,,一、董監事變更：第11屆董監事任期屆滿，改選第12屆董監事。二、董監事印鑑登記。,,,,
113法登他000259,1,2,趙美玲,901,1130823,1130823,1130823,14冊253頁,2,7,董事長,財團法人多元社會教育基金會,0940708,高雄市新興區河南路336號,推動族群合諧，提倡族群共生共榮，建立多元社會價值觀。,林建泉等捐助,高雄縣府94年7月1日府教社字第0940138279號函,永久,173320354.00,1,1130823,,1130830,,一、董事變更：第6屆董事任期屆滿，改選第7屆董事。二、董事印鑑登記。,,,,
113法登他000260,2,2,趙美玲,2072,1130826,1130827,1130827,44冊36頁,2,6,理事長,社團法人台灣南方社會力聯盟,0980904,高雄市前金區新盛二街87號7樓之3,以關懷弱勢、整合社會力、連結社會資源、推動社會福利、促進公民社會為宗旨。,會費及捐助等,內政部98年6月15日台內社字第0980110724號,永久,59380.00,1,1130827,,,,一、理監事變更：第5屆理監事任期屆滿，改選第6屆理監事。二、理監事印鑑登記。,,,,
113法登他000261,1,2,趙美玲,594,1130826,1130826,1130826,11冊221頁,2,9,董事長,財團法人台灣肝臟學術文教基金會,0880726,高雄市三民區合江街13巷9號,本會以鼓勵及促進對肝臟疾病之教育防治及研究為宗旨。,由張文宇先生等捐助,高雄市政府教育局88年7月7日(高市教四字第20684號）　,永久,5000000.00,1,1130826,,,,一、主事務所變更：原主事務所為高雄市三民區十全一路100號，變更為高雄市三民區合江街13巷9號。二、章程變更：原章程第4條於113年01月14日經法人第9屆113年第1次董事會會議決議修正通過，報經主管機關備查。三、董監事變更：第8屆董、監事任期屆滿，改選第9屆董、監事。四、董監事印鑑登記。,,,,
113法登他000262,1,2,趙美玲,534,1130827,1130827,1130827,10冊179頁,2,8,董事長,財團法人李瑞標紀念教育基金會,0870729,高雄市苓雅區四維二路118號11樓,本會以獎勵新聞教育推廣文化活動為宗旨。,由李瑞標家屬捐助,高雄市政府教育局、民國87年7月23日,永久,24573660.00,1,1130827,,,,一、董事變更登記：第7屆董事任期屆滿，改選第8屆董事。二、董事印鑑登記。,,,,
113法登他000263,2,2,趙美玲,1194,1130827,1130828,1130828,22冊139頁,1,15,理事長,社團法人高雄市綠色協會,0990623,高雄市三民區博愛一路70號8樓之2,"以關懷人文及生態環境之永續為目的; 並致力推動人文、社會、環境社區公民教育運動，啟發培養民眾文化、環境及公共參與等各領域之公民意識和行動。",會費及捐助,高雄市政府社會局84年7月14日高市社局一字第17285號函,永久,8573.00,1,1130828,,,,章程變更：原章程第5條第1項、第8條、第13條、第15條於113年4月13日經法人第15屆第2次會員大會會議決議修正通過，報經主管機關備查。,,,,
113法登他000264,2,2,趙美玲,1283,1130828,1130829,1130829,24冊40頁,2,5,理事長,社團法人中華美容造型休閒保健學會,1000425,高雄市三民區建國二路34號13樓,本會以美容造型休閒保健學術與實務之研究，培訓美容造型休閒保健相關產業人才，加強國內外有關組織團體之交流與合作，促進社會健康和諧為宗旨。,會費及捐助,內政部99年6月2日台內社字第0990113861號函,永久,3000.00,1,1130829,,,,一、理監事變更：第4屆理監事任期屆滿，改選第5屆理監事。二、理監事印鑑登記。,,,,
113法登他000265,1,2,趙美玲,1074,1130829,1130829,1130829,19冊29頁,2,6,董事長,財團法人高雄市私立慈暉關懷學園,0970915,高雄市鳳山區鳳崗路1之3號,以增進各類社會福利，健全社會發展為目標，提供各類多元培育、能力提升、學習交流、成果展示的綜合性服務平台。,由社團法人高雄縣青少年關懷協會捐助,高雄縣政府97年7月9日府社福字第0970166241號函,永久,1278000.00,1,1130829,,,,一、董事變更：第5屆董事任期屆滿，改選第6屆董事。二、新任董事長、董事印鑑登記。,,,,
113法登他000266,1,2,趙美玲,68,1130829,1130903,1130903,3冊12頁,1,15,董事長,財團法人台灣省高雄縣私立高英高級工商職業學校,0581008,高雄市大寮區鳳林三路19巷44號2樓,遵照國家教育政策暨現行教育法令之規定，辦理職業教育，並謀其健全發展。,捐助,台灣省政府教育廳、民國58年7月25日教三字第08799號,永久,781725960.00,1,1130903,,1130910,,一、監察人變更：第2屆監察人任期屆滿，改選第3屆監察人。二、監察人陳惠珍連任，印鑑不予變更登記。,,,,
113法登他000267,1,2,趙美玲,972,1130902,1130902,1130902,16冊19頁,2,8,董事長,財團法人山達基教會,0801004,高雄市前金區七賢二路329號9樓,"本會設立之目的乃著創始人L.羅恩 賀伯特先生所闡述之山達基的目標，傳揚山達基宗教之教義、應用及意旨，以促進人類心靈之健全與社會之和諧。",由朱松池、莊錫樂共同捐助,"台中縣政府    民國80年09月19日    80府民俗字第184327號",永久,37453877.00,1,1130902,,,,一、董事變更：第7屆董事任期屆滿，改選第8屆董事。二、董事印鑑登記。,,,,
113法登他000268,1,2,趙美玲,326,1130902,1130902,1130902,6冊161頁,2,9,董事長,財團法人高雄基督教會,0821013,高雄市鳳山區頂圃街188號,本耶穌的博愛精神與傳揚基督教教義、及辦理社會公益慈善事業,捐助,高雄市政府民政局、民國82年10月6日高市民政三字第16775號函,永久,70632618.00,1,1130902,,,,一、董事變更：第8屆董事任期屆滿，改選第9屆董事。二、董事印鑑登記。,,,,
113法登他000269,2,2,趙美玲,1537,1130903,1130903,1130903,31冊16頁,2,4,理事長,社團法人高雄市傳愛協會,1030711,高雄市新興區民生一路19號,見苦‧惜福‧再造福‧傳愛最幸福。,會費及捐助,高雄市政府社會局103年7月1日高市社人團字第10335569100號函,永久,60458.00,1,1130903,,,,一、章程變更：原章程第6、30、32條經法人於113年7月12日第4屆第1次會員大會會議決議修正通過，並報經主管機關備查。二、理監事變更：第3屆理監事任期屆滿，改選第4屆理監事。三、理監事印鑑登記。,,,,
113法登他000270,1,2,趙美玲,1680,1130904,1130904,1130904,34冊39頁,2,4,董事長,財團法人基督教福氣教會,1050324,高雄市三民區河堤路292號地下一樓,本於宏揚基督教教義，健全教會事工之發展，全力推展本教會之傳道、教育事工及公益事業為宗旨。,由楊錫儒先生捐贈,高雄市政府民政局104年11月6日高市民政宗字第10432501700號函,永久,15856448.00,1,1130904,,,,一、董監事變更：第3屆董監事任期屆滿，改選第4屆董監事。二、董監事印鑑登記。,,,,
113法登他000271,1,2,趙美玲,46,1130905,1130909,1130909,2冊20頁,2,14,董事長,財團法人鳳山鎮南宮仙公廟,0531119,高雄市鳳山區和興街189號,本道教之精神，傳揚呂仙祖主張三教一理教義，及辦理社會慈善公益事業。,捐助,高雄縣政府、中華民國53年8月10日,永久,96315100.00,1,1130909,,,,一、董監事變更：第13屆董監事任期屆滿，改選第14屆董監事。二、董監事印鑑登記。,,,,
113法登他000272,2,2,趙美玲,2281,1130909,1130909,1130909,50冊3頁,2,7,理事長,社團法人高雄市新曙光全人關懷協會,1060522,高雄市鳳山區北昌路28號,本會透過各類講座、研習，喚醒人們對「內在自我生命」與「外在自然生態」的重新思考，落實各年齡層全人價值觀之導正與自我形象重塑，強化個人、家庭與社會的內在力量，迎向生命曙光為宗旨。,會費及捐款。,高雄市政府社會局中華民國91年3月22日高市社局一字第7506號函,永久,563.00,1,1130909,,,,一、主事務所變更：原主事務所設高雄市左營區太華街61號4樓，變更為高雄市鳳山區北昌路28號。二、理監事變更：第6屆理監事任期屆滿，改選第7屆理監事。三、理監事印鑑登記。,,,,
113法登他000273,1,2,趙美玲,1123,1130910,1130910,1130910,20冊119頁,1,5,董事長,財團法人百善社會褔利慈善基金會,0980709,高雄市苓雅區永定街170號,以辦理社會福利慈善事業為目的。,由黃清華等22人共同捐助,高雄市政府社會局民國98年6月29日高市社局二字第0980030442號函,永久,30000000.00,1,1130910,,,,一、法人名稱變更：原法人名稱為財團法人高雄市百善社會褔利慈善基金會，變更為財團法人百善社會褔利慈善基金會。二、圖記變更。三、目的變更。四、章程變更：原章程共計26條於112年7月24日經法人第5屆第7次董事會會議決議修正通過，報經主管機關備查。並經本院113年度法字第20號民事裁定准予變更確定。,,,,
113法登他000274,2,2,趙美玲,1391,1130910,1130910,1130911,27冊30頁,2,8,理事長,社團法人高雄市微風市集志業協會,1011005,高雄市鳳山區光華路69號,以「照顧小農，維護消費者食物安全，堅持對土地友善及社區友善互助」為宗旨。,會費及捐助,高雄縣政府98年10月29日府社行字第0980273288號函,永久,200000.00,1,1130910,,,,一、理監事變更：第7屆理監事任期屆滿，改選第8屆理監事。二、理監事印鑑登記。,,,,
113法登他000275,1,2,趙美玲,2206,1130912,1130912,1130912,48冊9頁,1,14,董事長,財團法人慈暉社會福利基金會,0700609,高雄市鳳山區中和里中信街3號,以辦理社會福利為目的。,由林金海先生等共同捐助,內政部中華民國70年5月12日70台內社字第20902號函,永久,30800000.00,1,1130912,,,,章程變更：原章程第5條於113年3月25日經法人第14屆第3次董事會會議決議修正通過，報經主管機關備查，並經本院113年度法字第12號民事裁定准予變更確定。修正要旨：自第15屆起置董事9人，任期為4年。,,,,
113法登他000276,2,2,趙美玲,2283,1130912,1130912,1130912,50冊5頁,1,1,理事長,社團法人高雄市老齡動物關懷照養協會,1120501,高雄市鹽埕區七賢二路472號,本會以關懷照養老齡動物舒適安寧渡過晚年生活為宗旨,會費及捐款等,高雄市政府社會局中華民國112年4月12日高市社人團字第11232862400號函,永久,1000.00,1,1130912,,,,主事務所變更：原主事務所設於高雄市左營區華夏路1062號1樓，變更為高雄市鹽埕區七賢二路472號。,,,,
113法登他000277,2,2,趙美玲,1807,1130912,1130912,1130912,38冊6頁,2,4,理事長,社團法人高雄市大同健康照護協會,1061123,高雄市前金區中華三路68號9樓,本會以提供關懷照護，共同為促進台灣健康照護體系之健全發展為宗旨。,會費及捐款等,高雄市政府社會局中華民國106年11月9日高市社人團字第10639377400號函,永久,1000.00,1,1130912,,,,一、章程變更：原章程第21條於113年8月13日經法人第4屆第1次會員大會會議決議修正通過，報經主管機關備查。二、理監事變更：第3屆理監事任期屆滿，改選第4屆理監事。三、理監事印鑑登記。,,,,
113法登他000278,1,2,趙美玲,2,1130913,1130916,1130916,1冊3頁,2,22,董事長,財團法人基督教中華循理會,0430903,高雄市前金區自強一路36號11樓,本法人設立目的為在台灣各地設立教會(禮拜堂)傳揚基督聖道，並設聖光神學院訓練基督教義之傳道人才、並謀其健全發展、增進社會福祉推動各項公益慈善事業、關懷弱勢族群包括國內外貧苦兒童、家庭、單親、提供生活及獎助學金等之協助，並本著基督博愛救世精神，進行國內外人道救援、重大急難之救助，於國內外宣揚福音補助宣教經費及協助設立教會之經費等。,由國內外循理會信徒樂捐及因教會發展臨時籌謀,臺灣省政府民政廳、民國41年4月11日,永久,598121373.00,1,1130916,,,,一、董事變更：第21屆董事任期屆滿，改選第22屆董事。二、董事印鑑登記。,,,,
113法登他000280,2,2,趙美玲,1526,1130918,1130920,1130920,31冊5頁,2,4,理事長,社團法人高雄市育英護老行動協會,1030604,高雄市新興區中正二路175號5樓之3,以提升老人照顧服務品質及推動關懷社區老人行動化為宗旨，期許長者能感受到在地溫暖與關懷，以安享天年。,會費及捐助,高雄市政府社會局103年5月23日高市社人團字第10334482400號函,永久,60000.00,1,1130920,,,,一、主事務所變更：原主事務所設於高雄市新興區中正三路98號5樓之1，變更為高雄市新興區中正二路175號5樓之3。二、理監事變更登記：第3屆理監事任期屆滿，改選第4屆理監事。三、理監事印鑑登記。,,,,
113法登他000281,1,2,趙美玲,659,1130918,1130918,1130918,12冊85頁,2,9,董事長,財團法人國端心智文教基金會,0890828,高雄市苓雅區正言里中正一路372號9樓之3,以推動各級學校與社會教育相關活動、啟發心靈智慧，導正社會風氣，並奬助弱勢學生，教化培養優秀人才為目的,由劉啟安等捐助,高雄市政府教育局、民國89年8月22日高市教四字第8900008125號函,永久,9398000.00,1,1130918,,1130925,,一、董事變更：第8屆董事任期屆滿，改選第9屆董事。二、董事印鑑登記。,,,,
113法登他000282,1,2,趙美玲,568,1130918,1130918,1130918,11冊117頁,2,9,董事長,財團法人休休文教基金會,0880304,高雄市苓雅區林森二路9巷7號,以推廣佛教教育文化事業為宗旨。,捐助,高雄市政府教育局、中華民國88年3月2日,永久,13515000.00,1,1130918,,,,一、董事變更：第8屆董事任期屆滿，改選第9屆董事。二、董事印鑑登記。,,,,
113法登他000283,1,2,趙美玲,317,1130918,1130920,1130920,6冊125頁,2,11,董事長,財團法人和春文教基金會,0820723,高雄市鼓山區臨海二路58之2號,舉辦教育、文化、公益性工作及活動。,捐助,高雄市政府教育局、民國82年7月19日高市教育四第19620號,永久,11000000.00,1,1130920,,,,一、董事變更：第10屆董事任期屆滿，改選第11屆董事。二、董事印鑑登記。,,,,
113法登他000284,2,2,趙美玲,2184,1130919,1130920,1130920,47冊28頁,2,2,理事長,社團法人台灣青鳥社區關懷協會,1120224,高雄市三民區建國三路413號,以社區及弱勢群體之照顧與健康關懷為宗旨,會費及捐助等,內政部中華民國111年8月26日台內團字第1110042084號函,永久,32265.00,1,1130920,,,,一、理監事變更：第1屆理監事任期屆滿，改選第2屆理監事。二、理監事印鑑登記。,,,,
113法登他000285,1,2,趙美玲,15,1130919,1130920,1130920,1冊17頁,2,13,董事長,財團法人高雄市大港保安宮,0481228,高雄市三民區十全一路52號,奉祀主神保生大帝舉辦祈安消災祭典，宣揚宗教教義，改善習俗，淨化民心及興辦貧寒及喪葬，醫療救濟，設置奬學金鼓勵信徒子女求學上進及辦理慈善公益文化活動事業並謀其健全發展。,捐助,高雄市政府、中華民國48年11月4日,永久,502328232.00,1,1130920,,1130927,,一、董監事變更：第12屆董監事任期屆滿，改選第13屆董監事。二、董監事印鑑登記。,,,,
113法登他000286,2,2,趙美玲,1826,1130919,1130920,1130920,38冊25頁,2,4,理事長,社團法人台灣高齡照顧協會,1040915,高雄市三民區明誠一路20號,以辦理及推動老人褔利為目的。,會費及捐助。,內政部中華民國102年3月7日台內社字第1020076493號函,永久,24730.00,1,1130920,,,,一、主事務所變更：原主事務所設於高雄市小港區安和街7之1號，變更為高雄市三民區明誠一路20號。二、理監事變更：第3屆理監事任期屆滿，改選第4屆理監事。三、理監事印鑑登記。,,,,
113法登他000287,1,2,趙美玲,1,1130920,1130920,1130920,1冊1頁,1,12,董事長,財團法人台灣省私立高雄仁愛之家,0420407,"高雄市大寮區後庄里民順街1號 。分事務所：高雄市前金區中華四路356號",以舉辦並發展社會福祉，不以營利為目的之社會服務為宗旨。,捐助,"臺灣省政府社會處、民國39年2月10日 （主管機關自88年7月1日改隸為內政部）",永久,1081170645.00,1,1130920,,,,"財產總額變更：原財產總額為新台幣1,169,601,443元整，變更為新台幣1,081,170,645元整。",,,,
113法登他000288,1,2,趙美玲,19,1130923,1130924,1130924,1冊25頁,1,19,董事長,財團法人高雄佛教堂,0491227,高雄市苓雅區成功一路253號,宣揚佛教義理、弘揚人間佛教，淨化人心，興辦佛教文化與教育及慈善公益事業為宗旨。,捐助,高雄市政府、中華民國49年11月30日,永久,119482870.00,1,1130924,,,,一、目的變更。二、章程變更：原章程第1、2、4條、第6條至第10條、第12條至第26條，於113年7月10日經法人第10屆第5次董事會會議決議修正通過，報經主管機關備查，其中第6、7、9、10條、第13條、第15條至第21條並經本院113年度法字第21號民事裁定准予變更確定。修正要旨：原董、監事任期為3年，修正為5年。,,,,
113法登他000289,1,2,趙美玲,151,1130923,1130924,1130924,4冊45頁,2,13,董事長,財團法人高雄市塩埕區三山國王廟,0731214,高雄市鹽埕區鹽埕街54號,本財團法人設立目的為舉辦社區公益、慈善事業淨化信仰為宗旨，並謀其健全發展。,捐助,高雄市政府民政局七十三年十一月三日七三高市民政三字第六七二五號,永久,102699917.00,1,1130924,,,,一、董監事變更：第12屆董監事任期屆滿，改選第13屆董監事。二、董監事印鑑登記。,,,,
113法登他000290,2,2,趙美玲,1833,1130923,1130924,1130924,38冊32頁,2,3,理事長,社團法人台灣希望國際宣教事工協會,1070517,高雄市鼓山區明誠三路683號6樓,以建立台美基督宣教合作為宗旨。,會費及捐助等。,內政部中華民國107年4月16日台內團字第1070017195號函,永久,50000.00,1,1130924,,1130930,,一、主事務所變更：原主事務所設於高雄市旗津區敦和街24號，變更為高雄市鼓山區明誠三路683號6樓。二、章程變更：原章程第31條於113年1月7日經法人第3屆第1次會員大會會議決議修正通過，報經主管機關備查。三、董事變更：第2屆董事任期屆滿，改選第3屆董事。四、董事印鑑登記。,,,,
113法登他000291,2,2,趙美玲,1042,1130924,1130924,1130924,18冊37頁,2,5,理事長,社團法人高雄市基督教恩典協會,0970220,高雄市三民區明仁路157號地下一樓,本會以宣揚基督福音，服務社區人群為目的。,會員會費及捐助等,高雄縣政府96年12月18日府社行字第0960283440號函,永久,454100.00,1,1130924,,,,一、理監事變更：第4屆理監事任期屆滿，改選第5屆理監事。二、理監事印鑑登記。,,,,
113法登他000292,2,2,趙美玲,1416,1130924,1130924,1130924,28冊15頁,1,3,理事長,社團法人高雄市不老天使守護協會,1020207,高雄市新興區六合二路86號4樓,本會以推廣愛心服務，有效整合愛心服務資源，推動相關之社會福利之工作，照顧弱勢族群為宗旨。,會費及捐助等,高雄市政府社會局102年1月28日高市社人團字第10230778200號函,永久,6888.00,1,1130924,,,,主事務所變更：原主事務所設於高雄市前鎮區和平二路203號9樓，變更為高雄市新興區六合二路86號4樓。,,,,
113法登他000293,2,2,趙美玲,1208,1130924,1130925,1130925,23冊5頁,2,5,理事長,社團法人高雄市資訊培育協會,0990809,高雄市三民區堯山街8號,以研究並推廣如何善用資訊科技，培育E世代人才為宗旨。,會費及捐助,高雄市政府社會局97年6月9日高市社局一字第0970023126號函,永久,30000.00,1,1130925,,,,一、理監事變更：第4屆理監事任期屆滿，改選第5屆理理監事。二、理監事印鑑登記。,,,,
113法登他000294,2,2,趙美玲,2285,1130925,1130927,1130927,50冊7頁,2,3,理事長,社團法人高雄市荷馨關懷協會,1070815,高雄市三民區博愛一路366號14樓之H區5室,以確保台灣孩童的福祉為宗旨。,會費及捐款等,高雄市政府社會局中華民國107年7月31日高市社人團字第10735864800號函,永久,163944.00,1,1130927,,1131007,,一、主事務所變更：原主事務所設於高雄市左營區南屏路266之1號12樓，變更為三民區博愛一路366號14樓之H區5室。二、章程變更：原章程第7、17、25、26、29、31、34條於113年7月21日經法人第3屆第1次會員大會會議決議修正通過，報經主管機關備查。三、理監事變更：第2屆理監事任期屆滿，改選第3屆理監事。四、理監事印鑑登記。,,,,
113法登他000295,2,2,趙美玲,1549,1131007,1131014,1131014,31冊28頁,2,3,理事長,社團法人高雄市養生保健管理學會,1030916,高雄市三民區建國三路515號2樓,為非醫療執行單位，對內、對外不執行醫療業務，專門研究人類養生保健、健康管理、長期照護、醫學美容、促進人類（含原、新住民）健康與預防疾病為主要任務，發展暨推廣醫美保健、促進健康與長期照護教育訓練，與國內外有關機構團體之聯繫與研究並建構社區衞教預防保健。,會費及捐助,高雄市政府社會局103年7月1日高市社人團字第10335510300號函,永久,49751.00,1,1131014,,,,一、理監事變更：第2屆理監事任期屆滿，改選第3屆理監事。二、理監事印鑑登記。,,,,
113法登他000296,1,2,趙美玲,1676,1131007,1131008,1131008,34冊35頁,1,2,董事長,財團法人台灣基督全牧教會,1050307,高雄市苓雅區苓雅一路195號6樓,本於基督十字架上的捨己與真愛精神，在高雄市傳揚基督教義與耶穌的福音，辦理教會濟助事項。,由趙繼剛捐贈新台幣陸佰柒拾萬元。,高雄市政府民政局104年11月30日高市民政宗字第10432681900號、105年3月3日高市民政宗字第10530373200號函,永久,11352977.00,1,1131008,,1131015,,"財產總額變更：原財產總額為新台幣6,700,000元整，變更為新台幣11,352,977元整。",,,,
113法登他000298,1,2,趙美玲,1839,1131008,1131009,1131009,38冊38頁,1,2,董事長,財團法人高雄市台塑王氏昆仲公園文化基金會,1070712,高雄市前鎮區中山三路39號,保存與維護文化資產、辦理文化活動及推展文化建設。,捐助,高雄市政府文化局中華民國107年6月15日高市文發字第10730995700號函,永久,23075348.00,1,1131009,,,,一、董事變更：第2屆任期內董事長林健男辭任，推派林善志繼任、董事王妙珍因職務異動，改派林燦銘接任，另指派郭文筆為新任董事。二、新任董事長、董事印鑑登記。,,,,
113法登他000299,2,2,趙美玲,2033,1131008,1131009,1131009,43冊32頁,2,3,理事長,社團法人高雄市幸福永續協會,1091119,高雄市鹽埕區七賢二路472號8樓,以關懷弱勢族群，老人之生活。推動營造社區弱勢族群，老人之樂活健康教育為宗旨。,會費及捐助等,高雄市政府社會局中華民國109年11月9日高市社人團字第10939360000號,永久,50000.00,1,1131009,,,,一、理監事變更：第2屆理監事任期屆滿，改選第3屆理監事。二、理監事印鑑登記。,,,,
