登記案號,類別,案由,主任,登記號數,收件日期,登記日期,公告日期,登記簿,任期判定,屆期判定,法人代表,法人名稱,設立登記日期,主事務所,目的,捐助方法,許可機關日期,存立時期,財產總額,結案原因,結案日期,歸檔日期,發證日期,清算人,變更原因,註銷日期,撤銷日期,撤(註)銷機關文號,撤(註)銷原因
113法登社000001,2,1,張惠芳,2395,1130104,1130104,1130108,68冊2頁,,,賴彥光,社團法人ESG全方位發展協會,1130104,新北市新莊區化成路431巷42號,以致力於實踐ESG企業永續發展的核心理念，以共同形塑更美好的未來為發展目標。秉持誠信、正直、公平的原則，發展1.氣候、生態及環境的保護；2.人權、性平、友善職場的支持；3.企業管理與經營、風險評估、治理結構的透明度，相關之產學研討、國際交流、資訊分享、認證課程等，落實關鍵指標:環境保護(Environmental)、社會責任(Social)和公司治理(Governance)三個企業永續的維度為宗旨。,入會費、常年會費、事業費、會員捐款、委託收益、基金及其孳息、其他收入,內政部中華民國112年12月5日台內團字第1120051294號函,永久,2000.00,1,1130104,,,,,,,,
113法登社000002,2,1,張惠芳,2396,1130104,1130104,1130108,68冊3頁,,,陳敏嘉,社團法人臺灣跨性別醫學學會,1130104,新北市板橋區陽明街16號,以增進跨性別醫學相關之研究與發展，促進國內外相關性別醫學機構及團體交流，共同維護性別正義及和諧發展為宗旨。,入會費、常年會費、事業費、會員捐款、委託收益、基金及其孳息、其他收入,內政部中華民國112年11月6日台內團字第1120046910號函,永久,1000.00,1,1130104,,,,,,,,
113法登社000003,2,1,張惠芳,2397,1130104,1130104,1130108,68冊4頁,,,林玉貽,社團法人台灣澤千普賢聞思修學會,1130104,新北市中和區中正路167巷64號9樓,以推廣佛陀顯密教法，令佛陀慈悲及智慧之學普澤十方，提升人民心靈素養為宗旨。,入會費、常年會費、事業費、會員捐款、委託收益、基金及其孳息、其他收入,內政部中華民國112年11月23日台內團字第1120050227號函,永久,1000.00,1,1130104,,,,,,,,
113法登社000004,2,1,張惠芳,2398,1130110,1130110,1130112,68冊5頁,,,林文錡,社團法人臺灣咪可思協會,1130110,新北市三重區重陽路1段60巷32號1樓,本會為依法設立，非以營利為目的之公益性社會團體，並以提供流浪動物關懷照顧、資源聯結以及配合政府相關動保議題宣導及社會倡議為宗旨。,入會費、常年會費、事業費、會員捐款、委託收益、基金及其孳息、其他收入,內政部中華民國112年12月7日台內團字第1120055109號函,永久,1000.00,1,1130110,,,,,,,,
113法登社000005,2,1,張惠芳,2399,1130111,1130111,1130115,68冊6頁,,,莊天鐘,社團法人新北市新莊赤龍發展協會,1130110,新北市新莊區自立街214巷10弄12號,以弘揚太子爺護土佑民精神、增進鄉里和諧、興辦公益慈善及社會教化事業為宗旨。,入會費、常年會費、事業費、會員捐款、委託收益、基金及其孳息、其他收入,新北市政府中華民國112年12月25日新北府社團字第1122378260號函,永久,1000.00,1,1130111,,,,,,,,
113法登社000006,2,1,張惠芳,2400,1130118,1130118,1130122,68冊7頁,,,林志偉,社團法人新北市義福慈善關懷協會,1130118,新北市蘆洲區中山二路300巷8號2樓,以「義不容辭、造福人群」之團結互助行善服務，熱心參與公益事務，善盡社會責任為宗旨。,入會費、常年會費、事業費、會員捐款、委託收益、基金及其孳息、其他收入,新北市政府中華民國112年12月21日新北府社團字第1122391518號函,永久,1000.00,1,1130118,,,,,,,,
113法登社000007,2,1,張惠芳,2402,1130124,1130124,1130126,68冊9頁,,,梁林玉蘭,社團法人中華本智圓林佛學會,1130124,新北市板橋區文化路1段309之35號5樓,"以弘揚佛陀 釋迦牟尼教法，護持宇宙萬物生命為主要任務，供發心人士一平台，希望秉持利美運動的精神，倡辦各種公益慈善事業，護生活動，佛法宣講等，以促進社會進步、和諧、達到利益眾生、淨化生活環境、倡議慈悲濟世及推廣佛行事業為宗旨。",入會費、常年會費、事業費、會員捐款、委託收益、基金及其孳息、其他收入,內政部中華民國112年11月27日台內團字第1120052111號函,永久,1000.00,1,1130124,,,,,,,,
113法登社000008,2,1,張惠芳,2403,1130124,1130124,1130126,68冊10頁,,,梁嘉哲,社團法人新北市永鎮劉府元帥協會,1130124,新北市板橋區長安街331巷73號,本會以發展宣揚劉府元帥，崇揚武德盛行仁慈精神，及發揚社會善良風俗，發揮社會急難救助為宗旨。,入會費、常年會費、事業費、會員捐款、委託收益、基金及其孳息、其他收入,新北市政府中華民國113年1月19日新北府社團字第1122533100號函,永久,5000.00,1,1130124,,,,,,,,
113法登社000009,2,1,張惠芳,2405,1130125,1130125,1130129,68冊11頁,,,盧清芳,社團法人台灣越南佛教交流協會,1130125,新北市泰山區辭修路36巷6弄18號,以弘揚佛法以智慧.慈悲的精神.淨化人心.利益社會並普渡眾生.發揮佛性已達宗教大同.世界和平為宗旨。,入會費、常年會費、事業費、會員捐款、委託收益、基金及其孳息、其他收入,內政部中華民國106年6月29日台內團字第1060037474號函,永久,235683.00,1,1130125,,,,,,,,
113法登社000010,2,1,張惠芳,2406,1130125,1130125,1130129,68冊12頁,,,張晃彰,社團法人新北市一貫道天滋推廣協會,1130125,新北市三重區成功路127號2樓,本會為恭奉一貫道主神明明上帝，以宏揚一貫道宗旨「挽世界為清平，化人心為良善，冀世界為大同」為宗旨。,入會費、常年會費、會員捐款、基金及其孳息、其他收入,新北市政府中華民國111年6月23日新北府社團字第1111159428號函,永久,145000.00,1,1130125,,,,,,,,
113法登社000011,2,1,張惠芳,2407,1130126,1130126,1130123,68冊13頁,,,施顏祥,社團法人台灣紡織產業永續發展策進會,1130126,新北市土城區承天路6號,以促進永續性紡織品相關產業之合作，以達共榮發展之目的為宗旨。,入會費、常年會費、事業費、會員捐款、委託收益、基金及其孳息、其他收入,內政部中華民國112年9月8日台內團字第1120039188號函,永久,653214.00,1,1130126,,,,,,,,
113法登財000001,1,1,張惠芳,2404,1130124,1130124,1130126,68冊11頁,,,黃國明,財團法人新北市太陽之子教育基金會,1130124,新北市板橋區華江一路166號10樓,本會以提昇教育水準、推動社會公益活動、捐助獎學金及品格教育養成為目的。,由黃國明捐助。,新北市政府教育局中華民國113年1月18日新北教社字第1130024803號函,永久,5000000.00,1,1130124,,,,,,,,
