登記案號,類別,案由,主任,登記號數,收件日期,登記日期,公告日期,登記簿,任期判定,屆期判定,法人代表,法人名稱,設立登記日期,主事務所,目的,捐助方法,許可機關日期,存立時期,財產總額,結案原因,結案日期,歸檔日期,發證日期,清算人,變更原因,註銷日期,撤銷日期,撤(註)銷機關文號,撤(註)銷原因
113法登他000046,1,2,全國榮,153,1130426,1130426,1130426,6冊8頁,1,7,蘇政君,財團法人屏東縣私立椰子園老人養護之家,0880526,屏東縣長治鄉繁昌村振興路16之9號,"1.依老人福利法規定辦理之養護機構。
2.依老人福利法的規定舉辦老人福利慈善事業。
3.關於志願服務之辦理及推廣事項。
4.關於接受政府機關指導委辦各項社會福利服務事項。
5.關於老人住院醫療照顧服務事項。
6.關於人力資源培訓、媒合、派遣暨承攬等業務執行事項。
7.有關社會福利慈善事業事項。
8.有關長期照顧服務事項",由蘇玉霖、王青茂、陳慶林、賴平妹、陳志樑、蕭玲珍等人捐助,臺灣省屏東縣政府，八十八年四月廿三日，八八屏府社福字第七０四五七號,永久,90649837.00,1,1130426,,,,捐助章程第5條修正，經主管機關中華民國113年4月18日屏府長機字第11316309300號函同意備查。,,,,
113法登他000047,2,2,全國榮,187,1130501,1130501,1130502,8冊5頁,2,12,陳來福,社團法人屏東縣原住民文教協會,0901120,屏東縣霧台鄉霧台村魯凱街200號,本會以熱愛原住民文化為精神，並按有關法令規定，辦理公益性文化及教育事務為宗旨。,會員會費,屏東縣政府，中華民國九十年十月十六日，九十屏府社政字第167440號函,永久,20000.00,1,1130501,,,,新任理、監事印鑑。,,,,
113法登他000048,2,2,全國榮,281,1130502,1130502,1130502,12冊19頁,1,9,鄭君穎,社團法人中華溝通分析協會,0891123,屏東縣屏東市勝利里廣東路944號14樓之2,為增進溝通分析學派之實務運用及教育訓練，並充分運用於華人之社會福利與社會工作服務等相關工作，特成立中華溝通分析協會,入會費、常年會費、事業費、會員捐款、委託收益、基金孳息、其他收入。,內政部中華民國87年12月10日台（87）內社字第8739674號函。,永久,129092.00,1,1130502,,,,,,,,
113法登他000049,1,2,全國榮,732,1130507,1130507,1130507,35冊11頁,1,7,杜勇雄,財團法人天主教會高雄教區山地教會,0811130,屏東縣泰武鄉佳平村1鄰佳平巷16-1號,向山地原住民宣揚天主教教義及辦理社會公益慈善教育等事業並協助政府改善山地原住民生活品質，提升道德及教育水準為目的,由財團法人天主教會高雄教區撥贈,台灣省政府民政廳民國81年11月10日民五字第26267號,永久,20358298.00,1,1130507,,,,,,,,
113法登他000050,1,2,全國榮,46,1130507,1130507,1130507,2冊3頁,2,4,蘇兩文,財團法人台灣省屏東縣基督教新生會潮州教會,0680728,屏東縣潮州鎮信義路三五號,宣揚基督福音，辦理慈善事業，社會福利公益為目的。,由基督徒捐助,屏東縣政府，六十七年六月五日，屏民行字第四六八七五號,永久,689893.00,1,1130507,,,,新任董事印鑑。,,,,
113法登他000051,1,2,全國榮,35,1130508,1130508,1130508,1冊19頁,1,16,黃建清,財團法人臺灣省屏東縣私立日新高級工商職業學校,0620522,屏東縣潮州鎮太平路224號,協助政府發展職業教育培養工商企業人才,由董事會捐助,臺灣省政府教育廳五十八年十月十七日教三字第75677號函,永久,144700040.00,1,1130508,,,,,,,,
113法登他000052,2,2,全國榮,678,1130509,1130509,1130509,32冊17頁,2,2,黃宗煌,社團法人中華永續職能訓練教育協會,1100409,屏東縣屏東市北平路20號1樓,本會為依法設立、非以營利為目的之公益性社會團體，以結合各界資源，從事職訓教育的研究、實施、推展與辦理及促進就業機會為宗旨,入會費、常年會費,內政部中華民國110年3月19日台內團字第1100015183號函,永久,210000.00,1,1130509,,,,"新任理、監事印鑑。
圖記變更。
組織章程第1條、第3條、第4條修正，經主管機關中華民國113年4月15日台內團字第1130281864號函予以備查。",,,,
113法登他000053,2,2,全國榮,588,1130509,1130509,1130509,28冊7頁,2,5,胡政雄,社團法人屏東縣糖業從業退休人員協會,1060522,屏東縣屏東市建華一街122號,本會為依據人民團體法設立、非以營利為目的之社會團體，是以服務、聯絡感情、照顧會員為宗旨。,會員入會費、常年會費、會員、地方人士捐款。,屏東縣政府中華民國101年7月18日屏府社政字第10122701000號函,永久,70000.00,1,1130509,,,,"新任理、監事印鑑。
組織章程第6條修正，經主管機關中華民國113年3月21日屏府社政字第11310226100號函同意備查。",,,,
113法登他000054,2,2,全國榮,188,1130516,1130516,1130516,8冊6頁,1,9,簡忠成,社團法人屏東縣海青青弘會,0901205,屏東市建國路42之1號,本會係由一群聚小愛的人們組成，將小愛化成一股大愛的力量，秉著人飢己飢、人溺己溺，以慈悲為懷熱心奉獻的精神，關懷我們的社會，服務人群，並散播快樂的種子，發芽於台灣這塊土地上。,會員會費等,屏東縣政府九十年四月十六日九十屏府社政字第五六二八四號函,永久,100000.00,1,1130516,,,,組織章程第5條修正，經主管機關113年4月8日屏府社政字第11313902600號函同意備查。,,,,
113法登他000055,2,2,全國榮,745,1130520,1130520,1130520,36冊4頁,1,,江金美,社團法人屏東縣牽守關懷協會,1130129,屏東縣潮州鎮蓬萊里榮田路102巷2-3號,秉持以家庭為中心的兒少全人照顧之社會工作理念，透過關懷和支持服務，促進兒少身心發展和成長，培力家庭發揮照顧教養功能，以守護兒少及家庭的權益與福祉為宗旨,入會費、常年會費、事業費、會員捐款、委託收益、基金及其孳息、其他收入,屏東縣政府中華民國113年1月3日屏府社政字第11274270800號函,永久,30000.00,1,1130520,,,,圖記變更。,,,,
113法登他000056,2,2,全國榮,574,1130521,1130521,1130521,27冊13頁,1,9,廖士昌,社團法人屏東縣長期照護發展協會,1051109,屏東縣屏東市崇蘭里崇朝一路56號1樓,本會為依法設立，非以營利為目的之社會團體，以服務全縣從事長期照護之機構及人員，配合政府推動相關福利法令；在主管機關指導下，結合社會資源，提昇長期照護品質，給予會員必要的支援與服務為宗旨。,會員入會費、常年會費,屏東縣政府中華民國93年11月29日屏府社政字第0930222999號函,永久,10000.00,1,1130521,,,,會址變更。,,,,
113法登他000057,1,2,全國榮,56,1130523,1130523,1130523,2冊14頁,2,11,潘慶士,財團法人台灣省屏東縣東港東隆宮,0730705,屏東縣東港鎮東隆里東隆街21之1號,奉祀溫府王爺為主神、闡揚我國傳統正道及興辦公益慈善事業，策進國泰民安，樂利民生為宗旨。,以原東隆宮所有財產及其孳息捐助之,台灣省屏東縣政府，中華民國六十六年一月十一日，屏府民行字第一０九五０七號,永久,730342014.40,1,1130523,,,,新任董、監事印鑑。,,,,
113法登他000058,1,2,全國榮,247,1130524,1130524,1130524,11冊13頁,2,7,莊輝煌,財團法人漢景建築文化藝術基金會,0950124,屏東縣屏東市公益街37號,"宣導正確良善的人本觀念，打造優質美好的永續環境，結合有志之士追求人本永續的
美好新世界",由漢景人文建築有限公司捐助,屏東縣政府中華民國94年12月21日屏府文推字第0940238919號,永久,2000000.00,1,1130524,,,,新任董事印鑑。,,,,
113法登他000059,1,2,全國榮,52,1130527,1130527,1130527,2冊9頁,2,8,林嘉申,財團法人屏東縣後備軍人獎學金基金會,0790907,屏東市建國路239號,以獎助後備軍人(子女)努力向學為宗旨,由社會人士捐助,屏東縣政府89.6.21(89)屏府教社字第九七八二七號,永久,5746000.00,1,1130527,,,,"新任董事印鑑。
圖記變更。",,,,
113法登他000060,1,2,全國榮,97,1130528,1130528,1130528,3冊26頁,2,11,康美珠,財團法人屏東縣慧光圓通普賢文教基金會,0830711,屏東縣鹽埔鄉鹽中村勝利路卅一號,宏揚人間觀音行精神，推展佛教淨化社會及教化人心工作，建立一個具有菩薩心、生命共同體的祥和社會。,由康美珠等六人捐助,台灣省屏東縣政府，八十三年七月一日，屏府教社字第九六三九一號,永久,2000000.00,1,1130528,,,,新任董事印鑑。,,,,
113法登他000061,1,2,全國榮,355,1130529,1130529,1130529,16冊14頁,2,6,蔣龍煌,財團法人屏東基督教日光園,0980406,屏東縣屏東市瑞光里香揚巷1-6號,為宣揚基督教義，發揮宗教仁愛精神及興辦社會公益慈善業務。,由財團法人台灣基督長老教會屏東中會捐贈,屏東縣政府中華民國98年3月30日屏府民禮字第0980063760號函,永久,74714742.00,1,1130529,,,,"新任董事印鑑。
捐助暨組織章程第14條修正，經本院113年度法字第4號裁定准予變更。",,,,
113法登他000062,2,2,全國榮,723,1130603,1130603,1130603,35冊2頁,1,1,江貴添,社團法人屏東縣寵物食品及用品商業同業公會,1120427,屏東縣屏東市自由路250號,推廣國內外貿易、促進經濟發展、協調同業關係、增進同業共同利益及矯正弊害為宗旨,會費、捐款、其他收入等,屏東縣政府中華民國112年3月29日屏府社政字第11211882900號函,永久,55800.00,1,1130603,,,,"繼任監事印鑑。
組織章程第18條、第31條、第36條、第42條、第44條、第47條修正，經主管機關113年3月26日屏府社政字第11312985500號函同意備查。",,,,
113法登社000001,2,1,全國榮,743,1130105,1130105,1130105,36冊2頁,,,李清光,社團法人屏東縣屏東市菩薩流浪狗協會,1130105,屏東縣屏東市三山33-6號,本會為依法設立、非以營利為目的之社會團體，以推廣屏東縣市保護流浪狗為宗旨,會員費及常年費,屏東縣政府中華民國112年9月15日屏府社政字第11256537000號函,永久,10000.00,1,1130105,,,,,,,,
113法登社000002,2,1,全國榮,744,1130111,1130111,1130111,36冊3頁,,,林慶穎,社團法人毛小孩動物保謢協會,1130111,屏東縣潮州鎮吉祥路23號,本會為依法設立、非以營利為目的之公益性社會團體，以秉持保護及關懷流浪動物之信念，舉辦宣導活動將傳遞正確愛護動物觀念，設置友善餵食環境，救助受傷流浪貓犬，讓更多善心人士加入保護流浪動物行列為宗旨,一、入會費。二、常年會費。三、事業費。四、會員捐款。五、委託收益。六、基金及其孳息。七、其他收入,內政部中華民國112年12月8日台內團字第1120056522號函,永久,1000.00,1,1130111,,,,,,,,
113法登社000003,2,1,全國榮,745,1130129,1130129,1130129,36冊4頁,,,江金美,社團法人屏東縣牽守關懷協會,1130129,屏東縣潮州鎮蓬萊里榮田路102巷2-3號,秉持以家庭為中心的兒少全人照顧之社會工作理念，透過關懷和支持服務，促進兒少身心發展和成長，培力家庭發揮照顧教養功能，以守護兒少及家庭的權益與福祉為宗旨,入會費、常年會費、事業費、會員捐款、委託收益、基金及其孳息、其他收入,屏東縣政府中華民國113年1月3日屏府社政字第11274270800號函,永久,30000.00,1,1130129,,,,,,,,
113法登社000004,2,1,全國榮,746,1130206,1130206,1130206,36冊5頁,,,陳慧娟,社團法人臺灣老年人體育生態推廣協會,1130206,屏東縣車城鄉海口路6-5號,本會以推廣老年人體育養生，普及科學健身。搭配海洋生態觀光，於休閒活動研習中，傳播海洋環境之美為宗旨,入會費、常年會費、事業費、會員捐款、委託收益、基金及其孳息、其他收入,內政部中華民國113年1月23日台內團字第1130001300號函,永久,0.00,1,1130206,,,,,,,,
113法登社000005,2,1,全國榮,747,1130418,1130418,1130418,36冊6頁,,,詹博娜,社團法人屏東縣毛孩依生協會,1130418,屏東縣佳冬鄉豐隆村西昌路30-90號,以連結愛狗人士、結合社會資源，讓無助的狗找到幸福的家為宗旨,會員入會費、會員常年會費、政府補助、企業贊助、個人贊助,屏東縣政府中華民國113年3月19日屏府社政字第11309030000號函,永久,0.00,1,1130418,,,,,,,,
