登記案號,類別,案由,主任,登記號數,收件日期,登記日期,公告日期,登記簿,任期判定,屆期判定,法人代表,法人名稱,設立登記日期,主事務所,目的,捐助方法,許可機關日期,存立時期,財產總額,結案原因,結案日期,歸檔日期,發證日期,清算人,變更原因,註銷日期,撤銷日期,撤(註)銷機關文號,撤(註)銷原因
113法登他000089,2,2,全國榮,332,1130718,1130718,1130718,15冊11頁,2,9,劉健誼,社團法人中華民國農科園區產學協會,0970407,屏東縣長治鄉德和村神農路1號,結合大專院校、研究機構、農業生物科技園區相關主管機關及園區事業共同推動產學研究合作及人才培訓，提昇國內農業生物科技產業競爭力為宗旨。,出資及捐助,內政部中華民國97年3月5日台內社字第0970033966號函,永久,780000.00,1,1130718,,,,"新任理、監事印鑑。
組織章程第17條修正，經主管機關113年5月22日台內團字第1130013058號函予以備查。",,,,
113法登他000090,2,2,全國榮,666,1130731,1130731,1130731,32冊5頁,2,2,陳勤華,社團法人屏東縣科技農業植保機協會,1090811,屏東縣內埔鄉老埤村壽比路258號,本會為依法設立、非以營利為目的之社會團體，本會為以促進科技農業之進步，並以專業知識及安全合法用藥，保護農民與業者，以達到雙贏之目標，推廣農業植保機於相關產業之應用，教育植保機相關人員操控技能及作業知識，宣導安全應用之規範及調度各鄉鎮市植保機作業能量，促進農業科技化及有效防治病蟲害為宗旨,一、入會費二、常年會費三、事業費四、會員捐款五、委託收益六、基金及其孳息七、其他收入,屏東縣政府中華民國109年6月12日屏府社政字第10920991200號函,永久,0.00,1,1130731,,,,"新任理、監事印鑑。
組織章程第30條修正，經主管機關112年3月22日屏府社政字第11209294300號函同意備查。",,,,
113法登他000091,1,2,全國榮,255,1130802,1130802,1130802,11冊9頁,2,7,黃秀治,財團法人屏東縣私立青山育幼院,0941109,屏東縣高樹鄉新豐村沿山公路1段110號,非營業為目的之兒童及少年教養機構，以增進兒童及少年福利、健全兒童及少年身心發展，及救助社會弱勢團體。,1.基金孳息2.辦理福利服務活動之收入3.捐助收入4.政府機關之補助,屏東縣政府94年10月21日屏府社福字第0940204229號函,永久,27667500.00,1,1130802,,,,新任董事印鑑。,,,,
113法登他000092,1,2,全國榮,549,1130808,1130808,1130808,26冊8頁,2,3,謝勝信,財團法人屏東縣私立六堆謝申伯宗祠福利基金會,1041202,屏東縣內埔鄉美和村（忠心崙）海平路62號,一、發放敬老金予宗長之老人福利。二、設置獎學金獎助優秀子孫之兒少福利。三、整修祠堂、編修謝氏族譜、舉行春季祭祖典禮。四、發放低收入補助、貧困病患醫療補助。五、接受主管機關指導辦理事項。,由祭祀公業謝申伯捐助現金新台幣壹仟萬元整,屏東縣政府中華民國104年11月9日屏府社長字第10474504200號函,永久,93223311.00,1,1130808,,,,新任董、監事印鑑。,,,,
113法登他000093,1,2,全國榮,38,1130808,1130808,1130808,1冊22頁,2,13,黃奇男,財團法人屏東縣東港朝隆宮,0730916,屏東縣東港鎮朝安里延平路108號,闡揚佛教教義，興辦社會救濟福利事業。,由社會信徒捐獻。,台灣省屏東縣政府中華民國六十三年八月二十九日民行78469號函,永久,5132005.00,1,1130808,,,,新任董、監事印鑑。,,,,
113法登他000094,2,2,全國榮,145,1130809,1130809,1130809,5冊20頁,2,27,陳啓禎,社團法人屏東縣中醫師公會,0871102,屏東市建國里公勇路七十七號十二樓之二,研究發展中醫藥增進社會福祉並謀會員之親睦暨福利。,會費收入、捐助款。,台灣屏東縣政府、八十七年十月廿八日八七屏府社政字第一八五五六八號,永久,378836.00,1,1130809,,,,新任理、監事印鑑。,,,,
113法登他000095,2,2,全國榮,231,1130815,1130815,1130815,10冊9頁,2,9,傅炳山,社團法人屏東縣綠元氣產業交流促進會,0931021,屏東縣鹽埔鄉新二村彭厝路53之4號,促進城鄉發展之工作；拓展地方產業銷售管道及提供相關資訊諮詢服務；加強與社會各界合作關係，整合跨領域專業資源以促進地方經濟活化；協助地方終身學習事務；協助公私部門推動社會福利、文化藝術、產業發展、觀光休閒、水資源保育、環境生態等有助民眾福祉之事項，促進地方和諧發展展。,入會費、常年會費、事業費、會員捐款、委託收益基金及其孳息、其他收入。,屏東縣政府中華民國93年3月15日屏府社字第0930050220號函,永久,24000.00,1,1130815,,,,新任理、監事印鑑。,,,,
113法登他000096,2,2,全國榮,700,1130815,1130815,1130815,33冊19頁,2,3,楊文永,社團法人屏東縣關懷弱勢福利促進協會,1110510,屏東縣東港鎮興東路412號,本會為依法設立、非以營利為目的之社會團體，以促進社會福利發展，辦理社會福利事業，推動社會福利政策，提升弱勢族群福祉為宗旨。,會員會費,屏東縣政府中華民國107年6月28日屏府社政字第10721773600號函,永久,16800.00,1,1130815,,,,"圖記變更。
新任理、監事印鑑。",,,,
113法登他000097,1,2,全國榮,112,1130820,1130820,1130820,2冊16頁,1,13,王傳宇,財團法人屏東縣私立基督教信望愛家園,0841019,屏東縣里港鄉土庫村東榮巷30之6號,"本法人以弘揚耶穌基督大愛，辦理育幼事業及其他社會福利事工為目的。
主要業務為辦理育幼事業及其他社會福利事工。
本法人關於兒童及少年福利各項措施之規劃、執行，及目的業務所稱其他社會福利事工，均受所在地主管機關之監督、輔導、檢查與評鑑，屬屏東縣政府管轄區域。",由創辦人王守信、王祥珍等原始出資並接受基督教徒及社會人士繼續捐助,屏東縣政府中華民國七十三年十二月二十六日,永久,13063120.00,1,1130820,,,,繼任董事印鑑。,,,,
113法登他000098,2,2,全國榮,271,1130820,1130820,1130820,12冊9頁,2,10,李煥源,社團法人屏東縣社區大學文教發展協會,0951205,屏東市北興里公裕街300號,以服務在屏東縣社區大學修課或授課校友教師為目的，聯絡感情，砥礪學行，促進校務發展，協助校友相關事務，並推廣文化教育。,入會費、常年會費、會員捐款、委託收益、基金及其他孳息、收入,屏東縣政府94年2月22日屏府社政字第0940030002號函,永久,229081.00,1,1130820,,,,新任理、監事印鑑。,,,,
113法登他000099,1,2,全國榮,203,1130822,1130822,1130822,9冊1頁,2,7,蕭永忠,財團法人蕭珍記文化藝術基金會,0911004,屏東市崇蘭里六十九號,以從事文化藝術事務等為宗旨。,由蕭珍記祭祀公業捐助。,"屏東縣政府 九十一年九月二十五日 屏府文推字第０九一０一三七三九四號",永久,2000000.00,1,1130822,,,,新任董事印鑑。,,,,
113法登他000100,2,2,全國榮,468,1130822,1130822,1130822,22冊7頁,2,9,王雪玲,社團法人屏東縣九如鄉耆老社區發展協會,1011126,屏東縣九如鄉耆老村中正路1號,本會為依法設立、非以營利為目的之社會團體以促進社區發展，增進居民福利，建設安和融洽，團結互助之現代化社會為宗旨。,會費,屏東縣政府中華民國81年5月16日屏府社政區字第39號函,永久,500000.00,1,1130822,,,,新任理、監事印鑑。,,,,
113法登他000101,1,2,全國榮,542,1130823,1130823,1130823,26冊1頁,2,4,陳國基,財團法人南榮教育基金會,1041001,屏東縣崁頂鄉園寮村田寮路1-15號,本會以集結社會專業人士協助屏東縣教育發展為宗旨，依有關法令規定辦理下列業務：一、推廣辦理各類型學術教育活動及營隊。二、辦理促進社區教育發展之各項講座活動。三、舉辦各項終身學習相關課程，協助民眾提升生活技能。四、其他符合本會設立宗旨之相關公益性事務推展及各類相關性教育活動之辦理。,由梁應鐘、陳國基、陳純婉捐助。,屏東縣政府中華民國104年9月8日屏府教終字第10424618000號函,永久,2000000.00,1,1130823,,,,新任董、監事印鑑。,,,,
113法登他000102,1,2,全國榮,35,1130826,1130826,1130826,1冊19頁,1,16,黃建清,財團法人臺灣省屏東縣私立日新高級工商職業學校,0620522,屏東縣潮州鎮太平路224號,協助政府發展職業教育培養工商企業人才,由董事會捐助,臺灣省政府教育廳五十八年十月十七日教三字第75677號函,永久,145350638.00,1,1130826,,,,,,,,
113法登他000103,1,2,全國榮,229,1130829,1130829,1130829,10冊7頁,2,15,陳宇昭,財團法人伊甸社會福利基金會,0930921,台北市文山區萬美街一段五十五號三樓（分事務所：屏東縣東港鎮中正路一段十之一號）,以舉辦社會福利為目的,由劉俠等人繼續捐助,臺北市政府社會局七十二年三月十九日、北市社四字第九六九九號函,永久,775039856.00,1,1130829,,,,新任董、監事印鑑。,,,,
113法登他000104,1,2,全國榮,2,1130910,1130910,1130910,1冊2頁,2,17,林志明,財團法人台灣省屏東縣潮州三山國王廟,0480623,屏東縣潮州鎮西市路三十三號,確保三山國王廟財產收益及祭祀並興辦公益慈善事業推行文化建設為目的,由信徒自由捐助,台灣省屏東縣政府四十八年三月二十六日屏府民治字第19759號,永久,23188602.00,1,1130910,,,,新任董、監事印鑑。,,,,
113法登他000105,1,2,全國榮,160,1130912,1130912,1130912,6冊15頁,2,8,陳輝龍,財團法人屏東縣私立基督教沐恩之家,0880910,屏東縣內埔鄉大新村20鄰大新路111號,"本法人以辦理社會福利等為宗旨，並傳揚耶穌基督福音，依有關法令規定辦理下列業務：
（一）老人、婦女、兒童及青少年、身心障礙等社會福利服務。
（二）辦理各類型社會福利服務及長期照顧服務之機構。
（三）其他符合本法人設立目的之相關公益活動。",由財團法人中華民國台灣基督教信義會捐助,屏東縣政府　八十八年八月九日　八八屏府社福字第一三九六０二號,永久,36098582.00,1,1130912,,,,新任董事印鑑。,,,,
113法登他000106,2,2,全國榮,238,1130918,1130918,1130918,10冊16頁,2,6,陳建安,社團法人中華萱民會,0940106,屏東市和生路一段14號4樓之1,為秉持善心愛心之服務精神以實現「幼吾幼以及人之幼，老吾老以及人之老」之理想。,社員會費、事業費、會員捐款、委託收益、基金及其孳息。,內政部中華民國93年1月30日台內社字第0930003035號函,永久,102813.00,1,1130918,,,,"新任理、監事印鑑。
組織章程第26條條正，經主管機關 以112年8月28日台內團字第1120034362號函予以備查。",,,,
113法登他000107,2,5,全國榮,450,1130923,1130923,1130924,21冊9頁,1,,阮明帶,社團法人國際獅子會中華民國總會台灣省屏東縣大鵬灣獅子會,1010302,屏東縣林邊鄉仁愛路64-12號,1、發揚人類互助精神。2、增進國際間友好關係。3、尊重自由啟發智慧。4、提昌社會福利。5、促進國家安全。,會費收入及會員捐助。,屏東縣政府中華民國85年4月1日屏府社政換字第1000207844號函,永久,2500000.00,1,1130923,,,劉秋芬,"清算人劉秋芬陳報清算終結事件，業經本院民事庭於113年9月16日屏院昭民玉字第113司司9號准予備查。
本件清算後之資產總額及負債均為零。",,,,
113法登他000108,2,2,全國榮,617,1130925,1130925,1130925,29冊16頁,2,4,吳凰琴,社團法人中華大道協會,1071122,屏東縣南州鄉七塊村復興路1巷12號,為完成大道使命，引傳大道經典、佛規禮節、世法釋解、大道弟子戒律、大道組織管理規範等等，讓居家修行者與出世修行者皆有法統可依循，真實修行，勿忘做人基本價值，以家庭為修行基礎，不取巧迷信，追求信仰而非宗教，無分別修行。,入會費、常年會費、事業費、會員捐款、委託收益、基金及孳息、其他收入,內政部中華民國107年9月28日台內團字第1070060216號函,永久,100000.00,1,1130925,,,,新任理、監事印鑑。,,,,
113法登他000109,1,2,全國榮,476,1130930,1130930,1130930,22冊15頁,1,4,劉侃,財團法人屏東縣私立畢嘉士社會福利基金會,1020306,屏東縣屏東市華盛街45-2號,本會以宏揚基督耶穌救人博愛精神辦理社會福利慈善事業為目的。,個人與企業捐助,屏東縣政府中華民國102年3月5日屏府社長字第10205475600號函,永久,10000000.00,1,1130930,,,,捐助暨組織章程第2條修正，經本院113年度法字第7號裁定准予變更。,,,,
113法登他000110,1,2,全國榮,53,1131007,1131007,1131007,2冊10頁,2,18,蔡文賢,屏榮學校財團法人,0511023,屏東市民學路100號,辦理高級中等學校，並謀其健全發展。,由創辦人蔡江來個人捐助。,台灣省教育廳，中華民國四十六年四月廿九日，四六教三字第二二五四二號,永久,985505209.00,1,1131007,,,,新任董事印鑑。,,,,
113法登社000001,2,1,全國榮,743,1130105,1130105,1130105,36冊2頁,,,李清光,社團法人屏東縣屏東市菩薩流浪狗協會,1130105,屏東縣屏東市三山33-6號,本會為依法設立、非以營利為目的之社會團體，以推廣屏東縣市保護流浪狗為宗旨,會員費及常年費,屏東縣政府中華民國112年9月15日屏府社政字第11256537000號函,永久,10000.00,1,1130105,,,,,,,,
113法登社000002,2,1,全國榮,744,1130111,1130111,1130111,36冊3頁,,,林慶穎,社團法人毛小孩動物保謢協會,1130111,屏東縣潮州鎮吉祥路23號,本會為依法設立、非以營利為目的之公益性社會團體，以秉持保護及關懷流浪動物之信念，舉辦宣導活動將傳遞正確愛護動物觀念，設置友善餵食環境，救助受傷流浪貓犬，讓更多善心人士加入保護流浪動物行列為宗旨,一、入會費。二、常年會費。三、事業費。四、會員捐款。五、委託收益。六、基金及其孳息。七、其他收入,內政部中華民國112年12月8日台內團字第1120056522號函,永久,1000.00,1,1130111,,,,,,,,
113法登社000003,2,1,全國榮,745,1130129,1130129,1130129,36冊4頁,,,江金美,社團法人屏東縣牽守關懷協會,1130129,屏東縣潮州鎮蓬萊里榮田路102巷2-3號,秉持以家庭為中心的兒少全人照顧之社會工作理念，透過關懷和支持服務，促進兒少身心發展和成長，培力家庭發揮照顧教養功能，以守護兒少及家庭的權益與福祉為宗旨,入會費、常年會費、事業費、會員捐款、委託收益、基金及其孳息、其他收入,屏東縣政府中華民國113年1月3日屏府社政字第11274270800號函,永久,30000.00,1,1130129,,,,,,,,
113法登社000004,2,1,全國榮,746,1130206,1130206,1130206,36冊5頁,,,陳慧娟,社團法人臺灣老年人體育生態推廣協會,1130206,屏東縣車城鄉海口路6-5號,本會以推廣老年人體育養生，普及科學健身。搭配海洋生態觀光，於休閒活動研習中，傳播海洋環境之美為宗旨,入會費、常年會費、事業費、會員捐款、委託收益、基金及其孳息、其他收入,內政部中華民國113年1月23日台內團字第1130001300號函,永久,0.00,1,1130206,,,,,,,,
113法登社000005,2,1,全國榮,747,1130418,1130418,1130418,36冊6頁,,,詹博娜,社團法人屏東縣毛孩依生協會,1130418,屏東縣佳冬鄉豐隆村西昌路30-90號,以連結愛狗人士、結合社會資源，讓無助的狗找到幸福的家為宗旨,會員入會費、會員常年會費、政府補助、企業贊助、個人贊助,屏東縣政府中華民國113年3月19日屏府社政字第11309030000號函,永久,0.00,1,1130418,,,,,,,,
113法登社000006,2,1,全國榮,748,1130606,1130606,1130606,36冊7頁,,,莊智中,社團法人屏東縣暗夜微光關懷協會,1130606,屏東縣鹽埔鄉鹽中村民族路95號,本會由一群具有服務熱忱之人士發起，以關注社會多元族群權益保障，包括老人、身心障礙者、兒童、青少年、婦女、中高齡、原住民等多元化、全方位支援與關懷服務，以協助社會服務發展，致力於教育、培力、深耕、落實及發展社會福利服務為使命，依循國家福利政策、結合社會資源、維繫社區網絡及促進社會服務品質為宗旨,會費及捐助等,屏東縣政府中華民國113年4月3日屏府社政字第11312578000號函,永久,1000.00,1,1130606,,,,,,,,
113法登社000007,2,1,全國榮,749,1130701,1130701,1130701,36冊8頁,,,蔡信全,社團法人屏東縣內埔鄉大新自來水發展協會,1130701,屏東縣內埔鄉大新村大新路759號,以維護水資源為宗旨,事業費、存款利息收入、會員捐款及其他收入,屏東縣政府中華民國113年5月10日屏府社政字第11317242000號函,永久,10000.00,1,1130701,,,,,,,,
113法登社000008,2,1,全國榮,750,1130718,1130718,1130718,36冊9頁,,,陳依睿,社團法人屏東縣內埔鄉鎮南羅聖堂慈善會,1130718,屏東縣內埔鄉內田村崇文巷46-1號,本會依法設立、非營利為目的之社會團體，以結合各慈善團體之力量，共同解決社會急難救助，並發揮人溺己溺、人飢己飢、助人為快樂之本之精神辦理各項慈善工作為宗旨,入會費、常年會費、事業費、會員捐款、委託收益、基金及其孳息、其他收入,屏東縣政府中華民國113年7月4日屏府社政字第1130040908號函,永久,12000.00,1,1130718,,,,,,,,
113法登社000009,2,1,全國榮,751,1130805,1130805,1130805,36冊10頁,,,顏銘志,社團法人屏東縣綠色能源發展協會,1130805,屏東縣枋寮鄉中興路22-16號,本會為依法設立、非以營利為目的之社會團體，以環境保護作為宗旨發展綠色能源，建構縣民、政府、業者三者之間的良好溝通與合作平臺，並配合政府主管機關舉辦綠色能源教育及推廣交流活動、推動社區環保、節能減碳，美化環境之活動，增進民間對綠能之認識,入會費、常年會費、事業費、會員捐款、委託收益、基金及其孳息、其他收入,屏東縣政府中華民國113年4月16日屏府社政字第11314756700號函,永久,600000.00,1,1130805,,,,,,,,
113法登社000010,2,1,全國榮,752,1130906,1130906,1130906,36冊11頁,,,竇煜翔,社團法人中華民國護育生態教育協會,1130906,屏東縣潮州鎮潮州路762號,推廣環境教育相關之業務、提供動物收容急救醫療之功能，保護動物及環境、復育原生物種棲地之生態,一、入會費。二、常年會費。三、事業費。四、會員捐款。五、委託收益。六、基金及其孳息。七、其他收入,內政部中華民國112年9月21日台內團字第1120038169號函,永久,44606.00,1,1130906,,,,,,,,
113法登社000011,2,1,全國榮,753,1131009,1131009,1131009,36冊12頁,,,盧三娘,社團法人屏東縣屏東市正心慈愛會,1131009,屏東縣屏東市中華路164巷10號,非以營利為目的之社會團體，以正心、正理、正念為宗旨,入會費、常年會費、事業費、會員捐款、委託收益、基金及孳息、其他收入,屏東縣政府中華民國113年9月11日屏府社政字第1130087651號函,永久,8800.00,1,1131009,,,,,,,,
