登記案號,類別,案由,主任,登記號數,收件日期,登記日期,公告日期,登記簿,任期判定,屆期判定,法人代表,法人名稱,設立登記日期,主事務所,目的,捐助方法,許可機關日期,存立時期,財產總額,結案原因,結案日期,歸檔日期,發證日期,清算人,變更原因,註銷日期,撤銷日期,撤(註)銷機關文號,撤(註)銷原因
113法登他000211,1,2,鄭秀美,1036,1130715,1130715,1130717,66冊6頁,2,4,徐富榮,財團法人台南市樂扶社會福利慈善事業基金會,1030429,台南市南區永成路三段365號1-3樓,一、關於身心障礙福利服務事項。二、關於老人福利服務事項。三、關於嬰幼兒福利服務事項。四、關於兒童福利服務事項。五、關於青少年福利服務事項。六、關於婦女福利服務事項。七、關於各項急難救助服務事項。八、關於低收入戶補助服務事項。九、關於清寒獎助學金服務事項。十、關於貧困病患醫療補助服務事項。十一、關於推動家庭教育福利服務事項。十二、關於附設社會福利慈善事業機構事項。十三、關於志願服務之辦理及推廣事項。十四、接受政府或主管機關指導辦理各項社會福利服務事項。十五、其他有關社會福利慈善事業事項。,現金捐助：劉陳素琴肆佰萬元、徐富榮陸佰萬元。,臺南市政府社會局103年4月24日南市社助字第1030375348號函。,永久,10000000.00,1,1130715,,,,"第3屆董事任期屆滿，改選第4屆董事。
代表法人之董事：徐富榮。
全體董事印鑑。
法人主事務所變更：新址為台南市南區永成路三段365號1-3樓。
法人捐助章程變更：經臺南市政府社會局113年7月9日南市社助字第1130966685號函同意辦理，變更內容詳如捐助章程修正條文對照表所載。",,,,
113法登他000212,1,2,鄭秀美,1048,1130716,1130716,1130718,66冊17頁,2,4,姜丁興,財團法人台南市釋甘如社會福利慈善事業基金會,1030624,台南市下營區營前里中華街1巷1號,一、慈善救濟。二、接受主管機關指導辦理事項。三、其他有關社會福利慈善事業事項。,釋甘如老和尚捐助新台幣壹仟萬元整。,臺南市政府社會局103年6月6日南市社助字第1030500716號函,永久,24000000.00,1,1130716,,,,"第3屆董事任期屆滿，改選第4屆董事。
代表法人之董事：姜丁興。
全體董事印鑑。",,,,
113法登他000213,2,2,鄭秀美,1552,1130716,1130716,1130718,92冊2頁,1,1,王函玉,社團法人直貢噶舉開慧眼佛學會,1120706,台南市安南區長和路一段587號,本會為依法設立、非以營利為目的之公益性社會團體，以弘揚佛法，學習正道；以正道次第，弘法佈道；以同體大悲，利益眾生；以菩薩願力，關懷社會；實踐佛化人生及淨化人心為宗旨。,一、入會費。二、常年會費。三、事業費。四、會員捐款。五、委託收益。六、基金及其孳息。七、其他收入。,內政部中華民國112年5月31日台內團字第1120026222號,永久,0.00,1,1130716,,,,"法人主事務所變更：新址為台南市安南區長和路一段587號。
第1屆理事陳郁婷、何續惠、魏昱紘、陳宥樺辭任，補選理事。
新任理事印鑑。",,,,
113法登他000214,2,2,鄭秀美,901,1130717,1130717,1130719,60冊1頁,2,7,蔡清源,社團法人台南市普濟堂法雨佛學會,1000926,台南市安平區府平路560號,一、弘揚佛法，淨化人心二、關懷弱勢，濟弱扶傾三、建立會員之間的聯繫事宜四、籌措經費以建立普濟寺五、提供外埠宗教性參訪有關訊息及協助六、其他符合本會宗旨之事宜七、配合政府協辦公益活動。,入會費、常年會費、會員捐款、委託收益、基金及其孳息、其他收入。,"台南市政府  100年9月16日府社行字第1000716454號",永久,950420.00,1,1130717,,1130726,,"第6屆理監事任期屆滿，改選第7屆理監事。
代表法人之理事：蔡清源。
全體理監事印鑑。",,,,
113法登他000215,1,2,鄭秀美,1330,1130719,1130719,1130723,80冊16頁,2,2,羅昭彥,財團法人台南市祭祀公業羅寓,1090212,台南市學甲區中山路47號,本法人本於紀念開台始祖「羅寓公」及祭祀歷代祖先、闡揚祖德、敦睦宗誼、弘揚孝道、增進宗親福利，並維護善良風俗、安定社會為宗旨。,由「祭祀公業法人台南市羅寓」解散轉捐助設立,臺南市政府109年2月6日南市民宗字第1090108624號,永久,16825485.00,1,1130722,,,,"第1屆董事、監察人任期屆滿，改選第2屆董事、監察人。
代表法人之董事：羅昭彥。
全體董事、監察人印鑑。
法人捐助章程變更：經本院113年度法字第17號民事裁定確定變更，變更內容詳如捐助章程修正條文對照表所載。",,,,
113法登他000216,1,2,鄭秀美,138,1130722,1130722,1130724,11冊7頁,2,2,楊秀敏,財團法人進學正宗圖書館文教基金會,0750618,台南市中西區南寧街47號,"本會為感念進學國校鄧正宗老師教導之恩，擴增學校圖書增強後輩學子讀書環境與風氣，培養學生美術寫作、語文、音樂、運動等技能為        宗旨",由進學國民學校四十一年度畢業生陳由豪捐贈玖佰萬元其他壹佰萬元,七十五年六月四日台南市政府，南市教國字第０九一八七號,永久,10000000.00,1,1130722,,,,"法人印信（圖記）變更。
第1屆董事任期屆滿，改選第2屆董事。
代表法人之董事：楊秀敏。
法人印信（圖記）、全體董事印鑑。",,,,
113法登他000217,2,2,鄭秀美,745,1130723,1130723,1130725,52冊8頁,2,5,陳葦芸,社團法人臺南市教師會,0970922,台南市永康區中華二路358巷26號,本會以維護教師專業尊嚴，保障學生受教權，並藉由推動教育改革成功，以提昇教育品質為宗旨。本會之任務如下：一、維護教師專業尊嚴與專業自主權。二、與本市教育局協議教師聘約準則。三、研究並協助解決各項教育問題。四、監督離職給付機構之管理、營運、給付等事宜。五、派出代表參與教師聘任、申訴及其他與教師有關之法令組織。六、制定教師自律公約。七、推動教育改革成功，以保障學生受教權。八、辦理各項教師所需要的服務活動。九、與本市各社會團體、機構之溝通、聯繫。十、與各地區教師會之合作與聯繫。十一、與國內外學術團體之學術交流。十二、接受會員教師委託，提起團體訴訟。,一、會費：1.同時加入本會與臺南市教育產業工會之會員，本會酌收會費200元整。2.非臺南市教育產業工會之會員每人年費1500元(包含上繳中華民國全國教師會會費，並隨上繳會費異動而調整之)。二、捐贈。三、其他收入。四、以上收入之孳息。,"台南市政府  89年1月10日89南市社行字第001147號",永久,3152516.00,1,1130723,,,,"出資方法變更。
第4屆理監事任期屆滿，改選第5屆理監事。
代表法人之理事：陳葦芸。
全體理監事印鑑。",,,,
113法登他000218,1,2,鄭秀美,1271,1130729,1130729,1130731,78冊1頁,1,2,陳國珍,財團法人臺南市私立陳張社會福利慈善事業基金會,1080213,台南市安平區建平七街182巷26號,以辦理社會福利慈善事業為目的。,陳國珍捐助玖佰萬元、張文明捐助壹佰萬元,臺南市政府社會局108年1月14日南市社助字第1080098480號,永久,10000000.00,1,1130729,,,,"第2屆董事蔡佩宜辭任，補選董事。
全體董事印鑑。",,,,
113法登他000219,1,2,鄭秀美,715,1130729,1130729,1130731,47冊40頁,2,7,凃柏原,財團法人基督教會台南錫安堂,0961219,台南市永康區小東路689號地下一樓,本法人宗旨係本基督仁愛精神，在台南市傳揚基督教教義，辦理及捐助社會公益慈善教育事業。,由林宗、陳孟暇、吳璧君、李燕宜、董雅雲捐贈,台南市政府95年12月21日南市民宗字第09510529460號函,永久,16066598.00,1,1130729,,,,"第6屆董監事任期屆滿，改選第7屆董監事。
代表法人之董事：凃柏原。
全體董監事印鑑。",,,,
113法登他000220,1,2,鄭秀美,887,1130729,1130729,1130731,59冊7頁,2,5,郭添財,財團法人郭添財教育基金會,1000704,台南市東區衛國街106巷5弄63號,以關心學校教育，推展社會文教活動為準則，特結合專家學者之專業與社會菁英之熱忱，以感恩的心來服務民眾、回饋鄉親、提攜學子。,由郭添財捐助新台幣壹仟萬元整設立基金，並繼續接受捐贈。,台南市政府教育局100年6月22日南市教社字第1000447526號函　　,永久,10000000.00,1,1130729,,,,"第4屆董事任期屆滿，改選第5屆董事。
代表法人之董事：郭添財。
新任董事印鑑。",,,,
113法登他000221,1,2,鄭秀美,155,1130730,1130730,1130801,12冊1頁,1,14,張智欽,財團法人台南市私立噶瑪噶居蔣揚社會福利慈善事業基金會,0780105,台南市玉井區望明里11鄰望明116號,一、辦理兒少安置教養機構。二、辦理兒童青少年福利之服務。三、辦理婦女庇護收容所。四、辦理街友愛心之家。五、辦理關懷偏鄉地區學子。六、辦理孩提輔育之家。七、辦理身心障礙者與老人之服務。八、協助政府辦理公益慈善事業。九、辦理公益慈善教育、研習訓練課程事務。十、辦理兒少福利教育中心。,接受團體或個人的捐助,77年12月13日台南縣政府，府社福字第146126號,無限期,116490822.00,1,1130730,,,,"法人捐助章程變更：經本院113年度法字第22號民事裁定確定變更，變更內容詳如捐助章程條文修正對照表所載。
目的變更。",,,,
113法登他000222,2,2,鄭秀美,1325,1130731,1130731,1130802,80冊11頁,1,3,徐李柑,社團法人臺南市徐園長護生協會,1090106,台南市將軍區長榮里長榮78之3號,本會以收容安置流浪動物為主，並發動社會力量保護動物為宗旨,入會費、常年會費、會員捐款、委託收益、基金及其孳息、其他收入,臺南市政府105年2月2日府社團字第1050112170號函,永久,500000.00,1,1130731,,,,"法人印信（圖記）變更。
法人章程變更：經臺南市政府社會局113年7月2日南市社團字第1130920409號函備查，變更內容詳如章程修正對照表所載。",,,,
113法登他000223,1,2,鄭秀美,21,1130802,1130802,1130806,1冊21頁,1,19,魏宏泰,財團法人台灣省台南市私立瀛海高級中學,0480917,台南市安南區安慶里長溪路一段76號,為創辦私立瀛海高級中學並謀發展,自由籌集,台灣省政府教育廳民國48年6月18日教字第34001號函,永久,633088318.00,1,1130802,,,,法人財產變更：變更後財產總額為新台幣陸億參仟參佰零捌萬捌仟參佰壹拾捌元整。,,,,
113法登他000224,2,2,鄭秀美,1336,1130802,1130802,1130806,80冊20頁,2,2,曾耀正,社團法人臺南市基督教新營靈糧堂宣教協會,1090304,台南市新營區東義街26號,本會基於基督教之信仰理念，以提供個人及家庭信仰之建立，協助個人生命重整及家庭功能恢復，促進社會和諧；藉援助、教育、訓練為國內外弱勢與有需要者，提供不同層面的宗教教化及社會服務，參與國內外發生之重大天災人道救援及長期人道關懷救（捐）助為宗旨,入會費、常年會費、會員捐款、委託收益、基金及其孳息、事業費、其他收入,臺南市政府社會局109年1月17日南市社團字第1090113659號,永久　,10000.00,1,1130802,,,,"第1屆理監事任期屆滿，改選第2屆理監事。
代表法人之理事：曾耀正。
全體理監事印鑑。",,,,
113法登他000225,2,2,鄭秀美,1439,1130807,1130807,1130809,86冊9頁,2,2,余寶鳳,社團法人臺南市仁愛服務協會,1110413,台南市新營區長榮路二段373號,以辦理社會服務關懷弱勢團體，提倡心靈改革創造溫馨祥和社會為宗旨。,入會費、常年年費、政府機關補助、捐助收入、基金及其孳息、其他收入。,臺南市政府社會局民國88年2月28日府社0561號,永久,97343.00,1,1130807,,,,"法人印信（圖記）變更。
第1屆理監事任期屆滿，改選第2屆理監事。
代表法人之理事：余寶鳳。
法人印信（圖記）、全體理監事印鑑。
法人章程變更：經臺南市政府社會局112年8月14日南市社團字第1121052608號函備查，變更內容詳如章程修正對照表所載。",,,,
113法登他000226,1,2,鄭秀美,458,1130807,1130807,1130809,30冊9頁,1,9,何鑫毅,財團法人臺南市私立麻豆社會福利慈善事業基金會,0880819,台南市麻豆區謝厝寮里謝厝寮101號之35,本會以舉辦社會福利慈善事業為宗旨，目的事業如下：一、關於老人福利服務事項。二、關於身心障礙福利服務事項。三、關於附設社會福利慈善事業機構事項。四、關於社會福利專業人員培訓暨社會福利服務業務之承攬。五、關於志願服務之辦理及推廣事項。六、關於接受政府機關指導委辦各項社會福利服務事項。七、關於接受政府機關指導委辦各項長期照顧服務事項。八、其他有關社會福利慈善事業事項。,由孫德乾先生捐助,台南縣政府88年8月12日88府社福字第143338號,永久,44028000.00,1,1130807,,,,法人財產變更：變更後財產總額為新臺幣肆仟肆佰零貳萬捌仟元整。,,,,
113法登他000227,1,2,鄭秀美,201,1130809,1130809,1130813,13冊5頁,1,10,郭耀煌,財團法人國立成功大學文教基金會,0810317,台南市東區大學路一號,本會以協助國立成功大學校務發展及校友服務為宗旨，辦理下列各項業務：一、學生奬、助、貸學金之設置。二、教職員工（含退休人員）生之急難救助與照顧。三、實驗室設置及圖書儀器設備之補助。四、學術專題研究之奬助。五、校友之聯繫、服務及會館之籌建。六、捐款人之指定項目。七、幼兒與兒童教育、家庭教育、教保服務人員福祉等教育相關事務。八、其他有關文化教育、公益、創新創業及學術性活動之舉辦或補助。,接受國立成功大學師長、校友暨各界熱心公益人士捐助（自由捐助）,臺南市政府80年12月3日南市教社字第29783號,永久,25000000.00,1,1130809,,,,"第7屆監察人王涵青辭任，改選監察人。
新任監察人印鑑。",,,,
113法登他000228,2,2,鄭秀美,286,1130809,1130809,1130813,19冊6頁,1,16,魏永富,社團法人台南市噶瑪噶居戒癮協進會,0851211,台南市北區文賢路313巷49號,本會為依法設立、非以營利為目的之社會團體，本慈悲喜捨之精神、集大眾智慧能力，以共同防制藥物濫用，並協助戒癮者與其家人重新適應社會生活，進而達到淨化人心、安定社會為宗旨之公益團體。,包括入會費及常年會費收入、會員捐款、委託收益、基金及其孳息、其他收益等六方面。,台南市政府81年11月14日81南市社行字第107609號函。,永久,723072.00,1,1130809,,,,法人章程變更：經臺南市政府社會局113年8月6日南市社團字第1131048977號函核備，變更內容詳如章程修正條文前後對照表所載。,,,,
113法登他000229,1,2,鄭秀美,259,1130813,1130813,1130815,16冊9頁,1,8,王石柱,財團法人鹿耳門天后宮文教公益基金會,0830106,台南市安南區媽祖宮一街136號,本會以規劃、協調、推動社會教育及各項公益與藝文活動為宗旨。,無償、樂捐、奉獻,台南市政府82年12月16日82南市教社字第38397號,永久,2000000.00,1,1130813,,,,"第8屆董事林玉山辭任，補選董事。
新任董事之印鑑。",,,,
113法登他000230,1,2,鄭秀美,68,1130815,1130815,1130819,4冊3頁,2,14,陳漳,財團法人台灣省私立台南仁愛之家,0451027,台南市北區公園路591號,以辦理社會福利救助事業為目的,一、承台南慈惠院台南愛護會及私立台南救濟院財產生息。二、補助款及其他收入。,台灣省政府社會處民國45年10月27日,無限期,7381388846.11,1,1130815,,,,"第13屆董事任期屆滿，改選第14屆董事。
代表法人之董事：陳漳。
全體董事印鑑。",,,,
113法登他000231,2,2,鄭秀美,388,1130816,1130816,1130820,25冊9頁,2,28,陳建銘,社團法人臺南市永康獅子會,0870213,台南市永康區大灣路764巷105號七樓之5,發揚人類博愛互助精神，增進國際友好關係，尊重自由，啟發智慧，提倡社會福利，促進國家安全。,由社員捐助,台南縣政府八十一年五月廿五日府社行字第二六五號函,永久,180824.70,1,1130816,,,,"目的變更。
第27屆理監事任期屆滿，改選第28屆理監事。
代表法人之理事：陳建銘。
全體理監事印鑑。",,,,
113法登他000232,2,2,鄭秀美,862,1130820,1130820,1130822,58冊2頁,2,5,梁志男,社團法人台南市勞工志願服務協會,1000119,台南市新營區文昌街26-7號,本會為依法設立，非以營利為目的之社會團體，以推廣助人美德，激發勞工對社會之責任感，結合勞工奉獻服務之精神，利用工作餘暇參與公益性、慈善性之志願服務工作，並發掘及結合社會資源，配合政府政策，推展勞工福利及各項社會服務，促進社會安定和諧為宗旨。,會員收會費，每人每年600元。,台南縣政府　89年府社行字第108625號函,永久,246104.00,1,1130820,,,,"目的變更。
第4屆理監事任期屆滿，改選第5屆理監事。
代表法人之理事：梁志男。
全體理監事印鑑。",,,,
113法登他000233,1,2,鄭秀美,36,1130820,1130820,1130822,2冊6頁,1,15,徐國潤,財團法人台南市亞洲高級餐旅職業學校,0520712,台南市南區大成路一段5號,以創辦亞洲高級餐旅職業學校，並謀其發展為目的。,由董事會及熱心教育人士捐募,台灣省政府教育廳民國63年5月20日教三字第08491號函核准,永久,241422902.00,1,1130820,,,,法人財產變更：變更後財產總額為新台幣貳億肆仟壹佰肆拾貳萬貳仟玖佰零貳元整。,,,,
113法登他000234,1,2,鄭秀美,154,1130821,1130821,1130823,11冊23頁,2,9,潘燦鉁,財團法人台灣省台南市中華基督教健康路浸信會,0771222,台南市中西區健康路一段340號,本法人信奉主耶穌，遵守聖經教訓，廣傳福音，造就信徒並舉辦慈善公益事業。,係美南浸信會差所捐助。,台南市政府77年11月30日南市民調字第94831號,永久,18530832.00,1,1130821,,,,"第8屆董事任期屆滿，改選第9屆董事。
代表法人之董事：潘燦鉁。
全體董事印鑑。",,,,
113法登他000235,2,2,鄭秀美,439,1130822,1130822,1130826,29冊6頁,2,47,曾澎英,社團法人中華民國(台灣)國際獅子會第六聯合會第一支會,0880428,台南市北區西門路四段480號4樓之1,發揚人類博愛互助精神、增進國際友誼、尊重自由啟發智慧。,會費,臺灣省政府社會處民國88年4月2日88社2字第2108號,永久,25661249.50,1,1130822,,,,"第46屆理監事任期屆滿，改選第47屆理監事。
代表法人之理事：曾澎英。
全體理監事印鑑。",,,,
113法登他000236,1,2,鄭秀美,606,1130822,1130822,1130826,44冊8頁,2,15,陳宇昭,財團法人伊甸社會福利基金會,0931122,台北市文山區萬美街一段55號3樓,以舉辦社會福利為目的,由劉俠等人繼續捐助,臺北市政府社會局七十二年三月十九日北市社四字第九六九九號函,永久,775039856.00,1,1130822,,,,"第14屆董事、監察人任期屆滿，改選第15屆董事、監察人。
代表法人之董事：陳宇昭。
全體董事、監察人印鑑。",,,,
113法登他000237,1,2,鄭秀美,42,1130823,1130823,1130827,2冊12頁,2,16,薛井然,財團法人台灣省台南市私立慈幼高級工商職業學校,0530923,台南市東區裕農路801號,為遵照國家教育政策暨現教育法令之規定，辦理私立慈幼高級工商職業學校，並謀發展。,捐助,臺灣省政府教育廳53年7月21日教二字第42569號函,無限期,1040562022.00,1,1130823,,,,"第15屆董事任期屆滿，改選第16屆董事。
代表法人之董事：薛井然。
全體董事、監察人印鑑。",,,,
113法登他000238,1,2,鄭秀美,534,1130823,1130823,1130827,37冊6頁,2,8,蕭明霞,財團法人台南市私立母佑會社會福利慈善基金會,0910710,台南市東區裕農路798號,兒童福利及兒童教育、青少年福利、低收入戶子女教育補助、無依少女之收容、輟學少女之輔導、老人福利、婦女福利、身心障礙者福利、志願服務之辦理及推廣、接受主管機關指導辦理其他社會福利等事項。,謝錦芳、梁德寶、王芳萍、王麗萍等四人捐助,台南市政府91年6月25日南市社福字第9100471760號函,永久,10000000.00,1,1130823,,,,"第7屆董事任期屆滿，改選第8屆董事。
代表法人之董事：蕭明霞。
全體董事印鑑。",,,,
113法登他000239,1,2,鄭秀美,129,1130827,1130827,1130829,10冊6頁,1,10,黃錦盒,財團法人禮儀研究發展基金會,0720902,台南市學甲區新達里山寮1-2號,本會為響應政府基層文化建設培養禮儀及研究禮儀之人才，服務社會大眾為目的,由捐助人自由捐助,台南縣政府72年6月28府教社字第6658號,永久,500000.00,1,1130827,,,,"法人捐助章程變更：經臺南市政府文化局113年8月8日南市文運字第1131102053號函備查，變更內容詳如捐助章程修正條文對照表所載。
桃園分事務所地址變更。",,,,
113法登他000240,1,2,鄭秀美,732,1130827,1130827,1130829,51冊15頁,2,6,黄啓峰,財團法人台南市私立光洋社會福利慈善事業基金會,0970520,台南市安南區工業三路1號,一、關於老人、兒童、身心障礙、低收入戶等之社會慈善福利事項。二、關於貧困病患及偏遠地區之義診及醫療補助事項。三、推動社區文化教育，協助改善社區生活環境，提升社區文化水準之業務事項。四、接受主管機關委託指導辦理事項。五、其他與社會福利慈善事業發展有關之業務及其教育訓練。,光洋應用材料科技股份有限公司捐助現金新台幣壹仟萬元。,"台南縣政府   97年4月28日府社身字第0970089534號",自97年3月25日起永久,30000000.00,1,1130827,,,,"第5屆董事任期屆滿，改選第6屆董事。
代表法人之董事：黄啓峰。
新任董事印鑑，董事黄啓峰印鑑變更。",,,,
113法登他000241,2,2,鄭秀美,564,1130828,1130828,1130830,40冊6頁,2,20,葉英俊,社團法人臺南市獸醫師公會,0920930,台南市東區自由路二段33巷60號,為促進畜牧獸醫業務之發展，宣揚醫德，加強同業間之連繫，互相策勵共謀求學識及技術上獲得更高水準為宗旨,會費、常年會費、特別費、資金之利息、臨時會費、雜項收入、捐款收入、委託收益,台南縣政府92年7月14日府社行字第0920116448號函,永久,4566102.00,1,1130829,,,,"法人主事務所變更：新址為台南市東區自由路二段33巷60號。
第19屆理監事任期屆滿，改選第20屆理監事。
代表法人之理事：葉英俊。
新任理監事印鑑。
法人章程變更：經臺南市政府社會局112年5月11日南市社團字第1120608069號函核備，變更內容詳如章程編修新舊條文對照表所載。",,,,
113法登他000242,1,2,鄭秀美,607,1130829,1130829,1130830,44冊9頁,2,7,郭治華,財團法人台南市創新技術服務基金會,0931123,臺南市新營區民治路36號（世紀大樓九樓）,以協助推動臺南市產業發展為目的，從事產業技術服務以促進產業升級與發展之工作。,由台南縣政府及傑俐企業股份有限公司等二十二家公司共同捐助,台南縣政府九十三年九月十四日府經科字第○九三○一七四六八五號函,永久,5000000.00,1,1130830,,,,"第6屆董事、監事任期屆滿，改選第7屆董事、監事。
代表法人之董事：郭治華。
新任董事、監事印鑑。",,,臺南市政府經濟發展局113年8月22日南市經產輔字第1131147904號函,
113法登他000243,1,2,鄭秀美,205,1130829,1130829,1130830,13冊9頁,1,10,李天佑,財團法人台南勞資事務基金會,0810414,台南市南區南門路261號,為增進台南縣市地區勞資和諧，調合勞資關係，以公正第三人之立場解決勞資爭議事務，促進勞資雙方權利與義務之平衡為目的。,創立人捐助,臺灣省政府勞工處81年3月9日勞一字第4612號,永久,2000000.00,1,1130830,,,,法人捐助章程依勞動部民國113年8月8日勞動關3字第1130143945號函許可變更。,,,,勞動部113年8月8日勞動關3字第1130143945號函准予備查。
113法登他000244,2,2,鄭秀美,704,1130830,1130830,1130903,50冊7頁,2,25,李美慧,社團法人大臺南護理師護士公會,0960726,台南市新營區中山路115號7樓之1,本會以發展護理專業，維護護理人員權益，提昇護理人員地位，並增進全民健康及公共福利為宗旨。,會員入會費、常年會費。,"台南縣政府  46年2月21日府社行字第471號函。",永久,7699539.00,1,1130830,,,,"第24屆理監事任期屆滿，改選第25屆理監事。
新任理監事印鑑。",,,臺南市政府社會局113年3月5日南市社團字第1130348753號函准予備查。,
