登記案號,類別,案由,主任,登記號數,收件日期,登記日期,公告日期,登記簿,任期判定,屆期判定,法人代表,法人名稱,設立登記日期,主事務所,目的,捐助方法,許可機關日期,存立時期,財產總額,結案原因,結案日期,歸檔日期,發證日期,清算人,變更原因,註銷日期,撤銷日期,撤(註)銷機關文號,撤(註)銷原因
115法登他000001,1,2,葛羽洪,607,1150105,1150105,1150105,8冊7頁,1,2,董事長林茂賢,財團法人臺灣歌仔戲推廣基金會,0620703,高雄市左營區軍校路51號,本會以推廣臺灣歌仔戲為目的。,由國劇欣賞委員會捐助,教育部文化局中華民國62年5月17日62文2字第03122號函,永久,412052.00,1,1150105,,,,"李國俊辭任第二屆董事，由徐亜湘繼任董事。
第二屆新任董事印鑑登記。",,,,
115法登他000002,2,2,葛羽洪,136,1150109,1150112,1150112,2冊36頁,2,8,理事長藍美雅,社團法人高雄市勞動生活教育促進會,0970109,高雄市仁武區名湖街925巷5號,本會以推廣勞工教育，提昇勞動意識、促進社區發展，推動文化保存、增進勞工法治教育能力，辦理職業技能訓練及社區大學等相關社區學習業務為宗旨。,入會費、常年會費、政府補助款、捐款、委託收益、基金及其孳息、其他收入。,高雄市政府社會局中華民國95年9月26日高市社局一字第0950031764號函,永久,5002.00,1,1150112,,,,"第七屆理、監事任期屆滿；改選第八屆理、監事。
藍美雅、李永祺、林鈴蕙、黃文景、黃淑娟、謝政勳及鄭敏聰等連任第八屆理事；王御風及曾順陽等連任第八屆監事。
第八屆理、監事印鑑登記。
法人章程變更:法人組織章程第5條及第19條於中華民國114年10月13日經法人第七屆第三次會員大會決議修正；並經高雄市政府社會局中華民國114年07月14日高市社人團字第11435528700號函核備。",,,,
115法登他000003,1,2,葛羽洪,165,1150109,1150112,1150112,2冊65頁,1,8,董事長呂文豪,財團法人曹公農業水利研究發展基金會,0840707,高雄市左營區明誠二路332號9樓之2,辦理或協助推行農田水利及相關農業之研究發展，以繁榮農村，增進農民福址為宗旨。,一、原臺灣高雄農田水利會捐助原始基金為新台幣伍億元正。二、政府之補助及社會各界之捐贈。,台灣省政府建設廳，中華民國84年7月4日84建水字第28327號函,永久,500000000.00,1,1150112,,,,"章程變更:法人捐助章程第一條、第七條、第十條、第十一條、第十二條、第十四條、第二十條及第二十二條於中華民國114年07月09日經法人第八屆第七次董事暨監察人會議決議修正；並經農業部中華民國114年09月19日農授水字第1148051892號函核備；業經本院民事庭114年度法字第17號民事確定裁定准予變更第七條、第十一條、第十二條、第十四條、第二十一條及第二十二條在案，其中第一條及第十條非屬於財團法人組織不完全或重要管理方法不具備而為修正，無向法院聲請裁定准予變更之必要。
法人出資及捐助方法更正為一、原臺灣高雄農田水利會捐助原始基金為新台幣伍億元正。二、政府之補助及社會各界之捐贈。",,,,
115法登他000004,1,2,葛羽洪,238,1150112,1150112,1150112,3冊38頁,2,9,董事長理却遜廉而特,財團法人台灣聯合五旬節基督教會,0810128,高雄市杉林區月眉里清水路118號,在台灣及全世界各地努力傳揚耶穌基督的福音,捐助,高雄縣政府民國八十年九月二十七日民禮字第一三六一七號函,永久,641595.00,1,1150112,,,,"第八屆董事任期屆滿，改選為第九屆董事。
第八屆董事全部連任第九屆董事。
第九屆董事印鑑登記",,,,
115法登他000005,1,2,王淑美,434,1150120,1150120,1150120,5冊34頁,1,2,董事長吳燦坤,財團法人高雄市燦坤WU社福基金會,1091027,高雄市旗山區樹人路63之8號,以辦理社會福利慈善事業為目的,由吳燦坤捐助成立,高雄市政府社會局中華民國109年9月29日高市社人團字第10938883300號函,永久,259917524.00,1,1150120,,,,"財產總額由新台幣239,917,524元變更為新台幣259,917,524元。",,,,
115法登社000001,2,1,葛羽洪,689,1150112,1150112,1150112,9冊39頁,,,理事長鍾承儒,社團法人台灣運動培育推展協會,1150112,高雄市岡山區大仁北路108號,以提升民眾運動參與度，促進身心健康與社會福祉為宗旨,入會費、常年會費、事業費、會員捐款、委託收益、基金及其孳息、其他收入,內政部中華民國114年12月09日台內團字第1140044124號函,永久,100.00,1,1150112,,,,,,,,
115法登社000002,2,1,王淑美,690,1150120,1150120,1150120,9冊40頁,,,理事長陳仁吉,社團法人台灣同心關懷推廣協會,1150120,高雄市楠梓區芎林六街63號,以推廣同心生活環境及關懷弱勢族群為宗旨,入會費、常年會費、事業費、會員捐款、委託收益、基金及其孳息、其他收入,內政部中華民國114年11月11日台內團字第1140042092號函,永久,20000.00,1,1150120,,,,,,,,
