登記案號,類別,案由,主任,登記號數,收件日期,登記日期,公告日期,登記簿,任期判定,屆期判定,法人代表,法人名稱,設立登記日期,主事務所,目的,捐助方法,許可機關日期,存立時期,財產總額,結案原因,結案日期,歸檔日期,發證日期,清算人,變更原因,註銷日期,撤銷日期,撤(註)銷機關文號,撤(註)銷原因
087法登他000682,1,2,許立民,1826,0871116,0871126,0871126,72冊37頁,0,2,潘煥昆,財團法人中華民國發行公信會,0831020,台北市中山區長安東路二段七十八號六樓,依據公平、公正、公開之原則，藉著對報紙及雜誌發行調查、稽核及對付費讀者之分析，以提供正確資訊，促進廣告及經營之合理化，達成社會公器之誠信目標。,由本會第一屆董、監事等及各界共同捐助,行政院新聞局八十三年八月廿九日　︵八三︶強版二字第一五五五四號函,永久,11000000.00,1,0871126,0871204,0871204,,繼任董事印鑑。,,,,
087法登他000683,2,2,許立民,415,0871116,0871116,0871116,15冊10頁,2,3,魏忠華,社團法人中華民國電腦稽核協會,0831209,台北市松山區民生東路三段一五六號六樓,㈠推動電腦稽核及系統控制安全之學術研究發展。㈡協助制定電腦稽核、控制、安全之標準。㈢協助企業強化電腦系統之控制與電腦稽核功能。㈣與國際電腦稽核相關組織作資訊及技術之交流。,㈠會員入會費及常年會費㈡事業費㈢會員捐款㈣委託收益㈤基金及其孳息㈥其他收入,"內政部八十三年七月十四日  台︵八三︶內社字第八三一六四七四號函",永久,217280.00,1,0871116,0871127,0871127,,"代表法人之理事：魏忠華
理、監事印鑑。",,,,
087法登他000684,1,2,許立民,1881,0871117,0871117,0871117,74冊22頁,2,2,王永慶,財團法人王詹樣社會福利慈善基金會,0840815,台北市敦化北路二０一號二樓,以不營利為目的，依有關法令辦理下列事項：㈠關於重大傷病無法工作致嚴重影響家庭生計者之補助。㈡關於老、弱、殘障及慢性病者及其家庭生活之補助。㈢關於清寒學生生活之補助。㈣其他有關慈善事業或公益事業之捐助、參與或興辦。,由王詹樣遺產捐助,台北市政府社會局八十四年八月四日　北市社二字第四０四０三號函,永久,121460780.00,1,0871117,0871127,0871127,,"代表法人之董事：王永慶
法人圖記。",,,,
087法登他000685,1,2,許立民,652,0871117,0871117,0871117,32冊59頁,1,13,各董事,財團法人中華民國郵政職工福利委員會,0641204,台北市金山南路二段五五號郵政總局五樓,為謀求郵政職工福利，提高服務熱忱，增進工作效率，進而發展郵政事業。,報請按本會福利事業之需要撥付創業基金、按每月郵政事業收入、下腳變價時等提撥。：：等,"內政部六十四年十一月十八日  台內勞字第六六一五一五號函",永久,250000000.00,1,0871117,0871127,0871127,,繼任董事長、董事印鑑。,,,,
087法登他000686,1,2,許立民,1441,0871117,0871118,0871118,59冊29頁,2,4,各董事,財團法人台鳳股份有限公司職工福利委員會,0790123,台北市重慶南路一段一五號,以謀求全體員工福利為宗旨。,依稅法規定，按當月營業收入一‧五％提撥為福利金,台北市政府勞工局七十九年一月十五日　北市勞工三字第０五五七號函,永久,4549334.00,1,0871118,0871127,0871127,,"代表法人之董事：各董事
董事印鑑。
原捐助章程經本院八十七年度法字第三三號民事裁定准予變更。",,,,
087法登他000687,1,2,許立民,872,0871118,0871118,0871118,40冊19頁,0,6,饒賢奇,財團法人臺灣區蠶業發展基金會,0690811,台北市中正區羅斯福路一段七號十樓之四,以發揚我國固有蠶業文化，增進消費者對蠶業之了解，推展蠶業試驗研究、生產、加工、運銷，促進蠶業發展為宗旨。,自由捐助。,六十九年七月二十一日經濟部　經()農字第二三八０五號函,永久,40301378.00,1,0871118,0871127,0871127,,,,,,
087法登他000688,1,2,許立民,2012,0871118,0871118,0871118,78冊55頁,1,1,周樂茞軍,財團法人成長文教基金會,0860424,台北市仁愛路三段一二三巷三弄七號一樓,以興辦公益事業，發揚學術文化，造福社會為宗旨。,由豐泰企業股份有限公司捐助。,台北市教育局八十六年四月二十二日　北市教四字第八六二０九三一三００號函,永久,5000000.00,1,0871118,0871127,0871127,,代表法人之董事：周樂茞軍,,,,
087法登他000689,1,2,許立民,900,0871118,0871118,0871118,41冊15頁,1,6,歐晉德,財團法人臺灣營建研究院,0700516,台北縣新店市中興路二段一九０號十一樓,以推動有關營建技術方面研究為宗旨。,由行政院國軍退除役官兵輔導委員會榮工處捐助，國立臺灣大學及國立臺灣工業技術學院贊助,"內政部七十年三月十一日  ︵七十︶台內營字第一一０三四號函",永久,1000000.00,1,0871118,0871127,0871127,,繼任董事印鑑。,,,,
087法登他000691,1,2,許立民,709,0871118,0871118,0871118,34冊53頁,2,9,各董事,財團法人中國電腦運用發展中心,0660331,台北市忠孝東路四段一四八號八樓之四,以介紹最新資料處理技能，訓練運用自動機器處理資料技術人才，接受委託代辦各項資料等處理工作，藉以配合政府政策發展政府所定事業，增加管理效能，改善公共行政為目的。,由捐助人陶鴻傑等八人捐助之,經濟部六十六年三月七日　經︵六六︶商字第０五六四五號函,永久,1000000.00,1,0871118,0871127,0871127,,"代表法人之董事：各董事
董事、 監察人印鑑。",,,,
087法登他000693,1,2,許立民,242,0871119,0871119,0871119,17冊13頁,0,10,林蔭中,財團法人臺灣省台北縣私立開明高級工業商業職業學校,0540428,台北縣新店市寶興里十二鄰寶中路四九號,為遵照國家教育政策暨現行教育法令之規定辦理高級工家職業學校並謀其健全發展。,由創辦人林蔭中、陳石安、林志烈、何謙、王世俊共同捐助,臺灣省政府教育廳五十三年七月十一日　教三字第四三一四八號函,永久,261039488.00,1,0871119,0871127,0871127,,,,,,
087法登他000694,1,2,許立民,1173,0871119,0871126,0871126,50冊25頁,2,7,馬長生,財團法人中華民國民營廣播電台聯合會,0750813,台北市重慶南路三段十七號十一樓,以研究廣播學術，改進廣播技術，團結民營同業，共謀廣播事業之進步發展為目的。,一、黨政主管單位及民間廣電團體捐助二、民營廣播單位捐助,行政院新聞局七十五年七月二十九日　（七五）京廣二字第一一七一一號函,永久,1300000.00,1,0871126,0871204,0871204,,"代表法人之董事：馬長生。　
董事長及新任董、監事印鑑。",,,,
087法登他000695,1,2,許立民,1451,0871119,0871119,0871119,59冊49頁,2,4,賴國洲,財團法人新道文教基金會,0790215,台北市光復南路二六二號八樓之三,協助倡導倫理道德，促進社會和諧進步為宗旨，從事或贊助編著出版、發行，並支援舉辦有益社會大眾身心健康之文化活動。,富隆證券股份有限公司等捐助,"教育部七十九年一月廿五日  台︵七九︶社字第三九六六號函",永久,83000000.00,1,0871119,0871127,0871127,,代表法人之董事：賴國洲,,,,
087法登他000697,1,2,許立民,1668,0871120,0871123,0871123,67冊7頁,1,2,范思平,財團法人中華民國輸入業環境保護基金會,0810812,台北市仁愛路四段三七六號十六樓之八,成立目的是配合政府之保護環境政策。,由德記事業股份有限公司等捐助,行政院環境保護署八十一年六月十七日　︵八一︶環署綜字第一三六二九號,永久,9021700.00,1,0871123,0871204,0871204,,"代表法人之董事：范恩平
繼任董事長、董事、監事印鑑。
原捐助章程經本院八十七年度法字第六十五號、第一０一號民事裁定准予
變更。",,,,
087法登他000698,1,2,許立民,1774,0871120,0871120,0871120,70冊58頁,2,2,黃榮村,財團法人遠哲科學教育基金會,0830322,台北市重慶南路二段七十五號七樓,以推動科學教育事業為宗旨。,由何壽山、何壽川、何張杏如等共同捐助,"教育部八十三年三月五日  台（八三）社字第０一一六四０號函",永久,100000000.00,1,0871120,0871127,0871127,,"代表法人之董事：黃榮村。
新任董事及連任董事施振榮印鑑。　　　　　　　　　　　　　　　　　
原捐助章程第四條、第十五條、第二十七條經本院八十七年度法字第一一
五號民事裁定准予補充變更。",,,,
087法登他000699,1,2,許立民,1818,0871120,0871123,0871123,72冊13頁,1,2,李義燦,財團法人中華民國證券櫃檯買賣中心,0830926,台北市羅斯福路二段一００號十五、十六樓,依證券交易法之規定，以發展國民經濟，並保障投資為目的。,由台北市、高雄市等證券商業同業公會、台灣證券交易所、台灣證券集中保管等股份有限公司共同捐助,財政部證券管理委員會八十三年七月廿七日(83)台財證(三)字第０一三九八號函,永久,490000000.00,1,0871123,0871204,0871204,,繼任監察人印鑑。,,,,
087法登他000701,1,2,許立民,1234,0871120,0871123,0871123,52冊27頁,2,5,任治平,財團法人台北市中華基督教培神教會,0761123,台北市松山區基隆路一段一五五號三樓之五,以耶穌愛人捨己之精神，在台北市內傳揚基督教教義，造就培育宣道人材，促互助互愛，並辦理社會公益慈善事業。,由任治平先生捐助,台北市政府民政局七十六年十一月九日（七六）北市民三字第一七七四三號函,無限期,2689305.00,1,0871123,0871204,0871204,,"代表法人之董事：任治平
董事印鑑。",,,,
087法登他000702,1,2,許立民,345,0871123,0871127,0871127,22冊37頁,2,6,黃忠臣,財團法人台北市行天宮,0580118,台北市民權東路二六一號,以宏揚聖教、誠心敬神、宣揚五倫八德，提倡正信以利世人濟世宏道辦理社會慈善公益為目的。,捐助,台北市政府五十七年十二月三十日　府民二字第六００五四號,永久,837548601.00,1,0871127,0871204,0871204,,"代表法人之董事：黃忠臣
董事印鑑。",,,,
087法登他000703,1,2,許立民,616,0871124,0871124,0871124,31冊47頁,1,7,尹衍樑,財團法人紀念尹珣若先生教育基金會,0631203,台北市敦化南路二段七六號廿四樓,本會以舉辦左列獎助及捐助為宗旨：一、獎（助）學各級學校在籍優秀與清寒學生及軍公教子弟。二、獎（助）各級學校教師及文教機構研究人員從事學術研究。三、捐助各文教機構。四、捐助其他各種社會公益及急難事業。,潤華染織廠股份有限公司及私人等捐獻。,六十三年十一月二十一日台北市政府教育局　北市教輝四字第四０一六九號函,永久,100000000.00,1,0871124,0871204,0871204,,"繼任董事印鑑。
董事長尹衍樑、董事許金水住所變更。",,,,
087法登他000704,1,2,許立民,1384,0871124,0871126,0871126,57冊31頁,2,4,釋心道,財團法人靈鷲山般若文教基金會,0780612,台北縣貢寮鄉福連村香蘭街七之一號,１復興中華文化、獎勵學術研究及文學創作風氣。２促進哲學、教育、文學等文教服務之發展。３推展國際間學術文化交流活動，以發揚中國固有文化。４提倡倫理，促進德育，以導正人心，端正社會風俗,釋心道法師捐助。,"教育部七十八年六月一日  台︵七八︶高字第二五五九六號函。",永久,1200000.00,1,0871126,0871204,0871204,,"代表法人之董事：釋心道
董事印鑑。",,,,
087法登他000705,1,2,許立民,1345,0871124,0871124,0871124,56冊13頁,2,4,許萬聖,財團法人台北市勇致文教基金會,0780201,台北市民權東路三段二十一號七樓,以宏揚中華文化、培養賢才及增進社會公益、造福人群，提昇生活品質與素質為宗旨。,由陳致遠等董事捐助,台北市政府教育局七十八年一月四日　北市教四字第七二一三０號函,永久,1300000.00,1,0871124,0871204,0871204,,"代表法人之董事：許萬聖。
董事印鑑。",,,,
087法登他000706,1,2,許立民,46,0871125,0871127,0871127,4冊7頁,2,9,黃書瑋,財團法人台北市法華寺,0451106,台北市西寧南路一九四號,為宣揚佛教教義、擴充佛教基礎，廣佈善道、舉辦慈善救濟事業，社會福利為目的。,由捐助人捐助。,台北市政府四十五年九月廿九日　︵四五︶北市民社字第０二七七０二號函,永久,13788000.00,1,0871127,0871204,0871204,,"原捐助暨組織章程經本院八十七年度法字第一一四號民事裁定准予補充變
更。",,,,
087法登他000707,2,2,許立民,525,0871125,0871210,0871210,18冊73頁,2,2,李炎堯,社團法人台北市孔孟思想研究學會,0860108,台北市吳興街三七五巷五一弄十八號之三,研究孔孟思想，弘揚儒家倫理道德精神，實踐社會之道德規範，使人們行為合於理、合於道、合於法之準繩，進而成為和諧有禮，康樂富強之大同社會為宗旨。,會費及捐款,台北市政府社會局　八十四年三月四日北市社一字第一０七０五號函,永久,67248.00,1,0871210,0871218,0871218,,"代表法人之理事：李炎堯
理、監事印鑑。
原章程第二十一條經會員大會決議修改，報經主管機關核備變更。",,,,
087法登他000708,1,2,許立民,1685,0871125,0871127,0871127,67冊41頁,2,3,陳維昭,財團法人臺灣醫學發展基金會,0811118,台北市敦化南路一段一三八號十五樓,以促進臺灣醫學發展及提昇醫學研究與教學水準為宗旨。,由施純鎰先生及其他熱心人士捐助,"教育部八十一年十月三十日  台（八一）社字第五九九九０號函",永久,22000000.00,1,0871127,0871204,0871204,,"代表法人之董事：陳維昭
連任董事謝博生印鑑。",,,,
087法登他000709,1,2,許立民,476,0871125,0871217,0871217,27冊7頁,2,3,林耀福,財團法人英千里先生獎學金基金會,0611003,台北市羅斯福路四段一號國立台灣大學外國語文學系,為紀念英千里教授、獎助輔仁及台灣兩大學品學兼優之青年。,由英千里先生友好及學生捐助,台北市教育局六十一年七月一日　︵六一︶北市教輝肆字第二四號函,永久,750000.00,1,0871217,0871224,0871224,,"代表法人之董事：林耀福
新任董事印鑑、董事胡耀恆、高天恩印鑑變更。",,,,
087法登他000710,1,2,許立民,777,0871126,0871222,0871222,37冊9頁,2,6,各董事,財團法人臺灣福音書房,0670919,台北市金山南路一段七十二號,本法人設立宗旨為出版、編譯、經售傳揚耶穌基督福音之書籍雜誌及詩歌講道錄音等，供應基督徒生命與教會真理之需要且不以營利為目的。,由旅美華僑李常受先生捐助,台北市政府六十七年九月十三日　（六七）府新一字第三七五一六號函,永久,6000000.00,1,0871222,0871229,0871229,,"代表法人之董事：各董事
新任董事印鑑。",,,,
087法登他000711,1,2,許立民,842,0871126,0871126,0871126,39冊19頁,1,6,"林  慶",財團法人欣然氣體燃料事業研究服務社,0690221,台北市南京東路四段一００號十二樓,１促進氣體燃料有關工業安全之發展。２研究加強城鎮及家庭用氣體燃料使用之安全。３氣體燃料供銷技術之研究與服務。４配合政府能源政策及行政措施之宣導與研究服務。５其他有關事業之興辦與服務,行政院國軍退除役官兵輔導委員會所屬液化石油氣供應處等單位捐助,經濟部六十九年二月七日　經（六九）工字第０四三一七號函,永久,1606170.00,1,0871126,0871204,0871204,,"代表法人之董事：楚  慶
繼任董事長、董事印鑑。",,,,
087法登他000714,2,2,許立民,476,0871127,0871210,0871210,17冊16頁,2,3,王政亮,社團法人中華民國密宗薩迦佛學會,0850125,台北市錦州街二一五號四樓,以弘揚佛法、利益眾生、簡稱「弘法利法」為宗旨。,會費、捐款、孳息,內政部七十九年五月十六日　台（七九）內社字第八０三六二二號函,永久,500000.00,1,0871210,0871218,0871218,,"代表法人之理事：王政亮
理、監事印鑑。",,,,
087法登他000715,1,2,許立民,835,0871127,0871127,0871127,39冊5頁,0,6,黃烈火,財團法人味全文化教育基金會,0681221,台北市松江路一二五號四樓,以培育各種專門人才，推行社會教育，研習各種技藝，增進國內外人民之溝通與瞭解，促進家庭生活之美滿與和諧而促成安和樂利之社會。,由各董事募集捐助或接受有關機構，社團及個人之捐助,"教育部六十八年十二月十五日  台︵六八︶社字第三九一三五０號函",永久,72642550.00,1,0871127,0871204,0871204,,,,,,
087法登他000716,1,2,許立民,1370,0871127,0871127,0871127,57冊3頁,2,4,陳永泰,財團法人震旦永續經營基金會,0780512,台北市信義路五段二號十六樓,以倡導企業永續經營理念從事現代企業管理研究，提昇國人生活品質，促進資訊科技發展，推動工商社會公益、福利、獎學為宗旨。,由陳永泰先生等捐助,經濟部七十八年四月二十七日　經（七八）技字第０一八０一六號函,永久,19000000.00,1,0871127,0871204,0871204,,"代表法人之董事：陳永泰。
新任董事印鑑。",,,,
087法登他000717,1,2,許立民,1693,0871127,0871130,0871130,67冊57頁,2,3,江秀珠,財團法人吳伯楨肝臟學術基金會,0820105,台北市中山南路七號,以鼓勵從事肝臟學，尤其有關肝癌、肝硬化、肝炎及藥物、化學物品引起的肝損傷之研究及相關事宜為宗旨。,由江秀珠女士、李陸大先生捐助,教育部八十一年十一月十八日　台（八一）社字第六九八九五號函,永久,10000000.00,1,0871130,0871210,0871210,,"代表法人之董事：江秀珠。
董事印鑑。",,,,
087法登他000718,1,2,許立民,1511,0871127,0871127,0871127,61冊51頁,0,3,高辛陽,財團法人中衛發展中心,0790803,台北市敦化北路六號及八號七樓,以協助企業界建立中心衛星工廠制度，促使企業相輔相成，共存共榮，並提昇企業經營及品質水準，促進產業昇級，樹立國際優良形象，進而增強對外競爭力為宗旨。,由經濟部工業局及相關業者共同捐助,經濟部七十九年六月二十九日　經︵七九︶技字第０三００五０號函,永久,74100954.00,1,0871127,0871204,0871204,,,,,,
087法登他000719,1,2,許立民,2135,0871127,0871127,0871127,82冊67頁,1,1,孫忠信,財團法人榮欣文教基金會,0870723,台北市忠孝東路五段三七０號十一樓,以宏揚中華文化，推動文化建設，獎勵敦品勵學，提昇文化領域及倡導生活智能等為本會宗旨。,由蔡裕仁等三十三人及欣湖等天然氣股份有限公司共同捐助。,教育部八十七年六月十二日台(87)社(四)字第八七０六二八五七號函,永久,34000000.00,1,0871127,0871204,0871204,,繼任董事印鑑。,,,,
087法登他000720,1,2,許立民,1687,0871130,0871130,0871130,67冊45頁,2,3,吳英俊,財團法人皮膚科學發展文教基金會,0811124,台北市中山南路七號,以促進皮膚科學教育發展及提昇皮膚科學相關之學術研究與水準為宗旨。,捐助,台北市政府教育局八十一年十月二十四日　北市教四字第五三九九八號函,永久,5000000.00,1,0871130,0871208,0871208,,"代表法人之董事：吳英俊。
新任董事印鑑。
原捐助及組織章程第十條經董事會決議修正，報經主管機關同意備查。",,,,
087法登他000721,1,2,許立民,928,0871130,0880203,0880203,42冊11頁,2,5,阮大新,財團法人中華民國大同老人福利基金會,0701231,台北市基隆路一段一五五號三樓,配合國策謀取老人福利。,自由捐獻,內政部七十年十二月廿六日　七十台內社字第五九七六三號函,永久,10000000.00,1,0880203,0880211,0880211,,"代表法人之董事：阮大新
董事印鑑。",,,,
087法登他000722,2,2,許立民,559,0871201,0871202,0871202,19冊85頁,2,1,鄭明昌,社團法人台北市中華外內丹功研究學會,0860822,台北市松江路二十三號二樓,為復興中華文化、發揚固有民族精神，以研習外丹功及內丹功功能使全民身心舒泰，同登壽域，增強國民生命力。,入會費、常年會費,台北市政府社會局八十六年四月廿三日　北市社一字第二一四０四號函,永久,500000.00,1,0871202,0871211,0871211,,繼任理事印鑑。,,,,
087法登他000723,1,2,許立民,414,0871130,0871130,0871130,25冊3頁,0,10,各董事,財團法人陶聲洋防癌基金會,0600405,台北市羅斯福路三段二七七號四樓,以協助傳播防癌知識，贊助防癌活動為宗旨。,由啟業化工公司周煥章等二十單位共同捐助,內政部六十年三月十五日　台內衛字第四０四六四三號函,永久,26266653.00,1,0871130,0871210,0871210,,,,,,
087法登他000724,1,2,許立民,194,0871201,0871202,0871202,14冊7頁,0,10,林燕玢,財團法人台北市私立祐德高級中學,0520923,台北市忠孝東路五段七九０巷廿七號,創設學校，從事教育，辦理普通中學及職業學校，並謀其發展為目的。,由創辦人張瑟音女士及全體董事捐贈。,五十二年八月七日台灣省政府教育廳　教二字第０三０四六號函,永久,274340687.00,1,0871203,0871211,0871211,,,,,,
087法登他000725,1,2,許立民,1939,0871201,0871208,0871208,76冊16頁,2,2,江奉琪,財團法人中華民國關懷演藝人員基金會,0850803,台北市光復南路一００號,以關懷演藝人員為目的,由行政院新聞局、中華民國電視學會捐助,行政院新聞局八十五年七月廿三日　(85)起廣三字第一０四三九號函,永久,57300000.00,1,0871208,0871218,0871218,,"代表法人之董事：江奉琪
新任董事、監察人印鑑。",,,,
087法登他000726,1,2,許立民,959,0871201,0871202,0871202,43冊15頁,2,6,潘玉杏,財團法人台北市私立潘品如老人福利基金會,0710828,台北市景興路一九三號十七樓之三,以辦理老人服務及福利為目的,由潘玉杏女士捐助,"台北市政府社會局七十一年八月十二日  北市社四字第二九六四八號函",永久,24645552.00,1,0871202,0871211,0871211,,"代表法人之董事：潘玉杏。
新任董事印鑑。
原捐助章程第五條、第六條、第二十六條經本院八十七年度法字第一一七
號民事裁定准予補充變更。",,,,
087法登他000727,1,2,許立民,2046,0871201,0871216,0871216,79冊67頁,1,1,朱婉清,財團法人中央廣播電臺,0860919,台北市北安路五五號,一、對國外地區傳播新聞及資訊，樹立國家新形象，促進國際人士對我國之正確認知，及加強華僑對祖國之向心力。二、對大陸地區傳播新聞及資訊，增進大陸地區對台灣地區之溝通與暸解。,國防部捐助,行政院新聞局八十六年八月二十五日(86)維廣二字第一一九二六號函,永久,49660600.00,1,0871216,0871224,0871224,,繼任董事印鑑。,,,,
087法登他000728,2,2,許立民,206,0871201,0871221,0871221,8冊9頁,2,6,陳國和,社團法人中華民國工商建設研究會,0791023,台北市建國南路二段二０一號六樓,以促進國內工商建設之研究發展與進步為宗旨。,會員入會費、常年會費、捐款,"內政部七十九年七月二日  台︵七九︶內社字第八００九七九號函",永久,31408833.00,1,0871221,0871221,0871229,,"代表法人之理事：陳國和
理、監事印鑑。
原章程第十條經會員大會決議通過變更，報經主管機關准予備查。",,,,
087法登他000729,1,2,許立民,130,0871202,0871203,0871203,9冊25頁,,15,各董事,財團法人台北市私立金甌女子高級中學,0500210,台北市杭州南路二段一號,以創辦金甌女子高級中學並謀其發展為目的。,1.董事捐獻2.社會捐助,"教育部三十七年十月十三日  中字第五六五一二號代電核准",永久,758057053.00,1,0871203,0871210,0871210,,"代表法人之各董事
新任董事印鑑",,,,
087法登他000730,1,2,許立民,724,0871202,0871202,0871202,35冊23頁,1,0,胡新南,財團法人艾森豪獎金中華民國協會,0660813,台北市松壽路三號,為響應及協助美國故總統艾森豪獎金會，促進國際文化交流。,由熱心公益人士、機關及團體捐助之,"教育部六十六年三月十八日  台︵六六︶高字第七一七七號函",永久,31000000.00,1,0871202,0871211,0871211,,"代表法人之董事：胡新南
繼任董事印鑑。
原捐助章程第四條、第七條、第八條、第十三條經本院八十四年度法字第
六七號民事裁定准予補充變更。",,,,
087法登他000731,1,2,許立民,435,0871202,0871202,0871202,25冊45頁,2,6,鄭錫華,財團法人康寧醫院,0600910,台北市松山區光復南路卅五號四樓之一,以強化社會服務，增進國人身心健康為目的。,中國大眾康寧互助會撥交土地,台北市政府衛生局五十九年九月二十一日　北市衛三字第一一０七０號函,永久,80000000.00,1,0871202,0871210,0871210,,"代表法人之董事：鄭錫華
董事印鑑。
原捐助章程經本院八十七年度法字第一一六號民事裁定准予補充變更。",,,,
