登記案號,類別,案由,主任,登記號數,收件日期,登記日期,公告日期,登記簿,任期判定,屆期判定,法人代表,法人名稱,設立登記日期,主事務所,目的,捐助方法,許可機關日期,存立時期,財產總額,結案原因,結案日期,歸檔日期,發證日期,清算人,變更原因,註銷日期,撤銷日期,撤(註)銷機關文號,撤(註)銷原因
087法登他000432,1,2,許立民,1956,0870714,0870714,0870714,76冊67頁,2,5,劉錦龍,財團法人中華民國科技圖書館及資料單位館際合作組織研究及發展基金會,0740711,台北市和平東路二段一０六號十六樓,促進我國科技資訊之研究，推展科技資訊館際合作，以支援國家科學技術研究發展為目的,捐助,教育部七十四年六月二十八日　台（）高字第二六四八七號函,永久,2686493.00,1,0870714,0870721,0870721,,"代表法人之董事：劉錦龍。
新任董事印鑑。",,,,
087法登他000433,1,2,許立民,126,0870714,0870714,0870714,9冊17頁,2,8,彭志平,財團法人台北市基督教台灣貴格會,0491217,台北市萬盛街一四四號,以傳道教導暨醫療方法，增進為基督耶穌傳教之興趣，及促進對外教人之傳道工作。,美國基督教美東貴格會捐助,台灣省政府四十九年十一月七日　府民一字第八四七０五號函,永久,269592452.00,1,0870714,0870714,0870724,,"代表法人之董事:彭志平
董事印鑑。",,,,
087法登他000434,1,2,許立民,1507,0870714,0870715,0870715,61冊43頁,2,3,楊祖珺,財團法人兩岸關係文教基金會,0790720,台北市文山區景興路二０二巷十一號十樓之一,促進兩岸文化學術交流。,由林正杰捐助,"教育部七十九年七月七日  台(79)文字第三二一四０號函",永久,3000000.00,1,0870715,0870724,0870724,,"代表法人之董事：楊祖君
董事印鑑",,,,
087法登他000435,1,2,許立民,1790,0870715,0870716,0870716,71冊19頁,2,2,陸　榕,財團法人新光人壽保險股份有限公司職工福利委員會,0830527,台北市敦化南路一段二四三號,以謀求全體員工福利為目的。,由新光人壽保險股份有限公司提撥之職工福利金之賸餘財產,"台北市政府勞工局八十三年一月五日 北市勞三字第二八二二六號函",永久,71209044.00,1,0870716,0870724,0870724,,"代表法人之董事：各董事。
董事印鑑。",,,,
087法登他000436,1,2,許立民,2033,0870715,0870716,0870716,79冊28頁,,0,高仲源,財團法人榮民榮眷基金會,0860718,台北市光復南路卅二巷十六弄十九號一樓,以亡故現役軍人或退除役官兵在大陸地區繼承人申請遺產之核發、榮民重大災害之救助、清寒榮民子女教育獎助學金及教育補助、其他有關榮民、榮眷福利及服務。,依臺灣地區與大陸地區人民關係條例第六八條第四項規定所捐助之遺產,行政院國軍退除役官兵輔導委員會八十六年七月九日(86)輔壹字第一三八五五號函,永久,1530000000.00,1,0870716,0870724,0870724,,,,,,
087法登他000437,1,2,許立民,142,0870715,0870810,0870810,10冊19頁,2,19,饒奇勳,財團法人中國石油股份有限公司職工福利委員會,0500710,台北市中山區中山北路二段一一三號五樓,以辦理中國石油股份有限公司職工及其眷屬之福利事業。,由中國石油股份有限公司依照法令規定提撥之福利金,中華民國五十年元月,永久,1051298.00,1,0870810,0870821,0870821,,"代表法人之董事：饒奇勳
董事印鑑。
原捐助暨組織章程經本院八十七年度法字第二十四號民事裁定准予補充變
更。",,,,
087法登他000439,1,2,許立民,1865,0870716,0870911,0870911,73冊64頁,2,2,許水德,財團法人亞太文經學術基金會,0840520,台北市敦化南路二段二一六號二０樓之一,在研究並推動國內外有關文化、教育、經濟發展之學術合作及交流，提昇中華民國人文及科技水準，協助中華民國發展成為亞太地區文化經濟中心，進而加強及促進中華民國與亞太地區暨全球其他國家互惠合作之文化經貿關係為宗旨,由發起人許水德先生及宏福建設公司等六家公司捐助,"教育部八十四年四月二十四日  台(84)社字第０一八四一九號函",永久,42202801.00,1,0870911,0870918,0870918,,"代表法人之董事；許水德
董事印鑑。
原捐助章程第三條、第八條、第十二條經本院八十六年度法字第一三六號
民事裁定准予補充變更。",,,,
087法登他000440,1,2,許立民,1314,0870717,0870717,0870717,55冊11頁,2,4,毛松年,財團法人華語文教育發展基金會,0770901,台北市舟山路二四三號,以研究、倡導、協進華文教育、宏揚中華文化為宗旨。,由張希文先生等捐助,"教育部七十七年八月五日  台（七七）高字第三六四二六號函",永久,1000000.00,1,0870717,0870724,0870724,,"代表法人之董事：毛松年。
董事印鑑。",,,,
087法登他000441,1,2,許立民,675,0870717,0870717,0870717,33冊45頁,1,7,孟憲傑,財團法人宏恩綜合醫院,0650421,台北市仁愛路四段七十一巷一號,服務社會、嘉惠病患、增進地方公益、研究醫療學術、加強國民保健為目的。,由楊濟華等人及財團法人宏恩醫院捐助。,六十四年十二月三日行政院衛生署　衛署醫字第八七０二三號函,永久,86414013.00,1,0870717,0870724,0870724,,"代表法人之董事：孟憲傑。
繼任董事印鑑。",,,,
087法登他000442,1,2,許立民,1344,0870717,0870804,0870804,56冊11頁,,0,郭均祥,財團法人台北市私立長德老人基金會,0780123,台北市信義區基隆路二段十九號六樓之一,以辦理服務老人，擴大老人福利為目的。,董事共同捐助,台北市政府社會局七十七年十二月二十七日　北市社三字第四五八九六號函,永久,11606101.00,1,0870804,0870811,0870811,,"原捐助章程第七條經本院八十七年度法字第七七號民事裁定准予補充變更
。",,,,
087法登他000443,1,2,許立民,1738,0870717,0870904,0870904,69冊27頁,2,2,董事長,財團法人台北市巫永福文化基金會,0821019,台北市民權東路三段一四二號七０五室,以設置評論獎及文化活動為宗旨。,由巫永福捐助。,八十二年九月二十五日台北市政府教育局　北市教四字第四五四五０號函,永久,5000000.00,1,0870904,0870911,0870911,,代表法人之董事：巫永福。,,,,
087法登他000444,1,2,許立民,1637,0870717,0870717,0870717,66冊5頁,,0,陳朝亨,財團法人台北市思源文教基金會,0810210,台北市中山區松江路一四八號九樓,宏揚中華文化培養賢才，增進社會公益造福人群提升生活品質及素質為宗旨。,捐助,台北市政府教育局八十年十二月十二日　,永久,10131880.00,1,0870717,0870724,0870724,,"代表法人之董事：陳朝亨。
新任董事印鑑。
原捐助章程第二、三、四、十五條經本院八十六年度法字第一一七號民事
　裁定准予補充變更。",,,,
087法登他000445,1,2,許立民,806,0870717,0870812,0870812,38冊7頁,2,7,李棟樑,財團法人中華民國貿易教育基金會,0680402,台北市松江路三五０號,以興辦貿易教育，協助貿易從業人員進修及對國際貿易問題研究推廣為宗旨。,創辦人台北市進出口商業同業公會及黃政旺先生等四十二人捐助,教育部六十八年三月十四日　台（）高字第六六０六號許可設立,永久,380000000.00,1,0870812,0870821,0870821,,"代表法人之董事：李棟樑。
董事印鑑。",,,,
087法登他000447,1,2,許立民,715,0870718,0870722,0870722,35冊5頁,1,6,朱寶奎,財團法人吳仲亞先生教育慈善基金會,0660606,台北市敦化南路一段三０六號二樓,辦理獎助在學清寒青年及貧病醫療、慈幼、養老、傷殘暨更生青年之保護事項為宗旨。,由吳仲亞先生捐助,台北市政府教育局六十六年二月十六日　北市教四字第二九二三號函,永久,34532900.00,1,0870722,0870731,0870731,,"十月十八日止）
新任董事印鑑",,,,
087法登他000449,1,2,許立民,1938,0870720,0870811,0870811,76冊13頁,0,0,王安邦,財團法人消防教育學術研究基金會,0850803,台北市仁愛路四段四號三樓,以促進消防學術交流，提振消防學術研究風氣為宗旨,由古正義等人捐助,教育部八十五年七月廿五日　台社㈣字第八五五一二一五九號函,永久,10000000.00,1,0870811,0870821,0870821,,,,,,
087法登他000451,1,2,許立民,2014,0870720,0870805,0870805,78冊61頁,,0,高　澤,財團法人安居文教基金會,0860428,台北市和平東二段二六五巷四四號一樓,本會推行生活安全維護之學術研究、辦理有關推廣安居生活及科技知識為宗旨。,由高澤先生、趙森嚴先生、蕭碧珊女士等三人共同捐助。,教育部八十六年四月十七日　台社㈣字第八六０四一六三三號函,永久,10000000.00,1,0870805,0870814,0870814,,,,,,
087法登他000452,1,2,許立民,1949,0870721,0870721,0870721,76冊46頁,0,0,王宏修,財團法人王冠文教基金會,0850913,台北市遼寧街二０九巷四十三號,以發揚民族文化，提倡學術交流，推動科技成長，關心社會動態，結合高科技與人文教育，提升國人生活之品質，促進社會和諧與健康為宗旨,由王冠百貨企業股份有限公司、王重泉、王吳月、王宏修、王舜民共同捐助,教育部八十五年九月二日　台社㈣字第八五五一二四０九號函,永久,13365400.00,1,0870721,0870728,0870728,,,,,,
087法登他000453,2,2,許立民,471,0870722,0870803,0870803,17冊1頁,2,2,于春艷,社團法人台北市山東省莒縣同鄉會,0850109,台北市八德路四段一０六巷十弄四號　　　　　,以聯繫同鄉情感，促進同鄉互助，謀求同鄉福祉為宗旨。,社員繳納會費或自由樂捐,台北市政府社會局八十三年七月二十二日　北市社一字第三六八０九號函,永久,156800.00,1,0870801,0870801,0870814,,,,,,
087法登他000454,1,2,許立民,1659,0870722,0870724,0870724,66冊49頁,2,3,周俊吉,財團法人信義文化基金會,0810628,台北市敦化南路二段九七號十樓,以推廣社會教育、學術研究及文化交流活動，進而宏揚優質文化、提昇生活品質、促進和諧人生為宗旨。,由信義房屋仲介股份有限公司捐助,"教育部八十一年五月廿八日  台︵八一︶社字第二八三四六號函",永久,20000000.00,1,0870724,0870804,0870804,,"原捐助章程第二、三、十二、十四、十五條經本院八十六年度法字第七０
號民事裁定准予補充變更。",,,,
087法登他000456,1,2,許立民,114,0870722,0870805,0870805,8冊23頁,2,15,陳珠璫,財團法人大安工業協進會,0491017,台北市中正區館前路三十六號六樓,以協助獎學、培養工業技術優秀人材，並配合國策研究新進工商業技術與管理，以提昇工商業水準為宗旨。,捐助人等自由認捐,臺灣省政府建設廳四十九年一月八日　建工字第四八一一二號通知,永久,24846402.00,1,0870805,0870814,0870814,,"代表法人之董事：陳珠璫。
董、監事印鑑。",,,,
087法登他000457,1,2,許立民,1645,0870722,0870723,0870723,66冊21頁,2,3,星雲,財團法人佛光淨土文教基金會,0810421,台北市松隆路三二七號十三樓,本會推展宗教學術研究，聯合世界宗教學術團體，促進國際文化與宗教學術交流，為民眾謀幸福，為國家提昇國際地位，以淨化人心，安定社會為宗旨。,佛光山星雲大師捐助,教育部八十一年三月十七日　台（八一）社字第一三六九九號函,永久,295171022.00,1,0870723,0870731,0870731,,"代表法人之董事：星雲。
董事印鑑。",,,,
087法登他000458,1,2,許立民,1478,0870722,0870728,0870728,60冊43頁,1,3,謝森展,財團法人國際美育自然生態基金會,0790417,台北市大安路一段一０六巷十九號一樓,實現融合真、善、美的真文明及追求世界永久的和平。,由日本美育國際協會捐贈，並接受對外認捐。,七十九年四月九日行政院農業委員會　農林字第九一一三二九九Ａ號,永久,17000000.00,1,0870728,0870804,0870804,,繼任董事印鑑。,,,,
087法登他000459,1,2,許立民,1174,0870722,0870727,0870727,50冊27頁,2,5,李子弋,財團法人天帝教,0750825,台北縣新店市北新路二段一五三號,奉行天帝真道，化延核子毀滅劫，早日實現三民主義統一中國，為人類帶來永遠和平。,教徒奉獻樂捐,"內政部七十五年七月十六日  台︵七五︶內民字第四一七九０八號函",永久,122877055.00,1,0870727,0870727,0870807,,"原捐助暨組織章程第二、三、五、六條經本院八十四年度法字第一四一號
  民事裁定准予補充變更。",,,,
087法登他000460,1,2,許立民,1032,0870722,0870727,0870727,45冊41頁,2,5,辜嚴倬雲,財團法人台北榮星文教基金會,0721213,台北市民權東路三段一六０巷十九弄二號地下室,為紀念辜偉甫先生生前提倡音樂文化、陶冶美育的教育、薰陶品德，以正確的倫理和愛國觀念，培養訓練人才提高音樂水準特捐助財產，以設置榮星合唱團為目的。,捐助,台北市教育局七十二年十二月七日　北市教四字第六０六一五號,永久,1350000.00,1,0870727,0870804,0870804,,,,,,
087法登他000461,1,2,許立民,1528,0870723,0870805,0870805,62冊25頁,1,3,楊壽延,財團法人青年音樂家文教基金會,0790906,台北市松山區南京東路五段六號三樓,培養音樂人才，提高音樂水準，推展音樂活動，提昇中華文化為宗旨。,由崔玉磐、顏豐賜、林子宏、蘇丁選、張香華、林美寧、姚安莉、陳和慧、許德仁等人捐助。,教育部中華民國七十九年八月廿二日　台社字第四一四四四號函。,永久,3000000.00,1,0870805,0870814,0870814,,"代表法人之董事：陳和慧
新任董事印鑑。",,,,
087法登他000462,1,2,許立民,952,0870724,0870724,0870724,43冊1頁,2,6,洪伯廷,財團法人台北視覺文教基金會,0710603,台北市常德街一號,以促進有關視覺之教育及學術研究獎助，視覺保健服務以及有關視覺圖書之印刷，增進社會福利為宗旨。,經由籌備委員會勸募基金，日後繼續接受個人及團體之捐款,台北市政府教育局七十一年五月三日　北市教四字第一五七六二號函,永久,500000.00,1,0870724,0870804,0870804,,"代表法人之董事：洪伯廷。
董事印鑑。",,,,
087法登他000463,1,2,許立民,1877,0870727,0870728,0870728,74冊10頁,2,2,劉景豐,財團法人豐匙慈善公益基金會,0840711,台北市民生東路二段二十二號三樓,以舉辦或捐助慈善事業為目的。,由劉景豐等六人共同捐助,"內政部八十四年六月二十一日  台（八四）內社字第八四七七六六七號函",永久,50000000.00,1,0870728,0870728,0870807,,繼任董事印鑑。,,,,
087法登他000465,1,2,許立民,67,0870727,0870820,0870820,5冊19頁,2,16,各董事,財團法人台灣新生報業股份有限公司職工福利委員會,0471225,台北市延平南路一一０號十二樓,辦理職工福利事業為目的。,捐助,台北市政府社會局五十七年二月五日北市社一字第一三一九號函,永久,7037250.00,1,0870820,0870828,0870828,,"任期至九十年一月十八日止）
代表法人之董事：各董事。
董事印鑑。
原捐助章程第五條、第九條經本院八十七年度法字第七十三號民事裁定准
予補充變更。",,,,
087法登他000466,1,2,許立民,174,0870727,0870729,0870729,12冊23頁,,0,錢龍韜,財團法人台北市私立滬江高級中學,0510913,台北市羅斯福路六段三三六號,創辦私立滬江中學求其發展為目的。,自籌及捐募,教育部四十七年十月八日,無限期,477302815.00,1,0870729,0870807,0870807,,"代表法人之董事：錢龍韜。
董事印鑑。",,,,
087法登他000467,1,2,許立民,62,0870727,0870728,0870728,5冊9頁,2,26,汪彞中,財團法人台灣手工業推廣中心,0470320,台北市徐州路一號,以輔導手工業生產之合理發展，促進工藝品之改良與創新及外銷市場之推廣，俾增加國民就業機會，發展國家經濟為宗旨。,由美援及中美基金撥贈款項,經濟部四七年三月二十日　經公（四七）二字第０四一二四號函,永久,13948730.00,1,0870728,0870728,0870807,,繼任董事印鑑。,,,,
087法登他000468,1,2,許立民,1405,0870728,0870728,0870728,58冊15頁,2,3,張紹玉,財團法人台北市基督教改革宗長老會聯合二村教會,0780919,台北市民生東路九二九巷二弄十二號,本耶穌之精神，在台北市內傳揚基督教義，辦理社會公益慈善教育事業為宗旨。,國內外個人或團體之奉獻及捐贈,台北市政府民政局七十八年八月二十九日　︵七八︶北市民三字第一四四五七號函,永久,9642000.00,1,0870728,0870804,0870804,,"代表人之董事：張紹玉
新任董事印鑑。",,,,
087法登他000469,2,2,許立民,384,0870728,0870730,0870730,14冊7頁,2,3,楊芳婉,社團法人台北市婦女新知協會,0830629,台北市大安區新生南路三段五六巷七號二樓,以關心婦女問題、表達婦女意見、爭取婦女權益、支援不幸婦女；並喚起女性自我覺醒及鼓勵女性自我成長，以達成平等、公正、互敬、和諧的兩性社會為宗旨。,入會費、年會費、其他捐款,台北市政府社會局八十三年五月十日　北市社一字第二二二六二號函,永久,100000.00,1,0870730,0870730,0870807,,,,,,
087法登他000470,1,2,許立民,1647,0870728,0870729,0870729,66冊25頁,2,3,涂煌鎮,財團法人台北市新聯陽社會慈善公益事業基金會,0810421,台北市基隆路一段三九六號十一樓,本財團以辦理「社會救助、關懷與回饋」為目的。,捐助,台北市政府社會局八十一年二月十七日　北市社二字第五四三七號函,永久,28000000.00,1,0870729,0870807,0870807,,"代表法人之董事：涂煌鎮。
董事印鑑。",,,,
087法登他000471,1,2,許立民,188,0870729,0870731,0870731,13冊21頁,2,21,杜金池,財團法人台灣省政府糧食處職工福利委員會,0520514,台北市杭州南路一段十五號,以謀求本局全體職工福利改善職工之生活為目的。,依照職工福利金條例第二條規定提撥之福利金、捐助及其他收入,"台灣省政府社會處五十一年九月十日  社一字第二二二七四號函",永久,2273732.00,1,0870731,0870731,0870807,,"代表法人之董事：杜金池。
法人圖記、董事印鑑。
原捐助暨組織章程經本院八十七年度法字第一０號民事裁定准予補充變更",,,,
087法登他000472,1,2,許立民,1918,0870729,0870729,0870729,75冊43頁,2,2,辜嚴倬雲,財團法人中華民國婦聯聽障文教基金會,0850314,台北市長沙街一段二十七號,以推展並捐助聽障文教工作為宗旨。,由中華婦女反共聯合會捐助,教育部八十五年二月二十六日　台（八五）社（四）字第八五００四五九四號函,永久,20000000.00,1,0870729,0870807,0870807,,"代表法人之董事：辜嚴倬雲。
董監事印鑑。",,,,
087法登他000473,1,2,許立民,1835,0870729,0870730,0870730,72冊64頁,1,2,李遠哲,財團法人傑出人才發展基金會,0831129,台北市羅斯福路四段一號（中研院原子與分子研究所內一一八室）,為加強教育、發展高科技研究，充實人文、社會、自然、生命等科學水準及提昇文化。,由董世芬先生等捐助人共同捐助,"教育部八十三年十一月十一日  台︵八三︶社字第六一０一二號函",永久,952712042.00,1,0870730,0870730,0870807,,,,,,
087法登他000474,1,2,許立民,958,0870731,0870803,0870803,43冊13頁,1,8,石永貴,財團法人中國回教文化教育基金會,0710721,台北市新生南路二段六二號,本會係以闡揚回教文化、傳播回教教義、辦理國內外獎助學金、廣譯回教經典，促進國際回教文化交流與合作為宗旨。,由常子春、常子萱先生及中國回教基金保管委員會捐贈。,教育部七十一年六月九日　台（71）高字第一九四八０號函　,永久,5000000.00,1,0870803,0870811,0870811,,,,,,
087法登他000475,1,2,許立民,867,0870731,0870731,0870731,40冊9頁,2,7,葉明勳,財團法人大同文化基金會,0690707,台北市南京東路三段三一一號四樓,以宣揚中華文化促進國際間文化交流及研究各國文化教育問題為宗旨。,自由捐助,教育部六十九年七月三日　台（六九）高字第一九五四０號函,永久,11000000.00,1,0870731,0870731,0870807,,"原捐助章程第二、五、七、九、十、十九條經本院八十四年度法字第九四
  號民事裁定准予補充變更。",,,,
087法登他000476,1,2,許立民,998,0870801,0870821,0870821,44冊33頁,1,6,蔡昭賢,財團法人中央營建技術顧問研究社,0720429,台北市民生東路四段五四號九樓九０三室,承辦都市計畫等之規劃與開發自來水下水道及環境科技之研究與工程之設計操作管理建築技術及其他公共工程有關土木水利等之測量設計施工監造與檢驗等事項。,"由建華工程顧問,中國瓦斯水道,三冠工程顧問,集美工程顧問等股份有限公司及內政部營建署共同捐助","內政部七十二年一月二十七日  ︵七二︶台內營字第一三一八九五號函",永久,10100000.00,1,0870821,0870831,0870831,,"代表法人之董事：蔡昭賢。
新任董事印鑑。",,,,
087法登他000477,1,2,許立民,643,0870801,0870803,0870803,32冊41頁,1,8,各董事,財團法人山葉音樂振興基金會,0640917,台北市南京東路二段六號永新大樓十樓,以推廣全民音樂提高國民音樂水準為宗旨。,由台北市私立山葉音樂短期補習班及台灣山葉樂器製造股份有限公司共同捐助,教育部六十四年九月十三日　（六四）社二三八一五號函,永久,1000000.00,1,0870803,0870803,0870814,,,,,,
087法登他000478,1,2,許立民,578,0870801,0870803,0870803,30冊31頁,1,8,田可高,財團法人中心診所醫院,0630523,台北市忠孝東路四段七七號,以闡揚醫學維繫人才，救助貧苦病患，辦理義診及學術研究發行臨床醫學報告以服務社會大眾為目的。,由熱心醫學人士捐獻之，並得由國內外其他醫學團體或私人隨時續以捐款補助之,台北市政府衛生局六十三年二月九日　北市衛三字第０二六九七號函,永久,3321412.58,1,0870803,0870811,0870811,,"代表法人之董事：田可高。
董、監事印鑑。",,,,
087法登他000479,1,2,許立民,584,0870801,0870810,0870810,30冊43頁,2,9,林享能,財團法人台灣區肉品發展基金會,0630620,台北市溫州街十四號四樓,以調節肉品供需發展肉品貯存、運銷、加工，以充裕並穩定國內豬肉供應及促進畜牧增產為宗旨。,由本會捐助章程第四條一款規定之事業機關及業者捐助。,經濟部六十三年四月二日　經（六三）農字第八三八七號函,永久,201000000.00,1,0870810,0870821,0870821,,"代表法人之董事：林享能
董事、監事印鑑
原助章程第九條、第十條經本院八十七年度法字第十九號民事裁定准予補
充變更",,,,
087法登他000480,1,2,許立民,1640,0870803,0870803,0870803,66冊11頁,1,2,陳維昭,財團法人臺灣大學學術發展基金會,0810115,台北市羅斯福路四段一號,本會以促進台灣大學校園之發展及提昇台灣大學師生之學術研究與教學水準為宗旨。,基金捐助、一般捐助及捐贈。,教育部中華民國80年12月20日台(80)社字第68996號函,永久,50000000.00,1,0870803,0870803,0870803,,,,,,
087法登他000481,1,2,許立民,1654,0870803,0870803,0870803,66冊39頁,1,2,陳維昭,財團法人凝態科學研究基金會,0810530,台北市羅斯福路四段一號,本會以促進並提昇國內整合性凝態科學基礎與應用研究之水準為宗旨。,基金捐助、一般捐助及捐贈。,"八十一年五月十二日教育部  台︵八一︶社字第二四八三九號函",永久,26500000.00,1,0870803,0870803,0870814,,,,,,
087法登他000482,1,2,許立民,130,0870804,0870804,0870804,9冊25頁,2,15,各董事,財團法人台北市私立金甌女子高級中學,0500210,台北市杭州南路二段一號,以創辦金甌女子高級中學並謀其發展為目的。,1.董事捐獻2.社會捐助,"教育部三十七年十月十三日  中字第五六五一二號代電核准",永久,137221714.00,1,0870804,0870811,0870811,,"代表法人之董事：各董事。
新任董事印鑑。",,,,
087法登他000483,1,2,許立民,1800,0870804,0870804,0870804,71冊49頁,0,2,"狄  剛",財團法人天主教善牧社會福利基金會,0830708,台北市中山北路一段二號八樓八一五室,以宣導教育家庭為中心，增進青少年身心健康與福利，減少少女、兒童或婦女受虐待、惡意遺棄、押賣或被毆打等機會；並給予更生保護、輔導教育，以期重返社會為目的。,由財團法人天主教會台北教區附設善牧修女會捐助,"台北市政府社會局八十三年六月二十日  北市社六字第二八二七二號函",永久,34516965.00,1,0870804,0870804,0870814,,董事長狄剛印鑑變更。,,,,
087法登他000484,1,2,許立民,239,0870805,0870805,0870805,17冊7頁,2,12,"劉  信",財團法人台北市基督教浸信會仁愛堂,0540331,台北市八德路一段十一號,為發展基督教義、宗教教育及宣揚福音為宗旨。,捐助,"台北市政府五十四年三月四日  府民行字第五七七七八號函",永久,106401159.00,1,0870805,0870814,0870814,,"代表法人之董事：劉信
董事印鑑。",,,,
