登記案號,類別,案由,主任,登記號數,收件日期,登記日期,公告日期,登記簿,任期判定,屆期判定,法人代表,法人名稱,設立登記日期,主事務所,目的,捐助方法,許可機關日期,存立時期,財產總額,結案原因,結案日期,歸檔日期,發證日期,清算人,變更原因,註銷日期,撤銷日期,撤(註)銷機關文號,撤(註)銷原因
087法登他000219,1,2,許立民,169,0870414,0870415,0870415,12冊13頁,2,13,"謝  凡",財團法人耶穌基督末世聖徒教會台灣傳道部,0510714,台北市金華街一八三巷二四號,以宣揚基督之復興福音及耶穌基督末世聖徒教會所教導之基督教義及原則及維護本財團已持有及將來持有之財產。,由美國總會撥款捐贈與本會,台灣省政府五十一年七月二日　府民一字第四七九五三號函,永久,313726850.00,1,0870415,0870424,0870424,,"代表法人之董事：謝　凡。
董事印鑑。",,,,
087法登他000220,1,2,許立民,1272,0870414,0870420,0870420,53冊47頁,1,4,李鍾桂,財團法人中國青年服務事業文教基金會,0770413,台北市松江路二一九號,以服務青年，推展各項文教活動為宗旨。,捐助,"教育部七十七年三月廿三日  台︵七七︶高字第一一八九三號",永久,37103520.00,1,0870420,0870428,0870428,,繼任董事印鑑。,,,,
087法登他000221,1,2,許立民,1402,0870415,0870415,0870415,58冊9頁,1,3,三橋信一郎,財團法人第一勸業銀行慈善事業愛心基金會,0780906,台北市敦化北路一六七號宏國大樓二樓,以舉辦或捐助慈善事業為目的。,由日商第一勸業銀行台北分行捐助,"內政部七十八年八月二十三日  台︵七八︶內社字第七三五二六八號函。",永久,30000000.00,1,0870415,0870424,0870424,,繼任監察人印鑑。,,,,
087法登他000223,1,2,許立民,714,0870416,0870417,0870417,35冊3頁,2,9,李天智,財團法人台北市私立忠義育幼院,0660602,台北市文山區景興路八五巷十二號一至四樓,創辦私立忠義育幼院托兒所並謀其發展為目的。,由劉德岑女士及李天智出資創辦各董事贊助社會人士自由捐助。,五十九年八月十六日台北市政府社會局　北市社四字第一四七九九號函,永久,6409750.00,1,0870417,0870424,0870424,,"代表法人之董事：李天智。
董事印鑑。",,,,
087法登他000224,1,2,許立民,611,0870416,0870428,0870428,31冊37頁,0,0,黃烈火,財團法人和泰汽車、味全食品關係企業純青社會福利基,0631118,台北市松江路一二一號十三樓,以舉辦及獎助社會福利事業為目的，以服務社會。,創立時由和泰汽車、味全食品工業等股份有限公司共同捐助,"內政部六十三年十一月九日  台內社第六０九九０八號函",永久,168703127.00,1,0870428,0870505,0870505,,,,,,
087法登他000225,1,2,許立民,810,0870417,0870420,0870420,38冊15頁,2,7,蔣仲苓,財團法人國防工業發展基金會,0680508,台北市博愛路一六四號,為促進國防有關工業加速整體發展。,自強救國捐獻及國內外公私團體或個人之捐獻。政府循預算程序撥助款。其他收入,"行政院六十八年三月十日  台︵六八︶財字第二二四九號函",永久,5000000000.00,1,0870420,0870501,0870501,,"代表法人之董事：蔣仲苓。
新任董、監事印鑑。",,,,
087法登他000227,1,2,許立民,1928,0870417,0870420,0870420,75冊73頁,1,1,白培英,財團法人建弘文教基金會,0850521,台北市博愛路五十三號十樓,以推動財經政策研究、提昇文化藝術水準為目的,由洪敏弘先生及建弘證券投資信託股份有限公司共同捐助,教育部、中華民國八十五年四月廿五日台社㈣字第八五五０六九三四號函,永久,10000000.00,1,0870420,0870501,0870501,,繼任董事長、董事印鑑。,,,,
087法登他000228,1,2,許立民,1836,0870417,0870417,0870417,72冊67頁,2,2,曾元一,財團法人台大土木文教基金會,0831202,台北市羅斯福路四段一號,以提昇土木工程科技水準、協助國立台灣大學土木工程學系所（以下簡稱台大土木系所）與國立台灣大學土木系所校友聯誼會（以下簡稱校友會）發展為宗旨。,由曾元一先生等共同捐助,"教育部八十三年十一月廿三日  台（八三）社字第０六三四三二號函",永久,12000000.00,1,0870417,0870424,0870424,,"代表法人之董事：曾元一。
新任董事印鑑。",,,,
087法登他000229,1,2,許立民,1551,0870418,0870420,0870420,63冊11頁,1,3,"高  輝",財團法人民主文教基金會,0791023,台北市中正區仁愛路二段七一號九樓之六,以推廣國家民主與統一之教育及促進公共政策之學術研究為宗旨。,熱心人士捐助。,七十九年十月十二日教育部　台︵七九︶社字第五０二四七號。,永久,10000000.00,1,0870420,0870501,0870501,,,,,,
087法登他000230,1,2,許立民,1558,0870420,0870420,0870420,63冊25頁,2,5,"孫  震",財團法人台大經濟研究學術基金會,0791114,台北市徐州路廿一號,以促進及獎助經濟研究之學術活動為宗旨。,由陳朝亨先生等人捐助,"教育部七十九年十一月三日  台︵七九︶社字第五四０五八號函",永久,13100000.00,1,0870420,0870428,0870428,,"代表法人之董事：孫　震。
董事印鑑。",,,,
087法登他000231,1,2,許立民,1465,0870420,0870428,0870428,60冊17頁,2,4,曹道成,財團法人中華輪胎資源再利用基金會,0790314,台北市復興北路一八一號十樓,以配合政府政策、防止污染、維護環境整潔及維護人民健康為目的。,基金由泰豐輪胎、固特異輪胎、南港輪胎、台灣普利司通、正新橡膠工業等公司捐助,行政院環境保護署七十九年三月六日　（七九）環署綜字第０三七０三號函,永久,5000000.00,1,0870428,0870508,0870508,,"代表法人之董事：曹道成。
董事印鑑。
原捐助章程第五、六、七、八、九、十、十一、十二、十三、十四、十五
、十八、十九、二十一、二十六條經本院八十七年度法字第六號民事裁定
准予補充變更。",,,,
087法登他000232,1,2,許立民,473,0870421,0870424,0870424,27冊1頁,0,9,高銘輝,財團法人中國童子軍文教基金會,0610908,台北市龍江路四０號,以培育智仁勇兼備之健全國民，發展中國童子軍運動，加強童子軍用品器材之研究製作及供應為宗旨。,捐助,"教育部六十一年八月九日  （六一）社一八九四三號代電",永久,850000.00,1,0870424,0870501,0870501,,"原捐助章程第一、二、四條經董事會議決修改，報經主管機關同意備查。
法人圖記。",,,,
087法登他000233,1,2,許立民,1593,0870421,0870422,0870422,64冊35頁,0,3,各董事,財團法人李國鼎科技發展基金會,0800525,台北市敦化南路二段六五號十三樓Ｂ,以協助發展科技促進國家進步為宗旨。,由吳尊賢等捐助,"教育部八十年五月十四日  台︵八十︶社字第二三五０八號函",永久,144500000.00,1,0870422,0870501,0870501,,,,,,
087法登他000234,1,2,許立民,2111,0870421,0870422,0870422,81冊85頁,2,3,萬德群,財團法人晨光文化事業文教基金會,0810804,台北市忠孝東路一段一七六號三樓,發展我國新聞事業，揚昇固有文化為宗旨。,由瀚興實業股份有限公司捐助,台中市政府八十一年七月八日　八十一府教社字第六七六三八號函,永久,58906032.00,1,0870422,0870501,0870501,,"代表法人之董事：萬德群。
董事印鑑。
原捐助章程第四、六、十五條經台灣台中地方法院八十七年度法字第五號
民事裁定准許變更。",,,,
087法登他000235,1,2,許立民,2040,0870421,0870422,0870422,79冊49頁,1,1,吳仁輔,財團法人亞太文化學術交流基金會,0860821,台北市光復北路一九九號一樓,以促進亞太地區國家有關教育、文化、科技、藝術、運動、政治及經濟等之學術交流，以提昇彼此間之人文、生產力與生活素質為宗旨。,由吳仁輔、許國泰、王隆基及羅玉陵等四人共同捐助,教育部八十六年八月十二日　台文字第八六０八七八九八號函,永久,10000000.00,1,0870422,0870501,0870501,,"繼任董事印鑑。
原捐助章程第六、十六條經本院八十六年度法字第一五二號民事裁定准予
補充變更。",,,,
087法登他000236,1,2,許立民,1446,0870422,0870430,0870430,59冊39頁,2,3,孫沛德,財團法人中國幼稚教育基金會,0790206,台北市木柵路一段二九二號,研究、倡導及推廣幼兒教育為宗旨。,自由樂捐,"教育部七十八年十二月廿八日 台社六四一九六號函",永久,1600000.00,1,0870430,0870508,0870508,,"代表法人之董事：孫沛德。
董事印鑑。",,,,
087法登他000238,1,2,許立民,1959,0870422,0870515,0870515,76冊76頁,1,1,章孝嚴,財團法人中國青年和平團,0851105,台北市忠孝西路一段六號十樓,推動青年志工服務、增進人群和諧、促進世界和平與發展,由社團法人中國國民黨捐助,"行政院青年輔導委員會八十五年八月廿一日  （八五）青輔肆字第四００三七七號函",永久,150000000.00,1,0870515,0870526,0870526,,"代表法人之董事變更為章孝嚴。
繼任董事長印鑑。",,,,
087法登他000239,1,2,許立民,1777,0870422,0870422,0870422,70冊67頁,0,2,蕭安樂,財團法人天恩至德文教基金會,0830331,台北市文山區指南路三段三八巷三七之二號,本會以擴大社會教育功能，宣揚中華倫理文化，發揚國粹及獎助在挍學生敦品勵學為宗旨。,韓雨霖先生捐助,"教育部八十三年三月九日  台︵八三︶社字第０一二一三九號函",永久,11130400.00,1,0870422,0870501,0870501,,,,,,
087法登他000240,1,2,許立民,1528,0870422,0870422,0870422,62冊25頁,2,3,陳和慧,財團法人青年音樂家文教基金會,0790906,台北市南京東路五段六號三樓,培養音樂人才，提高音樂水準，推展音樂活動，提昇中華文化為宗旨。,由崔玉磐、顏豐賜、林子宏、蘇丁選、張香華、林美寧、姚安莉、陳和慧、許德仁等人捐助。,教育部中華民國七十九年八月廿二日　台社字第四一四四四號函。,永久,3000000.00,1,0870422,0870501,0870501,,"代表法人之董事：陳和慧。
董事印鑑。",,,,
087法登他000241,1,2,許立民,2064,0870422,0870422,0870422,80冊34頁,,0,趙藤雄,財團法人遠雄文教基金會,0861119,台北市基隆路一段二００號廿三樓之一,以宏揚博愛精神，發揚倫理道德，提倡學術交流，關心社會動態，促進社會和諧與健康暨獎助及提攜清寒，優秀學子為宗旨。,由趙藤雄捐助,教育部八十六年十一月十一日　台(86)社(四)字第八六一三一五八六號函,永久,50000000.00,1,0870422,0870501,0870501,,,,,,
087法登他000242,2,2,許立民,152,0870422,0870506,0870506,6冊21頁,1,5,"洪  迪",社團法人中華民國錄音著作權人協會,0781116,台北市信義區東興路五九號四樓,以保障錄音著作權人權益，調和社會公共利益，促進國家文化發展及推廣國際文化交流為宗旨。,會員繳納之會費及捐贈,"內政部七十八年十月十二日  台︵七八︶內社字第七四五七０四號函",永久,600000.00,1,0870506,0870515,0870515,,"代表法人之理事：李岳奇。
新任理事印鑑。",,,,
087法登他000243,1,2,許立民,1871,0870423,0870622,0870622,73冊82頁,2,2,黃承文,財團法人黃建斌文教基金會,0840627,台北市大安區大安路一段五十一巷二十三號二樓,以配合國家教育文化政策，推展文教公益事業為宗旨。,由黃建斌先生捐助,教育部八十四年五月二十六日　台（八四）社字第０二四四五０號函,永久,10500000.00,1,0870622,0870703,0870703,,"代表法人之董事：黃承文。
董事印鑑。",,,,
087法登他000244,1,2,許立民,320,0870423,0870429,0870429,21冊47頁,2,10,各董事,財團法人臺灣省台北縣私立崇光女子高級中學,0570502,台北縣新店市三民路十八號,以創辦私立崇光女子高級中學並謀其發展為目的。,捐助,"臺灣省政府教育廳五十六年七月十三日  教二字第０六一六九號函",永久,322416575.00,1,0870428,0870505,0870505,,"代表法人之董事：各董事。
新任董事印鑑。",,,,
087法登他000246,2,2,許立民,298,0870423,0870424,0870424,11冊13頁,2,3,李中新,社團法人中華民國唐氏症關愛者協會,0810722,台北市復興南路一段二００號十二樓,以結合唐氏症者家長監護及關心唐氏症者人士團體及學者專家共同促進教養經驗之溝通或護理保健永久諮詢，進而爭取唐氏症者合法權益與福利，以期協助國家減輕負擔解決社會問題為宗旨,會員會費及捐助,內政部八十一年元月二十二日　台（八一）內社字第八一０一四八七號函,永久,166000.00,1,0870424,0870501,0870501,,"代表法人之理事：李中新。
新任理、監事印鑑。
原章程第七、十八、三十四條經會員大會議決修改，報經主管機關准予備
　查。",,,,
087法登他000247,1,2,許立民,1512,0870423,0870506,0870506,61冊53頁,0,3,各董事,財團法人杜詩綿教授學術基金會,0790803,台北市常德街一號台大醫院耳鼻喉科,以提昇國內耳鼻喉科臨床及基礎研究為目的。,由杜教授夫人及台大耳鼻喉科醫局共同捐助,"教育部七十九年六月二十八日  台︵七九︶社字第三０四三八號函",永久,5706000.00,1,0870506,0870515,0870515,,,,,,
087法登他000248,1,2,許立民,1939,0870424,0870424,0870424,76冊16頁,1,1,李聖文,財團法人中華民國關懷演藝人員基金會,0850803,台北市光復南路一００號,以關懷演藝人員為目的,由行政院新聞局、中華民國電視學會捐助,行政院新聞局八十五年七月廿三日　(85)起廣三字第一０四三九號函,永久,57300000.00,1,0870424,0870501,0870501,,繼任董事、監察人印鑑。,,,,
087法登他000249,1,2,許立民,972,0870424,0870506,0870506,43冊41頁,2,6,朱正義,財團法人中華民國朱氏宗親文教基金會,0711126,台北市重慶南路一段一二一號八樓二十二室,以明倫教孝，增進族誼，追懷祖德，獎勵中華民族文物研究，發展教育及學事業為宗旨。,由本會第一次籌備會議人員捐助,"教育部七十一年九月三十日  台︵七一︶高字第三五六八七號函",永久,1000000.00,1,0870506,0870518,0870518,,"代表法人之董事：朱正義。
董事、監察人印鑑。",,,,
087法登他000250,1,2,許立民,1052,0870427,0870521,0870521,46冊21頁,2,5,石明江,財團法人朝陽大學法律評論雜誌社基金會,0730509,台北市詔安街廿六巷十二號三樓,以發行法律評論雜誌宏揚民主憲政，促進法治為宗旨。,由朝陽大學校友捐助,台北市政府七十三年四月十二日　73府新一字第一四三０五號函,永久　,300000.00,1,0870521,0870529,0870529,,"代表法人之董事：石明江。
新任董事印鑑。",,,,
087法登他000252,1,2,許立民,1679,0870427,0870518,0870518,67冊29頁,2,2,趙玲玲,財團法人孫文學術思想研究交流基金會,0811006,台北市和平東路一段一六二號,以促進孫逸仙思想學術究與發展，並協助推動國家民主、統一為宗旨，依有關法令辦理相關業務。,由趙玲玲女士等七人捐助,教育部八十一年八月十五日　台（八一）社字第四五五五七號函　,永久,10000000.00,1,0870518,0870526,0870526,,"代表法人之董事：趙玲玲。
董事印鑑。",,,,
087法登他000253,1,2,許立民,908,0870427,0870429,0870429,41冊31頁,1,6,謝森中,財團法人中華經濟研究院,0700624,台北市長興街七十五號,一、從事國內、國際及特定地區經濟之研究１，并以其研究成果提供政府作決策上之參考。二、舉辦有關學術活動，促進國內外學術交流。三、接受各界之研究委託，并提供經濟資訊等有關服務。,由中央政府、中美經濟社會發展基金及工商界共同捐助,經濟部七十年六月十日　經︵七十︶技字第二二九五九號函,永久,1125649550.00,1,0870429,0870508,0870508,,繼任董事印鑑。,,,,
087法登他000254,1,2,許立民,1386,0870427,0870430,0870430,57冊35頁,2,4,黃博治,財團法人黃土英文教基金會,0780620,台北市仁愛路四段二三二號三樓之一,以提昇教育水準透過獎學金發放及本會舉辦教育、研究、著作、發明等之獎助為宗旨。,黃土英、黃博治、黃俊雄等捐贈,教育部七十八年六月一日　台高二五六七三號函,永久,7265520.00,1,0870430,0870508,0870508,,代表法人之董事：黃博治。,,,,
087法登他000255,1,2,許立民,1747,0870427,0870527,0870527,69冊45頁,,0,黃禎祥,財團法人臺灣省私立健順養護中心,0821125,台北縣深坑鄉昇高村王軍寮九號,以舉辦老人福利慈善事業為宗旨。,由黃阮粹蘭、黃康月滿、黃尊景、黃禎祥、黃禎憲、黃慧筠、林雅文,八十二年十一月五日台灣省政府社會處　︵八二︶社五字第五四六八六號函,永久,53000000.00,1,0870527,0870605,0870605,,"原捐助章程第廿一條經本院八十六年度法字第四號民事裁定准予補充變更
法人圖記。",,,,
087法登他000257,1,2,許立民,1048,0870428,0870501,0870501,46冊13頁,2,5,廖清霞,財團法人台北市友緣社會福利事業基金會,0730328,台北市南京東路五段五十九巷三十弄十八號一樓,以促進兒童心理健康和增進兒童生活適應能力，促進兒童福利發展、促進社會工作專業化為目的。,由廖國昌、廖國華、廖清霞、廖清碧等捐助,台北市政府社會局七十三年三月二十日北市社四字第一Ｏ八四二號,永久,1000000.00,1,0870501,0870508,0870508,,代表法人之董事：廖清霞。,,,,
087法登他000258,1,2,許立民,1855,0870428,0870429,0870429,73冊34頁,2,2,劉泰英,財團法人關懷長青文教基金會,0840227,台北市康定路三十七號,以從事老人安養、養生保健與醫療等相關問題之研究與資訊宣導，藉以提昇醫療服務層次與生命品質為宗旨。,由中央投資公司等四家公司所共同捐助,"教育部八十四年二月十三日  台︵八十四︶社字第００六五四六號函",永久,10000000.00,1,0870429,0870505,0870505,,"代表法人之董事：劉泰英。
董事印鑑。
原捐助章程第二、八條經本院八十七年度法字第三十九號民事裁定准予變
更。",,,,
087法登他000259,1,3,許立民,1609,0870428,0870708,0870708,65冊11頁,1,0,應式文,財團法人應式文法務基金會,0800827,台北市建國北路一段廿三巷三０號四樓,宏揚法治、申張正義。,由捐助人應式文捐助　,法務部八十年八月十五日　法律一二四一五號函,永久,1000000.00,1,0870708,0870708,,應式文,"解散之原因，可決之程序與日期：
因法人之董事長年邁體弱，難勝繁劇，業務後繼乏人，經董事會於八十六
年三月廿五日決議解散，並選任應式文為清算人，報經主管機關法務部八
十六年五月五日法律決字第一二六七０號函許可解散。
清算人之姓名及住址　
應式文　住台北市建國北路一段廿三巷三０號四樓
清算人印鑑。",,,,
087法登他000260,1,2,許立民,1847,0870429,0870430,0870430,73冊10頁,0,0,柯文昌,財團法人普訊融悟文教基金會,0831224,台北市民生東路三段一一五號十樓,以推廣文化教育事業為宗旨。,由柯文昌、柯文仁等八人捐助,"教育部八十三年十二月九日  台（八三）社字第０六六七三六號函",永久,47000000.00,1,0870430,0870508,0870508,,,,,,
087法登他000261,1,2,許立民,1709,0870429,0870429,0870429,68冊29頁,2,3,林敏欽,財團法人社會無醉文教基金會,0820415,台北市松江路三二八號六樓,推廣社會教育，發揚固有文化，推廣當代人文資訊，促進國際文化交流為宗旨。,由徐文勇捐助。,台北市政府教育局八十二年四月二日北市教四字第一一五一八號。,永久,5000000.00,1,0870429,0870508,0870508,,"代表法人之董事：林敏欽。
董事印鑑。
原捐助章程第四、十五條經董事會決議修改，報經主管機關同意備查。",,,,
087法登他000262,1,2,許立民,900,0870429,0870430,0870430,41冊15頁,2,6,曾元一,財團法人臺灣營建研究院,0700516,台北市基隆路四段四十三號,以推動有關營建技術方面研究為宗旨。,由行政院國軍退除役官兵輔導委員會榮工處捐助，國立臺灣大學及國立臺灣工業技術學院贊助,"內政部七十年三月十一日  ︵七十︶台內營字第一一０三四號函",永久,1000000.00,1,0870430,0870508,0870508,,"代表法人之董事：歐晉德。
董事印鑑。",,,,
087法登他000264,1,2,許立民,1746,0870430,0870501,0870501,69冊43頁,0,0,林金生,財團法人國家政策研究基金會,0821126,台北市徐州路二十一號國立台灣大學政治學系,以研究國家政策，促進國家進步與發展為宗旨。,由財團法人連震東文教基金會捐助。,"八十二年十一月十日教育部  台︵八二︶社字第０六二九三九號函",永久,13000000.00,1,0870501,0870508,0870508,,,,,,
087法登他000266,2,2,許立民,487,0870430,0870430,0870430,17冊49頁,2,19,高銘輝,社團法人中國童子軍總會,0850424,台北市朱崙街二十號十三樓,中國童子軍以發展青少年潛在能力，養成良好習慣，使其人格高尚、常識豐富、體魄健全，成為智仁勇兼備之公民；以建設民有、民治、民享之國家，而臻世界於大同為宗旨。,會員繳納會費或其它捐款,內政部七十九年一月　台內社第七五九二一七號立案證書,永久,4809786.00,1,0870430,0870508,0870508,,"代表法人之理事：高銘輝。
新任理、監事印鑑。",,,,
087法登他000267,1,2,許立民,1152,0870501,0870504,0870504,49冊43頁,2,5,柯希能,財團法人以琳基督徒中心,0750423,台北市新生北路三段二六號十一樓之十四,在弘揚基督真理，效法基督博愛救世之精神，廣傳福音、服務人群，並辦理公益慈善事業。,捐助,臺北市政府民政局中華民國七十五年四月七日北市民三字第二六八一九號函,永久,3078903.00,1,0870504,0870515,0870515,,"代表法人之董事：柯希能。
董事印鑑。",,,,
087法登他000268,1,2,許立民,190,0870502,0870505,0870505,13冊25頁,2,7,張萬利,財團法人台北市私立景文高級中學,0520812,台北市文山區保儀路一二七號,以創辦財團法人台北市私立景文高級中學並謀發展為目的。,全體董事出資,台北市政府五十九年九月二十二日　教輝二字第一七一一０號函,永久,66440232.00,1,0870505,0870512,0870512,,"代表法人之董事：張萬利。
董事印鑑。",,,,
087法登他000269,1,2,許立民,887,0870502,0870504,0870504,40冊49頁,2,12,林昭揚,財團法人私立大同工學院,0700126,台北市中山北路三段四０號,遵照國家教育政策暨現行教育法令之規定，辦理私立大同工學院，並謀其健全發展。,台北市協志工業振興會捐贈,"教育部五十二年六月廿四日  台︵五二︶高字第七七五三號函",永久,2777525867.00,1,0870504,0870515,0870515,,新任董事印鑑。,,,,
087法登他000270,1,2,許立民,1323,0870502,0870504,0870504,55冊29頁,2,3,呂學海,財團法人社大文教基金會,0771026,台北市信義區東興路四一號八樓,以倡導終身學習，推展社會教育為宗旨。,威京投資公司、崇光文教基金會、新學友書局共同捐助,"教育部七十七年九月三十日  台（七七）社字第四六二六八號函",永久,1000000.00,1,0870504,0870512,0870512,,"代表法人之董事：呂學海。
董事印鑑。",,,,
087法登他000271,1,2,許立民,39,0870502,0870506,0870506,3冊23頁,0,5,"狄  剛",財團法人天主教會台北教區,0450523,台北市樂利路九四號,以宣揚天主教教義及辦理社會慈善教育事業、福利等事業為目的。,由羅馬教廷捐助,台北市政府四十五年五月九日,永久,2503355531.00,1,0870506,0870515,0870515,,,,,,
087法登他000272,1,2,許立民,1334,0870504,0870505,0870505,55冊51頁,1,5,李子春,財團法人台北市婦女救援社會福利事業基金會,0771229,台北市復興南路一段三二一號七樓之一,以辦理不幸婦女之救援、提供法律諮詢與服務、輔導其生活與教育、重建其自信自立之人格，助其重返家庭及社會為目的。,捐款由捐助人捐款設立創辦,台北市政府社會局七十七年十二月八日　北市社四字第四三八九七號函,永久,12040000.00,1,0870505,0870515,0870515,,"代表法人之董事：李子春。
繼任董事長印鑑。",,,,
087法登他000273,1,2,許立民,1317,0870504,0870504,0870504,55冊17頁,2,5,李光華,財團法人中華民國印心禪學文教基金會,0770912,台北縣新店市自強路二三巷五二號,本會以弘揚中國國粹，中國禪學印心法，崇尚倫理道德，轉移社會風氣，充實精神文明，美化真善美人生，促進世界人類平等和平自由。,由黃國倫、蘇永安等先生捐助,"教育部七十七年七月十五日  台︵七七︶高字第三二七三三號函",永久,10000000.00,1,0870504,0870515,0870515,,"代表法人之董事：李光華。
董事印鑑。",,,,
