登記案號,類別,案由,主任,登記號數,收件日期,登記日期,公告日期,登記簿,任期判定,屆期判定,法人代表,法人名稱,設立登記日期,主事務所,目的,捐助方法,許可機關日期,存立時期,財產總額,結案原因,結案日期,歸檔日期,發證日期,清算人,變更原因,註銷日期,撤銷日期,撤(註)銷機關文號,撤(註)銷原因
104法登他000106,1,2,陳雪芬,96,1040907,1040917,1040918,4冊27頁,2,10,游永仁,財團法人台灣省嘉義市真武宮,0660805,嘉義市西區頭港里玉山路1013號,弘揚聖德啟發我國固有倫理道德，以淨化人心向善，並辦理慈善事業，而造福社會人群為宗旨。,黃啟緒、游朝讀等捐助,"嘉義縣政府 民國66年3月22日六六府民行字第21676號函",無限期,10596989.00,1,1040917,1041030,1040924,,第九屆董監事任滿，改選第十屆董監事。,,,,
104法登他000107,1,2,陳雪芬,111,1040911,1040930,1041005,5冊12頁,2,6,曹正芬,財團法人臺灣省嘉義市基督教浸禮聖經會嘉義會幕堂,0751217,嘉義市民權路364號,傳揚基督教聖經之非營利宗教教會，並得辦理附屬之慈善事業。,財團法人臺灣基督教浸禮會聖經會捐助及會友捐助,嘉義市政府75年10月17日府民禮字第57791號,無限期,2483246.00,1,1040930,,1041013,,第5屆任滿，改選第6屆董事。,,,,
104法登他000109,1,2,陳雪芬,293,1040914,1040916,1040917,11冊33頁,2,21,趙犁民,財團法人台灣兒童暨家庭扶助基金會(嘉義分事務所),0910403,臺北市信義區忠孝東路5段482號4樓,以辦理兒童、青少年、身心障礙者及家庭福利為宗旨。,由美國維吉尼亞州基督教兒童福利會捐助,臺灣省政府社會處43年12月10日,永久,4094144053.00,1,1040916,1041030,1041001,,,,,,
104法登他000110,1,2,陳雪芬,33,1040915,1040917,1040918,2冊3頁,1,17,柏殿宏,財團法人臺灣省嘉義市私立輔仁高級中學,0540226,嘉義市吳鳳南路270號,創辦私立輔仁中學並謀其發展為目的。,天主教聖言會總會捐助。,台灣省政府教育廳，民國51年7月20日教二字第02887號。,無限期,284123283.00,1,1040917,1041030,1041008,,董事任期中補選,,,,
104法登他000111,1,2,陳雪芬,46,1040915,1040922,1040923,3冊3頁,2,16,鍾安住,財團法人臺灣省嘉義市私立宏仁女子高級中學,0560503,嘉義市忠孝路667號,創辦私立宏仁女子中學，並謀其發展。,由天主教嘉義教區主教公署捐助之,臺灣省政府教育廳55年7月15日教二字第46490號函,永久,254621301.00,1,1040922,,1041015,,15屆任期期滿，改選第16屆董事。,,,,
104法登他000112,2,2,陳雪芬,470,1040915,1040922,1040923,17冊33頁,2,2,鍾啟煌,社團法人嘉義縣身心障礙友愛協會,1010831,嘉義縣竹崎鄉鹿滿村鹿鳴路7號,本會非以營利為目的，結合身心障礙者、家屬及社會人士，關懷身心障礙者和弱勢家庭，爭取其權利及福利。,會費及捐款,嘉義縣政府100年5月20日府社行字第1000091405號,無限期,146175.00,1,1040922,1041030,1041008,,,,,,
104法登他000113,1,2,陳雪芬,102,1040916,1040923,1040925,5冊3頁,1,9,廖建富,財團法人嘉義後備軍人（子女）獎學教育基金會,0690719,嘉義市民權路295號,鼓勵優秀後備軍人及其子女努力求學向上，培育國家英才，貢獻社會服務。,嘉義縣、市後備軍人暨熱心之社會人事、民間廠商捐助,嘉義縣政府69年6月9日69府教學字第030947號函,無限期,7507705.00,1,1040923,1041030,1041008,,,,,,
104法登他000114,1,2,陳雪芬,131,1041001,1041005,1041006,6冊5頁,2,13,江義雄,財團法人中正大學學術基金會,0791207,嘉義縣民雄鄉三興村大學路1段168號,發展學術、培養優秀人才、奬助傑出教師、及奬勵優秀學生,捐助,教育部79年11月27日台(79)社字第58649號,永久,17059598.00,1,1041005,,1041102,,董事任期屆滿改選。變更董事長為江義雄，新任董事黃仁竑、黃國芳。變更董事江義雄印鑑。,,,,
104法登他000116,1,2,陳雪芬,69,1041001,1041005,1041006,3冊53頁,2,8,王政羲,財團法人台灣省嘉義市天后宮,0620731,嘉義市林森東路113號,倡導我國固有道德宣揚聖道，勸眾人向善，善施恤貧等慈善事業而繁榮地方,捐助,中華民國62年7月6日嘉府嘉民行字第52059號許可書,無限期,6800000.00,1,1041005,,1041013,,第七屆董監事任滿，改選第八屆董監事。,,,,
104法登他000117,2,2,陳雪芬,473,1041005,1041007,1041008,17冊39頁,2,2,羅水素,社團法人嘉義市太元聖道會,1011008,嘉義市友愛路355之10號,以集眾之力，聚少為多，達「博普及於社會」為宗旨。本「取之於社會，用之於社會」回饋之念，持「老吾老以及人之老，幼吾幼以及人之幼」之心，恤寡矜、助殘障、濟無依，廣施愛心於社會，發揮善心於極致，凡此慈濟之行為，均為本會努力以赴，力求實踐之工作目的為宗旨。,一、會員入會費。二、常年會費。三、事業費。四、會員捐款。五、委託收益。六、基金及其孳息。,嘉義市政府101年8月22日府社行字第1015038397號函,永久,19200.00,1,1041007,,,,第一屆理監事任滿，改選第二屆理監事。,,,,
104法登他000118,1,2,陳雪芬,287,1041005,1041007,1041008,11冊21頁,2,6,陳蔡美惠,財團法人嘉義市私立瑞泰老人長期照護中心,0901123,嘉義市玉山路669號,"辦理社會福利長期照護為宗旨，提供 一、長期慢性疾病或身心障礙老人所需之照護 服務 二、提供日間照護、臨時托顧、短期保護安置等綜合性服務 三、提倡正當休閒活動 四、配合政令宣導，舉辦衛生保健、護工訓練、社工講座 五、贊助推行社會福利相關活動 六、參與相關慈善活動",營運設備及銀行存款捐助,嘉義市政府嘉市府社福字第83523號民國90年9月28日核准設立,永久,1815277.00,1,1041007,,1041020,,第五屆董事任滿，改選第六屆董事。,,,,
104法登他000119,1,2,陳雪芬,467,1041006,1041008,1041012,17冊27頁,1,2,盤振詮,財團法人聯發電氣研究發展教育基金會,1010720,嘉義縣太保市祥和一路東段90號,一、端正社會風氣、推動青少年正常生活之教育活動。二、配合教育單位舉辦節約能源之教育宣傳活動。三、設立電力設備檢測實驗室，做各類電力設備、儀表等檢測。四、舉辦學生進入實驗室學習，學習電力相關知識，輔導進入職場。五、舉辦弱勢團體專業人才之培訓與認證。六、與學界及相關機構交換經驗和合作，提昇電力設備專業水準。七、進行電力系統、設備檢測及相關法規之研究。八、捐助教育獎助金。九、辦理其他公益文教活動。,葉蔡傳獨捐，依法完成財團法人登記後，得繼續接受捐助。,嘉義縣政府中華民國101年7月5日府教社字第1010263656號,永久,2000000.00,1,1041008,,,,"董事陳敏華辭任，補選變更為羅仕玖。
董事長葉蔡傳辭任，改選變更為盤振詮。",,,,
104法登他000120,1,2,陳雪芬,29,1041012,1041016,1041020,1冊29頁,2,18,王福賢,財團法人嘉義市北社尾振淨公祭祀會,0520404,嘉義市西區北湖里北社尾路202巷9號,祭祀嘉義市北社尾王姓遷台祖先為宗旨,財產收益,嘉義縣政府民國52年3月15日嘉府宗民行字第11718號函,無限期,380000.00,1,1041016,,,,"17屆董事任期屆滿，改選第18屆董事。（董事印鑑全部重新留存）
法人地址變更（門牌整編）。",,,,
104法登他000121,1,2,陳雪芬,429,1041015,1041015,1041016,16冊11頁,2,3,蔡錦玲,財團法人和線教育基金會,0990317,嘉義縣民雄鄉北斗村34鄰新正五街41號,培育良善、科技人文兼容並蓄的下一代。,由蔡錦玲小姐捐助，登記完成後得繼續接受捐助。,嘉義縣政府民國99年2月12日府教社字第0990034103號,永久,17296569.00,1,1041015,1050317,1041028,,,,,,
104法登他000123,1,2,陳雪芬,444,1041019,1041019,1041020,16冊41頁,1,2,黃文亮,財團法人新港國中教育基金會,1000613,嘉義縣新港鄉福德路106號,以協助嘉義縣立新港國民中學校務發展為目的。,如章程之捐助方法。,嘉義縣政府100年5月11日府教社字第1000086792號。,永久,2000000.00,1,1041019,,1041111,,,,,,
104法登他000125,1,2,陳雪芬,142,1041104,1041104,1041105,6冊16頁,2,7,莊國輝,財團法人銘光文教基金會,0820127,嘉義市圳頭里盧厝108之17號5樓之1,回饋社會，奬勵後進，提升文化水準為宗旨,遠東機械工業股份有限公司捐助壹佰伍拾萬元、遠通精機股份有限公司捐助壹佰伍拾萬元、莊國輝捐助,嘉義市政府81年12月30日81府教社字第67787號,永久,9000000.00,1,1041104,,,,第六屆董事任滿，改選第七屆董事。財產變更為900萬元。,,,,
104法登他000126,1,2,陳雪芬,424,1041110,1041111,1041113,16冊1頁,1,2,鍾安住,財團法人嘉義縣私立天主教安道社會福利慈善事業基金會,0981127,嘉義縣朴子市學府路二段92號,一、關於老人福利事業事項。二、關於身心障礙者福利事項。三、關於兒童及少年福利事業事項。四、關於婦女福利事業事項。五、關於社會救助事業事項。六、接受政府機關委託辦理事項。七、關於原住民福利服務事項。八、關於志願服務志工之訓練與推廣事項。九、有關福音傳播工作之相關事項。十、其他有關社會福利慈善事業事項。,由財團法人天主教嘉義教區捐助。,"嘉義縣政府中華民國98年11月13日  府社救字第0980175219號",永久,10000000.00,1,1041111,,1041120,,章程變更，董事長鍾安住地址變更。,,,,
104法登他000127,2,2,陳雪芬,135,1041113,1041113,1041116,6冊9頁,2,12,簡琦𡤜,社團法人嘉義縣仁愛慈善會,0801123,嘉義市垂楊路689號,以發揮人溺己溺，人飢己飢之精神，老吾老以及人之老，幼吾幼以及人之幼的美德，啟發我國倫理道德，發揚社會仁風義舉，造福社會人群為目的,會員會費及社會善心人士樂捐,嘉義縣政府80年10月12日嘉府社行字第082965號人民團體立案證書,永久,19038033.00,1,1041113,,,,第11屆理監事任滿，改選第12屆理監事（第12屆理事戴光宗辭任，由吳陽明遞補）。,,,,
104法登他000128,1,2,陳雪芬,260,1041119,1041123,1041123,10冊27頁,1,6,李雅景,財團法人台灣農業發展基金會,0890104,嘉義縣朴子市大葛里27鄰吉祥七街76號,發展農業、富麗農村、造福農民。,由李雅榮等13人共同捐助。,行政院農業委員會88年11月30日（88）農輔字第88050669號函,永久,5000000.00,1,1041123,,1041130,,,,,,
104法登他000129,1,2,陳雪芬,225,1041120,1041130,1041204,9冊19頁,2,6,華淑芳,天主教中華聖母修女會醫療財團法人,0870909,嘉義市東區蘭潭里大雅路2段565號,以宏揚基督博愛之精神，推行醫療保健服務，並促進社會公益。,由「財團法人台灣省嘉義市天主教會嘉義教區中華聖母會」捐助成立。,"行政院衛生署 86年11月3日衛署醫字第86063473號",永久,489000000.00,1,1041130,,1041216,,章程第6條變更，經衛生福利部104年10月19日衛部醫字第1041668103號函及本院104年度司法字第15號准予變更。,,,,
104法登他000130,1,2,陳雪芬,3,1041120,1041120,1041123,1冊3頁,2,12,吳振明,財團法人臺灣省私立嘉義博愛仁愛之家,0440705,嘉義市東區林森東路235號,一、興辦社會福利救助事業，服務弱勢族群尊重生命價值與發揚人道精神。二、發展長期照護業務，協助失能者在生命餘光裡開創新價值，進而重燃對生活的希望。三、以機構式照護為基礎，結合社區資源推動社區照護，落實在地老化。,財產孳息、業務收入、地方捐贈、政府補助及其他收益撥充。,嘉義縣政府40年6月30日嘉府民字第35146號函（內政部40年11月7日內社7620號函准予備案）,無限期,128036414.00,1,1041120,1050317,1041204,,,,,,
104法登他000131,1,2,陳雪芬,187,1041201,1041221,1041221,8冊3頁,2,9,鄭金鎮,財團法人民雄文教基金會,0850913,嘉義縣民雄鄉西安村西安路130-1號,以獎勵教育、推展文化、維護並培育善良風俗、提振人文素養、提高國民生活品質、改善整體生活環境。,由何明宗等捐助,"嘉義縣政府 85年8月26日85府教社字第98204號函",永久,7510000.00,1,1041221,,,,第八屆董事任期屆滿改選第九屆董事。,,,,
104法登他000132,1,2,陳雪芬,319,1041204,1041207,1041216,12冊25頁,2,5,陳俊男,財團法人嘉義縣私立瑞泰社會福利基金會,0930112,嘉義縣番路鄉新福村5鄰許厝22號,兒童福利、青少年福利、婦女福利、老人福利、殘障福利、急難救助、低收入補助、醫療補助、志願服務、災害（變）救濟、接受主管機關指導辦理事項。,由陳蔡美惠發起創設暨陳嘉星等捐助,嘉義縣政府93年1月2日府社救字第0930007225號函,永久,10000000.00,1,1041207,,,,第4屆董事任滿改選第5屆董事,,,,
104法登他000133,1,2,陳雪芬,155,1041208,1041216,1041218,6冊29頁,2,8,黃國芳,財團法人張進通許世賢教育事務基金會,0830624,嘉義市共和路167號,本會以奬勵教育，推展公益為宗旨,由遺族親友及各界社會人士、社團損助,嘉義市政府83年6月20日83府教社字第35884號函,永久,10000000.00,1,1041216,,,,第七屆董監事任滿改選第八屆董監事、財產變更為1千萬元、章程變更、信印變更。,,,,
104法登他000134,1,2,陳雪芬,324,1041209,1041216,1041218,12冊35頁,2,5,葉松海,財團法人嘉義縣私立開元殿福松老人養護中心,0930426,嘉義縣溪口鄉柴林村65之2號,依老人福利及相關法規，以對老人提供服務與福利為宗旨。,如章程之捐助方法,"嘉義縣政府 93年3月30日府社福字第0930043488號函",永久,41470620.00,1,1041216,,,,第4屆任滿改選第5屆董事（第4屆董事全部連任）、財產總額變更為41470620元、章程變更。,,,,
104法登他000135,1,2,陳雪芬,63,1041209,1041217,1041218,3冊41頁,2,14,陳柏鍠,財團法人臺灣省嘉義市私立大同高級商業職業學校,0620531,嘉義市彌陀路255號,以創辦私立大同高級商業職業學校，並謀其發展。,詳捐助章程,台灣省政府教育廳　中華民國六十一年九月二七日,永久無限期,72680660.00,1,1041217,,,,財產總額變更。,,,,
104法登他000136,1,2,陳雪芬,94,1041217,1021218,1041221,4冊25頁,1,10,陳良清,財團法人台灣省嘉義縣梅山玉虛宮,0660729,嘉義縣梅山鄉梅東村中山路72號,倡導我國固有道德，宣揚聖教，勸導向善，興辦慈善公益事業，協助繁榮地方，促進社會褔利,由玉虛宮捐贈及信徒樂捐,嘉義縣政府中華民國66年6月14日66府民行字第44471號許可書,永久,7527616.90,1,1041218,,,,章程變更（第13、23、27條變更）。,,,,
104法登他000137,1,2,陳雪芬,424,1041223,1041224,1041230,16冊1頁,2,3,鍾安住,財團法人嘉義縣私立天主教安道社會福利慈善事業基金會,0981127,嘉義縣朴子市學府路二段92號,一、關於老人福利事業事項。二、關於身心障礙者福利事項。三、關於兒童及少年福利事業事項。四、關於婦女福利事業事項。五、關於社會救助事業事項。六、接受政府機關委託辦理事項。七、關於原住民福利服務事項。八、關於志願服務志工之訓練與推廣事項。九、有關福音傳播工作之相關事項。十、其他有關社會福利慈善事業事項。,由財團法人天主教嘉義教區捐助。,"嘉義縣政府中華民國98年11月13日  府社救字第0980175219號",永久,10000000.00,1,1041224,,,,第二屆董事任滿，改選第三屆董事。,,,,
104法登社000001,2,1,陳雪芬,511,1040114,1040115,1040116,18冊15頁,,,鍾震璋,社團法人台灣扶農協會,1040115,嘉義縣民雄鄉正大路3段2119號,以扶助農民、推展企業資源引入農業產銷模式、推動農業傳承與創新、推行老農安養機制、引導農民發展與大地共生之自然農法等宗旨。,一、入會費。二、常年會費。三、事業費。四、會員捐款。五、委託收益。六、基金及其孳息。七、其他收入,內政部103年12月27日台內團字第1030331426號函,永久,0.00,1,1040115,,1040202,,,,,,
104法登社000002,2,1,陳雪芬,512,1040126,1040127,1040128,18冊17頁,,,游象輝,社團法人嘉義縣以斯帖全人關懷協會,1040127,嘉義縣太保市崙頂里1鄰5之16號,為傳揚「耶穌基督的愛」，結合群力，整合社會資源，以服務弱勢族群，發揮基督精神及興辦社會公益或慈善事業為宗旨。,入會費、常年會費、事業會、捐助收入、委託收益、基金及其孳息,嘉義縣政府101年6月26日府社人團字第1010004092號函,永久,0.00,1,1040127,,1040130,,,,,,
104法登社000003,2,1,陳雪芬,513,1040212,1040213,1040216,冊頁,,,李宗立,社團法人中華民國晧月佛教文化學會,1040213,嘉義縣竹崎鄉灣橋村1鄰坑仔內9之1號,宏揚釋尊教法、推廣佛教藝術文化，淨化人心，促進社會和諧。,一、入會費。二、會員會。三、事業費。四、會員捐款。五、委託收益。六、基金及其孳息。七、其他收入,內政部103年8月28日台內團字第1030226340號函,永久,0.00,1,1040213,,,,,,,,
104法登社000004,2,1,陳雪芬,514,1040212,1040216,1040216,冊頁,,,陳金城,社團法人嘉義縣鹿草山子脚南陳協進會,1040216,嘉義縣鹿草鄉後堀村山子脚22號,弘揚孝道，宣導傳統宗教儀式活動、祭祀禮儀，淨化社會提昇社會倫理道德，配合政府推行心靈改革，以促進社會和諧。,入會費、常年會費、會員捐款、其他收入,嘉義縣政府104年1月8日府授社人團字第1030246239號函,永久,0.00,1,1040216,,,,,,,,
104法登社000005,2,1,陳雪芬,515,1040213,1040224,1040225,冊頁,,,陳淑芬,社團法人嘉義市髮藝整體造型暨多元產業推廣協會,1040224,嘉義市國安二街63號,一、互助、扶助服務暨辦理公益活動。二、各行各業從業人員學術與技藝提升，互助交流運用有效資源結合發揮效益。三、提供各行各業創業培訓就業人才，培養與集聚之平台。四、保障會員權益，增進會員技能改善會員生活條件，謀取會員福利。,一、入會費。二、常年會費。三、事業費。四、會員捐款。五、委託收益。六、基金及其孳息。七、其他收入,嘉義市政府103年11月14日府社行字第1035043522號函,永久,0.00,1,1040224,,,,,,,,
104法登社000006,2,1,陳雪芬,516,1040302,1040304,1040305,18冊25頁,,,陳怜娜,社團法人嘉義縣太保福音協會,1040304,嘉義縣太保市太保里46號之1二樓,宣揚神愛世人之福音，也以擬平城鄉差距，培養具有創意與優良品格的青少年和提升太保社區互助互愛之精神。,一、入會費。二常年會費。三、事業費。四、會員捐款。五、委託收益。六、基金及其孳息。七、其他收入。,嘉義縣政府96年11月7日府社行字第0960155252號函,永久,0.00,1,1040304,,,,,,,,
104法登社000007,2,1,陳雪芬,517,1040310,1040320,1040323,18冊27頁,,,葉聰銘,社團法人台灣愛延續協會,1040320,嘉義市東區荖藤里荖藤宅23-11號,匯集各領域之菁英從事公益活動，並妥善運用各方面資源，以照顧獨居老人，單親家庭暨弱勢族群之生活、健康、休閒與教育，關懷偏遠地區等目的。,會費以及會員捐款。,內政部103年8月7日台內團字第1030206856號函,永久,0.00,1,1040320,,1040330,,,,,,
104法登社000008,2,1,陳雪芬,518,1040401,1040407,1040407,18冊29頁,,,周清輝,社團法人嘉義市基督教慕義學會,1040407,嘉義市東區民權路200號9樓之2,1.傳揚耶穌基督福音，使人認識基督教信仰。2.促進會友彼此相愛，建造美好生命。3.積極參與公益服務，促進社會祥和。,1.入會費及常年會費。2.會員捐款。3.基金及其孳息。4.其他收入,嘉義市政府100年11月24日府社行字第1005051151號函,永久,0.00,1,1040407,,1040417,,,,,,
104法登社000009,2,1,陳雪芬,522,1040409,1040416,1040417,18冊37頁,,,張文祥,社團法人嘉義市弱勢關懷重建協會,1040416,嘉義市忠義街131號,提供弱勢者關懷協助服務及職業訓練、職業重建、生活藝能教育、就業資訊媒合、社會救助為目的。以培養弱勢者正確人生觀、促進人際互動、增強競爭能力、提升生活品質、維護生命尊嚴為宗旨。,入會費、常年會費、事業費、會員捐款、委託收益、基金及其孳息、其他收入,嘉義市政府103年9月5日府社行字第1035033470號函,永久,0.00,1,1040416,,1040427,,,,,,
104法登社000010,2,1,陳雪芬,524,1040428,1040505,1040515,18冊41頁,,,江和謙,社團法人台灣新住民交流協會,1040505,嘉義縣大林鎮溝背里溝背163號,以提昇會員生活品質，拓展生活領域、增進生活幸福，建立互信的家庭，促進新住民家庭都能互相學習與交流為宗旨。,入會費等,內政部104年2月9日台內團字第1040000595號函,永久,0.00,1,1040505,,1040521,,,,,,
104法登社000011,2,1,陳雪芬,526,1040520,1040629,1040630,18冊45頁,,,許育仁,社團法人台灣諸羅鸞鳳慈善會,1040629,嘉義縣大林鎮明和里甘蔗60號,以團結善心，濟弱扶貧為宗旨,年度會費收入及募款,內政部104年5月8日台內團字第1040029977號函,永久,0.00,1,1040629,,1040702,,,,,,
104法登社000012,2,1,陳雪芬,527,1040728,1040730,1040731,18冊47頁,,,陳清文,社團法人嘉義縣地政士公會,1040730,嘉義縣新港鄉文昌街27號,以顧及會員權益，充實學術智能，提昇服務品質，維護不動產交易安全，保障人民財產權益。並協助政府推行政令及增進地政士之社會信譽為宗旨。,會員繳納入會費、常年會費、捐助及其他收入,嘉義縣政府91年1月8日91府社行字第0006849號函,永久,0.00,1,1040730,,1040810,,,,,,
104法登社000013,2,1,陳雪芬,528,1040728,1040731,1040803,18冊49頁,,,郭章燦,社團法人臺灣嘉義大學獸醫校友會,1040731,嘉義市新民路580號獸醫學系系館D04-105室,以加強系友間連繫，增進友誼，砥礪學行，以及服務社會為宗旨。,1入會費。2常年會費。3事業費。4會員捐款。5委託收益。6基金及其孳息。7其他收入,內政部104年5月14日台內團字第1040025397號函,永久,0.00,1,1040731,,1040813,,,,,,
104法登社000015,2,1,陳雪芬,531,1040916,1040930,1041005,18冊55頁,,,李燕蕙,社團法人正念助人學會,1040930,嘉義市東區文雅里9鄰文雅街150巷10號11樓之2,本會宗旨以華人文化為基礎，推廣各類型之正念助人課程與學術研究，以期利益台灣與華人之社會。,會費收入、政府補貼。,內政部104年8月14日台內團字第1040060505號函,永久,0.00,1,1040930,,1041013,,,,,,
104法登社000016,2,1,陳雪芬,532,1041012,1041019,1041020,18冊57頁,,,許晉源,社團法人台灣外籍婚姻媒合輔導協會,1041019,嘉義縣水上鄉柳新村柳子林615號,以促進美滿婚姻之服務、辦理跨國（境）婚姻媒合服務、提升婚姻媒合之服務品質、協助政府推展法令、協調會員關係、增進會員及社會利益、促進跨國（境）聯姻婚姻和諧為宗旨。,會員會費級捐款。,內政部104年9月15日台內團字第1040065913號函。,永久,0.00,1,1041019,,,,,,,,
104法登社000017,2,1,陳雪芬,533,1041021,1041029,1041031,18冊59頁,,,司徒惠禎,社團法人嘉義市心康復之友協會,1041029,嘉義市西區世賢路2段600號,本會以協助精神疾病患獲得完善之醫療與復健，增強社會大眾對精神疾病患者的關懷與接納，並為其爭取應有之權利與福利為宗旨。,入會費、常年會費、事業費、會員捐款、委託收益、基金及其孳息、其他收入。,嘉義市政府104年7月7日府社行字第1041610823號函。,永久,0.00,1,1041029,1050318,1041119,,,,,,
104法登社000018,2,1,陳雪芬,534,1041021,1041104,1041105,18冊61頁,,,郭文昌,社團法人嘉義縣愛分享體育協會,1041104,嘉義縣民雄鄉建國路2段142-158號,以促進青少年體育運動、青少年運動休閒、提倡國內年輕學子體育運動發展為宗旨。,入會費、常年會費、會員捐款、委託收益、基金及其孳息、其他收入。,嘉義縣政府104年10月15日府授社人團字第1040183216號函。,永久。,50000.00,1,1041104,,,,,,,,
104法登社000019,2,1,陳雪芬,535,1041126,1041204,1041207,18冊63頁,,,莊為仁,社團法人台灣特殊植物實用研究學會,1041204,嘉義市文化路664號之1,針對臺灣特殊植物之實際可用性，並與其相類似或易誤認之植物做一相較性、植物名稱之正名、市場流通之草本書籍校正、植物成分之科學分析、民俗流通之植物使用方法等等之研究與記錄。,會員會費及募款。,內政部中華民國104年10月7日台內團字第1040073073號函,永久,0.00,1,1041204,,,,,,,,
104法登社000020,2,1,陳雪芬,536,1041204,1041216,1041218,18冊65頁,,,楊尚峰,社團法人嘉義縣番路鄉逐鹿社區發展協會,1041216,嘉義縣番路鄉觸口村梅花一路1號,以促進社區發展、增進居民福利、建設安和融洽、團結互助之現代化社會為宗旨。,入會費、常年會費、社區生產收益、政府機關之補助、捐助收入、社區辦理福利服務活動之收入、基金及其孳息、其他收入。,嘉義縣政府102年10月23日府授社人團字第1020194048號函,永久,0.00,1,1041216,,,,,,,,
