登記案號,類別,案由,主任,登記號數,收件日期,登記日期,公告日期,登記簿,任期判定,屆期判定,法人代表,法人名稱,設立登記日期,主事務所,目的,捐助方法,許可機關日期,存立時期,財產總額,結案原因,結案日期,歸檔日期,發證日期,清算人,變更原因,註銷日期,撤銷日期,撤(註)銷機關文號,撤(註)銷原因
104法登社000021,2,1,陳雪芬,537,1041214,1041218,1041221,18冊67頁,,,郭春在,社團法人中華托育及教育專業人員培育推展協會,1041218,嘉義市西區八德路160號,以提升嬰幼兒托育及教育從業人員的專業素質，培養術德兼備涵養之托育及教育之專業人才，補充家庭教育功能，以承續「幼吾幼以及人之幼」之精神，奠定了「仁」的哲學理念為宗旨。,會員會費、活動贊助等。,內政部104年11月18日台內團字第1040084200號函,永久,0.00,1,1041218,,1041230,,,,,,
104法登社000022,2,1,陳雪芬,538,1041216,1041230,1050106,18冊67頁,,,林文泉,社團法人台灣中醫藥學會,1041230,嘉義縣大林鎮民權路46號,以弘揚中醫藥學術、培養中醫藥人才、謀求中醫藥之發展、提高國民保健常識為宗旨。,會員會費及捐款。,內政部104年10月8日台內團字第1040067342號函。,永久,0.00,1,1041230,,1050113,,,,,,
104法登財000001,1,1,陳雪芬,519,1040401,1040407,1040407,18冊31頁,,,莊士賢,財團法人修平教育基金會,1040407,嘉義縣太保市麻寮里北港路2段247巷36號,1.協助嘉義縣各國民中小學，家境清寒學生的教育獎、助學金。2.其他與本會設立宗旨相關之公益性教育事務。,由莊武雄、莊士賢、強本汽車交通事業股份有限公司、強展汽車股份有限公司共同捐助創辦。,嘉義縣政府104年3月26日府教社字第1040054632號函,永久,2000000.00,1,1040407,1040825,1040417,,,,,,
104法登財000002,1,1,陳雪芬,520,1040402,1040413,1040414,18冊33頁,,,吳嬌容,財團法人薪傳教育基金會,1040413,嘉義縣竹崎鄉沙坑村下厝6-1號,關懷幼兒與兒少福利及推廣公益性教育活動為宗旨。,由吳泓熀等人捐助,嘉義縣政府104年4月1日府教社字第1040057240號函,永久,2000000.00,1,1040413,,1040415,,,,,,
104法登財000003,1,1,陳雪芬,521,1040409,1040416,1040417,18冊35頁,,,黃萬福,財團法人翰陽文教基金會,1040416,嘉義縣民雄鄉北斗村中華路92號,培育優秀或具潛力運動選手。,由翰陽開發股份有限公司捐助,嘉義縣政府104年4月8日府教社字第1040060633號函,永久,2000000.00,1,1040416,,1040420,,,,,,
104法登財000004,1,1,陳雪芬,523,1040501,1040504,1040505,18冊39頁,,,侯兆銘,財團法人臺灣省嘉義縣侯壽宗祠,1040504,嘉義縣朴子市双溪里双溪口50之1號,以祭祀侯壽宗族祖先，闡揚祖德，弘揚孝道，敦化人心，延續家族文化傳統，維護善良風俗及公益推行。,侯兆銘等人共同捐助,嘉義縣政府104年4月13日府民禮字第1040065218號函,永久,13407830.00,1,1040504,,,,,,,,
104法登財000005,1,1,陳雪芬,525,1040522,1040602,1040605,18冊43頁,,,蘇隆顯,財團法人中華基督教嘉義浸信會民雄分會傳愛浸信會,1040602,嘉義縣民雄鄉正大路1段372號（104.12.15全案撤回）,實行耶穌基督所托付的使命，傳揚福音，領人歸主，遵行聖經教訓，發揮新約教會精神，並辦理教育、安養院及各項慈善事業，服務社會。,財團法人中華基督教嘉義浸信會捐助,嘉義縣政府104年4月29日府民禮字第1040075377號函,永久,36921170.00,1,1050418,1050318,,,,,,,
104法登財000006,1,1,陳雪芬,529,1040824,1040825,1090826,18冊51頁,,,李泰賢,財團法人嘉義市私立永嘉社會福利慈善事業基金會,1040825,嘉義市中山路300號6樓,辦理社會福利慈善事業為目的,捐助,嘉義市政府104年8月20日府社福字第1041613858號函,永久,10000000.00,1,1040825,1050318,1041012,,,,,,
104法登財000007,1,1,陳雪芬,530,1040902,1040915,1040918,10冊6頁,,,羅崑龍,財團法人嘉義市伏龍宮,1040915,嘉義市西區博愛路2段408巷1號附1,弘揚道教教義，樹立民間正言，宣導主神聖蹟，革除不良習俗，激發人心向上、促進社會和諧、復興民族文化，並舉辦公益慈善及文化教育建設等事項為宗旨。,嘉義市伏龍宮捐助。,嘉義市政府104年8月24日府民禮字第1045034042號函,永久,47422358.00,1,1040915,,,,,,,,
