104法登他000249,1,2,陳美月,659,1040817,1040818,1040820,33冊34頁,2,5,呂子昌,財團法人新北市私立淡信社會福利慈善事業基金會,0920312,新北市淡水區中正路67號,以舉辦並協助推展或捐助社會福利慈善事業，致力提昇社會生活品質，促進社會和諧發展為宗旨。,設立基金共新台幣壹仟萬元整，由保證責任台北縣淡水信用合作社發起創設捐助,台北縣政府　中華民國92年2月26日　北府社助字第0920062698號,永久,10000000.00,1,1040818,,,邱煥宸,新北市淡水區中正路67號,251,,,,,,,,,,,,,https://aomp109.judicial.gov.tw/judbp/whd6k/q/FvCyH2gX4-L9_yrky5LxzqfxGbQWV5jJuibfTy1tCyggPVSTxHK_ac35pzA=
104法登他000250,1,2,陳美月,326,1040817,1040818,1040820,16冊31頁,2,7,陳博明,財團法人台灣癌症臨床研究發展基金會,0860716,台北市北投區石牌路2段95號2樓之2及之3,鼓勵優秀癌症臨床醫學人員，研究發展固體腫瘤學、血液腫瘤學及骨髓和造血細胞移植，增進國際癌症臨床醫學交流，提高我國癌症臨床醫學水準。,由台北榮民總醫院陳博明主任發起，經新光醫院吳董事長東進先生等捐助新台幣一千萬元為創設基金，嗣後接受各界熱心癌症臨床醫學研究發展之團體或個人自由捐贈,行政院衛生署86.7.2衛署醫字第86035823號,永久,65500000.00,1,1040818,,,李新芝,台北市北投區石牌路2段201號（基金會聯合辦公室）,112,,,,,,,,,,,,,https://aomp109.judicial.gov.tw/judbp/whd6k/q/3OXo9UXuJxE1wOp3wfeEUAHekcJ_SKebqMip-772-izQZ1fQl8JVEO4jh8Q=
104法登他000251,1,2,陳美月,1569,1040818,1040819,1080820,79冊3頁,1,7,辜仲諒,財團法人松柏文教基金會,0830906,台北市南港區經貿二路188號5樓,以期透過本國與各國之藝術、學術機構暨民間團體之交流活動，推展本國之藝術、文藝、醫學、管理科學研究及其他相關之文教學術活動為宗旨。,由辜濂松先生與中國信託商業銀行等十四家公司等共同捐助,內政部中華民國83年8月4日台（83）社字第043012號函,永久,92000000.00,1,1040819,1050106,1040827,陳怡如,台北市信義區信義路5段7號68樓,110,,,,,,,,"章程變更：
1.章程第3條、第24條條文內容變更，業經主管機關文化部104年6月12日文綜字第1041014844號函核備。
2.章程第6條、第12條、第13條條文內容變更，業經本院民事庭104年度法字第16號民事裁定確定。",,,,,https://aomp109.judicial.gov.tw/judbp/whd6k/q/XIe0qQsjVaVa53BLydJhX4rZc-0XgxOJRQ_iIQqx0FO-FCa6g6TnS8EgMil7
104法登他000252,1,2,陳美月,718,1040819,1040820,1040824,36冊31頁,2,8,黃輝珍,財團法人台灣綜合研究院,0830106,新北市淡水區中正東路2段27號29樓,從事各項綜合學術議題之研究，以提供政府制訂政策之參考，並加強全球華人及海峽兩岸文化及科技之交流為目的。,由潤泰建設股份有限公司等十三家工商企業捐助，俟完成登記後，繼續接受捐助。,教育部82年11月8日　台（82）高字第062271號函,永久,371492143.00,1,1040820,,,李瑞儀,新北市淡水區中正東路2段27號29樓,251,,,,,,,,,,,,,https://aomp109.judicial.gov.tw/judbp/whd6k/q/eRm4qPUGTxuyFbSw1VIJJQa7t7k1ePr3YkHUMr-E9rY868v_JOiEYuzp1tM=
104法登他000253,1,2,陳美月,227,1040819,1040825,1040827,11冊33頁,1,7,許慧明,財團法人淡水文化基金會,0840328,新北市淡水區鼻頭街22號,促進淡水藝文發展，建設淡水文化城鎮。,設立基金新台幣陸佰萬元正，由捐助人陳俊哲等254人共同捐助。俟依法完成法人登記後，得繼續接受捐助,"台北縣政府84.3.13   84北府教三字第84891號函",永久,7000000.00,1,1040825,,,張乃儷,新北市淡水區鼻頭街22號,251,,,,,,,,,,,,,https://aomp109.judicial.gov.tw/judbp/whd6k/q/Wx8OoKYgiP3h6zP-jy0G3EccaE5vDKRxxIlaJmvVYHTuVTsBpq-n0lQkFQ0=
104法登他000254,1,2,陳美月,1613,1040819,1040820,1040824,81冊7頁,1,1,辜仲諒,財團法人中國信託反毒教育基金會,1040612,台北市南港區經貿二路188號6樓,以預防青少年使用毒品，及宣導、推廣青少年反毒教育相關事業為宗旨。,設立基金共新臺幣參仟萬元整，由台灣彩券股份有限公司捐助；俟依法完成法人登記後，得繼續接受捐贈,教育部中華民國104年6月4日臺教社（三）字第1040070612號函,永久,30000000.00,1,1040820,,,陳怡如,台北市信義區信義路5段7號68樓,110,,,,,,,,,,,,,https://aomp109.judicial.gov.tw/judbp/whd6k/q/FyEDz9gCLegbKEyzQySJzCz0mgEXbmE8Oiy533NrI5xtebqTkF0BePkI7HsF
104法登他000255,1,2,陳美月,1067,1040820,1040820,1040824,54冊1頁,2,4,馬紹進,財團法人馬岐山基金會,0950915,台北市士林區雨農路14號1樓,以辦理社會福利慈善事業為目的。,設立基金共新臺幣三千一百萬元整，由泰豐輪胎股份有限公司捐助新臺幣三仟萬元，馬紹進先生捐助新臺幣一百萬元，俟完成法人登記後，得繼續接受捐贈,教育部中華民國95年8月25日台社(四)字第0950125441號函,永久,324642675.00,1,1040820,,,劉秋滿,台北市士林區雨農路14號1樓,111,,,,,,,,,,,,,https://aomp109.judicial.gov.tw/judbp/whd6k/q/JIp_ZIiAGDO4uu3ALuhpqN4exMOCo3CJyAcRsIAThjXYFM2b7Q2hzRDMXgMY
104法登他000256,2,2,陳美月,1113,1040820,1040820,1040824,56冊7頁,2,7,李連滋,社團法人中華無菌製劑協會,0860926,台北市承德路1段35號3樓,以結合製藥業與相關工業、政府及學術界之從業人員及認同本會宗旨之社會人士，共同提升醫藥物品質及製造技術，貢獻於社會為宗旨。,入會費、常年會費、事業費、會員捐款、委託收益、基金及其孳息、其他收入,內政部中華民國86年8月7日台(86)內社字第8687596號函,永久,851977.00,1,1040820,,,何佩倫,台北市承德路1段35號3樓,103,,,,,,,,,,,,,https://aomp109.judicial.gov.tw/judbp/whd6k/q/tP0PgR4NEgSHkQCwSG43i3lQKy8zqeMBwoEkUyDQHyA79JJMD1XQ-6-0QPLY
104法登他000257,1,2,陳美月,490113,1040824,1040826,1040831,1冊51頁,2,9,張曼琳,財團法人新北市天主教聖心會,0490903,新北市八里區龍米路1段263號,"為遵照  耶穌博愛精神以傳播天主教義及辦教育文化及公益福利等事業。",捐助,49年5月25日台北縣政府民政局(49)北縣民一字第5號,永久,314486102.00,1,1040826,,,陳辰益,新北市八里區龍米路1段263號,249,,,,,,,,,,,,,https://aomp109.judicial.gov.tw/judbp/whd6k/q/iSbNi_KSBOHcpYPga6bNiLtxJiObDmDHq_PocxnPx8FXYbYgfOc_7Rrxeri7coQ=
104法登他000258,2,2,陳美月,321,1040824,1040826,1040831,16冊21頁,2,23,謝博軒,社團法人中國生理學會,0860606,台北市內湖區民權東路6段161號6樓（國防醫學院生理及生物物理學科）,以聯絡國內外人士，共同發揚生理科學之研究及應用為宗旨。,入會費、常年會費、永久會員終生會費、補助費、自由捐助、基金及其孳息、其他收入,內政部48.10.3台(48)內社字第17676號,永久,450000.00,1,1040826,,,潘伊薇,台北市內湖區民權東路6段161號6樓（國防醫學院生理學科6328室）,114,,,,,,,,章程第6條、第13條、第20條、第25條、第30條及第36條條文內容變更，業經主管機關內政部104年4月20日台內團字第1040028145號及同年8月14日台內團字第1040059031號函備查。,,,,,https://aomp109.judicial.gov.tw/judbp/whd6k/q/oL9Rpo6IAVJ9wgytr3Fa3WcSZmbFPsa7N4-2hprS6r5YYZjwhKNWOtftGSc=
104法登他000259,1,2,陳美月,1105,1040826,1040827,1040901,55冊19頁,2,9,黃珊珊,財團法人青年之愛文教基金會,0790914,台北市內湖區成功路3段133號2樓,以推行民主法治教育，激勵青年以熱愛國家為榮，服務社會為傲為宗旨。,設立基金共新台幣參佰萬元整，由社會熱心人士捐助。俟完成法人登記後，得繼續接受捐助。,教育部79年8月20日(79)社字第40506號函,永久,3000000.00,1,1040827,,,李佳妍,台北市內湖區成功路3段133號2樓,114,,,,,,,,,,,,,https://aomp109.judicial.gov.tw/judbp/whd6k/q/iFBP-DNgT3d3LXNe_KQhQTIv4seVeFkATkG9-3vNnmtyYtpSeOruI__HaxNg
104法登他000260,1,2,陳美月,1296,1040825,1040826,1040831,65冊10頁,2,9,魏明春,財團法人台北市白陳惜慈善基金會,0781213,台北市內湖區民權東路6段160號4樓之2,以辦理貧困救濟獎助清寒提昇社會慈善風尚等慈善事業為目的。,基金總額新台幣肆仟萬元，由捐助人無償捐助之；嗣後得由捐助人或熱心公益人士、法人團體等隨時捐助補充之,臺北市政府社會局中華民國78年11月23日北市社二字第41459號函,永久,60000000.00,1,1040826,,1040908,張清波,台北市內湖區民權東路6段160號4樓之2,114,,,,,,,,,,,,,https://aomp109.judicial.gov.tw/judbp/whd6k/q/eTQeidf7VuWqsobfLJSYmyodD7C0WElPmtLkmMS9d6BDtYwzfmm4IdXrCOLe
104法登他000261,2,2,陳美月,362,1040827,1040828,1040901,18冊23頁,2,35,洪秀全,社團法人國際獅子會臺灣總會新北市淡水獅子會,0870113,新北市淡水區北新路74號3樓,發揚人類博愛互助精神，增進國際間友好的關係，尊重自由啟發智慧，提倡社會福利，促進國家安全。,入會費、常年會費、會員捐款、國內外公司團體及個人捐贈、基金之孳息、其他收入,台北縣政府⒑⒍,永久,4209815.00,1,1040828,,,張月霞,新北市三芝區淡金路2段99號4樓之1,252,,,,,,,,,,,,,https://aomp109.judicial.gov.tw/judbp/whd6k/q/jG94tszqurCNXGahtCQCyik4fNBsLRUvWOaqlE-iMtSIscadl86MfZb9BzU=
104法登他000262,1,2,陳美月,1349,1040827,1040828,1040901,68冊3頁,1,6,許銘能,財團法人醫藥品查驗中心,0870603,台北市南港區忠孝東路6段465號3樓,以提昇醫藥品之查驗品質與效率，確保醫藥品安全，促進製藥業發展，增進國人之健康為目的。,設立基金新台幣壹仟萬元，由行政院衛生署捐助；俟完成法人登記後，得繼續接受其他部會、相關團體或個人之捐助,行政院衛生署87年5月26日衛署醫字第87032010號函,永久,14000000.00,1,1040828,,,李以青,台北市南港區忠孝東路6段465號3樓,115,,,,,,,,章程第19條條文內容變更，業經本院民事庭104年度法字第19號民事裁定確定。,,,,,https://aomp109.judicial.gov.tw/judbp/whd6k/q/e-gmvSWxLwtE0t0Y8MnvVDkdQxxMOc307MBZjYVHK-QtgVnBQX7FcranbLgU
104法登他000263,1,2,陳美月,620,1040828,1040831,1040901,31冊37頁,1,11,王文正,財團法人戴運軌田蘊蘭伉儷學術基金會,0870804,台北市南港區八德路4段768巷1弄18號3樓之1,以發展學術（包含自然科學、社會科學、人文科學等）與奬勵優秀學生。,設立基金新台幣壹佰萬元整，由戴運軌先生家屬及親友等捐助；俟依法完成法人登記後，得隨時接受社會捐贈,教育部中華民國72年7月20日台字七二高28129號函,永久,2500000.00,1,1040831,,,邵曼珣,新北市新店區中央五街1號4樓,231,,,,,,,,,,,,,https://aomp109.judicial.gov.tw/judbp/whd6k/q/fvTaJVIEnUOtFuTIfD7stPKQkBz2BSUAfiH1fiffTF4ImTtEo4E9N9DEzG4=
104法登他000264,1,2,陳美月,251,1040828,1040831,1040901,13冊1頁,1,7,陳文正,財團法人台北市基督教浸信會榮恩堂,0841005,台北市內湖區內湖路3段143巷6號1樓,本博愛之精神，傳揚基督福音，辦理社會公益慈善事業及充實教友靈性生活。,捐助,台北市政府民政局84.9.18北市民三字第26449號函,永久,24320264.00,1,1040831,,,李建蓉,台北市內湖區內湖路3段143巷11號1樓,114,,,,,,,,,,,,,https://aomp109.judicial.gov.tw/judbp/whd6k/q/j83alfcCx7egRrK0a4ZJW0shjTk1HdZGI7bQ7KhLoxGqxyWtxfgeytyRR3Q=
104法登他000265,2,2,陳美月,755,1040901,1040901,1040903,38冊22頁,1,4,吳林秀琴,社團法人台北聖化懿德慈善協會,0930701,台北市民權東路6段56巷15弄3號,以社會救濟、救急、獎助學為宗旨。,入會費、常年會費、事業費、會員捐款、委託收益、基金及其孳息、其他收入,台北市政府社會局91年11月20日北市社一字第09138800500號函,永久,5332004.00,1,1040901,,,林明源,台北市內湖區民權東路6段56巷15弄3號,114,,,,,,,,,,,,,https://aomp109.judicial.gov.tw/judbp/whd6k/q/RUc8aPuAYGmhAIh8FsW4mdEUEOE15kZiJi-I6KjLva5Qy7ZHzQuO0ts0fR8=
104法登他000266,1,2,陳美月,514,1040901,1040901,1040903,26冊4頁,1,5,湯家坤,財團法人國光慈善事業基金會,0490515,台北市南港區南港路2段146號1樓,以辦理社會福利慈善事業為目的。,基金總額新台幣貳拾壹億元，除募集外另由其他團體或個人捐助之。,台北市政府47年11月15日北市社教字第33號函,永久,2100000000.00,1,1040901,,,魏月華,台北市南港區南港路2段146號,115,,,,,,,,,,,,,https://aomp109.judicial.gov.tw/judbp/whd6k/q/5e_IDYZdLrWLGxR353b1vNXrNFUAzgwdDHDkETgFPbp6WLQujAxiRaUeVXE=
104法登他000267,2,2,陳美月,420,1040901,1040902,1040908,21冊19頁,1,10,"范 晃",社團法人中華民國生長之家傳道協會,0821217,台北市重慶北路4段251號3樓,以在總攬生長之家教義之該宗教中心者生長之家總裁的指導之下，傳播谷口雅春大聖師所創始之生長之家教義，使人人了悟生命的實相，自覺自己是神子、佛子，藉以貢獻社會光明化為宗旨。,入會費、常年會費、事業費、捐款、委託收益、基金及其孳息、其他收入,內政部81年12月8日　台（81）內社字第8190376號函,永久,36432400.00,1,1040902,,,陳柏宏,台北市士林區重慶北路4段251號3樓,111,,,,,,,,,,,,,https://aomp109.judicial.gov.tw/judbp/whd6k/q/oYo-M65Vfu3PPosIwJ3IjT5y9F-XwoCI-VdiirEWuQ4CgGATBtqhYIlSw7U=
104法登他000268,1,2,陳美月,1604,1040901,1040902,1040908,80冊18頁,1,6,馮寄台,財團法人中國信託商業銀行文教基金會,0850117,台北市南港區經貿二路188號5樓,以從事有關文化藝術事物、藝文教育推廣、促進國際文化交流及財經金融等社會公益事業為宗旨。,設立基金共新臺幣壹仟萬元整，由中國信託商業銀行捐助；俟依法完成法人登記後，得繼續接受捐助,教育部中華民國84年12月8日台（84）社字第060837號函,永久,10000000.00,1,1040902,,1040914,蔡瑞芬,台北市南港區經貿二路168號26樓,115,,,,,,,,,,,,,https://aomp109.judicial.gov.tw/judbp/whd6k/q/wdpWt2P_XyzXTOpWDf0n6_55BYG9UB__omi2AdsYILzLXsH4G7_OroPg2oRA
104法登他000270,2,2,陳美月,270,1040901,1040903,1040908,13冊39頁,2,11,邱世哲,社團法人台灣安寧照顧協會,0850320,新北市淡水區民生路45號,結合從事安寧照顧之工作人員，發揚安寧照顧的學術與應用，推展安寧照顧之理念與實踐，分享安寧照顧之心得與精神，並謀求會員間之親睦與合作，及增進國際間安寧照顧團體之聯繫與學術及友誼交流為宗旨。,入會費、常年會費、贊助會員費、事業費、會員捐款、委託收益、基金及其孳息,內政部84年11月17日台內社字第8482805號函。,永久,646149.00,1,1040903,,,蔡佩如,新北市淡水區民生路45號台灣安寧照顧協會,251,,,,,,,,,,,,,https://aomp109.judicial.gov.tw/judbp/whd6k/q/dnmLbJ1JUigm9L7ibLDWriMtOWkIMJ8KMWXLPsLKtY2T75z6qoK9DWnQb8Q=
104法登他000271,1,2,陳美月,1342,1040902,1040903,1040908,67冊16頁,2,2,呂明儒,財團法人佛光普照基金會,1010223,台北市北投區致遠二路95巷4號3樓,本法人本於　典璧尼嘛仁波切傳承慈悲精神，以弘揚佛法、維護社會和諧為宗旨。,設立基金新台幣參仟萬元整，由邱正峰捐助，嗣後得繼續接受個人或有關單位之捐贈,內政部中華民國101年2月4日台內民字第1010082070號函,永久,62000000.00,1,1040903,,,,,104,,,,,,,,,,,,,https://aomp109.judicial.gov.tw/judbp/whd6k/q/9HSosHXnOd88UyV-X_1H1L194n9KFGSMMyNEn3i8dEy1drL_k68e13aaAV4N
104法登他000272,2,2,陳美月,1033,1040903,1040907,1040909,52冊7頁,1,3,李怡瑱,社團法人臺北市基督教大內之光協會,0970613,台北市內湖區星雲街90號1樓,基於耶穌基督信仰設置基督國度工人培訓中心，以「五重職份的成全、團隊牧養的分工、信徒裝備的建立、完成大使命的榮耀」，聯結臺北市大直內湖地區教會，服務社區，宣揚基督福音，訓練信徒宣教全世界為宗旨。,入會費、常年會費、會員捐款、委託收益、基金及其孳息、其他收入,臺北市政府社會局中華民國97年2月26日北市社團字第09731726000號函,永久,112339486.00,1,1040907,,,楊祈修會計師,台北市中山區民權東路2段206號3樓之4,104,,,,王湘棋,台北市中山區民權東路2段206號3樓之4（日笙會計師事務所）,104,,,,,,,https://aomp109.judicial.gov.tw/judbp/whd6k/q/ae5IVOZx7g7-FMJrMO5r9liLkrud-39BuSGRMtlS6JbE-k6Xt7LYWZscoRmY
104法登他000273,2,2,陳美月,1062,1040903,1040907,1040909,53冊16頁,2,10,呂昶賢,社團法人中華民國愛滋感染者權益促進會,0890629,台北市大同區承德路1段48號2樓,以促進社會平等、爭取及維護愛滋感染者應有的權利及福利、提高愛滋感染者的社會地位、遏止愛滋病毒蔓延為宗旨。,入會費、常年會費、委辦費、會員捐款、委託收益、基金及孳息、其他收入,內政部中華民國86年12月15日台(86)內社字第8690006號函,永久,497980.00,1,1040907,,1040914,蔡旻光,台北市大同區承德路1段48號2樓,103,,,,,,,,,,,,,https://aomp109.judicial.gov.tw/judbp/whd6k/q/oKYFB3JdA5mbRFnU5fw7KkjArrD9MEwcouNJBxzuRiYAbT8TlWhinPRIEDrn
104法登他000274,1,2,陳美月,1434,1040903,1040907,1040909,72冊8頁,2,4,陳茂強,財團法人軒宇文化藝術基金會,0951220,台北市內湖區陽光街321巷56號4樓之6,以提升文化生活品質、健全藝術發展環境，營造優質生活並促進國際文化藝術交流為宗旨,設立基金共新臺幣伍佰萬元整，由陳茂強創始董事捐助；俟依法完成財團法人登記後，得繼續接受捐贈,臺北市政府文化局中華民國95年12月18日北市文化四字第09532037900號函,永久,5000000.00,1,1040907,,,陳怡君,台北市中山區復興北路2號4樓之11,104,,,,,,,,,,,,,https://aomp109.judicial.gov.tw/judbp/whd6k/q/X5uUYn62UiSOdE37JtKp07-6XwD6tFsR9u6LrOmSnflBFVpo9bj5g2vcQDIL
104法登他000275,1,2,陳美月,117,1040904,1040907,1040909,6冊13頁,2,9,陳耀奇,財團法人益嬰文教基金會,0801128,新北市淡水區新民街30號2樓,以推行台北縣社區兒童教育發展為宗旨。,設立基金共新台幣貳佰萬元整，由陳耀奇、陳士訓、鍾調琴、陳瑜鳳、陳瑜玲、陳瑜芬共同捐助，嗣後得繼續接受捐助,臺北縣政府80年11月13日(80)北府教三字第349566號函,永久,3800000.00,1,1040907,,,,,112,,,,,,,,,,,,,https://aomp109.judicial.gov.tw/judbp/whd6k/q/16qHLjb-PSjPGA3cAgrBNWsU5f9oeESmDzzWQj6248sgySD7cdiKRod9KnA=
104法登他000276,1,2,陳美月,202,1040904,1040908,1040911,10冊23頁,1,6,邢仁壽,財團法人邢榮階紀念父母慈善事業基金會,0830812,台北市大同區迪化街1段14巷25號,以舉辦或捐助慈善事業為目的。,由邢榮階先生捐助成立基金會，嗣後得由其他個人、團體繼續捐贈,內政部83.7.30台(83)內社字第8317366號函,永久,257408000.00,1,1040908,,,,,,,,,,,,,章程第11條、第26條條文內容變更，業經主管機關衛生福利部中華民國104年8月17日部授家字第1040018541號函備查。,,,,,https://aomp109.judicial.gov.tw/judbp/whd6k/q/2tm3UKGFiapfwObRyq3owkZXVcA1pzI40NPVYgUG5P4_GMvs3aIhvekVQD8=
104法登他000277,1,2,陳美月,206,1040908,1040909,1040911,10冊31頁,1,7,彭芳谷,財團法人毒藥物防治發展基金會,0830923,台北市北投區石牌路2段201號,以資助及執行與毒品、藥物、化學毒物防治有關之研究發展、教育訓練、推廣及幫助解決相關問題為宗旨。,設立基金新台幣壹仟萬元整由國內各界自由捐獻，嗣後並得繼續接受國內外認同本會宗旨之個人或機關團體之捐助,行政院衛生署83.6.29衛署醫字第83040566號函,永久,24798929.00,1,1040909,,,李新芝,台北市石牌路2段201號,112,,,,,,,,章程第第27條條文內容變更，業經本院民事庭104年度法字第15號民事裁定確定。,,,,,https://aomp109.judicial.gov.tw/judbp/whd6k/q/P54OAbZVBl85u3_ldbN5VMlSLTeZMIrpeyZRbllD1s7SswJWQk6pQ8eJYLg=
104法登他000278,2,2,陳美月,574,1040908,1040909,1040911,29冊19頁,2,39,"張 珏",社團法人中華心理衛生協會,0900904,台北市大同區民權西路136號16樓之1,以結合民間及專業力量共同促進心理健康、預防心理疾病為宗旨。,入會費、補助費、自由捐、基金孳息,"內政部  中華民國44年3月20日",永久,521055.00,1,1040909,,,周倩蘋,台北市大同區民權西路136號16樓之1,103,,,,劉蓉台,台北市大同區民權西路136號16樓之1,103,,章程第5條、第6條條文內容變更，業經主管機關內政部104年8月11日台內團字第1040429287號函備查。,,,,,https://aomp109.judicial.gov.tw/judbp/whd6k/q/tK9LW_SlbqXBL7T8RNH1Npdre1erBPhPmImNASxQGjmK1ddIBXwmjIBbyLU=
104法登他000279,1,2,陳美月,374,1040908,1040909,1040911,19冊7頁,1,6,吳良材,財團法人吳振芳文教基金會,0870603,台北市大同區延平北路2段215號4樓,為推廣文化教育，發揚民族文化傳承，提升生活環境品質，促進社區營造，強化建築藝術之美及民族藝術保存。,設立基金共新台幣壹仟萬元整，由吳振芳先生捐助；俟依法完成法人登記後，得繼續接受捐贈,教育部87年4月22日台(87)社(四)字第87041416號,永久,36002500.00,1,1040909,,,林文慧,台北市大同區延平北路2段258號,103,,,,,,,,,,,,,https://aomp109.judicial.gov.tw/judbp/whd6k/q/_o3ZS9ZYBlH3N1ePGUQtoUt0TEqXlToRQoUaeF1GMGGje4PFRz2kGPq5164=
104法登他000280,2,2,陳美月,1302,1040908,1040909,1040911,65冊16頁,1,2,王晴紋,社團法人中華民國視障者家長協會,1001026,台北市大同區庫倫街7號2樓,以自助、互助、助人之精神，結合關心視障者及弱勢族群之相關資源，積極爭取其合法權益與社會福利，促進其全人發展及社會參與為宗旨。,入會費、常年會費、永久會費、事業費、會員捐款、委託收益、基金及其孳息、其他收入,內政部中華民國99年8月12日台內社字第0990165297號函,永久,100.00,1,1040909,,,王思婷,台北市松山區敦化北路155巷76號1樓,105,,,,陳世芸,台北市松山區敦化北路155巷76號1樓,105,,,,,,,https://aomp109.judicial.gov.tw/judbp/whd6k/q/G_wtBVrFBMbN2d2lW5MG23Qyhs3c6FFmEy8ReKx1EB97ivvV7-CjJKqQt7vk
104法登他000281,1,2,陳美月,570324,1040909,1040910,1040914,2冊43頁,1,14,陳璽安,財團法人臺北市私立稻江高級商業職業學校,0570606,台北市大同區民權西路225巷24號,為遵照國家教育政策暨現行教育法令之規定，辦理職業學校並謀其健全發展之目的，創辦『臺北市私立稻江高級商業職業學校』，進而設立『財團法人臺北市私立稻江高級商業職業學校』。,設立基金新台幣參佰壹拾壹萬陸仟元整，由陳垗花先生等人捐助；嗣後並得繼續接受國內外之個人、法人或團體之捐贈,台北市政府教育局57.8.9北市教雲二字第19997號函,永久,64732916.00,1,1040910,,,徐淑玲,台北市大同區民權西路225巷24號,103,,,,,,,,"第1屆監察人任期屆滿，選任原監察人楊思勤續任：
監察人    楊思勤     基隆市安樂區安樂路2段166巷16號。",,,,,https://aomp109.judicial.gov.tw/judbp/whd6k/q/J-WyYJyxxDPxmH7HEBEAw8xDGHQEU3ie4_u6OaHMxjXm4qBeIHRa-NqNpGdrvZY=
104法登他000282,1,2,陳美月,1530,1040909,1040910,1040914,77冊4頁,1,14,"錢  復",財團法人太平洋文化基金會,0630723,台北市大同區長安西路180號2樓之1,以促進國內外教育文化交流為宗旨。,設立基金共新台幣壹仟萬元，由捐助人端木愷、周一塵、謝明山等人捐助；嗣後為充實與擴大本會之基礎，得隨時向外界勸募或接受捐贈,教育部中華民國63年6月27日台(63)高16605號函,永久,131000000.00,1,1040910,,,羅蘭君,台北市大同區長安西路180號2樓之1,103,,,,,,,,"章程變更：
1.章程第4條、第17條條文內容變更，業經主管機關教育部中華民國104年6月23日臺教社(三)字第1040084668號函備查。
2.章程第6條、第12條條文內容變更，業經本院民事庭104年度法字第22號民事裁定確定。",,,,,https://aomp109.judicial.gov.tw/judbp/whd6k/q/M21rqx23zag5SbkGtlB5zrt5IVnDfx6iUyG-bxaffBXV4H8PHuLzWIBEjuus
104法登他000283,1,2,陳美月,548,1040909,1040911,1040914,27冊52頁,2,9,劉錦齡,財團法人台灣經濟科技發展研究院,0701223,新北市汐止區新台五路1段90號18樓,為響應政府推行國家加速經濟科技發展政策，以推行研究經濟科技問題，培養經濟科技發展研究人才暨創立「財團法人台灣經濟科技發展研究院」為目的。,設立基金約新台幣壹仟參佰伍拾捌萬元，嗣後繼續籌集，得視需要情況，接受外界捐助,經濟部　中華民國70年11月10日　經（70）技字第47197號函,永久,13580000.00,1,1040911,,,王曉婷,台北市松江路50號11樓,104,,,,,,,,,,,,,https://aomp109.judicial.gov.tw/judbp/whd6k/q/gZvkKOa3shpDmm-6Op5ZY8MIokVHXv1KkXK6m37E4wGxbJHQ9-vOq_dG4k0=
