104法登他000351,1,2,陳美月,481,1041028,1041030,1041102,24冊31頁,1,14,金明儒,財團法人中華藥學研究基金會,0630316,新北市淡水區中正東路2段27-2號21樓,以致力於藥學相關事業研究發展為宗旨。,由劉孔樂先生捐助，嗣後並得繼續接受國內外之個人或團體之捐助,"63年2月18日行政院衛生署  衛署藥字第35496號許可成立",永久,10058053.00,1,1041030,,1041109,李偉泉,新北市淡水區中山北路2段189巷166號11樓,251,,,,,,,,因主事務所遷移變更章程第4條條文，業經主管機關衛生福利部民國104年10月5日衛部醫字第1040026593號函備查。,,,,,https://aomp109.judicial.gov.tw/judbp/whd6k/q/r6I2ulaR2tNIsXfNfB8mEZIVT1qeQ9C3uCUXygEfezg30hHxt_sbqeMlR6Y=
104法登他000352,1,2,陳美月,580356,1041029,1041030,1041102,2冊53頁,2,8,謝金乾,財團法人台北市陽明山謝氏宗親會,0580815,台北市士林區仰德大道1段12巷39號,配合政府社會福利政策，推展社會公益事業，致力中華文化復興運動，倡導社會優良風範。,捐助,陽明山管理局改制為台北市政府社會局80.7.23,永久,1092000.00,1,1041030,,,,,,,,,,,,,,,,,,https://aomp109.judicial.gov.tw/judbp/whd6k/q/zOgei6s8RAPYB_mQIxtYgp8_Wk9lg2ApsA7r1lgpN4nQXwBNu5L2mj1EA3qGaZE=
104法登他000353,1,2,陳美月,721010,1041029,1041030,1041102,4冊57頁,2,8,陳政忠,財團法人台北市陳安文教基金會,0720713,台北市士林區延平北路6段116巷46號1樓,1.協助貧寒家庭子女就學，繼續完成其學業。2.一般清寒家庭之救助。3.文教社會風氣之宣導。,由陳安先生遺囑，自其遺產撥出新台幣參拾萬元作為原始基金，嗣後仍可由其家族繼續捐贈，並接受社會團體及個人之捐贈,台北市政府教育局72年6月27日,永久,1000000.00,1,1041030,,,,,111,,,,,,,,,,,,,https://aomp109.judicial.gov.tw/judbp/whd6k/q/5FFExOVEloEM92xpxlSZyx8qJHFzEjQ_ydi3ixwyXjev-DoXdseMOhjhDDixvKU=
104法登他000354,2,2,陳美月,965,1041029,1041030,1041102,48冊19頁,2,3,葉雪暉,社團法人佛教如來宗如來實證協會,0960731,台北市內湖區民權東路6段180巷6號12樓,"一﹑弘揚佛教如來宗宗師  妙禪師父教化之明心見性，見性成佛，利益十方眾生。
二﹑依教奉行，實踐  妙禪師父悲智願行，實證  妙禪師父法偈所開示「末法眾生苦，妙禪住世渡，佛子滿天下，聖花佛果實。」為千秋萬世如來正法奠基。",入會費、常年會費、會員隨喜捐款、銀行存款孳息、其他收入,內政部中華民國96年5月11日台內社字第0960075972號函,永久,100.00,1,1041030,,1041109,徐乙可,台北市內湖區民權都路6段180巷6號12樓,114,,,,,,,,章程第5條、第6條條文內容變更，業經主管機關內政部103年9月2日台內團字第1030205409號及104年5月8日台內團字第1041500721號函備查。,,,,,https://aomp109.judicial.gov.tw/judbp/whd6k/q/z-u_ghnGF9ToXi2HMcXT__CCDJ4nha5ZkjPMepWbLOqVe2vxKvUAieuumGM=
104法登他000355,1,2,陳美月,980,1041102,1041102,1041104,49冊14頁,2,9,羅瑩雪,財團法人中華民國兒童福利聯盟文教基金會,0801224,台北市大同區長安西路43號6樓,以倡導兒童福利觀念，推展兒童教育，保障兒童權利，促進兒童健全發展，增進兒童福利為宗旨。,由財團法人心臟病兒童、吳麥文教、國泰建設文化教育等基金會、王志雄、王世雄、林謝罕見等捐助，俟完成法人登記後，得繼續接受捐贈,"教育部80年12月17日  台（80）社字第68396號函",永久,760000000.00,1,1041102,,,廖千皓,台北市大同區長安西路43號7樓,103,,,,,,,,,,,,,https://aomp109.judicial.gov.tw/judbp/whd6k/q/mGlHWhk-Q8ui1Sfjaeo7j6W9qvm0saVIqvm74W-xL6plZPjEJxn2HsJ6QAQ=
104法登他000356,1,2,陳美月,1577,1041102,1041104,1041106,79冊11頁,1,6,鈕廷莊,康寧學校財團法人,0890218,台北市內湖區康寧路3段75巷137號,為響應私人捐資興學，培養國家高級學術人才之目的，設立康寧學校財團法人。,設立時之財產總額為新台幣貳億元整，由王榮昌、林政則、王純德等人捐助設立（詳如捐助人名冊及捐助財產清冊）；嗣後並得繼續接受國內外之個人、法人或團體之捐贈,教育部中華民國88年9月29日台八八高三字第88117128號函,永久,4828496987.00,1,1041104,,,莊文伶,台北市內湖區康寧路3段75巷137號,114,,,,,,,,,,,,,https://aomp109.judicial.gov.tw/judbp/whd6k/q/WA3vHPcEBQ368MCsjhwahlmk0wJUuFGKS6ChWKSm8kVFO6PKoNSFCQ3tPslQ
104法登他000357,1,2,陳美月,1189,1041103,1041104,1041106,60冊3頁,2,4,張金順,財團法人台北市新視界社會福利基金會,0940526,台北市延平北路6段258巷56弄4號2樓,以舉辦視障及重度身心障礙者之社會福利事業為宗旨。,由蔡慧駿、楊麗菁、張悅薌、葉豐輝、彭敏卿、黃士慶、張金順、張國瑞等8人共同捐助；嗣後得由捐助人或其他個人、團體隨時補充之。,臺北市政府社會局中華民國94年5月16日北市社三字第09434826500號函,永久,10000000.00,1,1041104,,,潘仁尉,台北市士林區延平北路6段258巷56弄4號2樓,111,,,,,,,,章程第8條第2項、第13條條文內容變更，業經主管機關臺北市政府社會局中華民國104年10月20日北市社團字第10445705700號函核備。,,,,,https://aomp109.judicial.gov.tw/judbp/whd6k/q/AIcK9fHjUmR6ZbJuY5QcFuxCv4vc_3zn3d55oWcroTBcKNL77bzgBMugr-VQ
104法登他000358,1,2,陳美月,744,1041104,1041105,1041106,37冊49頁,2,7,翁主治,財團法人台北市李春金關懷基金會,0870330,台北市內湖區成功路5段460號16樓,以辦理緊急醫療、急難救助、低收入照顧、老弱傷殘無依之救助，促進社會祥和風氣為目的。,設立基金新台幣壹仟萬元整，由捐助人無償捐助；嗣後得繼續接受捐助。,"台北市政府社會局87年1月3日  北市社二字第8720010600號函",永久,220000000.00,1,1041105,,,邱瓊賢,台北市內湖區成功路5段460號16樓,114,,,,,,,,,,,,,https://aomp109.judicial.gov.tw/judbp/whd6k/q/PNQbCeVX9LtnAWWibjPRe4fibuqMTC6Lv3bE_bVb9tWPTQPxPWn7Ltm9XSE=
104法登他000359,1,2,陳美月,53,1041104,1041105,1041106,3冊5頁,1,6,何美慶,財團法人謝成源先生食品科技發展基金會,0770825,台北市大同區迪化街1段102號,係響應政府推動業食品科技發展之號召，為國內食品科技文教出版事業。,設立基金新台幣參佰萬元整，由謝忠弼、何美慶等人捐助；嗣後並得繼續接受國內外之個人或團體之捐助,行政院衛生署77.5.18衛署醫字第723993號函,永久,90549700.00,1,1041105,,,林麗玲,台北市忠孝東路1段49巷23號1樓,100,,,,,,,,,,,,,https://aomp109.judicial.gov.tw/judbp/whd6k/q/rXgrRQJjKhaWnltJkdrX7Nc3F1LC7UZIRIzIW56StH1qKr7nC1TtY4j8HQ==
104法登他000360,1,2,陳美月,690849,1041105,1041105,1041109,4冊9頁,1,9,廖武治,財團法人台北保安宮,0690328,台北市大同區哈密街61號,以闡揚宗教教義提倡敬奉神明，並管理本法人財產及辦理社會公益事業為宗旨。,設立財產總額新台幣壹億壹仟零壹拾肆萬貳仟零貳拾肆元均由捐助人台北保安宮管理委員會捐助及信眾樂捐，嗣後得繼續接受樂捐,台北市政府民政局69.2.28北市民三字第1466號,永久,997442161.00,1,1041105,,,,,,,,,,,,,章程第2條、第3條、第6條、第8條、第11條、第12條之2、第17條、第20條條文內容變更，並增訂第6條之1，業經本院民事庭104年度法字第25號民事裁定確定。,,,,,https://aomp109.judicial.gov.tw/judbp/whd6k/q/7JwsZ0VjDJ9VcyHuphcbFyokR41cTMMnQC7NhPeEPYIcGenq7D6RnGmn8hxycsg=
104法登他000361,1,2,陳美月,550262,1041105,1041106,1041109,2冊15頁,1,19,張振華,財團法人中華基督教行道會,0550326,台北市士林區中山北路5段676號,以按照聖經在世界各地宣講、教導、見證、傳佈、主耶穌基督之福音及基督之精神辦理關於基督徒或社會有益之事業為宗旨。,捐助,台灣省政府54年5月14日民字第30894號函,永久,4109061399.00,1,1041106,,,孫慶華,台北市中山北路5段676號,111,,,,,,,,,,,,,https://aomp109.judicial.gov.tw/judbp/whd6k/q/Jdx-4wnQN2o_N6lI6btFvTUBMasxGTXyA1MV7akmVyA7Eh5R0jwn1ccNdDh-9Sk=
104法登他000362,1,2,陳美月,793,1041105,1041106,1041109,40冊7頁,2,4,陳麒文,財團法人力鋼社會福利慈善基金會,0940215,台北市士林區社中街76號,辦理社會福利慈善事業為目的,由力鋼工業股份有限公司捐贈，嗣後得繼續接受捐助,臺北市政府社會局中華民國94年1月11日北市社二字第09342027200號函,永久,30000000.00,1,1041106,,,柯君翰,台北市大安區羅斯福路3段335號9樓之2,106,,,,,,,,,,,,,https://aomp109.judicial.gov.tw/judbp/whd6k/q/5FEUMRPSX_vBJWytEHZmi9R9AoVrp68QVVFpC1b1bvf0BrI8QTqVYK4Lddc=
104法登他000363,1,2,陳美月,540245,1041106,1041110,1041111,2冊13頁,1,17,姚聰榮,財團法人真理大學,0540909,新北市淡水區真理街32號,為達成教學及學術研究，自由探討真理，培養人格，服務社會，促進國際間學術交流，榮神益人之目的，設立財團法人真理大學。,設立基金新台幣陸佰貳拾萬元，由北部臺灣基督長老教會大會，熱心信徒及社會各界人士捐助，嗣後並得繼續接受國內外之個人、法人或團體之捐贈,教育部54.8.26台(54)高字第13242號函,永久,4975631153.00,1,1041110,,1041118,"溫  芯",新北市淡水區真理街32號,251,,,,,,,,,,,,,https://aomp109.judicial.gov.tw/judbp/whd6k/q/HmOOn8z3kHF33AO8Sypk78ldDWqMGiYpXNyj-4BNfsGgkdpVOf9L2d4E9jbplbs=
104法登他000364,1,2,陳美月,1604,1041106,1041110,1041111,80冊18頁,2,7,馮寄台,財團法人中國信託商業銀行文教基金會,0850117,台北市南港區經貿二路188號5樓,以從事有關文化藝術事物、藝文教育推廣、促進國際文化交流及財經金融等社會公益事業為宗旨。,設立基金共新臺幣壹仟萬元整，由中國信託商業銀行捐助；俟依法完成法人登記後，得繼續接受捐助,教育部中華民國84年12月8日台（84）社字第060837號函,永久,10000000.00,1,1041110,,,蔡瑞芬,台北市南港區經貿二路188號5樓,115,,,,,,,,,,,,,https://aomp109.judicial.gov.tw/judbp/whd6k/q/oFQSbEI_I4-c5qHKegFDuvxMC3yWtdy8Jde04oWaz9oTRKqhjHLdnahOsBUJ
104法登他000365,1,2,陳美月,710957,1041109,1041110,1041111,4冊33頁,2,15,劉榮宏,財團法人韻珊眼科教育研究基金會,0710713,台北市北投區石牌路2段201號,以發展眼科教育，培育眼科人才，鼓勵眼科相關研究，提高中華民國眼科水準為宗旨。,由林和鳴及贊助人各捐贈5萬元，共100萬元為基金，陸續接受社會熱心公益人士自由捐贈。,行政院衛生署中華民國71年6月4日衛署醫字第380244號函,永久,1000000.00,1,1041110,,,李家綺,台北市北投區石牌路2段201號（眼科部）,112,,,,,,,,,,,,,https://aomp109.judicial.gov.tw/judbp/whd6k/q/sefyR1-hMObcuBH7_DIybNwHh4_f0w2SGCf0ej8GhmtB2NROjKyo-EAukDMfcDA=
104法登他000366,1,2,陳美月,804,1041109,1041110,1041111,40冊18頁,1,8,鄭慧明,財團法人鄭氏藥學文教基金會,0781024,台北市士林區天母北路64號1樓,以獎助藥學教育，促進藥學發展為宗旨。,設立基金共新台幣壹仟萬元整，由鄭水金、鄭李菉雲、鄭慧明、鄭慧正、鄭慧文、鄭慧珍等共同捐助；俟依法完成法人登記後，得繼續接受捐贈,"教育部  78年10月9日  台（78）社字第49274號函",永久,10000000.00,1,1041110,,1041118,吳媖媖,台北市大安區敦化南路2段60號12樓之2（13A）,106,,,,,,,,,,,,,https://aomp109.judicial.gov.tw/judbp/whd6k/q/bm7jYuYM6wM5YcwHRggQA0k5Pdy8XlVqBIgC1u5j04AiiH7vVqHcZ3ULJDs=
104法登他000367,1,2,陳美月,32,1041109,1041110,1041111,2冊5頁,2,11,沈金鎮,財團法人台北市崇善基金會,0761202,台北市大同區西寧北路122號2樓,秉承中華道統文化，推廣仁慈普化世人為宗旨，辦理照顧生活困難者及遭受緊急患難或非常災害者之生活，並協助其自立為目的。,設立基金總額為新台幣伍佰陸拾伍萬元整，嗣後得由捐助人或社會人士、團體隨時繼續捐贈補充之,台北市政府社會局76.9.14北市社三字第42933號函,永久,5650000.00,1,1041110,,,王世銓,台北市西寧北路90號3樓,103,,,,,,,,章程第6條、第9條條文內容變更，業經本院民事庭104年度法字第30號民事裁定確定。,,,,,https://aomp109.judicial.gov.tw/judbp/whd6k/q/9Z8BC9TwLmIeomSlvjwWpgp-Nz8AU9XBaXaTqHWT7yKHLJs159JUMQ0f0w==
104法登他000368,1,2,陳美月,464,1041110,1041112,1041112,23冊40頁,2,4,林義順,財團法人台北市台北基督徒蘭雅禮拜堂,0890211,台北市士林區中山北路5段727號2樓,以管理、應用台北基督徒蘭雅禮拜堂所有一切財產，使信徒獲得靈性長進，及廣傳耶穌基督救世福音，並推動社會福利及公益事業為宗旨。,捐助,台北市政府民政局89年1月29日北市民三字第8920249100號函,永久,54150000.00,1,1041112,,,蔡欣齡,台北市士林區中山北路5段727號2樓,111,,,,,,,,,,,,,https://aomp109.judicial.gov.tw/judbp/whd6k/q/f5e4bJYK2YeM8kopWaDmBClJZt_NjoyMXzWWWmBYQByxp36PAzIj1dnd15k=
104法登他000370,1,2,陳美月,1282,1041111,1041112,1041112,64冊16頁,1,10,林勝益,財團法人中美和文教基金會,0750728,台北市內湖區瑞光路392號9樓,以協助中華民國藝術、科學、醫療及環保有關之文教學術活動之推展為宗旨。,設立基金共新台幣壹仟貳佰萬元整，由中美和石油化學股份有限公司捐助；俟依法完成財團法人登記後，得繼續接受捐助。,教育局75年7月3日台高字第28106號函,永久,131160000.00,1,1041112,,,李姿蓉,台北市內湖區瑞光路392號9樓,114,,,,,,106,,,,,,,https://aomp109.judicial.gov.tw/judbp/whd6k/q/kjHGgvJU5uWZjlcH1QslnzyxJPRQixu92nMQFDbhuzDkGrUcUOJv4vBcHuWU
104法登他000371,1,2,陳美月,1613,1041113,1041116,1041118,81冊7頁,1,1,辜仲諒,財團法人中國信託反毒教育基金會,1040612,台北市南港區經貿二路188號6樓,以預防青少年使用毒品，及宣導、推廣青少年反毒教育相關事業為宗旨。,設立基金共新臺幣參仟萬元整，由台灣彩券股份有限公司捐助；俟依法完成法人登記後，得繼續接受捐贈,教育部中華民國104年6月4日臺教社（三）字第1040070612號函,永久,30000000.00,1,1041116,,,葉曉芬,台北市南港區經貿二路188號6樓,115,,,,,,,,,,,,,https://aomp109.judicial.gov.tw/judbp/whd6k/q/GaTv6_dlaZOBXA2e8jW0LqLzCO1SkzfKcctwGCR3S-DJMbiIhAAilTfxWL0W
104法登他000372,1,2,陳美月,906,1041113,1041116,1041118,45冊20頁,2,4,江松樺,財團法人昇恒昌基金會,0951025,台北市內湖區新湖二路289號,以確保觀光事業永續發展、提昇國際旅客服務品質、發展免稅商店國際接軌、促進國際交流合作、舉辦社會公益活動為宗旨。,由昇恒昌股份有限公司捐助，俟完成登記後，得繼續接受捐贈,"交通部  中華民國95年10月19日交路字第0950010035號函",永久,400000000.00,1,1041116,,,陳維彰會計師,台北市信義區東興路51號10樓,110,,,,,,,,章程第8條條文內容變更，業經本院民事庭104年度法字第24號民事裁定確定。,,,,,https://aomp109.judicial.gov.tw/judbp/whd6k/q/-ypA40YYo7KUoYbGZum4JS0amJUZmQI9AR2RbR-fJtBQt4nATjWk4Vkyuuk=
104法登他000373,2,2,陳美月,864,1041116,1041117,1041118,43冊18頁,1,6,劉進義,社團法人中華民國水利技師公會全國聯合會,0950327,新北市汐止區新台五路1段81號10樓之4,以促進會員之團結合作研究水利技術，促進水利事業之發展，砥礪同業品德，增進共同利益並致力國家建設為宗旨。,入會費、常年會費、會員捐助費、事業費、政府補助、其他收入,"內政部  中華民國87年9月24日台（87）內社字第8793477號",永久,163963.00,1,1041117,,,錢香君,新北市汐止區新台五路1段81號10樓之4,221,,,,,,,,,,,,,https://aomp109.judicial.gov.tw/judbp/whd6k/q/8h_IWLgNkcHxtS6LRiupdCoBhRv4HORtACzZ_lVB1PxZR7POkwTjS9gZ50Q=
104法登他000374,1,2,陳美月,630619,1041117,1041117,1041118,3冊33頁,2,12,李傳洪,財團法人臺北市私立薇閣國民小學,0631221,台北市北投區育仁路106號,為遵照國家教育政策暨現行教育法令之規定，辦理國民小學，並謀其健全發展之目的，設立財團法人臺北市私立薇閣國民小學。,財產（包括動產、不動產及其他產權）由財團法人私立薇閣育幼院等捐助及收入購置，其總值為新台幣壹億捌千捌佰壹拾肆萬陸仟參佰捌拾元。嗣後並得繼續接受國內外之個人、法人或團體之捐贈,臺灣省政府教育廳40年10月6日(40)酉魚教四字第40954號,永久,392844817.00,1,1041117,,,呂錦貴,台北市新生南路1段148號6樓,100,,,,,,,,,,,,,https://aomp109.judicial.gov.tw/judbp/whd6k/q/Di-MRL1-_cx6cAIsxb1WHXJpRc6-kNKo1nBLx6j6PwfCG5k3d5QeOKB9MEAljj4=
104法登他000375,1,2,陳美月,1312,1041117,1041119,1041123,66冊6頁,2,6,張顯爵,財團法人台灣基督長老教會傳播基金會,0900223,台北市士林區忠誠路1段117號1樓,本於基督愛人救世的精神，以大眾傳播方式，製作推廣公益、藝文、社教、宣教節目，以改善社會風氣，教化人心。,由捐助人捐助設立基金新台幣壹佰貳拾萬元整，嗣後繼續對外籌集，接受各界捐助,行政院新聞局中華民國90年1月19日（90）正廣一字第00956號函,永久,50000000.00,1,1041119,,,王雅雯,台北市士林區忠誠路1段117號1樓,111,,,,,,,,,,,,,https://aomp109.judicial.gov.tw/judbp/whd6k/q/--_CIKvCZhzpwxy8rKFDvhfywvNG0Orht_GwLRhRq00Sad6z3a8q95cNrxtV
104法登他000376,1,2,陳美月,136,1041117,1041119,1041123,7冊11頁,1,8,許本爵,財團法人台北市中國基督教靈糧世界佈道會士林靈糧堂,0810904,台北市社中街298巷4弄2號1樓,本基督仁愛精神，以傳道為目的，辦理社會公益慈善教育、出版、發行及網路媒體等相關事業。,原始捐助財產總額為新台幣貳佰壹拾玖萬壹仟參佰柒拾伍元整；俟依法完成法人登記後，得繼續接受國內外個人或團體之奉獻及捐贈,台北市政府民政局81.8.22,永久,2676020865.00,1,1041119,,,洪淑芳,台北市社中街298巷4弄2號1樓,111,,,,,,,,,,,,,https://aomp109.judicial.gov.tw/judbp/whd6k/q/-ljt39pzCx7o1TjHjg-TdvhbVZyXal6jea0aZyD3cDaT2ifYdWJNyNX6tJ4=
104法登他000377,1,2,陳美月,1334,1041117,1041119,1041123,67冊8頁,2,2,石曜堂,財團法人演譯基金會,1010119,台北市內湖區行善路58號3樓之3,建立華人大型人體生物資料庫，提供生物醫學及生技產業研究發展，以研究生命科學研究為目的。,設立基金新台幣一千萬元整，由美兆生活事業股份有限公司捐助；嗣後並得繼續接受國內外之個人或團體之捐助,行政院衛生署中華民國101年1月12日衛署醫字第1010204516號函,永久,10000000.00,1,1041119,,,游佳蓁,台北市內湖區行善路58號3樓之3,114,,,,,,,,章程第6條條文內容變更，業經本院民事庭104年度法字第26號民事裁定確定。,,,,,https://aomp109.judicial.gov.tw/judbp/whd6k/q/vdnRGmdfFWX2rTGfDkPfJW4f00VbgTJeHscxwy9LhsMea9wpsX3uU0y2o4ae
104法登他000378,1,2,陳美月,1255,1041120,1041124,1041126,63冊9頁,2,5,李致慧,財團法人許常惠文化藝術基金會,0930511,台北市北投區光明路66號12樓,以推展文化藝術活動、提高生活素質為宗旨。,設立基金共新台幣伍佰萬元整，由邱復生等人捐助。俟完成法人登記後，得繼續接受捐贈。,臺北市政府文化局中華民國92年11月17日北市文化四字第09231596400號函,永久,5000000.00,1,1041124,,,林靜蓉,新北市淡水區民權路75號20樓之1,251,,,,,,,,,,,,,https://aomp109.judicial.gov.tw/judbp/whd6k/q/qy_5AIaLTk6AUUag3ZnyQ6a0HvHpnrYnWjBm2y8OnQLGmgAnJZDRz_2fUkbw
104法登他000379,1,2,陳美月,1144,1041123,1041124,1041126,57冊18頁,2,3,葉國一,財團法人英業達集團公益慈善基金會,0990114,台北市士林區後港街66號,以辦理社會福利慈善事業為目的。,設立基金新台幣參仟萬元整，由英業達股份有限公司捐助；嗣後得繼續接受捐贈,內政部中華民國98年12月17日內授中社字第0980022399號函,永久,30000000.00,1,1041124,,1041203,張郁俐,台北市士林區後港街66號,111,,,,,,,,,,,,,https://aomp109.judicial.gov.tw/judbp/whd6k/q/-GHwsD20lc0nlyfczL4yeXz_pgtdItjOpHz9hfRBTod-yoTw-sa6wG-MgMiY
104法登他000380,1,2,陳美月,1407,1041123,1041124,1041126,71冊1頁,2,9,郭育鈞,財團法人郭敏行觀光發展基金會,0810507,台北市內湖區內湖路1段387巷12號,以促進中華民國觀光事業發展暨培植優秀觀光人才為宗旨。,捐助人捐款；俟依法完成法人登記後，得繼續接受捐助,交通部中華民國81年3月11日（81）交路字第008071號函,永久,100000000.00,1,1041124,,,王美華,台北市民權東路2段9號5樓,104,,,,,,,,捐助章程第3條條文內容變更，業經主管機關交通部中華民國104年11月18日交路字第1045015315號函核備。,,,,,https://aomp109.judicial.gov.tw/judbp/whd6k/q/cxUo0Ad5vAe--8WUXzIK3D60hbRQF7hmQlISYzINfoKMIZGByABICoJEU50d
104法登他000381,1,2,陳美月,21,1041123,1041124,1041126,1冊41頁,2,10,詹巨豪,財團法人詹氏大宗祠,0760107,台北市承德路3段67號,為奉祀先烈先祖以闡揚祖德、敦睦宗誼，增進族親福利，樹立互助團結、宗教教義之精神向國內外宣揚傳統文化、宗教信仰並興辦社會公益事業為目的。,設立基金共新台幣壹仟萬元正，由詹錫富等共同捐助之,台北市政府民政局75.12.23北市民三字第41314號,永久,117000000.00,1,1041124,,,翁如怡,台北市大同區承德路3段67號,103,,,,,,,,,,,,,https://aomp109.judicial.gov.tw/judbp/whd6k/q/0YDknMezqi6XQ-TnnIMBY4fXSwP8oDBnazAzXogDZflDn9WRaNK0hjLzOw==
104法登他000383,1,2,陳美月,490112,1041126,1041127,1041201,1冊49頁,2,10,王永昌,財團法人台北市私立王氏宗廟圖書館,0490830,台北市北投區一德街75號,以辦理供應民眾閱覽並創辦台北市私立志仁高級中學為目的。,設立基金新台幣柒拾萬元整，由捐助人無償捐助之，嗣後得繼續接受捐助,台北市政府教育局47.8.18,永久,546858868.00,1,1041127,,,賴美麗,台北市北投區一德街75號,112,,,,,,,,,,,,,https://aomp109.judicial.gov.tw/judbp/whd6k/q/ZVwUp5IATk0V3YpqkTo2yoMn-AJvjM10WcLPvPyX6cdh58eTDMcQIOZ6rADGuZc=
104法登他000384,1,2,陳美月,610461,1041127,1041130,1041203,2冊81頁,2,13,張鏡湖,財團法人華岡興業基金會,0610517,台北市士林區華岡路55號,以興辦文教事業為宗旨。,捐助,陽明山管理局改制為台北市政府教育局68.2.2.,永久,306099267.00,1,1041130,,,宋玉峰,台北市瑞安街276巷16號1樓,106,,,,,,,,,,,,,https://aomp109.judicial.gov.tw/judbp/whd6k/q/9bBfp528O9_N7wfZ3f-lZ_vWSBn3pw_VD3qoqRMJqRoe4QGNAX_xGoTsjDIbGsU=
104法登他000385,1,2,陳美月,500143,1041201,1041202,1041203,1冊69頁,1,60,王榮信,財團法人台灣神學院,0500720,台北市士林區仰德大道2段2巷20號,以傳揚基督福音，培養基督教傳教人才，並發展台灣基督長老教會及辦理公益、文教、出版事業為目的。,由財團法人北部台灣基督長老教會大會所捐贈,陽明山管理局50.7.10政民字第15161號,永久,104556475.00,1,1041202,,,林二豪,台北市士林區仰德大道2段2巷20號,111,,,,,,,,,,,,,https://aomp109.judicial.gov.tw/judbp/whd6k/q/MuHutGXujI6EhvQi4K1jOE5ujpzlyj_MfIcBtor-IkB1NzDOSv9Zf5_XYjxJepQ=
104法登他000386,1,2,陳美月,526,1041201,1041202,1041203,26冊35頁,2,8,周宗崙,財團法人中華基督教浸信會嶺頭山莊福音中心,0891103,台北市士林區仰德大道2段11巷11號,以基督教聖經之原則，宣揚基督福音，提昇信徒靈命，促進教會復興，辦理各項營會及休閒活動，提供場地供團體或個人靈修、教育訓練之用，並辦理社會慈善公益事業等。,由財團法人美南浸信會台北市事務所捐助，俟後得接受國內外教會、團體、信徒或個人之捐贈（獻）,台北市政府民政局中華民國89年10月24日北市民三字第8923200800號函,永久,355029820.00,1,1041202,,,李景雯,台北市懷寧街47之1號2樓,100,,,,,,,,,,,,,https://aomp109.judicial.gov.tw/judbp/whd6k/q/n-7uMXLqKOQO3UndiIROy8Q6kU1ewpgtCYFUxZsXjc7xgTeGLPimGOeaxNk=
104法登他000387,1,2,陳美月,731038,1041202,1041203,1041207,4冊67頁,2,6,郭廷銘,財團法人台北市白奇郭氏宗祠,0730216,台北市大同區延平北路4段181之3號4樓,為救助貧、病、死宗親，獎助宗族貧困子弟升學，並創辦各種公益慈善福利事業。,設立基金新台幣貳佰參拾萬元整，由郭姑送等人捐助；嗣後並得繼續接受捐贈,臺北市政府民政局73年2月7日北市民三字第1399號函,永久,2300000.00,1,1041203,,,郭廷瑜,台北市內湖區安泰街83巷5號12樓,114,,,,,,,,,,,,,https://aomp109.judicial.gov.tw/judbp/whd6k/q/cg4_mYemPR4grgJkOQU5ioqekXdNgbIQ084eIFcTC46apjOSwpgCh9Pu_2xcYDE=
104法登他000388,1,2,陳美月,391,1041202,1041203,1041207,20冊1頁,1,6,余宏仁,法鼓學校財團法人,0871021,台北市北投區公舘路186號,為遵照國家教育政策暨現行教育法令之規定，辦理法鼓學校財團法人，並謀其健全發展。,捐助,教育部87年6月5日台(87)高(三)字第87058532號,永久,4067510854.00,1,1041203,,,賴沛琳,台北市北投區公舘路186號,112,,,,,,,,,,,,,https://aomp109.judicial.gov.tw/judbp/whd6k/q/Q1DUALvwBSyFy6ybJhFPHuhyhICjM2UiXNHwDGOj9M78eqwq0_TEaCruOHA=
