登記案號,類別,案由,主任,登記號數,收件日期,登記日期,公告日期,登記簿,任期判定,屆期判定,法人代表,法人名稱,設立登記日期,主事務所,目的,捐助方法,許可機關日期,存立時期,財產總額,結案原因,結案日期,歸檔日期,發證日期,清算人,變更原因,註銷日期,撤銷日期,撤(註)銷機關文號,撤(註)銷原因
092法登社000001,2,1,謝怜聰,472,0920123,0920123,0920124,14冊47頁,,,邱創盛,社團法人新竹縣關西鎮鄉土文化協會,0920123,新竹縣關西鎮南新里十一鄰三十四號,本會以彙整鄉土文化與觀光資源為前提，發揚地方文化產業特色，提升休閒觀光旅遊品質及落實生態保育為宗旨。,會員會費等,"新竹縣政府社會局  九十一年十月十四日",永　　　久,64000.00,1,0920123,0921224,0920127,,,,,,
092法登社000002,2,1,謝怜聰,473,0920227,0920227,0920303,14冊48頁,,,鄧政春,社團法人新竹縣藥師公會,0920227,新竹市民主路一六０號四樓之三,本會以協助政府推行政令聯絡會員感情，增進藥學學術，促進藥界業務推展，維護會員權益，謀求會員福利為宗旨。,會員會費等,新竹縣政府　民國三十六年四月十七日,永　　　久,2018498.00,1,0920227,0921224,0920304,,,,,,
092法登社000003,2,1,謝怜聰,475,0920401,0920401,0920402,14冊50頁,,,杜錦權,社團法人新竹縣關西鎮肢體殘障協進會,0920401,新竹縣關西鎮上林里十二鄰二十二號,本會為依法設立，非以營利為目的之社會團體，以團結關西鎮肢障者，配合政府社會福利措施，及各界愛心人士社團，發揮泛愛眾人精神，激勵殘障者走出自我象牙塔，化消極退縮為積極進取，參與社會自助助人，開拓更寬廣的生活空間，實現三民主義，大同世界之理想為宗旨。　,會員會費等,"新竹縣政府  八十二年九月七日","永  久",500000.00,1,0920401,0920407,0920407,,,,,,
092法登社000004,2,1,謝怜聰,476,0920402,0920402,0920403,15冊1頁,,,黎原胡,社團法人中華心願文教協會,0920402,新竹縣峨眉鄉峨眉村成功街五十號,本會為依法設立，非以營利為目的之社會團體，以促進國際文化、教育、學術研究及藝文活動，並加強海峽兩岸文教教流，傳承中華文化為宗旨,社員會費等,內政部　　九十二年二月二十一日,永　　　久,100000.00,1,0920402,0920407,0920407,,,,,,
092法登社000005,2,1,謝怜聰,477,0920428,0920428,0920429,15冊2頁,,,戴梅盛,社團法人新竹市至愛服務協會,0920428,新竹市中山路四三一巷五十四號,為發揚愛心，響應政府所推行社會福利政策，運用人類與生俱來的至愛天性，盡己所能，協助需要照顧的人為宗旨,會員會費等,新竹市政府　七十八年八月九日,"永  久",8685.00,1,0920428,0920501,0920501,,,,,,
092法登社000006,2,1,謝怜聰,478,0920516,0920516,0920517,15冊3頁,,,陳伯榕,社團法人台灣電子連接器協會,0920516,新竹縣竹東鎮中興路四段一九五號五三館二０二室,本會以結合產、官、學、研共同促進連接器產業升級為宗旨,會員會費等,"內政部  九十年二月十五日","永   久",2574211.00,1,0920516,0920520,0920520,,,,,,
092法登社000007,2,1,謝怜聰,480,0920521,0920521,0920522,15冊5頁,,,姚棋輝,社團法人新竹市社會福利發展協會,0920521,新竹市中華路四段六四巷二號四樓之二,本會以照顧弱勢族群、協助解決失業問題、提倡終身學習、創造就業機會為宗旨。,會員會費等,"新竹市政府  九十二年三月六日","永    久",10000.00,1,0920521,0920523,0920523,,,,,,
092法登社000008,2,1,謝怜聰,481,0920613,0920613,0920616,15冊6頁,,,胡定華,社團法人台灣工業技術研究院院友會,0920613,新竹縣竹東鎮中興路四段一九五號,"本會為依法設立、非以營利為目的之社會團體,以推動工業技術研究院院友之合作、交流與聯誼,並促進工研院之長期發展為宗旨。",會員會費等,"內政部  九十一年十一月二十八日","永    久",1011982.00,1,0920613,0920619,0920619,,,,,,
092法登社000009,2,1,謝怜聰,482,0920619,0920619,0920620,15冊7頁,,,胡鵬飛,社團法人中華民國聖光道學協會,0920619,新竹市東區建功一路三十五號,一、以吾中華民族先聖先賢的聖光，照亮我們導引吾人走入大道，弘揚傳承至善之道，以消解人類日漸走向自我沉淪之路，以大道消除人所自照的一股不道德的乖戾之風氣。二、我們積極互助發出聖道光輝，以挽救今人將面臨的浩劫，人無道德則智慧不開不生，有真智慧者，才有進入聖賢之門之希望。,由啟德機械起重工程有限公司捐助及會員會費等,"內政部   九十二年四月四日","永   久",260000.00,1,0920619,0921224,,,,,,,
092法登社000010,2,1,謝怜聰,483,0920626,0920626,0920627,15冊8頁,,,林進財,社團法人臺灣健康管理學會,0920626,新竹市元培街三０六號之一,本會希望能倡導預防醫學及健康管理之觀念，藉由探討與醫技、健康相關之管理科學與技術，以達增進國人健康並提昇生活品質之目的。,會員會費等,九十一年六月二十八日　　　內政部,"永 久",206730.00,1,0920626,0920630,0920630,,,,,,
092法登社000011,2,1,謝怜聰,485,0920709,0920710,0920711,15冊10頁,,,劉健明,社團法人新竹市藥師公會,0920710,新竹市民主路一六０號四樓之三,本會以振興藥學發展藥業，協助推行公共衛生，謀求社會福祉，並維護會員權益，增進會員之親睦暨福利為宗旨,會員會費等,新竹市政府,"永   久",2872885.00,1,0920709,0920711,0920711,,,,,,
092法登社000012,2,1,謝怜聰,487,0920801,0920801,0920804,15冊12頁,,,劉仲明,社團法人台灣平面顯示器材料與元件產業協會,0920801,新竹縣竹東鎮中興路四段一九五號七十七館二０八室,本會以匯聚產業發展共識，促成產業間之合作與國際合作，並促進產業繁榮進步為宗旨。,會員會費等,"內政部  九十二年四月三十日","永   久",1500000.00,1,0920801,0921111,0920805,,,,,,
092法登社000013,2,1,謝怜聰,488,0920801,0920801,0920804,15冊13頁,,,范增達,社團法人台灣農場經營協會,0920801,新竹縣竹東鎮大同路二二號,本會以結合農場經營者之智慧與力量，共謀改善經營管理之績效，以創造競爭優勢，促進農業永續經營為宗旨。,會員會費等,"內政部  八十四年八月十六日",永　　久,428590.00,1,0920801,0921111,0920806,,,,,,
092法登社000014,2,1,謝怜聰,489,0920806,0920806,0920807,15冊14頁,,,吳昌志,社團法人新竹縣湖口鄉吳姓職鳳公宗族會,0920806,新竹縣湖口鄉信勢村二四鄰十六之八號,本會係非以營利為目的之社會團體，為祭祀祖先傳述祖德慎終追遠並遵祖訓敬宗睦族為宗旨。　,會員會費等,"新竹縣政府  九十二年七月一日","永   久",5000.00,1,0920806,0921111,0920808,,,,,,
092法登社000015,2,1,謝怜聰,490,0920828,0920828,0920829,15冊15頁,,,李武福,社團法人新竹市耕心文教發展協會,0920828,新竹市明湖路四八二巷三六之一號,本會為依法設立，非以營利為目的之社會團體，以結合社會各界力量發輝互助精神，共同推動有關弱勢家庭或教養有困難家庭子女課後照顧及終身教育之各項活動,會員會費等,新竹市政府　九十二年七月九日,永　　久,51500.00,1,0920828,0921111,,,,,,,
092法登社000016,2,1,謝怜聰,492,0920910,0920910,0920912,15冊17頁,,,李雄略,社團法人新竹市野鳥學會,0920910,新竹市光復路二段二四六號四樓之一,本會為公益性社團法人，以觀賞、研究及保育野生鳥類，提高社會大眾對自然生態保育之觀念為宗旨。,會員會費等,新竹市政府　　七十九年七月一日,"永   久",716956.00,1,0920910,0921111,0920915,,,,,,
092法登社000017,2,1,謝怜聰,493,0920923,0920923,0920924,15冊18頁,,,王金蘭,社團法人新竹市消費者保護協會,0920923,新竹市鐵道路二段三一０號,本會為依法設立之社會團體，非以營利為目的，以保護消費者權益，促進國民消費生活安全，提昇國民消費生活品質及推行消費者教育為宗旨。,會員會費等　,新竹市市政府　　九十二年八月二十日,永　　　久,103000.00,1,0920923,0921111,0920925,,,,,,
092法登社000018,2,1,謝怜聰,494,0921105,0921229,0921230,15冊19頁,,,盧國郎,社團法人新竹縣長期照護服務協會,0921229,新竹縣新豐鄉鳳坑村八鄰七二０之二號,本會為依法設立，非以營利為目的之社會團體，以健全護理照護、長期照護、長期照護業者經營管理、營照互動交流關係，提昇服務品質，並爭取多元化護理照護、長期照護權益福祉，配合政府平衡施政為發展宗旨。,會員會費等,新竹縣政府　九十二年十月十六日,永　　　久,122654.00,1,0921105,0930112,,,,,,,
092法登社000019,2,1,謝怜聰,495,0921114,0921114,0921117,15冊20頁,,,陳炫彬,社團法人中華民國台灣薄膜電晶體液晶顯示器產業協會,0921114,新竹縣竹東鎮興路四段一九五號十五館二八二室,"本會為依法設立非以營利為目的之社會團體,以匯聚產業發展共識，促成會員間之合作與國際合作，以促進產業繁榮進步為宗旨。　",會員會費等,內政部　　八十九年五月十七日,"永     久",4000000.00,1,0921114,0930112,0921120,,,,,,
092法登社000020,2,1,謝怜聰,496,0921119,0921119,0921120,15冊21頁,,,"季  昀",社團法人新竹市學習障礙教育協進會,0921119,新竹市明湖路三九三巷四號,"本會為依法設立之社會團體,非以營利為目的,為增進學習障礙學生之受教機會,並提昇其受教品質為宗旨",會員會費等,"新竹市政府社會局  九十一年一月十二日","永    久",41927.00,1,0921119,0930112,0921124,,,,,,
092法登社000021,2,1,謝怜聰,497,0921201,0921201,0921202,15冊22頁,,,鄭百川,社團法人台灣鎂合金協會,0921201,新竹縣竹東鎮中興路四段一九五號五二館七０七室,"本會為依法設立,非以營利為目的之社會團體,以結合鎂合金相關之產、官、學、研界共同促進鎂合金產業及技術發展為宗旨。",會員會費等,內政部九十二年七月二十八日,永　久,200000.00,1,0921201,0930112,0921201,,,,,,
092法登社000022,2,1,謝怜聰,499,0921231,0921231,0930102,15冊24頁,,,郭鳳嬌,社團法人新竹市米粉商業同業公會,0921231,新竹市延平路一段三五七巷九十一號,本會依法設立，以促進同業情感，增進技述經驗交流，提升產品品質，振興米粉傳統產業發展產地觀光事業，並謀共同利益為宗旨,會員會費等,新竹市政府　九十二年九月十日,永　　久,264141.00,1,0921231,0930112,,,,,,,
092法登財000001,1,1,謝怜聰,474,0920401,0920401,0920402,14冊49頁,,,黃衍介,財團法人李宏銘科技新知文教基金會,0920401,新竹市大學路八十八號十八樓之四,本會之宗旨在產生、推廣、教育科技新知，致力於台灣與國際學術教育機構之合作交流，及支持相對論光電子動力學之學術研究。,由應用生物光電股份有限公司等共同捐助,新竹市政府　　九十二年三月十二日,永　　久,2000000.00,1,0920401,0920403,0920403,,,,,,
092法登財000002,1,1,謝怜聰,479,0920520,0920520,0920521,15冊4頁,,,李遠哲,財團法人國家同步輻射研究中心,0920520,新竹市科學工業園區新安路一０一號,本中心以有效運轉與利用同步輻射設施，執行相關尖端基礎與應用研究，提昇我國科學研究之水準與國際地位為目的,由中央政府編列預算捐助,行政院國家科學委員會,"永    久",100000000.00,1,0920520,0920522,0920522,,,,,,
092法登財000003,1,1,謝怜聰,484,0920707,0920707,0920708,15冊9頁,,,潘鵬仁,財團法人新埔潘欽龍教育基金會,0920707,新竹縣新埔鎮中正路二三０號,本會以協助推動新埔鎮辦理社會教育及學校教育為宗旨。,潘鵬仁等九人共同捐助,"新竹縣政府  九十二年六月十六日","永   久",3000000.00,1,0920707,0920710,0920710,,,,,,
092法登財000004,1,1,謝怜聰,486,0920721,0920721,0920722,15冊11頁,,,譚昌琳,財團法人經綸教育基金會,0920721,新竹市大學路九十號十九樓之四,本會以獎勵學子就學、宗教人文及科技研究為宗旨,由譚昌琳先生捐助,"新竹市政府教育局  九十二年七月二日","永   久",2000000.00,1,0920721,0921224,,,,,,,
092法登財000005,1,1,謝怜聰,491,0920908,0920908,0920909,15冊16頁,,,陳崇斌,財團法人新竹市中華基督教東山街浸信會,0920908,新竹市東山街六十二號,本法人以傳佈基督福音，傳揚耶穌真理，辦理社會公益慈善事業及充實信徒心靈生活為宗旨。,由財團法人美南浸信會台北市事務所捐助,新竹市政府　九十二年八月二十六日,永　　久,66443870.00,1,0920908,0930112,,,,,,,
