092法登他000183,1,2,簡福助,537,0920715,0920716,0920717,27冊19頁,1,1,陳文欽,財團法人台北縣私立雙連社會福利慈善事業基金會,0891228,台北縣三芝鄉後厝村二十二之十七號,以辦理社會福利慈善事業為宗旨。,由財團法人台灣基督長老教會雙連教會捐助,台北縣政府社會局中華民國八十九年十二月二十一日八九北府社助字第四八七五二三號,永久,120995200.00,1,0920716,0921002,0920730,蔡芳文,台北縣三芝鄉後厝村二二－十七號,,,,,,,,,,,,,,https://aomp109.judicial.gov.tw/judbp/whd6k/q/vSBUVHsOnAYuNT54DfwZODvmCN8pSBF_WQ2gSXZAeSos7AMK9H6tGMfwcSQ=
092法登他000184,1,2,簡福助,680,0920716,0920717,0920721,34冊37頁,,0,"陳  樹",財團法人中華民國會計研究發展基金會,0730615,台北市大同區承德路一段十七號二十樓,以提高我國會計學術水準，促進會計準則之持續發展及協助工商企業健全會計制度為宗旨。,捐贈,財政部七十三年五月二十一日（七三）台財證（一）字第一二八三號函,永久,6000000.00,1,0920717,0921002,0920801,,,,,,,,,,,,,,,,https://aomp109.judicial.gov.tw/judbp/whd6k/q/OCdYntXN5MPrZ_SqeR6Fz7lrZ41ccA2y5ZwnyZTx7UZlKA3tRItYfNo-wHU=
092法登他000186,1,2,簡福助,27,0920721,0920721,0920722,1冊53頁,2,5,柯淑貞,財團法人台灣基督教道生長老會北投中和教會,0760609,台北市北投區中和街四九三巷六之三號,"奉行耶穌基督博愛救人之真理，遵照聖經原則傳揚福音，設立教會為        宗旨，並辦理社會公益慈善事業。",捐助,台北市北投區公所76.5.25北市投民字第八六三００號,永久,606680.00,1,0920721,0921002,0920804,葉如敬,台北市臨沂街二十四巷三號,,,,,,,,,,,,,,https://aomp109.judicial.gov.tw/judbp/whd6k/q/C6FKyNxUDzmy7hJwbcFwKJEFPstNrSXkpWspvRh1gCDjpylmHGGeYKXwDA==
092法登他000187,1,2,簡福助,530223,0920722,0920722,0920725,2冊34頁,1,8,彭勝利,財團法人台北市基督教南港浸信會,0530919,台北市興華路六二號,本會以宣揚基督福音真理，辦理慈善公益、充實信眾心靈精神生活，促進社會善良風氣為宗旨。,捐助,台北縣政府53.6.20北縣民一字第十六號,永久,1632610.50,1,0920722,0920812,0920812,廖世孟,台北市南港區興華路六二號,,,,,,,,,,,,,,https://aomp109.judicial.gov.tw/judbp/whd6k/q/DUrHNZpWoH6-1_TsOBIS0c7HSh_Z-XkoeGIdhuJWaskME5eklpaXnge_TQXIn-Q=
092法登他000188,1,2,簡福助,550276,0920723,0920724,0920725,2冊25頁,1,10,許敏惠,財團法人台北市台灣許姓宗祠,0811102,台北市士林區士東路五四巷十一號,顯揚祖德、敦睦親誼，增進族人福利，啟發後裔，樹立團體互助精神兼行慈善公益。,捐助,陽明山管理局55.9.10陽明證字第八號,永久,267961765.00,1,0920724,0921002,0920805,黃松源,台北市士林區士東路五四巷十一號,,,,,,,,,,,,,,https://aomp109.judicial.gov.tw/judbp/whd6k/q/3vyiNgPUAM-dRXwdIBCqioM8hpOtB2tJccnye4bIrz7219TlRjqNNTB4mmURiJ4=
092法登他000189,1,2,簡福助,500139,0920723,0920724,0920725,1冊67頁,1,14,"陳  幸",財團法人台北市私立衛理女子高級中學,0840322,台北市士林區至善路二段三二一號,以創辦財團法人台北市私立衛理女子高級中學校並謀其發展為目的。,由衛理公會及各同學校友捐助。,台灣省政府教育廳50.7.10教二字第二五六一號函,永久,1369096648.36,1,0920724,0921002,0920730,谷筱雯,台北市士林區至善路二段三二二巷八號,,,,,,,,,,,,,,https://aomp109.judicial.gov.tw/judbp/whd6k/q/F5OY_PTUBNiB4-dm9PeCjiorTvS2tv8qygfU9emt_IltDzdpgJZdLzH_rfoNXJ0=
092法登他000190,1,2,簡福助,693,0920724,0920912,0920915,35冊16頁,,0,陳宏一,財團法人台北市素香慈善事業基金會,0791105,台北市內湖區成功路二段三二五號（三軍總醫院）,救助貧苦病患醫療及復健，期使無力負擔醫療費用之貧苦病患有獲得醫療之同等機會，俾原有可望挽救之生命或肢體機障，能獲得醫療照顧而不致放棄應有之治療。,林素香女士捐助,七十九年九月二十六日台北市政府社會局　北市社二字第三三五七九號函,永久,10000000.00,1,0920912,0920922,0920922,蔡惠芳,台北市內湖區成功路二段三二五號（三軍總醫院）,,,,,,,,,,,,,,https://aomp109.judicial.gov.tw/judbp/whd6k/q/EdJ_tiopuUUq5T6rBWkZtzEBF4uP-JYVyFBArkcpevD8eFgRkLaP87wu1QI=
092法登他000191,1,2,簡福助,136,0920728,0920729,0920730,7冊11頁,1,4,許本爵,財團法人台北市中國基督教靈糧世界佈道會士林靈糧堂,0810904,台北市社中街二九八巷四弄二號一樓,本基督仁愛精神，以傳道為目的，辦理社會公益慈善教育、出版、發行及網路媒體等相關事業。,捐助,台北市政府民政局81.8.22,永久,112091375.00,1,0920729,0921002,0920805,唐秀麗,台北市士林區承德路四段一七０之一號,,,,,,,,,"捐助暨組織章程第五條條文及內容變更：                            
（業經主管機關台北市政府民政局中華民國九十二年七月九日北市民三字
第０九二三一六七六四００號函核備）",,,,,https://aomp109.judicial.gov.tw/judbp/whd6k/q/6iRcye94erlqQX9xVo9Erta0ef4CDX4g9zI7xdGjD543Ulp613FXVcFOVvA=
092法登他000192,1,2,簡福助,141,0920729,0920729,0920730,7冊21頁,1,2,莊光明,財團法人七星農業發展基金會,0811120,台北市民權東路六段九十巷十八號四樓,以配合政府推展休閒農業，辦理學童農業推廣教育，農村綠美化及培養農業人才，提高農民所得與社會地位及改善環境景觀，提昇生活品質，推行農業及水利政策，開發地方農業資源，建立安祥富足繁榮的社會為宗旨。,捐助,台北市政府81.10.8,永久,1067331837.00,1,0920729,0921002,0920806,黃凱茵,台北市民權東路六段九十巷十八號四樓,,,,,,,,,"原捐助暨組織章程第五、第八條條文內容變更及第十三條之一條文新增︰
（業經本院民事庭九十二年度法字第二一號民事裁定確定）",,,,,https://aomp109.judicial.gov.tw/judbp/whd6k/q/XPvq2LlgziDl4bY33Mbk8YWYviLFfP4gc0-nYdiiWhI7XijzGQp3Pz53-BQ=
092法登他000193,1,2,簡福助,689,0920730,0920829,0920902,35冊4頁,,0,林百里,財團法人當代藝術基金會,0900718,台北市士林區後港街一一六號九樓,以推動當代藝術之發展與欣賞為宗旨。,由財團法人台積電文教基金會、財團法人廣達電腦教育基金會、宏碁電腦股份有限公司、民生報股份有,臺北市政府文化局中華民國九十年六月二十九日北市文化四字第九０二０八八三九００號函,永久,5000000.00,1,0920829,0920908,0920908,王明馨,台北市士林區後港街一一六號九樓,,,,,,,,,,,,,,https://aomp109.judicial.gov.tw/judbp/whd6k/q/XdspHvCSjJUot-yeCUdj68xqMAKSg2T2cYOnEDAAdu7DqoqqvprnPpm2VX8=
092法登他000197,1,2,簡福助,225,0920804,0920805,0920806,11冊29頁,2,4,王曼嬅,財團法人王榮圳文教基金會,0840227,台北市士林區忠誠路一段五十六號四樓,為推廣文化教育，並提昇農業機械水準獎勵學術研究，增進國際學術交流。,捐助,教育部84.2.8台(84)社字第五五八四號函,永久,30000000.00,1,0920805,0921002,0920812,劉靜蘭,台北市松山區復興北路一０一號六樓之十,,,,,,,,,,,,,,https://aomp109.judicial.gov.tw/judbp/whd6k/q/ucvNtDWFx_cU_oAW3BrhBS94rz8ql2T_QW4sSGvvxxIUbHZV-KewF37FmL0=
092法登他000198,1,2,簡福助,360,0920806,0920807,0920808,18冊19頁,2,3,周荃,財團法人賢德惜福文教基金會,0861227,台北縣八里鄉舊城村中華路二段一八０號十樓,以台北縣文化教育政策研究發展暨服務為宗旨，依有關法令規定辦理各項業務。,由台灣邁新企業有限公司及國航航空器工業有限公司共同捐助,台北縣政府⒒八六北府教三字第442361號,永久,2000000.00,1,0920807,0920818,0920818,呂淑華,台北市內湖區行善路二五巷四六號七樓,,,,,,,,,"原捐助章程第二、第十五條條文及內容變更：                        
（業經本院民事庭九十二年度法字第二八號民事裁定確定）",,,,,https://aomp109.judicial.gov.tw/judbp/whd6k/q/naQZ5y_Bm6tJPwP6JM9lR6XfB9J_5kZlmHnWx2MMm_oWf6fACf8NIGUmiKo=
092法登他000200,1,2,簡福助,460051,0920811,0920812,0920813,1冊29頁,2,12,林燦榮,財團法人台北市覺修宮,0460807,台北市大同區重慶北路三段三四０號,為宗奉聖、神仙、佛，闡揚三教道德遵守聖訓改良信仰中之惡習，增進和睦，確守國法信念、慈悲精神，並辦理社會公益事業。,捐助,台北市政府民政局46.6.15,永久,83263509.40,1,0920812,0920819,0920819,蔡政諺,台北市信義區忠孝東路五段二四二號六樓,,,,,,,,,,,,,,https://aomp109.judicial.gov.tw/judbp/whd6k/q/mJ05p-cbCdFFzieuwJ3Q25d6IvPzpWdmJzSU7HG4IiJwXGA_s9t1RvEa_XFa3hY=
092法登他000201,1,2,簡福助,560299,0920812,0920813,0920814,2冊33頁,2,9,郭添福,財團法人台北市天師宮,0560616,台北市大同區延平北路三段九九號,為崇奉聖神仙佛、闡揚三教道德、遵守聖訓、改良信仰中之惡習、增進和睦、確守國法信念慈悲精神為宗旨。,捐助,"台北市政府民政局  中華民國五十五年二月十日",永久,486000.00,1,0920813,0920820,0920820,連婉憶,台北市酒泉街一０三巷三號,,,,,,,,,,,,,,https://aomp109.judicial.gov.tw/judbp/whd6k/q/X_zU6QAXbc0OVtCAaJ9_L_L46Fqy_IOY5--S6p0Rkc8WexjRqMJQ1WL8BcrCSW4=
092法登他000202,1,2,簡福助,694,0920813,0920915,0920916,35冊19頁,,0,李伸一,財團法人中華民國納稅人基金會,0790827,台北市延平北路四段一００號,保障納稅人權益，推廣租稅教育，促進租稅公平合理。,由陶傳正等捐助，並接受外來捐贈。,財政部年元月?日、台財稅第七八０四三四三０九號,永久,2000000.00,1,0920915,0920930,0920930,歐合純,台北市中山區中山北路二段七七巷二九號七樓,,,,,,,,,,,,,,https://aomp109.judicial.gov.tw/judbp/whd6k/q/7whxCwtQi4hpGI1duQRwbx258tb-73eG3pPVXy3_MwrKB-fzErhVvwgk5-0=
092法登他000203,1,2,簡福助,268,0920814,0920912,0920915,13冊35頁,2,3,何武雄,財團法人國華體育文教基金會,0850217,台北縣淡水鎮坪頂里二十三之一號,為求達到高爾夫體育及文化運動之推廣，以及開創時代的正當運動風氣，提高生活品質之目的。,捐助,教育部、中華民國八十五年一月八日台(85)體84065611號。,永久,20000000.00,1,0920912,0920922,0920922,王麗蓉,台北市內湖區行善路一二八號一樓,,,,,,,,,"原捐助章程第三條、第十五條條文及內容變更：                      
（業經本院民事庭九十二年度法字第三五號民事裁定確定）",,,,,https://aomp109.judicial.gov.tw/judbp/whd6k/q/ifV72K6lciGL8F6NEomrK9rrEJX3gxd0StMmPuXHuVpSDHP8jyO0P3cIaNw=
092法登他000204,1,2,簡福助,545,0920815,0920915,0920916,27冊43頁,1,1,王承前,財團法人天主教白永恩神父社會福利基金會,0900302,台北市士林區中正路二六四號,以辦理社會福利慈善事業為目的。,捐助,"內政部  中華民國九十年二月八日台內中社字第九０七０二五七號函",永久,861967069.00,1,0920915,0920922,0920922,黃美惠,台北市松山區民生東路五段一六五號十四樓之六,,,,,,,,,"原捐助章程第十七條、第十八條條文及內容變更：                    
（業經本院民事庭九十二年度法字第三四號民事裁定確定）",,,,,https://aomp109.judicial.gov.tw/judbp/whd6k/q/rSJypRd1ugdkmBnSihD0j2sUJIrgE8hifrOQFyDyaV-0ci4bAMjKFxyTKI4=
092法登他000207,1,2,簡福助,456,0920819,0920820,0920822,23冊16頁,1,2,張聖嚴,財團法人法鼓山人文社會獎助學術基金會,0890117,台北市北投區光明路二七六號,一、推動人文社會化，社會人文化之理念；以提昇人的品質，建設人間淨土。二、經由人文社會學術之探討，開發人的心智、轉變人的觀念；以達成淨化人心，淨化社會的目的。三、鼓勵社會各界人士撙節祝賀、追思及特別紀念之費用，移作文教獎助金；既可永久紀念，亦能改善社會風氣，造福社會。,捐助。,教育部　中華民國捌拾玖年壹月拾貳日　台（八九）社（四）字第八九００三三三九號函　,永久,484188381.00,1,0920820,0920827,0920827,熊淑惠,台北縣金山鄉三界村半嶺十四－五號,,,,,,,,,,,,,,https://aomp109.judicial.gov.tw/judbp/whd6k/q/dUoHHokoEABcdNOngwh5nhv68WrIfmUFm6eM3Hg-Pkd7PsoLozf1JAcKa7s=
092法登他000208,1,2,簡福助,647,0920819,0920825,0920827,32冊58頁,2,10,陳義男,財團法人聯合船舶設計發展中心,0651001,台北縣淡水鎮中正東路二段二十七號十四樓,聯合國內外造船及有關海事技術人才，提供服務，以協助國內外造船工業、航業及其他海洋結構工程有關事業之發展為目的,由中船公司等八個單位共同捐助,經濟部民國六十五年九月六日經（六五）技字第二四六四０號,永久,136284724.00,1,0920825,0920929,0920929,羅曼華,台北縣淡水鎮中正東路二段二七號十四樓,,,,,,,,,"原捐助章程第九、十、十一、十二條文及內容變更：                  
（業經本院民事庭九十二年度法字第二三號民事裁定確定）",,,,,https://aomp109.judicial.gov.tw/judbp/whd6k/q/7mMwAqKz7jvKUp5kYiTnBO_lwk1Jw5bUM55V2wAsWeW8YKJWBB0YRtr5_ZU=
092法登他000209,1,2,簡福助,61,0920819,0920825,0920827,3冊21頁,2,5,何忠雄,財團法人台北市傳統與現代文教基金會,0780508,台北市大同區長安西路261號3樓,為達中華傳統文化薪傳及開創時代性文化藝術之目的與推展各相關研究和活動。,捐助,台北市政府教育局78.2.21北市教四字第五０九九號函,永久,1000000.00,1,0920825,0921009,0921009,,,,,,,,,,,"原捐助暨組織章程第六條條文及內容變更：                          
（業經本院民事庭九十二年度法字第一八號民事裁定確定）",,,,,https://aomp109.judicial.gov.tw/judbp/whd6k/q/KO7L8xVsDzTssN79ygvNb4M44vKdythx8YTQwqtl9fWTPH4qwApQz5-u4A==
092法登他000210,1,2,簡福助,630586,0920819,0920820,0920822,3冊21頁,1,10,何正言,財團法人台北市私立方濟高級中學,0630626,台北市內湖區成功路三段六十一號,以創辦台北市私立方濟中學並謀其發展為目的。,捐助,台北縣政府54.7.8北府教一字第六四五二五號令,永久,247776393.00,1,0920820,0920915,0920915,張正本,台北市內湖區成功路三段六十一號,,,,,,,,,,,,,,https://aomp109.judicial.gov.tw/judbp/whd6k/q/S7RE0yG6Lvs4JX6D6Aipzi0nOYW6WDJs1hsQUdid6YtLzqSN59FJgg20-ufJLx8=
092法登他000211,1,2,簡福助,560,0920820,0920825,0920827,28冊28頁,1,1,王世任,財團法人志英植物研究發展基金會,0900613,台北市內湖區基湖路三五巷十一號七樓,以植物之栽培、研究及應用等為設立目的。,捐助,行政院農業委員會　中華民國九十年六月五日（九０）農糧字第九００一二七００七號函,永久,5000000.00,1,0920825,0920904,0920904,謝麗華,台北市北投區石牌路一段三九巷一三三弄七號,,,,,,,,,"原捐助章程第三、六、七、九、十三、十六、十七條條文及內容變更：  
（業經本院民事庭九十二年度法字第一九號民事裁定確定）",,,,,https://aomp109.judicial.gov.tw/judbp/whd6k/q/YrYa7g7sqwgH5IgdFl7IxhjeBkJk4ZZY2VTCGAyKcX4JzycnKQs07aqjkk4=
092法登他000212,1,2,簡福助,623,0920820,0920825,0920827,31冊46頁,1,1,吳鴻顯,財團法人康寧社會福利慈善事業基金會,0910822,台北市內湖區成功路五段四二０巷二十八號一樓,以辦理社會福利慈善事業為目的。,由台北市內湖區第二期自辦市地重劃區重劃會，鄭錫華、胡曉菁、陳玲玲等四人共同捐助,內政部中華民國九十一年八月五日台內中社字第０九一００七一０四八號函,永久,84000000.00,1,0920825,0920901,0920901,馬美美,台北市內湖區成功路五段四二０巷二十八號一樓,,,,,,,,,"原捐助章程第十七條、第十八條條文及內容變更：                    
（業經本院民事庭九十二年度法字第二七號民事裁定確定）",,,,,https://aomp109.judicial.gov.tw/judbp/whd6k/q/ZObTXZXAXPXrumrzdq99qz1qqWAP5hFIts5X4zXHXd10RYX2VaeO27QMS00=
092法登他000213,1,2,簡福助,618,0920820,0920825,0920827,31冊31頁,1,7,鄭錫華,財團法人康寧醫院,0600910,台北市內湖區成功路五段四二０巷二十六號,以強化社會服務，增進國人身心健康為目的。,中國大眾康寧互助會撥交土地,台北市政府衛生局五十九年九月二十一日北市衛三字第一一０七０號函,永久,80000000.00,1,0920825,0920901,0920901,徐娟娟,台北市內湖區成功路五段四二０巷二十六號,,,,,,,,,,,,,,https://aomp109.judicial.gov.tw/judbp/whd6k/q/US_WuhDitbf3od7d8WcdL9IRSjTHYkov3lv-X4u1SEb33j-pVZpk7iVPGW4=
092法登他000214,1,2,簡福助,600444,0920822,0920825,0920827,2冊75頁,1,3,翁仁義,財團法人台北葫蘆寺,0601228,台北市士林區延平北路五段二八五巷三五號,"宏揚觀音佛祖濟世精神,勸導國民行善。",由信徙及熱心人士樂捐,陽明山管理局??陽明政基字第28729號,永久,73056000.00,1,0920825,0920901,0920901,鄭財雄,台北市士林區延平北路五段二八五巷三五號,,,,,,,,,"捐助暨組織章程第十三、二十六條條文及其內容變更：                
（業經本院民事庭八十九年度法字第三九號民事裁定確定）",,,,,https://aomp109.judicial.gov.tw/judbp/whd6k/q/ewnEUaXLnD6JC6nihrPLWcUHKccfLoV28BQmqn4X-mjTDedXELzc_cE0NQJ5FBA=
092法登他000215,1,2,簡福助,349,0920822,0920825,0920827,17冊37頁,2,3,吳正斌,財團法人台北市私立祥安老人養護所,0861009,台北市北投區自強街一六二巷三號,提供罹患慢性疾病老人寧靜、安全、衛生之環境及設備，增進老人健康老人生活照顧為目的。,捐助,台北市政府社會局⒏北市社四字第8624395200號,永久,2112000.00,1,0920825,0920910,0920910,吳小琴,台北市北投區自強街一六二巷四號一樓,,,,,,,,,,,,,,https://aomp109.judicial.gov.tw/judbp/whd6k/q/HcZ55NSAGY03UHpNSGxfV-8piKtNmYJAVc3eSeNkW-e8wYYTgIXUWylDR4w=
092法登他000216,1,2,簡福助,350,0920822,0920825,0920827,17冊39頁,2,3,吳正斌,財團法人台北市私立祥好老人養護所,0861009,台北市北投區自強街一六二巷四號,提供罹患慢性疾病老人寧靜、安全、衛生之環境及設備，增進老人健康老人生活照顧為目的。,捐助,台北市政府社會局⒏北市社四字第8624395300號,永久,2112000.00,1,0920825,0920910,0920910,吳小琴,台北市北投區自強街一六二巷四號一樓,,,,,,,,,,,,,,https://aomp109.judicial.gov.tw/judbp/whd6k/q/5cxprq_Nm61PUx8v2cepx_fF6ytaiekznoeGeh7MkA3ADz7k4-0bwB8eI7U=
092法登他000218,1,2,簡福助,650660,0920827,0920828,0920829,3冊45頁,2,3,楊天賜,財團法人台北市大同民防義警協進基金會,0650211,台北市大同區延平北路四段二二號四樓,以支助大同民防義警協勤中心促進警民團結及民防義警公益事項為目的。,捐助,台北市政府警察局?北市警防字第12136號,永久,880000.00,1,0920828,0920905,0920905,田大來,台北市敦煌路二四巷九號四樓,,,,,,,,,"原捐助暨組織章程第五條條文及內容變更：                          
（業經本院民事庭九十二年度法字第三三號民事裁定確定）",,,,,https://aomp109.judicial.gov.tw/judbp/whd6k/q/cw8e-fg2oz1JtJB48uS1vBheNFRUutNk0NuHG4-i2EFjeeUmvJrSkWNBOSrbQSg=
092法登他000219,1,2,簡福助,688,0920827,0920828,0920829,35冊1頁,,0,釋曉雲,財團法人華梵文教基金會,0870803,台北市承德路三段二三０號九樓,以支援華梵大學興辦教育、宏揚宗教濟世精神善導社會人心為宗旨。,由釋曉雲捐助。,"教育部八十七年七月六日 台社?字第八七０六四一一七號函。",永久,21883872.00,1,0920828,0920908,0920908,張嘉真,台北市承德路三段二三二號十樓,,,,,,,,,,,,,,https://aomp109.judicial.gov.tw/judbp/whd6k/q/Nnl072Mp9rtIlRnMQUcRsiCEN2SWPxvTC4szDF1wJPTQtff51PebUHy9yg8=
092法登他000220,1,2,簡福助,517,0920828,0920829,0920902,26冊9頁,2,3,柯文昌,財團法人普訊融悟文教基金會,0831224,台北市內湖區堤頂大道二段十五號六樓,以推廣教育事業為宗旨。,由柯文昌、柯文仁等人捐助,教育部八十三年十二月九日台(八三)社字第０六六七三六號函,永久,142730475.00,1,0920829,0920910,0920910,黃麗灼,台北市內湖區堤頂大道二段十五號六樓,,,,,,,,,"原捐助章程第二條、第十五條條文及內容變更：                      
（業經本院民事庭九十二年度法字第三二號民事裁定確定）            
法人圖計記變更。                                                
法人圖記。",,,,,https://aomp109.judicial.gov.tw/judbp/whd6k/q/587OFRfzLj7XeJIP0bVCee-PYTXvHaPU9vmQUWpEfW5gNM0CITuF__bbcng=
092法登他000223,2,2,簡福助,271,0920901,0920903,0920904,14冊1頁,2,24,黃正慶,社團法人國際獅子會中華民國總會臺灣省台北縣八里獅子會,0850320,台北縣八里鄉中華路二段一三四號三樓,以發揚人類博愛互助精神增進國際間友好關係，尊重自由啟發智慧提倡社會福利，促進國家安全為目的。,會員入會費及捐助。,台北縣政府六十九年十二月五日北府社一字第六九０一二號。,永久,296770.00,1,0920903,0920915,0920915,李華美,台北縣八里鄉中華路二段一三四號三樓,,,,,,,,,,,,,,https://aomp109.judicial.gov.tw/judbp/whd6k/q/rNYMFe-voKS2ZAKpi2TG96J9JE8shRp4CFkImbyHgDKE9zCgl02Si3I2j-E=
092法登他000224,1,2,簡福助,590389,0920901,0920903,0920904,2冊65頁,1,5,蔣宋美齡,財團法人振興復健醫學中心,0591003,台北市北投區振興街四十五號,以醫療病患、闡揚醫學、學術研究、培植人才及擴大醫療服務為目的。,捐助,陽明山管理局改制為行政院衛生署59.3.3,永久,2614199232.00,1,0920903,0920910,0920910,蔡淑銘,台北市北投區振興街四十五號（院本部）,,,,,,,,,"原捐助章程第十五條、第十六條條文及內容變更：                    
（業經本院民事庭九十二年度法字第三一號民事裁定確定）",,,,,https://aomp109.judicial.gov.tw/judbp/whd6k/q/hzV0XUQ2xp7JD9lg5WXhjBCbMB4xLM6kl5Iu2Qk_CznX0GVN0P13n2Ll0gFyV4U=
092法登他000225,1,2,簡福助,63,0920901,0920903,0920904,3冊25頁,1,5,吳清基,財團法人中國童子軍陽明山活動中心,0780517,台北市北投區竹子湖路一之五及一之十號,推行童子軍運動並提供兒童及青少年育樂設施。,捐助,台北市政府教育局78.4.27北市教四字第一七０四七號函,永久,17310800.00,1,0920903,0920925,0920925,吳慶華,台北市北投區竹子湖路一之十號,,,,,,,,,"原捐助章程第一、三、四、九、十條及原組織章程第一、二、九、十、十
三條條文內容變更。（業經臺灣士林地方法院九十一年度法字第一七號民
事裁定，確定。）",,,,,https://aomp109.judicial.gov.tw/judbp/whd6k/q/EOfnlIpI1usTyD1Yvn4ui35y2lhZxPewNFwmpNX97Wmss4T74Ml_f0gMmA==
092法登他000226,1,2,簡福助,669,0920901,0920903,0920904,34冊4頁,1,1,馬玉山,財團法人冠雄文教基金會,0870714,台北市內湖區星雲街一六三號三樓,以增進暨推廣音樂、美術、文學之文化教育事業為目的。,由冠德建設及雙雄建設開發股份有限公司共同捐助,台北市政府教育局八十七年六月二十五日北市教四字第八七二三五一九四００號函,永久,11954164.00,1,0920903,0920916,0920916,周立人,台北市和平東路三段一三一號二樓,,,,,,,,,,,,,,https://aomp109.judicial.gov.tw/judbp/whd6k/q/KwNi5ynHvh8MDkg7WgBL8RVNFHKl40EJ-0_PPuIqsNqrBprXt-nu-xaNo1U=
092法登他000227,2,2,簡福助,254,0920901,0920903,0920904,13冊7頁,2,3,李松發,社團法人台北市北投區吉慶社區發展協會,0841123,台北市北投區實踐街三十四號三樓,以促進社區發展，增進居民福利，建設安和融洽團結互助之現代化社會為宗旨。,會員會費及捐助,台北市政府社會局84.2.4北市社七字第四九三九號函,永久,150000.00,1,0920903,0920915,0920915,高芬明,台北市北投區致遠二路六一巷十二號二樓,,,,,,,,,,,,,,https://aomp109.judicial.gov.tw/judbp/whd6k/q/kHnyG09d5HLZNhalDX5pQ2x18SWW-CwmZcds8lb4BVB1-Goli9ByWosj-XY=
092法登他000228,1,2,簡福助,344,0920903,0920909,0920910,17冊27頁,1,5,辜嚴倬雲,財團法人辜公亮基金會和信治癌中心醫院,0780811,台北市北投區立德路一二五號,以癌症之整體性治療、研究以及有關醫事人員之培育為宗旨。,台灣水泥股份有限公司等法人機構捐助現金或土地,行政院衛生署??衛署醫字第817528號,永久,3106713837.00,1,0920909,0920917,0920917,林雅玲,台北市基隆路一段三三三號九樓,,,,,,,,,,,,,,https://aomp109.judicial.gov.tw/judbp/whd6k/q/GshHtLr9_x1gLaolbL-8RlBtkwefhDpKop0yq4fVZ5s-lfTHseCPCo2tJYs=
092法登他000229,2,2,簡福助,645,0920903,0920909,0920910,32冊52頁,2,22,楊建邦,社團法人國際獅子會中華民國總會台灣省台北縣三芝獅子會,0911227,台北縣三芝鄉長安街一一三號五樓,㈠發揚人類博愛互助精神㈡增進國際間友好的關係㈢尊重自由啟發智慧㈣提倡社會福利㈤促進國家安全。,㈠會員常年會費。㈡會員捐款。㈢國內外公私團體及個人捐贈。㈣基金及其孳息。㈤其他收入,台北縣政府中華民國七十年十月一日七十北府社一字第二三二四五八號函,永久,3207300.00,1,0920909,0920919,0920919,張月霞,台北縣三芝鄉淡金路二段九九號四樓之一,,,,,,,,,,,,,,https://aomp109.judicial.gov.tw/judbp/whd6k/q/j0fB0PXxu1Xdb7soelbB6KfZZadSaK8H-xsb-scxj24bVUZJaKKLCS3N1vU=
