092法登他000273,1,2,簡福助,498,0921021,0921202,0921202,25冊22頁,2,2,洪德仁,財團法人台北市北投文化基金會,0890607,台北市北投區中央南路一段四五號之一,以保存、推展文化為宗旨。,捐助,台北市政府文化局中華民國八十九年五月二十二日北市文化三字第八九二０四０五０００號函,永久,5000000.00,1,0921202,0921215,0921215,許弘勳,台北市北投區中央南路一段四五號之一,,,,,,,,,"捐助章程第六、八、九、十條條文內容變更：                        
（業經本院民事庭九十二年度法字第四七號民事裁定確定）",,,,,https://aomp109.judicial.gov.tw/judbp/whd6k/q/b7AQTNtnXKmSmcI9yzLeD6EutgOGfvTVRx2PMQ4Y4n_ALkKRO86UgUtfhOo=
092法登他000274,1,2,簡福助,237,0921021,0921126,0921127,12冊13頁,1,3,陳建仁,財團法人國家衛生研究院,0840616,台北市南港區研究院路二段一二八號,以提昇我國醫藥衛生研究，增進國人健康福祉為目的。,由中央政府分年編列預算捐助之。,行政院衛生署84.4.27衛署醫字第八四０二０六四二號函,永久,2952097026.00,1,0921126,0921210,0921210,何書賢,台北市內湖區民權東路六段一０九號三樓,,,,,,,,,"捐助章程第九條條文及內容變更：                                  
（業經本院民事庭九十年度法字第三九號民事裁定確定）",,,,,https://aomp109.judicial.gov.tw/judbp/whd6k/q/le0vp4_-o5uYTIdYVXUTn0tboeWU9Z3qTTUHiBnSVaIrqQsLJuPcq2b2wkc=
092法登他000277,1,2,簡福助,198,0921022,0921022,0921027,10冊15頁,1,4,楊木興,財團法人現代禪文教基金會,0830711,台北市北投區懷德街六之二號三樓,闡揚中華禪學與固有文化，倡導科學、理性、人文之現代禪法，淨化人心，促進社會和諧。,由連永川先生等五人捐助,"教育部 81.12.22 台(81)社一字第七０四０四號函",永久,34300000.00,1,0921022,0921106,0921106,陳美惠,台北市信義區信義路五段一五０巷三四二弄十五號,,,,,,,,,"原捐助章程第八條、第十六條條文內容變更。                        
（業經臺灣士林地方法院九十一年度法字第二十八號民事裁定，確定。）",,,,,https://aomp109.judicial.gov.tw/judbp/whd6k/q/s2mTLAJmjoDf8o9-XDG9UOTUPQo-as0XaWAI-yWgihO2_g0JD0Dz2q_qdkk=
092法登他000278,1,2,簡福助,419,0921022,0921022,0921027,21冊17頁,2,3,洪家富,財團法人弘益網球文教基金會,0880518,台北縣淡水鎮崁頂里崁頂五八─六號,培育淡水網球人才，發展淡水網球運動。,捐助,"台北縣政府88.4.29 八八北府教三字第一二七三六五號",永久,2000000.00,1,0921022,0921106,0921106,陳秀蘭,台北縣淡水鎮新民街五十號十六樓,,,,,,,,,,,,,,https://aomp109.judicial.gov.tw/judbp/whd6k/q/LzmCAgqlz2niWnso3iol7QoNNQD2mi0fhOPEro5-AvuIQ-UoTeAILbopmJE=
092法登他000279,1,2,簡福助,580357,0921023,0921023,0921027,2冊55頁,2,7,陳天章,財團法人台北市北投慈后宮,0580731,台北市北投區清江路一六九號,宣揚聖母教義，辦理社會救濟。,捐助,台北市政府民政局58.6.5陽明政行字第一一九九四號,永久,16372528.00,1,0921023,0921103,0921103,陳麗珠,台北市北投區溫泉路三四巷十一弄四號二樓,,,,,,,,,,,,,,https://aomp109.judicial.gov.tw/judbp/whd6k/q/BwL-BrMJYKabBzt3sngChzMbHDkYC_9Xo8hkFTPJTzgEnLZi4FphBhFMZrMqwtc=
092法登他000280,2,2,簡福助,444,0921024,0921027,0921028,22冊40頁,1,2,劉榮堂,社團法人中華民國糖尿病之友協會,0881102,台北市士林區天母北路四四巷十號一樓,致力國內糖尿病預防之宣導及得病時病友間之相互扶持，喚起社會大眾對糖尿病的重視以促進國民健康。,捐助、社員繳納會費。,"內政部 八十八年九月二十七日 台( 八八) 內社字第八八八五四一０號",永久,25100.00,1,0921027,0921107,0921107,陳美燕,台北市士林區天母北路四四巷十號一樓,,,,,,,,,,,,,,https://aomp109.judicial.gov.tw/judbp/whd6k/q/pqSfbPKY_qsQl2uDnXMRXp_Mv7ZxTOZ6U5-E0h4g1XW_iKmMQ_nzj7F0NBQ=
092法登他000281,2,2,簡福助,445,0921024,0921027,0921028,22冊43頁,1,2,陳昭聰,社團法人中華民國健康之友協會,0881103,台北市士林區天母北路四四巷十號一樓,致力東西方醫學保健養生方法之介紹。,社員繳納會費、捐助。,"內政部 八十八年九月二十七日 台( 八八) 內社字第八八八五四一一號",永久,25100.00,1,0921027,0921107,0921107,陳美燕,台北市士林區天母北路四四巷十號一樓,,,,,,,,,,,,,,https://aomp109.judicial.gov.tw/judbp/whd6k/q/aHdFSmA33FiOXafGVujYEicfMNH-0PmVdhWdrD1wnpiupWYJJW-ghIElDlI=
092法登他000283,1,2,簡福助,490098,0921028,0921029,0921030,1冊45頁,2,14,蕭東浩,財團法人台灣省台北縣私立淡江高級中學,0831129,台北縣淡水鎮真理街二十六號,為辦理台北縣私立淡江高級中學暨附設國民中學部、私立純德幼稚園。,捐助,台灣省政府教育廳47.11.18教二字第六三四四六號函,永久,356808780.00,1,0921029,0921106,0921106,鄭禎瑞,台北縣淡水鎮真理街二六號,,,,,,,,,,,,,,https://aomp109.judicial.gov.tw/judbp/whd6k/q/b1cXtSrXv4kAgDlngLVNfXV5oKb5KNabxLsKKdLvzX0cUo7xcVbX5qtsUlS2NE8=
092法登他000284,1,2,簡福助,400015,0921030,0921031,0921104,1冊9頁,1,17,王文霖,財團法人王氏太原堂,0401019,台北市迪化街二段二四三巷二號,以闡揚祖德、敦睦宗誼、增進族人福利，樹立團結互助精神。,捐助,台北市政府民政局??,永久,272930128.00,1,0921031,0921119,0921119,王世亮,台北市迪化街二段二四三巷二號,,,,,,,,,"原捐助章程第二、六、七、十二、十三、十五至二十、二十四、二十六條
條次及內容變更，第十一、二十一、二十二、二十三條條文刪除：      
（業經本院民事庭九十二年度法字第一一號民事裁定確定）",,,,,https://aomp109.judicial.gov.tw/judbp/whd6k/q/6R0UwjGBZjSBbWj0TYCShZuoJRr7ZD0mnkc05qbogkwXbZ4T5cJJStqiLtKhtpE=
092法登他000285,1,2,簡福助,38,0921030,0921031,0921104,2冊17頁,1,5,李良雄,財團法人鄒濟勳醫學研究發展基金會,0770226,台北市北投區石牌路二段二０一號,以推展策劃資助醫師、護理、技術、行政、工程、營養及社工等醫院有關人員繼續教育，出國進修、參觀、訪問、開會與研究，並積極提供上述人員再教育的資訊、機會、場所、師資，以資助其費用為主。,捐助,行政院衛生署77.1.20衛署醫字第七０七四九一號函,永久,102160830.00,1,0921031,0921114,0921114,裴漢民,台北市北投區石牌路二段二０一號（台北榮民總醫院）,,,,,,,,,"原捐助章程第五條條文及內容變更：                                
（業經本院民事庭九十二年度法字第四一號民事裁定確定）",,,,,https://aomp109.judicial.gov.tw/judbp/whd6k/q/TkrGLbDxQCxpajM7RJhv3lpUJ9NM8sWnzV_HWlp2KT-whnHsltXVyZX8Fg==
092法登他000286,1,2,簡福助,670744,0921103,0921104,0921105,3冊71頁,2,16,潘采薇,財團法人台北市私立靜修女子高級中學,0830617,台北市大同區寧夏路五十九號,為遵照國家教育政策暨現行教育法令之規定，辦理普通中學，並謀其健全發展為目的。,捐助,台灣省政府教育廳⒋⒕(40)卯寒字第一四五八六號,永久,212047869.14,1,0921104,0921110,0921110,馬朱麗,台北市寧夏路五十九號,,,,,,,,,,,,,,https://aomp109.judicial.gov.tw/judbp/whd6k/q/6JuFHvArB-1z0LlAs_fL_zfPZDTTgvnCrDCkTa9sYCqN8HTeoabiPOaVX_2aqnM=
092法登他000287,1,2,簡福助,287,0921103,0921107,0921110,14冊33頁,1,22,許勝雄,財團法人中國生產力中心,0450626,台北縣汐止市新台五路一段七九號二樓,本中心以執行目的事業主管機關產業發展政策，協助企業精進經營管理技術，提昇生產力與競爭力，促進經際發展為目的。,捐募,經濟部中華民國四十五年六月廿日發文經台四五工字第０六０二六號,永久,10000000.00,1,0921107,0921114,0921114,黃揮能,台北縣汐止鎮新台五路一段七九號二樓,,,,,,,,,,,,,,https://aomp109.judicial.gov.tw/judbp/whd6k/q/7sgD2bedC8Se_qPzRo9gJj5_c9ID0oQbCfEqAI29fxszRnmk1ZdqCzbOANQ=
092法登他000288,1,2,簡福助,229,0921103,0921104,0921105,11冊37頁,1,3,陳長文,財團法人台北歐洲學校,0840414,台北市士林區建業路三一號,"以協助居住在中華民國境內之外僑子女接受正規教育( 包括課外活動教育 )，增進中歐文化交流，進而促進中華民國與歐洲國家實質關係之長期發展，辦理台北歐洲學校及其附設幼稚園、托兒所並謀其發展為設立宗旨。",由香港商太古洋行有限公司捐助。,教育部83.12.27台(83)社字第七００八二號,永久,10000000.00,1,0921104,0921119,0921119,劉靜淳,台北市敦化北路二０一號七樓,,,,,,,,,"原捐助章程第七、十二條條文內容變更。（業經臺灣士林地方法院九十二
年度法字第二四號民事裁定確定。）                                
原組織章程第四、五、九、十三、十七條條文內容變更（業經主管機關台
北市政府九十二年五月十六日府教四字第０九二０一七三四０００號函核
備）",,,,,https://aomp109.judicial.gov.tw/judbp/whd6k/q/I-S2S9AHu2dWxPsYLhyyT6a1tbCUCESUCQWw37Sf5W6QuNHok6h8kgf2WwE=
092法登他000289,1,2,簡福助,490117,0921105,0921113,0921113,1冊55頁,2,11,劉文超,財團法人臺灣省台北縣私立崇義高級中學,0491111,台北縣汐止市大同路三段六十八號,創辦私立崇義高級中學並謀其發展。,捐助,民國四十九年九月一日台灣省政府教育廳四九教二字第二九七七號,永久,54220626.00,1,0921113,0921120,0921120,,,,,,,,,,,,,,,,https://aomp109.judicial.gov.tw/judbp/whd6k/q/0onL__nK_mJGfSo0JobKCyTSjbP4zGuH2UnlMGbAGTjX0e7x0vszqPglmG118ss=
092法登他000290,2,2,簡福助,302,0921106,0921107,0921110,15冊23頁,2,4,賴憶雯,社團法人中華格魯巴佛學會,0851203,台北市中山北路七段一八六號七樓,宏揚佛陀教義，發揚大乘佛教精神。促進顯密佛學研究實修，啟發眾生菩提心，慈悲心及智慧、淨化社會人心。,會費,"內政部八十三年十一月九日台 (八三) 內字第八三八七一０七號",永久,7526618.00,1,0921107,0921125,0921125,廖伶俐,台北市中山北路七段一八六號七樓,,,,,,,,,,,,,,https://aomp109.judicial.gov.tw/judbp/whd6k/q/lDrOgxF8Gp1Q1cM89BlJkxazbu9voxdnXZ5R_ExXFJ2ocgPC6O6o6kteTBQ=
092法登他000291,2,2,簡福助,203,0921106,0921210,0921211,10冊25頁,2,4,陳吉男,社團法人台北市戶外登山協會,0830826,台北市內湖區新湖二路二一九號六樓,本會為提倡全民戶外登山之體育活動，促進市民健康，陶治身心，增加休閒活動空間，提高生活品質，進而使市民享受康強安樂之生活為宗旨。,會員會費及捐助,台北市政府社會局83.6.14北市社一字第二九四五九號函,永久,36400.00,1,0921210,0930825,0930109,,,,,,,,,,,,,,,,https://aomp109.judicial.gov.tw/judbp/whd6k/q/DLpkSKI19ePABXeeATf4hXJv9dbO-kI_CMD6T5_DTyZfoGqryVEJfsyhEDE=
092法登他000293,1,2,簡福助,233,0921107,0921107,0921110,12冊5頁,1,2,黃高香娥,財團法人黃清標慈善基金會,0840612,台北市大同區太原路十一巷四號二樓,以辦理社會福利慈善事業為目的。,捐助,台北市政府社會局84.4.17北市社二字第一七五五四號函,永久,39500000.00,1,0921107,0921120,0921120,李永華,台北市敦化南路二段七七號九樓之四,,,,,,,,,"原捐助章程第十七、十八條條文及其內容變更。（業經本院民事庭九十二
年度法字第二九號民事裁定確定。）",,,,,https://aomp109.judicial.gov.tw/judbp/whd6k/q/Y2Z8I7HEEZtN-IiGPG2bCvGdOsD06hiu9559C6Z88iqlTEGeGT0_3LinQj4=
092法登他000295,1,2,簡福助,239,0921110,0921110,0921111,12冊17頁,2,3,蔡世仁,財團法人基督教天母靈泉堂,0840710,台北市北投區榮華三路四十八號二樓,本基督耶穌愛人捨己之精神，傳揚基督教教義及辦理社會公益慈善事業。,由信徒等捐助,台北市政府民政局84.6.23(84)北市民三字第一六八九四號函,永久,5900000.00,1,0921110,0921114,0921114,謝麗雪,台北市北投區榮華三路四八號二樓,,,,,,,,,,,,,,https://aomp109.judicial.gov.tw/judbp/whd6k/q/m7Hqho_iSk_hpdyJOkTW-IemYBSzMj8NsSPQqRHe0pUcX7H7qqYlTMZPPd8=
092法登他000297,2,2,簡福助,322,0921111,0921111,0921113,16冊23頁,2,23,梁錦光,社團法人國際扶輪社中華民國總社臺灣省台北縣淡水扶輪社,0860623,台北縣淡水鎮中正東路一段二七號三樓,鼓勵並培養以服務理想為可貴事業之基礎。,會費,台北縣政府70.3.19,永久,3183616.00,1,0921111,0921121,0921121,連淑慧,台北市淡水鎮中正東路一段二七號三樓,,,,,,,,,,,,,,https://aomp109.judicial.gov.tw/judbp/whd6k/q/gLQFqZCo0G_Ki-azXFg1GeSBTqEGxRRLdmK0Ua50ccv_3VuyWOkw3tJ5v3I=
092法登他000298,2,2,簡福助,686,0921117,0921118,0921120,34冊55頁,2,2,洪舜河,社團法人中華民國動力飛行傘訓練協會,0920820,台北市內湖區安泰街六十八巷四號四樓,以發展、訓練、推廣各種動力飛行傘運動，舉辦全國、國際等訓練會議及競賽，藉以提昇飛行技藝，促進國際交流為目的。,入會費、常年會費、事業費、會員捐款、委託收益、基金及其孳息、其他收入,內政部八十八年三月十六日台（八八）內社字第八八九二四０七號函,永久,30808.00,1,0921118,0921203,0921203,劉穆哲,台北市內湖區安泰街六八巷四號四樓,,,,,,,,,"章程第三十條第一、二項內容變更。（業經內政部九十二年九月十八日台
內社字第０九二００三四九三一號函核備。）",,,,,https://aomp109.judicial.gov.tw/judbp/whd6k/q/j5Wo50iiPdg41PFMzI7fWEAT7F52Ch5JwLi0jUW89oSMoqz-E6aXji0ixqc=
092法登他000299,1,2,簡福助,610,0921117,0921118,0921120,31冊7頁,2,17,彭明聰,財團法人台灣兒童暨家庭扶助基金會,0910503,台北市信義區忠孝東路五段四八二號四樓,以辦理兒童、青少年、身心障礙者及家庭福利為宗旨。,由美國維吉尼亞州基督教兒童福利會捐助,臺灣省政府社會處民國四十三年十二月十日以台省社字第００六號函,永久,889525398.00,1,0921118,0930825,0921229,黃淑媛,台北市士林區前港街三二號一樓,,,,,,,,,,,,,,https://aomp109.judicial.gov.tw/judbp/whd6k/q/hb7GI3pJfIvhOQWcbvrxYhPpZcwoaU-eLpOvlPF3c3954JH7JTZbU2oNerI=
092法登他000302,1,2,簡福助,540245,0921118,0921120,0921121,2冊13頁,1,13,莊武男,財團法人真理大學,0540909,台北縣淡水鎮真理街三十二號,辦理真理大學，以教學及研究學術，自由探討真理，培養人格，服務社會，促進國際間學術交流，榮神益人為宗旨。,由北部臺灣基督長老教會大會，熱心信徒及社會各界有志奉獻。,教育部54.8.26台(54)高字第一三二四二號函,永久,2774897036.00,1,0921120,0921201,0921201,陳秋雄,台北縣淡水鎮真理街三十二號,,,,,,,,,,,,,,https://aomp109.judicial.gov.tw/judbp/whd6k/q/f0VCDa6zYn1q8nqhB3B9EF0-IXRmqpfjtbbyCLc6Ah7tmnKMvNk104FzVrvx2i4=
092法登他000304,1,2,簡福助,620493,0921120,0921121,0921124,2冊95頁,1,10,張懷遠,財團法人台北市私立文德女子高級中學,0620131,台北市內湖區成功路三段七十號,以創辦私立文德女子高級中學並謀其發展為目的。,捐助,台北市政府教育局60.7.5北市教輝二字第二０八六七號,永久,232454358.00,1,0921121,0921203,0921203,朱美平,台北市內湖區成功三段七十號,,,,,,,,,,,,,,https://aomp109.judicial.gov.tw/judbp/whd6k/q/og-86K_hJFnPzVLB9KeIF3V-JRjXEKKDmYLe8NEBGoiA0l0c1vnahV_6dDmCHlg=
092法登他000305,1,2,簡福助,202,0921120,0921121,0921125,10冊23頁,1,3,林碧玉,財團法人邢榮階紀念父母慈善事業基金會,0830812,台北市大同區迪化街一段十四巷二五號,以舉辦或捐助慈善事業為目的。,由邢榮階先生捐助,內政部83.7.30台(83)內社字第八三一七三六六號函,永久,257408000.00,1,0921121,0921205,0921205,吳淑惠,台北市大同區迪化街一段十四巷二五號,,,,,,,,,"捐助章程第二十一條條文內容變更：                                
（業經本院民事庭九十二年度法字第三九號民事裁定確定）",,,,,https://aomp109.judicial.gov.tw/judbp/whd6k/q/d-8Jvj0eKYHdbmqBqOX5NwYjFlVydZYMApgsxLb6hl6p6_uTQKZAxRnyHvo=
092法登他000306,1,2,簡福助,285,0921125,0921126,0921127,14冊29頁,2,3,武沛曜,財團法人愛心第二春文教基金會,0850711,台北市士林區中社路一段四三巷六號四樓,以興辦獎助教育文化及社會和諧等有關之文教性活動及研究，達成安和樂利的社會。,由立法委員王建煊服務處捐助，並接受對外認捐。,教育部八十五年六月四日台(85)社(四)字第八五五０九三０八號,永久,20000000.00,1,0921126,0921205,0921205,劉瑞霞,台北市士林區中社路一段四三巷六號四樓,,,,,,,,,"捐助章程第三、九、十、十六、二十二條條文內容變更：              
（業經本院民事庭九十二年度法字第四五號民事裁定確定）",,,,,https://aomp109.judicial.gov.tw/judbp/whd6k/q/bPT3pwhcCrCj55mTf2C1E8j9POV94hW1DurvBABIFwshDx4qHqjA9L3uVnw=
092法登他000307,1,2,簡福助,548,0921127,0921128,0921201,27冊52頁,1,5,黃國藏,財團法人台灣經濟發展研究院,0701223,台北縣汐止市大同路三段一九六號二樓,為響應推行國家加速經濟發展政策，以推行研究經濟問題，培養經濟發展研究人才暨創立「財團法人台灣經濟發展研究院」為目的。,由創辦人先行捐助，嗣後由各董事及社會熱心人士自由樂捐。,經濟部　中華民國七十年十一月十日　經（七十）技字第四七一九七號函,永久,13580000.00,1,0921128,0921209,0921209,王曉婷,台北市南京東路五段二九六號十二樓,,,,,,,,,,,,,,https://aomp109.judicial.gov.tw/judbp/whd6k/q/pk9zr4D-i6j89UnbD2-rDsrjwos5pzcuzHW3UKySNmA_BSLDg1aslZ8qkGk=
092法登他000308,1,2,簡福助,733,0921127,0930415,0930415,37冊16頁,,0,周昌德,財團法人風濕病基金會,0890801,台北市北投區石牌路二段二０一號（台北榮總思源樓四樓過敏免疫風,以促進風濕病的衛生教育及風濕病相關之學術研究為宗旨。,由周昌德、何清吉、友瑞股份有限公司等捐助,行政院衛生署中華民國八十九年六月三十日衛署醫字第八九０三二三八五號函,永久,10000000.00,1,0930415,0930825,0930427,陳欣怡,台北市北投區石牌路二段二０一號（台北榮總思源樓四樓過敏免疫風,,,,,,,,,,,,,,https://aomp109.judicial.gov.tw/judbp/whd6k/q/oT9x8ORy8kMVSAGX_99E59_tPpl3LX3nS_VE5EfG0UoANh1CpxTsBUUI8wI=
092法登他000309,1,2,簡福助,518,0921201,0921202,0921202,26冊11頁,2,2,林莉君,財團法人新約教會石牌教會,0891017,台北市北投區石牌路一段一六六巷十一號五樓,傳揚耶穌基督全備福音，引導聖徒及社會大眾遵守使徒教訓，樹立榮神益人之典範，以造福社會大眾。,捐助,台北市民政局八十九年十月二日北市民三字第八九二二九六三九００號函,永久,4500000.00,1,0921202,0921209,0921209,,,,,,,,,,,,,,,,https://aomp109.judicial.gov.tw/judbp/whd6k/q/iNFSynjcF5VI5OrPNvmfUQz-7gpHra7FVCUc6IwRJ1Z02iC889ycr3tScPE=
092法登他000310,2,2,簡福助,336,0921201,0921202,0921202,17冊11頁,2,4,武九靈,社團法人台北市佛教正覺同修會,0860917,台北市大同區承德路三段二七七號九樓,以結合佛教三寶弟子，無相念佛共修，淨化身心，秉持釋迦牟尼佛正法眼，普攝眾生，建立良善之組織與制度，以自利利他之菩薩道，積極廣行福慧資糧，落實正覺的教義，弘揚佛法廣利有緣眾生，使正法久住，以期到達圓滿的人間淨土為宗旨。,會費、捐款,台北市政府社會局⒎⒉北市社一字第8623605400號,永久,37412790.00,1,0921202,0921211,0921211,李訓仁,台北市大同區承德路三段二七七號九樓,,,,,,,,,"組織章程第六、七、九、十條條文內容變更：                        
（業經主管機關台北市政府社會局中華民國九十二年七月九日北市社一字
第０九二三七一七００００號函核備）",,,,,https://aomp109.judicial.gov.tw/judbp/whd6k/q/Rs_ZeXkYjwgSVAZsRwUC-UFuKJ5FBQYlRYtzvyMTefatUJblqDcJLEiboHw=
092法登他000311,1,2,簡福助,670769,0921203,0921203,0921204,3冊79頁,2,8,詹添福,財團法人詹氏社會福利獎助學基金會,0820727,台北市承德路三段六十七號,辦理獎助在學、家境清寒、孤殘之學生及貧病醫療、慈幼、養老等宗旨。,捐助,台北市政府教育局67.5.25(67)北市教四字第一七七五二號函,永久,11271656.00,1,0921203,0921211,0921211,詹錫富,台北市承德路三段六十七號,,,,,,,,,,,,,,https://aomp109.judicial.gov.tw/judbp/whd6k/q/JVUgICOzy3ZpS_0J2NkLa3_cLWVRhsrO3oqaJTNJIjhdvSmaJojs4NN2c0SLOrM=
092法登他000312,1,2,簡福助,490113,0921203,0921203,0921204,1冊51頁,2,5,張曼琳,財團法人台灣省台北縣天主教聖心會,0490903,台北縣八里鄉龍源村龍米路一段二六三號,創辦私立聖心女子高級中學、私立聖心國民小學及宗教研究中心。,捐助,四十九年五月二十五日台北縣政府民政局(49)北縣民一字第五號,永久,314486102.00,1,0921203,0921217,0921217,林梅玉,台北縣八里鄉龍米路一段二六三號,,,,,,,,,,,,,,https://aomp109.judicial.gov.tw/judbp/whd6k/q/_ydIRkKYHiJ5JKP4kaiB6XI29GQaaFXzEmFLYJq_gWNMWKEahpp0i0TYSArr6tY=
092法登他000313,1,2,簡福助,301,0921203,0921203,0921204,15冊21頁,1,3,蔡葉偉,財團法人國花葉金枝紀念文教基金會,0851203,台北縣淡水鎮新生街五十一巷三十一弄一之二號等,發揚推廣關懷兒童教育藝術文化等活動為宗旨。,捐助,台北縣政府八十五年十一月九日八五北府教三字第三九七三四七號函。,永久,2004600.00,1,0921203,0921211,0921211,李君亮,台北縣淡水鎮新生街五一巷三一弄一號,,,,,,,,,,,,,,https://aomp109.judicial.gov.tw/judbp/whd6k/q/mmzlqFXa7g6iXfHd51Ds0gj17Kl3tROZb5zxLz5m5YSUAYQZfv4aBAydVFQ=
092法登他000314,1,2,簡福助,670758,0921204,0921205,0921208,3冊75頁,1,5,張聖嚴,財團法人台北市中華佛教文化館,0831124,台北市北投區光明路二七六號,弘揚大乘佛教文化圖書室，舉辦佛教教育文化事業，並設置大專學生佛教研究獎學金，開辦老人靜修院及辦理其他公益慈善事業。,捐助,台北市政府民政局67.2.23北市民三字第一三六九號函,永久,91630401.00,1,0921205,0921215,0921215,賴沛琳,台北市北投區承德路七段三八八號二樓,,,,,,,,,"原捐助暨組織章程第七條條文內容及第十九、二十、二十一條條次變更；
新增加第十八條基金管理條文：                                    
（業經本院民事庭九十二年度法字第三七號民事裁定確定）",,,,,https://aomp109.judicial.gov.tw/judbp/whd6k/q/DLF60lcv1QksOFcF7qne0iG_S837IqsGCK_4E8wUltmMOc970ktDUTSMxrsOa4U=
092法登他000315,1,2,簡福助,708,0921204,0921205,0921208,36冊1頁,,0,堤真壽雄,財團法人中國佛教阿含宗基金會,0841228,台北縣淡水鎮中正東路二段二七之六號一樓,係本佛教阿含宗之精神，傳揚佛教教義及辦理社會公益慈善事業為宗旨。,由日本阿含宗代表堤真壽雄先生捐助,內政部八十四年九月十四日　台（八四）內民字第八四０六一四九號函,永久,30000000.00,1,0921205,0930825,0921229,于靜雯,台北縣淡水鎮中正東路二段二七之六號一樓,,,,,,,,,,,,,,https://aomp109.judicial.gov.tw/judbp/whd6k/q/ceLQ-XQbgwmHfsUlWIqnzujzMfqRWAnyUAb_vQURpLdtyA1zQDAuBZniMXM=
092法登他000316,1,2,簡福助,400,0921205,0921209,0921210,20冊19頁,2,3,石滋宜,財團法人全球華人競爭力基金會,0880114,台北縣汐止市新台五路一段七七號九樓之七,以提倡現代化管理及運用資訊網路科技，協助全球華人強化企業競爭力。,捐助,經濟部⒈⒎經(八八)商字第87229201號,永久,30000000.00,1,0921209,0921217,0921217,潘熙瑩,台北縣汐止市新台五路一段七七號九樓之七,,,,,,,,,,,,,,https://aomp109.judicial.gov.tw/judbp/whd6k/q/vQp-5bF0po5pN5fPdUYA8IrI0c9oyb_wWDLUQYnAgw9szXwQiCneuJQjASU=
092法登他000317,1,2,簡福助,227,0921205,0930102,0930106,11冊33頁,1,3,陳信雄,財團法人淡水文化基金會,0840328,台北縣淡水鎮鼻頭街二十二號,促進淡水藝文發展，建設淡水文化城鎮。,捐助,台北縣政府84.3.13八四北府教三字第八四八九一號,永久,7000000.00,1,0930102,0930825,0930130,李慧蘋,台北縣淡水鎮鼻頭街二十二號,,,,,,,,,"捐助章程第六、八、九、十六條條文內容變更：                      
（業經本院民事庭九十二年度法字第四六號民事裁定確定）",,,,,https://aomp109.judicial.gov.tw/judbp/whd6k/q/JNUDyVTAyyJE5nTkwWqtipdEfij815WFDCoanqLENg3D7ITtet0tmTc6Ui4=
092法登他000318,1,2,簡福助,440034,0921208,0921209,0921210,1冊21頁,2,6,鍾啟悟,財團法人台北市李春生紀念基督長老教會,0440518,台北市大同區貴德街四十四號,為基督教信徒發揚基督博愛精神啟揮互助道德為宗旨。,捐助,台北市政府民政局44.5.4.北市社字第一四００七號,永久,8443266.00,1,0921209,0921217,0921217,鍾世錚,台北市農安街一五三號四樓之三,,,,,,,,,,,,,,https://aomp109.judicial.gov.tw/judbp/whd6k/q/YnUXj16zIKSbf8lGbH0EwQlEXiD3mpZnY0zkzsqlV5S0NgkF8rQelzD9TerykMI=
