登記案號,類別,案由,主任,登記號數,收件日期,登記日期,公告日期,登記簿,任期判定,屆期判定,法人代表,法人名稱,設立登記日期,主事務所,目的,捐助方法,許可機關日期,存立時期,財產總額,結案原因,結案日期,歸檔日期,發證日期,代理人,代理人住址,郵遞區號,第二個代理人,第二個代理人住址,郵遞區號,送達代收人姓名,送達代收人住址,郵遞區號,清算人,變更原因,註銷日期,撤銷日期,撤(註)銷機關文號,撤(註)銷原因
083法登000001,2,2,林文鼎,140,0830111,0830111,0830112,5冊53頁,2,2,吳樹桑,社團法人台北縣道教會,0810903,台北縣板橋市漢生東路三三九號四樓,"以闡揚教義、研習道學、加強道教進修活動等服務社會、弘教護國、        促進世界大同為宗旨。",會費收入及捐助購置,八十一年七月十日台北縣政府北府社一換字第二三二五四二號立案證書,永久,8353963.00,1,0830111,,,,,,,,,,,,,,,,,
083法登000002,2,1,林文鼎,141,0830118,0830118,0830119,5冊55頁,,0,黃邱好,社團法人台北縣三重市一竹慈善會,0830118,台北縣三重市慈愛街六十八號,"以﹁人饑己饑，人溺己溺﹂之精神，集腋成裘，及時救援社會上孤苦        急難者，讓溫暖與愛心充滿人間為宗旨。",入會費、會費及其他收入。,台北縣政府八十一年十一月七日北府社一字第三八五００五號函,永久,861122.00,1,0830118,,,,,,,,,,,,,,,,,
083法登000003,1,2,林文鼎,142,0830121,0830121,0830122,5冊57頁,1,0,吳敬芳,財團法人台灣省台北縣竹林山觀音寺,0480930,台北縣林口鄉竹林路三二五號,"以宣揚佛教道德，敦睦信徒友誼，增進福利，樹立團結互助精神，並        興辦慈善育英公益事業為宗旨。",由信徒捐助,四十八年九月十六日台北縣政府北府德民一字第一三三三０號,永久,1774358802.00,1,0830121,,,,,,,,,,,,,,,,,
083法登000004,1,1,林文鼎,143,0830126,0830126,0830127,5冊59頁,,0,尤進興,財團法人樹春文教基金會,0830126,台北縣板橋市公園街三十四巷十二號三樓,以協助推廣教育活動，提倡社會優良風氣為宗旨。,由尤進興等六人捐助,八十二年十二月二十七日台北縣政府北府教三字第四七五０八六號,永久,2600000.00,1,0830126,,,,,,,,,,,,,,,,,
083法登000005,1,2,林文鼎,23,0830222,0830222,0830223,1冊45頁,2,4,鄧信哲,財團法人台灣省台北縣板橋基督榮光教會,0751009,台北縣板橋市成功路三十七號,以傳揚基督引人歸主，舉辦慈善育英公益事業為宗旨。,由教友捐助,七十五年六月九日台北縣政府北府民二字第一八０四四０號函,永久,2679700.00,1,0830222,,,,,,,,,,,,,董事印鑑。,,,,
083法登000007,1,1,林文鼎,144,0830312,0830312,0830314,6冊1頁,,0,"許  伯",財團法人文同文教基金會,0830312,台北縣板橋市光正街二十巷一弄四號之三,獎助幼教研究，落實婦幼權益，普及書香文化，充實人文精神為宗旨,由許伯等十二人捐助,八十三年二月二十三日台北縣政府北府教三字第０六二二七一號函,永久,2800000.00,1,0830312,,,,,,,,,,,,,,,,,
083法登000008,1,2,林文鼎,17,0830319,0830319,0830321,1冊33頁,2,2,孟慶霖,財團法人台灣省台北縣基督教莒光教會,0740807,台北縣中和市德光路十五巷二十二號一樓,"以耶穌博愛救世之精神，在台北縣內傳揚基督教義，辦理社會公益慈        善教育事業為宗旨。",由教友捐助,七十四年五月十六日台北縣政府北府民二字第一四二一一九號,永久,4403100.00,1,0830319,,,,,,,,,,,,,,,,,
083法登000009,1,1,林文鼎,145,0830324,0830324,0830325,6冊3頁,,0,林延男,財團法人省立泰山高級中學文教基金會,0830324,台北縣泰山鄉明志路一段四二二號,"以協助省立泰山高級中學改善環境，發展校務，獎勵教師研究進修，        促進學生敦品勵學為宗旨。",由熱心教育人士捐助,八十三年三月十七日台北縣政府北府教三字第０八九０三三號函,永久,3200000.00,1,0830324,,,,,,,,,,,,,,,,,
083法登000010,1,1,林文鼎,146,0830328,0830328,0830330,6冊5頁,,0,童裕民,財團法人台灣省台北縣基督教浮洲浸信會,0830328,台北縣板橋市大觀路二段一五三巷四十五號,"以接受耶穌基督為救主，聖經教訓為準則之信仰，本著耶穌救世之精        神，傳揚福音，建立教會，辦理社會公益或慈善事業為宗旨。",由財團法人美南浸信會台北市事務所捐助,八十三年三月九日台北縣政府北府民二字第０八一二六四號函,永久,19950000.00,1,0830328,,,,,,,,,,,,,,,,,
083法登000011,1,2,林文鼎,102,0830401,0830401,0830402,4冊37頁,1,0,連勝彥,財團法人清傳商職文教基金會,0820413,台北縣三重市五谷王北街一四一巷一號,"以協助清傳商職學校改善環境，發展校務，獎勵教師研究進修，促進        學生敦品勵學為宗旨。",由連清傳等人捐助,台北縣政府八十二年四月八日北府教三字第一一七二八五號函,永久,4200000.00,1,0830401,,,,,,,,,,,,,,,,,
083法登000012,1,2,林文鼎,38,0830412,0830412,0830413,2冊27頁,2,2,周志宇,財團法人台灣省台北縣周可安大宗祠,0780222,台北縣板橋市民權路二０二巷十五弄四之二號,以宏揚祖德，興辦社會公益，慈善事業為目的。,由周金鎮、周有生、周志宇等捐助。,七十八年二月十一日台北縣政府北府民二字第三九九八七號函,永久,22323346.00,1,0830412,,,,,,,,,,,,,董事印鑑。,,,,
083法登000013,1,1,林文鼎,147,0830413,0830413,0830414,6冊7頁,,0,邱幸香,財團法人謝聰敏文教基金會,0830413,台北縣板橋市大仁街一一０巷十二弄四號五樓,"以獎助學術文化教育事業，培養國內各項優秀人才，提高社會法治風        氣，促進全縣生活品質為宗旨。",由謝聰敏捐助,台北縣政府八十三年四月一日北府教三字第一一０八一二號函,永久,2000000.00,1,0830413,,,,,,,,,,,,,,,,,
083法登000014,1,2,林文鼎,44,0830426,0830426,0820427,2冊39頁,1,1,李育軒,財團法人國防管理學院校友文教基金會,0790113,台北縣中和市民安街一五０號,"以倡導管理科學之學術研究與發展，帶動學術研究之風氣，增進教育        之效果為目的。",由社會熱心人士捐助,教育部七十八年十二月二十八日台七八社字第六四一九七號函,永久,4350000.00,1,0830426,,,,,,,,,,,,,,,,,
083法登000015,1,1,林文鼎,148,0830427,0830427,0830428,6冊9頁,,0,黃敏雄,財團法人快樂陽光文教基金會,0830427,台北縣永和市智光街一一六號二樓,以推廣社會教育，發揚固有文化，推展當代人本教育為宗旨。,由黃敏雄等捐助,八十三年四月二十一日台北縣政府北府教三字第一三三八一七號函,永久,2000000.00,1,0830427,,,,,,,,,,,,,,,,,
083法登000017,1,2,林文鼎,95,0830504,0830504,0830505,4冊23頁,2,2,陳幸浩,財團法人台灣省台北縣台北基督徒永和禮拜堂,0600306,台北縣永和市中山路一段二一五號五樓,"以使信徒獲得靈性長進及廣傳耶穌基督救世福音，並推動社會福利及        公益事業為目的。",由教友捐助,台北縣政府六十年一月二十五日北府民一字第一三二０三號函,永久,15060238.00,1,0830504,,,,,,,,,,,,,,,,,
083法登000018,1,2,林文鼎,98,0830512,0830512,0830513,4冊29頁,1,0,林義重,財團法人台北縣立三重國民中學教育發展基金會,0820211,台北縣三重市集美街二一二號,以獎助品學兼優或家境清寒學生及協助學校教育發展為目的。,由林義重等捐助,台北縣政府八十一年十二月八日北府教三字第四二一七二七號函,永久,6000000.00,1,0830512,,,,,,,,,,,,,,,,,
083法登000019,2,1,林文鼎,149,0830516,0830516,0830517,6冊11頁,,0,陳仁德,社團法人國際獅子會中華民國總會台灣省台北縣頭前獅子會,0830516,台北縣新莊市化成路三二五巷十六號,"以發揚人類博愛互助精神，增進國際間友好關係，尊重自由啟發智慧        ，提倡社會福利，促進國家安全為目的。",會員入會費、常年會費及其他捐款。,台北縣政府七十九年十二月二十六日北府社一字第三七一００二號函,永久,767341.00,1,0830516,,,,,,,,,,,,,,,,,
083法登000020,1,2,林文鼎,87,0830520,0830520,0830521,4冊7頁,2,2,趙愷政,財團法人私立華夏工業專科學校,0541116,台北縣中和市華新街一一一號,為遵照國家教育政策暨現行教育法令之規定辦理專科學校，並謀其健全發展。,由創辦人及董事捐助,五十五年一月十九日教育部55高字第０八一九號令,永久,473823266.00,1,0830520,,,,,,,,,,,,,,,,,
083法登000021,1,2,林文鼎,89,0830520,0830520,0830521,4冊11頁,1,0,梁秉權,財團法人私立致理商業專科學校,0540922,台北縣板橋市文化路一段三一三號,為供應私立致理商業專科學校所需一切設備及經費,由創辦人及董事會捐助,五十四年九月二日教育部54高字第一三六二五號令,永久,369669162.00,1,0830520,,,,,,,,,,,,,,,,,
083法登000022,1,2,林文鼎,96,0830524,0830524,0830525,4冊25頁,1,0,林慶福,財團法人台北縣樹林健民協會,0390927,台北縣樹林鎮育英街一三五巷五十二號,以舉辦輔助地方之教育文化、協助保健衛生、鼓勵增產為目的。,由[樹林信用、利用、購買、販賣、組合]捐助,台北縣政府三十九年五月二十五日辰謙北府三字第一三七號,永久,324199343.00,1,0830524,,,,,,,,,,,,,,,,,
083法登000023,1,2,林文鼎,150,0830525,0830525,0830526,6冊13頁,2,2,林謝罕見,財團法人私立四海工商專科學校,0600827,台北縣土城市青雲路三八０巷一號,"為遵照國家教育政策暨現行教育法令之規定，辦理工商專科學校，並        謀其健全發展。",由李景德等共同捐助,六十年四月二日教育部台六０專字第七五五二號函,永久,411739289.00,1,0830525,,,,,,,,,,,,,,,,,
083法登000024,1,2,林文鼎,151,0830528,0830528,0830530,6冊15頁,2,2,高王發,財團法人台灣省台北縣祭祀公業高時周,0620515,台北縣中和市景平路四十二之一號,以宣揚祖德，敦睦宗誼，團結互助，鞏固公業並圖社會公益為宗旨。,由高火鍊等十八人捐助,六十二年五月十日台北縣政府北府民一字第五六二九０號函,永久,908453.40,1,0830528,,,,,,,,,,,,,,,,,
083法登000025,1,2,林文鼎,32,0830528,0830528,0830530,2冊15頁,2,3,宋孝興,財團法人台灣省台北縣鏡江宋氏宗祠,0761229,台北縣蘆洲鄉和平路十九號五樓,以所有財產及孳息專作公益事業為目的,由宋玉水等七人捐助,台北縣政府七十六年十二月二日北府民二字第三六八四一六號函,永久,1873927.40,1,0830528,,,,,,,,,,,,,董監事印鑑。,,,,
083法登000026,1,2,林文鼎,49,0830603,0830603,0830604,2冊49頁,2,2,金培華,財團法人台灣省台北縣台北基督徒雙和禮拜堂,0790622,台北縣永和市中山路一段二一五號五樓,"以使教徒獲得靈性長進及廣傳耶穌基督救世福音，並推動社會福利及        公益事業為宗旨。",由教友捐助,台北縣政府七十九年六月一日北府民二字第一五三八五八號函,永久,6914928.00,1,0830603,,,,,,,,,,,,,董事印鑑。,,,,
083法登000027,1,2,林文鼎,152,0830606,0830606,0830607,6冊17頁,1,0,方朱憲,財團法人兒童藝術文教基金會,0781115,台北縣板橋市民享街六十五巷五之七號一樓,以發展兒童藝術教育為宗旨,由蘇振明等二十四人捐助,教育部七十八年十一月四日台七八社字第五四三四八號函,永久,1020000.00,1,0830606,,,,,,,,,,,,,,,,,
083法登000028,1,2,林文鼎,55,0830607,0830607,0830608,3冊3頁,1,1,張文華,財團法人安康長青文教基金會,0791006,台北縣永和市自由街五十五號七樓,以提昇社會生活品質，促進良好社會風氣為宗旨。,由薛頌留等捐助,台北縣政府七十九年八月二十八日北府教三字第二四四三五五號函,永久,2000000.00,1,0830607,,,,,,,,,,,,,,,,,
083法登000030,1,2,林文鼎,153,0830610,0830610,0830611,6冊19頁,2,2,藍金安,財團法人台灣省台北縣永和市中華基督教浸信會中和堂,0611109,台北縣永和市永和路一段一五五號,"以遵照聖經使命，傳揚福音，服務社會，辦理教育、公益、慈善等事        業為宗旨。",由會友捐助,台北縣政府六十一年十一月三日北縣民一字第四二號,永久,10962287.00,1,0830610,,0830616,,,,,,,,,,,,,,,
083法登000031,1,1,林文鼎,154,0830620,0830620,0830621,6冊21頁,,0,張國龍,財團法人新台灣發展文教基金會,0830620,台北縣板橋市文化路一段一四五號八樓之一,"以新台灣之未來發展，辦理綜合規劃之研究、教育及出版，促進社會        大眾對台灣未來發展之關心、了解與共識為宗旨。","由尤  清捐助",台北縣政府八十三年六月十五日北府教三字第二０六一０二號函,永久,2000000.00,1,0830620,,,,,,,,,,,,,,,,,
083法登000032,2,1,林文鼎,155,0830621,0830621,0830622,6冊23頁,,0,莊寶鑫,社團法人國際獅子會中華民國總會台灣省台北縣福營獅子會,0830621,台北縣新莊市富國路一二四號六樓,以尊重自由啟發智慧，發揚博愛互助精神，促進國家安全，增進國民外交，發展公共關係，提倡社會福利為宗旨。,入會費、常年會費及其他捐助。,八十一年五月六日台北縣政府北府社一字第一四二三三三號函,永久,345807.00,1,0830621,,,,,,,,,,,,,,,,,
083法登000033,2,1,林文鼎,156,0830622,0830622,0830623,6冊25頁,,0,陳進金,社團法人國際獅子會中華民國總會台灣省台北縣集賢獅子會,0830622,台北縣蘆洲鄉永安南路二段一五四號三樓,以發揚人類博愛互助精神，增進國際間友好關係，尊重自由啟發智慧，提倡社會福利，促進國家安全為宗旨。,會員入會費、常年會費及其他捐助。,台北縣政府八十三年四月二十一日北府社一字第一三五二七三號函,永久,100000.00,1,0830622,,,,,,,,,,,,,,,,,
083法登000034,1,1,林文鼎,157,0830623,0830623,0830624,6冊27頁,,0,朱義旭,財團法人開拓文教基金會,0830623,台北縣板橋市海山路三十七號,以宣揚民主教育理念，推展鄉土文化為宗旨。,由劉世芳捐助,台北縣政府八十三年六月六日北府教三字第一九四九０二號函,永久,2000000.00,1,0830623,,,,,,,,,,,,,,,,,
083法登000035,1,1,林文鼎,158,0830624,0830624,0830625,6冊29頁,,0,林安誠,財團法人樂林文教基金會,0830624,台北縣永和市中興街一三三巷十六號六樓,以提倡音樂及藝術活動，發揮社會教育，宏揚文化為宗旨。,由林安誠及蘇美玲捐助,台北縣政府八十三年六月十七日北府教三字第二０八八七五號函,永久,2000000.00,1,0830624,,,,,,,,,,,,,,,,,
083法登000036,1,1,林文鼎,159,0830628,0830628,0830629,6冊31頁,,0,謝志超,財團法人台灣省台北縣林口基督徒聚會處,0830628,台北縣林口鄉中正路六十巷十一號,以宣揚耶穌基督福音，培養信徒靈性，並舉辦慈善公益事業為宗旨。,由財團法人台北市基督徒聚會處捐助,台北縣政府八十三年五月十八日北府民二字第一五八０七五號函,永久,15000000.00,1,0830628,,,,,,,,,,,,,,,,,
083法登000037,1,2,林文鼎,116,0830628,0830628,0830629,5冊5頁,1,0,王永慶,財團法人私立明志工業專科學校。,0550601,台北縣泰山鄉貴子村工專路八十四號。,創辦私立明志工業專科學校並謀其發展。,台灣塑膠股份有限公司捐助。,教育部五十三年七月六日台53高字第八八五二號令。,永久。,693946095.00,1,0830628,,,,,,,,,,,,,,,,,
083法登000038,1,1,林文鼎,160,0830701,0830701,0830702,6冊33頁,,0,林長勳,財團法人慈暉文教基金會,0830701,台北縣永和市福和路九十二號地下樓,以改善國民生活環境與提昇國人生活品質為宗旨,由林長勳捐助,教育部八十三年六月二十二日台83社字第０三二三０七號函,永久,10000000.00,1,0830701,,,,,,,,,,,,,,,,,
083法登000039,1,2,林文鼎,127,0830701,0830701,0830702,5冊27頁,1,0,游炳昆,財團法人台灣省台北縣台灣基督長老教會樹林教會,0660712,台北縣樹林鎮中山路一段二號,以促進信徒健全信仰，宣揚基督福音，並舉辦慈善及教育事業為宗旨,由游炳昆等捐助,台北縣政府六十五年十二月十七日北府民一字第二九二六０二號函,永久,45425213.00,1,0830701,,,,,,,,,,,,,"捐助暨組織章程第三條及第八條經本院民事庭於八十三年三月四日以八十
  三年法字第一號民事裁定准予修正。",,,,
083法登000040,1,2,林文鼎,126,0830705,0830705,0830706,5冊25頁,1,2,徐有庠,財團法人私立亞東工業專科學校,0581007,台北縣板橋市四川路二段五十八號,"為遵照國家教育政策暨現行法令之規定，配合國家經濟發展，培養工        業專技人才，並謀其健全發展。",由遠東紡織股份有限公司及亞洲水泥股份有限公司捐助,教育部五十八年八月十二日(58)專字第一六四八七號令,永久,980311879.00,1,0830705,,,,,,,,,,,,,,,,,
083法登000041,1,2,林文鼎,30,0830725,0830725,0830726,2冊11頁,2,3,張培生,財團法人台灣省台北縣中華基督教永和浸信會,0761203,台北縣永和市中正路二七七號地下樓,以傳佈基督福音，發揚耶穌真理，辦理慈善公益及充實會友心靈生活為宗旨。,由會友捐助,台北縣政府七十六年十一月九日北府民二字第三五二五五四號函,永久,5242297.00,1,0830725,,,,,,,,,,,,,董事印鑑。,,,,
083法登000042,1,2,林文鼎,161,0830727,0830727,0830728,6冊35頁,2,11,郭若石,財團法人台灣省台北縣私立恒毅高級中學,0500130,台北縣新莊市中正路一０八號,為遵照國家教育政策暨現行教育法令之規定，創辦私立恒毅高級中學，並謀其健全發展。,由天主教主徒會捐助,台灣省政府六十八年七月二十四日(68)教二字第四九０八三號函,永久,160421464.00,1,0830727,,,,,,,,,,,,,,,,,
083法登000043,2,1,林文鼎,162,0830803,0830803,0830804,6冊37頁,,0,彭永寬,社團法人中華道教褒忠義民慈善會,0830803,台北縣板橋市明德街二巷八號,以發揚道教褒忠義民爺忠義精神，端正社會風氣，推展社會服務為宗旨。,會員入會費、常年會費及其他收入。,內政部八十三年五月十三日台(83)內社字第八三一一一三六號函,永久,20000.00,1,0830803,,,,,,,,,,,,,,,,,
083法登000044,1,1,林文鼎,163,0830803,0830803,0830804,6冊39頁,,0,謝敬忠,財團法人功學社學術獎助基金會,0830803,台北市博愛路一一五號,以獎學暨獎助學術研究，提高音樂水準，宏揚中華文化為宗旨。,由功學社股份有限公司捐助,教育部六十二年四月三日台(62)高字第八二三七號函,永久,10559746.00,1,0830803,,,,,,,,,,,,,,,,,
083法登000045,1,2,林文鼎,59,0830804,0830804,0830805,3冊11頁,2,2,廖本蒼,財團法人台北縣明聖愛心慈善事業基金會,0800418,台北縣永和市永和路一段一五一巷三號四樓,以舉辦社會愛心慈善事業為宗旨,由連田井等人捐助,台北縣政府八十年三月二十八日北府社三字第０七七一八六號函,永久,3150000.00,1,0830804,,,,,,,,,,,,,,,,,
083法登000046,1,1,林文鼎,164,0830804,0830804,0830805,6冊41頁,,0,林金田,財團法人三峽文教公益基金會,0830804,台北縣三峽鎮文化路一五八號,以提昇教育品質，從事文教及公益事業為宗旨。,由林金田等人捐助,台北縣政府八十三年七月二十九日北府教三字第二六四八二三號函,永久,6000000.00,1,0830804,,,,,,,,,,,,,,,,,
083法登000047,2,2,林文鼎,165,0830818,0830818,0830819,6冊43頁,2,2,張鄔如鳳,社團法人台北縣智障福利協進會,0800729,台北縣中和市秀朗路三段一二八巷十號,以結合台北縣智障者家屬及關心智障者人士，爭取智障者合法權益，促進智障者福利為宗旨。,會員入會費、常年會費、永久會費及其他收入。,台北縣政府八十年六月二十一日北府社一字第一六一八四五號函,永久,122000.00,1,0830818,,,,,,,,,,,,,,,,,
083法登000048,1,1,林文鼎,166,0830906,0830906,0830907,6冊45頁,,0,張慧生,財團法人群生文教基金會,0830906,台北縣永和市秀朗路一段二０一號,以協助學校改善環境，發展校務，獎勵教師研究進修，促進學生敦品勵學為宗旨。,由復興高級商工職業學校捐助,台北縣政府八十三年八月二十日北府教三字第二八八五００號函,永久,10000000.00,1,0830906,,,,,,,,,,,,,,,,,
083法登000049,2,1,林文鼎,167,0830909,0830909,0830910,6冊47頁,,0,董裕榮,社團法人台北縣自閉症服務協進會,0830909,台北縣三重市中正北路五０八巷二十一號,以結合台北縣關心自閉症人士，爭取自閉症者合法權益，促進自閉症福利為宗旨。,會員入會費、常年會費及其他收入。,台北縣政府八十三年九月五日北府社一字第三０五五二四號函,永久,919788.00,1,0830909,,,,,,,,,,,,,,,,,
083法登000050,1,2,林文鼎,135,0830912,0830912,0830913,5冊43頁,1,2,林水福,財團法人台灣省台北縣禮智堂,0560323,台北縣中和市石門路五十二號,以宣揚宗教道德，研習各教經典，勸化引善為宗旨。,由林金欽等捐助,台北縣政府五十六年二月二十八日北府民一字第一五四０五號通知,永久,25204034.00,1,0830912,,,,,,,,,,,,,,,,,
083法登000051,1,2,林文鼎,139,0830923,0830923,0830924,5冊51頁,2,9,林崇智,財團法人台灣省台北縣私立南山高級中學,0491204,台北縣中和市廣福路四十一號,以創辦台灣省台北縣私立南山高級中學並謀發展中等教育為目的,由林熊祥等人捐助,台北縣政府四十六年九月五日北府教德一字第四一六四號,永久,125707747.00,1,0830923,,,,,,,,,,,,,,,,,
083法登000052,1,2,林文鼎,168,0830930,0830930,0831001,6冊49頁,2,6,戴健新,財團法人台灣省台北縣中和教會聚會所,0590224,台北縣中和市興南路一段八十五巷二十三號,以成立聚會傳揚基督引人歸主及辦理公益慈善事業為宗旨,由信眾捐助,台北縣政府五十九年二月十二日北府民一字第一七七四０號,永久,5125801.00,1,0830930,,,,,,,,,,,,,,,,,
083法登000053,1,2,林文鼎,169,0830930,0830930,0831001,6冊51頁,2,2,金惠媖,財團法人台灣省台北縣天主教本篤會,0570418,台北縣泰山鄉明志路三段九十六巷一號,以協助中國當地主教服務人群，宣揚天主教教義，並供應聖本篤會所需之一切設備及經費為目的。,由天主教本篤會總會捐助,台北縣政府五十七年三月十八日,永久,226448000.00,1,0830930,,,,,,,,,,,,,,,,,
083法登000054,1,2,林文鼎,84,0831011,0831011,0831012,4冊1頁,1,0,林健治,財團法人中華民國石油環保基金會,0811106,台北縣新莊市五權一路一之五號,以環境保護，維護生態平衡及提升環境品質為目的。,"由中鋼碳素化學股份有限公司、林健治、林志卿、莊  達、陳敏廷、蔡銘賢、洪哲文、郭文忠捐助。",行政院環境保護署八十一年十月二十七日環暑綜字第四四一二八號,永久,5000000.00,1,0831010,,,,,,,,,,,,,,,,,
083法登000055,2,1,林文鼎,170,0831017,0831017,0831018,6冊53頁,,0,詹明祥,社團法人台北縣八二三戰役戰友協會,0831017,台北縣板橋市重慶路一三九巷十七號四樓,以發揚國軍光榮傳統，紀念八二三金門台海戰役，聯繫當年同生死共患難之戰友，精誠團結，擁護政府，維護國家安全，促進社會安定，並謀取戰友之合法權益為宗旨。,會員入會費、常年會費及其他收入。,台北縣政府八十三年九月十七日83北府社一字第三二二三０七號函,永久,100000.00,1,0831017,,,,,,,,,,,,,,,,,
083法登000056,1,2,林文鼎,171,0831017,0831017,0831018,6冊55頁,2,8,陳履慶,財團法人台灣省台北縣私立辭修高級中學,0620319,台北縣三峽鎮溪東路二五一號,以創辦私立辭修高級中學並謀其發展為目的,由財團法人陳誠文教基金會捐助,台灣省政府教育廳六十一年五月二十七日教二字第四二００七號,永久,131907665.00,1,0831017,,,,,,,,,,,,,,,,,
083法登000057,1,2,林文鼎,172,0831103,0831103,0831104,6冊57頁,2,5,許正秋,財團法人台灣省台北縣樹林鎮鎮南宮,0670703,台北縣樹林鎮千歲街二號,以宏揚教義，敦睦信徒，增進友誼，興辦社會福利公益慈善事業，樹立互助合作團結精神及獎助地方教育，拔擢人才為宗旨。,由信徒捐助,台北縣政府六十六年五月十三日北縣民一字第九七０九三號,永久,12909846.00,1,0831103,,,,,,,,,,,,,,,,,
083法登000058,1,2,林文鼎,41,0831111,0831111,0831114,2冊33頁,1,2,劉炳華,財團法人思源醫療基金會,0780902,台北縣新莊市思源路一二七號,以協助急救、急難病患就醫為目的。,由劉炳偉等捐助,行政院衛生暑七十八年五月十日衛暑醫字第八０一六七０號函,永久,11398656.00,1,0831111,,,,,,,,,,,,,董事劉炳華印鑑變更。,,,,
083法登000059,1,1,林文鼎,173,0831119,0831119,0831121,6冊59頁,,0,蔡友藏,財團法人華新文教基金會,0831119,台北縣板橋市中正路三三二號三樓,以推廣各項文教公益工作為宗旨,由名府建設股份有限公司捐助,台北縣政府八十三年十一月十六日北府教三字第四０二四一一號函,永久,2000000.00,1,0831119,,,,,,,,,,,,,,,,,
