登記案號,類別,案由,主任,登記號數,收件日期,登記日期,公告日期,登記簿,任期判定,屆期判定,法人代表,法人名稱,設立登記日期,主事務所,目的,捐助方法,許可機關日期,存立時期,財產總額,結案原因,結案日期,歸檔日期,發證日期,清算人,變更原因,註銷日期,撤銷日期,撤(註)銷機關文號,撤(註)銷原因
075法登000001,1,1,莊金昌,39,0750102,0750304,0750304,2冊53頁,,0,賴樹旺,財團法人彰化縣私立賴樹旺社會福利慈善事業基金會,0750304,彰化縣彰化市建寶里建寶街二十號,創辦社會愛心教育福利慈善事業人類愛心福利事業㈠老人福利㈡兒童福利㈢殘障福利㈣低收入照顧㈤貧困病患之醫療㈥老弱無依之收容救助㈦其他愛心福利。各類奬助學金事業㈠清寒奬助學金㈡各類研究之奬助學金。,賴樹旺等社會愛心人士二十四名,彰化縣政府中華民國七十四年十二月十九日,永久,9000000.00,1,0750102,0921209,,,,,,,
075法登000002,1,2,莊金昌,13,0750103,0750328,0750328,1冊25頁,2,2,洪金湯,財團法人彰化縣天理教真明彰化教會,0620626,彰化市成功里德安巷七號,宏揚天理教義發展社會福利事業。,洪金湯捐助,中華民國六十二年四月九日,無限期,102879.00,1,0750328,0921209,,,,,,,
075法登000004,1,2,莊金昌,22,0750203,0750424,0750424,2冊15頁,2,1,陳滿枝,財團法人天主教耶穌聖心修女會,0680113,臺灣省彰化縣田中鎮員集路三段一二五巷五十四號,"協助天主教會宣揚教義,辦理社會慈善、救濟、教育事業並負培養本會人才及瞻養年老或疾病修女為目的。",天主教會台中教區財法人捐助。,台灣省政府民政廳民國六十七年十二月二日,永久,10000410.00,1,0921209,0921209,,,,,,,
075法登000005,1,2,莊金昌,6,0750217,0750424,0750424,1冊12頁,2,2,黃漢朝,財團法人彰化縣化堂,0600908,彰化縣員林鎮惠來里光明街一四一巷二十號,"宣揚教義,重整道德,兼辦慈善公益事業,圖謀社會福利為宗旨,及關於信慈善互功並合於前項目的事項。",信徒及各界捐贈收益,中華民國六十年八月十一日,無限期,323999.00,1,0750424,0921209,,,,,,,
075法登000007,1,2,莊金昌,15,0750224,0750424,0750424,2冊1頁,2,9,吳聯星,財團法人私立建國商業專科學校董事會,0630226,台灣省彰化縣彰化市介壽路六十六號,發展高等教育配合國家經濟之需要。,由創辦人馬繼先、張敏華二人共同捐贈,教育部五十四年九月十三日台五十四高字第一四二三三號,無限期,140777971.00,1,0921209,0921209,,,,,,,
075法登000008,1,2,莊金昌,21,0750304,0750424,0750424,2冊13頁,2,3,蘇振輝,財團法人台灣省彰化縣私立精誠高級中學,0670624,彰化縣彰化市平和里中華西路二五０巷四十二號,"以創辦私立精誠中學為發展地方教育,以培植青年蔚為國用。",捐贈,台灣省教育廳民國肆拾伍年拾月玖日許可,永久設立,4626254.00,1,0750424,0921209,,,,,,,
075法登000012,1,1,莊金昌,40,0750501,0750716,0750716,2冊55頁,,0,陳照娥,財團法人彰化縣私立崇德社會福利慈善事業基金會,0750716,彰化縣彰化市南郭路一段六十號,以舉辦並發展各項會福利事業為目的。,董事陳照娥等十五位董事之捐助,彰化縣政府民國七十五年四月二一日,永久,3000000.00,1,0850201,0921209,,,,,,,
075法登000016,1,1,李端季,41,0760113,0760113,0760113,2冊57頁,,0,董事長,財團法人鹿港文教基金會,0760113,彰化縣鹿港鎮瑤林街六號,響應政府從事文化建設，轉移社會風氣，提高鎮民精神生活品質，重振鹿港文風啟廸鎮民愛鄉、愛國情操，積極鼓勵鹿港人從事進修及教育推展。,社會熱心教育文化人士捐贈。,七十四年八月十五日彰化縣政府,永久設立,2200000.00,1,0760113,0921209,,,,,,,
