登記案號,類別,案由,主任,登記號數,收件日期,登記日期,公告日期,登記簿,任期判定,屆期判定,法人代表,法人名稱,設立登記日期,主事務所,目的,捐助方法,許可機關日期,存立時期,財產總額,結案原因,結案日期,歸檔日期,發證日期,代理人,代理人住址,郵遞區號,第二個代理人,第二個代理人住址,郵遞區號,送達代收人姓名,送達代收人住址,郵遞區號,清算人,變更原因,註銷日期,撤銷日期,撤(註)銷機關文號,撤(註)銷原因
075法登000001,1,2,詹麗麗,27,0750521,0750527,0750529,3冊8頁,2,5,毛振翔,財團法人台灣省基隆市私立聖心高級工商職業學校,0600830,基隆市安樂區西定路一六六號,本財團以發展台灣省基隆市私立聖心高級工商職業學校，養成健全之工商技術人才為目的。,捐助,臺灣省政府教育廳七十五年五月十九日七五教三字第四七九五一號函。,不定期,107565120.00,1,0750529,0921218,,,,,,,,,,,,,,,,
075法登000002,1,2,詹麗麗,33,0750602,0750606,0750618,4冊1頁,2,5,朱萊蒂,財團法人台灣省基隆市私立培德高級工商職業學校,0630501,基隆市培德路七十三號,遵照國家教育政策暨現行教育法令之規定辦理私立培德高級工商職業學校並謀其健全發展,由董事會籌集捐助,台灣省政府教育廳六三年三月二三日教三字第二三一二０號,永久無限期,34131023.00,1,0750618,0921218,,,,,,,,,,,,,,,,
075法登000003,1,2,詹麗麗,15,0750701,0750703,0750708,2冊1頁,2,5,毛振翔,財團法人台灣省基隆市私立聖心國民小學,0550608,基隆市安樂區西定路一六六號,遵照國家教育政策現行法令之規定，辦理聖心國民小學，並謀其健全發展。,捐助,台灣省政府教育廳七十五年六月卅日七五基府教國字第三八０七二號函,不定期,19846104.00,1,0750708,0921218,,,,,,,,,,,,,,,,
075法登000004,1,2,詹麗麗,21,0751027,0751103,0751106,3冊5頁,2,7,蔣志平,財團法人私立德育護理專科學校,0560623,基隆市復興路三三六號,確保公有財產,捐助,教育部五十六年六月二十日台高字第一０三二二號,"永  久",59671184.00,1,0751106,0921218,,,,,,,,,,,,,,,,
075法登000005,1,2,詹麗麗,18,0751103,0751106,0751108,12冊16頁,1,0,王文光,財團法人私立崇右企業管理專科學校,0560228,基隆市義七路四十號,為確保公有財產權益,捐助,教育部七十五年十月廿九日台(七五)技四八八二一號,永久,159898438.00,1,0751108,0921218,,,,,,,,,,,,,,,,
075法登000006,1,2,詹麗麗,25,0751114,0751118,0751122,3冊6頁,2,9,顏惠卿,財團法人台灣省基隆市私立光隆高級家事商業職業學校,0600616,基隆市信二路二六四號,遵照國家教育政策暨現行教育法令之規定辦理商業職業學校並謀健全發展,捐助,台灣省政府教育廳六十年四月二三日(六十)教三字第三三二九五號,不定期,61719559.00,1,0751122,0921218,,,,,,,,,,,,,,,,
