088法登財000004,1,1,洪有川,153,0880507,0880526,0880526,6冊8頁,,0,蘇玉霖,財團法人屏東縣私立椰子園老人養護之家,0880526,屏東縣長治鄉繁華村水源路一七一號,以舉辦老人福利慈善事業為宗旨,由蘇玉霖、王青茂、陳慶林、賴平妹、陳志樑、蕭玲珍等人捐助,臺灣省屏東縣政府，八十八年四月廿三日，八八屏府社福字第七０四五七號,永久,42000000.00,1,0880526,0880914,0880914,,,,,,,,,,,,,,,
088法登財000005,1,1,洪有川,155,0880616,0880617,0880617,6冊10頁,,0,廖婉汝,財團法人屏東城鄉發展文教基金會,0880617,屏東縣潮州鎮永春里永康街二０二之一號,整合產官學民各界資源力量，激發社會學習熱忱，發揚屏東文教特色，帶動社區活力，促進屏東城鄉發展，建構二十一世紀的屏東新生活為宗旨。,由廖婉汝捐助,臺灣省屏東縣政府　八十八年六月十六日　八八屏府教社字第一０五七九七號,永久,2000000.00,1,0880617,0880622,0880622,,,,,,,,,,,,,,,
088法登財000006,1,1,洪有川,156,0880730,0880803,0880803,6冊11頁,,0,江貢楠,財團法人屏東縣私立枋寮老人養護中心,0880803,屏東縣枋寮鄉北勢寮小段一六二六號,以舉辦老人福利慈善事業為宗旨,由江貢楠等七人捐助,"臺灣省屏東縣政府  八十八年六月廿九日 八八屏府社福字第一一二九八七號",永久,27000000.00,1,0880802,0890322,0890322,,,,,,,,,,,,,,,
088法登財000007,1,1,洪有川,158,0880804,0880804,0880805,6冊13頁,,0,林一郎,財團法人屏東縣私立三地門養護之家,0880804,屏東縣三地門鄉三地段九三０號,對老人提供服務與福利為宗旨,由包富盛、林玉英等人捐助,臺灣省屏東縣政府　八十八年六月廿一日　八八屏府社福字第一０八三六二號　,永久,10902500.00,1,0880804,0931014,,,,,,,,,,,,,,,,
088法登財000008,1,1,洪有川,157,0880803,0880804,0880805,6冊12頁,,0,葉清坤,財團法人屏東縣私立安康老人養護中心,0880804,屏東縣鹽埔鄉彭厝段三二八號,對老人提供服務與福利為宗旨,由黃慶義等十五人捐助,"臺灣省屏東縣政府 八十八年六月廿三日 八八屏府社福字第一０九七三二號",永久,28243600.00,1,0880804,0881026,0881026,,,,,,,,,,,,,,,
088法登財000009,1,1,洪有川,160,0880818,0880910,0880913,6冊15頁,,0,周茂盛,財團法人基督教沐恩之家,0880910,屏東縣內埔鄉番子厝地號六四０之七,辦理青少年福利為宗旨，並收容輔導誤入歧途、行為偏差之青少年，幫助其身心健全發展為目的並傳揚耶穌基督福音。,由財團法人中華民國台灣基督教信義會捐助,屏東縣政府　八十八年八月九日　八八屏府社福字第一三九六０二號,永久,6392400.00,1,0880910,0890217,0890217,,,,,,,,,,,,,,,
088法登財000010,1,1,洪有川,159,0880827,0880831,0880831,6冊14頁,,0,曹啟鴻,財團法人大武山文教基金會,0880831,屏東縣潮州鎮中山路東段十六號,以資源永續利用為基本理念，進行產業發展教育、藝術文化、鄉土教育、族群與社區發展教育及生態教育的研究、採集、紀錄、保存為基礎教材、透過文字版及宣導活動等推展民眾教育為宗旨。,由曹啟鴻捐助新台幣貳佰萬元正,屏東縣政府　八十八年八月二十日　八八屏府教社字第一四七二七六號,永久,2004849.00,1,0880831,0880917,0880917,,,,,,,,,,,,,,,
088法登財000011,1,1,洪有川,163,0881008,0881011,0881011,7冊1頁,,0,賴桂霞,財團法人屏東縣私立明聖佛院社會福利慈善事業基金會,0881011,屏東縣麟洛鄉新田村民生路興農巷七之一號,老人、兒童、青少年、婦女、身心障礙者之福利、急難、災害（變）之救助、低收入及醫療補助、奬助學金、志願服務、社會公益活動及接受主管機關指導辦理事項。,由徐順賢等人捐助,"屏東縣政府 八十八年九月廿九日 八八屏府社福字第一七二九一四號",永久,10000000.00,1,0881011,0881116,0881116,,,,,,,,,,,,,,,
088法登財000012,1,1,洪有川,166,0881104,0881108,0881108,7冊4頁,,0,張聖嚴,財團法人法鼓山佛教基金會,0881108,台北市北投區光明路二七六號,秉持佛教慈悲濟世之精神，弘揚佛法、淨化人心，增進社會福祉。以興辦佛教宗教、社會、教育及文化等事業。,捐助,臺灣省屏東縣政府八十七年十一月五日八七屏府民禮字第一九一一四０號,永久,63486350.00,1,0881108,0931014,,,,,,,,,,,,,,,,
