登記案號,類別,案由,主任,登記號數,收件日期,登記日期,公告日期,登記簿,任期判定,屆期判定,法人代表,法人名稱,設立登記日期,主事務所,目的,捐助方法,許可機關日期,存立時期,財產總額,結案原因,結案日期,歸檔日期,發證日期,清算人,變更原因,註銷日期,撤銷日期,撤(註)銷機關文號,撤(註)銷原因
110法登他000493,1,2,楊志純,206,1100319,1100323,1100323,15冊1頁,1,19,鄒開蓮,財團法人台灣世界展望會,0530117,台北市松山區民生東路4段133號6樓,"以辦理社會福利慈善及宗教性等公益活動為目的，即是以生命、言行、事蹟來見證耶穌基督，對世上不幸者及貧困者，不論種族、膚色、信仰及性別予以全人基督教式之幫助。本會為World Vision International〈國際世界展望會〉之盟約關係夥伴，支持事工宣言、核心信念及其體制。",由世界展望會總會捐助及其他團體或個人之捐助。,臺灣省政府五十三年一月九日民一字第一二七八號,永久,183969759.00,1,1100323,,1100330,,繼任董事印鑑。,,,,
110法登他000494,1,2,楊志純,63,1100319,1100322,1100322,5冊11頁,1,6,廖惠燕,財團法人天主教聖母無原罪傳教女修會,0470425,台北市復興南路2段148巷30號,為協助當地主教服務人群宣揚天主教教義並供應聖母無原罪傳教女修會所需之一切設備及經費。,由總會撥贈,台北市政府四十七年四月十一日,永久,58101115.00,1,1100322,1100804,1100329,,,,,,
110法登他000495,1,2,楊志純,3129,1100322,1100323,1100323,130冊29頁,1,2,廖運範,財團法人台灣肝臟研究暨教育基金會,1051031,台北市中正區忠孝西路1段50號15樓之37,以促進肝臟醫學教育與學術交流、提高肝臟醫學之水準、促進對肝臟醫學之基礎與臨床研究、互相交換研究心得、加強與國際肝臟醫學團體之聯繫為宗旨。,由社團法人台灣消化系醫學會捐助,教育部中華民國105年10月26日臺教社（三）字第1050146325號函,永久,30000000.00,1,1100323,,1100330,,繼任董事印鑑。,,,,
110法登他000496,2,2,楊志純,2985,1100322,1100323,1100323,140冊1頁,2,2,林茂豊,社團法人台北市通化福德財神慈善協會,1060720,台北市大安區通化街39巷17號,發揚土地公救人助人的正義精神，結合會員力量支持深耕教育，幫助貧困家庭，提供急難救助並且促進地方發展。,會員捐款、委託收益、基金及其孳息、其他收入、會員入會費及常年會費,臺北市政府社會局中華民國106年3月9日北市社團字第10633532500號函,永久,900000.00,1,1100323,1100415,1100331,,理、監事印鑑。,,,,
110法登他000497,1,2,楊志純,2689,1100323,1100324,1100324,108冊29頁,2,6,黃崇仁,財團法人力晶環境保護基金會,0950606,台北市中山區南京東路3段68號15樓,本會以促進環保教育，並推動國內外環保應用為宗旨。,由力晶半導體股份有限公司捐助,行政院環境保護署中華民國95年5月22日環署綜字第0950039722號函,永久,5000000.00,1,1100324,,1100401,,董事印鑑。,,,,
110法登他000498,1,2,楊志純,1973,1100323,1100323,1100323,77冊28頁,2,9,王文杉,財團法人王惕吾先生文教基金會,0851230,台北市信義區基隆路1段180號12樓,以推廣教育，激勵青年專心學習，獎勵青年熱愛國家，服務社會，並為獎助祖籍為浙江省東陽縣之台灣青年求學為宗旨。,由王必成先生等捐助,"教育部八十五年十一月二十七日  台(85)社(四)字第八五五二四一五三號函同意設立",永久,10000000.00,1,1100323,1100804,1100331,,董事印鑑。,,,,
110法登他000499,2,2,楊志純,2695,1100323,1100324,1100324,125冊41頁,2,3,陳淑儀,社團法人中華國際技能交流協會,1041014,台北市中正區羅斯福路4段162號6樓之3,本會希望提升中華兩岸之職場知識技能，並促進雙方交流。藉由本會凝聚有職訓專長與經驗之人力，累積智慧、永續傳承。,入會費、常年會費、事業費、會員捐款、委託收益、基金及其孳息、其他收入,內政部中華民國104年5月26日台內團字第1040028266號函,永久,20000.00,1,1100324,,1100401,,理、監事印鑑。,,,,
110法登他000500,1,2,楊志純,3232,1100323,1100324,1100324,135冊41頁,1,,徐文俊,財團法人台北市瑞智社會福利基金會,1081112,台北市松山區復興北路427巷36號1樓,幫助及陪伴失智者與其家庭，讓他們在困難中有盼望，並提升生活品質與尊嚴。,由王雪惠、王欣蓉、蘇昭蓉、胡德興共同捐助,臺北市政府社會局中華民國108年10月31日北市社團字第1083155367號函,永久,10000000.00,1,1100324,1100804,1100331,,原捐助章程第9條經本院110年度法字第4號民事裁定准予變更。,,,,
110法登他000501,1,2,楊志純,2749,1100323,1100324,1100324,111冊29頁,1,5,李加寶,財團法人蒲公英希望基金會,0960910,台北市中正區忠孝東路1段9號6樓,以推廣青年公益服務理念，推動青年參與社會服務，並促進青少兒身、心、靈健康發展為宗旨。,由台北市基督教蒲公英協會捐助,行政院青年輔導委員會中華民國96年8月16日青參字第0960005326號函,永久,61723324.00,1,1100324,,1100401,,,,,,
110法登他000502,1,2,楊志純,44,1100323,1100324,1100324,4冊3頁,1,33,各董事,財團法人基督教台灣信義會,0450818,台北市大安區杭州南路2段15號,本會以辦理傳教、社會服務、社會福利、工業佈道、教育、文字出版、大眾傳播等公益事業為目的。,各地教會信徒之捐助。,台灣省政府四十五年七月三十一日　（四五）府民一字第八四四０六號函,永久,2243270060.00,1,1100324,1100804,1100331,,捐助及組織章程第4條至第7條、第9條經本院109年度法字第1241號民事裁定准予補充變更；捐助及組織章程第1條至第3條、第8條、第10條經董事會決議通過修正，報經主管機關已予備查。,,,,
110法登他000503,1,2,楊志純,2310,1100324,1100325,1100325,89冊29頁,2,8,陳一強,財團法人台北市勝利社會福利事業基金會,0890315,台北市大安區建國南路1段336號2樓,以舉辦社會福利為目的，發揮基督愛人並服務最小弟兄的精神，為身心障礙者、老人、兒童、青少年、婦女、原住民、外籍配偶及勞工等弱勢族群辦理相關的福利工作與活動、期能享有更獨立自主、更有生命尊嚴的生活品質和未來。並以臺北市為主要執行業務區域。,由挪威協力會捐助,臺北市政府社會局中華民國八十九年二月十五日北市社三字第八九二０九七六三００號函,永久,10000000.00,1,1100325,,1100401,,董事印鑑。,,,,
110法登他000504,1,2,楊志純,1375,1100324,1100325,1100325,57冊13頁,1,11,黃秀美,財團法人旭立文教基金會,0780518,台北市大安區羅斯福路3段245號8樓之2,本會以推動心理衛生，發展社會教育為宗旨。,捐助,教育部七十八年四月二十日　(78)社字第一七五一一號函,永久,1000000.00,1,1100325,1100804,1100406,,"廢止高雄市苓雅區興中二路69號4樓之1分事務所。
原捐助章程第4條、第15條經董事會決議通過修正，報經主管機關許可變更。",,,,
110法登他000505,1,2,楊志純,1827,1100324,1100325,1100325,72冊40頁,1,9,陳擇銘,財團法人大地之愛癌症基金會,0831110,台北市中正區中山南路7號,以推動人本癌症醫學，提昇癌症病人之生活品質為目的。,由謝長堯醫師及其他熱心人士捐助,行政院衛生署八十三年九月三日　衛署醫字第八三０四八七三三號函,永久,29659390.00,1,1100325,,1100401,,捐助章程第1條至第22條經臺灣臺北地方法院110年度法字第76號民事裁定准予變更。,,,,
110法登他000506,2,2,楊志純,1250,1100324,1100401,1100401,53冊21頁,2,,張德永,社團法人中華民國社區教育學會,0950117,台北市大安區和平東路1段147號11樓之2,本會以加強學校與社區之聯繫，結合社區與學校力量，推動社會建設，促進國際文化與學術交流為宗旨。,入會費、常年會費、終身會費、事業費、會員捐款、委託收益、基金及其孳息、其他收入,內政部中華民國94年8月1日台內社字第0940029540號函,永久,1000000.00,1,1100401,1100415,1100409,,"新任理、監事印鑑。
原章程第5條、第8條、第9條、第12條、第15條、第16條、第20條、第23條經會員大會決議通過修正變更，報經主管機關予以備查。",,,,
110法登他000507,2,2,楊志純,445,1100324,1100325,1100325,16冊13頁,2,,陳靜敏,社團法人台灣護理學會,0840906,台北市大安區信義路4段281號4樓,以發展護理專業、促進護理學術研究、提高護理教育水準、增進全民健康及提昇國際地位為宗旨。,會員會費、入會費之收入,內政部三十九年十二月二十日　台內社字第五三八０號指令,永久,170983416.00,1,1100325,,1100401,,"新任理、監事印鑑。
章程第2條、第4條、第5條、第6條、第17條經會員大會決議通過變更，報經主管機關予以備查。",,,,
110法登他000508,1,2,楊志純,2126,1100324,1100325,1100325,82冊40頁,1,8,鍾安住,財團法人天主教失智老人社會福利基金會,0870625,台北市萬華區德昌街125巷11號,以弘揚耶穌博愛精神，傳播天主教教義，配合老人福利法、身心障礙者權益保障法、長期照顧服務法，辦理失智老人照護及社會福利公益慈善事業為宗旨。,由財團法人天主教會台北教區、財團法人台北市天主教聖母聖心傳教修女會捐助,內政部八十七年六月十日　台(87)內社字第八七一八六八五號函,永久,128583664.00,1,1100325,1100804,1100406,,原捐助章程第5條至第7條、第11條至第24條經本院110年度法字第15號民事裁定准予變更；原捐助章程第1條至第4條、第8條至第10條、第25條、第26條經董事會決議通過修正，報經主管機關許可變更。,,,,
110法登他000509,1,2,楊志純,2807,1100325,1100326,1100326,114冊21頁,2,5,王志剛,財團法人立賢教育基金會,0971209,台北市中山區明水路589號2樓之2,本會秉持人文關懷及社會責任，以協助推行國民教育、扶助清貧學子、推動學術交流及豐厚藝文發展為宗旨。,由黃明仁、陳宏楷、陳宏揚、黃信義、謝協昌、黃鈺惠、黃鈺晴、莊士賢、陳錫鈿、陳榮泉、陳明錦、吳統雄、宏宇金屬建材股份有限公司、國裕開發股份有限公司等共同捐助,教育部中華民國97年12月3日台社（四）字第0970236966號函,永久,50560055.00,1,1100326,,1100406,,新任董事印鑑。,,,,
110法登他000510,1,2,楊志純,181,1100325,1100329,1100329,13冊7頁,1,20,曹安娜,財團法人台北市私立強恕高級中學,0511222,台北市中正區汀州路2段143號,為興辦學校並謀其發展為目的。,1.政府補助。2.董事捐獻。3.社會樂捐。,"教育部三十九年一月三十一日 台中字第四八五號代電電准備案",永久,153557281.00,1,1100329,1100804,1100406,,繼任董事印鑑。,,,,
110法登他000511,2,2,楊志純,3239,1100325,1100326,1100326,152冊57頁,2,2,陳惠萍,社團法人台灣綠能公益發展協會,1071102,台北市中山區民權西路70號5樓之1,以推廣低碳發電，永續能源為宗旨，並藉由綠能發電之收入、提供非營利組織長期而穩定之協助。綠能公益即是希望透過綠能之力量，放大公益之價值、擴大企業及公民之參與，同時向下紮根基礎，將綠能落實於大眾生活之中。,入會費、常年會費、事業費、會員捐款、委託收益、基金及其孳息、其他收入,內政部中華民國107年9月27日台內團字第1070064036號函,永久,6400.00,1,1100326,,1100406,,理、監事印鑑。,,,,
110法登他000512,1,2,楊志純,887,1100325,1100329,1100329,40冊49頁,1,18,李良德,財團法人大同大學,0700126,台北市中山區中山北路3段40號,為響應私人捐資興學，培養國家高級學術人才之目的，設立財團法人大同大學。,台北市協志工業振興會捐贈,"教育部五十二年六月廿四日  台（五二）高字第七七五三號函",永久,7641946792.00,1,1100329,1100804,1100406,,繼任董事印鑑。,,,,
110法登他000513,1,2,楊志純,513,1100325,1100329,1100329,28冊21頁,2,15,張昭焚,財團法人中國圍棋會,0620528,台北市仁愛路4段37之26、27號即仁愛大廈2樓Ｆ、Ｇ座,本會以發揚固有文化、獎勵圍棋棋藝研究，培育圍棋專才及端正社會風氣為目的。,由吳滌生、張恒甫、黃水生、周覺明、錢昌祚、王民、許金德、周傳諤、林挺生、陳逢源、顧儉德、高湯盤、辜振甫、孟君璞等及周至柔等董、監事共同捐助,內政部中華民國62年4月17日台內社字第521887號函,永久,2450000.00,1,1100329,,1100408,,法人印信變更及董、監事印鑑。,,,,
110法登他000514,2,2,楊志純,1082,1100325,1100329,1100329,44冊49頁,2,8,沈明德,社團法人臺北市職能治療師公會,0930630,台北市萬華區中華路1段78號10樓之3,以發展職能治療專業，協助政府推動衛生保健政策，提昇全民健康，並促進會員權益為宗旨。,入會費、常年會費、捐助、委託收入、專案計畫收入、基金及其孳息、其他收入,臺北市政府社會局中華民國九十三年六月十一日北市社一字第０九三三五三七六六００號函,永久,569643.00,1,1100329,1100415,1100406,,理、監事印鑑。,,,,
110法登他000515,2,2,楊志純,2138,1100325,1100329,1100329,97冊53頁,2,5,胡寶惠,社團法人台北市銀髮族協會,1010419,台北市松山區南京東路5段356號8樓之2,本會為依法設立、非以營利為目的之社會團體，以「自助助人、自勵勵人」之精神，充實身心靈內涵，分享經驗及心得，進而回饋社會國家為宗旨。,入會費、常年會費、永久會員會費、個人會員之眷屬，參加本會活動，依活動需要繳納活動費、贊助費樂捐及委託收益、基金及其孳息、其他收入,臺北市政府社會局中華民國101年3月20日北市社團字第10133990900號函,永久,588462.00,1,1100329,1101214,1100408,,理、監事印鑑。,,,,
110法登他000516,1,2,楊志純,1173,1100325,1100330,1100330,50冊25頁,2,16,馬長生,財團法人中華民國民營廣播電台聯合會,0750813,台北市中正區仁愛路2段2號9樓,以研究廣播學術，改進廣播技術，團結民營同業，共謀廣播事業之進步發展為目的。,一、黨政主管單位及民間廣電團體捐助二、民營廣播單位捐助,行政院新聞局七十五年七月二十九日　（七五）京廣二字第一一七一一號函,永久,1300000.00,1,1100330,1100804,1100407,,"董、監事印鑑。
原捐助暨組織章程第8條經本院109年度法字第1165號民事裁定准予變更。",,,,
110法登他000517,2,2,楊志純,3004,1100325,1100331,1100331,140冊77頁,2,3,王文正,社團法人台北市光鹽關懷發展協會,1060818,台北市松山區南京東路4段107號12樓,以協助全人關懷，辦理社會福利服務活動，促進社區發展為宗旨。,入會費、常年會費、事業費、會員捐款、補助費、委託收益、基金及其孳息、其他收入,臺北市政府社會局中華民國106年7月21日北市社團字第10640514600號函,永久,10800.00,1,1100331,,1100408,,理、監事簽名式。,,,,
110法登他000518,1,2,楊志純,1772,1100325,1100329,1100329,70冊52頁,1,10,胡世賢,財團法人臺北市私立恆安老人長期照顧中心（長期照護型）,0830311,台北市萬華區水源路187號,以舉辦或捐助（贈）社會福利慈善事業為目的。,王傳淵、陳敏雄、胡世賢、王傳芳、柳富藏、陳根火、謝朝宗等先生捐助,台北市政府社會局八十三年一月三十一日　北市社四字第五一五０號函,永久,546599149.00,1,1100329,1100804,1100406,,,,,,
110法登他000519,1,2,楊志純,66,1100326,1100329,1100329,5冊17頁,2,12,各董事,財團法人台北市華亞之聲社中華基督教便以利教會,0470814,台北市信義區嘉興街254號,在台北市及台灣省其他各處傳揚基督教教義，以捐得財產在台灣推進一切宗教工作及附帶從事救濟慈善工作，可設立托兒所及幼稚園等托育服務。,美國加利福尼亞州華亞之聲社捐助。,台北縣政府四七年七月一日北縣民(一)字第一號,永久,9746489.00,1,1100329,,1100408,,董事印鑑。,,,,
110法登他000520,1,2,楊志純,3037,1100326,1100329,1100329,125冊61頁,1,3,蔡秀娟,財團法人天美藝術基金會,1030528,台北市大安區永康街75巷8號6樓之1,以培育台灣年輕視覺藝術人才及保存台灣視覺藝術文化財產為宗旨。,由蔡秀娟捐助,臺北市政府文化局中華民國103年5月27日北市文化文創字第10331338400號函,永久,41824673.00,1,1100329,1100804,1100406,,捐助章程第2條、第5條至第11條、第13條至第19條經本院109年度法字第1095號民事裁定准予變更；捐助章程第1條、第3條、第4條、第12條、第20條經董事會決議通過修正，報經主管機關同意變更。,,,,
110法登他000521,2,2,楊志純,1224,1100326,1100329,1100329,51冊69頁,1,,劉嘉松,社團法人臺灣省會計師公會,0941114,台北市中正區南海路1號9樓之1,本會以會計審計學術之闡揚，制度之改進，並協助國家社會之財經建設，共謀會計師事業之發展，並增進其職務上之信譽為宗旨。,入會費、常年會費、事業費、捐助、其他收入,台灣省政府中華民國94年10月7日府社行字第0940015029號函,永久,73600982.00,1,1100329,,1100408,,,,,,
110法登他000522,1,2,楊志純,2397,1100326,1100329,1100329,93冊57頁,2,8,黃江淑,財團法人臺北市福陞教育基金會,0871208,台北市松山區民權東路3段170號12樓,以宏揚文化，關懷弱勢為宗旨。,由福陞興業股份有限公司捐助,臺北縣政府中華民國八十七年十二月三日（八七）北府教三字第三八一四八九號函,永久,7002180.00,1,1100329,1100804,1100406,,董事印鑑。,,,,
110法登他000523,1,2,楊志純,1130,1100326,1100329,1100329,48冊57頁,2,11,柯杜瑞琴,財團法人台北市明光基金會,0741120,台北市信義區基隆路2段151之5及151之8號3樓,以辦理扶助社會老弱貧苦者為對象，並以服務大眾為目的。,由創立人捐助,台北市政府社會局七十四年九月七日　（七四）年北市社四字第三九七六號函,永久,16739676.00,1,1100329,,1100408,,"董事印鑑。
捐助章程第16條、第25條經臺灣臺北地方法院110年度法字第22號民事裁定准予變更。",,,,
110法登他000524,1,2,楊志純,300,1100326,1100329,1100329,21冊7頁,2,11,呂允仁,財團法人台北市基督徒聚會處,0560616,台北市中正區南海路39號,以宣揚耶穌基督、培養信徒靈性，並舉辦慈善公益事業為宗旨。,動產及不動產均由信徒自由捐獻,台北市政府民政局五十六年六月十六日　,永久,17756709.00,1,1100329,1100804,1100406,,董事印鑑。,,,,
110法登他000525,1,2,楊志純,1746,1100326,1100329,1100329,69冊43頁,2,10,江啟臣,財團法人國家政策研究基金會,0821126,台北市中正區杭州南路1段16號,以研究國家政策，促進國家進步與發展為宗旨。,由財團法人連震東文教基金會捐助。,"教育部八十二年十一月十日  台(八二)社字第０六二九三九號函",永久,500000000.00,1,1100329,,1100408,,董事、監察人印鑑。,,,,
110法登他000526,1,2,楊志純,1983,1100326,1100329,1100329,77冊58頁,1,9,曾燦金,財團法人台北市政府教育局認助清寒學生基金會,0860124,台北市信義區松山路655號,以推動社會善心團體及人士認助設籍台北市及台北市所屬各級學校清寒暨家庭遭逢重大急難學生，使其順利完成學業為宗旨。,由台北市政府教育局「認助清寒學生專戶」捐助。,台北市政府教育局八十六年一月九日　北市教四字第八六二００二三六００號函同意設立,永久,12000000.00,1,1100329,1100804,1100406,,"第9屆董事張麗華辭任，繼任董事姓名及住所如下：董 事  張麗華  台北市南港區玉成街40之2號4樓。
繼任董事印鑑。",,,,
110法登他000527,2,2,楊志純,2611,1100326,1100329,1100329,121冊25頁,2,3,張琦琪,社團法人中華滔滔文創協會,1040428,台北市文山區木柵路3段102巷16號7樓之2,期待藉由文化創意的方式，帶出各項有聲無聲的訊息觸動人心、深自省思，促使親子、人際及社會等各項關係能進入深層的對話，彼此了解、互相寬容，達到促進社會和諧的終極關懷而成立，將秉持文化尊重與創意專業的信念，協助人才與產業進入適當的創意、創新與創業導向，促使社會關係和諧為宗旨。,入會費、常年會費、事業費、會員捐款、委託收益、基金及其孳息、其他收入,內政部中華民國104年1月15日台內團字第1030321250號函,永久,66000.00,1,1100329,,1100408,,新任理事印鑑。,,,,
110法登他000528,1,2,楊志純,1317,1100326,1100329,1100329,55冊17頁,1,16,悟覺妙天,財團法人世界領袖教育和平基金會,0770912,新北市新店區屈尺里櫻花街33號,以推廣全人教育，終身學習及溫馨校園之原則，培養國家人才，促進世界和平與福祉為宗旨。,由黃國倫、蘇永安等先生捐助,"教育部七十七年七月十五日  台（七七）高字第三二七三三號函",永久,10000000.00,1,1100329,1100804,1100406,,"原捐助章程第1條、第15條經董事會決議通過修正，報經主管機關許可變更。
法人印信變更。",,,,
110法登他000529,1,3,楊志純,2014,1100329,1100329,1100329,78冊61頁,1,6,林國明,財團法人安居文教基金會,0860428,台北市大安區信義路3段186號5樓,以辦理社會文教，推行安居生活及科技知識為宗旨。,由高澤先生、趙森嚴先生、蕭碧珊女士等三人共同捐助。,教育部八十六年四月十七日　台社㈣字第八六０四一六三三號函,永久,10000000.00,1,1100329,,,,解散登記之原因、可決之程序與日期：依據教育部民國110年3月25日臺教社（三）字第1100034138A號函依財團法人法第32條規定囑託解散登記。,,,,
110法登他000530,1,2,楊志純,1362,1100329,1100330,1100330,56冊47頁,1,11,張正岳,財團法人瑞助營造社會福利慈善事業基金會,0780427,台北市中正區忠孝西路1段50號9樓,以舉辦或捐助（贈）社會福利慈善事業為目的。,由沈長聲等捐助,"內政部七十八年四月十四日  台（七八）內社字第六八八八九０號函",永久,30000000.00,1,1100330,1100804,1100407,,繼任董事印鑑。,,,,
110法登他000531,2,2,楊志純,1490,1100329,1100330,1100330,65冊21頁,2,6,楊慧珺,社團法人中華世界易經協會,0961114,新北市新店區國校路75號,推行及宣揚世界易經為最高宗旨及意義。,入會費、常年會費、事業費、會員捐款、委託收益、基金及其孳息、其他收入,內政部中華民國95年5月29日台內社字第0950088847號函,永久,1076.00,1,1100330,,1100408,,理、監事印鑑。,,,,
110法登他000532,1,2,楊志純,688,1100329,1100330,1100330,34冊11頁,1,6,陳繼盛,財團法人陳林法學文教基金會,0651007,台北市忠孝東路1段138號7樓,為促進比較法學之研究，並宏揚法治精神、培養青年法律人才、普及法律教育為宗旨。,陳繼盛、林菊枝共同捐助,台北市政府教育局六十五年八月五日　北市教四字第二二０七三號函,永久,200000.00,1,1100330,1100804,1100407,,捐助章程第4條至第6條、第8條、第10條、第13條至第15條、第17條經本院110年度法字第33號民事裁定准予變更；捐助章程第1條至第3條、第7條、第9條、第11條、第12條、第16條、第18條至第20條經董事會決議通過修正，報經主管機關准予變更。,,,,
110法登他000533,1,2,楊志純,1996,1100329,1100330,1100330,78冊7頁,2,9,林聰明,財團法人歐洲文教交流基金會,0860307,台北市中山區林森北路554號7樓,以促進我國與歐洲各國間之學術文化與教育之交流為宗旨。,由陳哲芳、許幸惠、曲銘、蘇明朝、曹德風、程舒茵、劉定一、陸俊雄、許惠玲、徐美英共同捐助。,教育部八十六年二月十三日　台(86)社(四)字第八六０一四四九六號函,永久,10000000.00,1,1100330,,1100408,,董事印鑑。,,,,
110法登他000535,1,5,楊志純,1679,1100330,1100331,1100331,67冊29頁,1,9,趙玲玲,財團法人孫文學術思想研究交流基金會,0811006,台北市松山區八德路4段641號2樓,以促進孫逸仙思想學術現代化研究與交流發展，並協助推動國家民主統一，社會倫理自由安泰為宗旨。,由趙玲玲女士等七人捐助,教育部八十一年八月十五日　台（八一）社字第四五五五七號函　,永久,10000000.00,1,1100331,,,初建元,"清算人職務執行之情形：清算人向法院民事庭呈報清算人就任後，即了結現務，依法造具財務報表及財產目錄進行清算，經收取債權及清償債務後，將賸餘財產新台幣980萬403元整移交予臺北市政府。並造具清算期間內之收支表、損益表，連同各項簿冊，於民國110年3月18日提請第9屆第9次董事會會議審查通過，並向法院聲報清算終結，經臺灣臺北地方法院民事庭以民國110年3月26日北院忠民松109年度法字第812號函准予備查。
清算終結日期：110年2月22日。",,,,
