登記案號,類別,案由,主任,登記號數,收件日期,登記日期,公告日期,登記簿,任期判定,屆期判定,法人代表,法人名稱,設立登記日期,主事務所,目的,捐助方法,許可機關日期,存立時期,財產總額,結案原因,結案日期,歸檔日期,發證日期,清算人,變更原因,註銷日期,撤銷日期,撤(註)銷機關文號,撤(註)銷原因
110法登他000990,2,2,楊志純,2579,1100629,1100702,1100702,119冊57頁,2,13,陳錦誠,社團法人中華民國表演藝術協會,1040212,台北市大安區泰順街26巷45號,以建全表演藝術生態為宗旨。,入會費、常年會費、事業費、會員捐款、基金及其孳息、委託收益、其他收入,內政部中華民國86年7月24日台(86)內社字第8684680號函,永久,41000000.00,1,1100702,1100816,1100712,,理、監事印鑑。,,,,
110法登他000991,1,2,楊志純,26,1100629,1100706,1100706,2冊26頁,1,42,各董事,財團法人中華基督教衛理公會,0430430,台北市大安區光復南路438號1樓,以宣揚基督教教義，實行基督教真理，及服務人羣為目的。,由中華基督教衛理公會捐助,臺灣省政府四十三年四月十七日　肆參府民一字第三七二五三號通知,永久,5992657214.00,1,1100706,1100928,1100713,,,,,,
110法登他000992,2,2,楊志純,2986,1100629,1100702,1100702,140冊5頁,2,,李泰憲,社團法人台灣牙醫植體醫學會,1060724,台北市萬華區西園路2段300號,一、促進牙醫植體學之研究、訓練和醫療品質。二、樹立及維護牙醫植體學標準與權益。三、增進國際間牙醫植體學學術文化之交流。,入會費、常年會費、事業費、自由捐款、委託收益、基金及其孳息,內政部中華民國94年3月4日台內社字第0940008606號函,永久,1285081.00,1,1100702,1100816,1100712,,理、監事印鑑。,,,,
110法登他000993,1,2,楊志純,2538,1100629,1100706,1100706,100冊61頁,2,7,宋具芳,財團法人漢光教育基金會,0920416,台北市松山區八德路3段2號9樓之3,以發展身心靈全人教育及文化教育為宗旨。,由宋具芳捐助,教育部中華民國九十二年四月二日台社（四）字第０九二００四０四二０號函,永久,30000000.00,1,1100706,1100928,1100713,,董事印鑑。,,,,
110法登他000994,1,2,楊志純,89,1100629,1100714,1100714,7冊3頁,1,22,潘文炎,財團法人中技社,0481001,台北市大安區敦化南路2段97號8樓,以引進科技新知、培育科技人才，協助國內外經濟建設及增進我國生產事業之生產能力為目的,由發起人捐助。,經濟部四十八年五月廿三日　經台（四八）工字第七七二三號通知,永久,1690863138.00,1,1100714,1100816,1100723,,繼任董事印鑑。,,,,
110法登他000995,1,2,楊志純,1998,1100629,1100706,1100706,78冊13頁,2,9,孫大程,財團法人孫大程佈道大會基金會,0860317,台北市中山區建國北路1段69號10樓,以宣揚基督教教義，舉辦基督教佈道大會、基督教宣教訓練及會議和從事基督教文學之創作、出版、編譯及銷售有關之書籍、雜誌、錄音帶、錄影帶及光碟等，並辦理非營利性質之基督教服務事業為宗旨。,孫大程等五人捐助,台北市政府八十六年三月十日府新一字第八六０一六九０一００號函,永久,10000000.00,1,1100706,1100928,1100713,,"董事印鑑。
捐助章程第3條主事務所經董事會決議通過變更，報經主管機關同意備查。",,,,
110法登他000996,1,2,楊志純,195,1100629,1100702,1100702,14冊9頁,1,19,黃書瑋,財團法人台北市艋舺龍山寺,0520923,台北市萬華區廣州街211號,以提倡奉佛敬神，闡揚佛教教理、倡導佛教信仰、推廣慈善、公益、宗教、藝術、文化、教育，並出版上列有關書籍、刊物、有聲教材及開發相關衍生性產品，藉使一般善信各獲安心立命福利社會為宗旨。,捐助,台北市政府五十二年八月二十四日　五二府民行字第四二三八七號函,永久,5985831308.00,1,1100702,1100816,1100712,,,,,,
110法登他000997,1,2,楊志純,654,1100629,1100706,1100706,33冊3頁,1,12,賴振融,財團法人莊福文化教育基金會,0650103,台北市中山區長春路168號,以從事籌建莊福文化教育中心，振興教育，並培養優秀學術及運動人才，獎助在學青年、培養藝術教育人才、生物保育教育、保育學術、保育研究工作為宗旨。,由莊福、莊許金鳳、莊村徹、莊秀石、莊秀欣各捐之股票面額。,六十四年十二月二十九日台北市政府教育局（六四）北市教輝四字第四八八三九號函,永久,208049420.00,1,1100706,1100928,1100713,,繼任董事印鑑。,,,,
110法登他000998,2,2,楊志純,2148,1100630,1100712,1100712,98冊13頁,2,,廖嘉今,社團法人台北芝山扶輪社,1010427,台北市中正區杭州南路1段14巷1號2樓,本社以人道關懷，行善天下為宗旨。,入社費、常年會費、事業費、社員捐款、委託收益、基金及其孳息、其他收入,臺北市政府社會局中華民國100年11月28日北市社團字第10047273900號函,永久,1006407.00,1,1100712,1100816,1100719,,理、監事印鑑。,,,,
110法登他000999,1,2,楊志純,1325,1100630,1100727,1100727,55冊33頁,2,9,許嫺嫺,財團法人許勝發文教基金會,0771121,台北市松江路50號4樓,提高我國學術研究之水準，及工商企業人力資源之培育。,由太子汽車工業股份有限公司捐助新台幣叁仟萬元設立基金，並繼續接受國內、外個人、團體、政府等之捐贈。,教育部中華民國77年10月17日台(77)高字第49339號函,永久,30000000.00,1,1100727,1100928,1100803,,法人印信變更、董事長印鑑及其餘董事簽名式。,,,,
110法登他001000,2,2,楊志純,2480,1100630,1100702,1100702,114冊61頁,2,4,張鎮遠,社團法人華人磐石領袖協會,1010705,台北市大安區和平東路3段406巷19號1樓,以培訓台灣與華人地區青（少）年領袖，建立國際視野，促進台灣與全球華人地區青（少）年之全人發展。故以關懷海外貧困社區為平台，使他們能夠自給自足，帶領華人青年以「贈人以魚，不如授人以漁」的理念，關懷並協助海外社區能邁向自給自足為宗旨。,入會費、常年會費、事業費、會員捐款、委託收益、基金及其孳息、其他收入,內政部中華民國101年2月1日台內社字第1010074578號函,永久,3156554.00,1,1100702,1100816,1100712,,理、監事印鑑。,,,,
110法登他001001,1,2,楊志純,172,1100630,1100706,1100706,12冊19頁,1,14,朱澤民,財團法人主計協進社,0510805,台北市中正區博愛路216號1樓,以宏揚主計學術，促進主計業務發展為目的。,由行政院主計處創設之主計月報社捐助,"教育部五十一年五月三日  台（五一）高字第三八八八號函通知核准設立",永久,30000000.00,1,1100706,,1100713,,繼任董事印鑑。,,,,
110法登他001002,1,2,楊志純,799,1100630,1100702,1100702,37冊53頁,2,15,謝謂君,財團法人中國驗船中心,0680303,台北市中山區南京東路3段103號8樓,以優良技術與精密檢驗設備，從事船舶設計之審核，船舶結構、裝備與建材等之檢驗，為航運業、造船業及保險業提供服務，旨在增進海上人命安全及防止海洋環境污染，並配合政府政策，以輔助航業發展，促進國際貿易為目的。,由航業、造船業、保險業及相關機構等共同捐助。,交通部六十七年五月十六日　交航（六七）字第０八六九六號函,永久,60000000.00,1,1100702,1100816,1100712,,董事、監察人印鑑。,,,,
110法登他001003,1,2,楊志純,2822,1100630,1100706,1100706,115冊1頁,2,5,施瓊華,財團法人保險安定基金,0980703,台北市中正區忠孝東路2段123號9樓,本基金之目的在保障要保人、被保險人及受益人之基本權益，並維護金融之安定。,由財團法人人身保險安定基金、財團法人財產保險安定基金共同捐助,行政院金融監督管理委員會中華民國98年6月29日金管保財字第09802507900號函,永久,20442599289.00,1,1100706,1101013,1100713,,董事、監察人印鑑（其中董事黃淑芬為簽名式）。,,,,
110法登他001004,1,2,楊志純,1966,1100630,1100708,1100708,77冊7頁,2,9,黃勝雄,財團法人中華民國國家資訊基本建設產業發展協進會,0851206,台北市中山區松江路317號7樓,"一、敦促政府繼續按國家資訊通信基本建設（National Information Infrastructure，NII）民間主導之推動模式，大力推動，使擴及所有產業加速與其他先進國家同步發展。二、協助推廣具有增進人民福祉、公共安全、永續發展及高度商機之 NII應用與服務項目，尤其與產業發展和升級以及民眾日常生活息息相關者，強化前瞻性與實用性資通訊技術之結合和應用有關工作。三、在政府與民間業者之間扮演溝通橋樑角色，有效整合與傳達民間業者之需求，襄助公部門規劃、執行和廣宣相關政策，俾利公部門和私部門之互利協作。四、敦促政府營造產業發展有利環境，如協助融資，租稅減免、培育人才、釐訂標準、修訂相關法令等。",由台灣積體電路製造股份有限公司等九家公司共同捐助。,經濟部八十五年十一月二十日經（八五）商字第八五０三六一０三號函,永久,30500000.00,1,1100708,1100816,1100719,,董事、監察人簽名式（其中董事長黃勝雄、董事曾黎明、常務監事張京育、監察人曾更瑩係採印鑑式）。,,,,
110法登他001005,2,2,楊志純,1186,1100630,1100706,1100706,49冊77頁,1,5,林憲德,社團法人台灣綠建築發展協會,0940615,新北市新店區民權路95號3樓,本會為依法設立、非以營利為目的之社會團體，以推動符合地球環保目的之本土化優質綠建築政策，促進我國綠建築產業發展與國際交流，推廣綠建築社會教育為宗旨。,會員入會費、常年會費、事業費、會員捐款、委託收益、基金及其孳息、其他收入,內政部中華民國94年2月21日台內社字第0940006900號函,永久,44350.00,1,1100706,1101214,1100713,,繼任理事印鑑。,,,,
110法登他001006,2,2,楊志純,3529,1100630,1100813,1100813,167冊17頁,1,1,田宇君,社團法人國際整體造型協會,1090305,台北市中山區天祥路64號2樓,致力推動整體造型、彩妝造型、美容美髮、美甲美睫、美體美學、時尚彩妝等各項美學設計等相關活動，提昇會員之專業技能及教育培訓，並輔導就業及創業機會，促進國際技術交流，發展國際技術認證，提升專業技術形象為宗旨。,入會費、常年會費、事業費、會員捐款、委託收益、基金及其孳息、其他收入,內政部中華民國107年11月27日台內團字第1070082694號函,永久,47860.00,1,1100813,,1100820,,繼任理事印鑑。,,,,
110法登他001007,2,2,楊志純,2001,1100630,1100706,1100706,90冊65頁,2,10,陳宜君,社團法人台灣感染管制學會,1000616,台北市重慶南路1段121號8樓之20,本會以發展感染管制專業，加強感染管制工作與學術研究之推展，並提高醫療院所感染防治之觀念，增進國民健康為宗旨。,入會費、常年會費、事業費、會員捐款、委託收益、基金及其孳息、其他收入,內政部中華民國97年3月13日台內社字第0970043528號函,永久,12000000.00,1,1100706,1101214,1100713,,理、監事印鑑。,,,,
110法登他001008,2,2,楊志純,2030,1100701,1100702,1100702,92冊21頁,1,3,黃玫玫,社團法人台灣法爾禪修中心學會,1000826,台北市中山區建國北路1段78巷32號4樓,本會為依法設立、非以營利為目的之社會團體，以「尊崇釋迦牟尼佛慈悲喜捨之精神，發願以己力，弘法利生，引導人心向善，為端正社會風氣盡一份力量」為宗旨。,入會費、常年會費、事業費、會員捐款、委託收益、基金及其孳息、其他收入,內政部中華民國100年7月13日台內社字第1000136988號函,永久,214000.00,1,1100702,1100816,1100712,,繼任理事印鑑。,,,,
110法登他001009,2,2,楊志純,1566,1100701,1100706,1100706,69冊5頁,2,,蔡忠川,社團法人臺北市雙溪扶輪社,0970730,台北市大安區仁愛路4段345巷4弄36號4樓,本社之宗旨在於鼓勵並培養以服務之理想為可貴事業之基礎。,入會費、常年會費、會員捐款、基金及其孳息、其他收入,臺北市政府社會局中華民國80年4月20日北市社一字第15066號函,永久,5874083.00,1,1100706,1101214,1100713,,理、監事印鑑。,,,,
110法登他001010,2,2,楊志純,1652,1100701,1100708,1100708,73冊29頁,2,5,梁志瑋,社團法人台灣收容動物關懷協會,0980326,台北市中山區吉林路150號3樓之13,本會為依法設立、非以營利為目的之社會團體，以關懷收容所流浪動物，鼓勵民眾優先認養收容所動物，改善收容環境為宗旨。,入會費、常年會費、事業費、會員捐款、委託收益、基金及其孳息、其他收入,內政部中華民國97年10月9日台內社字第0970160332號函,永久,340582.00,1,1100708,1100816,1100719,,理、監事印鑑。,,,,
110法登他001011,2,2,楊志純,3421,1100701,1100706,1100706,161冊65頁,2,,林少游,社團法人台北市光華獅子會,1080814,台北市松山區八德路2段374號4樓之2,一、發揚人類博愛互助精神。二、增進國際友好關係。三、尊重自由啟發智慧。四、提倡社會福利,常年會費、會員捐款、委託收益、基金及其孳息、其他收入,臺北市政府社會局中華民國108年7月10日北市社團字第1083108117號函,永久,656000.00,1,1100706,,1100713,,理監事印鑑。,,,,
110法登他001012,1,2,楊志純,2258,1100701,1100708,1100708,86冊76頁,1,7,林明穱,財團法人馬偕．林輝成紀念文教基金會,0880810,台北市中山區松江路22號6樓之1,本會以「紀念偕叡理（馬偕）博士及其學生林輝成（林孽）先生，並偕烏妹女士、林和引先生等人之善行」為目的。,由林明穱女士捐助,教育部中華民國八十八年八月四日台（八八）社（四）字第八八０九二五一八號函,永久,11638000.00,1,1100708,1100816,1100719,,,,,,
110法登他001013,2,2,楊志純,1242,1100701,1100706,1100706,52冊65頁,2,,宋秉建,社團法人台北永安扶輪社,0941223,台北市松山區敦化北路222巷10號,本會以於鼓勵並培養以服務之理想為可貴事業之基礎，尤其著重於鼓勵並培養為宗旨。,入會費、常年會費、會員捐款、委託收益、基金及其孳息、其他收入,臺北市政府社會局中華民國94年10月25日北市社一字第09440539700號函,永久,88335.00,1,1100706,,1100713,,理、監事印鑑。,,,,
110法登他001014,1,2,楊志純,2369,1100701,1100708,1100708,92冊25頁,1,7,廖經倫,財團法人華山社會福利慈善事業基金會,0881110,台北市中正區杭州北路28號5樓之3,本會以舉辦社會福利慈善事業為目的。,由陳歐陽秀蘭及曹慶捐助,台北縣政府八十八年十月二十八日北府社三字第四０七七五九號函,永久,141215630.00,1,1100708,1100816,1100719,,,,,,
110法登他001015,1,2,楊志純,2072,1100701,1100706,1100706,80冊58頁,1,8,尤英夫,財團法人台北市賽珍珠基金會,0861205,台北市中山區長春路232號4樓,以辦理臺北市社會福利為主要目的，並以臺北市為執行業務主要區域。,由捐助人無償捐助之,台北市政府社會局八十六年十一月十九日　北市社五字第八六二六０八二０００號函,永久,10000000.00,1,1100706,1101013,1100713,,新任及繼任董事印鑑。,,,,
110法登他001016,1,2,楊志純,561,1100701,1100708,1100708,29冊57頁,2,18,鄭忠信,財團法人基督教中國主日學協會,0630208,台北市中山區中山北路2段105號,為促進主日學教導聖經，拯救靈魂，並服務各教會。,由陳澤如先生等捐助,"內政部六十二年十二月八日  台內民字第五五五七三八號函",永久,35786855.00,1,1100708,1100816,1100719,,董事印鑑。,,,,
110法登他001017,1,2,楊志純,1499,1100701,1100812,1100812,61冊27頁,2,9,武小鳯,財團法人台灣基督長老教會原住民教會,0790626,台北市大安區羅斯福路3段269巷3號,以宣揚基督福音領人歸主為宗旨。,由本會信徒奉獻,台灣省政府民政廳中華民國四十七年四月九日,永久,504040.00,1,1100812,1101013,1100819,,董事印鑑。,,,,
110法登他001018,1,2,楊志純,1981,1100701,1100708,1100708,77冊52頁,2,9,顏甘霖,財團法人吾心文教基金會,0860117,台北市中山區松江路17號2樓,以關懷青少年身心發展、人格養成為主要目標，並推廣相關文教事業及進行心理衛生教育工作以增進全民人格及身心的健全發展為宗旨。,由顏甘霖、顏陳秀霞夫婦共同捐助。,"教育部八十五年十二月三十一日 台(85)社(四)字第八五五二六四二二號函同意設立",永久,96368083.00,1,1100708,1100816,1100719,,"董事印鑑。
原捐助章程第4條、第17條經董事會決議通過修正，報經主管機關許可變更。",,,,
110法登他001019,1,2,楊志純,759,1100701,1100723,1100723,36冊33頁,1,5,黃教漳,財團法人崇德工業研究發展基金會,0670321,台北市松江路261號14樓,以獎助中華民國工業之研究發展，協助國人改善食品安全、營養健康之研究推廣為宗旨。,由台隆工業股份有限公司捐助,經濟部六十七年三月十四日　經（六七）工字第０七二二０號,永久,20000000.00,1,1100723,,1100730,,捐助章程第6條至第20條經臺灣臺北地方法院110年度法字第145號民事裁定准予變更。捐助章程第1條、第3條、第21條、第22條、第23條經董事會決議通過變更，報經主管機關核予許可。,,,,
110法登他001020,1,2,楊志純,1413,1100701,1100708,1100708,58冊31頁,1,10,張迺良,財團法人台北市黃尚權文教基金會,0781108,台北市中正區仁愛路2段23號7樓,以奬助清寒學業優良學生為宗旨,由黃尚權先生捐助,台北市政府教育局七十八年九月二十九日　北市教四字第四四九三０號函,永久,5000000.00,1,1100708,1100816,1100719,,捐助章程第3條、第5條至第13條經本院110年度法字第131號民事裁定准予變更；捐助章程第1條、第2條、第14條、第15條經董事會決議通過修正，報經主管機關准予變更。,,,,
110法登他001021,1,2,楊志純,475,1100701,1100708,1100708,27冊5頁,2,17,林源泉,財團法人台灣雜糧發展基金會,0610919,台北市中正區羅斯福路1段7號5樓之1,以協助雜糧及相關產業之發展為宗旨。　　　　　　　　　　　　　　　　　　　　　　　　　　　　　　　　　　　　　　,捐助,經濟部六十一年五月六日　經（六一）農字第一二三九０號函,永久,955310840.00,1,1100708,1101013,1100720,,董事、監察人印鑑。,,,,
110法登他001022,2,2,楊志純,1076,1100702,1100712,1100712,44冊25頁,2,19,林秀琛,社團法人台北長安扶輪社,0930519,台北市中山區伊通街19巷11號1樓,一、藉增廣相識以擴展服務之機會。二、在各種事業及專業中提高道德之標準；認識一切有益於社會的職業之價值；及每一扶輪社員應尊重其本身之職業，藉以服務社會。三、每一社員以服務之理想應用於其個人、事業及社會之生活。四、透過結合具有服務之理想之各種事業及專業人士，以世界性之聯誼，增進國際間之瞭解、親善與和平。,入社費、常年社費、事業費、社員捐款、委託收益、基金及其利息、其他收入,臺北市政府社會局中華民國九十二年十月十六日北市社一字第０九二四０九一０五００號函,永久,740000.00,1,1100712,1100816,1100719,,理、監事印鑑。,,,,
110法登他001023,1,2,楊志純,918,1100702,1100706,1100706,41冊51頁,1,12,蔡復進,財團法人農村發展基金會,0700922,台北市愛國東路22號14樓,以促進國際農業交流，協助國內外各地區農村與農業發展為宗旨,捐助,經濟部七十年八月二十一日　經（七０）農字第三四八七四號函,永久,644930000.00,1,1100706,,1100713,,繼任董事、監察人印鑑。,,,,
110法登他001024,2,2,楊志純,548,1100702,1100712,1100712,19冊52頁,2,,簡學禮,社團法人台北市羅馬扶輪社,0860617,台北市中山區中山北路1段53巷20號5樓之10,本社以鼓勵並培養服務社會之理想為一切正當事業之基礎為宗旨。,社員繳納入社費、常年會費及社員捐款。,"台北市政府八十六年二月廿八日  北市社會字一四二一號函",永久,58930.00,1,1100712,1100816,1100719,,理、監事印鑑。,,,,
110法登他001025,2,2,楊志純,2488,1100702,1100723,1100723,115冊13頁,2,,黃洪文,社團法人台北雲端扶輪社,1030724,台北市中山區松江路328號8樓6室,本社之宗旨在於鼓勵培養以服務之理想為事業之基礎，增進社會之福祉，提高地域文化之水準，並進而增進國際間之瞭解，親善與和平。,入會費、常年會費、社員捐款、基金及其孳息、其他收入,臺北市政府社會局中華民國103年7月7日北市社團字第10339926000號函,永久,300000.00,1,1100723,1101214,1100730,,理、監事印鑑。,,,,
110法登他001027,2,2,楊志純,826,1100702,1100706,1100706,31冊65頁,2,9,莊秋華,社團法人台灣病歷資訊管理學會,0901224,台北市中山區民權西路20號12樓之3,提昇病歷管理品質。宣導病歷管理新的理念。培訓病歷管理專業人才。普及暨交流國際病歷管理知識。,入會費、常年會費、事業費、會員捐款、委託收益、基金及其孳息、其他收入,內政部中華民國八十六年六月二十六日台內社字第八六一七一六一號函,永久,300000.00,1,1100706,,1100713,,理、監事印鑑。,,,,
110法登他001028,1,2,楊志純,1221,1100702,1100712,1100712,52冊1頁,1,11,江國林,財團法人台北市安親慈善基金會,0760914,台北市松山區民權東路5段18號5樓,以推行社會福利及慈善事業為目的。,捐助。,台北市政府社會局七十六年八月二十四日　北市社（四）字第三九六五五號函,永久,1000000.00,1,1100712,1100816,1100719,,"繼任董事印鑑。
捐助章程第5條、第9條至第24條、第8條經本院110年度法字第123號民事裁定准予變更；第1條、第6條、第7條、第25條經董事會決議通過修正，報經主管機關許可變更。",,,,
110法登他001029,2,2,楊志純,3203,1100702,1100706,1100706,150冊73頁,2,,許鈴裕,社團法人國際扶輪3482地區,1070823,台北市中正區衡陽路130號4樓,扶輪是結合全世界及專業的領導人士的一種組織，提供博愛的服務，在職業方面鼓勵崇高的道德標準，並幫助建立世界的親善與和平。,入社費、常年社費、事業費、社員捐款、委託收益、基金及其孳息、社會各界之捐款、其他收入,臺北市政府社會局中華民國106年4月24日北市社團字第10635840200號函,永久,1255388.00,1,1100706,1101214,1100713,,理、監事印鑑。,,,,
110法登他001030,1,2,楊志純,1373,1100702,1100708,1100708,57冊9頁,1,16,王錫福,財團法人國立臺北科技大學文教基金會,0780518,台北市大安區忠孝東路3段1號,以鼓勵國立臺北科技大學師生及學界人士致力研究，使蔚成風氣以提升學術與科技水準為宗旨。,由企業界及國立臺北科技大學校友、學生、學生家長及教職員等捐助,"教育部七十八年四月二十一日  台（七八）高字第一七八三三號函",永久,74108587.00,1,1100708,1100816,1100719,,繼任董事印鑑。,,,,
110法登他001031,2,2,楊志純,1576,1100705,1100706,1100706,69冊45頁,2,16,李岳峻,社團法人台北市松江扶輪社,0970820,台北市大安區仁愛路4段345巷4弄36號4樓,本社之宗旨在於鼓勵並培養以服務之理想為可貴事業之基礎。,入會費、常年會費、會員捐款、基金及其孳息、其他收入,臺北市政府社會局中華民國95年10月2日北市社一字第09540126500號函,永久,491268.00,1,1100706,1101214,1100713,,理、監事印鑑。,,,,
110法登他001032,2,2,楊志純,76,1100705,1100712,1100712,3冊80頁,2,,邱群傑,社團法人台北市稻江扶輪社,0761110,台北市中山區中山北路1段53巷20號5樓7室,本社之宗旨在於鼓勵並培養以服務之理想為事業之基礎，增進社會之福祉，提高地域文化之水準，並進而增進國際間之瞭解、親善與和平。,社員會費收入、社員樂捐收入、孳息收入、其他收入,臺北市政府社會局中華民國76年9月26日北市社一字第45413號函,永久,1170560.00,1,1100712,1100816,1100719,,理、監事印鑑。,,,,
110法登他001033,2,2,楊志純,2324,1100705,1100706,1100706,106冊77頁,2,9,蔡禮信,社團法人臺北市洲美扶輪社,1020718,台北市大安區仁愛路4段345巷4弄36號4樓,本社之宗旨在於鼓勵並培養以服務之理想為可貴事業之基礎。,入會費、常年會費、會員捐款、基金及其孳息、其他收入,臺北市政府社會局中華民國102年6月26日北市社團字第10239352100號函,永久,287197.00,1,1100706,1101214,1100713,,理、監事印鑑。,,,,
110法登他001034,2,2,楊志純,2835,1100705,1100712,1100712,132冊41頁,2,,唐立成,社團法人台北市清溪扶輪社,1050729,台北市大安區仁愛路4段345巷4弄36號4樓,鼓勵並培養以服務之理想為可貴事業之基礎為宗旨。,入會費、常年會費、會員捐款、基金及其孳息、其他收入,臺北市政府社會局中華民國88年1月25日北市社一字第8820320000號函,永久,500000.00,1,1100712,1100908,1100719,,理、監事印鑑。,,,,
