登記案號,類別,案由,主任,登記號數,收件日期,登記日期,公告日期,登記簿,任期判定,屆期判定,法人代表,法人名稱,設立登記日期,主事務所,目的,捐助方法,許可機關日期,存立時期,財產總額,結案原因,結案日期,歸檔日期,發證日期,清算人,變更原因,註銷日期,撤銷日期,撤(註)銷機關文號,撤(註)銷原因
110法登他001543,2,2,楊志純,1035,1101020,1101021,1101021,42冊21頁,2,10,顏家鈺,社團法人中華工程教育學會,0921210,台北市中山區林森北路554號7樓,以研究、推廣工程及科技教育，培育專業人才，服務社會，促進國家經濟發展。,入會費、常年會費、事業費、捐款、委託收益、基金及其孳息、其他收入,內政部中華民國九十二年八月一日台內社字第０九二００七二六五一號函,永久,40200.00,1,1101021,,1101028,,理、監事印鑑。,,,,
110法登他001544,2,2,楊志純,2790,1101020,1101021,1101021,130冊21頁,2,2,林文達,社團法人臺北市林培生派下宗親會,1050420,台北市大安區敦化南路2段105號10樓,本會以敦親睦族，慎終追遠，發揚固有道德及族謀取宗親福利為宗旨。,會員入會費、宗親自由樂捐、會費存款孳息收入、其他辦理活動合法收入,臺北市政府社會局中華民國105年3月21日北市社團字第10534308000號函,永久,10000.00,1,1101021,,1101029,,理、監事印鑑。,,,,
110法登他001545,1,2,楊志純,121,1101020,1101021,1101021,9冊7頁,2,16,王傳亮,財團法人新北市私立莊敬高級工業家事職業學校,0491120,新北市新店區民生路45號,遵照國家現行法令之規定，為辦理莊敬高級工業家事職業學校、托育及幼兒園、職業訓練及教育推廣等相關業務，並謀其健全發展之目的,創辦人由韓克溫及董事王顯庭、郭原勳等捐贈,台灣省教育廳四十八年八月卅一日　教二字第０三０八六號函,永久,1054726479.00,1,1101021,,1101028,,董事、監察人印鑑。,,,,
110法登他001546,1,2,楊志純,2917,1101020,1101021,1101021,119冊61頁,2,9,王美琦,財團法人台北市自閉兒社會福利基金會,0940721,台北市松山區八德路4段306號8樓,以促進社會福利之發展，並推行各項社會福利服務為宗旨。依照身心障礙者保護法及其他有關法令之規定，以辦理社會福利慈善事業為目的。,由臺北市自閉症家長協會捐助,臺北市政府社會局中華民國94年6月7日北市社三字第09435652900號函,永久,10000000.00,1,1101021,1101215,1101029,,董事、監察人印鑑（其中董事陳金源係採簽名式）。,,,,
110法登他001547,1,2,楊志純,2222,1101021,1101021,1101021,85冊58頁,1,8,王以倫,財團法人東吳企管文教基金會,0880504,台北市中正區延平南路129巷4號東吳大學企管系辦公室,以結合企管系系友及有關之力量，協助東吳大學企管系之發展為目的。,由謝子仁等捐助,台北市政府教育局中華民國八十八年四月十六日北市教六字第八八二二０六四０００號函,永久,5000000.00,1,1101021,,1101028,,繼任董事印鑑。,,,,
110法登他001548,1,2,楊志純,2845,1101021,1101022,1101022,116冊13頁,2,5,卓永財,財團法人上銀科技教育基金會,0990304,台中市南屯區文山里精科路7號,本會藉由各項教育與獎助活動，以促進我國工業水準之提升為宗旨。,由上銀科技（股）公司、卓永財、蔡惠卿、卓文恒、卓秀瑜等共同捐助,臺中市政府中華民國99年1月4日府教社字第0980346211號函,永久,164954535.00,1,1101022,1101215,1101029,,董事印鑑。,,,,
110法登他001549,1,2,楊志純,1652,1101021,1101021,1101021,66冊35頁,1,9,郭建中,財團法人金融聯合徵信中心,0810518,台北市中正區重慶南路1段2號10樓,以建置全國性信用資料庫，提供經濟主體信用紀錄及營運財務資訊予會員查詢利用，增進我國金融業徵信功能，促進徵信技能發展，確保信用交易安全，提升全國信用制度健全發展，提供主管機關金融監理所需資訊為宗旨。,銀行公會原始捐助及逐年將入會費收入、基金孳息收入、業務收支結餘等滾入,財政部八十一年四月二十日　台財融字第八一０一五四六二四號函,永久,5100000000.00,1,1101021,,1101028,,捐助章程第12條經董事會決議通過變更，報經主管機關同意備查。,,,,
110法登他001550,1,2,楊志純,960,1101021,1101022,1101022,43冊17頁,2,13,葉炳強,財團法人天主教康泰醫療教育基金會,0710830,台北市大安區羅斯福路3段245號8樓,以幫助民眾及病友能獲得衛生教育諮詢及其他社會福利為目的。,捐助,行政院衛生署中華民國71年5月21日衛署醫字第378985號函,永久,3000000.00,1,1101022,1101215,1101029,,董事印鑑。,,,,
110法登他001551,1,2,楊志純,3025,1101021,1101028,1101028,125冊13頁,1,2,沈　正,基督教華神學校財團法人,1030121,台北市中正區汀州路3段101號,推動神學教育、研究及相關事項。,由財團法人基督教中華福音神學基金會捐助,教育部中華民國102年10月24日臺教高（三）字第1020153864號函,永久,982846231.00,1,1101028,,1101104,,繼任董事印鑑。,,,,
110法登他001552,2,2,楊志純,2978,1101021,1101022,1101022,139冊53頁,2,2,廖東漢,社團法人臺北市福泰排球運動發展協會,1060704,台北市松山區長春路343號Ｂ1,推廣以排球運動為基礎的全民運動，讓社會大眾養成持續規律而定量的運動生活習慣為宗旨。,入會費、常年會費、會員捐款、委託收益、基金及其孳息、其他收入,臺北市政府社會局中華民國106年6月21日北市社團字第10638751700號函,永久,10000.00,1,1101022,,1101029,,理、監事印鑑。,,,,
110法登他001553,1,2,楊志純,1317,1101021,1101022,1101022,55冊17頁,1,16,悟覺妙天,財團法人世界領袖教育和平基金會,0770912,新北市新店區屈尺里櫻花街33號,以推廣全人教育，終身學習及溫馨校園之原則，培養國家人才，促進世界和平與福祉為宗旨。,由黃國倫、蘇永安等先生捐助,"教育部七十七年七月十五日  台（七七）高字第三二七三三號函",永久,10000000.00,1,1101022,,1101029,,捐助章程第5條經臺灣臺北地方法院110年度法字第225號民事裁定准予變更。捐助章程第15條經董事會決議通過變更，報經主管機關許可變更。,,,,
110法登他001554,1,2,楊志純,2232,1101022,1101022,1101022,85冊88頁,2,7,谷　正,財團法人台北市法自然文教基金會,0880531,台北市中正區寧波西街40巷5號,以「提供中國傳統經史文集之資料蒐集暨傳統經史文籍之生活化、現代化之研究發展，以俾益國人對傳統文化有更深刻的認識」為目的。,由谷黃金葉女士捐助,台北市政府教育局中華民國八十八年四月三十日北市教六字第八八二二三六七七００號函,永久,5000000.00,1,1101022,1101215,1101029,,董事印鑑。,,,,
110法登他001555,2,2,楊志純,3249,1101022,1101101,1101101,153冊17頁,2,,楊庭嘉,社團法人台灣醫學生聯合會,1071122,台北市中正區仁愛路1段1號,以聯合全國醫學生，維護共同權益，增進社會參與，並推動資訊及情感交流為宗旨。,入會費、常年會費、事業費、會員捐款、委託收益、基金及其孳息、其他收入,內政部中華民國91年3月8日台內社字第0910007716號函,永久,1500000.00,1,1101101,,1101109,,"理、監事印鑑。
章程第1條、第4條、第5條、第7條、第13條至第18條、第22條至第25條、第29條、第30條、第32條經會員大會決議通過修正，報經主管機關予以備查。",,,,
110法登他001556,1,2,楊志純,2428,1101022,1101026,1101026,95冊21頁,1,7,林敦仁,財團法人德山教育基金會,0900904,台北市松山區八德路2段374號10樓之1,以推動教育發展，增進社會公益為宗旨。,由林登山先生捐助,教育部中華民國九十年八月三十日台(九０)社(四)字第九０一二四六三一號函,永久,48850000.00,1,1101026,1101215,1101103,,,,,,
110法登他001557,2,2,楊志純,3632,1101022,1101025,1101025,172冊29頁,1,1,衣冠英,社團法人台灣經典保時捷協會,1090610,台北市信義區嘉興街180號3樓,以推動「公益愛心活動」來為弱勢團體奉獻發聲為主要目標。增進會員彼此之間的活動聯誼，以期待會員們可以互助，互利，並經典保時捷車輛買賣與維修經驗彼此分享，以回饋社會奉獻愛心為最大宗旨。,入會費、常年會費、事業費、會員捐款、委託收益、基金及其孳息、其他收入,內政部中華民國109年4月23日台內團字第1090023433號函,永久,0.00,1,1101025,,1101102,,繼任理事印鑑。,,,,
110法登他001558,1,2,楊志純,3219,1101022,1101025,1101025,134冊69頁,2,2,蔡玉葉,財團法人桂田文化藝術基金會,1071130,台北市大安區忠孝東路4段169號11樓之1,以文化藝術為宗旨,設立基金共新台幣壹仟萬元整，由慶欣欣鋼鐵股份有限公司捐助；俟依法完成法人登記後，得繼續接受捐贈,臺北市政府文化局中華民國107年10月26日北市文化文創字第1076007049號函,永久,10000000.00,1,1101025,1101215,1101101,,"董事印鑑。
原捐助章程第6條、第7條經本院110年度法字第226號民事裁定准予變更；第18條經董事會決議通過修正，報經主管機關同意變更。",,,,
110法登他001559,1,2,楊志純,2216,1101022,1101025,1101025,85冊40頁,1,8,周光宙,財團法人台灣建築中心,0880419,新北市新店區民權路95號3樓,以接受內政部建築研究所、營建署、消防署及其他政府機關之輔導辦理建築、消防及有關都市發展之評定審查、評鑑及具自償性、技術性、服務性等業務；辦理建築及消防相關檢驗、測試業務。,由內政部建築研究所等七個單位共同捐助,內政部中華民國八十八年三月三十一日台(88)內營字第八八０三五七八號函,永久,49809900.00,1,1101025,,1101102,,繼任董事印鑑。,,,,
110法登他001560,1,2,楊志純,1869,1101022,1101025,1101025,73冊76頁,1,9,林傳凱,財團法人臺北市傳德慈善基金會,0840530,台北市中山區中山北路3段27號8樓之5,以舉辦、贊助或捐助（贈）臺北市社會福利慈善事業為目的。,由劉玉玲、林傳凱、林傳捷捐助,"台北市政府教育局八十四年五月二十二日  北市教四字第二一一七六號函",永久,10000000.00,1,1101025,1101215,1101101,,繼任董事印鑑。,,,,
110法登他001561,1,2,楊志純,1276,1101022,1101025,1101025,53冊55頁,2,12,吳迎春,財團法人天下雜誌股份有限公司職工福利委員會,0770421,台北市中山區南京東路二段一三九號十一樓,加強職工福利業務的推動。,由天下雜誌「股」公司提撥,台北市政府勞工局七十七年四月九日北市勞三字第四一七九號函,永久,1050000.00,1,1101025,,1101102,,董事印鑑。,,,,
110法登他001562,1,2,楊志純,1747,1101022,1101026,1101026,69冊45頁,2,9,黃禎祥,財團法人臺灣省私立健順養護中心,0821125,新北市深坑區昇高里王軍寮9號,以辦理老人福利或社會福利慈善事業為目的。,由黃阮粹蘭、黃康月滿、黃尊景、黃禎祥、黃禎憲、黃慧筠、林雅文,八十二年十一月五日台灣省政府社會處　（八二）社五字第五四六八六號函,永久,56769466.00,1,1101026,1101215,1101103,,董事印鑑。,,,,
110法登他001563,3,2,楊志純,3443,1101022,1101105,1101105,162冊73頁,2,,柯文哲,台灣民眾黨,1080916,台北市中正區杭州南路1段27號2樓,本黨宗旨為台灣的整體利益及民眾的最大福祉，並確認民主、自由、多元、開放、法治、人權、關懷弱勢、永續經營之普世價值在台灣得以具體實現。,一、黨費。二、依法收受之政治獻金。三、政黨補助金。四、政黨為宣揚理念或從事活動宣傳所為之出版品、宣傳品銷售或其權利授與、讓與所得之收入。五、其他依政黨法規定所得之收入。六、由前五款經費及收入所生之孳息,內政部中華民國108年8月23日台內民字第10800528841號函,永久,0.00,1,1101105,,1101112,,"中央委員林富男、劉瑋、楊博宇、孫正華、中央評議委員吳亭蓁、羅靖為印鑑，其餘委員簽名式。
黨章第3條、第4條、第8條至第18條、第20條、第21條、第24條至第26條經黨員代表大會決議通過變更，報經主管機關已予備案。",,,,
110法登他001564,1,2,楊志純,228,1101022,1101025,1101025,16冊15頁,1,19,楊宏志,財團法人豐年社,0531120,台北市大安區溫州街14號1樓,本社以協助政府宣導農業，服務農民，加強消費者對本土農業的認識為設立目的,由行政院農業委員會等捐助,經濟部五十三年十月二十七日　經台（五三）農字第一七五九六號,永久,23514871.00,1,1101025,1101215,1101101,,繼任董事印鑑。,,,,
110法登他001565,2,2,楊志純,1890,1101025,1101025,1101025,85冊21頁,2,4,劉孝偉,社團法人臺北市三一全人關懷協會,0991202,台北市萬華區青年路142號,本會以耶穌基督的大愛，並教會系統各樣人力、物力資源來關懷、服務、濟助社會弱勢族群或個人。從少年人到老年人，從生理到心理，以達成全人關懷，並以各樣慈惠工作及活動來匡正人心促成健康的社會為宗旨。,入會費、常年會費、會員捐款、委託收益、基金及其孳息,臺北市政府社會局中華民國99年10月28日北市社團字第09944515100號函,永久,2928411.00,1,1101025,,1101102,,理、監事印鑑。,,,,
110法登他001566,1,2,楊志純,2067,1101025,1101025,1101025,80冊43頁,2,7,陳夏珠,財團法人伽耶山基金會,0861128,台北市中正區濟南路2段36號1樓,以住持正法為宗旨，稟持悲願、力行、和合的理念，實踐佛陀的悲懷，從事各種有益眾生的事業，淨化人間。,由陳夏珠、鄭美慧等九人捐助,內政部八十六年十月廿九日　台內民字第八六八五九六七號函,永久,112757335.00,1,1101025,1101215,1101101,,董事印鑑。,,,,
110法登他001567,1,2,楊志純,16,1101025,1101026,1101026,2冊6頁,1,6,洪維國,財團法人台灣電信協會,0401108,台北市中正區信義路1段21之3號,以創辦或投資電信相關事業，協助發展電信業務，推動電信或社會相關公益事務，及協助或支援政府辦理各項事務為宗旨,繼受原財團法人台灣遞信協會及原交通局遞信職員共濟組合所屬財產,交通部電信總局四十年九月三日　台字第九九六號令,永久,1023892796.00,1,1101026,,1101102,,繼任監察人印鑑。,,,,
110法登他001568,1,2,楊志純,1720,1101025,1101026,1101026,68冊51頁,2,8,張裕能,財團法人甲桂林文教基金會,0820528,台北市民權東路3段4號4樓,以舉辦或贊助文化藝術公益業務為宗旨。,由甲桂林廣告股份有限公司等共同捐助,"八十二年五月二十二日教育部  台八二社字第０二八０六七號函",永久,12000000.00,1,1101026,1101215,1101103,,董事印鑑。,,,,
110法登他001569,2,2,楊志純,2855,1101025,1101026,1101026,133冊41頁,2,5,鄭伊婷,社團法人中華民國學前教育發展學會,0980406,新北市新店區安祥路106巷214號,以保障幼兒及兒童福利，發展幼兒及兒童教育及照顧等工作為宗旨。,入會費、常年會費、事業費、會員捐款及補助收入、委託收益、孳息收入、其他收入,內政部中華民國98年3月9日台內社字第0980043877號函,永久,1000.00,1,1101026,,1101102,,理、監事印鑑。,,,,
110法登他001570,1,2,楊志純,3148,1101025,1101026,1101026,131冊25頁,2,6,吳康文,財團法人臺北市安和社會福利慈善事業基金會,0950817,台北市大安區復興南路2段363號6樓,以辦理社會福利慈善事業為目的。,由許新枝等捐助新台幣壹仟萬元成立，嗣後繼續接受捐贈,臺北市政府社會局中華民國95年7月21日北市社二字第09537522800號函,永久,14122446.00,1,1101026,1101215,1101103,,董事、監察人印鑑。,,,,
110法登他001571,2,2,楊志純,1891,1101025,1101026,1101026,85冊25頁,1,3,吳榮家,社團法人中華迦拿婚姻家庭成長協會,0991202,台北市信義區吳興街106巷14號1樓,透過從事婚前、婚姻／家庭教育、關懷陪伴，幫助人建立健康幸福的婚姻與家庭。,入會費、常年會費、事業費、會員捐款、委託收益、基金及其孳息、其他收入,內政部中華民國99年10月19日台內社字第0990207710號函,永久,10000.00,1,1101026,,1101102,,繼任理事印鑑。,,,,
110法登他001572,1,2,楊志純,2585,1101025,1101026,1101026,103冊9頁,2,7,林榮耀,財團法人台北市林榮耀教授學術教育基金會,0930312,台北市中正區南昌路2段70號2樓之9,以推展生物醫學研究相關之學術活動和教育為目的。,由林榮耀教授等人捐助,臺北市政府教育局中華民國九十三年二月二十五日北市教六字第０九三三一四０四三００號函,永久,5503249.00,1,1101026,1101215,1101103,,董事印鑑。,,,,
110法登他001573,1,2,楊志純,2965,1101025,1101026,1101026,122冊13頁,2,4,黃靖貽,財團法人臺北市三幸慈善基金會,1011109,台北市中山區林森北路372號7樓,本基金會以辦理臺北市社會福利及慈善為目的,由三幸投資股份有限公司、黃友三、簡幸、黃靖貽、黃一倉、黃筱瑜、黃明倉等人共同捐助,臺北市政府社會局中華民國101年10月30日北市社團字第10144620800號函,永久,10000000.00,1,1101026,,1101102,,新任董事印鑑。,,,,
110法登他001574,1,2,楊志純,1117,1101026,1101026,1101026,48冊31頁,2,8,陳嘉文,財團法人明台產物保險股份有限公司職工福利委員會,0740809,台北市大安區仁愛路4段1號,舉辦員工福利為目的。,創立時就資本總額提撥百分之五、就每月營業收入總額提撥百分之0.05~百分之0.15、每月於每個職工薪津內各扣百分之0.5、下腳變賣時提撥百分之40,台北市政府社會局中華民國七十四年七月四日北市社二字第二八六二一號函,永久,5881564.57,1,1101026,1101215,1101103,,新任董事印鑑。,,,,
110法登他001575,1,2,楊志純,2382,1101026,1101026,1101026,92冊77頁,2,6,葉義雄,財團法人台北市大將開發公益慈善基金會,0900102,台北市大安區敦化南路2段71號6樓,以辦理社會救助及急難救助為目的，藉以提昇民眾社會福利，並營造一個溫馨和諧的社會。,由大維投資股份有限公司、雙喜投資股份有限公司共同捐助,臺北市政府社會局中華民國八十九年十月三十日北市社二字第八九二七八二三六００號函,永久,10000000.00,1,1101026,,1101102,,"董事印鑑。
捐助章程第8條經臺灣臺北地方法院110年度法字第223號民事裁定准予變更。捐助章程第27條經董事會決議通過變更，報經主管機關予以許可。",,,,
110法登他001576,2,2,楊志純,2749,1101026,1101111,1101111,128冊17頁,2,4,張希慈,社團法人國際城市浪人育成協會,1050128,台北市中正區重慶南路3段2號302室,本會旨在使人們更清楚了解自己在群體中的生命價值，培養人們跨出舒適圈的習慣和能力，藉此強化社會內部互動，增加人群之間的互信和互助的能力。,入會費、常年會費、事業費、會員捐款、委託收益、基金及其孳息、其他收入,內政部中華民國104年9月25日台內團字第1040070197號函,永久,297496.00,1,1101111,,1101119,,新任理、監事印鑑。,,,,
110法登他001577,1,2,楊志純,3171,1101026,1101026,1101026,132冊37頁,2,2,林盈秀,財團法人小小幸福基金會,1060928,台北市中山區吉林路218巷18號1樓,以社會福利慈善事業為目的。,由溫健鈞捐助成立,衛生福利部中華民國106年9月11日衛授家字第1060019507號函,永久,30000000.00,1,1101026,,1101102,,董事印鑑。,,,,
110法登他001578,2,2,楊志純,3676,1101026,1101027,1101027,174冊45頁,1,,王清峰,社團法人中華民國紅十字會,1090909,台北市萬華區艋舺大道303號,依照我國法令、日內瓦公約及國際紅十字會議所決議各項原則，以發展博愛服務事業為宗旨。,入會費、常年會費、會員捐款、委託收益、基金及其孳息、其他收入,內政部中華民國109年9月2日台內團字第1090131366號函,永久,1000.00,1,1101027,,1101103,,"原章程第36條經會員大會決議通過修正變更，報經主管機關予以備查。
理事陳宏一、林聖芬印鑑變更。",,,,
110法登他001579,1,2,楊志純,1067,1101026,1101027,1101027,46冊51頁,2,12,杜一郎,財團法人台北市真如苑社會福利事業基金會,0730820,台北市中山區堤頂大道2段486號,本財團本人溺己溺精神以辦理社會救助，濟世利人，喚起國人對社會福利之重視，增進家庭圓滿提高社會安和幸福為目的，並以臺北市為執行業務區域。,捐助,台北市政府社會局七十三六月二十三日北市社四字第二三九七四號函,永久,45000000.00,1,1101027,,1101104,,董事印鑑。,,,,
110法登他001580,2,2,楊志純,2295,1101027,1101027,1101027,105冊41頁,2,4,李茂生,社團法人台灣冤獄平反協會,1010824,台北市大安區辛亥路2段165號7樓,以監督政府暨司法機關對於正當法律程序及實質正義，並追求憲法保障基本人權為宗旨。,入會費、常年會費、事業費、捐款、委託收益、基金及其孳息、其他收入,內政部中華民國101年7月20日台內社字第1010254848號函,永久,10255.00,1,1101027,,1101103,,新任理事印鑑。,,,,
110法登他001581,1,2,楊志純,71,1101027,1101118,1101118,5冊27頁,2,40,各董事,財團法人大同股份有限公司職工福利委員會,0480202,台北市中山區中山北路3段22號,為謀全體同仁之權益及推行各項福利業務，促進同仁生活，以實現民生主義之理想。,由大同製鋼機械股份有限公司及所屬職工依職工福利金條例提撥福利金、接收其他捐款,中華民國四十三年八月,永久,1651153.00,1,1101118,,1101125,,"董事印鑑。
組織章程第11條經臺灣臺北地方法院110年度法字第218號民事裁定准予變更。",,,,
110法登他001582,1,2,楊志純,547,1101027,1101029,1101029,29冊29頁,2,18,各董事,財團法人大同聯合職工福利委員會,0621105,台北市中山區中山北路3段22號,為謀大同股份有限公司所屬各投資公司全體同仁權益及推行各項福利業務，促進同仁智能，改善同仁生活，以實行民生主義的理想,資本額提撥,台北市政府社會局中華民國五十八年三月三十一日,永久,51990148.00,1,1101029,1101215,1101105,,"董事印鑑。
原捐助章程第4條、第6條及原組織章程第2條、第9條修正經本院110年度法字第217號民事裁定准予變更。",,,,
110法登他001583,1,2,楊志純,3261,1101027,1101028,1101028,136冊77頁,1,1,陳添壽,財團法人農業保險基金,1091228,台北市中正區金山南路1段70-1號,以推動農業保險、承擔與分散保險人承保之農業保險危險，並負責執行主管機關建立之危險分散機制為設立目的。,由行政院農業委員會捐助,行政院農業委員會中華民國109年12月23日農金字第1095085650號函,永久,20000000.00,1,1101028,,1101104,,"繼任董事印鑑。
捐助章程第9條、第10條、第18條經臺灣臺北地方法院110年度法字第219號民事裁定准予變更。",,,,
110法登他001584,1,2,楊志純,2487,1101027,1101029,1101029,98冊17頁,2,11,林穎曾,財團法人立夫醫藥研究文教基金會,0781229,台北市大安區信義路4段279號5樓,以協助發展中國醫藥研究、文化、教育及各資訊傳播工作等有關事項之發揚推廣為宗旨。,由陳立夫先生捐助,教育部中華民國七十八年十月六日台(78)社字第四八八九四號函,永久,30000000.00,1,1101029,1101215,1101105,,繼任董事印鑑，連任董事黃石城、陳春發印鑑變更。,,,,
110法登他001585,2,2,楊志純,3925,1101027,1101028,1101028,187冊1頁,2,6,陳鴻基,社團法人台灣服務科學學會,1000420,台北市中山區樂群二路267號7樓之1,本會為依法設立、非以營利為目的之社會團體，本會宗旨期以透過發展臺灣服務科學社群，匯聚產官學研的能量，推動「服務科學與服務創新」紮根與推廣工作，提升臺灣的服務經濟競爭力，增進社會幸福與永續發展。,會員繳納會費或其他捐款,內政部中華民國100年3月3日台內社字第1000039319號函,永久,100.00,1,1101028,,1101104,,"理、監事印鑑。
章程第23條、第30條經會員大會決議通過變更，報經主管機關予以備查。",,,,
110法登他001586,1,2,楊志純,2491,1101027,1101103,1101103,98冊33頁,1,7,何明果,財團法人私立學校興學基金會,0910822,台北市中山區中山北路3段40號,以鼓勵及處理各界對私立學校之捐助為宗旨。,由教育部、中華民國私立大學校院協進會、中華民國私立教育事業協會、中華民國私立學校文教協會共同捐助,教育部中華民國91年8月12日台（91）社（四）字第91119815號函,永久,30500000.00,1,1101103,1101215,1101110,,繼任董事印鑑。,,,,
