登記案號,類別,案由,主任,登記號數,收件日期,登記日期,公告日期,登記簿,任期判定,屆期判定,法人代表,法人名稱,設立登記日期,主事務所,目的,捐助方法,許可機關日期,存立時期,財產總額,結案原因,結案日期,歸檔日期,發證日期,清算人,變更原因,註銷日期,撤銷日期,撤(註)銷機關文號,撤(註)銷原因
110法登他000001,1,2,楊志純,2033,1100104,1100106,1100106,79冊28頁,1,9,李文忠,財團法人榮民榮眷基金會,0860718,台北市信義區忠孝東路5段159號6樓,以亡故現役軍人或退除役官兵在大陸地區繼承人申請遺產之核發、榮民重大災害之救助、清寒榮民子女教育獎助學金及教育補助、其他有關榮民、榮眷福利及服務。,依臺灣地區與大陸地區人民關係條例第六八條第四項規定所捐助之遺產,行政院國軍退除役官兵輔導委員會八十六年七月九日(86)輔壹字第一三八五五號函,永久,2321899779.00,1,1100106,1101013,1100114,,捐助章程第5條、第7條、第11條、第13條、第19條、第22條經臺灣臺北地方法院109年度法字第1209號民事裁定准予變更。捐助章程第3條經董事會決議通過變更，報經主管機關同意變更。,,,,
110法登他000002,2,2,楊志純,3349,1100104,1100105,1100105,158冊17頁,1,1,王昭舜,社團法人中華民國偏鄉學子圓夢公益協會,1080425,台北市中正區北平東路28號8樓,為以落實偏鄉教育平衡發展，提升偏遠地區教育品質；提供偏遠學童課業輔導，拓展偏遠地區學童國際視野；舉辦各項圓夢公益服務計畫，協助偏鄉學子圓夢實現與滿足為宗旨,入會費、常年會費、事業費、會員捐款、委託收益、基金及其孳息、其他收入,內政部中華民國108年4月2日台內團字第1080012231號函,永久,50000.00,1,1100105,1100227,1100113,,繼任理、監事印鑑（其中常務監事王健宇採簽名式）。,,,,
110法登他000003,1,2,楊志純,3033,1100104,1100122,1100122,125冊45頁,1,3,黃志誠,財團法人黃克銘健康基金會,1030423,台北市中山區松江路433號13樓,推動營養保健與預防醫學之社會教育與研究發展等工作。,由黃志誠先生捐助,衛生福利部中華民國103年4月15日衛部醫字第1031662073號函,永久,10000000.00,1,1100122,,1100129,,捐助章程第6條、第8條、第10條、第11條、第12條、第14條、第17條、第18條經臺灣臺北地方法院109年度法字第785號民事裁定准予變更。捐助章程第1條、第5條、第7條、第15條、第16條、第19條、第20條、第21條、第22條經董事會決議通過變更，報經主管機關許可變更。,,,,
110法登他000004,1,2,楊志純,2859,1100104,1100105,1100105,116冊69頁,1,6,李天任,財團法人中華民國私立學校教職員退休撫卹離職資遣儲金管理委員會,0990622,台北市中正區愛國東路22號10樓,財團法人中華民國私立學校教職員退休撫卹離職資遣儲金管理委員會依學校法人及其所屬私立學校教職員退休撫卹離職資遣條例第四條第二項規定設立，受教育部委託辦理退休撫卹離職資遣儲金之收支、管理、運用、審議與退休、撫卹、離職及資遣審定事宜。,由全國私立學校捐助,教育部中華民國99年3月9日台人（三）字第0990015722號函,永久,10000000.00,1,1100105,1100219,1100113,,繼任董事印鑑。,,,,
110法登他000005,1,2,楊志純,1772,1100104,1100106,1100106,70冊52頁,2,10,胡世賢,財團法人臺北市私立恆安老人長期照顧中心（長期照護型）,0830311,台北市萬華區水源路187號,以舉辦或捐助（贈）社會福利慈善事業為目的。,王傳淵、陳敏雄、胡世賢、王傳芳、柳富藏、陳根火、謝朝宗等先生捐助,台北市政府社會局八十三年一月三十一日　北市社四字第五一五０號函,永久,20250000.00,1,1100106,,1100114,,"董事印鑑。
捐助章程第5條至第13條經臺灣臺北地方法院109年度法字第1122號民事裁定准予變更。捐助章程第1條至第4條、第14條、第15條經董事會決議通過變更，報經主管機關同意備查。",,,,
110法登他000006,1,2,楊志純,2232,1100105,1100105,1100105,85冊88頁,1,6,谷　正,財團法人台北市法自然文教基金會,0880531,台北市中正區寧波西街40巷5號,以「提供中國傳統經史文集之資料蒐集暨傳統經史文籍之生活化、現代化之研究發展，以俾益國人對傳統文化有更深刻的認識」為目的。,由谷黃金葉女士捐助,台北市政府教育局中華民國八十八年四月三十日北市教六字第八八二二三六七七００號函,永久,5000000.00,1,1100105,1100219,1100113,,捐助章程第5條、第6條、第7條、第8條、第9條、第11條、第12條、第13條、第14條、第15條經本院109年度法字第1213號民事裁定准予變更；捐助章程第1條至第4條、第10條、第16條、第17條經董事會決議通過修正，報經主管機關准予變更。,,,,
110法登他000007,1,2,楊志純,552,1100105,1100106,1100106,29冊39頁,1,17,楊永祥,財團法人國立台北科技大學校友奬助基金會,0621126,台北市大安區八德路2段10巷6號5樓,發揚台北工專校友間之情感親睦與互助精神、增進前後期友好關係奬學協助養成優秀建設人才、啟發智慧研究科學發展工業、配合國策謀求社會福利。,贊同本會宗旨之校友捐助之,"台北市政府教育局六十二年十一月十三日  六二北市教四字第０三五號函",永久,5000000.00,1,1100106,1101013,1100114,,繼任監事印鑑。,,,,
110法登他000008,1,2,楊志純,1297,1100105,1100105,1100105,54冊37頁,2,11,陳啟清,財團法人台北市基督教全人福利事業基金會,0770708,台北市信義區吳興街269巷18弄8號,以基督之精神，辦理臺北市全人社會福利（慈善）救助、教育及文化事業為目的。,由捐助人捐助。,七十七年六月八日台北市政府社會局　北市社四字第一九六二三號函,永久,1000000.00,1,1100105,1100219,1100113,,"董事印鑑。
原捐助章程第1條至第26條經本院109年度法字第1202號民事裁定准予變更。",,,,
110法登他000009,2,2,楊志純,2892,1100105,1100107,1100107,135冊29頁,1,2,成群傑,社團法人燃點公民平台,1051129,台北市大安區敦化南路2段76號13樓之2,以貢獻公民運動，推動世代正義，攜手追求公平、永續、最大化的社會價值為宗旨。,入會費、常年會費、事業費、會員捐款、委託收益、基金及其孳息、其他收入,內政部中華民國105年11月10日台內團字第1050072967號函,永久,6190000.00,1,1100107,1101214,1100114,,,,,,
110法登他000010,1,2,楊志純,2906,1100105,1100106,1100106,119冊17頁,1,4,林英俊,財團法人臺北市岱宇國際慈善基金會,1000725,台北市中山區松江路111號12樓,本基金會以辦理臺北市慈善為目的。,由岱宇國際股份有限公司捐助,臺北市政府社會局中華民國100年6月30日北市社團字第10039115800號函,永久,51247590.00,1,1100106,1100219,1100113,,,,,,
110法登他000011,2,2,楊志純,3779,1100105,1100209,1100209,179冊57頁,2,2,陳佑誠,社團法人國立臺灣大學農業化學系系友會,1060930,台北市大安區羅斯福路4段1號,凝聚系友情誼，協助本系和系友在學術及事業上之發展，並促進農業化學領域產、官、學、研界資訊交流。,入會費、常年會費、事業費、捐款、委託收益、基金及其孳息暨其他收入,內政部中華民國106年6月17日台內團字第1060051015號函,永久,196897.00,1,1100209,,1100220,,"理、監事印鑑。
章程第4條經會員大會決議通過變更，報經主管機關予以備查。",,,,
110法登他000012,1,2,楊志純,2729,1100105,1100106,1100106,110冊29頁,1,5,蔡松坡,財團法人嘉宜社會福利基金會,0960503,台北市中山區松江路125號3樓,本會以辦理社會福利慈善事業為目的。,由嘉宜投資股份有限公司捐助,內政部中華民國96年4月25日內授中社字第0960700699號函,永久,496072442.00,1,1100106,1100219,1100113,,,,,,
110法登他000013,1,2,楊志純,3008,1100105,1100106,1100106,124冊25頁,1,3,謝玉琳,財團法人海墾社會福利基金會,1020731,台北市中山區松江路146號9樓,本會以辦理社會福利慈善事業為目的。,由明怡投資股份有限公司捐助,內政部中華民國102年7月17日台內社字第1020242440號函,永久,317210000.00,1,1100106,1101013,1100114,,,,,,
110法登他000014,1,2,楊志純,2362,1100105,1100106,1100106,91冊77頁,1,7,陳美貞,財團法人台北市東海社會福利慈善事業基金會,0891113,台北市中正區中華路1段41號12樓,以辦理臺北市社會福利慈善事業為目的。,由徐明年、徐明豐等共同捐助,臺北市政府社會局中華民國八十九年十月三十日北市社二字第八九二七八二三五００號函,永久,19317285.00,1,1100106,1100219,1100113,,,,,,
110法登他000015,2,2,楊志純,159,1100105,1100106,1100106,6冊35頁,2,19,孫立群,社團法人中華民國仁社,0790123,台北市大安區羅斯福路3段285號9樓之2,一、努力福國利民二、增進同仁友愛,會員會費及特捐,"內政部中華民國七十八年十二月二十七日 台（七八）內社字第七六七一七四號函",永久,500000.00,1,1100106,1101214,1100114,,理、監事印鑑。,,,,
110法登他000016,1,2,楊志純,2539,1100105,1100106,1100106,100冊65頁,1,6,黃永仁,財團法人玉山志工社會福利慈善事業基金會,0920422,台北市松山區民生東路3段117號13樓,以辦理社會福利慈善事業為宗旨。,由黃永仁先生等十五人共同捐助,內政部中華民國九十二年四月十日內授中社字第０九二００七二三七０號函,永久,608680556.00,1,1100106,1100219,1100113,,,,,,
110法登他000017,1,2,楊志純,2484,1100105,1100106,1100106,98冊5頁,2,7,林志揚,財團法人多元智能教育發展基金會,0910628,台北市中山區南京東路2段6號8樓,以倡導多元智能教育發展為宗旨。,由財團法人林公熊徵學田捐助,教育部中華民國九十一年六月二十日台（九一）社（四）字第九一０八九三六七號函,永久,30000000.00,1,1100106,1100217,1100114,,董事印鑑。,,,,
110法登他000018,1,2,楊志純,2680,1100106,1100106,1100106,107冊73頁,2,6,王明通,財團法人台北市王黃勉社會福利慈善事業基金會,0950327,台北市中山區大直街46巷28號4樓,以辦理台北市社會福利（慈善）為目的。,由王明通捐助,臺北市政府社會局中華民國95年2月20日北市社二字第09531421700號函,永久,24367710.00,1,1100106,1100219,1100113,,董事印鑑。,,,,
110法登他000019,2,2,楊志純,2977,1100106,1100107,1100107,139冊49頁,2,2,王春玉,社團法人台灣藥學國際發展協會,1060627,台北市中正區愛國西路9號2樓之3,以結合全國藥業，共同促進我國藥界在國際之發展，提升國際地位為宗旨。,入會費、常年會費、事業費、會員捐款、委託收益、基金及其孳息、其他收入,內政部中華民國106年6月9日台內團字第1060038015號函,永久,133302.00,1,1100107,1101214,1100114,,"理、監事印鑑。
章程第7條、第15條、第28條經會員大會決議通過變更，報經主管機關予以備查。",,,,
110法登他000020,1,2,楊志純,2752,1100106,1100106,1100106,111冊41頁,1,5,黄耀興,財團法人台肥基金會,0961030,台北市中山區南京東路2段88號6樓,本會以照顧農民及弱勢族群，並善盡企業社會責任為設立目的。,由台灣肥料股份有限公司捐助,行政院農業委員會中華民國96年9月29日農糧字第0960150518號函,永久,30000000.00,1,1100106,1100227,1100113,,繼任董事印鑑。,,,,
110法登他000021,1,2,楊志純,1742,1100106,1100107,1100107,69冊35頁,2,10,朱鳳芝,財團法人海棠文教基金會,0821109,台北市中正區汀州路2段115之1號5樓,以促進教育文化、福利服務、產業發展之公益事業為宗旨。,由捐助人朱鳳芝無償捐助。,"八十二年十月二十八日教育部  台(八二)社字第０六０二四三號函",永久,10000000.00,1,1100107,1101013,1100114,,董事印鑑。,,,,
110法登他000022,1,2,楊志純,1000,1100106,1100112,1100112,44冊37頁,2,9,鍾聲揚,財團法人基督教以琳書房,0720513,台北市大安區忠孝東路4段206號,出版編譯經售傳揚耶穌基督福音之書籍，雜誌及詩歌講道錄音帶等供應基督徒生命與教會真理之需要。,由章啟明等捐,台北市政府中華民國七十二年一月二十五日（七二）府縣一字第０一八六七號函,永久,2000000.00,1,1100112,1100219,1100120,,董事印鑑。,,,,
110法登他000023,1,2,楊志純,56,1100106,1100107,1100107,4冊27頁,1,22,吳瑞鵬,財團法人基督教美國南長老會台灣差會,0470129,台北市大安區羅斯福路3段269巷3號6樓,基於美國長老教會與台灣基督長老教會之悠久歷史關係，本會以在中華民國台灣境內，宣揚耶穌基督福音，領人歸信基督，推行教育、慈善、社會服務等公益事業為宗旨。,美國鐵納西洲基督教美國南長老會捐助,臺灣省政府四十六年十一月二十七日　府民（一）字第一一三一二九號通知,永久,121300723.00,1,1100107,1101013,1100114,,繼任董事印鑑。,,,,
110法登他000024,2,2,楊志純,1387,1100106,1100111,1100111,60冊9頁,2,8,向家弘,社團法人台灣社造聯盟,0960126,台北市松山區民權東路3段191巷76號1樓,透過組織力量，協力推動社區營造工作。連結社區網路，促成區域整合。參與社會公共事務，與政策進行對話。開拓全面性的社區運動，進行社會改革的實踐。,入會費、常年會費、事業費、會員捐款、委託收益、基金及其孳息、其他收入,內政部中華民國95年8月24日台內社字第0950135856號函,永久,1000.00,1,1100111,1100227,1100118,,理、監事印鑑。,,,,
110法登他000025,1,2,楊志純,694,1100106,1100107,1100107,34冊23頁,2,9,詹志為,財團法人中華基督教禮賢會,0651116,台北市中正區青島東路3號7樓,以建設基督教會，宣傳福音，使萬人得救明白真理，拓展教會傳道、教育、慈善等為宗旨。,中華基督教禮賢會香港區會捐贈,台北市政府民政局中華民國六十五年十月二十日北市民三字第一五九一八號函,永久,29047428.00,1,1100107,1101013,1100114,,董事印鑑。,,,,
110法登他000026,1,2,楊志純,197,1100106,1100107,1100107,14冊13頁,2,23,各董事,財團法人台灣地理資訊中心,0521011,台北市中正區羅斯福路1段7號6樓,本中心以配合政府發展資訊與通訊技術為宗旨。,行政院經濟建設委員會（前行政院國際經濟合作發展委員會）捐助。,經濟部五十二年九月二十五日　經台（五二）統字第一四一三六號函,永久,138500000.00,1,1100107,1100219,1100115,,董事、監察人簽名式。,,,,
110法登他000027,1,2,楊志純,1652,1100106,1100107,1100107,66冊35頁,1,9,郭建中,財團法人金融聯合徵信中心,0810518,台北市中正區重慶南路1段2號10樓,以建置全國性信用資料庫，提供經濟主體信用紀錄及營運財務資訊予會員查詢利用，增進我國金融業徵信功能，促進徵信技能發展，確保信用交易安全，提升全國信用制度健全發展，提供主管機關金融監理所需資訊為宗旨。,銀行公會原始捐助及逐年將入會費收入、基金孳息收入、業務收支結餘等滾入,財政部八十一年四月二十日　台財融字第八一０一五四六二四號函,永久,4800000000.00,1,1100107,1101013,1100114,,繼任監察人印鑑。,,,,
110法登他000028,1,2,楊志純,89,1100107,1100107,1100107,7冊3頁,1,22,潘文炎,財團法人中技社,0481001,台北市大安區敦化南路2段97號8樓,以引進科技新知、培育科技人才，協助國內外經濟建設及增進我國生產事業之生產能力為目的,由發起人捐助。,經濟部四十八年五月廿三日　經台（四八）工字第七七二三號通知,永久,1690863138.00,1,1100107,1100219,1100115,,繼任董事印鑑。,,,,
110法登他000029,1,2,楊志純,2457,1100107,1100107,1100107,96冊57頁,1,10,張景森,財團法人賑災基金會,0910205,新北市新店區北新路3段200號5樓,以運用社會資源，統合民間力量，協助因天然災害受災地區之賑災為目的。,由行政院核定動支90年度第二預備金,內政部中華民國九十一年一月二十一日台內中社字第０九一００七０六三０號函,永久,30000000.00,1,1100107,1101013,1100114,,繼任董事、監察人印鑑。,,,,
110法登他000030,1,2,楊志純,3044,1100107,1100107,1100107,126冊9頁,2,3,李雀美,財團法人仁山社會福利慈善事業基金會,1030822,台北市大安區忠孝東路3段248巷19弄36號,以弘揚和平仁愛精神，舉辦宣教、慈善、社會福利、提昇社會道德等公益事業為宗旨，以辦理社會福利慈善事業為目的。,由林吳珍玉捐助,衛生福利部中華民國103年7月29日部授家字第1030013704號函,永久,31000000.00,1,1100107,1100219,1100115,,董事印鑑。,,,,
110法登他000031,2,2,楊志純,3025,1100107,1100111,1100111,142冊1頁,1,,應堃煇,社團法人台灣長期照護服務發展協會,1060929,台北市中山區民生東路2段119號3樓之3,提升長期照護服務品質，培育長期服務專業人員，促進照顧服務醫療健全發展。,入會費、常年會費、事業費、會員捐款、委託收益、基金及其孳息、其他收入,內政部中華民國101年11月7日台內社字第1010349024號函,永久,53242.00,1,1100111,,1100119,,,,,,
110法登他000032,2,2,楊志純,1511,1100107,1100108,1100108,66冊25頁,2,,王振堂,社團法人台北市生命線協會,0970212,台北市中山區松江路65號11樓,本會基於博愛精神，以服務社會增進人群健全的幸福為宗旨，藉著守候生命線之工作，使因絕望而喪失生機者，獲得生活的勇氣；並輔導有關男女、夫婦、家族、人際、經濟、法律、教育、疾病、心理、生理等問題。,會員入會費、會員常年會費、會員捐款、委託收益、基金及孳息、其他收入,臺北市政府社會局中華民國96年12月5日北市社團字第09643257300號函,永久,31695518.00,1,1100108,1100227,1100115,,理、監事印鑑。,,,,
110法登他000033,1,2,楊志純,1927,1100107,1100111,1100111,75冊70頁,2,10,張家祝,財團法人孫運璿學術基金會,0850521,台北市中正區杭州南路1段69號4樓,以倡導學術研究、促進科技發展、奬勵及培訓優秀人才、協助國家建設為目的,由台灣積體電路及聯華電子股份有限公司共同捐助,"教育部中華民國八十五年五月三日  台(85)社(四)字第八五五０六九九二號函同意設立",永久,120000000.00,1,1100111,1100217,1100119,,董事印鑑。,,,,
110法登他000034,2,2,楊志純,1585,1100107,1100108,1100108,70冊1頁,2,,"Carl Leonard Blundon",社團法人台北市英僑商務協會,0970923,台北市信義區松高路9－11號26樓,本協會之宗旨係促進、推廣及提升商業環境利益及協助本協會會員相互聯繫。,入會費、年費、本協會資金之營利、會員捐款、有關本協會授權項目之服務收入、其他合法收入,臺北市政府社會局中華民國83年5月30日北市社一字第26467號函,永久,1503926.00,1,1100111,1100227,1100118,,理、監事印鑑。,,,,
110法登他000035,2,2,楊志純,2633,1100107,1100505,1100505,122冊33頁,2,4,施世駿,社團法人台灣社會法與社會政策學會,1040529,台北市大安區羅斯福路4段1號（國立臺灣大學國家發展研究所417室）,以研究本國之社會法與社會政策為宗旨，進而提升社會法與社會政策之學術水準，並促進社會法與社會政策教育與學術之國際合作交流。,入會費、常年會費、事業收入、捐贈收入、委託收益、基金及其孳息、其他收入,內政部中華民國103年5月28日台內團字第1030154170號函,永久,2000.00,1,1100505,,1100513,,理、監事印鑑。,,,,
110法登他000036,1,2,楊志純,2929,1100107,1100108,1100108,120冊29頁,1,3,王貴雲,財團法人基督教異象事奉展望會,1001220,台北市松山區民生東路4段54號8樓之10,本法人本於信望愛之精神，以傳揚耶穌基督教義為宗旨。,由財團法人基督教中華信望愛基金會及王貴雲女士與陳徹先生共同捐助。,內政部中華民國100年12月19日台內民字第1000246090號函,永久,603159290.00,1,1100108,1100219,1100115,,,,,,
110法登他000037,1,2,楊志純,1681,1100107,1100111,1100111,67冊33頁,1,6,林文雄,財團法人樂喜文教基金會,0811014,台北市民生東路三段一二八號十二樓,以文教活動為宗旨。,由林文雄等九人及維舜股份有限公司共同捐助,教育部八十一年九月八日　台（八一）社字第四九九九四號函,永久,12088038.00,1,1100111,1100217,1100119,,捐助章程第5條至第16條經臺灣臺北地方法院109年度法字第1194號民事裁定准予補充變更。捐助章程第1條至第4條經董事會決議通過變更，報經主管機關許可變更。,,,,
110法登他000038,1,2,楊志純,2481,1100107,1100108,1100108,97冊73頁,2,7,殷允芃,財團法人天下雜誌教育基金會,0910603,台北市中山區南京東路2段139號11樓,以「積極、前瞻、放眼天下」為核心理念，推動追求美好而公平的社會旨志，以臺北市為中心並擴及全臺，整合社會教育資源，透過跨平台、跨產業、跨區域的多元化活動，營造與世界同步的全民學習社會，培養具國際視野與胸襟的下一代為宗旨。,由天下雜誌股份有限公司捐助,臺北市政府教育局中華民國九十一年五月十五日北市教六字第０九一三三四二四六００號函,永久,5000000.00,1,1100108,1100219,1100115,,董事印鑑。,,,,
110法登他000039,2,2,楊志純,152,1100108,1100111,1100111,6冊21頁,1,16,張耕宇,社團法人台灣錄音著作權人協會,0781116,台北市松山區八德路4段83號3樓,以保障錄音著作權人權益，調和社會公共利益，促進國家文化發展及推廣國際文化交流為宗旨。,會員繳納之會費及捐贈,"內政部七十八年十月十二日  台(78)內社字第七四五七０四號函",永久,750000.00,1,1100111,1100217,1100119,,章程第36條第1項經會員大會決議通過變更，報經主管機關准予備查。,,,,
110法登他000040,1,2,楊志純,2974,1100108,1100108,1100108,122冊49頁,1,2,許金川,醫療財團法人好心肝基金會,1011212,台北市中正區公園路30號2樓之2,為從事醫療事業辦理醫療機構，提供肝病及其他疾病病人醫療照護之目的。,"由英屬威京群島的CYBER PROFIT INVESTMENTS LIMITED公司、何曉亮先生、佳騰工業股份有限公司等共同捐助",行政院衛生署中華民國101年12月7日衛署醫字第1010025890號函,永久,871660759.00,1,1100108,1100219,1100115,,,,,,
110法登他000041,1,2,楊志純,1985,1100108,1100111,1100111,77冊64頁,1,8,辜寬敏,財團法人新台灣和平基金會,0860212,台北市中山區松江路266號3樓,以宣揚和平福祉理念，促進社會和諧為宗旨。,由葉博文、辜寬敏、駱錦明、高志明、許章賢先生等共同捐助。,"台北市政府教育局　八十六年二月四日  北市教四字第八六二０六九五０００號函",永久,5000000.00,1,1100111,1100217,1100119,,捐助章程第1條、第2條、第5條至第15條經臺灣臺北地方法院109年度法字第1229號民事裁定准予變更。,,,,
110法登他000042,2,2,楊志純,3281,1100108,1100111,1100111,154冊65頁,1,1,郭子瑛,社團法人國際基督教合盼協會,1080111,台北市大安區光復南路72巷71號,藉由不同的方式和活動傳揚基督教教義，並以行動去勸化世人，為本會的宗旨。,入會費、常年會費、事業費、會員捐款、委託收益、基金及其孳息、其他收入,內政部中華民國107年12月11日台內團字第1070082042號函,永久,30000.00,1,1100111,1100227,1100118,,理、監事印鑑。,,,,
110法登他000043,1,2,楊志純,2379,1100108,1100113,1100113,92冊65頁,1,5,陳俊義,財團法人中華長照暨偏鄉醫療基金會,0891222,台北市中山區松江路3號7樓之5,以提高全民健康、促進偏鄉醫療及老年長期照顧體系健全，並進行相關研究發展及教育人才培訓、宣導推廣及經營，並與國際間相關機構進行交流為宗旨。,由陳清寶等個人暨社會團體共同捐助,行政院衛生署中華民國八十九年十二月十九日衛署醫字第０八九００三六一一０號函,永久,10000000.00,1,1100113,1100217,1100121,,捐助章程第5條至第8條、第10條至第13條、第15條、第18條至第22條經臺灣臺北地方法院109年度法字第1205號民事裁定准予變更。捐助章程第1條、第2條、第3條、第16條、第23條、第24條經董事會決議通過變更，報經主管機關許可變更。,,,,
110法登他000044,1,2,楊志純,3211,1100108,1100309,1100309,134冊37頁,1,,詹雙發,財團法人金星建設文化藝術基金會,1080131,台北市松山區復興北路369號4樓,以薪傳永續深耕臺北市文化與藝術教育為宗旨。,由詹雙發捐助,臺北市政府文化局中華民國108年1月24日北市文化文創字第1083001294號函,永久,5000000.00,1,1100309,1100415,1100317,,原捐助章程第1條、第3條至第8條、第10條至第18條修正、刪除第19條並經本院110年度法字第46號民事裁定准予變更。,,,,
